{"title": "Alltagstipps", "author": null, "url": "https://cara.care/de/ernaehrung/tipps/", "hostname": "cara.care", "description": "Alltagstipps", "sitename": "Cara by HiDoc Technologies", "date": "2009-01-01", "id": null, "license": null, "body": null, "comments": "", "commentsbody": null, "raw_text": null, "text": "Eine gesunde\n[Darmflora](https://cara.care/de/ernaehrung/tipps/darmflora-schuetzen/) spielt eine entscheidende Rolle f\u00fcr das Wohlbefinden. Sie wird auch Intestinalflora oder intestinales Mikrobiom genannt und beschreibt die Gesamtheit der Mikroben (Mikroorganismen), die den Darm besiedeln. Sie tr\u00e4gt dazu bei, dass die Abwehrfunktion des K\u00f6rpers gegen\u00fcber Krankheiten und sch\u00e4dlichen Einfl\u00fcssen reibungslos funktioniert. Ver\u00e4nderungen in ihrer Zusammensetzung oder Anzahl k\u00f6nnen wiederum zu verschiedenen Symptomen f\u00fchren. Dieser Artikel pr\u00e4sentiert hilfreiche Ratschl\u00e4ge zur F\u00f6rderung der Darmgesundheit und zum Aufbau einer nat\u00fcrlichen Darmflora. [Lade dir unsere kostenlose Darmgesundheits-App herunter und fange an deine Symptome zu bek\u00e4mpfen](https://cara.app.link/61p9Ah24a4).\nWelche Tipps helfen f\u00fcr eine gute Darmgesundheit?\nEin gesunder Darm ist von verschiedenen Faktoren abh\u00e4ngig. Unverzichtbar ist diesbez\u00fcglich ein bewusster Lebensstil, der die Darmflora gezielt unterst\u00fctzt. Neben einer ballaststoffreichen Ern\u00e4hrung und ausreichend Bewegung kann die Verdauungsfunktion auch beispielsweise von regelm\u00e4\u00dfiger Entspannung und Massagen profitieren. Gleiches gilt f\u00fcr die Anwendung pflanzlicher Wirkstoffe und die regelm\u00e4\u00dfige Einnahme von\n[Probiotika](https://cara.care/de/ernaehrung/lebensmittel/probiotika-wirkung/) [1](#fn-1), [2](#fn-2).\nWas bewirkt eine ballaststoffreiche Ern\u00e4hrung?\nEine ballaststoffreiche Ern\u00e4hrung f\u00f6rdert die Verdauungsfunktion. Ballaststoffe erh\u00f6hen das Stuhlvolumen aufgrund ihres Quellverm\u00f6gens. Dadurch wird die Beweglichkeit (Motilit\u00e4t) des Darms stimuliert. Eine ballaststoffreiche Ern\u00e4hrung gilt daher auch als vorbeugender Faktor gegen\u00fcber\n[Verstopfung](https://cara.care/de/erkrankungen/symptome/verstopfung/) (Obstipation). Zus\u00e4tzlich scheint das Risiko von [Darmkrebs](https://cara.care/de/erkrankungen/unterbauch/darmkrebs/) und Divertikulose (Ausst\u00fclpungen des Dickdarms) bei einer hohen Ballaststoffzufuhr reduziert zu sein [3](#fn-3). Eine Vermutung, warum das Darmkrebsrisiko durch die ballaststoffreiche Ern\u00e4hrung niedriger sein soll, ist, dass der Kontakt zwischen krebserregenden Stoffen und der Darmwand durch Ballaststoffe vermindert wird. [4](#fn-4)\nWelche Lebensmittel sind ballaststoffreich?\nUm die Darmfunktion zu unterst\u00fctzen, ben\u00f6tigt der K\u00f6rper mindestens 30 Gramm Ballaststoffe pro Tag. Wichtig ist, zus\u00e4tzlich ausreichend Fl\u00fcssigkeit aufzunehmen, damit die\n[Ballaststoffe](https://cara.care/de/ernaehrung/lebensmittel/ballaststoffe/) ihr volles Quellverm\u00f6gen entfalten k\u00f6nnen.\nZu ballaststoffreiche Lebensmittel z\u00e4hlen insbesondere:\n- Vollkorngetreide (zum Beispiel Brot, Reis, Kleie und Haferflocken)\n- Gem\u00fcse und Salat (zum Beispiel M\u00f6hren, Kohl und Rucola)\n- Obst (zum Beispiel \u00c4pfel, Heidelbeeren, Himbeeren)\n- H\u00fclsenfr\u00fcchte (zum Beispiel Bohnen, Erbsen und Linsen)\n- Samen (zum Beispiel Leinsamen und Flohsamen)\n- Pseudogetreide (Amaranth, Buchweizen und Quinoa)\n- N\u00fcsse und Mandeln\nFlohsamen sind besonders ballaststoffreich und haben ein hohes Quellverm\u00f6gen. In einer Studie f\u00fchrte die t\u00e4gliche Gabe von 3,6 Gramm Flohsamenschalen zu einer signifikanten Besserung einer chronischen Verstopfung bei 82,3 Prozent der Probanden\n[5](#fn-5).\nBei Durchfall bindet wiederum das Pektin eines (idealerweise geriebenen) Apfels oder von Flohsamen die \u00fcbersch\u00fcssige Fl\u00fcssigkeit im Darm und lindert so die Beschwerden. Im Laborversuch wurde zus\u00e4tzlich beobachtet, dass die in \u00c4pfeln enthaltenen Oligosaccharide (Kohlenhydrate) menschliche Darmkrebszellen hemmen k\u00f6nnen.\n[6](#fn-6)\nEine ausreichende Aufnahme von Ballaststoffen geh\u00f6rt demnach zu den wichtigsten Darm-Gesundheitstipps. Bei der Einnahme von Flohsamen ist es jedoch wichtig, die angegebenen Mengenvorgaben einzuhalten und genug zu trinken. Denn wer zu wenig trinkt oder zu viel von den Flohsamen auf einmal zu sich nimmt, kann im schlimmsten Falle dadurch sogar einen Darmverschluss riskieren.\nWarum unterst\u00fctzen Probiotika eine gesunde Darmflora?\nProbiotika enthalten Bakterien, die sich im Darm ansiedeln und dort zum Beispiel die Abwehrfunktion unterst\u00fctzen k\u00f6nnen. Eine Dysbiose (gest\u00f6rte Darmflora aufgrund eines Ungleichgewichts der besiedelnden Mikroorganismen) findet sich h\u00e4ufig bei Patienten mit\n[7](#fn-7): [Reizdarm-Syndrom](https://cara.care/de/erkrankungen/reizdarm/)\u2013 sie kann Beschwerden wie Bl\u00e4hungen oder Durchfall ausl\u00f6sen\n- chronisch-entz\u00fcndliche Darmerkrankungen\n- \u00dcbergewicht\n- Diabetes Mellitus\nUm das Gleichgewicht der Darmflora wieder herzustellen, eignen sich probiotische Kulturen wie Laktobazillen oder Bifidobakterien. Solche Bakterien sind in vielen Lebensmitteln nat\u00fcrlicherweise enthalten. In Absprache mit einem Arzt kann auch eine unterst\u00fctzende Einnahme von probiotischen Nahrungserg\u00e4nzungsmitteln sinnvoll sein.\n[\nSchr\u00e4nken Reizdarmbeschwerden deinen Alltag sp\u00fcrbar ein? Finde heraus, wie du deine Symptome und Lebensqualit\u00e4t signifikant verbessern kannst!\nMEHR ERFAHREN\n](https://cara.care/de/?utm_campaign=organic_23&utm_source=organic&utm_medium=sidebanner3&utm_term=desktop)\nWelche Lebensmittel enthalten probiotische Kulturen?\nEinige Milchprodukte, Getr\u00e4nke und Gem\u00fcse liefern nat\u00fcrliche Probiotika. Wichtig ist, regelm\u00e4\u00dfig kleine Mengen aufzunehmen, damit die Verdauung und der Immunschutz effektiv profitieren k\u00f6nnen.\nProbiotische Lebensmittel sind beispielsweise:\n- milchsauer vergorenes Gem\u00fcse (zum Beispiel saure Gurken)\n- Naturjoghurt\n- unerhitztes Sauerkraut\n- Brottrunk\n- Buttermilch und Kefir\nDie gleichzeitige Zufuhr von Pr\u00e4biotika (unverdauliche Ballaststoffe) \u2013 Inulin zum Beispiel \u2013 geh\u00f6rt zu den weiteren Alltagstipps f\u00fcr die Darmgesundheit. Pr\u00e4biotika k\u00f6nnen zur Verbesserung der Wirkung probiotischer Kulturen beitragen.\n[8](#fn-8) Diese unter anderem in Getreide, Knoblauch, Spargel, Chicor\u00e9e und Schwarzwurzeln enthaltenen Wirkstoffe dienen den Darmbakterien als Nahrungsgrundlage.\nWarum ben\u00f6tigt der Darm ausreichend Fl\u00fcssigkeit?\nF\u00fcr eine verbesserte Quellkraft der Ballaststoffe aus Vollkorngetreide und Co. ist eine ausreichende Fl\u00fcssigkeitszufuhr \u2013 am besten in Form von Wasser oder unges\u00fc\u00dften Kr\u00e4uter- oder Fr\u00fcchtetees \u2013 wichtig. Das Trinken von warmem Wasser auf n\u00fcchternen Magen kann die Verdauungsfunktion am Morgen aktivieren.\nGibt es spezielle Di\u00e4ten f\u00fcr einen gesunden Darm?\nBeim Reizdarm-Syndrom kann die\n[low-FODMAP-Di\u00e4t](https://cara.care/de/ernaehrung/diaeten/low-fodmap/) helfen. Die englische Abk\u00fcrzung FODMAP steht f\u00fcr \u201efermentable oligo-, di-, monosaccharides and polyols\u201d \u2013 zu Deutsch etwa verg\u00e4rbare Mehrfach-, Zweifach-, Einfachzucker und mehrwertige Alkohole.\nIm Mittelpunkt dieser Ern\u00e4hrung steht der Verzicht beziehungsweise die Reduktion von kurzkettigen Kohlenhydratverbindungen. Diesbez\u00fcglich sind Fruchtzucker, Milchzucker und Maltodextrin sowie die S\u00fc\u00dfstoffe Maltit, Xylit und Sorbit zu nennen. Nach vor\u00fcbergehendem Verzicht auf die entsprechenden Lebensmittel kann getestet werden, ob einzelne Produkte wieder besser vertr\u00e4glich sind.\n[9](#fn-9)\nDas Vermeiden von FODMAPs kann jedoch einen verminderten Verzehr von Ballaststoffen zur Folge haben.\nWichtig\nNahrungsmittel, die FODMAPs enthalten, sind nicht per se \u201eungesund\u201d oder sch\u00e4dlich. W\u00e4hrend des Verdauungsvorgangs k\u00f6nnen sie jedoch Gase produzieren, was zu Bl\u00e4hungen, Durchf\u00e4llen und Schmerzen f\u00fchren kann.\nKann Bewegung die Verdauungsfunktion f\u00f6rdern?\nEin aktiver Lebensstil \u2013 zum Beispiel 30 Minuten Ausdauertraining pro Tag \u2013 wirken sich positiv auf die Darmflora aus. Eine kleine Studie zeigte, dass die Darmbesiedlung von Sportlern nicht nur vielschichtiger ist, sondern mehr schlankmachende Mikroorganismen enth\u00e4lt.\n[10](#fn-10) Zus\u00e4tzlich wird die Mobilit\u00e4t des Magen-Darm-Traktes erh\u00f6ht. Dadurch gilt ein aktiver Lebensstil als pr\u00e4ventiver Faktor gegen\u00fcber Verstopfung.\nWie funktionieren verdauungsf\u00f6rdernde Massagen?\nBauchmassagen k\u00f6nnen die Darmbewegung gezielt unterst\u00fctzen. Eine Studie kam zu dem Ergebnis, dass eine t\u00e4gliche Bauchmassage von 15 Minuten \u00fcber zwei Monate, die Darmfunktion bei Verstopfung deutlich verbessert. Die Massage wird \u00fcber knetende, kreisende oder streichende Bewegungen um den Bauchnabel im Uhrzeigersinn ausgef\u00fchrt.\n[11](#fn-11)\nWelche pflanzlichen Mittel verbessern die Darmfunktion?\nFunktionelle Beschwerden sind Symptome, die nicht auf eine Organsch\u00e4digung zur\u00fcckzuf\u00fchren sind. Funktionelle Darmbeschwerden sprechen teilweise auf pflanzliche Wirkstoffe (Phytotherapeutika) an. Studien belegen diesbez\u00fcglich den Nutzen einiger Phytotherapeutika. Bei krampfartigen Bauchschmerzen und Bl\u00e4hungen eignen sich unter anderem Kr\u00e4uterteemischungen aus Kamille, Fenchel, Pfefferminze und K\u00fcmmel. Zus\u00e4tzlich k\u00f6nnen feucht-warme Auflagen und Wickel mit K\u00fcmmel\u00f6l akute Verdauungsbeschwerden wie Bauchkr\u00e4mpfe und Bl\u00e4hungen lindern.\nMerke\nPhytotherapie als Alltagstipp bei Darmbeschwerden:\n[12](#fn-12), [13](#fn-13), [14](#fn-14)\n- Kamillenbl\u00fcten\n[Pfefferminze](https://cara.care/de/erkrankungen/reizdarm/pfefferminzoel/)\n- Fenchel\n- K\u00fcmmel\n- Salbei\nHilft Entspannung bei Verdauungsproblemen?\nDie Darmgesundheit und psychologische Faktoren sind eng miteinander verkn\u00fcpft. Studien belegen einen Zusammenhang zwischen dem Reizdarm-Syndrom und psychischen Belastungen. Um den Stresspegel zu reduzieren und Stresshormone abzubauen, eignen sich Entspannungsverfahren wie zum Beispiel autogenes Training, Meditation, Qigong oder Yoga. Studienergebnisse zeigen, dass sich eine Hypnotherapie ebenfalls positiv auf die Lebensqualit\u00e4t von Reizdarm-Patienten auswirken kann.\n[15](#fn-15), [16](#fn-16), [17](#fn-17)\nWelche Faktoren sch\u00e4digen wiederum die Darmflora?\nEin hoher Fleischkonsum erh\u00f6ht das Risiko, an Darmkrebs oder Divertikulitis (entz\u00fcndete Ausst\u00fclpungen des Dickdarms) zu erkranken. In einer Langzeitstudie wurde beobachtet, dass rotes Fleisch das Risiko f\u00fcr Darmkrebs um 49 Prozent erh\u00f6ht. Insbesondere gep\u00f6kelte und ger\u00e4ucherte Fleisch- und Wurstwaren gelten als kritisch\n[18](#fn-18), [19](#fn-19). Auch Antibiotika k\u00f6nnen negative Auswirkungen auf die Darmflora haben. Alkohol reduziert wiederum die Verdauungsfunktion und kann zur Sch\u00e4digung der Darm-Zellen und somit auch der Schleimhautbarriere f\u00fchren. Alkohol wirkt sich nicht nur auf den Magen-Darm-Trakt negativ aus, sondern beispielsweise auch auf die Leber und das Nervensystem. [20](#fn-20)\n-\nButel MJ. Probiotics, gut microbiota and health. Med Mal Infect. 2014;44(1):1\u20138. doi:10.1016/j.medmal.2013.10.002\n[\u21a9](#fnref-2)\n-\nMurphy N, Norat T, Ferrari P, et al. Dietary fibre intake and risks of cancers of the colon and rectum in the European prospective investigation into cancer and nutrition (EPIC). PLoS One. 2012;7(6):e39361. doi:10.1371/journal.pone.0039361\n[\u21a9](#fnref-3)\n-\nLattimer JM, Haub MD. Effects of dietary fiber and its components on metabolic health. Nutrients. 2010;2(12):1266\u20131289. doi:10.3390/nu2121266\n[\u21a9](#fnref-4)\n-\nPucciani F, Raggioli M, Ringressi MN. Usefulness of psyllium in rehabilitation of obstructed defecation. Tech Coloproctol. 2011;15(4):377\u2013383. doi:10.1007/s10151-011-0722-4\n[\u21a9](#fnref-5)\n-\nHyson DA. A comprehensive review of apples and apple components and their relationship to human health. Adv Nutr. 2011;2(5):408\u2013420. doi:10.3945/an.111.000513\n[\u21a9](#fnref-6)\n-\nCas\u00e9n C, Veb\u00f8 HC, Sekelja M, et al. Deviations in human gut microbiota: a novel diagnostic test for determining dysbiosis in patients with IBS or IBD. Aliment Pharmacol Ther. 2015;42(1):71\u201383. doi:10.1111/apt.13236\n[\u21a9](#fnref-7)\n-\nMarkowiak P, \u015ali\u017cewska K. Effects of Probiotics, Prebiotics, and Synbiotics on Human Health. Nutrients. 2017;9(9):1021. Published 2017 Sep 15. doi:10.3390/nu9091021\n[\u21a9](#fnref-8)\n-\nShepherd SJ, Halmos E, Glance S. The role of FODMAPs in irritable bowel syndrome. Curr Opin Clin Nutr Metab Care. 2014;17(6):605\u2013609. doi:10.1097/MCO.0000000000000116\n[\u21a9](#fnref-9)\n-\nClarke SF, Murphy EF, O'Sullivan O, et al. Exercise and associated dietary extremes impact on gut microbial diversity. Gut. 2014;63(12):1913\u20131920. doi:10.1136/gutjnl-2013-306541\n[\u21a9](#fnref-10)\n-\nL\u00e4m\u00e5s K, Lindholm L, Stenlund H, Engstr\u00f6m B, Jacobsson C. Effects of abdominal massage in management of constipation--a randomized controlled trial. Int J Nurs Stud. 2009;46(6):759\u2013767. doi:10.1016/j.ijnurstu.2009.01.007\n[\u21a9](#fnref-11)\n-\nLiu JP, Yang M, Liu YX, Wei M, Grimsgaard S. Herbal medicines for treatment of irritable bowel syndrome. Cochrane Database Syst Rev. 2006;(1):CD004116. Published 2006 Jan 25. doi:10.1002/14651858.CD004116.pub2\n[\u21a9](#fnref-12)\n-\nBahrami HR, Hamedi S, Salari R, Noras M. Herbal Medicines for the Management of Irritable Bowel Syndrome: A Systematic Review. Electron Physician. 2016;8(8):2719\u20132725. Published 2016 Aug 25. doi:10.19082/2719\n[\u21a9](#fnref-13)\n-\nLauche R, Janzen A, L\u00fcdtke R, Cramer H, Dobos G, Langhorst J. Efficacy of Caraway Oil Poultices in Treating Irritable Bowel Syndrome--A Randomized Controlled Cross-Over Trial. Digestion. 2015;92(1):22\u201331. doi:10.1159/000398790\n[\u21a9](#fnref-14)\n-\nLindfors P, Unge P, Nyhlin H, et al. Long-term effects of hypnotherapy in patients with refractory irritable bowel syndrome. Scand J Gastroenterol. 2012;47(4):414\u2013420. doi:10.3109/00365521.2012.658858\n[\u21a9](#fnref-15)\n-\nLindfors P, Unge P, Arvidsson P, et al. Effects of gut-directed hypnotherapy on IBS in different clinical settings-results from two randomized, controlled trials. Am J Gastroenterol. 2012;107(2):276\u2013285. doi:10.1038/ajg.2011.340\n[\u21a9](#fnref-16)\n-\nL\u00f6we B, Lohse A, Andresen V, Vettorazzi E, Rose M, Broicher W. The Development of Irritable Bowel Syndrome: A Prospective Community-Based Cohort Study. Am J Gastroenterol. 2016;111(9):1320\u20131329. doi:10.1038/ajg.2016.255\n[\u21a9](#fnref-17)\n-\nKappeler R, Eichholzer M, Rohrmann S. Meat consumption and diet quality and mortality in NHANES III. Eur J Clin Nutr. 2013;67(6):598\u2013606. doi:10.1038/ejcn.2013.59\n[\u21a9](#fnref-18)\n-\nCao Y, Strate LL, Keeley BR, et al. Meat intake and risk of diverticulitis among men. Gut. 2018;67(3):466\u2013472. doi:10.1136/gutjnl-2016-313082\n[\u21a9](#fnref-19)\n-\nRocco A, Compare D, Angrisani D, Sanduzzi Zamparelli M, Nardone G. Alcoholic disease: liver and beyond. World J Gastroenterol. 2014;20(40):14652\u201314659. doi:10.3748/wjg.v20.i40.14652\n[\u21a9](#fnref-20)", "language": null, "image": "https://cara.care/og_de.jpg", "pagetype": "website", "links": ["/de/", "/de/reizdarm", "/de/doctors", "/de/erkrankungen", "/de/selbsttest", "/de/diagnose", "/de/behandlung", "/de/ernaehrung", "/de/magazin", "/de/about", "/de/science", "https://apply.workable.com/cara-care/", "/de/press", "https://cara-care.zammad.com/help/de-de/10-sonstiges/119-an-wen-kannst-du-dich-bei-fragen-wenden", "https://survey.cara.care/to/bpuzKchE#src=xxxxx&clid=xxxxx&hubspot_utk=xxxxx&hubspot_page_name=xxxxx&hubspot_page_url=xxxxx", "/de/ernaehrung/", "https://cara.care/de/ernaehrung/tipps/darmflora-schuetzen/", "https://cara.app.link/61p9Ah24a4", "https://cara.care/de/ernaehrung/lebensmittel/probiotika-wirkung/", "#fn-1", "#fn-2", "https://cara.care/de/erkrankungen/symptome/verstopfung/", "https://cara.care/de/erkrankungen/unterbauch/darmkrebs/", "#fn-3", "#fn-4", "https://cara.care/de/ernaehrung/lebensmittel/ballaststoffe/", "#fn-5", "#fn-6", "#fn-7", "https://cara.care/de/erkrankungen/reizdarm/", "https://cara.care/de/?utm_campaign=organic_23&utm_source=organic&utm_medium=sidebanner3&utm_term=desktop", "#fn-8", "https://cara.care/de/ernaehrung/diaeten/low-fodmap/", "#fn-9", "#fn-10", "#fn-11", "#fn-12", "#fn-13", "#fn-14", "https://cara.care/de/erkrankungen/reizdarm/pfefferminzoel/", "#fn-15", "#fn-16", "#fn-17", "#fn-18", "#fn-19", "#fn-20", "#fn-1", "#fnref-2", "#fnref-3", "#fnref-4", "#fnref-5", "#fnref-6", "#fnref-7", "#fnref-8", "#fnref-9", "#fnref-10", "#fnref-11", "#fnref-12", "#fnref-13", "#fnref-14", "#fnref-15", "#fnref-16", "#fnref-17", "#fnref-18", "#fnref-19", "#fnref-20", "/de/ernaehrung/tipps/hausmittel-gegen-sodbrennen/", "/de/ernaehrung/tipps/darmflora-schuetzen/", "https://cara.care/de/?utm_campaign=organic_23&utm_source=organic&utm_medium=sidebanner1&utm_term=desktop", "https://cara.care/de/?utm_campaign=organic_23&utm_source=organic&utm_medium=sidebanner2&utm_term=desktop", "/de/", "/de/about", "https://apply.workable.com/cara-care/", "/de/press", "/de/news", "https://cara-care.zammad.com/help/de-de/10-sonstiges/119-an-wen-kannst-du-dich-bei-fragen-wenden", "/de/zweckbestimmung/", "https://cara.care/de/gebrauchsanweisung/", "https://cara.care/de/kompatibilitaet/", "https://assets.ctfassets.net/pmt5vquvp72j/6kZ95Hg1KNoJbkLwQiyX96/bbfbf9f2a0f2f58d48fd11320093b8f1/Informationen_zur_Leistungsbeschreibung_1.3.pdf", "https://cara-care.zammad.com/help/de-de", "/de/privacy/", "/de/terms-of-use", "/de/impressum/", "/de/privacy/", "/de/terms-of-use", "/de/impressum/"]}