{"title": "Schlaganfallrehabilitation: Behandlung der Folgeerscheinungen", "author": "Flint Rehab", "url": "https://www.flintrehab.com/de/schlaganfall-behandlung/", "hostname": "flintrehab.com", "description": "Woher wissen Sie angesichts all der verf\u00fcgbaren Behandlungsoptionen zur Schlaganfallrehabilitation, welche am besten f\u00fcr Sie geeignet ist? Da jeder Schlaganfall anders ist, reagiert jede Person auf jede Modalit\u00e4t anders. Daher ist es wichtig, dass Sie mit Ihrem Reha-Team zusammenzuarbeiten, um einen umfassenden Behandlungsplan zu erstellen, der Ihren Bed\u00fcrfnissen entspricht. Um Ihnen eine fundierte Diskussion mit \u2026 Schlaganfallrehabilitation: Die besten Methoden zur Behandlung der Folgeerscheinungen Weiterlesen \u00bb", "sitename": "Flint Rehab", "date": "2022-08-03", "id": null, "license": null, "body": null, "comments": "", "commentsbody": null, "raw_text": null, "text": "Woher wissen Sie angesichts all der verf\u00fcgbaren Behandlungsoptionen zur Schlaganfallrehabilitation, welche am besten f\u00fcr Sie geeignet ist? Da jeder Schlaganfall anders ist, reagiert jede Person auf jede Modalit\u00e4t anders. Daher ist es wichtig, dass Sie mit Ihrem Reha-Team zusammenzuarbeiten, um einen umfassenden Behandlungsplan zu erstellen, der Ihren Bed\u00fcrfnissen entspricht.\nUm Ihnen eine fundierte Diskussion mit Ihren Therapeuten zu erm\u00f6glichen, bietet dieser Leitfaden eine umfassende Liste an Methoden zur Schlaganfallrehabilitation, mit der Sie die besten Behandlungen f\u00fcr Ihre Bed\u00fcrfnisse finden k\u00f6nnen.\nInhaltsverzeichnis:\n[Die beste Behandlung zur Schlaganfallrehabilitation](#1) [Methoden zur Wiederherstellung der Bewegungsfunktion](#2) [Modalit\u00e4ten zur kognitiven Rehabilitation](#3)\nWas ist die beste Behandlung zur Schlaganfallrehabilitation?\nFalls Sie nach der besten Behandlung zur Schlaganfallrehabilitation suchen, so lautet die Antwort: Die beste Behandlung variiert von Person zu Person.\n[Jeder Schlaganfall ist anders](https://translate.google.com/translate?hl=&sl=en&tl=de&u=https://www.flintrehab.com/every-stroke-is-different/), und jeder Patient wird verschiedene sekund\u00e4re Folgeerscheinungen haben. Einige Patienten leiden beispielsweise an St\u00f6rungen ihrer Arm- und Beinbeweglichkeit, w\u00e4hrend andere eine gest\u00f6rte Sprach- und Sprechfunktion aufweisen. Daher wird die beste Behandlung zur Schlaganfallrehabilitation aufgrund individueller Beeintr\u00e4chtigungen und betroffener Funktionen von Person zu Person variieren.\nAnstatt sich zu fragen, was die beste Behandlung zur Schlaganfallrehabilitation ist, sollten Sie versuchen, sich verschiedene Fragen zu stellen, wie z. B.:\n- Welche sekund\u00e4ren\n[Folgeerscheinungen](https://www.flintrehab.com/de/schlaganfall-folgen/)habe ich nach meinem Schlaganfall?\n- Welche Therapien habe ich bereits erhalten, und was hat mir am meisten gen\u00fctzt?\n- Welche Rehabilitationsmethoden werde ich regelm\u00e4\u00dfig anwenden k\u00f6nnen?\nDiese Fragen werden Sie zu den f\u00fcr Sie besten Behandlungsmethoden zur Schlaganfallrehabilitation f\u00fchren.\nDie Wahl zwischen den verf\u00fcgbaren Behandlungsmodalit\u00e4ten kann jedoch eine Herausforderung darstellen. Der Rest dieses Leitfadens wird Ihnen erkl\u00e4ren, welche Rehabilitationsmethoden zur Verf\u00fcgung stehen, damit Sie sehen k\u00f6nnen, was Ihnen hinsichtlich Ihrer individuellen Ziele helfen kann.\nBeginnen wir mit den aktuellen Behandlungen zur Schlaganfallrehabilitation:\nMethoden zur Schlaganfallrehabilitation\nHier ist ein \u00dcberblick \u00fcber einige beliebte und effektive Behandlungsmethoden zur Schlaganfallrehabilitation, die helfen k\u00f6nnen, die Erholung der Bewegungsfunktionen nach einem Schlaganfall zu maximieren. Im Anschluss an diesen Abschnitt werden wir die kognitive Rehabilitation besprechen.\nRehabilitations\u00fcbungen\n[Bewegungs\u00fcbungen f\u00fcr Schlaganfallpatienten](https://www.flintrehab.com/de/ubungen-nach-schlaganfall/) sind das A und O der Rehabilitation. W\u00e4hrend der station\u00e4ren Rehabilitation arbeiten die Patienten mit ihren Therapeuten zusammen, um ein [intensives Training](https://translate.google.com/translate?hl=&sl=en&tl=de&u=https://www.flintrehab.com/massed-practice/) verschiedener physio- und ergotherapeutischer \u00dcbungen durchzuf\u00fchren.\nNach der Entlassung aus der station\u00e4ren Reha haben die Patienten w\u00e4hrend der ambulanten Reha oft einmal pro Woche einen Therapeutentermin. Ihnen werden oft schriftlichen \u00dcbungsbl\u00e4tter gegeben, um zwischen den Sitzungen zu Hause zu \u00fcben.\nStudien zeigen jedoch, dass diese \u00dcbungsbl\u00e4tter eine\n[schlechte Rate der Therapietreue](https://translate.google.com/translate?hl=&sl=en&tl=de&u=https://pubmed.ncbi.nlm.nih.gov/21642065/) haben, was darauf hindeutet, dass andere ansprechendere Behandlungen zur Schlaganfallrehabilitation dazu beitragen k\u00f6nnen, die Einhaltung eines h\u00e4uslichen Reha-Programms zu verbessern.\nPassive Rehabilitations\u00fcbungen\nF\u00fcr Menschen mit einer Hemiplegie sind\n[passive Bewegungen](https://www.flintrehab.com/de/aktive-vs-passive-ubungen-wahrend-der-rehabilitation/) eine gro\u00dfartige Behandlung zur Schlaganfallrehabilitation. Es handelt sich um Bewegungen, die nicht durch Ihre Muskeln initiiert werden. Stattdessen bewegt ein Therapeut oder eine geschulte Betreuungsperson Ihre Gliedma\u00dfen f\u00fcr Sie, oder Sie k\u00f6nnen Ihre nicht betroffene Seite zur Unterst\u00fctzung Ihrer betroffenen Seite verwenden.\nDiese Rehabilitationsmethode ist besonders hilfreich bei einer Hemiplegie, da sie die betroffenen Gliedma\u00dfen in Bewegung bringt und den erlernten\n[Nichtgebrauch](https://translate.google.com/translate?hl=&sl=en&tl=de&u=https://www.flintrehab.com/learned-nonuse-stroke/) verhindert \u2013 eine Erkrankung, die auftritt, wenn sich die Beweglichkeit aufgrund einer Vernachl\u00e4ssigung weiter verschlechtert. Das Beste ist, dass die passiven \u00dcbungen, obwohl Sie die Bewegung nicht selbst initiieren, dennoch [die Teile des Gehirns stimulieren, die an der Muskelbewegung beteiligt sind](https://translate.google.com/translate?hl=&sl=en&tl=de&u=https://www.ncbi.nlm.nih.gov/pmc/articles/PMC6336439/).\nMit anderen Worten: Selbst, wenn Sie die Bewegung nicht selbst initiieren, helfen die passiven Bewegungen, das Gehirn neu zu vernetzen und die Erholung der Bewegungsfunktion zu f\u00f6rdern.\nH\u00e4usliche Neurorehabilitationsger\u00e4te\nWenn Sie nach einer M\u00f6glichkeit suchen, f\u00fcr Ihre Heimtherapie motiviert zu bleiben, verf\u00fcgt Flint Rehab \u00fcber zwei gamifizierte\n[Neurorehabilitationsger\u00e4te](https://translate.google.com/translate?hl=&sl=en&tl=de&u=https://www.flintrehab.com/magnetic-brain-stimulation-stroke/), die die Wiederherstellung der Bewegungsfunktionen nach einem Schlaganfall unterst\u00fctzen.\nDer erste Ger\u00e4t ist der\n[MusicGlove](https://www.flintrehab.com/de/product/musicglove-handtherapie/), ein Musik-basierter, sensorischer Handschuh, der Ihnen hilft, Ihre betroffene Hand zu trainieren. Eine [randomisierte kontrollierte Studie](https://translate.google.com/translate?hl=&sl=en&tl=de&u=https://jneuroengrehab.biomedcentral.com/articles/10.1186/1743-0003-11-76) hat gezeigt, dass der MusicGlove bei konsequenter Anwendung die Handfunktion innerhalb von nur 2 Wochen verbessert.\nDas zweite Neurorehabilitationsger\u00e4t ist das\n[FitMi](https://www.flintrehab.com/de/product/fitmi-heimtherapie/), das zwei bewegungsempfindliche \u201ePucks\u201c umfasst, die Ihre Bewegungen verfolgen, w\u00e4hrend Sie auf dem Bildschirm den vorgeschriebenen Rehabilitations\u00fcbungen folgen.\nObwohl randomisierte kontrollierte Studien noch\n[im Gange](https://translate.google.com/translate?hl=&sl=en&tl=de&u=https://www.nia.nih.gov/research/osbr/nia-small-business-showcase-flint-rehabilitation-devices) sind, wird das FitMi bereits in einigen der f\u00fchrenden amerikanischen Kliniken wie dem Shirley Ryan Ability Lab, dem erstrangigen Reha-Krankenhaus der USA, eingesetzt.\nDiese bewegungsempfindlichen Neurorehabilitationsger\u00e4te motivieren Sie dazu, eine hohe Wiederholungsrate Ihrer Reha-\u00dcbung zu erreichen, was dazu beitr\u00e4gt, Ihr Gehirn durch die\n[Neuroplastizit\u00e4t](https://www.flintrehab.com/de/neuroplastizitat-nach-schlaganfall/) neu zu vernetzen. Die Ger\u00e4te stellen ein hervorragendes h\u00e4usliches Therapieprogramm dar, das Sie zwischen den Besuchen mit Ihrem Therapeuten anwenden k\u00f6nnen.\nSpiegeltherapie\nDie\n[Spiegeltherapie](https://translate.google.com/translate?hl=&sl=en&tl=de&u=https://www.flintrehab.com/mirror-therapy-stroke/) ist eine vielversprechende Modalit\u00e4t f\u00fcr Schlaganfallpatienten, die an einer stark eingeschr\u00e4nkten Beweglichkeit oder sogar L\u00e4hmung ihrer betroffenen Hand leiden. Sie funktioniert, indem sie einen Tischspiegel \u00fcber Ihre betroffene Hand platzieren und mit der nicht betroffenen Hand Handtherapie-\u00dcbungen durchf\u00fchren. Die Spiegelung \u201everleitet\u201c das Gehirn dazu zu denken, dass Sie beide H\u00e4nde bewegen, was die Neuvernetzung des Gehirns unterst\u00fctzt.\nDas vielversprechendste Element der Spiegeltherapie ist, dass sie Personen\n[ohne jegliche Beweglichkeit der Hand](https://translate.google.com/translate?hl=&sl=en&tl=de&u=https://www.ncbi.nlm.nih.gov/pmc/articles/PMC7012218/) geholfen hat, ihre Beweglichkeit wiederzuerlangen. Es ist am besten, diese Rehabilitationsmodalit\u00e4t mit Ihrem Therapeuten zu beginnen, der Ihnen zeigen kann, wie sie funktioniert, und Ihnen \u00dcbungen empfehlen kann. Anschlie\u00dfend k\u00f6nnen Sie Ihren eigenen Tischspiegel kaufen, um zu Hause weiter zu \u00fcben.\nElektrostimulation\nDie\n[Elektrostimulation](https://www.flintrehab.com/de/elektrostimulation-fur-schlaganfallpatienten/) ist eine Rehabilitationsmethode, die besonders bei schweren Beweglichkeitseinschr\u00e4nkungen und sogar schlaganfallbedingten L\u00e4hmungen n\u00fctzlich ist. Sie funktioniert, indem Elektroden auf die Haut platziert und elektrische Impulse direkt an die betroffenen Muskeln gesendet werden. Dies hilft nicht nur, das Gehirn zu stimulieren, sondern es initiiert Bewegungen in den betroffenen Muskeln, was f\u00fcr Patienten mit einer L\u00e4hmung hilfreich ist.\nF\u00fcr die\n[besten Ergebnisse](https://translate.google.com/translate?hl=&sl=en&tl=de&u=https://www.ahajournals.org/doi/10.1161/STROKEAHA.107.490318) sollten Sie die Elektrostimulation mit Rehabilitations\u00fcbungen kombinieren. Dies f\u00f6rdert eine bessere Genesung der Bewegungsfunktionen als die Elektrostimulation allein.\nWenn Sie mit der Elektrostimulation beginnen, sollten Sie unter Aufsicht Ihres Therapeuten \u00fcben. Er/sie kann Ihnen zeigen, wo die Elektroden angebracht werden m\u00fcssen und wie Sie das Ger\u00e4t sicher bedienen.\n(Lesen Sie auch:\n[Die besten Reha-Ger\u00e4te f\u00fcr eine sichere h\u00e4usliche Genesung](https://www.flintrehab.com/de/hilfsmittel-fur-schlaganfallpatienten/))\nMentale \u00dcbungen\n[Mentale \u00dcbungen](https://translate.google.com/translate?hl=&sl=en&tl=de&u=https://www.flintrehab.com/mental-practice-stroke-rehabilitation/) sind eine weitere Behandlungsoption zur Schlaganfallrehabilitation, die ideal f\u00fcr Personen mit einer stark eingeschr\u00e4nkten Beweglichkeit oder L\u00e4hmung ist. Sie beinhalten, dass man sich mental vorstellt, sich zu bewegen. Sie k\u00f6nnen sich vorstellen, wie Sie Ihre Reha-\u00dcbungen oder andere Bewegungsarten durchf\u00fchren, z. B. das Gehen \u00fcber einen Rasen oder entlang eines Sandstrandes.\nStudien haben gezeigt, dass die mentalen \u00dcbungen Ver\u00e4nderungen in den Bereichen des Gehirns ausl\u00f6sen, die die Bewegungen steuern, wie etwa in den\n[motorischen und pr\u00e4motorischen Bereichen](https://translate.google.com/translate?hl=&sl=en&tl=de&u=https://www.sciencedirect.com/science/article/abs/pii/S000399930601272X). Es zeigt sich auch, dass [die Kombination](https://translate.google.com/translate?hl=&sl=en&tl=de&u=https://academic.oup.com/ptj/article/81/8/1455/2857674) von mentalen und k\u00f6rperlichen \u00dcbungen die Beweglichkeit st\u00e4rker verbessert als k\u00f6rperliche \u00dcbungen allein.\nDie mentalen \u00dcbungen sind einfach, nicht invasiv, kostenlos und f\u00fcr jeden zug\u00e4nglich. Sie sind die perfekte Erg\u00e4nzung zu jeder Schlaganfallrehabilitation, vor allem f\u00fcr sich von einer L\u00e4hmung erholende Patienten.\nKognitive Behandlungen zur Schlaganfallrehabilitation\nNeben der motorischen Genesung gibt es etliche Methoden zur Verbesserung der kognitiven F\u00e4higkeiten im Rahmen der Schlaganfallrehabilitation. Personen, die an St\u00f6rungen des Ged\u00e4chtnisses, kritischen Denkens und der Kommunikation leiden, k\u00f6nnen von kognitiven Therapien profitieren.\nHier sind einige gro\u00dfartige Rehabilitationsmethoden, die Ihre kognitive Genesung unterst\u00fctzen:\nSensorische Umschulung\nDie\n[sensorische Umschulung](https://translate.google.com/translate?hl=&sl=en&tl=de&u=https://www.flintrehab.com/sensory-reeducation-return-of-sensation-after-stroke/) ist eine Form der kognitiven Verhaltenstherapie, die die Patienten hinsichtlich einer Verbesserung ihrer Sinne unterst\u00fctzt. Dies ist hilfreich, um [sensorische Probleme zu behandeln](https://translate.google.com/translate?hl=&sl=en&tl=de&u=https://www.ncbi.nlm.nih.gov/pmc/articles/PMC3073500/), wie ein schlaganfallbedingtes Taubheitsgef\u00fchl, Kribbeln oder Schwierigkeiten mit der Wahrnehmung von Hei\u00df und Kalt.\nW\u00e4hrend dieser Therapie f\u00fchren die Patienten \u00dcbungen zur sensorischen Umschulung durch, die ihr Gehirn stimulieren und neu vernetzen. Beispielsweise kann ein Therapeut unterschiedlich beschaffene Gegenst\u00e4nde in einem Beutel mit Bohnen verstecken und den Patienten bitten, die Gegenst\u00e4nde herauszuholen. Die Stimulierung durch die verschiedenen Texturen unterst\u00fctzt die sensorische Umschulung.\nLogop\u00e4die\nDie Logop\u00e4die ist ein Bereich, der sich mit Kommunikationsst\u00f6rungen, St\u00f6rungen der kognitiven Kommunikation, Stimmst\u00f6rungen und Schluckst\u00f6rungen befasst. Ein Sprachpathologe, \u00fcblicherweise als Logop\u00e4de bezeichnet, kann hinsichtlich der Diagnose und Behandlung dieser Probleme helfen.\nEin Sprachpathologe hilft bei der Diagnose von Personen, die mit kognitiven Funktionen wie dem Ged\u00e4chtnis und Sprachverm\u00f6gen zu k\u00e4mpfen haben, und begleitet sie durch verschiedene individuelle Rehabilitations\u00fcbungen. Einige Beispiele f\u00fcr diese \u00dcbungen sind sprachtherapeutische \u00dcbungen und kognitive \u00dcbungen.\nSo wie k\u00f6rperliche Therapie\u00fcbungen zur Verbesserung der Beweglichkeit beitragen, tragen diese kognitiven Kommunikations\u00fcbungen dazu bei, die kognitiven Kommunikationsf\u00e4higkeiten zu verbessern. Es geht um ein intensives Training und eine ausreichende Wiederholungsrate zur Stimulierung des Gehirns und Aufrechterhaltung der Neuroplastizit\u00e4t.\nSehtraining\n[Mehr als die H\u00e4lfte](https://translate.google.com/translate?hl=&sl=en&tl=de&u=https://www.ncbi.nlm.nih.gov/pmc/articles/PMC5607544/) aller Schlaganfallpatienten leiden an St\u00f6rungen des Sehverm\u00f6gens \u2013 nicht zu verwechseln mit Problemen mit der Sehkraft. Die Sehkraft bezieht sich darauf, wie die Augen Bilder erfassen, w\u00e4hrend das Sehverm\u00f6gen sich darauf bezieht, wie das Gehirn diese Bilder verarbeitet.\nSie k\u00f6nnen\n[Ihr Sehverm\u00f6gen nach einem Schlaganfall verbessern](https://www.flintrehab.com/de/genesung-des-sehvermogens-nach-dem-schlaganfall/), indem Sie mit einem Spezialisten f\u00fcr Neuro-Optometrie zusammenarbeiten, der Ihren Zustand diagnostizieren und Ihnen individuelle Augen\u00fcbungen empfehlen kann. Einige \u00dcbungen beinhalten das Umtrainieren der Muskeln, die Ihre Augen kontrollieren, w\u00e4hrend andere \u00dcbungen sich auf das Umtrainieren des Gehirns zur Verarbeitung visueller Reize konzentrieren. Die Zusammenarbeit mit einem Experten ist ein Muss.\nErstellen eines Behandlungsplans zur Schlaganfallrehabilitation\nJetzt, da Sie diese Methoden zur Behandlung eines Schlaganfalls erkundet haben, ist es an der Zeit zu handeln. Welche Behandlungsmodalit\u00e4ten sind f\u00fcr Sie interessant oder motivierend? Welche Methoden k\u00f6nnen Sie regelm\u00e4\u00dfig absolvieren?\n[Wiederholung und Beharrlichkeit](https://translate.google.com/translate?hl=&sl=en&tl=de&u=https://www.flintrehab.com/repetition-vs-consistency/) sind der Schl\u00fcssel zur Genesung. Ganz gleich, f\u00fcr welche Behandlungsmodalit\u00e4ten Sie sich entscheiden, das oberste Ziel ist es, etwas zu finden, das Ihnen hilft, die ben\u00f6tigten \u00dcbungen auf eine Weise durchzuf\u00fchren, die Sie motiviert.", "language": null, "image": "https://cdn.flintrehab.com/uploads/2020/08/Schlaganfallbehandlung.jpg", "pagetype": "article", "links": [null, "#content", "https://www.flintrehab.com/de/", "https://www.flintrehab.com/de/beginnen-sie-hier/", "https://www.flintrehab.com/de/beginnen-sie-hier/", "https://www.flintrehab.com/de/ueber-uns/", "https://www.flintrehab.com/de/product/fitmi-heimtherapie/", "https://www.flintrehab.com/de/product/musicglove-handtherapie/", "https://www.flintrehab.com/de/product/flex-afo-knoechel-fuss-orthese/", "https://www.flintrehab.com/de/paket/", "https://www.flintrehab.com/de/lernen/", "https://www.flintrehab.com/de/lernen/", "https://www.flintrehab.com/de/kostenloses-e-buch-newsletter/", "https://www.flintrehab.com/de/wagen/", "https://www.flintrehab.com/de/", "https://www.flintrehab.com/de/lernen/", "https://www.flintrehab.com/de/category/schlaganfall-rehabilitation/", "#1", "#2", "#3", "https://translate.google.com/translate?hl=&sl=en&tl=de&u=https://www.flintrehab.com/every-stroke-is-different/", "https://www.flintrehab.com/de/schlaganfall-folgen/", "https://www.flintrehab.com/de/ubungen-nach-schlaganfall/", "https://translate.google.com/translate?hl=&sl=en&tl=de&u=https://www.flintrehab.com/massed-practice/", "https://translate.google.com/translate?hl=&sl=en&tl=de&u=https://pubmed.ncbi.nlm.nih.gov/21642065/", "https://www.flintrehab.com/de/aktive-vs-passive-ubungen-wahrend-der-rehabilitation/", "https://translate.google.com/translate?hl=&sl=en&tl=de&u=https://www.flintrehab.com/learned-nonuse-stroke/", "https://translate.google.com/translate?hl=&sl=en&tl=de&u=https://www.ncbi.nlm.nih.gov/pmc/articles/PMC6336439/", "https://translate.google.com/translate?hl=&sl=en&tl=de&u=https://www.flintrehab.com/magnetic-brain-stimulation-stroke/", "https://www.flintrehab.com/de/product/musicglove-handtherapie/", "https://translate.google.com/translate?hl=&sl=en&tl=de&u=https://jneuroengrehab.biomedcentral.com/articles/10.1186/1743-0003-11-76", "https://www.flintrehab.com/de/product/fitmi-heimtherapie/", "https://translate.google.com/translate?hl=&sl=en&tl=de&u=https://www.nia.nih.gov/research/osbr/nia-small-business-showcase-flint-rehabilitation-devices", "https://www.flintrehab.com/de/neuroplastizitat-nach-schlaganfall/", "https://translate.google.com/translate?hl=&sl=en&tl=de&u=https://www.flintrehab.com/mirror-therapy-stroke/", "https://translate.google.com/translate?hl=&sl=en&tl=de&u=https://www.ncbi.nlm.nih.gov/pmc/articles/PMC7012218/", "https://www.flintrehab.com/de/elektrostimulation-fur-schlaganfallpatienten/", "https://translate.google.com/translate?hl=&sl=en&tl=de&u=https://www.ahajournals.org/doi/10.1161/STROKEAHA.107.490318", "https://www.flintrehab.com/de/hilfsmittel-fur-schlaganfallpatienten/", "https://translate.google.com/translate?hl=&sl=en&tl=de&u=https://www.flintrehab.com/mental-practice-stroke-rehabilitation/", "https://translate.google.com/translate?hl=&sl=en&tl=de&u=https://www.sciencedirect.com/science/article/abs/pii/S000399930601272X", "https://translate.google.com/translate?hl=&sl=en&tl=de&u=https://academic.oup.com/ptj/article/81/8/1455/2857674", "https://translate.google.com/translate?hl=&sl=en&tl=de&u=https://www.flintrehab.com/sensory-reeducation-return-of-sensation-after-stroke/", "https://translate.google.com/translate?hl=&sl=en&tl=de&u=https://www.ncbi.nlm.nih.gov/pmc/articles/PMC3073500/", "https://translate.google.com/translate?hl=&sl=en&tl=de&u=https://www.ncbi.nlm.nih.gov/pmc/articles/PMC5607544/", "https://www.flintrehab.com/de/genesung-des-sehvermogens-nach-dem-schlaganfall/", "https://translate.google.com/translate?hl=&sl=en&tl=de&u=https://www.flintrehab.com/repetition-vs-consistency/", "https://www.flintrehab.com/de/lernen/", "https://www.flintrehab.com/de/product/musicglove-handtherapie/", "https://www.flintrehab.com/de/product/fitmi-heimtherapie/", "https://app.monstercampaigns.com/c/d2vng38fhcoqc1px5ico/", "https://www.flintrehab.com/stroke-recovery-treatment/", "https://www.flintrehab.com/es/accidente-cerebrovascular-tratamiento/", "https://www.flintrehab.com/de/schlaganfall-behandlung/", "https://www.flintrehab.com/fr/avc-traitement/", "https://www.flintrehab.com/de/beginnen-sie-hier/", "https://www.flintrehab.com/de/ueber-uns/", "https://www.flintrehab.com/de/lernen/", "https://www.flintrehab.com/de/flint-rehabs-garantie/", "https://www.flintrehab.com/de/product/fitmi-heimtherapie/", "https://www.flintrehab.com/de/product/musicglove-handtherapie/", "https://www.flintrehab.com/product/afo/", "https://www.flintrehab.com/de/paket/"]}