{"title": "Home - Deutsche Gesellschaft f\u00fcr Traditionelle Chinesische Medizin", "author": "Admin", "url": "https://dgtcm.de/home/", "hostname": "dgtcm.de", "description": "Viele Menschen suchen die Therapieverfahren der Chinesischen Medizin (CM, TCM), weil sie eine nebenwirkungsarme, sichere und umfassende (\u201eganzheitliche\u201c)", "sitename": "Deutsche Gesellschaft f\u00fcr Traditionelle Chinesische Medizin e.V.", "date": "2023-07-26", "id": null, "license": null, "body": null, "comments": "", "commentsbody": null, "raw_text": null, "text": "Liebe Patientinnen, liebe Patienten,\nInhalt\n- Das Beste aus zwei Welten\n- Ihre Anliegen sind uns wichtig\n- TCM ohne Hokuspokus \u2013 so funktioniert TCM\n- Das Heidelberger Modell\n- Hier hilft die Chinesische Medizin\n- So heilt die Chinesische Medizin\n- Literaturverzeichnis\nDas Beste aus zwei Welten\nViele Menschen suchen die Therapieverfahren der Chinesischen Medizin (CM, TCM), weil sie eine nebenwirkungsarme, sichere und umfassende (\u201eganzheitliche\u201c) Therapie anstreben.\nTats\u00e4chlich kann die Chinesische Medizin in vielen F\u00e4llen auch dann Beschwerden lindern, wenn die bei uns etablierte westlich-naturwissenschaftliche Medizin ausgereizt ist. Dar\u00fcber hinaus hat die Chinesische Medizin ein gro\u00dfes Potential f\u00fcr die Pr\u00e4vention vieler Erkrankungen, die individuelle Leistungsoptimierung (k\u00f6rperlich, geistig, vor Pr\u00fcfungen, f\u00fcr Healthy Aging) und f\u00fcr die Verbesserung der emotionalen Lebensqualit\u00e4t\nDie CM soll die westliche Medizin nicht ersetzen, sondern in ihrer hervorragenden Weise sinnvoll erg\u00e4nzen. Wir raten deshalb zu einer kombinierten Anwendung von westlicher und Chinesischer Medizin. Nur die vernunftgerechte Kombination der Medizinformen aus Ost und West erf\u00fcllt unser Bed\u00fcrfnis nach Wirksamkeit und Sicherheit!\nIhre Anliegen sind uns wichtig\nAuf dieser Seite finden Sie grunds\u00e4tzliche Ausk\u00fcnfte zum Heilsystem der TCM und zu allen sieben Heilmethoden, ihrer Wirkweise und ihren Anwendungsgebieten. Mehr \u00fcber die TCM erfahren Sie in allgemein verst\u00e4ndlicher Weise in dem Buch \u201eHeilen mit der Intelligenz des K\u00f6rpers\u201c, einem neuen Bestseller von Henry Johannes Greten, das Sie problemlos in jeder Buchhandlung, \u00fcber das Netz oder im Webshop bestellen k\u00f6nnen. Au\u00dferdem helfen Ihnen die folgenden Links weiter: 2 Blogs\nWir hoffen, dass wir zumindest einen Teil Ihrer Fragen auf diese Weise kl\u00e4ren k\u00f6nnen. Nat\u00fcrlich freuen wir uns auch \u00fcber Ihre pers\u00f6nlichen Anfragen, die Sie am besten kurz per Mail an patient@dgtcm.de stellen.\nWir geben Ihnen zu Ihrem Anliegen gerne auch individuelle Ausk\u00fcnfte, die notgedrungen eher allgemeiner Art sein m\u00fcssen, denn unsere Mitarbeiter sind nicht berechtigt, medizinische Therapieratschl\u00e4ge zu geben.\nDaf\u00fcr fallen bei uns keinerlei Geb\u00fchren an. Gerne k\u00f6nnen Sie uns unterst\u00fctzen, denn nur mit Ihrer Unterst\u00fctzung k\u00f6nnen wir unsere Arbeit fortsetzen, die f\u00fcr viele Menschen sehr wichtig ist. Werden Sie als Patient f\u00f6rderndes Mitglied in unserer Gemeinschaft! Wir sind eine gemeinn\u00fctzige wissenschaftliche Fachgesellschaft. Das bedeutet \u00fcbrigens auch, dass Spenden f\u00fcr die gute Sache voll steuerabzugsf\u00e4hig sind.\nIn besonderen F\u00e4llen wird es vielleicht n\u00f6tig sein, dass wir zu Ihren Anliegen speziell ausgebildete \u00c4rzte unserer Gesellschaft befragen. Dann ist es m\u00f6glich, Ihnen ggfs. auch weitergehende und Ihren Einzelfall betreffende Ausk\u00fcnfte und Hinweise zu vermitteln.\n\u00dcbrigens: Auch wenn Sie kein Arzt/keine \u00c4rztin sind, k\u00f6nnen Sie bestimmte Verfahren der TCM im gesetzlichen Rahmen kompetent anwenden und lernen. Das kann f\u00fcr Sie privat und zugleich auch beruflich interessant sein. Wenn Sie eines der sieben Verfahren besonders anspricht, klicken Sie dort einmal auf Ausbildung,\nTCM ohne Hokuspokus - so funktioniert TCM\nDie Chinesische Medizin funktioniert ein wenig anders als die bei uns verbreitete westlich-naturwissenschaftliche Medizin. Obwohl sie aus Asien kommt, beruht sie eigentlich nicht auf einer etwas nebul\u00f6sen Asiaphilosophie, wie man es h\u00e4ufig liest. Tats\u00e4chlich beruht sie auf einem eigenen Wissenschaftssystem. Man kann daher sagen, sie ist eine \u00f6stlich-naturwissenschaftliche Medizin.\nHeilen auf einer guten Grundlage \u2013 die Chinesische Funktionsdiagnose\nDie Chinesische Medizin ist eine ideale Erg\u00e4nzung zur westlich-naturwissenschaftlichen Medizin. Das liegt vor allem an ihrem besonderen wissenschaftlichen Ansatz, der hierzulande noch viel zu wenig bekannt ist. Jede Form von Medizin muss die Symptome eines Patienten aufnehmen, verstehen und daraus eine Handlungsanweisung f\u00fcr Heilung, f\u00fcr die Therapie ableiten. Man nennt diese Handlungsanweisung auch die Diagnose. Je genauer die Diagnose, desto genauer und wirksamer ist die Therapie.\nIn der westlich-naturwissenschaftlichen Medizin geschieht die Deutung der Symptome ganz wesentlich durch Messungen, zum Beispiel durch die Laborwerte in einer Arztpraxis. Dazu geh\u00f6ren nicht nur die Blutwerte, sondern auch Messungen wie die Lungenfunktion oder das EKG. Auch das R\u00f6ntgen, Kernspinaufnahmen und andere Bilder dienen der Ausmessung des K\u00f6rpers. So entsteht ein zuverl\u00e4ssiges Bild, das man im Gro\u00dfen und Ganzen auch als ein Abbild der Hardware des K\u00f6rpers bezeichnen kann. Es geht um die messbare Struktur des K\u00f6rpers, seiner verschiedenen Bauelemente, aus denen der K\u00f6rper besteht. Die Diagnose der westlichen Medizin ist also eher eine Hardware-Diagnose. Man k\u00f6nnte die westlich-naturwissenschaftliche Medizin als eine Medizin verstehen, die eher den Zustand der Hardware bestimmt, um die Krankheiten zu erkl\u00e4ren.\nDabei ergibt sich das Problem, dass die deutlich \u00fcberwiegende Zahl von Alltagsbeschwerden gar keine Ver\u00e4nderungen im Blutbild, den Laborwerten usw. zeigen Das kennt eigentlich jeder: eine Patientin f\u00fchlt sich schlecht und matt, geht zum Arzt. Er nimmt Blut ab und sagt, es ist alles in Ordnung. F\u00fcr die Patientin ist diese Herangehensweise nicht befriedigend. Das hat zur Folge, dass die Ursache vieler Symptome nur ungen\u00fcgend erfasst werden k\u00f6nnen. Die wissenschaftliche Fachliteratur sch\u00e4tzt den Anteil der Patienten ohne messbare Ursache der St\u00f6rungen recht hoch ein, die Sch\u00e4tzungen belaufen sich auf fast neun von zehn Patienten\n[[i]](#_edn1), der Anteil unerkl\u00e4rlicher Symptome und Wahrnehmungen auf ca. 15 %. Das k\u00f6nnte daran liegen, dass die Diagnose in der bei uns etablierten Medizin so stark auf die Hardware fokussiert und dabei die funktionellen Ursachen eher in den Hintergrund stehen. Das wirkt auf den ersten Block erstaunlich, vielleicht sogar befremdlich. Wie also kann das sein?\nMan kann das an einem einfachen Beispiel erkl\u00e4ren: wenn Sie ein CT-Bild von einer Kommode machen w\u00fcrden, dann w\u00e4re meist die Diagnose ohne Befund. Nichts ist gebrochen, alle Scharniere sind intakt. Aber trotzdem kann es sein, dass die Kommode klemmt, und das w\u00fcrde man auf einem einfachen Bild nicht erkennen k\u00f6nnen. Die Struktur der Kommode ist also in Ordnung, aber sie funktioniert trotzdem nicht richtig.\nStellen Sie sich einmal vor, wie sich dieses Vorgehen auf die Diagnose und die Behandlung von R\u00fcckenschmerz auswirken k\u00f6nnte. Die Spannung der Muskeln und Sehnen, die Durchblutung von Nerven und Muskeln, die Funktion der Weichteile sind auf diesen Bildern gar nicht zu messen. Das f\u00fchrt naturgem\u00e4\u00df zu Fehleinsch\u00e4tzungen.\nZitat: Ein Gro\u00dfteil der in Deutschland durchgef\u00fchrten R\u00fccken-Operationen k\u00f6nnte einer Analyse der Techniker Krankenkasse zufolge unn\u00f6tig sein. Acht von zehn Patienten, die vor einer geplanten OP eine Zweitmeinung einholten, bekamen dabei die Empfehlung, auf den Eingriff zu verzichten, wie die Techniker Krankenkasse (TK) im Vorfeld des Tags der R\u00fcckengesundheit am Montag (15.3.2021) mitteilte. Untersucht wurden demnach 6000 F\u00e4lle aus den Jahren 2013 bis 2019, die an bundesweit 30 Schmerzzentren eine Zweitbegutachtung erhielten. Redaktionsnetzwerk Deutschland vom 15.03.2021).\nDie chinesisch-naturwissenschaftliche Herangehensweise unterscheidet sich grunds\u00e4tzlich von diesem Vorgehen. Man k\u00f6nnte sie im Vergleich hierzu als eine Art Software-Medizin bezeichnen. In der Tat kann man den K\u00f6rper als eine Art Zellenstaat bezeichnen (Virchow, 1853/1855), der wie jede Hardware auch eine Software ben\u00f6tigt, um zum Leben erweckt zu werden. Diese Software braucht man, um geordnet zu funktionieren, und um K\u00f6rper und Seele in ihren Gleichgewichten zu st\u00fctzen. Die westliche Medizin teilt diese \u201ehumane Software\u201c in die drei Teile Sympathikus, Parasympathikus und Darmnervensystem ein. Ihre Funktionen sind der Medizin schon seit 100 Jahren bekannt (Langley 1921), aber es gibt nur wenige M\u00f6glichkeiten diese Software zu beeinflussen.\nWeil diese Funktionen so schwer zu messen sind bedient sich die Chinesische Medizin nun einer anderen Methode, die Symptome, Wahrnehmungen und Beobachtungen eines Patienten zu deuten. Sie verfolgt dabei eine eigene, genaue und erstaunlich effiziente Systematik. Die Chinesische Medizin verwendet zur Beschreibung hierzu ganz eigene Begriffe, die auf den ersten Blick fremd und gar esoterisch anmuten k\u00f6nnten. Sie werden manchmal auch als \u201ephilosophische Grundlagen\u201c der TCM \u00fcbersetzt. Das ist nicht nur inhaltlich nicht wirklich zul\u00e4ssig, es verhindert auch die Integration der Chinesischen Medizin.\nErst vor relativ kurzer Zeit wurden diese Begriffe in ihrer biologischen und medizinischen Bedeutung entschl\u00fcsselt. Dadurch haben wir auch die chinesische Diagnosestellung neu verstehen gelernt und in die Sprache der westlichen Medizin \u00fcbersetzt. Das ebnete den Weg zu einer besseren Integration der TCM, zu einer genaueren Diagnose und zu besseren Heilerfolgen, die durch eine Reihe von internationaler Publikationen doppel-verblindet belegt werden konnten. Das blieb auch in China nicht unbemerkt:\n\u201c\u2026 the Heidelberg model \u2026 can be regarded as the future model to integrate Chinese Medicine in Western health care systems and research.\u201d Brief von Yulong Shen, Generaldirektor der State Administration of Traditional Chinese Medicine vom 29.09.2005).\nDas Heidelberger Modell \u2013 f\u00fchrend in Wissenschaft, Behandlung und Unterricht\nNach neueren Erkenntnissen entsteht durch die systematische Beobachtung und Erhebung der Symptome, K\u00f6rperempfindungen und Emotionen, der Befunde der Zungendiagnose und des Gesamteindrucks des Patienten ein Funktionsbild des K\u00f6rpers, eine funktionelle Diagnose. Diese Funktionen werden vom Gehirn wie von einem Computer gesteuert. Insofern ist sie eine Art Software-Medizin, die sich mit dem Einfluss der menschlichen Software auf die T\u00e4tigkeit der einzelnen Leibesgebiete und Organregionen, der Muskeln, Knochen, Sehnen und des Emotionsapparates besch\u00e4ftigt.\nIn der westlichen Medizin bezeichnet man den Teil des Gehirns, der wie ein Computer den K\u00f6rper steuert, als das vegetative Nervensystem. Es funktioniert ganz automatisch und im Allgemeinen merkt man von dieser Funktionssteuerung nicht viel, denn sie l\u00e4uft automatisch im Unterbewusstsein ab. Fehlsteuerungen aber, die ungew\u00f6hnliche und kranke Funktionen bewirken, werden zu f\u00fchlbaren Symptomen, der Patient f\u00fchlt sich ungesund und geht zum Arzt.\nFunktionsst\u00f6rungen und Symptome des Alltags beruhen zu einem hohen Teil auf Fehlsteuerung der Softwarepakete des Vegetativums, die die westliche Medizin nur schlecht oder gar nicht beeinflussen kann. Eine Software-Medizin, die \u00fcber die nervliche Steuerung des Gehirns wirkt, das w\u00e4re aus Sicht der \u00c4rzte und Patienten h\u00f6chst w\u00fcnschenswert. Und genau hier setzt die Chinesische Medizin an.\nHand aufs Herz: wenn Ihr Computer nicht so will wie Sie, was machen Sie? Tauschen Sie gleich die Festplatte, den Monitor oder das Motherboard (die Hardware) aus oder reparieren Sie das Ding mit der Methode Reset und Upgrade aufspielen?\nDie Chinesische Medizin kann unsere Software wieder zum Laufen, die funktionellen Gleichgewichte von K\u00f6rper und Seele in Ordnung bringen und auf diese Weise viele Symptome lindern, die mit der westlichen Medizin schwer oder gar nicht zu behandeln sind. Interessanterweise steuert das vegetative Nervensystem, \u00fcber das die TCM viele ihrer Wirkungen entfaltet, auch die tiefsten Gef\u00fchle in uns. Die Therapien helfen daher h\u00e4ufig auch bei emotionalen und mental bedingten Symptomen. Au\u00dferdem gibt es auch Heilpflanzen und andere Methoden, die wir weiter unten kurz erkl\u00e4ren.\nMehr dar\u00fcber erfahren? In diesen Blogs wird alles noch weiter erkl\u00e4rt.\n2 links zu den Blogs St Antony und de andere, P bitte eintragen\nHier hilft die Chinesische Medizin\nUnserer Forschung kann Ihnen helfen.\nWir sind und waren regelm\u00e4\u00dfig an wissenschaftlichen Projekten und der universit\u00e4ren Lehre beteiligt, bisher u.a. in Zusammenarbeit mit Abteilungen der Universit\u00e4ten Heidelberg, Hamburg, Magdeburg, Rom, Berlin, Porto, Mainz, dem American College of Acupuncture and Oriental Medicine Houston, Yale, dem Texas Medical Center, dem WHO Collaborating College Beijing, der Shanghai University of TCM\u2026\nLaufend ver\u00f6ffentlichen wir die Ergebnisse in Fachzeitschriften, \u00fcber 140 solcher Arbeiten benennen wir hier auf unserer Website Sie k\u00f6nnen sie gerne per Mail oder als Ausdruck zuschicken lassen, z.B. als Information f\u00fcr Ihren Hausarzt und als Beleg zur Weitergabe an Angeh\u00f6rige und Interessierte.\nDie Themen sind \u00fcberaus vielf\u00e4ltig. Eine kurze \u00dcbersicht Erkrankungen, bei denen die Behandlung mit der TCM hilfreich sein kann, haben wir hier zusammengestellt. Wir haben sie \u201evon Kopf bis Fu\u00df\u201c angeordnet, damit Sie sich besser zurecht finden. Weiter unten finden Sie eine Beschreibung der einzelnen Therapieverfahren. Die dortigen links verweisen auf die Anwendung der Verfahren bei weiteren Erkrankungen, dort geordnet nach den verfahren, zB. Akupunktur, Arzneitherapie u.s.w. .\n\u2022 Parkinson, MS, Demenz und andere neurologischen Erkrankungen\n\u2022 Behandlung von Gangst\u00f6rungen, Schlaganf\u00e4llen und Multipler Sklerose\n\u2022 Altersbedingte Makuladegeneration (AMD) und andere Sehst\u00f6rungen\n\u2022 Allergien\n\u2022 Asthma, Chronisch-obstruktive Atemwegserkrankungen (COPD), Atemnot verschiedener Ursachen\n\u2022 Z.n. Thoraxoperationen, postoperative Schmerzen\n\u2022 Linderung von Magen-Darm-Symptomen wie Schmerzen, Oberbauchsyndrom, Reizdarm, \u201eleaky gut\u201c Unvertr\u00e4glichkeit von Nahrungsmitteln, Beschwerden nach Bauchoperationen\n\u2022 R\u00fcckenschmerzen\n\u2022 Knieschmerzen\n\u2022 Rheuma und andere Kollagenosen (Bindegewebserkrankungen)\n\u2022 Therapie der Volkskrankheit Polyneuropathie\n\u2022 Reduktion der Nebenwirkungen von Chemo- und Strahlentherapie\n\u2022 Naturstoffe zur unterst\u00fctzenden Krebstherapie\n\u2022 Kombination der TCM mit Hyperthermie bei Tumoren und Prostataleiden, , FILM DGHT\n\u2022 St\u00e4rkung der Abwehr (messbare Effekte durch Naturstoffe und Akupunktur)\n\u2022 Behandlung von Herzinsuffizienz\n\u2022 Lungenerkrankungen wie Asthma und Chronisch Obstruktive Bronchitis (COPD)\n\u2022 Behandlung der Nebenh\u00f6hlen (Sinusitis)\n\u2022 Kopfschmerzen, Migr\u00e4ne\nSo heilt die Chinesische Medizin\nDer Chinesischen Medizin steht ein ganzes Arsenal von Behandlungsmethoden zur Verf\u00fcgung, die sie individuell f\u00fcr die Patienten einsetzen und miteinander kombinieren kann. In diesem Abschnitt m\u00f6chten wir Sie kurz mit den wichtigsten therapeutischen Verfahren vertraut machen. Genauere Erkl\u00e4rungen finden Sie in der von uns empfohlenen Fachliteratur (Link zum Kursbuch und zum Buch Heilen mit der Intelligenz des K\u00f6rpers).\nMan kann heute die Wirkmechanismen wissenschaftlich sehr gut erkl\u00e4ren, die traditionell mit Begriffen wie \u201eQi\u201c oder \u201eEnergie\u201c beschrieben werden. Bei dieser Erkl\u00e4rung spielen sogenannte Reflexe eine wichtige Rolle, deren Wirkungen \u00fcber das Nervensystem erzeugt werden. Diese Reflexe k\u00f6nnen durch Nadeln, Erw\u00e4rmen, Schr\u00f6pfgl\u00e4ser, schabenden Steinen (Gua sha) und nicht zuletzt durch die heilende Ber\u00fchrung mit den H\u00e4nden bewirkt werden.\nAu\u00dferdem gibt es \u2013 wie in der westlichen Medizin \u2013 Arzneistoffe, die in der TCM \u00fcberwiegend aus Pflanzen bestehen. Alle von uns gepr\u00fcften \u00c4rzte der Chinesischen Medizin verwenden \u00fcbrigens ausschlie\u00dflich landwirtschaftlich produzierte Heilpflanzen, die nicht unter Artenschutz stehen, und vor allem keine Bestandteile haben, die aus gesch\u00fctzten Tier- und Pflanzenarten hergestellt werden. Alle Heilstoffe werden von deutschen Apotheken gepr\u00fcft, ihre Identit\u00e4t und Reinheit k\u00f6nnen so garantiert werden.\nBei den Reflexverfahren spielt die Akupunktur bei uns die wichtigste Rolle. Immer wieder werden wir gefragt, wie sie wirkt, und auch, wie man einen guten Akupunkteur erkennt. Das Prinzip ist einfach. Sicher erinnern Sie sich an ihre Besuche beim Kinderarzt. Manchmal schl\u00e4gt er mit einem kleinen H\u00e4mmerchen unter die Kniescheibe und das Bein schnellt automatisch nach vorne.\nDas Prinzip dahinter kennen Sie vom Armaturenbrett Ihres Autos. Wenn die T\u00fcr nicht richtig geschlossen wird, dann wird ein Signal erzeugt, das auf dem Armaturenbrett erscheint. Nat\u00fcrlich werden viele solcher Signale im Motor, den Scheinwerfern und sonst wo gebildet und an die elektronischen Bauteile Ihres Wagens weitergeleitet. Eine Software im elektronischen Gehirn des Autos kann dann z.B. entscheiden, ob Sie rechts heranfahren m\u00fcssen oder ob Sie die Handbremse l\u00f6sen m\u00fcssen. Etwas \u00e4hnliches passiert auch im K\u00f6rper.\nBei dem sanften Schlag des Kinderarztes dr\u00fcckt das H\u00e4mmerchen auf ein ganz bestimmtes Hautareal. Es handelt sich um einen genau umschriebenen Punkt nahe der K\u00f6rperoberfl\u00e4che, der in diesem Fall eben in der Kniescheibensehne verborgen ist. Dort befinden sich Empf\u00e4ngerzellen des K\u00f6rpers (Rezeptoren), die den Schlag aufnehmen und in ein Stromsignal umwandeln, genau wie im Auto. Diese Stromsignale gelangen in R\u00fcckenmark und Gehirn, wo sich die Software des K\u00f6rpers befindet. Reflexpunkte funktionieren also im Prinzip wie ein Schalter. Dabei entsteht eine Funktions\u00e4nderung des K\u00f6rpers. Das funktioniert nicht nur im Bein eines Kindes, sondern in sehr vielen Geweben des K\u00f6rpers. Ein wirklich sehr umfassendes Wirkprinzip, dass unserem K\u00f6rper hilft auch in widrigen Umst\u00e4nden die richtigen Funktionen aufrecht zu erhalten\nWer es genau wissen will: man teilt diese Software in die drei schon benannten Softwarepakete ein, die seit der Urzeit unser \u00dcberleben gesichert haben: Der Sympathikus aktiviert uns, wir werden wach und kampfbereit. Er kann deshalb Stresserkrankungen hervorrufen. Der Parasympathikus regeneriert uns in den Ruhephasen und kann hier und da prophylaktisch dem Sympathikus entgegenwirken, wenn z.B. der momentane Stresspegel einfach \u00fcberhandnimmt. Dann kann es z.B. zu hohem Blutdruck, Herzbeschwerden und Muskelverspannungen kommen. Es droht uns sonst, dass \u201ebei uns eine Sicherung durchbrennt\u201c. Das Darmnervensystem (enterales Nervensystem) sorgt f\u00fcr Ordnung bei der Nahrungsaufnahme, die Grundlage des Lebens. Das alles illustriert, wie au\u00dferordentlich stark die Wirkungen der Software des automatischen (\u201evegetativen\u201c) Nervensystems den ganzen K\u00f6rper und sogar die Emotionen durchdringen.\nDie Chinesische Medizin hat \u00fcber 372 solcher Schalterpunkte genau analysiert und kann sie systematisch ausl\u00f6sen. Diese Schalter hei\u00dfen Akupunkturpunkte. Sie haben, \u00e4hnlich wie Schalter \u2013 einen Einfluss auf Nervenleitbahnen, die zu allen m\u00f6glichen Geweben im Zellenstaat des Menschen eine Verbindung haben. Sie kann damit automatische Wirkungen in allen m\u00f6glichen Geweben des K\u00f6rpers erzeugen. Diese Wirkungen betreffen also nicht nur die Muskeln der Beine, sondern manchmal auch das gesamte biologische System des Menschen.\nMan kann auf diese Weise Fehlsteuerungen des Nervensystems und den damit verbundenen Symptomen entgegenwirken. Das ist ein wenig so, also w\u00fcrde man die Fehlsteuerung durch ein Computerprogramm mit einem Upgrade in Ordnung bringen. Um die M\u00f6glichkeiten dieser Softwarereparatur voll zu nutzen, ist es zun\u00e4chst wichtig zu verstehen, in welcher Ausgangslage sich der K\u00f6rper befindet. Eine laufende Nase braucht eben andere Punkte als eine trockene Nase. Die Art der Fehlsteuerung ist also entscheidend f\u00fcr die Wahl der Punkte. Auch die Art, wie diese Punkte gereizt werden, ist von gro\u00dfer Bedeutung. Deshalb unterscheidet man eben zum Beispiel die Behandlung mit Nadeln, Schr\u00f6pfgl\u00e4sern, die Behandlung mit der Hand oder das Erw\u00e4rmen.\nDas Problem dieser Methode ist gegenw\u00e4rtig h\u00e4ufig noch, dass die Wirkungen der Reflexpunkte auf den K\u00f6rper mit f\u00fcr uns fremd klingenden Begriffen wie qi, Energie, yin und yang, \u201eElemente\u201c, beschrieben werden. Die Grundbegriffe dieser Medizin haben wir auf ihre biologische Bedeutung untersucht. So entstand des Heidelberger Modell, der TCM. Wir konnten die Diagnose, die Therapie und die Menschen dadurch viel besser verstehen. Auch die innere Logik der TCM als Wissenschaft der Systembiologie (der \u201eGanzheitlichkeit\u201c) wurde auf diese Weise klarer erkennbar. Dadurch hat sich auch die Wirksamkeit der Akupunktur unserer \u00c4rzte gegen\u00fcber anderen Konzepten deutlich verbessert, wie Studien eindeutig beweisen.\nDas Wichtigste scheint uns aber: wir k\u00f6nnen die TCM von der Pseudophilosophie befreien, mit der westlichen Medizin sinnvoller kombinieren und den Nutzen beider Systems voll vereinen. Es stehen uns dazu aus der Chinesischen Medizin eine Reihe interessanter Therapieverfahren zur Verf\u00fcgung:\n- Die Akupunktur, eine systemische Reflextherapie f\u00fcr ein Upgrade unserer K\u00f6rperfunktionen. Wir f\u00fchren seit Jahrzehnten eine systematische und gut strukturierte Akupunkturausbildung f\u00fcr \u00c4rzte durch, die von den deutschen \u00c4rztekammern zur Fortbildung der \u00c4rzte in Akupunktur anerkannt ist, jedoch weit \u00fcber das dort geforderte Minimum hinausgeht. Auch das Erw\u00e4rmen der Punkte mit Moxa geh\u00f6rt zu dieser Behandlung. Apropos Erw\u00e4rmen: diese Behandlungsform ist in der klassischen TCM genauso wichtig wie die Nadelbehandlung. Sprichw\u00f6rtlich sagt man in China auch, man soll nicht zu einem Arzt gehen, bei dem es nicht ein wenig nach Moxa (Beifu\u00df) duftet.\n- Die Chinesische Manuelle Therapie (CMT) ist gewisserma\u00dfen eine Fortsetzung der Akupunktur mit den H\u00e4nden. Es gibt verschiedene therapeutische Verfahren mit insgesamt \u00fcber 60 Formen, um die Haut, Unterhaut, Muskeln und auch die Bewegungselemente des K\u00f6rpers zu neuem Wohlgef\u00fchl zu bringen, zu l\u00f6sen und zu bewegen. Link\n- Chinesische Gesundheits\u00fcbungen wie Qigong und Taiji. Diese Therapieformen nannte man fr\u00fcher \u201echinesisches Schattenboxen\u201c. Dabei werden mit einer besonders konzentrierten Wahrnehmung Atembewegung und K\u00f6rperfunktion \u201eneu programmiert\u201c und bis in die sog. Tiefenemotionen hinein ver\u00e4ndert. Unsere Wissenschaftler haben hierzu bereits 15 verschiedene wissenschaftliche Publikationen und 21 Masterarbeiten verfasst (Stand Juli 2023). Die Wirkungen bei Burnout, \u00c4ngsten, Lernst\u00f6rungen und vielen anderen Indikationen konnten dadurch wissenschaftlich belegt werden .\nIn der Zwischenzeit gibt es sogar einen von der Industrie- und Handelskammer anerkannten Abschluss als Qigonglehrer. Link.\nViele dieser Therapieformen eignen sich f\u00fcr \u00c4rzte und Physiotherapeuten, aber auch f\u00fcr den Gebrauch in der eigenen Familie kann man sie erlernen und ihre erstaunlichen Wirkungen f\u00fcr sich selber nutzen. Link.\n- Psychotherapie der TCM (PTTCM) ist eine bei uns im Westen entwickelte Anwendung chinesischer Lebenserkenntnisse auf der Grundlage eines westlichen Werte- und Weltverst\u00e4ndnisses. Hier wird die chinesische Kunst, den K\u00f6rper und die Seele zu lesen in besonderer Weise in die Lebensberatung und auch die psychotherapeutische Praxis integriert. Link\n- Chinesische Ern\u00e4hrungslehre. Seit Jahrtausenden haben die Chinesen die Kunst, mit Nahrung zu heilen zu einer besonderen Kunst entwickelt. Was wir heute bei den \u201eErn\u00e4hrungs-Docs\u201c im Fernsehen erfahren, wei\u00df die Chinesische Medizin in den meisten F\u00e4llen schon seit ihren Anf\u00e4ngen. Sie heilt mit Methoden, die schon 2000 Jahren geholfen haben: \u201eDu bist, was du isst.\u201c Man kann diese Lehre zur Vorbeugung von Erk\u00e4ltungskrankheiten, wiederkehrenden Infekten, Nahrungsmittelunvertr\u00e4glichkeiten, zur Behandlung von Rheuma und vielen anderen Erkrankungen einsetzen. Sie ist ein unentbehrlicher Helfer im Alltag f\u00fcr alle, die gesundheits- und ern\u00e4hrungsbedingt leben wollen und ihre Gesundheit selbst in die Hand nehmen m\u00f6chten. Wir bieten auch Kurse f\u00fcr Laien und ihre Kinder an. Link.\n- Die Chinesische Arzneitherapie ist bei uns im Westen \u00fcber Jahrzehnte immer besser verstanden worden. Der wichtigste Unterschied zur westlichen Arznei- und Chemotherapie besteht darin, dass man an verschiedenen Stellen des K\u00f6rpers zugleich wirken m\u00f6chte.\nDer Grundgedanke besteht darin jeweils relativ geringe Mengen eines Mittel zu verwenden, daf\u00fcr aber diese Mittel gekonnt zu kombinieren. So will man vorsichtige und umfassendere Einfl\u00fcsse ausl\u00f6sen, um das Gesamtsystem Mensch von verschiedenen Seiten her zu behandeln. Wissenschaftlich nennt man ein solches herangehen eine Multi-Target- oder Multi-Substance-Therapie.\nDieses Vorgehen zielt auch auf noch etwas ab: wenn eine Monosubstanz (z.B. in einer Pille) nicht reicht, dann kann man ganze Kombinationen aus den Pflanzen systematisch nutzen und in manchen F\u00e4llen und diese sind nicht selten \u2013 Linderungen und Heilungen sehen, die eine Einzelsubstanz zuvor nicht bewirken konnte. Es ist auch wichtig, auf die Qualit\u00e4t der Arzneien zu achten. Vor allem die Herkunft und Reinheit der Arzneipflanzen und Heilstoffe m\u00fcssen garantiert sein. Also bitte nicht einfach irgendetwas im Internet bestellen! In der Apotheke ist es zwar teurer, aber in Deutschland mit modernsten Methoden auf R\u00fcckst\u00e4nde und Identit\u00e4t kontrolliert. Einige asiatische Pr\u00fcfungen haben sich als nicht stichhaltig erwiesen, das kann gef\u00e4hrlich sein.\nNat\u00fcrlich braucht man dazu unbedingt ein fundiertes Wissen \u00fcber den K\u00f6rper \u2013 aus Sicht der westlichen und der Chinesischen Medizin, und in bestimmten F\u00e4llen auch Laborkontrollen. Denn alle Medizin die wirkt k\u00f6nnte ja auch an anderen Stellen unerw\u00fcnschte Wirkungen (\u201eNebenwirkungen\u201c) haben. Hier pl\u00e4dieren wir also wieder besonders f\u00fcr eine Integration der westlichen und \u00f6stlichen Naturwissenschaft, eben \u201edas Beste zu zwei Welten\u201c. Die von uns ausgebildeten \u00c4rzte verf\u00fcgen \u00fcber eine solide Grundlage in westlicher und chinesischer Arzneitherapie und konnten in vielen F\u00e4llen helfen, in denen die alleinige westliche Therapie nicht ausreichte. Wir f\u00fchren hierzu fundierte und umfassende Lehrg\u00e4nge durch, unter anderem in unserem Heilkr\u00e4utergarten f\u00fcr Chinesische Medizin in einem Bergtal der Provence. Link.\n- Klang- und Musiktherapie spielt von alters her ebenso eine wichtige Rolle. An der Universit\u00e4t Heidelberg wurden in Zusammenarbeit mit anderen Universit\u00e4ten ganz neue Erkenntnisse zu dieser Therapieform gewonnen. Sie kann bei Tinnitus, ADHS, Autismus, Altersschwerh\u00f6rigkeit, und anderen St\u00f6rungen sehr hilfreich sein. Auch speziell f\u00fcr Musiker gibt es besondere Anwendungen in Kombination mit chin. Heilverfahren\nlink\nSie wollen mehr erfahren? Schreiben Sie uns eine Mail an\n[info@dgtcm.de](mailto:info@dgtcm.de).\nLiteraturverzeichnis\n[1] Common symptoms in ambulatory care: incidence, evaluation, therapy, and outcome. Kroenke K, Mangelsdorff AD. Am J Med. 1989 Mar;86(3):262-6. doi: 10.1016/0002-9343(89)90293-3.PMID: 2919607\n[1] Effectiveness of Acupuncture in Parkinson\u2019s Disease Symptoms \u2013 A Systematic Review. Pereira C, Machado J, Rodriques J, Oliveira NM, Criado MB, Greten HJ, healthcare 2022, doi.org/10.3390/healthcare10112334\n[1] Effects of Acupuncture on Gait of Patients with Multiple Sclerosis. Criado MB, Santos MJ, Machado J, Gon\u00e7alves AM, Greten HJ. J Altern Complement Med 2017; doi 10.1089/acm.2016.0355\n[1]\n[Acupuncture treatment on gait ](http://www.patolex.org/EPHS/revista/201602_files/21%20criado%20mb.pdf)problems in multiple sclerosis: a preliminary study. Criado MB, Santos MJ, Laranjeira M, Machado J, Greten HJ. Experimental Pathology and Health Sciences, 2016;8 (2) 171-174131-134\n[1] Effect of Heidelberg Scalp Acupuncture on the cognitive function of mild to moderate Alzheimer\u2019s Disease Patients \u2013 A preliminary study, Carlos Soares dos Reis, 2014, Masterarbeit an der Universit\u00e4t Porto\n[1] Stimulation of Acupoint St 34 Acutely Improves Gait Performance in Geriatric Patients During Rehabilitation: A Randomized Controlled Trial. Hauer K, Wendt I, Schwenk M, Rohr C, Oster P, Greten HJ, Arch Phys Med Rehabil 2011 Jan;92(1):7-14 (IF 2011: 2.282)\n[1] Immediate Effect of Acupuncture on Poststroke Patients with Spastic Upper Limb Hemiparesis. Ana Rodrigues 2014, Masterarbeit an der Universit\u00e4t Porto\n[1] Effects of scalp acupuncture in patients with stroke (Efeitos da Acupuntura Craniana em Pacientes com Acidente Vascular Cerebral). Ana Cruz 2020, Masterarbeit an der Universit\u00e4t Porto\n[1] Effects of Acupuncture on Gait of Patients with Multiple Sclerosis. Criado MB, Santos MJ, Machado J, Gon\u00e7alves AM, Greten HJ. J Altern Complement Med 2017; doi 10.1089/acm.2016.0355\n[1] Acupuncture for Nasal Congestion: A Prospective, Randomized, Double Blind, Placebo-Controlled Clinical Study. Sertel S, Bergmann Z, Ratzlaff K, Baumann I; Greten HJ, Plinkert PK,. Am J Rhinol Allergy. 2009, 23(6)\n[1] Effects of Acupuncture on Physical Tolerance Exercise in COPD Patients \u2013 A Controlled, Randomised Double-Blind Study. (Efic\u00e1cia da Acupunctura na Toler\u00e2ncia ao Exerc\u00edcio em Pacientes com DPOC \u2013 Estudo Controlado, Randomizado, Duplo Cego). Carla Barros 2018, Materarbeit an der Universit\u00e4t Porto\n[1] Objectifying acupuncture effects by lung function and numeric rating scale in patients undergoing heart surgery. Maimer A, Remppis A, Sack FU, Greten T, Brazkiewicz F, Schr\u00f6der S, Goncalves M, Efferth T, Greten HJ. Evid Based Complement Alternat Med, 2013, http://dx.doi.org/10.1155/2013/21981 (IF 4,774)\n[1] Checkpoint acupuncture as a novel complementary tool to address postoperative pain within the ERAS\u00ae-pathway for abdominal surgery. Ghanad E, Yang C, Wei\u00df C, Machado J, Gon\u00e7alves M, Otto M, Rei\u00dffelder J, Greten HJ, Herrle F, Clinical Nutrition ESPEN 2022. doi: 10.1016/j.clnesp.2022.06.052\n[1] The effect of manual acupuncture on postoperative pain and recovery from abdominal surgery: A systematic review. Staff S, Yang C, Ghanad E, Greten HJ, Rei\u00dffelder J, Herrle F, Clinical Nutrition ESPEN 2022. doi: 10.1016/j.clnesp.2022.06.083\n[1] Pain therapy within the ERAS concept \u2013 Creating objectivity in studies on personalized checkpoint acupuncture. Ghanad E, Machado J, Santos MJ, Gon\u00e7alves M, Rei\u00dffelder, Herrle F, J, Greten HJ, Clinical Nutrition ESPEN 2022; doi: 10.1016/j.clnesp.2022.06.104\n[1] Reduction of Pain After Laparoscopic Bariatric Surgery by Personalized Checkpoint Acupuncture-Data of a STRICTA Conform Pilot Study. Ghanad E, Staff S, Wei\u00df C, Goncalves M, Santos MJ, Correia N, Vassilev G, Herrle F, Reissfelder C, Greten HJ, Otto M, Yang C. Obes Surg 2023 May 29. doi: 10.1007/s11695-023-06654-8. Online ahead of print.\n[1] Reduction of Pain After Laparoscopic Bariatric Surgery by Personalized Checkpoint Acupuncture-Data of a STRICTA Conform Pilot Study. Ghanad E, Staff S, Wei\u00df C, Goncalves M, Santos MJ, Correia N, Vassilev G, Herrle F, Reissfelder C, Greten HJ, Otto M, Yang C. Obes Surg 2023 May 29. doi: 10.1007/s11695-023-06654-8. Online ahead of print.\n[1] Pain therapy within the ERAS concept \u2013 Creating objectivity in studies on personalized checkpoint acupuncture. Ghanad E, Machado J, Santos MJ, Gon\u00e7alves M, Rei\u00dffelder, Herrle F, J, Greten HJ, Clinical Nutrition ESPEN 2022; doi: 10.1016/j.clnesp.2022.06.104\n[1] The effect of manual acupuncture on postoperative pain and recovery from abdominal surgery: A systematic review. Staff S, Yang C, Ghanad E, Greten HJ, Rei\u00dffelder J, Herrle F, Clinical Nutrition ESPEN 2022. doi:\n[10.1016/j.clnesp.2022.06.083](http://dx.doi.org/10.1016/j.clnesp.2022.06.083)\n[1] Checkpoint acupuncture as a novel complementary tool to address postoperative pain within the ERAS\u00ae-pathway for abdominal surgery. Ghanad E, Yang C, Wei\u00df C, Machado J, Gon\u00e7alves M, Otto M, Rei\u00dffelder J, Greten HJ, Herrle F, Clinical Nutrition ESPEN 2022. doi:\n[10.1016/j.clnesp.2022.06.052](http://dx.doi.org/10.1016/j.clnesp.2022.06.052)\n[1] G1-5 Syndromes, a Novel Model of Diagnosis of Upper Abdominal Syndromes and their Treatment. Santos MJ, Moura A, Machado J, Morcos M, Greten HJ, Froeschen P. Biomedical Journal of Scientific & Technical Research May 2020, doi 10.26717/BJSTR.2020.26.004362\n[1] Diagnosis and Objective Pain Assessment of Traditional Chinese Medicine May Be Useful to Demonstrate Specific Effects of Acupuncture in Low Back Pain \u2013 A Prospective, Randomized, Controlled and Single-Blinded Pre-Study. Seca S, Capelo P, Efferth T, Doenitz CA, Schroeder S, Anjos A, Machado J, Greten HJ. J Acupunct. Tuina Sci 2013, 11(3): 155-159, doi 10.1007/s11726-013-0679-0\n[1] Objectifying specific and non-specific effects of acupuncture: A double-blinded, randomised trial in osteoarthritis of the knee. Karner M, Brazkiewicz F, Remppis A, Fischer J, Gerlach O, Stremmel W, Subramanian SV, Greten HJ. Evid Based Complement Alternat Med, 2013, http://dx.doi.org/10.1155/2013/427265 (IF 4,774)\n[1] Effectiveness of Acupuncture on Pain, Physical Function and Health-Related Quality of Life in Patients with Rheumatoid Arthritis: A Systematic Review of Quantitative Evidence.Seca, S, Miranda D, Cardoso D, Nogueira B, Greten HJ, Cabrita A, Rodrigues MA. Chin J Integr Med. 2018 Dec 19. doi: 10.1007/s11655-018-2914-x. [Epub ahead of print]\n[1] Effectiveness of acupuncture on pain, functional disability and quality of life on rheumatoid arthritis of the hand \u2013 results of a double-blind randomized clinical trial. Seca, S, Miranda D, Cardoso D, Nogueira B, Greten HJ, Cabrita A, Rodrigues MA. Chin J Integr Med. 2018 Dec 19. doi: 10.1007/s11655-018-2914-x. [Epub ahead of print]\n[1] Chinese medicine functional diagnosis: An integrative insight to understand rheumatoid arthritis of the hand.\n[Seca](https://www.sciencedirect.com/science/article/pii/S1876382018302919?via%3Dihub#!) S, Patr\u00edcio M, [Kirch S,](https://www.sciencedirect.com/science/article/pii/S1876382018302919?via%3Dihub#!) [Franconi G](https://www.sciencedirect.com/science/article/pii/S1876382018302919?via%3Dihub#!), [Cabrita AS](https://www.sciencedirect.com/science/article/pii/S1876382018302919?via%3Dihub#!), [Greten](https://www.sciencedirect.com/science/article/pii/S1876382018302919?via%3Dihub#!) HJ. [Eur J Integr Med](https://www.sciencedirect.com/science/journal/18763820) 2018. doi:10.1016/j.eujim.2018.07.005\n[1] Does acupuncture improve strength and nerve conduction in RA patients with hand affection? A protocol study.\n[Miranda D, Seca S, Ramos B, Laranjeira M, Cabrita A, Greten HJ, Machado](http://www.patolex.org/EPHS/revista/201602_files/14%20Diana%20Miranda%20-%202%20Short%202016_1.pdf) J. Experimental Pathology and Health Sciences, 2016;8 (2) 93-98\n[1] Effect of acupuncture on hand pain in patients with rheumatoid Arthritis \u2013 Clinical research protocol.\n[Fernandes M, Seca S, Gabriel J, Correia R, Santos MJ, Cabrita A, Machado J, Greten](http://www.patolex.org/EPHS/revista/201602_files/20%20marco%20fernandes_1.pdf) HJ. Experimental Pathology and Health Sciences, 2016;8 (2) 125-130\n[1] The effectiveness of acupuncture on hand pain, physical function and health-related quality of life in patients with rheumatoid arthritis: a systematic review protocol. Seca S, Miranda D, Cardoso D, Greten H, Cabrita A, Rodrigues MA. JBI Database System Rev Implement Rep. 2016 May; 14(5): 18-26. doi: 10.11124/JBISRIR-2016-002543\n[1] Effect of acupuncture on hand pain in patients with rheumatoid Arthritis \u2013 Clinical research protocol. Fernandes M, Seca S, Gabriel J, Correia R, Santos MJ, Cabrita A, Machado J, Greten HJ. Experimental Pathology and Health Sciences, 2016;8 (2) 125-130\n[1] Evaluation of the effect of acupuncture on hand pain, functional deficits and health-related quality of life in patients with rheumatoid arthritis \u2013 A study protocol for a multicenter, double-blind, randomized clinical trial. Seca S, Kirch S, Cabrita AS, Greten HJ. J Integr Med. 2016 May;14(3):219-27. doi: 10.1016/S2095-4964(16)60254-6.\n[1] Acupuncture improves CIPN explored by neurophysiological and clinical outcomes \u2013 the randomized, controlled, cross-over ACUCIN trial. Friedemann T, Kark E, Cao N, Kla\u00dfen M, Meyer-Hamme G, Greten HJ, Rostock M, Buhlmann E, Zhao A, Schr\u00f6der S. Phytomedicine 2022 DOI:\n[10.1016/j.phymed.2022.154294](https://doi.org/10.1016/j.phymed.2022.154294)\n[1] Electrophysiologically verified effects of acupuncture on diabetic peripheral neuropathy in type 2 diabetes: The randomized, partially double-blinded, controlled ACUDIN trial. Meyer-Hamme G, Friedemann T, Greten HJ, Gerloff C, Schr\u00f6der S. Journal of Diabetes 2020.DOI: 10.1111/1753-0407.13130\n[1] ACUDIN \u2013 ACUpuncture and laser acupuncture for treatment of DIabetic peripheral Neuropathy: a randomized, placebo-controlled, partially double-blinded trial. Meyer-Hamme G, Friedemann T, Greten HJ, Plaetke R, Gerloff C, Schroeder S.\n[BMC Neurol.](https://www.ncbi.nlm.nih.gov/pubmed/29653569) 2018 Apr 13;18(1):40. doi: 10.1186/s12883-018-1037-0.\n[1] Can Medical Herbs Stimulate Regeneration or Neuroprotection and Treat Neuropathic Pain in Chemotherapy- Induced Peripheral Neuropathy (CIPN)? Schroeder S, Beckmann K, Franconi G, Meyer-Hamme G, Friedemann T, Greten HJ, Rostock M and Efferth T. Evid Based Complement Alternat Med, 2013 http://dx.doi.org/10.1155/2013/423713 (IF 1.772)\n[1] Quantification of Acupuncture Effects on Peripheral Neuropathy of Unknown and Diabetic Cause by Nerve Conduction Studies. Schr\u00f6der S, Remppis A, Greten T, Brazkiewicz F, Morcos M, Greten HJ; J. Acupunct. Tuina Sci. (2008),6: 312-314\n[1] Acupuncture Treatment Improves Nerve Conduction in Peripheral Neuropathy. Schr\u00f6der S, Liepert J, Remppis A, Greten HJ, European Journal of Neurology 2007, 14: 276-281\n[1] Acupuncture improves chemotherapy-induced neuropathy explored by neurophysiological and clinical outcomes \u2013 the randomized, controlled, cross-over ACUCIN trial. Friedemann T, Kark E, Cao N, Kla\u00dfen M, Meyer-Hamme G, Greten HJ, Rostock M, Buhlmann E, Zhao A, Schr\u00f6der S. Phytomedicine 2022 https://doi.org/10.1016/j.phymed.2022.154294\n[1] The effect of QiGong in natural killer cells in colo-rectal cancer patients undergoing chemotherapy \u2013 A protocol study.\n[Costa, S, Pais I, Ara\u00fajo A, Gon\u00e7alves M, Santos MJ, Greten HJ, Machado ](http://www.patolex.org/EPHS/revista/201602_files/7%20Sara%20Costa%20-Short%202016_1.pdf)J. Experimental Pathology and Health Sciences, 2016;8 (2) 47-54\n[1] A Survey of Chinese Medicinal Herbal Treatment for Chemotherapy-induced Oral Mucositis. Meyer-Hamme G, Beckmann K, Efferth T, Radtke J, Greten HJ, Rostock M, Schroeder S. Evid Based Complement Alternat Med 2013, http://dx.doi.org/10.1155/2013/284959 (IF 1.772)\n[1] Can Medical Herbs Stimulate Regeneration or Neuroprotection and Treat Neuropathic Pain in Chemotherapy- Induced Peripheral Neuropathy (CIPN)? Schroeder S, Beckmann K, Franconi G, Meyer-Hamme G, Friedemann T, Greten HJ, Rostock M and Efferth T. Evid Based Complement Alternat Med, 2013 http://dx.doi.org/10.1155/2013/423713 (IF 1.772)\n[1] Effects of Acupuncture on Leucopenia, Neutropenia, NK and B Cells in Cancer Patients: A Randomised Pilot Study. Pais, I, Correia N, Pimentel I, Teles MJ, Neves E, Vasconcelos J, Guimar\u00e3es J, Azevedo N, Moreira Pinto A, Machado J, Efferth T, Greten HJ. Evid Based Complement Alternat Med June 2014 (IF 1.722\n[1] Effect of Qigong in Natural Killer Cells on Colorectal Cancer Patients Undergoing for Chemotherapy: A Prospective, Randomized and Controlled Study. Sofia Seabra 2014, Masterarbeit an der Universit\u00e4t Porto\n[1] Effects of acupuncture in NK cells in breast cancer patients undergoing neo and adjuvant chemotherapy \u2013 Prospective, controlled and randomized study (Efeitos da acupuntura na ansiedade, depress\u00e3o e frequ\u00e9ncia card\u00edaca em doentes com multi-adic\u00e7\u00f5es \u2013 Estudo explorativo). M\u00e1rcua Forte Faria 2014, Masterarbeit an der Universit\u00e4t Porto\n[1] Autophagy by Natural Products in Cancer Cells. Efferth T, Greten HJ, Biochem Anal Biochem 2012. 1:8. doi.org/10.4172/2161-1009.1000e128\n[1] Objective and Subjective Assessment of Qigong Related Effects in Breast Cancer Patients\u201d \u2013 A Feasibility Study. Andreia Fernandes 2011, Masterarbeit an der Universit\u00e4t Porto\n[1] Curcumin induces apoptosis in human neuroblastoma cells via inhibition of NFkB. Freudlsperger C, Greten J, Schumacher U, Anticancer Research 28: 209-214 (2008)\n[1] Antischistosomal activity of artemisinin derivatives in vivo and in patients. Saeed ME, Krishna S, Greten HJ, Kremsner PG, Efferth T.\n[Pharmacol Res.](http://www.ncbi.nlm.nih.gov/pubmed/?term=antischistosomal+efferth+greten) 2016 Feb 21. pii: S1043-6618(15)30158-4. doi: 10.1016/j.phrs.2016.02.017. [Epub ahead of print] IF 4,8\n[1] Artemisinin derivatives induce iron-dependent cell death (ferroptosis) in tumor cells. Ooko E, Saeed M, Kadioglu O, Sarvi S, Colak M, Elmasaoudi K, Janah R, Greten HJ, Efferth T, Phytomedicine 22 (2015) 1045-1054. doi: 10.1016/j.phymed.2015.08.002. Epub 2015 Aug 18\n[1] Quantitative structure-activity relationship and molecular docking of artemisinin derivatives to vascular endothelial growth factor receptor 1. Saeed ME,\n[Kadioglu O](http://www.ncbi.nlm.nih.gov/pubmed/?term=Kadioglu%20O%5BAuthor%5D&cauthor=true&cauthor_uid=25862844), [Seo EJ](http://www.ncbi.nlm.nih.gov/pubmed/?term=Seo%20EJ%5BAuthor%5D&cauthor=true&cauthor_uid=25862844), Greten HJ, [Brenk R](http://www.ncbi.nlm.nih.gov/pubmed/?term=Brenk%20R%5BAuthor%5D&cauthor=true&cauthor_uid=25862844), Efferth T, Anticancer Res. 2015 Apr;35(4):1929-34\n[1] A drug repurposing approach for individualized cancer therapy based on transcriptome sequencing and virtual drug screening. Kadioglu O, Bahramimehr F, Dawood M, Mahmoud N, Elbadawi M, Lu X, B\u00fclb\u00fcl Y, Schulz JA, Kr\u00e4mer L, Urschel MK, K\u00fcnzli Z, Abdulrahman L, Aboumaachar F, Kadalo L, Nguyen LV, Shaidaei S, Thaher N, Walter K, Besler KC, Spuller A, Munder M, Greten HJ, Efferth T, Comp. Bio. Med. 2023, doi.org/10.1016/j.compbiomed.2023.106781\n[1] Drug repurposing using transcriptome sequencing and virtual drug screening in a patient with glioblastoma.\n[Saeed](https://pubmed.ncbi.nlm.nih.gov/?sort=date&term=Saeed+MEM&cauthor_id=33313992) MEM, Kadioglu O, Greten HJ, Yildirim A, Mayr K, Wenz F, Giordano FA, Efferth T. Invest New Drugs. 2020 Dec 12. doi: 10.1007/s10637-020-01037-7. Online ahead of print.\n[1] Repurposing of bromocriptine for cancer therapy. Seo EJ, Sugimoto Y, Greten HJ, Efferth T. Front. Pharmacol. 08 Oct 2018, doi: 10.3389/fphar.2018.01030. PMID 30349477\n[1] A Method to Determine Agents for Personalized Use. Johannes Greten, Patentanmeldung beim Europaischen Patentamt sowie in den USA und China 2022\n[1] Differential Effect of Rhizoma Coptidis and its Main Alkaloid Compound Berberine on TNF-a Induced NFkB Translocation in Human Keratinocytes. Enk R, Ehehalt R, Graham JE, Bierhaus A, Remppis A, Greten HJ, Journal of Ethnopharmacology 109 (2007) 170 \u2013 175\n[1] Rhizoma Coptidis Inhibits LPS-induced MCP-1/CCL2 Production in Murine Macrophages via an AP-1 and NFkB-Dependent Pathway. Remppis A, Bea F, Greten HJ, Buttler, A, Wang H, Zhou Q, Preusch MR, Enk R, Ehehalt R, Katus HA, Blessing E, Mediators Inflamm. 2010:194896. Epub 2010 Jun 21 (IF 4,774)\n[1] Evaluation of Quality of Life in Patients Treated with Traditional Chinese Medicine. Sertel S, Greten HJ, Kraemer HJ, Efferth T, Plinkert PK, Baumann I, Open Otorhinolaryngol J, 2010,4, 62-67\n[1] Molecular Determinants of the Response of Tumor Cells to Boswellic Acids. Eichhorn T, Greten HJ, Efferth T. Pharmaceuticals 2011, 4(8), 1171-1182\n[1] Self-medication with nutritional supplements and herbal over-the-counter products. Eichhorn T, Greten HJ, Efferth T. Nat. Prod. Bioprospect 2011, 1, 62-70\n[1] Anti-Inflammatory and Anti-Cancer Activity of Boswellic Acids from Frankincense (Boswellia serrata Roxb. et Colebr, B. carterii Birdw.). Efferth T, Greten HJ. Forum on Immunopathological Diseases and Therapeutics. 2(4):303-313 (2011)\n[1] Microarray-Based Determinatio.n of Response of Tumor Cells to Cycloshikonin. Efferth T, Greten HJ. Forum on Immunopathological Diseases and Therapeutics. 2(4):315-322 (2011)\n[1] Effects of Scrophularia ningpoensis Hemsl. on inhibition of proliferation, apoptosis induction and NF-kB signaling of immortalized and cancer cell lines. Shen X, Eichhorn T, Greten HJ, Thomas Efferth T. Pharmaceuticals 2012, 5, 189-208\n[1] Traditionelle Chinesische Medizin und Hyperthermie, Vortrag von Henry Johannes Greten auf dem IX. Hyperthermiekongress am 21.09.2019 in Berlin\n[1] Prostata und mehr \u2013 Die Kombination von Hyperthermie und TCM. Vortrag von Henry Johannes Greten auf dem X. Hyperthermiekongress am 02.10.2022 in Berlin\n[1] Effects of Acupuncture on Leucopenia, Neutropenia, NK and B Cells in Cancer Patients: A Randomised Pilot Study. Pais, I, Correia N, Pimentel I, Teles MJ, Neves E, Vasconcelos J, Guimar\u00e3es J, Azevedo N, Moreira Pinto A, Machado J, Efferth T, Greten HJ. Evid Based Complement Alternat Med June 2014 (IF 1.722\n[1] Effect of Acupuncture on Exercise Tolerance in Heart Failure Patients \u2013 A Clinical Research Protocol (Efeito da Acupunctura na toler\u00e2ncia ao exerc\u00edcio em doentes com insufici\u00eancia card\u00edaca \u2013 Projecto de investiga\u00e7\u00e3o). Eduardo Capit\u00e3o 2010, Masterarbeit an der Universit\u00e4t Porto\n[1] Effect of Acupuncture in heart rate variability and non-invasive hemodynamic parameters in patients with heart failure \u2013 A clinical research protocol. Nuno Correia 2010, Masterarbeit an der Universit\u00e4t Porto\n[1] Acupuncture Effects on Heart Failure: How to Create Objective Study Designs. Greten HJ, Kick A, Scholz E Fischer, J, Greten T, Brazkiewicz F, Schr\u00f6der S, Sertel S, Wendt I, Goncalves M, Karrer O, Remppis A, J. Acupunct. Tuina Sci. (2008) 6(5): 307-308\n[1] Effects of Acupuncture on Physical Tolerance Exercise in COPD Patients \u2013 A Controlled, Randomised Double-Blind Study. (Efic\u00e1cia da Acupunctura na Toler\u00e2ncia ao Exerc\u00edcio em Pacientes com DPOC \u2013 Estudo Controlado, Randomizado, Duplo Cego). Carla Barros 2018, Materarbeit an der Universit\u00e4t Porto\n[1] Acupuncture for Nasal Congestion: A Prospective, Randomized, Double Blind, Placebo-Controlled Clinical Study. Sertel S, Bergmann Z, Ratzlaff K, Baumann I; Greten HJ, Plinkert PK,. Am J Rhinol Allergy. 2009, 23(6\n[1] Effectiveness of Acupuncture in the Treatment of Menstrual Migraine According to the Heidelberg Model (Efic\u00e1cia da Acupunctura no tratamento da enxaqueca menstrual segundo o Modelo de Heidelberg), Joana Figeuerido 2010, Materarbeit an der Universit\u00e4t Porto\n[1] Qigong for the Mental Health of Teachers \u2013 A Prospective Randomized Controlled Trial. Goncalves M, Oliveira R, Rodrigues J, Ventura C, Machado J, Greten HJ, Brain Behav Immun 2023, doi.org/10.1016/j.bbii.2023.100018\n[1] Can Qigong Be a Tool to Assist Students in Handling COVID-19\u2019s Resulting Academic Stress? Goncalves M, Duarte L, Rodrigues J, Greten HJ, Machado J. Healthcare 2023, doi.org/10.3390/healthcare11030307\n[1] Qigong in Perceptual Auditory Attention: Tool to Improve Sound Integration in Autism Spectrum Disorders. Lopes L, Matos LC, Gon\u00e7alves M, Ramos B, Santos MJ, Machado J, Greten HJ, Adv Mid Body Med 2022:36(3).4-11, PIMD:36308504\n[1] Qigong for the Emotional Exhaustion in Nurses: Implications of a Prospective Randomized Controlled Trial in the COVID-19 Pandemic. Sei\u00e7a A, Gon\u00e7alves M, Magalh\u00e3es J, Machado J, Rodrigues J, Greten HJ. Altern Ther Health Med. 2022 online ahead of print. PMID 35951067\n[1] Problems of Scientific Methodology Related to Placebo Control in Qigong Studies: A Systematic Review. Goncavles M, Matos LC, Duarte L, Machado J, Greten HJ, Franconi G. J Bodyw Mov Ther, 2020.\n[https://doi.org/10.1016/j.jbmt.2020.06.035](https://doi.org/10.1016/j.jbmt.2020.06.035)\n[1] Can Qigong improve attention in adolescents? A prospective randomised controlled trial. Duarte L, Gon\u00e7alves M, Mendes P, Matos LC, Greten HJ, Machado J. JP. J Bodyw Mov Ther, May 2019 DOI:\n[https://doi.org/10.1016/j.jbmt.2019.05.005](https://doi.org/10.1016/j.jbmt.2019.05.005)\n[1] Changes of Skin Electrical Potential in Acupoints from Ren Mai and Du Mai Conduits During Qigong Practice: Documentation of a Clinical Phenomenon. Matos, CM, Machado J, Greten HJ, Monteiro FJ. J Bodyw Mov Ther, 23 (4), 713-720, Oct 2019, DOI:\n[10.1016/j.jbmt.2019.02.021](https://doi.org/10.1016/j.jbmt.2019.02.021)\n[1] Potential effects of medical QiGong in major depressive disorder: study protocol based on clinical cases.\n[Ponte S, Santos MJ, Paiva C, Laranjeira M, Gon\u00e7alves M, Ramos B, Machado J, Greten HJ. Experimental Pathology and Health Sciences, 2016;8 (2) 41-46 ](http://www.patolex.org/EPHS/revista/201602_files/6%20Sara%20Ponte%20Short%20%202016_1.pdf)\n[1]\n[Efficacy of QiGong on depression: From a systematic literature review to the proposal of a study protocol](http://www.patolex.org/EPHS/revista/201602_files/5%20Pedro%20Oliveira%20-%20Depression%202016.pdf). Pereira P, Santos MJ, Laranjeira M, Gon\u00e7alves M, Greten HJ, Machado J. Experimental Pathology and Health Sciences, 2016;8 (2) 35-40\n[1] The effect of QiGong in natural killer cells in colo-rectal cancer patients undergoing chemotherapy \u2013 A protocol study.\n[Costa, S, Pais I, Ara\u00fajo A, Gon\u00e7alves M, Santos MJ, Greten HJ, Machado ](http://www.patolex.org/EPHS/revista/201602_files/7%20Sara%20Costa%20-Short%202016_1.pdf)J. Experimental Pathology and Health Sciences, 2016;8 (2) 47-54\n[1] The effect of QiGong on Attention: Deficit-Hyperactivity Disorder (ADHD): Clinical Case Report.\n[Correia MC, Greten HJ, Machado J, Gon\u00e7alves ](http://www.patolex.org/EPHS/revista/201602_files/4%20Marta%20Correia%20%20Short%202016_1.pdf)M. Experimental Pathology and Health Sciences, 2016;8 (2) 29-34\n[1] Qigong as a Traditional Vegetative Biofeedback Therapy: Long-Term Conditioning of Physiological Mind-Body Effects. Matos LC, Sousa CM, Goncalves M, Gabriel J, Machado J, Greten HJ, BioMed Research International, vol. 2015, Article ID 531789, 6 p. 2015. doi:10.1155/2015/531789\n[1] Qigong Therapy in Physiotherapists in Burnout \u2013 A Preliminary Study. Saganha JP, Doenitz CA, Greten T, Efferth T, Greten HJ, 2012, JCIM 2012; 10(11): 1233-9\n[1] Effects of qigong on performance-related anxiety and physiological stress functions in transverse flute music schoolchildren \u2013 A Feasibility Study. Sousa CM, Gon\u00e7alves M, Machado J, Efferth T, Greten T, Froeschen P, Greten HJ. JCIM 2012; 10(8):858-65\n[1] Assessment of Qigong-Related effects by Infrared Thermography: A Case Study. Matos LC, Gon\u00e7alves M, Machado J, Greten HJ. JCIM 2012; 10(6):663-666\n[1] Qigong in Perceptual Auditory Attention: Tool to Improve Sound Integration in Autism Spectrum Disord.ers. Lopes L, Matos LC, Gon\u00e7alves M, Ramos B, Santos MJ, Machado J, Greten, HJ. Adv Mind Body Med 2022;36(3):4-11. PIMD:36308504\n[1] The Prevalence of Playing-Related Musculoskeletal Disorders (PRMSD) Among Professional Orchestra Players. Sousa CM, Greten HJ, Machado J, Coimbra D, Revista M\u00fasica Hodie,V.14, n.2. 2014\nLiebe \u00c4rzte & Therapeuten\nSehr geehrte \u00c4rzte und Therapeuten,\nherzlich willkommen bei der Deutschen Gesellschaft f\u00fcr Traditionelle Chinesische Medizin (DGTCM). Als f\u00fchrende Organisation f\u00fcr TCM in Deutschland setzen wir uns f\u00fcr die F\u00f6rderung, Forschung und Verbreitung der Traditionellen Chinesischen Medizin ein. Wir freuen uns, Sie als Fachleute in unserem Netzwerk begr\u00fc\u00dfen zu d\u00fcrfen und m\u00f6chten Ihnen hier einige wichtige Informationen \u00fcber die DGTCM und die Vorteile einer Mitgliedschaft f\u00fcr \u00c4rzte und Therapeuten geben.\nUnsere Mission und Ziele: Die DGTCM hat es sich zur Aufgabe gemacht, die Traditionelle Chinesische Medizin in Deutschland auf einer soliden wissenschaftlichen Grundlage zu f\u00f6rdern und zu verbreiten. Unsere Ziele sind:\n- F\u00f6rderung des fachlichen Austauschs: Als Mitglied der DGTCM erhalten Sie Zugang zu einem interdisziplin\u00e4ren Netzwerk von \u00c4rzten, Therapeuten und Forschern. Sie haben die M\u00f6glichkeit, Ihr Wissen zu erweitern und sich mit Experten aus verschiedenen Fachrichtungen auszutauschen.\n- Fortbildungsangebote: Wir organisieren regelm\u00e4\u00dfig Fortbildungsveranstaltungen, Workshops und Kongresse, bei denen Sie Ihr Wissen \u00fcber die TCM vertiefen k\u00f6nnen. Diese Veranstaltungen bieten eine fundierte Grundlage f\u00fcr eine qualitativ hochwertige TCM-Praxis.\n- Unterst\u00fctzung von Forschung und wissenschaftlichen Projekten: Die DGTCM f\u00f6rdert wissenschaftliche Forschung im Bereich der TCM. Als Mitglied haben Sie die M\u00f6glichkeit, an laufenden Forschungsprojekten teilzunehmen und die Entwicklung der TCM aktiv mitzugestalten.\n- Integration der TCM in das Gesundheitssystem: Wir setzen uns daf\u00fcr ein, die TCM als erg\u00e4nzende Therapieform in das deutsche Gesundheitssystem zu integrieren. Als Mitglied der DGTCM tragen Sie dazu bei, die TCM als wertvolle Option f\u00fcr Ihre Patienten zu etablieren.\nVorteile einer Mitgliedschaft: Als Mitglied der DGTCM profitieren Sie von zahlreichen Vorteilen, darunter:\n- Verg\u00fcnstigte Teilnahmegeb\u00fchren f\u00fcr Fortbildungsveranstaltungen und Kongresse\n- Zugang zu aktuellen Forschungsergebnissen und Fachpublikationen\n- Networking-M\u00f6glichkeiten mit Kollegen aus der TCM-Community\n- Unterst\u00fctzung und Beratung durch erfahrene TCM-Experten\nWir hei\u00dfen Sie herzlich willkommen, Teil unserer Gemeinschaft zu werden. Zusammen k\u00f6nnen wir die TCM in Deutschland weiterentwickeln und sie als wertvolle Erg\u00e4nzung zur Schulmedizin etablieren.\nSchlie\u00dfen Sie sich der Deutschen Gesellschaft f\u00fcr Traditionelle Chinesische Medizin an und werden Sie Teil eines dynamischen Netzwerks von TCM-Fachleuten.\nF\u00fcr weitere Informationen und zur Mitgliedschaftsanmeldung besuchen Sie bitte unsere Website:\n[www.dgtcm.de](http://www.dgtcm.de/).\nBei Fragen stehen wir Ihnen gerne zur Verf\u00fcgung. Wir freuen uns darauf, Sie in der DGTCM willkommen zu hei\u00dfen!\nMit freundlichen Gr\u00fc\u00dfen, Ihr DGTCM-Team\nKonzept\nBeim Lernen einer neuen Methode ist es wie beim Zukn\u00f6pfen einer Weste: Wenn man mit dem falschen Knopf beginnt, dauert das Ganze doppelt so lang. Deshalb ist es besonders wichtig, dass die Bausteine des Lernens eine gute Basis vermitteln, denn Spa\u00df am eigenen Handeln braucht Erfolg. Und Erfolg, da sind wir ganz sicher, ist systematisch planbar, kommt von ganz allein, wenn wir gemeinsam das Richtige tun, und Du wirst es schon wissen, das Gegenteil von das Richtige tun, ist das Beste wollen.\nHier wollen wir uns abheben von dem langweiligen Auswendiglernen und platter Asiaphilosophie. Durch das Heidelberger Modell ist es gelungen, alle Kernbegriffe der Chinesischen Medizin in die westliche Physiologie zu \u00fcbersetzen. Das f\u00fchrt zu einem akademisch ansprechenderen Niveau und vor allem dazu, dass die Chinesische Medizin mit der westlichen Medizin perfekt kombinierbar wird.\nAls einzige Fachgesellschaft in Deutschland folgen wir dem international standardisierten Curriculum, dem auch der erste Masterstudiengang in Europa entspricht.\nDas Wichtigste an der Medizin ist und bleibt die Diagnose. Hier lernen Sie eine schl\u00fcssige neue Diagnose, die Ihnen hilft, die verschiedenen Methoden der Chinesischen Medizin sinnvoll einzusetzen. Wir haben seit 20 Jahren immer wieder in wissenschaftlichen Studien zeigen k\u00f6nnen: Mit der funktionellen chinesischen Diagnose ist die Therapie wesentlich erfolgreicher als mit der \u201ewestlichen Schema-Akupunktur\u201c Das gilt auch f\u00fcr die anderen Methoden der Chinesischen Medizin.\nDas Baukastenprinzip erlaubt den westlichen \u00c4rzten, zun\u00e4chst mit dem Akupunkturcurriculum zu beginnen. Es erf\u00fcllt sowohl die Standards des Mustercurriculums der \u00c4rztekammern als auch h\u00f6here Ma\u00dfst\u00e4be, die f\u00fcr den intelligenten Einsteiger und professionellen Nutzer der Methoden unentbehrlich sind.\nJedes der F\u00e4cher hat ein eigenes modulares Curriculum. Dabei k\u00f6nnen Sie die Module aus den Einf\u00fchrungskursen f\u00fcr alle weiteren Ausbildungsg\u00e4nge nutzen. Weil alles gut ineinanderpasst, lernen Sie schneller, sparen viel Zeit und schonen nat\u00fcrlich auch ihren Geldbeutel.", "language": null, "image": null, "pagetype": "article", "links": ["https://dgtcm.de/home/", "https://dgtcm.de/ausbildungskonzept/", "https://dgtcm.de/mitglied-werden/", "https://dgtcm.de/kurskalender/", "https://dgtcm.de/dgtcm_heidelberg/", "", "", "", "#_edn1", "mailto:info@dgtcm.de", "#_ednref18", "http://www.patolex.org/EPHS/revista/201602_files/21%20criado%20mb.pdf", "http://dx.doi.org/10.1016/j.clnesp.2022.06.083", "http://dx.doi.org/10.1016/j.clnesp.2022.06.052", "https://www.sciencedirect.com/science/article/pii/S1876382018302919?via%3Dihub#!", "https://www.sciencedirect.com/science/article/pii/S1876382018302919?via%3Dihub#!", "https://www.sciencedirect.com/science/article/pii/S1876382018302919?via%3Dihub#!", "https://www.sciencedirect.com/science/article/pii/S1876382018302919?via%3Dihub#!", "https://www.sciencedirect.com/science/article/pii/S1876382018302919?via%3Dihub#!", "https://www.sciencedirect.com/science/journal/18763820", "http://www.patolex.org/EPHS/revista/201602_files/14%20Diana%20Miranda%20-%202%20Short%202016_1.pdf", "http://www.patolex.org/EPHS/revista/201602_files/20%20marco%20fernandes_1.pdf", "https://doi.org/10.1016/j.phymed.2022.154294", "https://www.ncbi.nlm.nih.gov/pubmed/29653569", "http://www.patolex.org/EPHS/revista/201602_files/7%20Sara%20Costa%20-Short%202016_1.pdf", "http://www.ncbi.nlm.nih.gov/pubmed/?term=antischistosomal+efferth+greten", "http://www.ncbi.nlm.nih.gov/pubmed/?term=Kadioglu%20O%5BAuthor%5D&cauthor=true&cauthor_uid=25862844", "http://www.ncbi.nlm.nih.gov/pubmed/?term=Seo%20EJ%5BAuthor%5D&cauthor=true&cauthor_uid=25862844", "http://www.ncbi.nlm.nih.gov/pubmed/?term=Brenk%20R%5BAuthor%5D&cauthor=true&cauthor_uid=25862844", "https://pubmed.ncbi.nlm.nih.gov/?sort=date&term=Saeed+MEM&cauthor_id=33313992", "https://doi.org/10.1016/j.jbmt.2020.06.035", "https://doi.org/10.1016/j.jbmt.2019.05.005", "https://doi.org/10.1016/j.jbmt.2019.02.021", "http://www.patolex.org/EPHS/revista/201602_files/6%20Sara%20Ponte%20Short%20%202016_1.pdf", "http://www.patolex.org/EPHS/revista/201602_files/5%20Pedro%20Oliveira%20-%20Depression%202016.pdf", "http://www.patolex.org/EPHS/revista/201602_files/7%20Sara%20Costa%20-Short%202016_1.pdf", "http://www.patolex.org/EPHS/revista/201602_files/4%20Marta%20Correia%20%20Short%202016_1.pdf", "#materials", "http://www.dgtcm.de/", "#materials", "https://dgtcm.de/ausbildungskonzept/#Kursprogramm", "#materials", "https://dgtcm.de/ausbildungskonzept/#Kursprogramm", "https://dgtcm.de/impressum/", "https://dgtcm.de/impressum-2/", "mailto:info@dgtcm.de", "https://wordpress.org/plugins/gdpr-cookie-compliance/"]}