{"title": "Die Sache mit den Masken", "author": "Eva Novak", "url": "https://www.republik.ch/2020/04/06/die-sache-mit-den-masken", "hostname": "republik.ch", "description": "Sollten Sie draussen eine tragen? Oder ist alles bloss ein Hype? Der Stand der Debatte \u2013 und wie Sie mit diesem Wirrwarr umgehen k\u00f6nnen.", "sitename": "Republik", "date": "2020-04-06", "id": null, "license": null, "body": null, "comments": "", "commentsbody": null, "raw_text": null, "text": "Die Sache mit den Masken\nMehrere L\u00e4nder Europas schreiben ihren B\u00fcrgern vor, sich mit Hygienemasken vor dem Coronavirus zu sch\u00fctzen. Die Schweiz r\u00e4t davon ab. Wie Sie mit diesem Wirrwarr umgehen k\u00f6nnen.\nVon\n[Eva Novak](/~c09e2411-cf3b-434b-8a23-c1146ed6181e), 06.04.2020\nJournalismus, der Ihnen hilft, Entscheidungen zu treffen. Und der das Gemeinsame st\u00e4rkt: die Freiheit, den Rechtsstaat, die Demokratie. Lernen Sie uns jetzt 21 Tage lang kostenlos und unverbindlich kennen:\nGesundheitspolitiker rund um die Welt sind sich gerade ziemlich uneinig, ob man die Bev\u00f6lkerung dazu anhalten sollte, Gesichtsmasken zu tragen.\nGesunden Menschen n\u00fctze es nichts, Masken zu tragen, betont auf der einen Seite die Weltgesundheitsorganisation (WHO). Sich auf diese Weise vor dem Coronavirus zu sch\u00fctzen, ergebe nur f\u00fcr die Pflege und die Behandlung von Erkrankten Sinn.\nDie Schweiz ist Sitzstaat der WHO, und sie folgt dieser Empfehlung. Daniel Koch, Delegierter des Bundesamts f\u00fcr Gesundheit (BAG) f\u00fcr Covid-19, beantwortet Journalistenfragen dazu stets im selben Sinne. \u00abNach wie vor gibt es keine gesicherte Evidenz, dass das Maskentragen in der \u00d6ffentlichkeit wirklich einen gr\u00f6sseren Schutzfaktor darstellt\u00bb, sagte der Corona-Spitzenbeamte etwa vor einer Woche.\nAuf der anderen Seite gab der \u00f6sterreichische Bundeskanzler Sebastian Kurz seinen Landsleuten \u2013 ebenfalls vor einer Woche \u2013 die Anweisung, L\u00e4den nur noch mit einer Maske zu betreten. Wenige Tage zuvor war in der renommierten Wissenschaftszeitschrift \u00abScience\u00bb\n[ein Interview mit George Gao](https://www.sciencemag.org/news/2020/03/not-wearing-masks-protect-against-coronavirus-big-mistake-top-chinese-scientist-says), dem Virologen und Direktor des chinesischen Zentrums f\u00fcr Kontrolle und Pr\u00e4vention von Krankheiten, erschienen. Sein Befund: \u00abDer grosse Fehler, den Europa und die USA machen, ist, dass die Leute keine Masken tragen.\u00bb\nWer hat recht? Sind Gesichtsmasken wirklich n\u00f6tig, um die Epidemie in den Griff zu kriegen? Braucht es auch in der Schweiz eine Tragepflicht?\n1. Was andere L\u00e4nder tun\nMit ihrem Kurswechsel ist die \u00f6sterreichische Politik im Trend. Noch vor kurzem hatte das dortige Gesundheitsministerium verk\u00fcndet, das Tragen von Masken in der \u00d6ffentlichkeit bringe nichts. Nun wird es,\n[vorerst in Einkaufsm\u00e4rkten](https://wien.orf.at/stories/3042069/), zur Pflicht. Bereits am 19. M\u00e4rz verbot Tschechien seinen B\u00fcrgerinnen, [das Haus ohne Mund-und-Nasen-Schutz zu verlassen](https://www.denik.cz/z_domova/povinne-rousky-co-hrozi-bez-ni-20200318.html). Eine Woche sp\u00e4ter folgte die Slowakei und [wandelte ihre bestehende Maskentrag-Empfehlung in ein Obligatorium um](https://www.health.gov.sk/Clanok?covid-19-24-3-2020-opatrenia). Einzelne deutsche St\u00e4dte [haben ebenfalls eine Tragepflicht angek\u00fcndigt](https://www.mdr.de/thueringen/ost-thueringen/jena/corona-virus-mundschutz-masken-100.html) f\u00fcr Bus, Bahn, Supermarkt und \u00fcberall dort, wo Mindestabst\u00e4nde nicht gut eingehalten werden k\u00f6nnen. Und auch der B\u00fcrgermeister der Millionenstadt Los Angeles hat die Bewohner vergangene Woche angewiesen, nur noch mit Maske aus dem Haus zu gehen. Am Wochenende [folgte die US-Gesundheitsbeh\u00f6rde CDC](https://www.theverge.com/2020/4/3/21206044/masks-cloth-coronavirus-cdc-recommendation-guidelines-wear-spread-prevent-covid-19) und empfahl dem ganzen Land, in der \u00d6ffentlichkeit Mund und Nase mit einer einfachen Stoffmaske abzudecken.\nL\u00e4nder im Fernen Osten, in denen die Bev\u00f6lkerung seit Beginn der Pandemie Maske tr\u00e4gt, haben es geschafft, die Ausbreitung besser als alle anderen unter Kontrolle zu bringen:\n[Singapur, S\u00fcdkorea, Taiwan und allen voran China](https://www.statnews.com/2020/03/20/understanding-what-works-how-some-countries-are-beating-back-the-coronavirus/).\nDies nicht mit den Masken allein,\n[sondern mithilfe einer Reihe weiterer, teils drakonischer Massnahmen](https://www.theguardian.com/world/2020/mar/19/chinas-coronavirus-lockdown-strategy-brutal-but-effective). Welche Massnahme wie viel bewirkt hat, [kann niemand exakt beziffern](https://www.marketwatch.com/story/what-we-can-learn-from-south-korea-and-singapores-efforts-to-stop-coronavirus-in-addition-to-wearing-face-masks-2020-03-31). Eine Garantie sind Gesichtsmasken nicht: Japan, wo das Tragen verbreitet ist, aber bislang kein Lockdown ausgesprochen wurde, [hat M\u00fche, die Epidemie einzugrenzen](https://time.com/5813619/japan-coronavirus-lockdown/). Und auch in Singapur \u2013 lange ein leuchtendes Beispiel f\u00fcr die erfolgreiche Eind\u00e4mmung \u2013 stiegen zuletzt die Fallzahlen, wenn auch auf tiefem Niveau. [Schulen und Gesch\u00e4fte, die keine lebensnotwendigen G\u00fcter verkaufen, werden nun geschlossen](https://mainichi.jp/english/articles/20200403/p2g/00m/0in/092000c).\nUmgekehrt hat es bis heute kein Land ohne Masken geschafft,\n[die Ansteckungen nachhaltig in den Griff zu bekommen](https://www.ft.com/coronavirus-latest).\nAsiatische L\u00e4nder pflegen ein unverkrampftes Verh\u00e4ltnis zu Gesichtsmasken. In der Grippesaison geht kaum einer ohne aus dem Haus. Vor allem aber haben die meisten dieser L\u00e4nder ihre Lehren aus der Sars-Pandemie gezogen, die sie 2003 schlimmer getroffen hat als Europa und die USA. Zu diesem Schluss kommt\n[eine Studie der medizinischen Fachzeitschrift \u00abJournal of the American Medical Association\u00bb (Jama) am Beispiel Taiwans](https://jamanetwork.com/journals/jama/fullarticle/2762689?resultClick=1 ).\nWegen der N\u00e4he zum chinesischen Festland \u2013 \u00fcber 1 Million Taiwanesen leben oder arbeiten in China, weit \u00fcber 2,5 Millionen Besucher j\u00e4hrlich reisen von China nach Taiwan \u2013 wurden im Inselstaat eigentlich sehr viele Covid-19-Erkrankungen erwartet.\n[Doch aktuell sind nur gut 350 F\u00e4lle bekannt](https://coronavirus.jhu.edu/map.html), viel weniger als in der deutlich weniger dicht bev\u00f6lkerten Schweiz.\nDie Autoren der Jama-Studie erkl\u00e4ren das mit dem raschen und effizienten Krisenmanagement, das auch die Kontrolle und die Zuweisung von Ressourcen einschliesslich Masken umfasst.\n[Die Produktion wurde mit staatlichen Mitteln und mithilfe von 1800 Soldaten stufenweise auf \u00fcber 5 Millionen St\u00fcck pro Tag hochgefahren](https://www.institutmontaigne.org/en/blog/fighting-coronavirus-pandemic-east-asian-responses-taiwan-swift-meticulous). Gleichzeitig wurden die Preise der Masken staatlich festgesetzt (und mit zunehmender Produktion nach und nach gesenkt). F\u00fcrs Hamstern von Masken drohen hohe Bussen und Gef\u00e4ngnisstrafen zwischen 1 und 7 Jahren. 2. Was die Experten sagen\nNicht nur die Politik, auch die Fachwelt streitet \u00fcber Masken.\n[Am deutschen Fernsehen sogar zur Hauptsendezeit](https://www.welt.de/wissenschaft/article206588145/Streit-unter-Virologen-Ich-kann-nur-sagen-Alexander-Kekule-vertritt-eine-Aussenseiterposition.html): Da spricht sich erst der Epidemiologe Alexander Kekul\u00e9 f\u00fcr Gesichtsmasken aus \u2013 und sagt, dass diese zumindest einen Teil der Ansteckungen verhindern. Wenig sp\u00e4ter folgt Virologe Jonas Schmidt-Chanasit und sagt, Masken seien in asiatischen Megacitys n\u00fctzlich, aber nicht in unseren Breitengraden, wo die Menschen weniger dicht gedr\u00e4ngt leben.\nDie WHO ist auf der skeptischen Seite. Sie schreibt in ihren Empfehlungen,\n[gesunden Tr\u00e4gern biete die Maske keinen Schutz](https://www.who.int/docs/default-source/documents/advice-on-the-use-of-masks-2019-ncov.pdf) (\u00abA medical mask is not required for people who are not sick as there is no evidence of its usefulness in protecting them\u00bb), \u00c4rzten und Pflegepersonal hingegen biete die Maske Schutz (\u00abHealth care workers should wear a medical mask when entering a room where patients with suspected or confirmed Covid-19 are admitted\u00bb).\nDas BAG empfiehlt ebenfalls nur den Kranken, eine Maske zu tragen.\nDem gegen\u00fcber stehen zahlreiche Studien. Sie zeigen, dass Masken generell zum Schutz vor Atemwegserkrankungen beitragen.\n[Eine Zusammenfassung von 67 solcher Studien hat das Forschungsnetzwerk Cochrane 2011 publiziert](https://www.cochranelibrary.com/cdsr/doi/10.1002/14651858.CD006207.pub4/full?highlight). Die Metastudie kommt zum Schluss, dass die Kombination von erstens regelm\u00e4ssigem H\u00e4ndewaschen oder Desinfizieren, zweitens dem Tragen von Handschuhen und Masken sowie drittens der Diagnose und der Isolation von Verd\u00e4chtigen den besten Schutz vor Viren biete, die die Atemwege angreifen. Schon einfache Hygienemasken helfen gegen die \u00dcbertragung von Coronaviren, [best\u00e4tigt auch eine neue Studie in der Zeitschrit \u00abNature\u00bb](https://www.nature.com/articles/s41591-020-0843-2).\n\u00abDass Masken die \u00dcbertragung des Virus bremsen k\u00f6nnen, ist aus wissenschaftlicher Sicht eigentlich klar\u00bb,\n[sagt der Epidemiologe Marcel Salath\u00e9 von der EPF in Lausanne in einem Interview mit der NZZ](https://www.nzz.ch/schweiz/epidemiologe-marcel-salathe-wie-weiter-nach-dem-lockdown-ld.1549246). Klar d\u00fcrfe man sich nicht der Illusion hingeben, eine OP-Maske biete den perfekten Schutz. \u00abAber allein die Tatsache, dass ich mir weniger an Mund und Nase fasse, wenn ich eine Maske trage, verringert das Ansteckungsrisiko.\u00bb\nEin Hauptargument f\u00fcr Masken ist, dass viele Infizierte sich nicht bewusst sind, dass sie das Coronavirus in sich tragen. Dies, weil sie entweder keine Covid-19-Symptome entwickeln oder w\u00e4hrend der Inkubationszeit noch keine versp\u00fcren. W\u00e4hrend dieser Phase, die bis 14 Tage dauern kann, verringern Masken das Risiko, dass weitere Personen angesteckt werden. Denn es gilt inzwischen als erwiesen,\n[dass Infizierte auch ohne Symptome hoch ansteckend sein k\u00f6nnen](https://www.nature.com/articles/d41586-020-00822-x#ref-CR4). \u00abWenn alle eine Maske tragen, tragen auch die Kranken eine\u00bb, [bringt es Epidemiologe Kekul\u00e9 auf den Punkt](https://www.tagesanzeiger.ch/sonntagszeitung/warum-wir-allemasken-tragen-sollten/story/13936842).\nHygienemasken \u00abbilden eine n\u00fctzliche Barriere gegen die Verbreitung und die Aufnahme von Coronaviren\u00bb, sagt auch der Zuger Mediziner Andr\u00e9 Ochsenbein. Er hat mit weiteren Zentralschweizer Augen\u00e4rzten\n[einen Aufruf an die Bev\u00f6lkerung verfasst](https://www.scribd.com/document/454446850/Aufruf-Zentralschweiz-Corona). Die \u00c4rzte weisen darauf hin, dass die Corona-Erreger haupts\u00e4chlich durch Tr\u00f6pfchen \u00fcbertragen werden. Prim\u00e4r k\u00f6nnten Virentr\u00e4ger mit Hygienemasken die Umwelt sch\u00fctzen. Doch auch f\u00fcr Gesunde b\u00f6ten sie einen gewissen Schutz.\nVor noch nicht allzu langer Zeit sah es das BAG noch \u00e4hnlich.\n[Im aktuellen Pandemieplan aus dem Jahr 2018](https://www.bag.admin.ch/bag/de/home/das-bag/publikationen/broschueren/publikationen-uebertragbare-krankheiten/pandemieplan-2018.html), in dem Strategien und Massnahmen zur Vorbereitung einer Grippepandemie aufgef\u00fchrt sind, steht: \u00abSchutzmasken verringern das \u00dcbertragungsrisiko\u00bb, und durch die einfacheren Hygienemasken \u00abreduziert sich das allgemeine Infektionsrisiko\u00bb. Dies gelte auch f\u00fcr das Coronavirus, sagt Huldrych G\u00fcnthard, stellvertretender Direktor der Klinik f\u00fcr Infektionskrankheiten und Spitalhygiene am Universit\u00e4tsspital Z\u00fcrich. Die \u00dcbertragungswege der beiden Viren seien praktisch dieselben.\nAuf dem Campus des Unispitals Z\u00fcrich gilt generell eine Maskenpflicht. Dies als Vorsichtsmassnahme gegen Ansteckungen durch Virustr\u00e4ger, die keine Symptome aufweisen. \u00abWenn man weiss, dass man mit einem Covid-Patienten in Kontakt ist, steckt man sich nicht an, da man sich entsprechend sch\u00fctzt\u00bb, sagte Peter Steiger, stellvertretender Direktor des Instituts f\u00fcr Intensivmedizin, diese Woche an einer Pressekonferenz. Viel gef\u00e4hrlicher seien Kontakte mit Personen, von denen man nicht wisse, ob sie angesteckt sind \u2013 und bei denen man daher den Abstand nicht einhalte oder keine Maske trage.\nEin h\u00e4ufiges Argument gegen eine Maskenpflicht ist, dass viele Menschen nicht w\u00fcssten, wie man mit Hygienemasken umgehen m\u00fcsse \u2013\n[eine falsche Handhabung k\u00f6nne das Risiko sogar erh\u00f6hen](https://edition.cnn.com/2020/03/30/world/coronavirus-who-masks-recommendation-trnd/index.html). Ein weiteres Argument, das vom BAG seit Beginn der Krise ins Feld gef\u00fchrt wird, besagt: Das Tragen einer Maske k\u00f6nnte die Leute dazu verleiten, den gebotenen Abstand zu anderen, das social distancing, weniger konsequent einzuhalten. Diese Sichtweise wird von manchen Fachleuten kritisiert: Man sei schliesslich auch nicht gegen die Gurtenpflicht, [weil sie Autofahrer zu riskanterem Fahren verleiten k\u00f6nnte](https://www.washingtonpost.com/outlook/2020/03/28/masks-all-coronavirus/). 3. Um welche Masken es geht\n\u00abHolt eure Hygienemasken aus dem Keller\u00bb,\n[appellieren die Zentralschweizer \u00c4rzte an die Bev\u00f6lkerung](https://www.scribd.com/document/454449344/Medienmitteilung). Tats\u00e4chlich lagern in vielen Schweizer Kellern und Estrichen Kisten mit Masken aus der Zeit der Vogelgrippe- und der Schweinegrippe-Pandemie von 2007 und 2009, als das BAG die Anschaffung noch offiziell empfahl und viele Arbeitgeber und Konsumenten pflichtbewusst der Aufforderung folgten. \u00abMasken f\u00fcr die Bev\u00f6lkerung im Pandemiefall gem\u00e4ss Empfehlung BAG\u00bb steht darauf.\nIn den Kisten sind einfache Hygienemasken, die auch chirurgische Masken oder OP-Masken genannt werden. Diese sch\u00fctzen vor Tr\u00f6pfchen und werden auch vom Gesundheitspersonal zur Pflege von Corona-Patienten verwendet. Voraussetzung ist allerdings,\n[dass sie korrekt angewendet werden](https://www.who.int/emergencies/diseases/novel-coronavirus-2019/advice-for-public/when-and-how-to-use-masks): Beim An- und Ausziehen sind die H\u00e4nde zu waschen oder zu desinfizieren, und w\u00e4hrend des Tragens gilt: H\u00e4nde weg von der Maske.\nGr\u00f6sseren Schutz bieten die sogenannten Atemschutzmasken vom Typ FFP2 oder FFP3, die auch feinste in der Luft schwebende Teilchen \u2013 sogenannte Aerosole \u2013 abhalten, jedoch nur f\u00fcr besonders anspruchsvolle medizinische Eingriffe an Corona-Patienten verwendet werden.\n[Wie gross ihr Mehrwert gegen\u00fcber einfachen Hygienemasken ist, ist allerdings umstritten](https://www.lungenaerzte-im-netz.de/news-archiv/meldung/article/teure-atemschutzmaske-schuetzt-nicht-besser-vor-grippe-als-einfacher-mundschutze/).\nDar\u00fcber hinaus gibt es Masken nach dem Prinzip \u00abdo it yourself\u00bb. Diese selbst gen\u00e4hten oder gebastelten Masken sch\u00fctzen nicht ganz so stark wie gekaufte. Aber sie sch\u00fctzen. Das ist insofern von Bedeutung, als es nicht m\u00f6glich ist, bis auf die Kommastelle genau anzugeben, wie gut Masken generell vor einer Corona-Infektion sch\u00fctzen \u2013 das Ausmass des Schutzes h\u00e4ngt immer auch von der Anwendung und vom lokalen Kontext ab.\nIn manchen L\u00e4ndern setzen die Beh\u00f6rden auf solche Do-it-yourself-Masken. Zum Beispiel hat das Sars-erprobte Hongkong seiner Bev\u00f6lkerung\n[eigens eine Anleitung ins Netz gestellt](https://www.consumer.org.hk/ws_en/news/specials/2020/mask-diy-tips.html). Nach dieser l\u00e4sst sich eine Einfachst-Maske herstellen, welche gem\u00e4ss Labortests 80 bis 90 Prozent des Schutzes einer gekauften Hygienemaske bieten soll. [\u00c4hnlich geht Tschechien vor](https://www.televizeseznam.cz/video/jak-na-to/jak-si-doma-vyrobit-rousku-64037441), wobei hier bereits ein Schal als ausreichender Gesichtsschutz gilt, um sich ohne Busse in der \u00d6ffentlichkeit fortzubewegen.\n\u00dcber die letzten Wochen sind Gesichtsmasken im westlichen Mainstream angekommen. Medienh\u00e4user wie die \u00abNew York Times\u00bb stellen ihren Lesern zurzeit an prominenter Stelle\n[eine Anleitung zum Selbern\u00e4hen](https://www.nytimes.com/article/how-to-make-face-mask-coronavirus.html) bereit. Im deutschsprachigen Raum [hat die Feuerwehr der deutschen Stadt Essen als eine der ersten Institutionen eine Anleitung ins Netz gestellt](https://media.essen.de/media/wwwessende/aemter/0115_1/pressereferat/Mund-Nasen-Schutz__Naehanleitung_2020_Feuerwehr_Essen.pdf). Auch die Kleiderindustrie hat sich ans Werk gemacht. Der Sportschuhhersteller New Balance gab bekannt, [mit der Produktion von Masken zu beginnen](https://www.bostonglobe.com/2020/03/28/sports/new-balance-is-working-manufacture-facial-masks/). Und in der Schweiz verkauft eine Basler Handarbeitslehrerin [selbst gen\u00e4hte Masken an Modebewusste](https://www.basellandschaftlichezeitung.ch/basel/baselbiet/selbstgemachte-schutzmasken-in-liestal-ein-bisschen-schutz-und-lifestyle-in-einem-137566910).\nZur Selbsthilfe greifen mittlerweile auch \u00c4rzte und Zahn\u00e4rzte in der Schweiz. Geht ihr Vorrat zur Neige, lassen sie Masken aus Windeln oder \u00e4hnlichen Stoffen n\u00e4hen. Das geht aus Diskussionen in geschlossenen Onlineforen hervor, welche die Republik eingesehen hat. Oder sie verwenden Hygienemasken mehrfach und kochen sie aus, statt sie wie vorgeschrieben gleich wegzuwerfen. \u00abBei sorgf\u00e4ltiger Behandlung kann eine Maske bis zu 8 Stunden getragen werden \u2013 was bei zwei Einkaufstouren \u00e0 15 Minuten bis zu 16 Wochen entspricht\u00bb, schreiben die Zentralschweizer \u00c4rzte in ihrem Aufruf.\nSelbst gemachte Masken zu tragen, sei besser als gar nichts, finden Forscher wie Sui Huang, ein Schweizer Molekular- und Zellbiologe, der am Institut f\u00fcr Systembiologie bei Seattle forscht. \u00abWir d\u00fcrfen nicht l\u00e4nger zulassen, dass das Perfekte der Feind des Guten bleibt\u00bb,\n[schreibt er in einem Aufsatz](https://medium.com/@Cancerwarrior/covid-19-why-we-should-all-wear-masks-there-is-new-scientific-rationale-280e08ceee71). 4. Woher die Masken kommen\nMehrere deutsche Landespr\u00e4sidenten\n[haben sich gegen eine Maskenpflicht ausgesprochen](https://www.merkur.de/welt/mundschutz-maskenpflicht-coronavirus-schutzmasken-deutschland-soeder-oesterreich-jena-soeder-kretschmann-spahn-tagesthemen-ard-zr-13634528.html) \u2013 weil dadurch eine Knappheit entstehen k\u00f6nnte, die auch den medizinischen Bereich treffen k\u00f6nnte. Auch in der Schweiz spielen diese \u00dcberlegungen eine Rolle. Laut einem BAG-Mitarbeiter, der anonym bleiben will, ist die mangelnde Verf\u00fcgbarkeit der entscheidende Grund f\u00fcr die aktuelle Empfehlung. Das Amt rate der Bev\u00f6lkerung prim\u00e4r wegen dieser mangelhaften Verf\u00fcgbarkeit vom Tragen ab, da sonst f\u00fcr das Gesundheitspersonal nicht gen\u00fcgend Hygienemasken \u00fcbrig bleiben k\u00f6nnten.\nAuch in offiziellen Statements klang bereits \u00c4hnliches an: \u00abIm Moment fordern wir die Bev\u00f6lkerung nicht auf, Masken zu kaufen; weil es ist wirklich ein rares Gut, und die Masken werden im Moment wirklich im professionellen Bereich gebraucht\u00bb, sagte der BAG-Verantwortliche f\u00fcr Covid-19, Daniel Koch,\n[vor zwei Wochen an einer Medienkonferenz](https://www.youtube.com/watch?v=QBdJQC-d5jY).\nMittlerweile hat sich die Situation ein wenig entspannt. F\u00fcr \u00c4rzte und Pflegende, die t\u00e4glich 1 bis 2 Millionen Masken brauchen w\u00fcrden, reiche der Vorrat, erkl\u00e4rte Koch diese Woche. Den Bedarf f\u00fcr die gesamte Bev\u00f6lkerung beziffert eine ETH-Studie auf 300 Millionen Hygienemasken. Diese w\u00fcrden f\u00fcr rund 3 Monate reichen, wie Andreas Bucher, Sprecher des Bundesamts f\u00fcr Bev\u00f6lkerungsschutz (Babs), auf Anfrage sagt.\nWie weit der bestehende Maskenvorrat in der Schweiz reicht, ist unklar. Der Bund verf\u00fcgte am 1. April gem\u00e4ss Bucher \u00fcber rund 10 Millionen Hygienemasken sowie rund 1 Million Schutzmasken. Diese Zahl \u00e4ndert sich allerdings t\u00e4glich, weil ein Teil verbraucht wird und laufend neue geliefert werden. Am Samstag nannte Daniel Koch ein Vielfaches: 90 Millionen Hygienemasken und \u00fcber 4 Millionen Schutzmasken seien auf Lager. Ob das die Best\u00e4nde der Kantone und Spit\u00e4ler umfasst, liess er offen.\nHygienemasken einzukaufen, ist f\u00fcr Letztere zurzeit nicht einfach. Das Universit\u00e4tsspital Z\u00fcrich etwa bezieht einen Teil aus dem Pandemielager des Kantons. In die Schweiz gelangen die Masken zurzeit nach dem folgenden Mechanismus: Die Spit\u00e4ler erheben ihren Bedarf und bestellen Masken bei den Kantonsapothekern, welche die Bestellungen bei der im BAG angesiedelten Sanit\u00e4tskommission des Bundes einreichen, die wiederum die Armeeapotheke mit der Beschaffung beauftragt, welche die Masken dann importiert \u2013 sofern dies aktuell auf dem Markt \u00fcberhaupt m\u00f6glich ist. Immerhin: Die Lieferungen laufen gem\u00e4ss Babs-Sprecher Bucher wieder an.\nDie inl\u00e4ndische Maskenproduktion wurde hingegen, da wenig rentabel, bereits vor Jahren aufgegeben. Nun wird sie wieder hochgefahren. So wurden in China mit Vermittlung von Guy Parmelins Wirtschaftsdepartement zwei Maschinen bestellt,\n[mit denen die St. Galler Hygieneartikelfabrik Flawa AG ab Ostern 80\u2019000 Schutzmasken pro Tag produzieren will](https://www.handelszeitung.ch/unternehmen/ab-ostern-80000-schutzmasken-pro-tag-made-flawil). Man sei aktuell dabei, die logistischen Herausforderungen zu l\u00f6sen, sagt die Firma auf Anfrage. \u00abAuch m\u00fcssen wir uns um die Rohmaterialien k\u00fcmmern, welche in Europa auf Monate ausverkauft oder \u00fcberteuert sind.\u00bb\n\u00c4hnliche Pl\u00e4ne hegt die Verbandsstoff-Firma Wernli AG im aargauischen Rothrist:\n[Hier wird der Output auf bis zu 140\u2019000 Masken pro Tag beziffert](https://www.luzernerzeitung.ch/wirtschaft/aargauer-firma-will-schutzmasken-herstellen-ld.1202230). Mit den beiden Produzenten erg\u00e4be sich ein Total von 220\u2019000 Masken pro Tag. Dies w\u00e4re aber nur ein Bruchteil dessen, was die Gesamtbev\u00f6lkerung ben\u00f6tigen w\u00fcrde, sollte sie regelm\u00e4ssig Masken tragen m\u00fcssen oder wollen.\nUm den Engpass zu beseitigen, ist inzwischen auch der Branchenverband der Textilhersteller aktiv geworden. \u00abWir versuchen, die Lieferketten wieder zusammenzubringen\u00bb, sagt Peter Fl\u00fcckiger, Direktor von Swiss Textiles.\n[Der Verband hat dieser Tage eine Aktion lanciert](https://swisstextiles.ch/plattform-corona-produkte): Hersteller und H\u00e4ndler diverser Teile \u2013 vom Garn bis zum Gummiband \u2013 k\u00f6nnen sich via Website melden. Innerhalb von 4 Tagen kamen \u00fcber zwei Dutzend Meldungen zusammen. Was nun?\nDie offiziellen Empfehlungen des BAG stossen nicht \u00fcberall auf Anklang. In Uri bittet eine Physiotherapeutin ihre Patienten beispielsweise,\n[mit eigenen Schutzmasken zur Behandlung zu kommen](https://www.tagesanzeiger.ch/schutzmasken-fuer-alle-sollen-den-shutdown-beenden-406068906383). Und im St. Galler Rheintal [l\u00e4sst eine Apotheke Kunden nur mit Maske ins Gesch\u00e4ft hinein](https://www.fm1today.ch/ostschweiz/stgallen/wer-in-diese-apotheke-will-muss-fuer-drei-stutz-eine-maske-kaufen-137422584) \u2013 jene, die keine haben, m\u00fcssen 3 Franken f\u00fcr eine solche bezahlen. Dies sehr zum \u00c4rger der Stiftung f\u00fcr Konsumentenschutz, die gegen\u00fcber der Republik darauf hinweist, dass Apotheken zur systemkritischen Infrastruktur geh\u00f6rten und zurzeit eine ethische Pflicht h\u00e4tten, allen Personen den Zugang zum Gesch\u00e4ft zu gew\u00e4hren, solange die BAG-Empfehlungen anderweitig erf\u00fcllt w\u00fcrden.\nWie lange diese Empfehlungen noch ohne Maskentrag-Pflicht auskommen, steht auf einem anderen Blatt. Der Druck auf Bundesrat und BAG steigt. Die zwangsstillgelegten Zweige der Wirtschaft sehen in den Masken eine M\u00f6glichkeit, den Betrieb nach und nach wieder aufzunehmen. Und aus der Politik, namentlich von der SVP, werden Forderungen laut, eine Maskenpflicht einzuf\u00fchren, sobald gen\u00fcgend Masken vorhanden sind.\nDie wissenschaftliche Taskforce, von der sich das BAG neuerdings beraten l\u00e4sst,\n[hat bereits Signale in diese Richtung ausgesandt](https://www.youtube.com/watch?v=0MZb_VmaUek&feature=emb_logo). Ihr Leiter Matthias Egger nannte das Maskentragen als eine von drei Massnahmen (neben massiv viel mehr Tests und einer Tracking-App), \u00abum die Epidemie zu stabilisieren\u00bb und die Einschr\u00e4nkungen nach und nach zu lockern.\nGut m\u00f6glich, dass der Bund seine Maskenpolitik noch einmal \u00fcberdenkt. \u00abSobald der Peak \u00fcberschritten ist, kann man nichts ausschliessen\u00bb,\n[sagte Bundesrat Alain Berset am Freitag](https://www.youtube.com/watch?list=PLEnHzNShzOwbxmvpk7ajVhE3m1mO6h6p9&time_continue=1&v=dIGXiwKvNfs&feature=emb_logo). Hygienemasken doch noch zu empfehlen, w\u00e4re jedenfalls nicht der erste Schwenker im Zuge der Corona-Epidemie.\nWenn Sie unsicher sind, was Sie in der Zwischenzeit tun sollen \u2013 benutzen Sie am besten den gesunden Menschenverstand. Das heisst: Befolgen Sie\n[die allgemeinen Verhaltensregeln](https://www.bag.admin.ch/bag/de/home/krankheiten/ausbrueche-epidemien-pandemien/aktuelle-ausbrueche-epidemien/novel-cov/so-schuetzen-wir-uns.html) \u2013 H\u00e4nde waschen, Abstand halten, den Kontakt zu Risikogruppen vermeiden. Und sch\u00fctzen Sie mindestens in Situationen, wo dies partout nicht m\u00f6glich ist \u2013 zum Beispiel in der dicht gedr\u00e4ngten Menge im Tram \u2013, sich und Ihr Umfeld zus\u00e4tzlich mit einer Hygienemaske. Notfalls auch mit einer selbst gebastelten.", "language": null, "image": "https://cdn.repub.ch/s3/republik-assets/repos/republik/article-die-maskeninsel/images/7114a478c53b2593a52f7ffd579be0a3d50ce25b.png?size=1204x630", "pagetype": "website", "links": ["https://wiki.selfhtml.org/wiki/JavaScript/Tutorials/JavaScript_aktivieren", "/", "/angebote", "/~c09e2411-cf3b-434b-8a23-c1146ed6181e", "https://cdn.repub.ch/pdf/2020/04/06/die-sache-mit-den-masken.pdf", "https://www.republik.ch/2020/04/06/die-sache-mit-den-masken", "https://www.republik.ch/2020/04/06/die-sache-mit-den-masken", "/dialog?t=article&id=5b12ffd2-cc65-4a19-af6d-ccf5c5b58f29", "/datenschutz", "https://www.sciencemag.org/news/2020/03/not-wearing-masks-protect-against-coronavirus-big-mistake-top-chinese-scientist-says", null, "https://wien.orf.at/stories/3042069/", "https://www.denik.cz/z_domova/povinne-rousky-co-hrozi-bez-ni-20200318.html", "https://www.health.gov.sk/Clanok?covid-19-24-3-2020-opatrenia", "https://www.mdr.de/thueringen/ost-thueringen/jena/corona-virus-mundschutz-masken-100.html", "https://www.theverge.com/2020/4/3/21206044/masks-cloth-coronavirus-cdc-recommendation-guidelines-wear-spread-prevent-covid-19", "https://www.statnews.com/2020/03/20/understanding-what-works-how-some-countries-are-beating-back-the-coronavirus/", "https://www.theguardian.com/world/2020/mar/19/chinas-coronavirus-lockdown-strategy-brutal-but-effective", "https://www.marketwatch.com/story/what-we-can-learn-from-south-korea-and-singapores-efforts-to-stop-coronavirus-in-addition-to-wearing-face-masks-2020-03-31", "https://time.com/5813619/japan-coronavirus-lockdown/", "https://mainichi.jp/english/articles/20200403/p2g/00m/0in/092000c", "https://www.ft.com/coronavirus-latest", "https://jamanetwork.com/journals/jama/fullarticle/2762689?resultClick=1 ", "https://coronavirus.jhu.edu/map.html", "https://www.institutmontaigne.org/en/blog/fighting-coronavirus-pandemic-east-asian-responses-taiwan-swift-meticulous", null, "https://www.welt.de/wissenschaft/article206588145/Streit-unter-Virologen-Ich-kann-nur-sagen-Alexander-Kekule-vertritt-eine-Aussenseiterposition.html", "https://www.who.int/docs/default-source/documents/advice-on-the-use-of-masks-2019-ncov.pdf", "https://www.cochranelibrary.com/cdsr/doi/10.1002/14651858.CD006207.pub4/full?highlight", "https://www.nature.com/articles/s41591-020-0843-2", "https://www.nzz.ch/schweiz/epidemiologe-marcel-salathe-wie-weiter-nach-dem-lockdown-ld.1549246", "https://www.nature.com/articles/d41586-020-00822-x#ref-CR4", "https://www.tagesanzeiger.ch/sonntagszeitung/warum-wir-allemasken-tragen-sollten/story/13936842", "https://www.scribd.com/document/454446850/Aufruf-Zentralschweiz-Corona", "https://www.bag.admin.ch/bag/de/home/das-bag/publikationen/broschueren/publikationen-uebertragbare-krankheiten/pandemieplan-2018.html", "https://edition.cnn.com/2020/03/30/world/coronavirus-who-masks-recommendation-trnd/index.html", "https://www.washingtonpost.com/outlook/2020/03/28/masks-all-coronavirus/", null, "https://www.scribd.com/document/454449344/Medienmitteilung", "https://www.who.int/emergencies/diseases/novel-coronavirus-2019/advice-for-public/when-and-how-to-use-masks", "https://www.lungenaerzte-im-netz.de/news-archiv/meldung/article/teure-atemschutzmaske-schuetzt-nicht-besser-vor-grippe-als-einfacher-mundschutze/", "https://www.consumer.org.hk/ws_en/news/specials/2020/mask-diy-tips.html", "https://www.televizeseznam.cz/video/jak-na-to/jak-si-doma-vyrobit-rousku-64037441", "https://www.nytimes.com/article/how-to-make-face-mask-coronavirus.html", "https://media.essen.de/media/wwwessende/aemter/0115_1/pressereferat/Mund-Nasen-Schutz__Naehanleitung_2020_Feuerwehr_Essen.pdf", "https://www.bostonglobe.com/2020/03/28/sports/new-balance-is-working-manufacture-facial-masks/", "https://www.basellandschaftlichezeitung.ch/basel/baselbiet/selbstgemachte-schutzmasken-in-liestal-ein-bisschen-schutz-und-lifestyle-in-einem-137566910", "https://medium.com/@Cancerwarrior/covid-19-why-we-should-all-wear-masks-there-is-new-scientific-rationale-280e08ceee71", null, "https://www.merkur.de/welt/mundschutz-maskenpflicht-coronavirus-schutzmasken-deutschland-soeder-oesterreich-jena-soeder-kretschmann-spahn-tagesthemen-ard-zr-13634528.html", "https://www.youtube.com/watch?v=QBdJQC-d5jY", "https://www.handelszeitung.ch/unternehmen/ab-ostern-80000-schutzmasken-pro-tag-made-flawil", "https://www.luzernerzeitung.ch/wirtschaft/aargauer-firma-will-schutzmasken-herstellen-ld.1202230", "https://swisstextiles.ch/plattform-corona-produkte", null, "https://www.tagesanzeiger.ch/schutzmasken-fuer-alle-sollen-den-shutdown-beenden-406068906383", "https://www.fm1today.ch/ostschweiz/stgallen/wer-in-diese-apotheke-will-muss-fuer-drei-stutz-eine-maske-kaufen-137422584", "https://www.youtube.com/watch?v=0MZb_VmaUek&feature=emb_logo", "https://www.youtube.com/watch?list=PLEnHzNShzOwbxmvpk7ajVhE3m1mO6h6p9&time_continue=1&v=dIGXiwKvNfs&feature=emb_logo", "https://www.bag.admin.ch/bag/de/home/krankheiten/ausbrueche-epidemien-pandemien/aktuelle-ausbrueche-epidemien/novel-cov/so-schuetzen-wir-uns.html", "https://www.republik.ch/2020/04/06/die-sache-mit-den-masken", "/dialog?t=article&id=5b12ffd2-cc65-4a19-af6d-ccf5c5b58f29", "/datenschutz", "https://www.instagram.com/republikmagazin/", "https://www.facebook.com/RepublikMagazin", "https://twitter.com/RepublikMagazin", "https://republik.social/@republik_magazin", "/", "/angebote?group=", "/abholen", "/anmelden", "/about", "/format/jobs", "/cockpit", "/faq", "https://project-r.construction/", "/veranstaltungen", "/community", "/komplizin", "/etikette", "/agb", "/datenschutz", "/statuten", "/aktionariat", "/impressum", "mailto:kontakt@republik.ch", "/impressum", "https://github.com/republik/plattform"]}