{"title": "Leitmedien - seri\u00f6se Quellen?", "author": "J\u00fcrgen M\u00fcller", "url": "https://publikum.net/leitmedien-seriose-quellen/", "hostname": "publikum.net", "description": "Ist wirklich alles, was sich au\u00dferhalb der Leitmedien abspielt unseri\u00f6s? Kann man wirklich die Leitmedien in der Coronakrise noch als seri\u00f6se Quellen bezeichnen?", "sitename": "Publikum", "date": "2021-07-31", "id": null, "license": null, "body": null, "comments": "", "commentsbody": null, "raw_text": null, "text": "Der heutige Text \u00fcber Medien soll eingeleitet werden mit einem Zitat von Niklas Luhmann: \u201eWas wir \u00fcber unsere Gesellschaft, ja \u00fcber die Welt, in der wir leben, wissen, wissen wir \u00fcber die Massenmedien.\u201c\nJa es ist unglaublich, aber es gibt da drau\u00dfen tats\u00e4chlich eine ganz andere Welt als die Coronaberichterstattung (und auch sonstige Berichterstattung) in den Massenmedien. Ich habe mir in der Coronakrise zwischendurch mal die M\u00fche gemacht in verschiedenen Medien wie Zeit, SZ, Spiegel, t-online, Tagesspiegel die Berichterstattung quantitativ anzusehen. Da kommt man dann teilweise auf 30 Corona-Artikel am Tag! In einem Medium! Und die sind auch noch so platziert, dass man erstmal nach unten scrollen muss, um zu sehen, dass es noch andere Themen gibt, die die Redaktion zumindest f\u00fcr so wichtig h\u00e4lt, um sie irgendwo noch abzubilden. Weitere Themen, die oftmals eigentlich wesentlicher sind, fallen ganz unter den Tisch oder kommen schon vor, aber halt nicht so deutlich wahrnehmbar. \u00dcber die Funktionsweise der Medien gibt es viele gute B\u00fccher. Diese selektive Art der Berichterstattung hat zum Beispiel Ulrich Teusch in seinem Buch \u201eL\u00fcckenpresse\u201c gut beschrieben. Ebenfalls empfehlenswert ist das Buch \u201eMainstream\u201c von Uwe Kr\u00fcger, dessen Doktorarbeit es seinerzeit auch zum\n[Aufh\u00e4nger einer Anstalt-Sendung](https://www.claus-von-wagner.de/tv/anstalt/20140429-europaeische-union) gebracht hat.\nEin kurzer Abriss meiner Erfahrungen aus der Zeit weit vor Corona: Nachdem mir die Berichterstattung \u00fcber die Ukrainekrise sehr seltsam vorkam, habe ich mich mit dem Syrienkrieg so intensiv befasst, wie ich es jetzt mit Corona getan habe. Ich kam damals, sehr pointiert geschrieben zu der Schlussfolgerung, dass Deutschland an der Seite al-Qaidas gegen die syrische Regierung k\u00e4mpft und die Kriegsbegr\u00fcndung mit Demokratie und Menschenrechten haneb\u00fcchen ist. Oder wie man es in Coronazeiten nennen w\u00fcrde: Geschwurbel. Ich habe damals mein Spiegelabo nach langen Jahren beendet, weil Titel wie \u201ePutins Werk, Obamas Beitrag\u201c eine komplette Verdrehung der Tatsachen war und \u201eStoppt Putin jetzt\u201c eher kein Journalismus ist, sondern die Aufforderung zum Bruch des V\u00f6lkerrechts. Man kann von diesem verheerenden Stellvertreterkrieg halten, was man will, aber man kann schon der Ansicht sein, dass Putin an der Seite der syrischen Regierung und damit eher auf dem Boden des V\u00f6lkerrechts k\u00e4mpfte als die NATO-Staaten, von den \u00fcbrigen v\u00f6lkerrechtswidrigen Kriegen der NATO in der Region ganz zu schweigen. Das ganze Problem IS, das man vorgab zu bek\u00e4mpfen, entstand \u00fcberhaupt erst durch den v\u00f6lkerrechtswidrigen Angriffskrieg auf den Irak 2003, dem die Mutter aller FakeNews zu Grunde lag. Wer erinnert sich nicht, als Colin Powell das Fl\u00e4schchen Massenvernichtungswaffen der UN-Versammlung vor die Nase hielt, was unseren damaligen Au\u00dfenminister\n[Joschka Fischer nicht so ganz \u00fcberzeugt](https://www.youtube.com/watch?v=_k_QbpFl7RM) hat.\nDie USA h\u00e4tten dabei den Irak liebend gerne schon fr\u00fcher angegriffen, aber leider haben sich die Anthraxanschl\u00e4ge von September 2001 dann dummerweise als Eigenproduktion eines (nat\u00fcrlich) Einzelt\u00e4ters herausgestellt, der sp\u00e4ter an einem untauglichen Selbstmordversuch verstarb (so jedenfalls meine Erinnerung). Trotz hunderttausenden Toten durch diesen Krieg, trotz mehrerer hunderttausend Kinder, die bereits vorher durch Sanktionen geopfert wurden, weil es dies Wert war, wie Madelaine Albright meinte, trotz der bekannten Pl\u00e4ne den Nahen Osten in Schutt und Asche zu legen und einen Keil zwischen Europa und Russland zu treiben, stehen die USA in der Meinung vieler noch immer als die Guten da.\nDer Weltpolizist, der sich f\u00fcr Demokratie und Menschenrechte einsetzt und Frieden bringt. Trotz eines Kriegsetats, den alle anderen zusammen kaum erreichen, hunderten St\u00fctzpunkten rund um den Globus und kaum einem Jahr in ihrer Geschichte, in dem diese Nation nicht irgendwo auf dem Erdball Krieg gef\u00fchrt hat.\nViele Menschen verweigern sich der Tatsache, dass wenn es um Geld und Macht geht, auch Millionen Menschen geopfert werden. Diese gutgl\u00e4ubige Sichtweise ist vollkommen verr\u00fcckt, aber nicht verwunderlich, denn es wird eine gigantische PR-Maschinerie eingesetzt, bei der man nie wei\u00df, ob das gerade Nachrichten sind, die man liest oder Propaganda. Denn mit Propaganda arbeiten nicht nur Russland und China. Auch die\n[USA setzen bereits seit langem massiv darauf ](https://www.tagesanzeiger.ch/ausland/amerika/27-000-prberater-polieren-image-der-usa/story/20404513)und haben die Hebel durch die gro\u00dfen Tech-Konzerne, die (Achtung Euphemismus) nicht ganz frei sind von Geheimdiensteinfl\u00fcssen, fest in der Hand. Damit wird Meinung gemacht und gesteuert.\nWer sich dem Thema ann\u00e4hern will, dem seien neben den zahlreichen B\u00fcchern, die es zur Funktionsweise der Medien und unserer Gehirne gibt, die B\u00fccher von Michael L\u00fcders und Gabriele Krone-Schmalz zu empfehlen. Vorsicht: Man wird Parallelen zur Coronakrise erkennen und auch zur l\u00fcckenhaften Berichterstattung. Ich war im Jahr 2017 auf der Friedensdemo in Ramstein. Bei der Menschenkette schloss ich eine interessante Bekanntschaft als sich herausstellte, dass ich gerade Hand in Hand mit Otto J\u00e4ckel da stand, dem Vorstandsvorsitzenden der Deutschen Sektion der International Association of Lawyers Against Nuclear Arms. Wir sprachen unter anderem \u00fcber diese Thematik und die Planung der IALANA, eine Medientagung zu diesem Thema zu veranstalten. Diese fand im Januar 2018 statt, leider ohne Beteiligung oder Berichterstattung der Leitmedien. Ein\n[Bericht ist hier nachzulesen](https://www.nachdenkseiten.de/?p=42173#more-42173). Videos und [weitere Berichte finden sich hier](https://www.ialana.de/aktuell/veranstaltungen-ialana/2179-dokumentation-des-medienkongresses). Wer es angesichts der Brutalit\u00e4t nicht ganz so n\u00fcchtern ertr\u00e4gt, dem seien die Folgen der Anstalt vom [April 2015](https://www.claus-von-wagner.de/tv/anstalt/20151020-konflikte-im-nahen-und-mittleren-osten) und [November 2016](https://www.claus-von-wagner.de/tv/anstalt/20161101-syrienkonflikt-und-voelkerrecht) empfohlen, die das ZDF unter Comedy f\u00fchrt. Das ist schon recht grotesk, weil es sich so ziemlich um die einzigen Sendungen dazu im \u00f6ffentlich-rechtlichen Fernsehen handelte, die fundiert und mit einem validen Faktencheck versehen zu dem Thema berichteten.\nWarum diese verst\u00f6rende Einleitung bei einem Artikel, der sich in eine Serie \u00fcber Corona einreiht, deren erster Teil sich mit\n[meiner Verst\u00f6rung \u00fcber die komplett kontr\u00e4re Herangehensweise der Umweltbewegung](https://publikum.net/glyphosat-fur-das-immunsystem/) an Corona befasst hat, [deren zweiter Teil](https://publikum.net/corona-impfung-schwierige-gemengelelage-2/) meiner Verst\u00f6rung dar\u00fcber gewidmet war, dass es ein Vorsorgeprinzip bei der Impfung gar nicht mehr zu geben scheint und wir unsere historische Erfahrung mal ebenso \u00fcber Bord werfen und [deren dritter Teil sich mit unserer Demokratie und dem Grundgesetz](https://publikum.net/wahrend-der-anfange/) befasste?\nWeil ich den Eindruck habe, dass mit der Klimabewegung zwar zahlreiche Akteure aufgetreten sind, die viel Energie f\u00fcr ein Thema mitbringen, denen aber die Erfahrungen zu fehlen scheinen, die Menschen bereits gemacht haben, die sich f\u00fcr Frieden und Demokratie einsetzen und dabei Machtstrukturen angreifen. Die kennen das alles, was derzeit passiert, wissen, dass man sich auch in anderen Quellen au\u00dferhalb der Leitmedien \u00fcber Machtstrukturen und Hintergr\u00fcnde informieren muss und m\u00fcssten eigentlich gelangweilt sein, wenn es nicht eine derartige Dynamik ann\u00e4hme, die geeignet ist, die liberalen Demokratien, die es geschichtlich betrachtet erst einen Wimpernschlag gibt, einfach wegzuwischen. Dabei kommen die selben Mechanismen zum Einsatz, die insbesondere Friedensaktivisten kennen, wenn sie sich gegen geopolitische Interessen stellen. Allen voran die Diskreditierung als Antisemiten, Verschw\u00f6rungstheoretiker etc. Man mag es kaum glauben, dass solch seichte Spielchen funktionieren, die denkende Menschen eigentlich als intellektuelle Beleidigung auffassen m\u00fcssten.\nVerschw\u00f6rungstheorien\nNur keine Scheu vor plausiblen Verschw\u00f6rungstheorien, sofern sie Menschenfeindliches aufdecken ohne selbst menschenfeindlich zu sein. Also au\u00dfer gegen\u00fcber Menschenfeinden. Da muss man nicht so arg freundlich sein. Verschw\u00f6rungen gab es schon immer und es wird sie immer geben. Seit der Coronakrise wissen wir doch, dass Verschw\u00f6rungstheoretiker lediglich Menschen sind, die sich 1 Jahr zu fr\u00fch \u00f6ffentlich \u00e4u\u00dfern.\nK\u00fcrzlich habe ich\n[von Cemas gelesen](https://taz.de/Verschwoerungsideologen-im-Flutgebiet/!5781929/). Das ist ein Thinktank f\u00fcr Verschw\u00f6rungstheorien. Und das ist ja auch nur logisch, denn in der Coronakrise braucht man solche thinktanks, weil sich die Verschw\u00f6rungstheorien schneller bewahrheiten, als sie sich ein Einzelner ausdenken k\u00f6nnte. Egal ob das die nicht belastbaren Zahlen des PCR-Tests sind, der Intensivbettenskandal, ach eigentlich bisher alles, worauf die offiziellen Verlautbarungen [und die Horrorzahlen](https://www.aerzteblatt.de/archiv/220042/Epidemiologie-im-Fokus-Expertenkrise-in-der-Pandemie) in der Coronakrise beruhten, die zu den gr\u00f6\u00dften Verfassungsbr\u00fcchen gef\u00fchrt haben, die ich mir jemals vorstellen h\u00e4tte k\u00f6nnen. Verbreitet von den Leitmedien, die noch immer als seri\u00f6se Quellen angesehen werden, wohingegen alles, was auf valider Datengrundlage das Narrativ von Politik und Leitmedien in Frage stellt als unseri\u00f6s abgekanzelt wird. Verr\u00fcckte Welt.\nDas wirklich schlimme an Verschw\u00f6rungstheorien ist, dass die plausiblen diskreditiert werden, indem man sie fast immer, wenn es um solche im Bereich von wirtschaftlichen oder geopolitischen Machtinteressen geht, in einem Atemzug nennt mit Chemtrails, Flacherde oder Echsenmenschen. Dann ist das in den Hirnen wunderbar als Quatsch verklammert und man kann weiter machen mit seiner praktischen Verschw\u00f6rung. Leute, die sowas in einem Satz oder auch nur in engemzeitlichen Zusammenhang verr\u00fchren, sind per se unseri\u00f6s.\nAufreger gibt es doch immer wieder. CumEx ist so ein aktueller, wenn auch im Gesamtgeschehen recht kleiner. Was mich grad an Umweltaktivisten wundert: Warum halten die Verschw\u00f6rungstheorien f\u00fcr Quatsch. Ich meine: es gibt so viele Akteure, die bereit sind, sogar die gesamte \u00d6kosph\u00e4re zu opfern, wie ExxonKnew zeigte. Aber In Coronazeiten scheint das nicht mehr so zu sein. Das war fr\u00fcher. Jetzt sind Konzerne und die Regierungen die Guten und Ausbeuter sind Menschenfreunde. Wer w\u00fcrde denn schon f\u00fcr ein paar hundert Milliarden uns allen schaden wollen oder f\u00fcr eine absolut marktbeherrschende Stellung, die wir fr\u00fcher mal kartellrechtlich unterbunden h\u00e4tten. Ist alles K\u00e4se, sagen die Verschw\u00f6rungsleugner.\nWeiteres Beispiel: Wenn es um lange erprobte Pestizide geht, ist die Aufregung gro\u00df, wenn sich durch eigene m\u00fchsame Aufkl\u00e4rung der Zivilgesellschaft gegen massive Widerst\u00e4nde (Klagen, Einsch\u00fcchterungen, gekaufte Wissenschaft o.\u00e4.) herausstellt, dass es \u00fcber die Luft verfrachtet wird. Das entspreche nicht den Zulassungskriterien und m\u00fcsse vom Markt genommen werden. Wenn man jedoch schreibt, dass die experimentellen Impfstoffe entgegen den offiziellen Verlautbarungen gar nicht im Muskel verbleiben, wo sie eingespritzt werden, sondern sich im gesamten K\u00f6rper von Eierst\u00f6cken bis zum Gehirn verteilen mit unabsehbaren Folgen, wird man von eben jenen Umweltaktivisten angegriffen und die Impfstoffe werden verteidigt. Und damit verteidigen sie im Endeffekt die gleichen Leute: die Eigent\u00fcmer der Konzerne. Verr\u00fcckte Welt.\nSelbst bei Menschen, deren Arbeit ich sonst sch\u00e4tze, habe ich den Eindruck, dass sie bisweilen doch einen sehr begrenzten Blick auf manche Dinge haben. Wer schon mal \u201eFake Facts\u201c von Katharina Nocun und Pia Lemberty gelesen hat, sollte unbedingt noch Nils Melzers \u201eDie Akte Assange\u201c lesen und dann nochmal Fake Facts. Ich garantiere ihm andere Gef\u00fchle bei der zweiten Lekt\u00fcre. Mir ging es so. Nils Melzer hat den Glauben an den Rechtsstaat verloren.\n[Er sieht die Banalit\u00e4t des B\u00f6sen am Werk](https://www.heise.de/news/UN-Folterbeauftragter-Fall-Assange-hat-Vertrauen-in-Rechtsstaat-erschuettert-6020798.html).\nOberfl\u00e4chlich geht es aus meiner Sicht bei der Aburteilung von Kritikern der wikipedia zu. Die sieht man dort als demokratisch organisierte Wissensplattform, was sie aber gerade im Bereich von Geopolitik und Konzerninteressen nicht ist. Da scheint derjenige zu gewinnen, der sich mit mehr Ressourcen r\u00fccksichtslos durchsetzen kann. Der englischsprachige Artikel des Erfinders der mRNA-Technologie\n[Robert Malone wurde k\u00fcrzlich ganz gel\u00f6scht](https://corona-transition.org/nach-kritik-an-impfstoffen-wikipedia-loscht-den-erfinder-der-mrna-technologie), nachdem er sich [mehrfach \u00e4u\u00dferst kritisch zu seiner Miterfindung \u00e4u\u00dferte](https://tkp.at/2021/07/20/erfinder-von-mrna-impfstoffen-aeussert-sich-kritisch-zu-covid-praeparaten/). Zu einem anderen Fall aus einem recht [aktuellen Kommentar von Livia Gerster](https://www.faz.net/aktuell/politik/inland/warum-wikipedia-seine-kontrollinstrumente-schaerfen-muss-17194722.html?GEPC=s3) mit deutlicher \u00dcberschrift (Bezahlschranke):\n\u201eDoch in den Weiten der Wikipedia toben Heerscharen von k\u00e4uflichen Schleichwerbern, dressierten Desinformationskriegern und eitlen Hochstaplern. Jeder kann mitmachen, erstellen, bearbeiten, redigieren, optimieren, manipulieren, l\u00f6schen. Die Wikipedianer nennen das Schwarmintelligenz. Oft ist es aber nichts anderes als Mob-Anarchie.\u201c\nHier\n[ein offener Artikel zu diesem Fall](https://www.spiegel.de/netzwelt/web/wikipedia-autor-zu-8000-euro-schadensersatz-verurteilt-a-57314901-39fd-4514-8721-3787fde50dd4). Auch die [Viadrina sieht die wikipedia kritisch](https://www.rbb24.de/studiofrankfurt/panorama/2021/01/wikipedia-jubilaeum-viadrina-europa-universitaet.html) ebenso [wie einer ihrer Mitgr\u00fcnder](https://www.youtube.com/watch?v=l0P4Cf0UCwU). Speziell zur Coronakrise [hier ein Interview mit Clemens Arvay](https://www.nachdenkseiten.de/?p=69475), der sich in Videos und einem Buch zur Impfung \u00e4u\u00dfert. [Hier ein Gespr\u00e4ch mit ihm und Prof. Dr. Harald Walach](https://www.youtube.com/watch?v=90C_TpR8qro). Ma\u00dfgeblich zur Aufkl\u00e4rung beigetragen hat Markus Fiedler mit seinem Recherchest\u00fcck \u201e [Die dunkle Seite der Wikipedia](https://wikihausen.de/dokumentarfilm-die-dunkle-seite-der-wikipedia/)\u201c und in der Folge mit einer gemeinsamen Serie und Recherchearbeit Dirk Pohlmann, durch deren Ermittlungst\u00e4tigkeit \u00fcberhaupt erst das oben beschriebene Urteil gegen einen anonymen Diskreditierer m\u00f6glich war. Nun kann man dazu stehen wie mal will und muss Leuten f\u00fcr deren dem Gemeinwohl dienliche Recherche auch nicht wohlwollend gegen\u00fcber stehen. Ist ja ein freies Land mit mal mehr mal weniger Meinungsfreiheit. Aber wie man das so einfach in ein Buch als \u201edemokratisch\u201c hineinschreiben kann und Kritik daran in den Bereich der Verschw\u00f6rungstheorie r\u00fcckt, ist mir unbegreiflich.\nNoch unbegreiflicher ist mir, wie alles, was in der Realit\u00e4t beobachtet werden kann und was die Protagonisten selbst von sich geben, von so vielen in den Bereich der Verschw\u00f6rungstheorie ger\u00fcckt wird. Die vollkommen irre Idee, dass alle Menschen auf der Welt geimpft werden m\u00fcssen, um die Pandemie zu beenden, haben ja Bill Gates und Angela Merkel selbst in die Kameras gesprochen. Und das bedeutet ja nichts anderes als alle: vom S\u00e4ugling bis zum Greis rund um den Globus. Das ist wirklich vollkommen irre bei diesem Virus und den Risiken der Impfung. Dabei ist das mit der Impfung vielleicht sogar auch nur ein von noch gr\u00f6\u00dferen Dimensionen ablenkender Nebenkriegsschauplatz, w\u00e4hrend die Finanzkonzerne sich anschicken, halbe Volkswirtschaften zu \u00fcbernehmen und die Tech-Konzerne um Facebook und google (oder vielmehr um im Coronasprech zu bleiben das variantenreiche Alphabet) gleich die \u00dcbernahme der halben Welt planen. Also das sage ja auch wieder nicht ich. Da sei vielmehr zur Lekt\u00fcre Susanna Zuboffs \u201e\u00dcberwachungskapitalismus\u201c empfohlen. Beim Lesen muss man sich mittlerweile allerdings vorstellen, es sei 2019, als das noch als \u201eDas Kapital\u201c des 21. Jahrhunderts galt. Nicht \u201eim 21. Jahrhundert\u201c - sonst ist der Franzose mit dem anderen Wahnsinnswerk pikiert. Heutzutage ist aber wohl beides Verschw\u00f6rungstheorie. Also die Neigung von Kapital, zwangsl\u00e4ufig zu akkumulieren und damit Schlimmes zu tun.\nIn der Coronakrise gibt es Extreme auf beiden Seiten und ich gebe zu, dass man sich da verrennen und es dann auch gef\u00e4hrlich werden kann. Geschlossene Weltbilder bringen einen auf beiden Seiten aber nicht weiter. Nicht alles ist schwarz oder wei\u00df, in der Regel sind es Graut\u00f6ne. Manchmal eher dunkelgrau, manchmal heller. Was allerdings vollkommen unseri\u00f6s ist, sind die reinwei\u00dfen Berichte \u00fcber die Impfung angesichts von noch nie dagewesenen Nebenwirkungen bei einer gleichzeitig nicht f\u00fcr eine Exitstrategie zu gebrauchenden Wirkung. Gleiches gilt f\u00fcr die Huldigung von sog. Philanthropen und die ausbleibende Kritik gegen die gr\u00f6\u00dfte Umverteilung von \u00f6ffentlichem Verm\u00f6gen zu Privaten in der Geschichte und damit die Zementierung gemeinwohlsch\u00e4dlicher Machtstrukturen.\nDa muss man wohl dem gro\u00dfen Philosophen Roger \u201eVerbal\u201c Kint beipflichten: \u201eDer gr\u00f6\u00dfte Trick, den der Teufel je gebracht hat, war die Welt glauben zu lassen, es g\u00e4be ihn gar nicht.\u201c Das scheinen mittlerweile auch all diejenigen Gruppierungen zu glauben, die sich\n[bisher gegen Konzernmacht ](https://publikum.net/demokratiezersetzung-2-0/)und imperiale Politik eingesetzt haben.\nDie gr\u00f6\u00dfte Verschw\u00f6rungsideologie d\u00fcrfte es jedoch gleichwohl sein, alle, die sich f\u00fcr Demokratie, Gerechtigkeit, Menschenrechte, gemeinwohlorientiertes Wirtschaften, Gemeing\u00fcter etc. einsetzen einer einzigen Gruppe zuzuordnen, die den Staat delegitimieren will. So langsam sollten sich diese\n[Verschw\u00f6rungsleugner](https://www.nachdenkseiten.de/?p=74357) ( [hier der zitierte Artikel von Tim Foyle zum nachh\u00f6ren](https://soundcloud.com/radiomuenchen/die-psychoogie-der-verschworungsleugner-von-tim-foyle)) mal fragen, was sie da eigentlich wirklich treiben und wohin das f\u00fchren soll.\nManchmal bin ich sehr best\u00fcrzt von Menschen aus meinem Umfeld, die einfachste Zusammenh\u00e4nge nicht erkennen wollen. Wenn Kan\u00e4le von Journalisten abgeschaltet werden, verteidigen sie das sogar noch, weil es gegen die eigene Meinung geht. Solche Verschw\u00f6rungstheorien m\u00fcsse man nicht tolerieren und das Grundgesetz gegen sie verteidigen (obwohl nichts Strafbares berichtet wurde aber vielleicht die das eigene Weltbild zu sehr zertr\u00fcmmernde Wahrheit). Dass es einen dann selbst mal treffen kann, wird dabei ausgeblendet wie auch, dass unser Grundgesetz so nicht funktioniert. Aber das wird ja schon die komplette Coronakrise ausgeblendet und so kann man sich weiter sch\u00f6n auf das offizielle Narrativ berufen, das zwar schon dutzendfach pulverisiert wurde, aber f\u00fcr in der Zukunft liegende Sachverhalte noch immer so glaubhaft zu sein scheint, dass jede Kritik daran eine neue Verschw\u00f6rungstheorie ist.\nAuch eine Impfpflicht galt so bis vor Kurzem noch als Verschw\u00f6rungstheorie und manche waren verst\u00e4ndnislos, dass ich mich gegen eine Impfung von Kindern, die von Corona so gut wie nichts mitbekommen, wehrte, weil die Impfung f\u00fcr sie mit vielen Fragezeichen und gef\u00e4hrlichen Nebenwirkungen behaftet ist. Es g\u00e4be doch noch keine Impfpflicht und die STIKO spreche sich doch gegen die Impfung von Kindern aus (was aber halt noch nie einen Politiker interessiert hat).\nImpfpflicht\nSeit dem Wochenende rollt sie nun endlich - die erwartbare Kampagne zur Diskursverschiebung ins bisher Unsagbare. Bekannt von ihrer AfD und allen rechten Parteien re\u00fcssiert diese Technik in der Coronakrise bei Politik und Medien. Bisher Undenkbares wird ge\u00e4u\u00dfert und wieder halb zur\u00fcckgenommen, um irgendwann als hoff\u00e4hig beschlossen werden zu k\u00f6nnen und breite Akzeptanz zu genie\u00dfen.\nDa diskutieren \u201eEthiker\u201c, die offensichtlich aus unserer Geschichte nichts gelernt haben, dar\u00fcber, dass eine\n[Diskriminierung von Ungeimpften gerechtfertigt](https://www.zeit.de/gesellschaft/2021-07/corona-impfung-pflicht-ethik-massnahmen-grundrechte) sei.\nDas ist mittlerweile breit akzeptiert aber gewaltt\u00e4tig ist derjenige, der sich dahingehend \u00e4u\u00dfert, dass wir das nicht tun d\u00fcrfen. Gewaltt\u00e4tig ist nicht derjenige, der in freundlicher Sprache zivilisatorisch derartig entgleist! Wer so etwas fordert hat heutzutage das Zeug zum Ethikprofessor und darf ganz oben in der Zeit publizieren, damit das auch breit wahrgenommen wird. Und am Folgetag kommt dann\n[gleich der n\u00e4chste Experte](https://web.archive.org/web/20210723101727/https://www.zeit.de/2021/30/corona-impficht-ddr-siegwart-bigl-ethik-medizin), der eine Impfpflicht fordern darf, obwohl er schon vor lauter Unlogik eigentlich vom Hof gescheucht werden m\u00fcsste. Aber wen interessiert denn heutzutage noch Logik, wenn es darum geht, bei den Menschen die Botschaft im Hirn zu verankern, dass Umpfunwillige asoziale Parasiten der Gesellschaft sind. Das schafft man nur, wenn in hoher Frequenz immer wieder die gleiche Botschaft prominent unters Volk gebracht wird. Da muss man schon mal Abstriche bei der Qualit\u00e4t machen. Vor allem wenn das offizielle Narrativ die Qualit\u00e4t einfach nicht hergeben will und die Impfstoffe erst recht nicht.\nNun sollen auch Minderj\u00e4hrige in Schulen geimpft werden - ohne Einwilligung der Eltern aber unter dem Druck der Impfkampagne vor Ort und der Peer Group. Wie sollen denn 14-J\u00e4hrige so weit sein, die Tragweite ihrer Entscheidung zu verstehen, wenn selbst noch so viele gebildete Erwachsene, darunter auch Akademiker in meinem Umfeld nicht wissen, dass es sich bei dem Impfstoff um ein \"Weltexperiment\" (Alexander Kekul\u00e9) handelt, weil nur bedingt zugelassen und f\u00fcr die n\u00e4chsten 2-3 Jahre noch in der Studienphase mit ungewissem Ausgang? Es sollen\n[gesunde Kinder geimpft werden, die von der Krankheit \u00fcberhaupt nichts mitbekommen](https://tkp.at/2021/07/30/die-besten-infografiken-zu-corona-und-impfungen/), dann aber nat\u00fcrlich immun sind mit einem viel breiteren Schutz als ihn die Impfung vermitteln k\u00f6nnte, die gegen ein zwischenzeitlich mehrfach mutiertes Virus entwickelt wurde. Die sollen mit einem neuartigen Genpr\u00e4parat geimpft werden, das \u00fcberhaupt nicht den Zweck erf\u00fcllt, der propagiert wird und lediglich eine bedingte Zulassung hat, weil ein Notfall ausgerufen wurde, der nicht (mehr) besteht. Es gibt mehrfach geimpfte Superspreader und [wie die New York Times aktuell berichtet](https://www.nytimes.com/2021/07/30/health/covid-cdc-delta-masks.html?smtyp=cur&smid=tw-nytimes) tragen auch zweifach geimpfte eine hohe Virenlast im Rachen und sind infekti\u00f6s. Die ganze Impfstrategie bricht damit zusammen. Wird dar\u00fcber breit berichtet? Nein, man geht jetzt auf die STIKO und die Kinder los. Man h\u00e4tte es dabei belassen sollen, die Risikogruppen zu impfen und diejenigen, die es w\u00fcnschen, wenn sie denken, dann besser vor einem schweren Verlauf gesch\u00fctzt zu sein. Es gab noch nie einen Impfstoff in der BRD mit derart verheerenden Nebenwirkungen. Die Kinder damit zu impfen ohne einen Zugewinn f\u00fcr die Gesellschaft aber erheblichen gesundheitlichen eigenen Folgen bis hin zum m\u00f6glichen Tod ist ein Verbrechen. Ob Kinder eine strafbefreiende Einwilligung zu dieser K\u00f6rperverletzung geben k\u00f6nnen, wage ich zu bezweifeln.\nDas ist alles egal, da trommelt der\n[Kanzleramtsminister](https://www.nzz.ch/meinung/der-andere-blick/impfzwang-das-grundgesetz-gilt-auch-fuer-ungeimpfte-ld.1637526) f\u00fcr eine verfassungsfeindliche \u00c4chtung von Menschengruppen in diesem Land ebenso wie der [Gesundheitsminister](https://www.t-online.de/nachrichten/deutschland/id_90506968/corona-montgomery-stellt-sich-hinter-braun-vorstoss-zu-nicht-geimpften.html) und der Welt\u00e4rztepr\u00e4sident tr\u00f6tet fr\u00f6hlich sinnbefreit und verfassungsfeindlich hinterher. S\u00f6der und Co. machen gleich N\u00e4gel mit K\u00f6pfen und lassen entgegen dem STIKO-Rat vor Schulen Impfbusse auffahren. Um Gesundheit geht es in der ganzen Argumentation nicht, weil das auch kaum zu begr\u00fcnden w\u00e4re. Es geht um die \u201eGew\u00e4hrung\u201c von Grundrechten und N\u00f6tigung.\nDen bislang letzten aber sicher noch lange nicht allerletzten H\u00f6hepunkt setzte j\u00fcngst das (hoffentlich nicht mehr lange)\n[Leopoldinamitglied Armin Falk](https://www.berliner-zeitung.de/news/leopoldina-forscher-allgemeinheit-muss-fuer-dummheit-der-impfgegner-zahlen-li.174017): \u201eDie Allgemeinheit muss hier zahlen f\u00fcr die Tr\u00e4gheit und die Dummheit der Impfgegner\u2026Wenn Beatmungsger\u00e4te knapp werden oder wir nochmal in eine Triage-Situation k\u00e4men, was ich nicht hoffe, und wir dann vor der Wahl stehen, ob ein Geimpfter oder ein Nicht-Geimpfter die Behandlung bekommt, dann w\u00fcrde ich sagen, dass der Impfstatus mit in die Abw\u00e4gung einflie\u00dfen sollte\u201c.\nAngesichts unserer Geschichte ist das eine kaum zu glaubende Entgleisung. Kann die mal jemand alle inklusive der \u201eEthiker\u201c auf eine Schulbank setzen und ihnen die Grundlagen unseres Grundgesetzes erl\u00e4utern und\n[warum wir das alles so festgeschrieben haben inklusive Ewigkeitsgarantie](http://www.ippnw-nuernberg.de/aktivitaet2_1.html)? Oder ermittelt da auch schon die Generalstaatsanwaltschaft wegen Volksverhetzung?\nDas tut sie nat\u00fcrlich nicht, sondern lediglich bei geschmacklosen Vergleichen gegen die Coronapolitik und dann kommt\n[wom\u00f6glich eine Hausdurchsuchung](https://www.sueddeutsche.de/politik/corona-impfgegner-rechtsextreme-antisemitismus-1.5362745) wie sonst heutzutage nur [bei unabh\u00e4ngigen Richtern und gerichtlich bestellten Sachverst\u00e4ndigen](https://2020news.de/staatsanwaltschaft-erfurt-macht-selbst-vor-bundestagskandidaten-nicht-halt-sechs-hausdurchsuchungen-gleichzeitig-wegen-sensationsurteil/), die bei dem Regierungsnarrativ nicht mitspielen, weil es Fakten und Recht nicht hergeben. Oder bei \u00c4rzten, die ihren Patienten Maskenatteste ausstellen. Parallel zu diesen ganzen Ereignissen fordern in der Schweiz \u00fcbrigens Politiker, Ungeimpfte mit Stickern zu kennzeichnen. Verr\u00fcckte Welt.\nAch so, ja,\n[die aus dem V\u00f6lkerrecht kommende gr\u00fcne Kanzlerkandidatin ](https://www.spiegel.de/politik/deutschland/corona-annalena-baerbock-schliesst-einschraenkungen-fuer-ungeimpfte-nicht-aus-a-df7af99e-b6be-4e96-887a-be8c88a3945e)scheint auch nicht so ganz mit beiden Beinen auf dem Grundgesetz zu stehen und der Herr Habeck, der aus der Landwirtschaft kommt, formuliert es noch deutlicher entgegen aller demokratisch legitimierten Verfahren und die Wissenschaft und macht die Gr\u00fcnen komplett unw\u00e4hlbar:\nIm Bundestag scheint eigentlich niemand mehr so richtig mit beiden Beinen auf dem Grundgesetz zu stehen. Auch gegen die totalit\u00e4ren Phantasien einer aufkeimenden Impfpflicht wollen die Menschen am 1.8. in Berlin auf die Stra\u00dfe gehen wollen. Ob man sie das in irgendeiner Form l\u00e4sst, ist fraglich. Grundrechte werden seit der Coronakrise mit zweierlei Ma\u00df gemessen. Von der Politik, den Beh\u00f6rden und auch von der ehemals 4. Gewalt im Staate. Da gibt es\n[die guten Demos](https://www.tagesspiegel.de/berlin/csd-berlin-2021-im-blog-65-000-leute-bei-parade-groesste-demo-in-der-coronakrise/27450424.html), auf denen sich Politiker gerne bunt zeigen:\nUnd dann gibt es\n[die schlechten Demos f\u00fcr Demokratie und Minderheitenschutz](https://www.tagesspiegel.de/politik/von-merkels-hinrichtung-fabuliert-querdenker-wollten-in-kassel-unruhe-stiften/27450518.html), die mit aller H\u00e4rte unterbunden geh\u00f6ren, weil sich die Menschen nicht (wie ebensowenig beim CSD) an Abstandsgebote und Maskenpflicht halten.\nAm 1.8. wird in Berlin vermutlich also wieder nicht so demonstriert werden k\u00f6nnen, wie dies 65.000 ein Wochenende davor tun konnten, um f\u00fcr eine bunte Minderheit zu werben. Wenn dann die Demokratiebewegung auch f\u00fcr Minderheitenschutz auf die Stra\u00dfe geht, wird deren G\u00e4ngelung von vielen in der Gesellschaft goutiert, ohne 1,5 Meter weiter zu denken, was dies f\u00fcr das eigene Schicksal bedeuten k\u00f6nnte. Im geschichtlichen Ma\u00dfstab wird das nur ein Wimpernschlag gewesen sein, wenn man so weiter macht. Aber das scheint dann so gewollt zu sein. Verr\u00fcckte Welt.\nZur\u00fcck zur Impfpflicht, die derzeit vorbereitet wird und einer Diskriminierung T\u00fcr und Tor \u00f6ffnen k\u00f6nnte, wie sie kaum ein CSD-Teilnehmer jemals erfahren haben d\u00fcrfte und weshalb auch an jenem Tag in anderen europ. L\u00e4ndern Hunderttausende auf die Stra\u00dfen gingen. In Frankreich ist man beispielsweise\n[schon einen ganzen Schritt weiter](https://norberthaering.de/die-regenten-der-welt/impfpflicht-macron/). Allein in Paris demonstrierten daher 161.000. Die gr\u00f6\u00dfte Gewerkschaft des Landes hat sich jetzt angeschlossen. [Existiert die EU eigentlich noch](https://lostineu.eu/corona-und-lgbt-die-freiheit-die-sie-meinen/)?\nWas soll denn die Exit-Strategie aus der Pandemie sein? Oder wie der Staatsrechtler Uwe Volkmann fragt:\n[Wann h\u00f6rt es auf?](https://www.zeit.de/politik/deutschland/2021-06/corona-massnahmen-staat-pandemiebekaempfung-grundsaetze-demokratie/komplettansicht)\nFr\u00fcher, als ein paar Menschen mehr noch bereit waren, weiter zu denken, w\u00e4re denen aufgefallen, dass die angek\u00fcndigte Exitstrategie, die uns verkauft wird, bereits auf Gibraltar existiert. Und just in den Tagen, in denen die obigen Autoren ihren geistigen Unrat in den Quantit\u00e4tsmedien in die Hirne ihrer Leser entleeren d\u00fcrfen, liest man andernorts von Gibraltar, das bereits Herdenschutz durch fast 100% Impfung erreicht hat und damit auf die sagenumwobene Inzidenz von 600 (!) kommt. Verr\u00fcckte Welt.\nAus anderen L\u00e4ndern mit hoher Impfquote wird \u00c4hnliches berichtet. Wie weit muss man sich von der Realit\u00e4t noch entfernen, ohne dass einen die kognitive Dissonanz zerrei\u00dft.\n[Das hat religi\u00f6se Z\u00fcge](https://www.youtube.com/watch?v=zbbbchsqBik).\nIch verstehe ja, dass sich niemand gerne das Weltbild zertr\u00fcmmern l\u00e4sst von diesen unseri\u00f6sen Quellen, die das Narrativ in Frage stellen, indem sie einfach n\u00fcchtern die Zahlen reportieren. Da ist es anscheinend angenehmer, weiter den bisherigen Quellen zu folgen und darauf zu vertrauen, dass man selbst dann wieder seine Grundrechte vollumf\u00e4nglich genie\u00dfen kann, wenn man mit etwas gespritzt wurde, das zumindest au\u00dferhalb der eigenen Quellen im validen Verdacht steht, die k\u00f6rperliche Unversehrtheit teils massiv zu beeintr\u00e4chtigen. Und bei einer paarhunderter Inzidenz einer Krankheit die zwar mittlerweile weitgehend ihren Schrecken verloren hat aber noch nicht ihre politische und mediale Nutzbarkeit, muss man schon arg naiv sein, wenn man denkt, man k\u00f6nne wieder unbeschwert leben, ohne turnusm\u00e4\u00dfig durchgeimpft zu werden. Nene, das ist sch\u00f6n auf Dauer angelegt, wenn Ihr es nicht beendet und Euch Euer Leben zur\u00fcckholt. Daf\u00fcr muss man auf die Stra\u00dfe gehen und noch weitaus mehr und vor allem einfach mal \u201eNein!\u201c sagen oder wie es die gro\u00dfe Philosophin Dr. hc. lib. Gabriele Susanne Kerner j\u00fcngst ausdr\u00fcckte:\n\u201eDie Frage ist nicht, was wir d\u00fcrfen, sondern die Frage ist, was wir mit uns machen lassen.\u201c\nJens Berger schreibt zu diesen Exzessen:\n\u201eErkl\u00e4rungsbed\u00fcrftig ist auch die Formulierung, man m\u00fcsse \u201eGeimpften Rechte zur\u00fcckgeben\u201c oder \u201eGeimpften Vorteile verschaffen\u201c. Wer so spricht, zieht nicht den verfassungskonformen Normalzustand heran, sondern hat bereits argumentativ \u201eeingepreist\u201c, dass jeder B\u00fcrger nur eingeschr\u00e4nkte Grundrechte genie\u00dft. Dies entspricht zwar dem \u2013 scharf zu kritisierenden \u2013 Ausnahmezustand, ist aber eben nicht die Grundlage f\u00fcr weitere Debatten. Wenn mir jemand 1.000 Euro wegnimmt und dann mit gro\u00dfem Gestus verk\u00fcndet, man k\u00f6nne dar\u00fcber nachdenken, mir 500 Euro zur\u00fcckzugeben, wenn ich mich richtig verhalte, ist dies kein Vorteil, sondern unter dem Strich immer noch ein Nachteil f\u00fcr mich. Ich bin geimpft und m\u00f6chte keine \u201eVorteile\u201c, sondern dass alle, egal ob geimpft oder ungeimpft, die gleichen Rechte genie\u00dfen. Mir m\u00fcssen keine Rechte zur\u00fcckgegeben werden, die ich ohnehin laut Verfassung besitze und die der Staat mir \u00fcberhaupt nicht ohne eine sehr, sehr gute Begr\u00fcndung wegnehmen darf. Und das ist kein individueller Wunsch, sondern mein unteilbares und nicht ver\u00e4u\u00dferbares Recht \u2013 zumindest behauptet dies das Grundgesetz.\u201c\nDas Infektionsschutzgesetz scheint f\u00fcr viele in Politik und Medien die neue Verfassung zu sein. Jens Bergers einleitende conclusio zog ich schon vor vielen Monaten:\n\u201eEs ist bitter: Die Feinde der freiheitlichen demokratischen Grundordnung dieses Staates sitzen heute in dessen h\u00f6chsten \u00c4mtern.\u201c\nDem ist nichts hinzuzf\u00fcgen.\nFaktenvernebler\nBereits sehr fr\u00fch in der Coronakrise hat sich der Journalist\n[Norbert H\u00e4ring zu den sog. Faktencheckern](https://norberthaering.de/medienversagen/correctiv-anti-journalisten/) ge\u00e4u\u00dfert, zu deren immer gleicher Funktionsweise ich in den letzten Artikeln ebenfalls schon [einiges geschrieben](https://publikum.net/masken-machen-mies/) habe. Sie bringen den Diskurs nicht weiter. Sie verhindern ihn.\nGanz exemplarisch hat sich das nun\n[am Beispiel eines Papiers renommierter und bekannter Pers\u00f6nlichkeiten](https://coronaaussoehnung.org) gezeigt, die eine Br\u00fccke bauen wollen, um endlich den notwendigen Diskurs zu beginnen, um einen Ausweg aus der Krise zu finden und Wege, die gespaltene Gesellschaft wieder zu vers\u00f6hnen.\nHier der d\u00fcrre\n[Faktenirgendwas](https://www.tagesschau.de/faktenfinder/corona-ausssoehnung-101.html) dazu. Und hier [die Stellungnahme des Auorenkollektivs](https://coronaaussoehnung.org/wp-content/uploads/2021/07/Covid-19-ins-Verhaeltnis-setzen_Erwiderung_Rohwedder_12-Juli-2021_01.pdf). M\u00f6ge sich jeder sein Bild machen, was das mit Fakten zu tun hat.\nAm verheerendsten wirken sich die Faktenchecker in ihrer Einseitigkeit aus. Karl Lauterbach, einer der Helden der radikalsten Ma\u00dfnahmenbef\u00fcrworter, lag so oft daneben, dass Faktenchecker mittlerweile bereits eine Bibliothek mit ihren Werken best\u00fccken k\u00f6nnten. Machen sie aber nicht. Das schlimme daran ist seine mediale Pr\u00e4senz, die Kritikern, die mit validen Daten aufwarten k\u00f6nnen, nicht verg\u00f6nnt ist.\nDas Gegenteil von Faktenchecken passiert jedoch dann, wenn die, die f\u00fcr diese Krise die Hauptverantwortung tragen, ihre Unwissenheit zur Schau stellen. Wie\n[Angela Merkel im Bundestag](https://multipolar-magazin.de/artikel/erwunschter-blindflug) zu den ct-Werten beim PCR-Test, [dem wohl verheerendsten Instrument der Pandemieerzeugung](https://www.uni-due.de/2021-06-18-studie-aussagekraft-von-pcr-tests).\nMan muss sich das Video ansehen, weil nach der Rede Merkels Winston im Miniwahr das Protokoll korrigiert und das Original ins Ged\u00e4chtnis-Loch geworfen hat. Im Protokoll kennt Merkel jetzt sogar die korrekte Bezeichnung des Virus und auch das mit der Infektiosit\u00e4t wurde halbwegs grade ger\u00fcckt. Doof mit dem Video, wo sich die unabh\u00e4ngigen Faktenchecker doch so sch\u00f6n zur\u00fcckgehalten haben, um nicht Fake News zu wittern, wo mal wirklich welche waren. Bei der Hauptverantwortlichen f\u00fcr die Beseitigung des demokratischen Rechtsstaats.\nSo bitter es ist, aber die Faktenchecker gerieren sich in der Coronakrise oft genug als hetzerische, staatstragende Propagandamaschinerie, die spalterisch und gesellschaftszersetzend wirkt, insbesondere dann, wenn der Ton weit schlimmer ist, als ich - oft kritisiert daf\u00fcr - jemals schreiben k\u00f6nnte.\nPsychologie:\nDie Coronakrise wurde ausgel\u00f6st durch eine Massenpsychose, in die die Menschen versetzt wurden. Ich w\u00fcrde es sogar als psychologische Kriegsf\u00fchrung bezeichnen und das ist gar nicht so weit hergeholt. Das\n[Strategiepapier des Innenministeriums](https://fragdenstaat.de/blog/2020/04/01/strategiepapier-des-innenministeriums-corona-szenarien/) (link) nenne ich deshalb auch Panikpapier, weil bei den Menschen bewusst ein Schockzustand herbeigef\u00fchrt und Panik erzeugt werden sollte. So hei\u00dft es in dem Papier:\nUm die gew\u00fcnschte Schockwirkung zu erzielen, m\u00fcssen die konkreten Auswirkungen einer Durchseuchung auf die menschliche Gesellschaft verdeutlicht werden:\n- 1) Viele Schwerkranke werden von ihren Angeh\u00f6rigen ins Krankenhaus gebracht, aber abgewiesen, und sterben qualvoll um Luft ringend zu Hause. Das Ersticken oder nicht genug Luft kriegen ist f\u00fcr jeden Menschen eine Urangst. Die Situation, in der man nichts tun kann, um in Lebensgefahr schwebenden Angeh\u00f6rigen zu helfen, ebenfalls. Die Bilder aus Italien sind verst\u00f6rend.\n- 2) \"Kinder werden kaum unter der Epidemie leiden\": Falsch. Kinder werden sich leicht anstecken, selbst bei Ausgangsbeschr\u00e4nkungen, z.B. bei den Nachbarskindern. Wenn sie dann ihre Eltern anstecken, und einer davon qualvoll zu Hause stirbt und sie das Gef\u00fchl haben, Schuld daran zu sein, weil sie z.B. vergessen haben, sich nach dem Spielen die H\u00e4nde zu waschen, ist es das Schrecklichste, was ein Kind je erleben kann.\n- 3) Folgesch\u00e4den: Auch wenn wir bisher nur Berichte \u00fcber einzelne F\u00e4lle haben, zeichnen sie doch ein alarmierendes Bild. Selbst anscheinend Geheilte nach einem milden Verlauf k\u00f6nnen anscheinend jederzeit R\u00fcckf\u00e4lle erleben, die dann ganz pl\u00f6tzlich t\u00f6dlich enden, durch Herzinfarkt oder Lungenversagen, weil das Virus unbemerkt den Weg in die Lunge oder das Herz gefunden hat. Dies m\u00f6gen Einzelf\u00e4lle sein, werden aber st\u00e4ndig wie ein Damoklesschwert \u00fcber denjenigen schweben, die einmal infiziert waren. Eine viel h\u00e4ufigere Folge ist monate- und wahrscheinlich jahrelang anhaltende M\u00fcdigkeit und reduzierte Lungenkapazit\u00e4t, wie dies schon oft von SARS-\u00dcberlebenden berichtet wurde und auch jetzt bei COVID-19 der Fall ist, obwohl die Dauer nat\u00fcrlich noch nicht abgesch\u00e4tzt werden kann.\nAusserdem sollte auch historisch argumentiert werden, nach der mathematischen Formel: 2019 = 1919 + 1929\nDas w\u00e4re als singul\u00e4res Erlebnis schon schlimm genug, aber auch nicht ungew\u00f6hnlich. Schlie\u00dflich leben wir in Deutschland, da geht es bei so etwas gr\u00fcndlich und wenig zimperlich zu. Aber das ist ein weltweites Ph\u00e4nomen. Ein Beispiel aus England und damit kommen wir schon wieder zu den Medien.\n[Dar\u00fcber hatten die Nachdenkseiten berichtet](https://www.nachdenkseiten.de/?p=72641), die einen Artikel von RTdeutsch aufgriffen und in dem Artikel eben auch schrieben, dass offenbar nur RT dar\u00fcber berichtet hatte.\nIch twitterte das damals, eben weil dar\u00fcber nicht berichtet wurde und sich der Bericht nur in den Nachdenkseiten und RT wiederfand. Und die Reaktion f\u00e4llt dann wie immer aus, wenn man auf Quellen zur\u00fcckgreifen muss, die als einzige die wirklich ma\u00dfgeblichen Dinge berichten und sich nicht auf die Produktion von Horrorzahlen beschr\u00e4nken. Diese aufkl\u00e4renden Quellen sind dann unseri\u00f6s, nicht etwa die, die die gesamte Krise erst erm\u00f6glicht haben durch ihr Trommelfeuer unbrauchbarer Zahlen. So in etwa ist dann die immer gleiche Reaktion:\nApplaus Applaus. Noch antikaufkl\u00e4rerischer kann es dann nicht mehr zugehen. Eine andere Reaktion h\u00e4tte sein k\u00f6nnen, dass man anerkennt, dass es wirklich skandal\u00f6s ist, dass die Medien nicht in epischer Breite \u00fcber die Grundlagen dieser Krise und \u00fcber Psychologie berichten. Psychologie ist die m\u00e4chtigste Disziplin in dieser Krise. Von Corona haben die wenigsten direkt etwas mitbekommen, aber alle sind in eine Angststarre gefallen, die das Denken aussetzte. Und sehr viele befinden sich trotz immer besserer Daren noch immer darin.\nDabei kann man in anderen Medien au\u00dferhalb der Quantit\u00e4tsmedien so viel \u00fcber Psychologie lernen und sich damit auch erschlie\u00dfen, was in der Bev\u00f6lkerung eigentlich los ist. Ich empfehle dazu durchaus mal, sich mit erlernter Hilflosigkeit, dem Milgram-Experiment, Veranwortungsdiffusion, Gefangenen-Dilemma, Standford-Prison-Experiment, sunk-cost-effect etc. zu befassen. Das k\u00f6nnte lohnend sein. Oder besonders spannend fand ich auch das Konformit\u00e4tsexperiment von Asch, weil ich mir kaum erkl\u00e4ren kann, wie Menschen selbst ganz offensichtlich falsche Zahlen f\u00fcr richtig halten. Vielleicht tun sie es gar nicht, weil es zu offensichtlich ist. Vielleicht fehlt der Mut und das Selbstbewusstsein, die es jetzt br\u00e4uchte, um zumindest die Kinder zu sch\u00fctzen.\nUnd wenn man das alles mal zusammendenkt und zumindest als Denkm\u00f6glichkeit in Betracht zieht, bekommt man vielleicht auch eine Idee, dass es gar nicht um Gesundheit geht, wenn man das mit den Zahlen in der Realit\u00e4t und den vollkommen haneb\u00fcchenen Ma\u00dfnahmen abgleicht, die vielleicht genau deshalb so haneb\u00fcchen sind mit zwischendrin etwas Hoffnungsschimmer. Peter F. Meyer\n[berichtet \u00fcber den Vergleich eines britschen Abgeordenten](https://tkp.at/2021/07/26/corona-massnahmen-fuehren-zu-stockholm-syndrom/) mit dem Stockholm-Syndrom:\n\u201eIn einem\n[Kommentar](https://www.dailymail.co.uk/debate/article-9798365/GRAHAM-BRADY-believe-real-purpose-masks-social-control-time-stop-fear.html) in der britischen Daily Mail schrieb der konservative Abgeordnete Graham Brady, Vorsitzender des Tory 1922 Committee, dass der wahre Zweck der Masken sei, Kontrolle \u00fcber die Menschen auszu\u00fcben.\nEr verweist auf das Stockholm Syndrom, das analysiert wurde nach dem versuchten Bank\u00fcberfall am 23. August 1973 am Stockholmer Norrmalmstorg-Platz. Vier Geiseln waren f\u00fcnf Tage in der Gewalt der R\u00e4uber. Dabei zeigte sich eine seltsame Reaktion der Geiseln, die eine enge Bindung zu ihren Gef\u00e4ngnisw\u00e4rtern aufbauten.\u201c\nHier eine\n[deutsche \u00dcbersetzung](https://alschner-klartext.de/2021/07/19/ein-befreiendes-eingestaendnis-einer-zynischen-politik/) des Artikels. Auch vor dem Hintergrund: Will man sich wirklich weiterhin mit dem Z\u00e4hlen von Inzidenzen, Mutanten und Antik\u00f6rpern befassen oder sich eher mal die Frage stellen, warum man sich wie eine Geisel verh\u00e4lt?\nStattdessen\nDie Berichterstattung in den Leitmedien m\u00f6chte ich nur an zwei Beispielen dokumentieren. Zun\u00e4chst an der\n[Reaktion des Tagesspiegel ](https://www.tagesspiegel.de/kultur/filmbranche-und-querdenker-das-netzwerk-hinter-allesdichtmachen/27149604.html)auf die Schauspieler-Aktion allesdichtmachen. Kann man machen, ist aber halt dann kein Journalismus. Aber recht exemplarisch f\u00fcr den Tagesspiegel und gro\u00dfe Teile der Medienlandschaft. Damit sind die aber selbst f\u00fcr ihre Verh\u00e4ltnisse so \u00fcbers Ziel hinausgeschossen, dass sie sich bereit erkl\u00e4ren mussten, auch die Gegenseite zu Wort kommen zu lassen. Das haben sie in einer 4 zu 1 Situation nicht besonders gut hinbekommen. [Kann man hier nachsehen](https://www.youtube.com/watch?v=Iu8JxpV1E2I):\nDer eine Journalist h\u00e4ngt nach seinen Angaben an den Lippen von Wieler. und Drosten. Da hat er es wunderbar auf den Punkt gebracht. Das Praktische ist ja auch, dass die sich sehr h\u00e4ufig \u00e4u\u00dfern. Das muss man dann nur ehrf\u00fcrchtig abschreiben. Sein Kollege meint zum Arzt in der Runde: \u201eSchauen Sie sich die Bilder aus Indien an. Das sind die gleichen Menschen.\u201c Und verdreht die Augen, als ihn der Arzt zu Recht darauf hinweist, dass man das nicht vergleichen k\u00f6nne. \u201eDOCH!\u201c ist die alle Fakten ausblendende, f\u00fcr Corona so typische Trotzreaktion, weil nicht sein kann, was nicht sein darf. Das ist Palmstr\u00f6m in der Corona-Edition. So geht das schon seit Beginn der Pandemie. St\u00e4ndig soll man sich Bilder von woanders ansehen, die nicht vergleichbar sind, ohne dass relevante Informationen mit einbezogen werden wie etwa die Zusammensetzung der Bev\u00f6lkerung, die Lebensumst\u00e4nde, die Luftverschmutzung, die Altersstruktur, die Wohnverh\u00e4ltnisse, das Gesundheitssystem\u2026 Auf solch schlichter Grundlage scheint man aber (nicht nur) beim Tagesspiegel zu arbeiten.\nBevor ich zu Alternativen zu den Leitmedien komme ein weiteres Beispiel, dass diesen Akt medialer Notwehr erkl\u00e4rt.\n[In einem Interview bei OvalMedia](https://www.youtube.com/watch?v=GeG8ogthaMs) antwortete Prof. Dr. Franz Allerberger (Leiter f\u00fcr \u00d6ffentliche Gesundheit bei der \u00f6sterreichischen Agentur f\u00fcr Gesundheit und Ern\u00e4hrungssicherheit (AGES), also sowas wie der deutsche Lothar Wieler) auf die Frage, was ohne den PCR-Test gewesen w\u00e4re (etwas verk\u00fcrzt): Dann h\u00e4tten wir von einer Pandemie nichts bemerkt.\nDas habe ich f\u00fcr diesen Artikel gesucht. Gefunden habe ich es auf den ersten Seiten der Suchtreffer leider nicht in einem Medium, das von den Ma\u00dfnahmenbef\u00fcrworten als seri\u00f6se Quelle eingestuft w\u00fcrde.\nAn erster Stelle war\n[RTdeutsch](https://de.rt.com/europa/119930-osterreichs-wieler-ohne-pcr-test/), gefolgt von Tichys Einblick, achgut, blauer Bote, report24, wochenblick usw. Jetzt mal die Frage an die geneigte Leserschaft dieses Artikels: wer ist denn nun unseri\u00f6s? Jemand der diese Quellen mit der Aussage eines Experten zitiert in Ermangelung \u201eseri\u00f6ser\u201c Quellen, weil die es seit Beginn der Krise vorziehen, Angst zu sch\u00fcren durch ein Trommelfeuer der Zahlen? Oder doch derjenige, der dies als unseri\u00f6s diffamiert und dadurch die gesellschaftlichen Zust\u00e4nde mit zu verantworten hat mit der Folge der gentherapeutischen Behandlung von Kindern?\nBedauerlicherweise ist auch der Wissenschaftjournalismus in der Coronakrise oftmals sinnlose Besch\u00e4ftigungstherapie und unterst\u00fctzt die verfassungswidrige Politik und die Zementierung von Macht bei Exekutive und Konzernen. Wer denkt, er k\u00f6nne die Coronakrise l\u00f6sen, indem er auf das Virus und seine verwandten Mutanten schaut und Antik\u00f6rper nach Verabreichung von irgendwas z\u00e4hlt und vergleicht, hat sie nicht so umfassend verstanden, dass er einer L\u00f6sung nahe kommt.\nF\u00fcr einen breiteren Blick w\u00e4re es f\u00fcr alle erst einmal erforderlich, die Angst zu \u00fcberwinden. Dazu empfiehlt es sich, die sozialen Medien mal zwei Wochen abzuschalten und zumindest auf die Corona-Berichterstattung der Leitmedien zu verzichten. Stattdessen kann man in die Natur gehen und jeden Tag einen Menschen umarmen. Und wenn man dann merkt, dass man auf einmal gar nicht mehr so viel Angst hat, kann man sich zun\u00e4chst mal Informationen aus einer anderen Richtung ansehen.\nAlternativen\u2026\n\u2026g\u00e4be es so viele. Nachdenkseiten und multipolar beispielsweise, die immer wieder auf interessante Beitr\u00e4ge hinweisen - sowohl solche aus den etablierten Medien als auch auf solche, die vor l\u00e4ngerer und k\u00fcrzerer Zeit neu entstanden. Und davon gibt es zahlreiche, komplette Zeitungen oder blogs von Einzelk\u00e4mpfern im Internet wie beispielsweise Infosperber, Norbert H\u00e4ring, corona-ausschuss und 2020news, Telepolis. Oder podcasts. Ich bin ein riesiger Fan von podcasts und Interviews, die ich mir t\u00e4glich zum Leidwesen meiner Umgebung stundenlang anh\u00f6ren kann wie punkt.preradovic, Gunnar Kaiser (weil ich\u2019s grad offen hab:\n[anschauen](https://odysee.com/@kaisertv:a/vom-regen-in-die-traufe-%E2%80%93-ulrike:6?)), FairTalk, Oval Media (Narrative, B&B), Servus TV usw. Das empfinde ich sehr abwechslungsreich, besonders, wenn beide Extrempositionen in einer Sendung aufeinandertreffen und man einen Erkenntnisgewinn hat, den man beim hundertsten Lauterbach im \u00f6ffentlich-rechtlichen vergeblich sucht.\nIch gehe da nicht ganz naiv vor und habe f\u00fcr mich ein paar Spielregeln aufgestellt, die nicht davor sch\u00fctzen, auch mal daneben zu liegen, aber die es eher erlauben, sich zu einem Thema ein ausgewogenes Bild zu machen.\nNat\u00fcrlich muss man sich klar machen, wo man gerade ist. Dann kann man aber auch mal RTdeutsch (o.\u00e4.) mit einbeziehen, das ja gerne als Feindpropaganda verschrien wird oder Reitschuster, der in der Bundespressekonferenz mittlerweile als einziger kritische Fragen stellt. Aber man muss sich das gleiche setting auch zulegen, wenn man sich den Leitmedien aussetzt, die - ich sage es mal eher vorsichtig - auch nicht immer ganz frei von Propaganda sind.\nMan sollte sich so viele Perspektiven wie m\u00f6glich verschaffen, was schwierig ist, wenn die Leitmedien fast einheitlich das gleiche Narrativ mit der gleichen Handvoll Fachleute bedienen. Auch und vor allem ausl\u00e4ndische Perspektiven k\u00f6nnten hilfreich sein. Wenn man das macht, ist es schon best\u00fcrzend zu erkennen, wie eng hier bei uns der Fokus in den Medien ist.\nKritisch sollte man immer bleiben - \u00fcberall - aber keine falsche Scheu haben. Nat\u00fcrlich teilt man nicht jede Meinung eines Experten und findet manche Facette vielleicht sogar absurd. Aber ist das in den Leitmedien anders? Ich w\u00fcrde beispielsweise auch nicht gerade Marc Beise von der SZ als prim\u00e4re Anlaufstation in Wirtschaftsfragen aufsuchen oder Alice Bota in der ZEIT als neutrale Quelle zu Russland heranziehen. Extrempositionen gibt es immer - aber in beide Richtungen. Bei Corona gibt es hardcore-Verschw\u00f6rungstheoretiker ebenso wie hardcore-Verschw\u00f6rungsleugner. Und au\u00dferhalb dieser geschlossenen Weltbilder gibt es einen Haufen Graut\u00f6ne und tausende Fachleute, die nicht in den Leitmedien zu Wort kommen.\nEin guter Eigenschutz ist tats\u00e4chlich der Tipp, keinem Vorschlagsalgorithmus zu folgen bei youtube, sondern die Videos selbst aussuchen, die man sich ansehen will. Es gibt genug Empfehlungen auf seri\u00f6sen Seiten und Blogs, die ein Mensch zusammengestellt hat. Aber auch hier ist der Hinweis auf einen undurchschaubaren und die Konsumenten radikalisierenden Algorithmus zu eng: Dann sollte man vielleicht auch \u00fcber die Beendigung seines Mainstream-Abos nachdenken, das einem die Blattlinie ganz automatisch ins Hirn sp\u00fclt und die Konsumenten ebenso radikalisiert.\nWas sehr wesentlich sein d\u00fcrfte: Wir sollten zumindest den \u00f6ffentlich-rechtlichen Rundfunk, den wir dringend brauchen, demokratisieren. Dazu geh\u00f6rt ein repr\u00e4sentativer Programmbeirat mit Sanktionsm\u00f6glichkeiten, eine Finanzierung, die nicht in weiten Teilen zu derart unanst\u00e4ndigen Bez\u00fcgen und Pensionsanspr\u00fcchen, Programm- und Geb\u00e4udewucherungen f\u00fchrt, dass sie ein Affront f\u00fcr die Beitragszahler sind. Vor allem aber geh\u00f6rt dazu politische Unabh\u00e4ngigkeit, also das exakte Gegenteil einer\n[Besetzung der ARD-Programmdirektion mit der Tochter von Wolfgang Sch\u00e4uble](https://www.deutschlandfunk.de/neue-ard-programmdirektorin-interessenkonflikte-bei.2907.de.html?dram:article_id=484866) und Ehefrau des Baden-W\u00fcrttembergischen Innenministers und stellvertretenden Ministerpr\u00e4sidenten Thomas Strobl. So etwas ist vollkommen absurd und einer funktionierenden Demokratie abtr\u00e4glich und unw\u00fcrdig.\nAusweg?\nDie gesamte verfahrene Situation der Coronakrise f\u00e4llt ma\u00dfgeblich auf die Leitmedien zur\u00fcck, von der Panik, in die die Gesellschaft versetzt wurde bis hin zur aktuell \u00fcberhitzten und jegliche Logik vermissen lassende Debatte \u00fcber die sog. Impfung.\nNat\u00fcrlich gab es eine wohl recht \u00fcberschaubare Gruppe in der Politik, die die Menschen in Angst und Schrecken versetzen wollte und das scheint nicht nur in der Bev\u00f6lkerung geklappt zu haben, sondern auch bei einem Gro\u00dfteil der Medien und der \u00fcbrigen Politiker.\nVerwerflich an der Berichterstattung in den Leitmedien ist jedoch, dass fast ausnahmslos das Narrativ der Bundesregierung staatstragend unhinterfragt in Dauerschleife gesendet wurde. Vielmehr wurde es den Menschen regelrecht eingeh\u00e4mmert und wird es bis heute, obwohl sich alle wesentlichen Grundlagen der Ma\u00dfnahmen in den vergangenen Monaten in Luft aufgel\u00f6st haben: Die PCR-Tests liefern unbrauchbare Zahlen, die Intensivbetten waren zu keinem Zeitpunkt \u00fcberlastet, unser Immunsystem ist sehr wohl in der Lage, mit dem Virus umzugehen, weshalb 85% gar nicht oder nur recht wenig davon mitbekommen, weil das Immunsystem es \u00fcberhaupt nicht zul\u00e4sst, dass sich eine derart hohe Virenlast entwickelt, die zu schwerer Krankheit oder hoher Infektiosit\u00e4t f\u00fchrt. Daher gibt es auch valide Kritik an exponentiellen Steigerungen der Fallzahlen, die eher an der Ausweitung der Testungen lagen. Asymptomatische sind keine Superspreader, weshalb der pandemische Imperativ kategorisch als gesellschaftszersetzend abzulehnen ist, weil er jeden anderen und sich selbst als Gefahr f\u00fcr die Allgemeinheit anzusehen verpflichtete undsoweiterundsofort.\nJeder m\u00f6ge nun f\u00fcr sich entscheiden, welche Quellen als unseri\u00f6s abekanzelt werden und welche noch als seri\u00f6s eingestuft werden k\u00f6nnen. So einfach, wie sich die Ma\u00dfnahmenbef\u00fcrworter die Welt machen wollen, ist sie jedenfalls nicht.\nPolitikern b\u00f6te sich ein Ausweg aus der Coronakrise. Sie wurden durch mediales Sperrfeuer wie alle anderen in einen ausweglosen Irrweg getrieben. Ein Ausweg besteht nur darin, diesen Irrtum anzuerkennen und den Irrweg zu beenden. Danach kann und muss eine Aufarbeitung beginnen.\nDir gef\u00e4llt, was J\u00fcrgen M\u00fcller schreibt?\nDann unterst\u00fctze J\u00fcrgen M\u00fcller jetzt direkt:", "language": null, "image": "https://publikum.net/content/images/2021/07/iStock-537805220.jpg", "pagetype": "article", "links": ["https://publikum.net", "https://publikum.net/tag/politik/", "https://publikum.net/tag/wissen/", "https://publikum.net/tag/gesellschaft/", "https://publikum.net/tag/sport/", "https://publikum.net/tag/wirtschaft/", "https://publikum.net/tag/leben/", "https://publikum.net/tag/digitalisierung/", "https://publikum.net/tag/kultur/", "https://publikum.net/tag/literarisches/", "https://publikum.net/author/publikum/", "/signup/", "/ghost/", "https://publikum.net/tag/politik/", "https://publikum.net/tag/wissen/", "https://publikum.net/tag/gesellschaft/", "https://publikum.net/tag/sport/", "https://publikum.net/tag/wirtschaft/", "https://publikum.net/tag/leben/", "https://publikum.net/tag/digitalisierung/", "https://publikum.net/tag/kultur/", "https://publikum.net/tag/literarisches/", "https://publikum.net/author/publikum/", "/impressum", "/nutzungsbedingungen", "/datenschutz", "https://publikum.net", "https://publikum.net/tag/politik/", "https://publikum.net/tag/wissen/", "https://publikum.net/tag/gesellschaft/", "https://publikum.net/tag/sport/", "https://publikum.net/tag/wirtschaft/", "https://publikum.net/tag/leben/", "https://publikum.net/tag/digitalisierung/", "https://publikum.net/tag/kultur/", "https://publikum.net/tag/literarisches/", "https://publikum.net/author/publikum/", "/signup/", "/ghost/", "/tag/medienkritik/", "/author/juergen-mueller/", "https://www.claus-von-wagner.de/tv/anstalt/20140429-europaeische-union", "https://www.youtube.com/watch?v=_k_QbpFl7RM", "https://www.tagesanzeiger.ch/ausland/amerika/27-000-prberater-polieren-image-der-usa/story/20404513", "https://www.nachdenkseiten.de/?p=42173#more-42173", "https://www.ialana.de/aktuell/veranstaltungen-ialana/2179-dokumentation-des-medienkongresses", "https://www.claus-von-wagner.de/tv/anstalt/20151020-konflikte-im-nahen-und-mittleren-osten", "https://www.claus-von-wagner.de/tv/anstalt/20161101-syrienkonflikt-und-voelkerrecht", "https://publikum.net/glyphosat-fur-das-immunsystem/", "https://publikum.net/corona-impfung-schwierige-gemengelelage-2/", "https://publikum.net/wahrend-der-anfange/", "https://taz.de/Verschwoerungsideologen-im-Flutgebiet/!5781929/", "https://www.aerzteblatt.de/archiv/220042/Epidemiologie-im-Fokus-Expertenkrise-in-der-Pandemie", "https://www.heise.de/news/UN-Folterbeauftragter-Fall-Assange-hat-Vertrauen-in-Rechtsstaat-erschuettert-6020798.html", "https://corona-transition.org/nach-kritik-an-impfstoffen-wikipedia-loscht-den-erfinder-der-mrna-technologie", "https://tkp.at/2021/07/20/erfinder-von-mrna-impfstoffen-aeussert-sich-kritisch-zu-covid-praeparaten/", "https://www.faz.net/aktuell/politik/inland/warum-wikipedia-seine-kontrollinstrumente-schaerfen-muss-17194722.html?GEPC=s3", "https://www.spiegel.de/netzwelt/web/wikipedia-autor-zu-8000-euro-schadensersatz-verurteilt-a-57314901-39fd-4514-8721-3787fde50dd4", "https://www.rbb24.de/studiofrankfurt/panorama/2021/01/wikipedia-jubilaeum-viadrina-europa-universitaet.html", "https://www.youtube.com/watch?v=l0P4Cf0UCwU", "https://www.nachdenkseiten.de/?p=69475", "https://www.youtube.com/watch?v=90C_TpR8qro", "https://wikihausen.de/dokumentarfilm-die-dunkle-seite-der-wikipedia/", "https://publikum.net/demokratiezersetzung-2-0/", "https://www.nachdenkseiten.de/?p=74357", "https://soundcloud.com/radiomuenchen/die-psychoogie-der-verschworungsleugner-von-tim-foyle", "https://www.zeit.de/gesellschaft/2021-07/corona-impfung-pflicht-ethik-massnahmen-grundrechte", "https://web.archive.org/web/20210723101727/https://www.zeit.de/2021/30/corona-impficht-ddr-siegwart-bigl-ethik-medizin", "https://tkp.at/2021/07/30/die-besten-infografiken-zu-corona-und-impfungen/", "https://www.nytimes.com/2021/07/30/health/covid-cdc-delta-masks.html?smtyp=cur&smid=tw-nytimes", "https://www.nzz.ch/meinung/der-andere-blick/impfzwang-das-grundgesetz-gilt-auch-fuer-ungeimpfte-ld.1637526", "https://www.t-online.de/nachrichten/deutschland/id_90506968/corona-montgomery-stellt-sich-hinter-braun-vorstoss-zu-nicht-geimpften.html", "https://www.berliner-zeitung.de/news/leopoldina-forscher-allgemeinheit-muss-fuer-dummheit-der-impfgegner-zahlen-li.174017", "http://www.ippnw-nuernberg.de/aktivitaet2_1.html", "https://www.sueddeutsche.de/politik/corona-impfgegner-rechtsextreme-antisemitismus-1.5362745", "https://2020news.de/staatsanwaltschaft-erfurt-macht-selbst-vor-bundestagskandidaten-nicht-halt-sechs-hausdurchsuchungen-gleichzeitig-wegen-sensationsurteil/", "https://www.spiegel.de/politik/deutschland/corona-annalena-baerbock-schliesst-einschraenkungen-fuer-ungeimpfte-nicht-aus-a-df7af99e-b6be-4e96-887a-be8c88a3945e", "https://www.tagesspiegel.de/berlin/csd-berlin-2021-im-blog-65-000-leute-bei-parade-groesste-demo-in-der-coronakrise/27450424.html", "https://www.tagesspiegel.de/politik/von-merkels-hinrichtung-fabuliert-querdenker-wollten-in-kassel-unruhe-stiften/27450518.html", "https://norberthaering.de/die-regenten-der-welt/impfpflicht-macron/", "https://lostineu.eu/corona-und-lgbt-die-freiheit-die-sie-meinen/", "https://www.zeit.de/politik/deutschland/2021-06/corona-massnahmen-staat-pandemiebekaempfung-grundsaetze-demokratie/komplettansicht", "https://www.youtube.com/watch?v=zbbbchsqBik", "https://norberthaering.de/medienversagen/correctiv-anti-journalisten/", "https://publikum.net/masken-machen-mies/", "https://coronaaussoehnung.org", "https://www.tagesschau.de/faktenfinder/corona-ausssoehnung-101.html", "https://coronaaussoehnung.org/wp-content/uploads/2021/07/Covid-19-ins-Verhaeltnis-setzen_Erwiderung_Rohwedder_12-Juli-2021_01.pdf", "https://multipolar-magazin.de/artikel/erwunschter-blindflug", "https://www.uni-due.de/2021-06-18-studie-aussagekraft-von-pcr-tests", "https://fragdenstaat.de/blog/2020/04/01/strategiepapier-des-innenministeriums-corona-szenarien/", "https://www.nachdenkseiten.de/?p=72641", "https://twitter.com/docugraf/status/1395714936844783621?ref_src=twsrc%5Etfw", "https://tkp.at/2021/07/26/corona-massnahmen-fuehren-zu-stockholm-syndrom/", "https://www.dailymail.co.uk/debate/article-9798365/GRAHAM-BRADY-believe-real-purpose-masks-social-control-time-stop-fear.html", "https://alschner-klartext.de/2021/07/19/ein-befreiendes-eingestaendnis-einer-zynischen-politik/", "https://www.tagesspiegel.de/kultur/filmbranche-und-querdenker-das-netzwerk-hinter-allesdichtmachen/27149604.html", "https://www.youtube.com/watch?v=Iu8JxpV1E2I", "https://www.youtube.com/watch?v=GeG8ogthaMs", "https://de.rt.com/europa/119930-osterreichs-wieler-ohne-pcr-test/", "https://odysee.com/@kaisertv:a/vom-regen-in-die-traufe-%E2%80%93-ulrike:6?", "https://www.deutschlandfunk.de/neue-ard-programmdirektorin-interessenkonflikte-bei.2907.de.html?dram:article_id=484866", "/tag/medienkritik/", "/tag/medien/", "/tag/corona/", "/tag/corona-impfung-2/", "/tag/demokratie/", "https://www.facebook.com/sharer/sharer.php?u=https://publikum.net/leitmedien-seriose-quellen/", "https://twitter.com/share?text=Leitmedien%20-%20seri%C3%B6se%20Quellen%3F&url=https://publikum.net/leitmedien-seriose-quellen/", "http://www.linkedin.com/shareArticle?mini=true&url=https://publikum.net/leitmedien-seriose-quellen/&title=Leitmedien%20-%20seri%C3%B6se%20Quellen%3F", "whatsapp://send?text=https://publikum.net/leitmedien-seriose-quellen/", "/cdn-cgi/l/email-protection#c3aba2afafac83b3b6a1afaaa8b6aeedada6b7", "/ghost/#/editor/post/"]}