{"title": "Faktencheck: Sorgt die Grippeschutzimpfung f\u00fcr eine Entlastung bei Covid-19?", "author": "OLIVER M\u00c4RTENS", "url": "https://multipolar-magazin.de/artikel/faktencheck-grippeschutzimpfung", "hostname": "multipolar-magazin.de", "description": "Ein gr\u00fcndlicher Blick auf Nutzen, Risiken und die wissenschaftliche Evidenz", "sitename": "multipolar-magazin.de", "date": "2020-09-29", "id": null, "license": null, "body": null, "comments": "Diskussion3 Kommentare", "commentsbody": null, "raw_text": null, "text": "Faktencheck: Sorgt die Grippeschutzimpfung f\u00fcr eine Entlastung bei Covid-19?\n[OLIVER M\u00c4RTENS](/autorenarchiv?autor=Oliver M\u00e4rtens), 29. September 2020, [3 Kommentare](https://multipolar-magazin.de/artikel/faktencheck-grippeschutzimpfung#diskussion)\nEine Entlastung bei der Pandemie durch die Grippeschutzimpfung d\u00fcrfte Bundesgesundheitsminister Jens Spahn gemeint haben, als er j\u00fcngst darauf\n[hinwies](https://www.n-tv.de/panorama/Arzte-fuerchten-Mangel-an-Grippe-Impfdosen-article22038594.html), dass Schutzimpfungen \u201ef\u00fcr das Grippegeschehen einen deutlichen Unterschied machten\u201c, da \u201esowohl die Grippe als auch COVID-19 dieselben Teile des Gesundheitswesens gleichzeitig belasteten\u201c. Das \u00c4rzteblatt [zitiert](https://www.aerzteblatt.de/nachrichten/116076/Kinderaerzte-empfehlen-Grippeschutzimpfung-fuer-Kinder) ihn mit den Worten: \u201eJeder, der sich und seine Kinder impfen lassen will, sollte und kann das tun.\u201c\nAuch der Bonner Virologe Hendrik Streeck ist \u201e\u00fcberzeugter Impf-Fan\u201c, wie er in der Sendung ZDF heute live\n[bekannte](https://www.zdf.de/nachrichten/panorama/coronavirus-streeck-impfstoff-100.html). Weiter f\u00fchrte er aus: \u201eGrippeimpfung hat den Vorteil, dass, wenn sich viele Menschen impfen lassen und wir eine Grippewelle haben sollten, dass wir zumindest diese Menschen nicht im Krankenhaus sehen.\u201c Streeck vermutet, dass eine Grippeimpfung m\u00f6glicherweise auch einen gewissen Schutz gegen COVID-19 bieten k\u00f6nne, denn: \"Man nimmt an, dass das Immunsystem geboostet wird.\"\nMissverst\u00e4ndlich ist eine weitere Aussage von ihm, die vom ZDF so wiedergegeben wird: \"Generell k\u00f6nnen wir eine Pandemie nur \u00fcber Impfstoffe kontrollieren.\" Doch dann wird er weiter zitiert mit: \"Es ist eine der billigsten, aber auch effektivsten Methoden, sich gegen Erreger zu wehren.\" Im Gesamtzusammenhang seiner Aussagen betrachtet, sagt Streeck also nicht, dass Impfungen das einzige Mittel der Pandemiekontrolle seien, sondern dass sie in seinen Augen eine Vorzugsstellung gegen\u00fcber anderen m\u00f6glichen Ma\u00dfnahmen einn\u00e4hmen, da sie allein bereits hinreichend f\u00fcr eine Pandemiekontrolle seien.\nBevor in diesem Beitrag auf die Grippeschutzimpfung eingegangen wird, soll zun\u00e4chst eine Reihe von Suggestionen, welche sowohl die Artikel\u00fcberschrift als auch die Aussagen von Spahn und Streeck enthalten, n\u00e4her betrachtet werden.\nExistiert COVID-19?\nNicht jede Suggestion muss falsch sein und COVID-19 k\u00f6nnte tats\u00e4chlich existieren. Dennoch f\u00fchrt die Auseinandersetzung mit dieser fast trivial anmutenden Frage zu verbl\u00fcffenden Erkenntnissen. Denn der Erreger, der COVID-19 verursachen soll, wurde bisher nicht zweifelsfrei nachgewiesen. Der am 27. Juni 2020 von Torsten Engelbrecht und Konstantin Demeter ver\u00f6ffentlichte Artikel\n[\u201eCOVID19 PCR Tests are Scientifically Meaningless\u201c](https://off-guardian.org/2020/06/27/covid19-pcr-tests-are-scientifically-meaningless/) \u2013 in deutscher \u00dcbersetzung [hier](https://www.rubikon.news/artikel/die-nonsens-tests) \u2013 beschreibt den Weg, den die beiden Autoren gegangen sind, um die Existenz des Virus SARS-CoV-2 zu \u00fcberpr\u00fcfen.\nSie befragten eine Reihe von Wissenschaftlern, welche vermeintliche Gensequenzen des Virus aufgezeigt hatten, ob diese vor der Genbestimmung den angenommen Virus korrekt isoliert und gereinigt hatten. Sollte dies n\u00e4mlich nicht der Fall gewesen sein, w\u00fcrde sich genetisches Material unbekannter Herkunft mit dem des vermeintlichen Virus mischen und die ermittelten Gensequenzen k\u00f6nnten nicht mehr sicher dem Virus zugeschrieben werden. Zu vier der angefragten Studien gingen Antworten ein, die jedoch in keinem Fall einen hinreichend \u201esauber\u201c isolierten Virus best\u00e4tigten. Au\u00dferdem erbrachte die Befragung des \u201eSenior\u201c-Virologen Dr. Charles Calisher keine Hinweise auf andere Studien, welche ein isoliertes und hinreichend gereinigtes SARS-CoV-2 belegen k\u00f6nnten. (Dr. Calisher\n[geh\u00f6rt](https://science.sciencemag.org/content/293/5527/24.full) zu den langj\u00e4hrigen Kritikern der Verwendung des PCR-Tests als Nachweis pathogener Viren.) Auch das Abpr\u00fcfen weiterer der sogenannten Kochschen Postulate, die in ihrer Gesamtheit dem Nachweis der Existenz, der Sch\u00e4dlichkeit und der Urs\u00e4chlichkeit eines vermuteten Krankheitserregers dienen, f\u00fchrte dem Off-Guardian-Artikel zufolge in eine Sackgasse: Diese sogenannten Kontrollexperimente [fanden entweder nicht statt](https://off-guardian.org/2020/06/09/scientists-have-utterly-failed-to-prove-that-the-coronavirus-fulfills-kochs-postulates/) oder [schlugen fehl](https://www.nature.com/articles/s41586-020-2312-y_reference.pdf). Eine Reihe angefragter Virologen und Institute beantwortete die Anfragen der Autoren zur gesicherten Existenz von SARS-CoV-2 nicht \u2013 es bleibt dem Leser \u00fcberlassen, dar\u00fcber zu spekulieren, ob diese Adressaten einen wasserdichten Virusbeweis nicht an die \u00d6ffentlichkeit dringen lassen wollten, oder was andernfalls der Grund f\u00fcr ihr Schweigen gewesen sein k\u00f6nnte.\nErst im Juni 2020 und mit anwaltlicher Unterst\u00fctzung erhielten die Off-Guardian-Autoren auch eine Antwort der Charit\u00e9 Berlin auf die Frage, ob sich diese vor Entwicklung des ersten PCR-Tests auf SARS-CoV-2 von der ausreichenden Purifizierung des genetischen Materials im Hinblick auf das korrekte Arbeiten des Tests \u00fcberzeugt h\u00e4tte. Aus der Antwort der Charit\u00e9 lie\u00df sich entnehmen, dass eine hinreichende Reinigung nicht (!) gew\u00e4hrleistet war.\nBedeutet dies, dass alle kritischen und aufgekl\u00e4rten Menschen nun dazu angehalten sind, \u201eCorona\u201c zu \u201eleugnen\u201c? Nein, denn das Virus kann dennoch in den Proben enthalten gewesen sein; es kann pathogen sein und es kann urs\u00e4chlich f\u00fcr die Symptome sein, die COVID-19 ausmachen. Demzufolge k\u00f6nnen auch die ermittelten Gensequenzen \u2013 einzelne davon oder alle \u2013 dem Virus zuzurechnen sein. Doch eine Sicherheit daf\u00fcr gibt es nicht.\nDass die G\u00fcltigkeit auch der weiteren Kochschen Postulate in Bezug auf SARS-CoV-2 bisher nicht nachgewiesen wurde, sollte angesichts der\n[hohen Anzahl](https://www.aerzteblatt.de/nachrichten/116540/SARS-CoV-2-Tests-mit-ueber-eine-Million-auf-Rekordniveau) von PCR-Testungen und der auf positive Testresultate gegr\u00fcndeten, immer massiver werdenden [staatlichen Eingriffe](https://off-guardian.org/2020/09/17/new-rules-may-allow-australian-police-to-detain-conspiracy-theorists/) in Grundrechte neben B\u00fcrgern und Politikern auch die Gerichte aufr\u00fctteln: Ohne einen \u201eechten\u201c \u00fcbertragbaren Krankheitserreger gem\u00e4\u00df \u00a7 2 des Infektionsschutzgesetzes gibt es keine \u201eepidemische Lage\u201c; ohne hinreichende Tatsachengrundlage sind auf die sogenannte \u201eepidemische Lage\u201c bezogene und auf Basis des Infektionsschutzgesetzes veranlasste staatliche Ma\u00dfnahmen [rechtswidrig](https://www.achgut.com/artikel/die_taegliche_taeuschung_das_rki_zaehlt_am_gesetz_vorbei). Da eine mangelhafte Tatsachengrundlage auch jeglicher Verh\u00e4ltnism\u00e4\u00dfigkeitspr\u00fcfung den Boden entzieht, ist nicht nur Rechtswidrigkeit, sondern gem\u00e4\u00df Artikel 20, Absatz 3 des Grundgesetzes sogar Verfassungswidrigkeit zu konstatieren. (Siehe auch das [Normenkontrollverfahren vor dem Bayerischen Verwaltungsgerichtshof](https://www.ckb-anwaelte.de/download/2020000338JHJH966-Bayerischer-Verwaltungsgerichtshof.pdf), S. 13)\nBelasten Grippe und COVID-19 in \u00e4hnlicher Weise das Gesundheitswesen?\nDas Symptombild von COVID-19 \u00fcberschneidet sich in gro\u00dfen Teilen mit dem der Virusgrippe (Influenza). F\u00fcr beide Atemwegserkrankungen werden unterschiedlich schwere Verlaufsformen beschrieben, die von milden Symptomen \u00fcber behandlungs-, krankenhaus- und intensivpflichtige Verl\u00e4ufe und Komplikationen bis hin zu Todesf\u00e4llen\n[reichen](https://www.rki.de/DE/Content/InfAZ/N/Neuartiges_Coronavirus/Steckbrief.html#doc13776792bodyText13). Insofern ist durchaus von einer Inanspruchnahme \u201ederselben Teile\u201c des Gesundheitswesens auszugehen.\nDoch schon bei der Spahnschen \u201egleichzeitigen Belastung\u201c sind gewisse Unterschiede erkennbar, da die saisonalen Zyklen der Aktivit\u00e4t von Influenza- und Coronaviren\n[leicht phasenverschoben](https://emedicine.medscape.com/article/227820-overview) sind: W\u00e4hrend die Influenzasaison in unseren Breiten typischerweise im November beginnt und im M\u00e4rz endet, f\u00e4ngt die Coronavirensaion im Dezember an und geht im April zu Ende. Dies korrespondiert auch mit den offiziellen Ver\u00f6ffentlichungen des Robert Koch-Institutes f\u00fcr die vergangene Influenza-/Coronavirensaison 2019/2020: So erreichte die Positivenrate der Testungen auf das Coronavirus SARS-CoV-2 ihren Maximalwert von 9,03% in der 14. Kalenderwoche, die vom 30.03. bis zum 05.04.2020 reichte. Zum Ende des Monats April 2020 in der 18. KW war die Positivenrate bereits wieder auf unter 4% [gefallen](https://www.rki.de/DE/Content/InfAZ/N/Neuartiges_Coronavirus/Situationsberichte/Sept_2020/2020-09-16-de.pdf?__blob=publicationFile). (Tabelle 4, S. 10)\nNoch aufschlussreicher wird der Vergleich von Influenza und COVID-19 jedoch, wenn man sich den Beitrag von COVID-19 zum gesamten Geschehen der akuten Atemwegserkrankungen in der Saison 2019/2020 anschaut: Gem\u00e4\u00df der repr\u00e4sentativen (!) \u00dcberwachung durch das Influenza-Sentinel der\n[Arbeitsgemeinschaft Influenza](https://influenza.rki.de/Arbeitsgemeinschaft.aspx) (AGI) trug COVID-19 \u2013 anders als die Influenza \u2013 w\u00e4hrend der Grippewelle 2019/2020 kaum zu den akuten Atemwegserkrankungen bei. (Die AGI hat die Aktivit\u00e4t von SARS-CoV-2 ab der 8. KW in ihren Auswertungen erg\u00e4nzt.) So lie\u00df sich SARS-CoV-2 maximal in 3,1% der kalenderwochenweise betrachteten Atemwegsproben durch das RKI-eigene Labor (Nationales Referenzzentrum f\u00fcr Influenzaviren) nachweisen. Der Influenzavirennachweis erreichte dagegen mindestens den zehnfachen Umfang. Kurz nach Ende der Influenzasaison, also w\u00e4hrend der Schlussphase der noch wenige Wochen nachlaufenden Coronavirensaison, war die Summe weiterer Virennachweise (Rhino-, hMP- und andere Viren) noch immer [um ein Vielfaches h\u00f6her](https://multipolar-magazin.de/artikel/das-schweigen-der-viren) als der f\u00fcr SARS-CoV-2. Der letzte Nachweis von SARS-CoV-2 im Sentinel erfolgte f\u00fcr die 15. KW (06.04. bis 12.04.2020). Seitdem ist SARS-CoV-2 in den Sentinelproben [nicht mehr nachgewiesen worden](https://www.rki.de/DE/Content/InfAZ/N/Neuartiges_Coronavirus/Situationsberichte/Sept_2020/2020-09-24-de.pdf?__blob=publicationFile). (S. 9)\nSchaut man anstatt auf die Sentinelpraxen auf die schweren Verlaufsf\u00e4lle (\u201eSARI\u201c) gem\u00e4\u00df der Krankenhaus-Surveillance, so best\u00e4tigt sich ein weiteres Mal der Befund, dass die Influenza bzw. andere akute Atemwegserkrankungen das Gesundheitswesen weitaus\n[st\u00e4rker belasten als COVID-19](https://www.rki.de/DE/Content/InfAZ/N/Neuartiges_Coronavirus/Situationsberichte/Sept_2020/2020-09-24-de.pdf?__blob=publicationFile) (Abbildung 6, S. 9): Man erkennt am zeitlichen Verlauf der SARI-F\u00e4lle sowohl das Ende der Influenzawelle (12. KW) als auch der Coronavirensaison (April), die sich als nahezu linearer R\u00fcckgang der SARI-F\u00e4lle in diesem Zeitraum niederschlagen. Kurz nach dem Ende der Coronavirensaison ist dann auch der Bereich des Grundrauschens (\u00fcber den Sommer anhaltende F\u00e4lle von Atemwegserkankungen, jedoch auf niedrigem Niveau) erreicht. Bei den SARI-F\u00e4llen wird zugleich der Beitrag von COVID-19 als relativer Anteil in Prozent berichtet: Der COVID-19-Anteil lag am Ende der Influenzasaison (12. KW) bei unter 10 Prozent, stieg dann f\u00fcr wenige Wochen \u2013 die Influenzasaison war bereits vorbei; Coronaviren hatten noch wenige Wochen Nachlauf \u2013 auf rund 30 Prozent der verbleibenden SARI-F\u00e4lle an, um kurz nach dem Ende der Coronavirensaion auf bis heute anhaltende Quoten von im wesentlichen weit unter 10 Prozent der SARI-F\u00e4lle zu sinken.\nZusammenfassend: W\u00e4hrend die Belastungseffekte von COVID-19 qualitativ mit denen der Influenza durchaus vergleichbar sind, war dies quantitativ zu keinem Zeitpunkt der Fall \u2013 sowohl die akuten F\u00e4lle insgesamt als auch die Teilmenge der schweren Verlaufsformen von COVID-19 machten grunds\u00e4tzlich nicht mehr als 10 Prozent der jeweiligen Gesamtf\u00e4lle aus, mit Ausnahme einer kurzen Periode weniger Wochen im April 2020, als die Coronaviren nach Ende der Influenzasaison, aber vor ihrem eigenen \u201eSaisonende\u201c, vor\u00fcbergehend einen gr\u00f6\u00dferen Anteil (aber wiederum nicht mehr als von rund einem Drittel) erreichen konnten.\nBer\u00fccksichtigt man ferner, dass Coronaviren in jeder Grippesaison ein etwa 10 Prozent ausmachender Teil des Erregermixes sind und dass SARS-CoV-2-Tests auch auf andere Coronaviren\n[kreuzreagieren k\u00f6nnen](https://www.instand-ev.de/System/rv-files/340%20DE%20SARS-CoV-2%20Genom%20April%202020%2020200502j.pdf) (S. 12f), dass also die Jahr f\u00fcr Jahr auftretenden weiteren Coronaviren auch f\u00e4lschlicherweise als SARS-CoV-2 klassifiziert werden k\u00f6nnen, ist somit kein Grund f\u00fcr die Annahme einer relevanten st\u00e4rkeren Beanspruchung des Gesundheitswesens durch COVID-19 gegeben.\nUnd was den aktuellen Alarmismus steigender absoluter Positivzahlen bei Testungen angeht: Gem\u00e4\u00df j\u00fcngstem RKI-Bericht lag die Positivenquote in der 38. KW bei 1,19 Prozent und damit wie in vielen Vorwochen im Bereich der zu veranschlagenden Fehlerquote \u2013 allerdings bei einem Testumfang von enormen rund 1,1 Mio. St\u00fcck. Dies f\u00fchrte in der 38. KW zu\n[knapp 13.000 Positivtestungen](https://www.rki.de/DE/Content/InfAZ/N/Neuartiges_Coronavirus/Situationsberichte/Sept_2020/2020-09-23-de.pdf?__blob=publicationFile) \u2013 die ganz \u00fcberwiegend falschpositiv gewesen sein d\u00fcrften. (Tabelle 4, S. 10)\nBesteht eine Pandemie?\nDas Magazin Multipolar hat sich mit dieser Aussage bereits in einem Faktencheck besch\u00e4ftigt, der am 04. September 2020\n[erschienen ist](https://multipolar-magazin.de/artikel/faktencheck-pandemie). Erg\u00e4nzend zu den oben bereits aufgef\u00fchrten Aspekten, die gegen eine Pandemie sprechen \u2013 kein eindeutig bestimmter Erreger, kein gegen andere Ateminfektionskrankheiten hinreichend abgegrenztes Symptombild, kein erkennbares Epidemiegeschehen in der repr\u00e4sentativen virologischen Surveillance der Bundesrepublik (Influenza-Sentinel), kein nachweisbares Epidemiegeschehen in der Statistik der SARI-F\u00e4lle \u2013 benennt der Artikel vom 04.09. auch, dass\n-\nim August noch nicht einmal jeder vierhundertste Tote in der Bundesrepublik als COVID-19-Toter klassifiziert wurde,\n-\nweniger als ein Prozent aller Intensivbetten in Krankenh\u00e4usern mit SARS-CoV-2-positiven Patienten belegt waren,\n-\nvon April bis August die tagesdurchschnittliche Zahl der COVID-19-Toten um 97% fiel,\n-\ndie Zahl der COVID-19-Intensivpatienten in Deutschland um 89% zur\u00fcckging,\n-\nviele andere L\u00e4nder wie z. B. Frankreich \u00e4hnliche Entwicklungen erlebten.\nErg\u00e4nzend l\u00e4sst sich zur Situation in der Bundesrepublik auch das GrippeWeb heranziehen, welches Meldungen zu Atemwegserkrankungen von \u00fcber 8.000 Teilnehmern aus der Bev\u00f6lkerung auswertet und f\u00fcr die j\u00fcngste Berichtswoche (38. KW) ein Infektionsgeschehen leicht unter Vorjahresniveau\n[konstatiert](https://grippeweb.rki.de/). Auch die j\u00fcngeren Angaben des Intensivregisters laut RKI-Bericht vom 24.09.2020 weisen lediglich 296 durch COVID-19-Patienten belegte Intensivbetten aus, was 0,97% aller Intensivbetten bzw. 1,35% der belegten Intensivbetten [ausmacht](https://www.rki.de/DE/Content/InfAZ/N/Neuartiges_Coronavirus/Situationsberichte/Sept_2020/2020-09-24-de.pdf?__blob=publicationFile). (S. 8)\nZusammenfassend lassen sich drei Aussagen treffen:\n-\n(1) Das Geschehen der akuten Atemwegsinfektionen ist derzeit absolut mit dem der Vorjahre vergleichbar, was im Wesentlichen durch den aktuellen Umlauf von Rhinoviren\n[bedingt](https://influenza.rki.de/Default.aspx)sein d\u00fcrfte.\n-\n(2) Die bereits im Multipolar-Artikel vom 21.06.2020\n[getroffene](https://multipolar-magazin.de/artikel/das-schweigen-der-viren)Feststellung \u201eDie Viren schweigen\u201c gilt auch weiterhin, denn diese Aussage bezog und bezieht sich ausschlie\u00dflich auf das Virus SARS-CoV-2, das seit der 16. KW nicht mehr im repr\u00e4sentativen Influenza-Sentinel der Bundesrepublik nachweisbar war.\n-\n(3) Es bestand zu keinem (!) Zeitpunkt in Deutschland eine durch COVID-19 bedingte \u201eepidemische Lage\u201c.\nDie Rechts- und Verfassungswidrigkeit der auf dieser nur vermeintlichen Lage beruhenden Ma\u00dfnahmen ist also nicht nur \u201ekausal\u201c begr\u00fcndet (n\u00e4mlich wie oben diskutiert durch den nicht zweifelsfrei nachgewiesenen urs\u00e4chlichen Krankheitserreger), sondern zugleich \u201esymptomatisch\u201c, da auch das beobachtbare und messbare Geschehen akuter Atemwegsinfektionen \u2013 unabh\u00e4ngig von dem im Einzelfall urs\u00e4chlichen Virus \u2013 keine epidemie\u00e4hnlichen Ausma\u00dfe angenommen hat.\nDas von offizieller Seite an dieser Stelle eingebrachte Gegenargument des sogenannten Pr\u00e4ventionsparadoxons geht ins Leere, da\n-\nzum einen die sogenannten \u201epr\u00e4ventiven\u201c Ma\u00dfnahmen\n[fragw\u00fcrdig und ineffektiv](http://www.matthias.schrappe.com/einzel/thesenpapier_corona.pdf)\n-\nbzw. sogar\n[kontraproduktiv](https://www.ktipp.ch/artikel/artikeldetail/gesichtsmasken-sind-voll-von-bakterien-und-pilzen/)(letzteres gilt z. B. f\u00fcr das stundenlange Tragen verkeimter Mund-Nase-Bedeckungen),\n-\nteilweise schlicht\n[wissenschaftlich nicht belegt](https://www.thieme-connect.com/products/ejournals/pdf/10.1055/a-1174-6591.pdf)\n-\noder sogar\n[statistisch widerlegbar](https://www.heise.de/tp/features/Coronavirus-Das-Aufrechterhalten-der-Massnahmen-trotz-einer-dramatisch-gesunkenen-Sterberate-4906401.html?seite=all)sind\n-\nund zum anderen das Pr\u00e4ventionsparadoxon speziell im Falle des Influenza-Sentinel auch gar nicht greifen kann: Wenn die staatlichen Ma\u00dfnahmen einen R\u00fcckgang des Infektionsgeschehens h\u00e4tten bewirken k\u00f6nnen, h\u00e4tten sie diesen R\u00fcckgang sowohl bezogen auf Influenzaviren, als auch auf SARS-CoV-2, als auch auf andere respiratorischen Viren bewirkt. An dem geringen Anteil von COVID-19 am gesamten Infektionsgeschehen bzw. im Verh\u00e4ltnis zum Auftreten der Influenza h\u00e4tte dies jedoch nichts ge\u00e4ndert \u2013 wenn ein 90 prozentiger Anteil von Influenza keine Epidemie darstellt, kann es ein maximal 10 prozentiger Anteil von COVID-19 erst recht nicht, egal auf welchem absoluten Niveau der Atemwegsinfektionen und unabh\u00e4ngig davon, ob dieses absolute Niveau durch die staatlichen Ma\u00dfnahmen beeinflussbar war oder nicht.\nZudem ist, entgegen offizieller \u00c4u\u00dferungen, weder COVID-19 hinreichend \u201eneuartig\u201c, noch mangelt es in der Bev\u00f6lkerung an entsprechender Immunit\u00e4t: Wie die Kreuzreagibilit\u00e4t der durch andere Coronaviren trainierten Immunsysteme\n[beweist](https://deutsche-wirtschafts-nachrichten.de/505561/War-der-Lockdown-falsch-Studie-spricht-von-81-Prozent-Immunitaet-gegen-SARS-Cov-2-durch-andere-Corona-Viren), begr\u00fcnden diese Faktoren keine besondere Gef\u00e4hrlichkeit von SARS-CoV-2. Auf den vielfach von offizieller Seite angef\u00fchrten \u201efehlenden Impfstoff\u201c gegen COVID-19 als besonderen Risikofaktor wird nachfolgend noch im Zusammenhang mit der Grippeschutzimpfung einzugehen sein.\nWas bewirkt eine Grippeschutzimpfung?\nIn diesem Abschnitt soll die klassische Impfung gegen die Influenza betrachtet werden, da diese nach den eingangs wiedergegebenen Thesen geeignet sein soll, das Gesundheitswesen in Zeiten der COVID-19-\u201cPandemie\u201c zu entlasten. Diese Betrachtung ist zum jetzigen Zeitpunkt auch sinnvoll, da Medien aktuell viel \u00fcber die Grippeschutzimpfung berichten. Es ist aber auch zu erw\u00e4hnen, dass parallel die Entwicklung von Impfstoffen gegen COVID-19 kritisch diskutiert werden muss, was aber nicht Gegenstand dieses Beitrages ist. Interessierte \u2013 und das sollten bei COVID-19 alle B\u00fcrger ein \u2013 finden grundlegende Diskussionen zu den COVID-19-Impfungen z. B. auf der Website des langj\u00e4hrigen Gesundheitsexperten\n[Dr. Wodarg](https://www.wodarg.com/impfen/) sowie in den Videos und Interviews des Biologen [Clemens Arvay](https://www.youtube.com/c/CGArvay/videos). Wer sich hinsichtlich des genmanipulierenden Charakters einer Reihe von COVID-19-Impfstoffkandidaten verwirrt f\u00fchlt, kann erg\u00e4nzend auch auf einen [Artikel](https://peds-ansichten.de/2020/07/coronavirus-erbgut-rna-genforschung/) des Autors dieses Beitrags zur\u00fcckgreifen.\nAu\u00dferordentlich aufschlussreich ist zudem das Verh\u00e4ltnis von Politik und Pharmaindustrie, wie es sich etwa in den Vereinbarungen zwischen der Europ\u00e4ischen Kommission und einigen COVID-19-Impfstoffherstellern\n[ausdr\u00fcckt](https://www.anti-spiegel.ru/2020/covid-19-was-der-spiegel-ueber-die-bestellung-von-impfstoffen-durch-die-eu-kommission-verschweigt/). Ferner haben einige der nun folgenden Aspekte der Grippeschutzimpfung zugleich Implikationen f\u00fcr COVID-19-Impfstoffe.\nZulassungsstudien und Antik\u00f6rper\nAuf der Seite des in Zulassungsstudien dargestellten Impfnutzens ist zu beachten, dass diese Dokumente die Vorz\u00fcge einer Impfung tendenziell immer \u00fcberzeichnen. Dies ist unter anderem auf die Auswahl der Probanden zur\u00fcckzuf\u00fchren, die gem\u00e4\u00df Studienbedingungen meist j\u00fcnger und weniger krank sind als der Bev\u00f6lkerungsdurchschnitt. Am Beispiel eines aktuellen Impfstoffkandidaten gegen COVID-19 (also nicht gegen die Influenza, doch die Gestaltungsm\u00f6glichkeiten sind vom Virustyp unabh\u00e4ngig) f\u00fcr die bisher absolvierten klinischen Studienphasen I und II\n[aufgezeigt](https://www.drugs.com/history/azd1222.html), m\u00fcssen Kandidaten gesund und d\u00fcrfen nicht \u00e4lter als 55 Jahre sein.\nF\u00fcr die bereits begonnene Phase III sind die Auswahl-/Ausschlusskriterien weniger eindeutig, k\u00f6nnen jedoch noch immer zu Verzerrungen gegen\u00fcber der Gesamtbev\u00f6lkerung im Hinblick auf den Gesundheitszustand f\u00fchren. So ist es z. B.\n[m\u00f6glich](https://clinicaltrials.gov/ct2/show/NCT04400838), aufgrund \u201evermuteter\u201c Umst\u00e4nde oder wegen \u201eanderer erheblicher\u201c Erkenntnisse einzelne Probanden auszuschlie\u00dfen. Auch Bestrebungen, aufgrund auff\u00e4lliger oder sogar besorgniserregender Befunde nach Verabreichung des Impfstoffkandidaten einen Probanden nachtr\u00e4glich auszuschlie\u00dfen (um dessen Beschwerden als anderweitig verursachte Komplikationen aus der Studie eliminieren zu k\u00f6nnen), k\u00f6nnen vermutet werden. (Siehe dazu die [vagen Umschreibungen](https://www.drugs.com/clinical_trials/statement-astrazeneca-oxford-sars-cov-2-vaccine-azd1222-covid-19-vaccine-trials-temporary-pause-18833.html) wie \u201eungekl\u00e4rte Erkrankungen\u201c und \u201ezuf\u00e4llig (im Studienverlauf) auftretende Erkrankungen\u201c.)\nUnter diesen Bedingungen ist es nicht ohne Weiteres zul\u00e4ssig, von Studienergebnissen auf die zu erwartenden Effekte in der Bev\u00f6lkerung zu schlie\u00dfen. Dies kann sowohl Einflussgr\u00f6\u00dfen wie die unterschiedlichen Altersverteilungen zwischen Experimentalgruppe und Bev\u00f6lkerung als auch die Bandbreite m\u00f6glicher Vorerkankungen oder auch die Wahrscheinlichkeit, seltene aber schwerwiegende Nebenwirkungen schon w\u00e4hrend der Zulassungsphasen zu entdecken, betreffen.\nEin weiteres gravierendes Problem der Nutzenseite ist das Ersetzen des Zieles \u201eImmunit\u00e4t\u201c durch das Surrogat \u201eAntik\u00f6rperbildung\u201c. Antik\u00f6rper sind bei weitem nicht die einzigen Abwehrmittel des Immunsystems. Neben Antik\u00f6rpern spielen beispielsweise auch Fresszellen der angeborenen Immunit\u00e4t (\n[sogenannte Makrophagen](https://www.ncbi.nlm.nih.gov/pmc/articles/PMC4242194/)) und solche der erworbenen Immunit\u00e4t ( [T-Lymphozyten/\u201cKillerzellen\u201c](https://www.medrxiv.org/content/10.1101/2020.04.17.20061440v1)) eine wesentliche Rolle.\nHinzu kommt, dass bei der Antik\u00f6rpermessung nur bestimmte Formen ber\u00fccksichtigt werden (gegebenenfalls das kurzlebige Immunglobulin M/IgM und vor allem das in der Regel f\u00fcr wenige Monate nachweisbare Immunglobulin G/IgG). Andere Antik\u00f6rpertypen, die gerade auch bei Atemwegsinfektionen eine gro\u00dfe Rolle spielen wie das Immunglobulin A (IgA) werden bei der Betrachtung regelm\u00e4\u00dfig ausgeklammert. Bei der Bewertung der verschiedenen Abwehrmechanismen ist es wichtig zu ber\u00fccksichtigen, dass Antik\u00f6rper vom Typ IgG vom K\u00f6rper nur begrenzte Zeit vorgehalten werden, da sie f\u00fcr eine Immunabwehr nicht zwingend ben\u00f6tigt werden: Bei einer Vielzahl von Infektionen reicht die zellul\u00e4re Abwehr vollkommen aus, so dass sich das \u201eMitschleppen\u201c von Antik\u00f6rpern er\u00fcbrigt. Sollte die Infektion schwerer oder die zellul\u00e4re Abwehr ungew\u00f6hnlich schwach sein, k\u00f6nnen Antik\u00f6rper nachgebildet werden und die Infektionsbek\u00e4mpfung erg\u00e4nzen. Doch genau diese\n[vielschichtige und interdependente Immunabwehr](https://www.laborwert.info/immunsystem/) macht die Interpretation allein der Antik\u00f6rperbildung durch Impfungen so tr\u00fcgerisch:\n-\nWerden Antik\u00f6rper zur Erregerabwehr zwingend ben\u00f6tigt? Nein: Das k\u00f6nnen zellul\u00e4re Mechanismen unter Umst\u00e4nden\n[allein bewerkstelligen](https://www.sciencedaily.com/releases/2012/03/120301143426.htm).\n-\nBedeuten nachweisbare Antik\u00f6rper, dass das betrachtete Immunsystem besonders stark ist? Nein: Je st\u00e4rker bereits die zellul\u00e4re Abwehr ist,\n[desto weniger](https://www.biorxiv.org/content/10.1101/2020.05.21.108308v1.full.pdf)werden Antik\u00f6rper ben\u00f6tigt.\n-\nIst ein Mensch ohne nachweisbare Antik\u00f6rper ungesch\u00fctzt? Als pauschale Behauptung w\u00e4re dies irref\u00fchrend. Es h\u00e4ngt von der St\u00e4rke seiner zellul\u00e4ren Abwehr ab.\n-\nIst ein Mensch mit Antik\u00f6rpern besser gesch\u00fctzt? Tendenziell eher nicht, da Antik\u00f6rper auf die M\u00f6glichkeit einer schw\u00e4cheren zellul\u00e4ren Abwehr hindeuten und diese Antik\u00f6rper innerhalb weniger Monate ohnehin wieder abgebaut werden.\n-\nSollte sich ein Mensch ohne Antik\u00f6rper impfen lassen? Nicht aufgrund dieser Indikation allein, denn fehlende Antik\u00f6rper sagen f\u00fcr sich genommen noch nichts \u00fcber die St\u00e4rke des Immunsystems aus, und eine per Impfung angereizte Antik\u00f6rperproduktion kann eine gute zellul\u00e4re Abwehr nicht ersetzen.\n-\nIst die Impfung der beste Weg zur St\u00e4rkung des Immunsystems? Nein, denn eine Impfung \u201est\u00e4rkt\u201c nicht; sie provoziert lediglich eine bestimmte Form der Immunabwehr. Eine dauerhafte und umfassende St\u00e4rkung\n[erfordert](https://www.netdoktor.de/anatomie/immunsystem-staerken/)eine gesunde Lebensweise, die sich durch hochwertige, ausgewogene Ern\u00e4hrung, ausreichenden, erholsamen Schlaf, ein inneres seelisch-emotionales Gleichgewicht, ausreichende und regelm\u00e4\u00dfige Bewegung auszeichnet sowie durch idealerweise nat\u00fcrliche Vitamin D-Produktion mittels regelm\u00e4\u00dfiger wohldosierter Aufenthalte an der Sonne.\nM\u00f6gliche Impfsch\u00e4den\nWie sieht es auf der Seite der m\u00f6glichen Impfsch\u00e4den aus? Die wichtigste Erkenntnis zur Einsch\u00e4tzung potenzieller Impfsch\u00e4den gem\u00e4\u00df den Zulassungsstudien ist, dass diese Studien nicht (!) echt Placebo-kontrolliert sind. Eine wirkliche Placebokontrolle l\u00e4ge vor, wenn eine Kontrollgruppe im Rahmen einer Studie eine Substanz verabreicht bek\u00e4me, die v\u00f6llig frei von jeglichen Wirkungen w\u00e4re. Dies w\u00e4re z. B. bei einer reinen Kochsalzl\u00f6sung der Fall. Doch hat das f\u00fcr entsprechende Zulassungen in Deutschland zust\u00e4ndige Paul-Ehrlich-Institut\n[erkl\u00e4rt](https://web.archive.org/web/20081225090224/http://www.pei.de/cln_115/nn_992504/DE/infos/fachkreise/impf-fach/hpv/studien.html) (laut Abruf seiner Internetseite in 2008), dass genau dies bei Impfstoffen ausgeschlossen sei, \u201eda das Impfantigen der einzige Unterschied in der Zusammensetzung von Testimpfstoff und Placebo ist.\u201c\nIm Klartext bedeutet dies, dass m\u00f6gliche sch\u00e4dliche Wirkungen von Zusatzstoffen, darunter Wirkungsverst\u00e4rkern (Adjuvazien) wie Aluminiumsalzen, Konservierungsmitteln wie Formaldehyd, Fremdeiwei\u00dfen aus H\u00fchnereiern oder fetalen Zellen \u2013 letzteres sind Zellkulturen, die von abgetriebenen F\u00f6ten gewonnen werden \u2013 bewusst auch in den Kontrollgruppen in Kauf genommen werden. Dadurch verbessert sich im direkten Vergleich der Impfkomplikationen zwischen der Experimental- und der Kontrollgruppe das Studienergebnis zugunsten der Impfstoffkandidaten \u2013 Nebenwirkungen, welche durch den gleichen Zusatzstoff in beiden Gruppen entstehen, \u201ek\u00fcrzen sich aus der Studie heraus\u201c. Wird beispielsweise in beiden Gruppen die gleiche Anzahl allergischer Reaktionen auf einen der identischen Zusatzstoffe (also nicht auf das Antigen) ausgel\u00f6st, und liegen damit Erkenntnisse zu Allergierisiken sowohl aus der Experimental- als auch aus der Kontrollgruppe vor, w\u00fcrde das Studienergebnis diese Erkenntnisse unter den Tisch fallen lassen und die Resultate in der Weise verf\u00e4lschen, dass erkl\u00e4rt w\u00fcrde, der Impfstoff w\u00fcrde keine (zus\u00e4tzlichen) Allergien ausl\u00f6sen, die \u00fcber dem Allergieaufkommen der Kontrollgruppe liegen \u2013 eine Abgrenzung gegen Wissenschaftsbetrug f\u00e4llt bei diesem Studiendesign und derartigen Schlussfolgerungen schwer.\nWirkungsverst\u00e4rker\nEinige der h\u00e4ufigsten Zusatzstoffe in Impfdosen sind Aluminiumverbindungen (Aluminiumhydroxid und Aluminiumphosphat), die als Wirkungsverst\u00e4rker, sogenannte Adjuvanzien, dem eigentlichen Wirkstoff (dem Antigen) hinzugef\u00fcgt werden. Aluminiumverbindungen sind in ca. 60% aller Impfstoffe enthalten. Aufsichtsbeh\u00f6rden und Zulassungsstellen wie die Arznei- und Lebensmittel\u00fcberwachungsstelle der USA (FDA) weisen darauf hin, dass Toxizit\u00e4tsuntersuchungen bei Impfstoffen h\u00e4ufig deshalb unterbleiben, weil Impfstoffe per se als nicht toxisch\n[angesehen werden](https://www.zentrum-der-gesundheit.de/artikel/impfungen/aluminium-in-impfstoffen-ia?utm_source=nl&utm_medium=newsletter&utm_campaign=NL13101&newsletter=NL13101).\n\u00c4hnliche Forschungsl\u00fccken\n[weist](https://www.atsdr.cdc.gov/ToxProfiles/tp22-p.pdf#:~:text=A%20Toxicological%20Profile%20for%20Aluminum%2C%20Draft%20for%20Public,status%20of%20previously%20released%20profiles%2C%20contact%20ATSDR%20at%3A) das \u201eToxikologische Profil f\u00fcr Aluminium\u201c des US Gesundheitsministeriums aus dem Jahr 2008 auf. Da Aluminium laut historischen Ver\u00f6ffentlichungen mindestens seit 1931 in Impfstoffen eingesetzt wird, muss dieser \u201eWissensstand\u201c im Jahre 2008 doch sehr [befremdlich wirken](https://scienceblogs.de/lob-der-krankheit/2008/12/01/aluminium-die-evidenz/). Hinzu kommt, dass negative Effekte von Aluminiumadjuvanzien aus Tierversuchen durchaus [bekannt](https://pubmed.ncbi.nlm.nih.gov/11115725/) sind. Die durch das Aluminium fehlgeleiteten und \u00fcberschie\u00dfenden Immunreaktionen k\u00f6nnen bei echter Virenexposition [gr\u00f6\u00dfere Sch\u00e4den anrichten](https://scienceblogs.de/lob-der-krankheit/2008/12/01/aluminium-die-evidenz/) als das Virus selbst. Irritierenderweise [berichtet](https://www.impfkritik.de/zusatzstoffe/aluminiumhydroxid.html) der Impfreport von Hans Tolzin, dass Impftstoffhersteller im Einzelfall durchaus \u00fcber Sicherheitsdaten zu Aluminiumzus\u00e4tzen verf\u00fcgen, diese jedoch \u201eals Teil der Zulassungsunterlagen vertraulich seien\u201c. Diese Aussage legt nahe, dass auch Zulassungsstellen \u00fcber entsprechende Informationen verf\u00fcgen m\u00fcssen.\nDamit bleibt es unabh\u00e4ngigen Wissenschaftlern \u00fcberlassen, zu den Wirkungen des Leichtmetalls zu forschen und mit ihren Erkenntnissen den Wissensstand auch der Allgemeinheit zu verbessern. So\n[ergab](https://pubmed.ncbi.nlm.nih.gov/23609067/) beispielsweise eine Studie aus dem Jahr 2013 mit dem Titel \u201eAluminum in the central nervous system (CNS): toxicity in humans and animals, vaccine adjuvants, and autoimmunity\u201c, dass Aluminium Sch\u00e4den am Nervensystem in jedem Lebensalter hervorzurufen vermag. Die Autoren Shaw und Tomljenovic benennen neurologische Defizite bei Erwachsenen, die mit Alzheimer vergleichbar sind, und f\u00fcr j\u00fcngere Kinder eine [enge Korrelation](https://pubmed.ncbi.nlm.nih.gov/22099159/) zwischen verabreichten Aluminium-haltigen Impfstoffen und Autismus. Diese lie\u00dfen sich den Autoren zufolge in Teilen auf Aluminium-bedingte Autoimmunreaktionen zur\u00fcckf\u00fchren.\nEbenfalls bewusst f\u00fcr Grippeimpfstoffe herangezogen wird vermehrt synthetisches Squalen, eine \u00d6l-in-Wasser-Emulsion, wie sie in nat\u00fcrlicher Form auch im menschlichen Stoffwechsel vorkommt. Das Squalen soll als Wirkungs\u201cverst\u00e4rker\u201c in Impfstoffen dienen, l\u00f6ste aber auch eine Kontroverse \u00fcber den Verdacht aus, eine Vielzahl schwerer Symptome hervorzurufen, die unter dem Sammelbegriff des \u201eGolfkrieg-Syndroms\u201c\n[bekannt geworden](https://www.arznei-telegramm.de/html/2009_11/0911508_01.html) sind. Zum Krankheitsbild werden unter anderem chronische M\u00fcdigkeit und Kopfschmerzen, abnormer Haarausfall, nichtheilende Hautver\u00e4nderungen, Schwindel, Schw\u00e4che und Ged\u00e4chtnisverlust, Multiple Sklerose und eine Reihe weiterer schwerwiegender Komplikationen gez\u00e4hlt. Synthetisches Squalen aktiviert auch die zellul\u00e4re Immunit\u00e4t, was bei Schwangeren, deren F\u00f6tus vom m\u00fctterlichen Immunsystem grunds\u00e4tzlich als \u201eFremdk\u00f6rper\u201c angesehen wird, Komplikationen bis hin zu Fr\u00fch- und Totgeburten [bewirken kann](https://www.impfkritik.de/zusatzstoffe/squalen.html). Sollte eine Autoimmunst\u00f6rung im Zusammenhang mit Squalen ausgel\u00f6st werden, w\u00fcrde das Immunsystem auch das k\u00f6rpereigene Squalen angreifen, was aufgrund seiner Rolle in der Biosynthese schwere und komplexe Folgen haben kann.\nUnter der kryptischen Bezeichnung AS03 wird Squalen mit Polysorbat 80 und synthetischem Vitamin E kombiniert. AS03 wurde vom Pharmakonzern GlaxoSmithKline entwickelt und war bereits 2009 im Schweinegrippen-Impfstoff Pandemrix enthalten. Da der Schweinegrippenvirus zum Subtyp Influenza A(H1N1) geh\u00f6rt, war die Schweinegrippe eine (mildere) Form der Influenza, Pandemrix somit ein Influenzaimpfstoff. Seine Verabreichung f\u00fchrte zum Auftreten schwerer F\u00e4lle von Narkolepsie, was letztendlich auch von offizieller Seite\n[einger\u00e4umt wurde](https://www.pei.de/DE/newsroom/veroffentlichungen-arzneimittel/sicherheitsinformationen-human/narkolepsie/narkolepsie-studien-europa.html).\nEs sollte nicht gesondert betont werden m\u00fcssen, dass derartige Nebenwirkungen bei einer Impfung gegen den milden Verlauf einer Variante der saisonalen Grippe absolut inakzeptabel sind. Doch wurden auch beim \u201eSchweinegrippen-Impfstoff\u201c warnende \u2013 was die Nebenwirkungen des Impfstoffs\n[anging](https://www.arznei-telegramm.de/html/2009_11/0911093_01.html) \u2013 wie auch einordnende Stimmen \u2013 soweit es den Vergleich der Schweinegrippe mit vorangegangenen Verl\u00e4ufen der Influenza betraf \u2013 lange Zeit \u00fcberh\u00f6rt. Hier sind Parallelen zum Alarmismus wegen COVID-19 wie auch zum Durchsetzen neuer \u2013 nunmehr auch auf der genetischen Manipulation der Proteinherstellung im menschlichen K\u00f6rper beruhenden \u2013 Impfstoffe un\u00fcbersehbar.\nKontaminationen von Impfstoffen\nEine brisante Studie der italienischen Autoren Gatti und Montanari aus dem Jahr 2017\n[weist](http://medcraveonline.com/IJVV/IJVV-04-00072.pdf) eine Vielzahl unterschiedlicher Kontaminationen diverser Impfstoffe mit nicht abbaubaren (und auch nicht ausscheidbaren) Partikeln nach, die f\u00fcr den menschlichen K\u00f6rper toxisch und entz\u00fcndungsausl\u00f6send sind sowie einen negativen Einfluss auf das Immunsystem aus\u00fcben. Da diese Objekte aufgrund ihrer Gr\u00f6\u00dfe vielfach als Nanopartikel einzustufen sind, sind sie in der Lage, durch Zellmembranen zu gelangen und sogar in menschliche Zellkerne einzudringen. Eine Interaktion mit der menschlichen DNS ist dann nicht mehr auszuschlie\u00dfen. Die Kristalle k\u00f6nnen mit dem Blutkreislauf im K\u00f6rper verteilt werden und in die Organe gelangen. Ihre Eigenschaft, unter anderem Entz\u00fcndungen auszul\u00f6sen, verlieren sie auch im Zeitablauf nicht, da sie f\u00fcr den menschlichen K\u00f6rper weder abbaubar noch ausscheidbar sind. Die Entz\u00fcndungen, die auf diese Weise in verschiedenen K\u00f6rperteilen und Organen hervorgerufen werden k\u00f6nnen, sind demzufolge also chronisch!\nAuch l\u00f6sen diese Partikel Reaktionen nicht nur kurz nach einer Impfung aus. Genauso gut k\u00f6nnen Effekte erst nach einem gewissen Zeitraum auftreten. Soweit diese Partikel Eisen enthalten, k\u00f6nnen sie im menschlichen K\u00f6rper korrodieren und der \u201eRost\u201c kann in der Folge eine eigene Toxizit\u00e4t entfalten. Die Autoren \u00e4u\u00dfern die These, dass es sich bei all diesen Substanzen um unbeabsichtigte und nicht ohne Weiteres erkl\u00e4rbare Verschmutzungen von Impfstoffen handelt, die von den Herstellern nicht erkannt und demzufolge weder entfernt noch deklariert wurden. Zu den untersuchten Proben geh\u00f6rte auch eine Vielzahl von Influenzaimpfstoffen, die entweder als Einzelgaben oder als Kombinationspr\u00e4parate zusammen mit weiteren Impfstoffen zu verabreichen sind. Zu den festgestellten Substanzen geh\u00f6rte neben dem weit verbreiteten und bewusst eingesetzten Wirkungs\u201cverst\u00e4rker\u201c Alumium immer auch mindestens eine toxisch wirkende nicht deklarierte Substanz wie Stahl, Eisen, Chrom, Nickel, Brom oder Titan. Stoffe wie diese sind mit dem Auftreten von Leuk\u00e4mie, L\u00e4hmungen, Krampfanf\u00e4llen bis hin zum sogenannten \u201ePl\u00f6tzlichen\u201c Kindstod assoziiert. Daneben sind zahlreiche weitere F\u00e4lle von Impfstoff-Kontaminationen\n[bekannt](https://www.cdc.gov/vaccinesafety/concerns/concerns-history.html).\nEmpirische Nutzennachweise\nDas Ersatzziel der Antik\u00f6rperbildung wirft die Frage auf, ob gegebenenfalls im Nachhinein, also unter den realen Bedingungen, die sich aus dem Altersaufbau, der Verteilung von Vorerkankungen und den Immunst\u00e4rken bzw. -schw\u00e4chen der Bev\u00f6lkerung ergeben, der Nutzen von Grippeschutzimpfungen ermittelbar ist. Tats\u00e4chlich liegen dazu verschiedene empirische Studien vor, aus denen sich Erkenntnisse zur Impfeffektivit\u00e4t gewinnen lassen.\nEine kanadische Studie aus dem Januar 2015, die einen Zwischenstand zur Impfeffektivit\u00e4t in der zum Ver\u00f6ffentlichungszeitpunkt noch andauernden Grippewelle 2014/2015\n[darlegte](https://www.eurosurveillance.org/content/10.2807/1560-7917.ES2015.20.4.21022), sagt aus, dass die Impfeffektivit\u00e4t bei minus (!) 8 Prozent lag (und damit im Intervall \u201egeringer bzw. kein Impfschutz\u201c). Vereinfacht ausgedr\u00fcckt bedeutet dieses Ergebnis, dass die Bev\u00f6lkerung insgesamt, d.h. ohne Differenzierungen nach Alter etc. vorzunehmen, in der betreffenden Grippesaison ohne eine Impfung in dieser speziellen Auspr\u00e4gung besser gefahren w\u00e4re als mit ihr. Die Autoren f\u00fchren als Grund an, dass zwar der vorherrschende Influenzavirus-Subtyp A(H3N2) vom Impfstoff anvisiert wurde, jedoch der umlaufende Virenstamm, also die nochmals feinere Differenzierung innerhalb eines Subtyps, verfehlt wurde. Dies ist eine Herausforderung aller Impfungen gegen Viren, die umso gr\u00f6\u00dfer wird, je schneller die Viren mutieren bzw. rekombinieren und damit die Zahl ihrer St\u00e4mme erh\u00f6hen. Viren mit einstr\u00e4ngiger Erbgutinformation (RNA) gelten als mutationsfreudiger als solche mit doppelstr\u00e4ngigem Erbgut (DNA). Influenza- und Coronaviren geh\u00f6ren zu den \u201ewechselfreudigeren\u201c RNA-Viren. Dies f\u00fchrt von vornherein zu einer geringeren Wahrscheinlichkeit f\u00fcr eine hohe Impfeffektivit\u00e4t und zu einer h\u00f6heren Streuung der Effektivit\u00e4tszahlen \u00fcber mehrere Infektionsperioden hinweg.\nEin Review verschiedenster Studien durch die Cochrane Collaboration in 2018 hat die Schutzwirkung der Grippeimpfung mit inaktiven Influenzaviren speziell bei gesunden Erwachsenen\n[untersucht](https://www.cochrane.org/CD001269/ARI_vaccines-prevent-influenza-healthy-adults). Die Autoren schlussfolgern unter anderem, dass es nur schwache Hinweise auf eine Reduzierung von Krankenhausaufenthalten und Arbeitsunf\u00e4higkeitszeiten gab. Die Wahrscheinlichkeit fiebriger Atemwegserkrankungen nahm zwar ab; der R\u00fcckgang war jedoch f\u00fcr M\u00fctter und Neugeborene geringer als f\u00fcr andere Bev\u00f6lkerungsgruppen und variierte zwischen diesen anderen Gruppen. F\u00fcr schwangere Frauen war der Schutzeffekt sehr klein. Auch laut diesem Review fehlt es also an einem zuverl\u00e4ssig eintretenden positiven Effekt bei definierten Zielgruppen.\nEbenfalls aus 2018 stammt ein\n[Cochrane-Review zu Impfwirkungen](https://www.cochrane.org/CD004876/ARI_vaccines-preventing-seasonal-influenza-and-its-complications-people-aged-65-or-older) bei Menschen von 65 Jahren an aufw\u00e4rts. Das f\u00fcr den Review verf\u00fcgbare Datenmaterial wird von den Autoren als begrenzt, verzerrt, l\u00fcckenhaft bzw. veraltet bezeichnet, was insbesondere auch f\u00fcr etwaige Impfkomplikationen gilt. Demzufolge erlaubt der Review gem\u00e4\u00df der Bewertung seiner Autoren keine Aussagen zur Sicherheit (!) oder Effektivit\u00e4t von Grippeimpfungen in dieser Altersgruppe.\nAuch wenn dieser Review keine Stellung f\u00fcr oder wider eine Influenzaimpfung von \u00e4lteren Menschen beziehen kann, ist doch die dort gezeigte Herangehensweise wertvoll zur Interpretation der Ergebnisse anderer Studien: Was n\u00fctzt der Allgemeinheit eine vermeintlich klare Aussage zum Nutzen oder zum Schaden einer Impfung, wenn diese Aussage z. B. auf einer verzerrten Datenbasis beruht (etwa: die geimpften Personen hatten ohnehin, also bereits vor der Impfung, ein starkes Immunsystem) oder auf einer nur eingeschr\u00e4nkten Betrachtung von m\u00f6glichen Nebenwirkungen (z. B. wenn ausschlie\u00dflich kurzfristige Effekte wie R\u00f6tungen an der Einstichstelle ermittelt werden, jedoch keine u.U. nur l\u00e4ngerfristig ermittelbaren Sch\u00e4den wie Allergiebildungen oder andere Autoimmunst\u00f6rungen).\nIn einer Variation dieser Betrachtung\n[untersuchte](https://www.cochrane.org/CD005187/ARI_influenza-vaccination-healthcare-workers-who-care-people-aged-60-or-older-living-long-term-care) die Cochrane Collaboration bereits 2016 die Effekte einer Grippeimpfung von Pflegepersonal im Hinblick auf das Risiko der Bewohner der Einrichtungen, an einer vom Personal \u00fcbertragenen Influenza zu erkranken. Auch hier hatte Cochrane zu konstatieren, dass die Studienlage wie auch die Qualit\u00e4t der einzelnen Ver\u00f6ffentlichungen \u00e4u\u00dferst unzureichend war. Noch am ehesten war eine Evidenz daf\u00fcr gegeben, dass die Impfungen des Pflegepersonal sich in geringem Umfang, aber g\u00fcnstig, auf das Risiko der Bewohner auswirkt, sich Infektionen der unteren Atemwege zuzuziehen.\nNochmals schw\u00e4cher war die Evidenz, dass sich die Gesamtzahl der Grippef\u00e4lle oder die Notwendigkeit der Krankenhauseinweisungen geringf\u00fcgig reduziert. Unklar blieb der Impfeffekt hinsichtlich t\u00f6dlicher Verl\u00e4ufe der Grippe und bez\u00fcglich der Sterblichkeit der Bewohner insgesamt. Die Review-Autoren bem\u00e4ngeln, dass andere potenziell sch\u00fctzende Ma\u00dfnahmen au\u00dfer Impfungen, wie z. B. H\u00e4ndewaschen, Quarant\u00e4nen, Neuaufnahmestopps, Selbstisolierung symptomatischer Mitarbeiter (also bei Krankheit der Arbeit fernbleiben) in den verf\u00fcgbaren Studien nicht ber\u00fccksichtigt wurden. Die isolierte Betrachtung nur von Impfwirkungen wird somit dem ma\u00dfgeblichen und deutlich komplexeren Ziel des Bewohnerschutz vom Studiendesign her nicht gerecht. Entsprechend gering ist daher der Aussagewert solcher Studien.\nEine breitere Betrachtung wurde in einer Studie \u00fcber Effekte einer Influenzaimpfung des Personals des US Verteidigungsministriums f\u00fcr die Grippesaison 2017/2018\n[vorgenommen](https://pubmed.ncbi.nlm.nih.gov/31607599/). Dort wurde nicht nur der Schutz der geimpften Personen gegen Influenzaviren ermittelt, sondern zugleich festgestellt, inwieweit die Geimpften gegebenfalls an anderen respiratorischen Viren erkrankten. Diese Betrachtung ist aussagef\u00e4higer als eine auf Influenzaviren fokussierte, da es f\u00fcr die Gesundheit der einzelnen Menschen wie auch f\u00fcr die Inanspruchnahme der Kapazit\u00e4ten von \u00c4rzten und Krankenh\u00e4usern entscheidend ist, wie h\u00e4ufig welche Schweregrade von Erkrankungen auftreten, und nicht die Namensgebung oder die Kategorisierung der einzelnen Viren.\nDie Wissenschaftler zeigten auf, dass eine auf einen einzigen Virustyp verengte Aussage zur Impfeffektvit\u00e4t die implizite Annahme enth\u00e4lt, dass die Impfung gegen diesen einen Virus die Wahrscheinlichkeit der Erkrankung an einem anderen Virus nicht ver\u00e4ndert \u2013 und weisen in der Folge anhand ihrer Ergebnisse nach, dass genau diese Pr\u00e4misse nicht erf\u00fcllt ist, so dass jede Botschaft zu einer Impfeffektivit\u00e4t, die Infektionen durch andere Viren ausblendet, das Risiko birgt, den Nutzen dieser Impfung systematisch zu verzerren!\nDie Studienresultate zeigen, dass die untersuchte Influenzaimpfung \u00fcber alle anderen betrachteten Virenarten hinweg zwar keine erh\u00f6hte durchschnittliche Infektionswahrscheinlichkeit bewirkte; dass aber bei einer Differenzierung der sonstigen Virenarten sich positive und negative Effekte mischten. So lie\u00df sich durch die Influenzaimpfung das Risiko, durch Parainfluenza-, RSV- und andere Viren zu erkranken, senken, doch erh\u00f6hte sich im Gegenzug das Risiko bez\u00fcglich hMP- und Corona(!)viren (um 51 bzw. um 36 Prozent) \u2013 f\u00fcr die durch die Herren Spahn und Streeck aufgestellte Eingangsthese eine sicher nicht ganz unwichtige Erkenntnis. Hier liegt die Vermutung nahe, dass die Influenzaimpfung eine gewisse Breitenwirkung auf andere Virenarten entfaltet, dass aber Coronaviren von dieser nicht mehr erfasst sind. Vielmehr scheinen sich die Ausbreitungsbedingungen f\u00fcr Coronaviren durch das \u201eWegimpfen\u201c der Influenzaviren zu verbessern.\nDie Cochrane Collaboration hat auch den Einfluss von Influenzaimpfungen Schwangerer auf die Neugeborenen, Kleinkinder und ihre M\u00fctter\n[untersucht](https://www.cochrane.org/CD009982/PREG_haemophilus-influenzae-type-b-and-viral-influenza-vaccinations-during-pregnancy-for-improving-maternal-neonatal-and-infant-health-outcomes). Bezeichnenderweise vermied es eine in den Review einbezogene Studie, \u00fcber relevante Impfeffekte zu berichten wie z. B. Ver\u00e4nderungen der Sterblichkeit, H\u00e4ufigkeit von Atemwegsinfektionen oder Blutvergiftungen. Dies best\u00e4tigt den oben bereits angesprochenen Kritikpunkt des Ersetzens relevanter Studien- und damit Impfziele durch blo\u00dfe Surrogate. In einer zweiten f\u00fcr den Review herangezogenen Studie wurde zwar einerseits ein R\u00fcckgang allein der sogenannten \u201elaborbest\u00e4tigten\u201c Influenza infolge der Impfung konstatiert, doch beruhte zum einen die \u201eLaborbest\u00e4tigung\u201c nicht auf einer Nachz\u00fcchtung der Influenzaviren im Labor (\u201eGoldstandard\u201c), sondern auf dem [vielf\u00e4ltig manipulierbaren](https://multipolar-magazin.de/artikel/diskussion-pcr-test) PCR-Test. Zum anderen ging die Gesamtzahl Influenza-\u00e4hnlicher Erkrankungen laut der Studie nicht zur\u00fcck, was auf die oben bereits durch eine andere Arbeit aufgezeigte Virensubstitution hindeutet.\nBei einem weiteren Review der Organisation von Studien zu Influenzaimpfungen bei Kindern lie\u00dfen sich bei stark streuender statistischer G\u00fcltigkeit sowohl Reduzierungen der Influenza als auch anderer fiebriger Atemwegserkrankungen mittels Impfungen\n[aufzeigen](https://www.cochrane.org/CD004879/ARI_vaccines-preventing-influenza-healthy-children). Ein gro\u00dfer Kritikpunkt war jedoch neben der nur selten gegebenen statistischen Validit\u00e4t die Darstellung von Nebenwirkungen und Impfsch\u00e4den. Hier fordern die Review-Autoren Schritte zur Verbesserung der Ermittlung und Berichterstattung \u00fcber diese \u201eSchattenseiten\u201c der Impfungen. Zudem weisen sie darauf hin, dass jegliche Datenbasis auch f\u00fcr die positiven Impffolgen bei Kindern unter 3 Jahren nochmals schw\u00e4cher ist als die f\u00fcr \u00e4ltere Kinder.\nFazit: Entlastung gern \u2013 jedoch besser eine der Impfstoffherstellung\nAuf der Suche nach dem urs\u00e4chlichen Erreger f\u00fcr das Symptombild namens COVID-19 mag man als Privatperson f\u00fcr sich glauben, die Wissenschaft sei bei SARS-CoV-2 f\u00fcndig geworden oder auch nicht. F\u00fcr staatliches Handeln ist jedoch wesentlich, dass 1. ein Krankheitserreger zweifelsfrei existiert, 2. die Krankheit nachweislich droht, epidemische Ausma\u00dfe anzunehmen, und 3. ein unstrittiges Testverfahren zum Infektionsnachweis bei einzelnen Personen zur Verf\u00fcgung steht. Weltweit war und ist in Bezug auf COVID-19 keine einzige dieser drei Bedingungen erf\u00fcllt.\nUnd so ist auch im bisherigen Verlauf des Jahres 2020 in der Bundesrepublik zu keinem Zeitpunkt eine Situation eingetreten, die Ma\u00dfnahmen erfordert h\u00e4tte, die \u00fcber die sinnvollen Schritte bei jeder Grippewelle hinausgehen. Dies dr\u00fcckt sich vor allem in der Entwicklung der akuten Atemwegsinfektionen aus, die absolut in einem vergleichbarem Rahmen zu den Grippewellen der Vorjahre liegt. Wer hier als Gegenargument das Pr\u00e4ventionsparadoxon bem\u00fcht, muss nicht nur die Wirksamkeit seiner Ma\u00dfnahmen nachweisen, sondern sich auch fragen lassen, warum das mindestens 10-fach h\u00f6here Auftreten der Influenza- und anderer respiratorischer Viren \u2013 auch in den Vorjahren \u2013 keine \u201eepidemische Lage\u201c ausgel\u00f6st hat.\nWas Grippeschutzimpfungen angeht, mangelt es an einer Datenlage, die objektiv und verl\u00e4sslich den Nutzen dieser Impfungen von Grippewelle zu Grippewelle aufzeigt. Stattdessen sind stark schwankende Impfeffektivit\u00e4ten festzustellen, die zumeist Wechselwirkungen mit anderen respiratorischen Viren au\u00dfer Acht lassen. Dort wo andere Viren ausnahmsweise doch einbezogen werden, sind nun ausgerechnet Substitutionen von Influenza- durch u.a. Coronaviren zu beobachten. Auch ein R\u00fcckgang von Atemwegserkrankungen insgesamt oder insbesondere der schwereren fiebrigen Verl\u00e4ufe ist nicht gew\u00e4hrleistet.\nNeben- und Fernwirkungen von Impfstoffen werden laut unabh\u00e4ngigen Reviews und gem\u00e4\u00df Aussagen ehemaliger Insider\n[nicht in ausreichendem Umfang erfasst](https://www.gesundheitlicheaufklaerung.de/dr-klaus-hartmann-impfstoffe-sicherheit/) und berichtet. Dies ist ein Problem schon bei der Impfstoffzulassung. Es betrifft zum einen die Vielzahl von offiziellen Zusatzstoffen, welche dem menschlichen K\u00f6rper schaden (Aluminium und andere) wie auch nicht deklarierte Schadstoffe wie Nanopartikel aus verschiedensten Materialien.\nSomit stehen einem zweifelhaften und stark schwankenden Impfnutzen Neben- und Fernwirkungen mit hoher Dunkelziffer gegen\u00fcber, wobei offen bleiben muss, ob sich im Einzelfall ein Immunsystem mit einem Coronavirus anstelle eines Influenzavirus besser arrangieren wird. Je j\u00fcnger die betrachtete Person ist (S\u00e4uglinge und Kleinkinder), desto vulnerabler ist dieser Mensch, desto schw\u00e4cher wird die Datenlage bez\u00fcglich Impfwirkungen und desto gr\u00f6\u00dfer wird das Potenzial und der Zeitraum, in dem sich Langfristsch\u00e4den durch Zusatzstoffe und Kontaminationen manifestieren k\u00f6nnen.\nVor diesem Hintergrund w\u00e4re es sinnvoll, einen Bruchteil der Steuergelder, die f\u00fcr Garantieabnahmen noch nicht einmal zugelassener COVID-19-Impfstoffe\n[ausgegeben werden](https://ec.europa.eu/commission/presscorner/detail/de/ip_20_1680), zur Finanzierung industrieunabh\u00e4ngiger, transparenter und ergebnisoffener Impfstoffforschung zu verwenden. Ein weiterer Bruchteil w\u00e4re in der gesundheitlichen Aufkl\u00e4rung zur Wirkungsweise und St\u00e4rkung des Immunsystems gut angelegt. Das Gesundheitssystem und die \u00f6ffentlichen Finanzen k\u00f6nnten dadurch ebenso wirkungsvoll entlastet werden wie die [Produktionskapazit\u00e4ten der Impfstoffhersteller](https://www.n-tv.de/wirtschaft/Tesla-mischt-beim-Curevac-Impfstoff-mit-article21886866.html).\n\u00dcber den Autor: Oliver M\u00e4rtens, Jahrgang 1967, ist nach einer Banklehre und einem wirtschaftswissenschaftlichen Studium in verschiedenen Kreditinstituten der Bundesrepublik in Marketing und Vertriebsunterst\u00fctzung t\u00e4tig gewesen. Seit Ende 2018 arbeitet er in der Korruptionspr\u00e4vention einer Bank.\nWeitere Artikel zum Thema:\n[Faktencheck: Gibt es aktuell eine Coronavirus-Pandemie in Deutschland?](https://multipolar-magazin.de/artikel/faktencheck-pandemie)(Paul Schreyer, 4.9.) [Faktencheck: Bedeuten steigende Fallzahlen eine gr\u00f6\u00dfere Gef\u00e4hrdung der \u00d6ffentlichkeit?](https://multipolar-magazin.de/artikel/faktencheck-fallzahlen)(Paul Schreyer, 11.8.) [Das Schweigen der Viren](https://multipolar-magazin.de/artikel/das-schweigen-der-viren)(Oliver M\u00e4rtens, 21.6.) [Warum die Diskussion um den PCR-Test nicht endet](https://multipolar-magazin.de/artikel/diskussion-pcr-test)(Oliver M\u00e4rtens, 6.6.)", "language": null, "image": "https://multipolar-magazin.de/media/pages/artikel/faktencheck-grippeschutzimpfung/add7ee41d3-1629432964/shutterstock_1796131795.jpg", "pagetype": "article", "links": ["https://multipolar-magazin.de", "https://multipolar-magazin.de?locale=en", "https://multipolar-magazin.de/ueber-multipolar", "https://multipolar-magazin.de/login", "https://multipolar-magazin.de/ich-moechte-multipolar-unterstuetzen", "https://multipolar-magazin.de/ich-moechte-multipolar-unterstuetzen", "/autorenarchiv?autor=Oliver M\u00e4rtens", "https://multipolar-magazin.de/artikel/faktencheck-grippeschutzimpfung#diskussion", "https://www.n-tv.de/panorama/Arzte-fuerchten-Mangel-an-Grippe-Impfdosen-article22038594.html", "https://www.aerzteblatt.de/nachrichten/116076/Kinderaerzte-empfehlen-Grippeschutzimpfung-fuer-Kinder", "https://www.zdf.de/nachrichten/panorama/coronavirus-streeck-impfstoff-100.html", "https://off-guardian.org/2020/06/27/covid19-pcr-tests-are-scientifically-meaningless/", "https://www.rubikon.news/artikel/die-nonsens-tests", "https://science.sciencemag.org/content/293/5527/24.full", "https://off-guardian.org/2020/06/09/scientists-have-utterly-failed-to-prove-that-the-coronavirus-fulfills-kochs-postulates/", "https://www.nature.com/articles/s41586-020-2312-y_reference.pdf", "https://www.aerzteblatt.de/nachrichten/116540/SARS-CoV-2-Tests-mit-ueber-eine-Million-auf-Rekordniveau", "https://off-guardian.org/2020/09/17/new-rules-may-allow-australian-police-to-detain-conspiracy-theorists/", "https://www.achgut.com/artikel/die_taegliche_taeuschung_das_rki_zaehlt_am_gesetz_vorbei", "https://www.ckb-anwaelte.de/download/2020000338JHJH966-Bayerischer-Verwaltungsgerichtshof.pdf", "https://www.rki.de/DE/Content/InfAZ/N/Neuartiges_Coronavirus/Steckbrief.html#doc13776792bodyText13", "https://emedicine.medscape.com/article/227820-overview", "https://www.rki.de/DE/Content/InfAZ/N/Neuartiges_Coronavirus/Situationsberichte/Sept_2020/2020-09-16-de.pdf?__blob=publicationFile", "https://influenza.rki.de/Arbeitsgemeinschaft.aspx", "https://multipolar-magazin.de/artikel/das-schweigen-der-viren", "https://www.rki.de/DE/Content/InfAZ/N/Neuartiges_Coronavirus/Situationsberichte/Sept_2020/2020-09-24-de.pdf?__blob=publicationFile", "https://www.rki.de/DE/Content/InfAZ/N/Neuartiges_Coronavirus/Situationsberichte/Sept_2020/2020-09-24-de.pdf?__blob=publicationFile", "https://www.instand-ev.de/System/rv-files/340%20DE%20SARS-CoV-2%20Genom%20April%202020%2020200502j.pdf", "https://www.rki.de/DE/Content/InfAZ/N/Neuartiges_Coronavirus/Situationsberichte/Sept_2020/2020-09-23-de.pdf?__blob=publicationFile", "https://multipolar-magazin.de/artikel/faktencheck-pandemie", "https://grippeweb.rki.de/", "https://www.rki.de/DE/Content/InfAZ/N/Neuartiges_Coronavirus/Situationsberichte/Sept_2020/2020-09-24-de.pdf?__blob=publicationFile", "https://influenza.rki.de/Default.aspx", "https://multipolar-magazin.de/artikel/das-schweigen-der-viren", "http://www.matthias.schrappe.com/einzel/thesenpapier_corona.pdf", "https://www.ktipp.ch/artikel/artikeldetail/gesichtsmasken-sind-voll-von-bakterien-und-pilzen/", "https://www.thieme-connect.com/products/ejournals/pdf/10.1055/a-1174-6591.pdf", "https://www.heise.de/tp/features/Coronavirus-Das-Aufrechterhalten-der-Massnahmen-trotz-einer-dramatisch-gesunkenen-Sterberate-4906401.html?seite=all", "https://deutsche-wirtschafts-nachrichten.de/505561/War-der-Lockdown-falsch-Studie-spricht-von-81-Prozent-Immunitaet-gegen-SARS-Cov-2-durch-andere-Corona-Viren", "https://www.wodarg.com/impfen/", "https://www.youtube.com/c/CGArvay/videos", "https://peds-ansichten.de/2020/07/coronavirus-erbgut-rna-genforschung/", "https://www.anti-spiegel.ru/2020/covid-19-was-der-spiegel-ueber-die-bestellung-von-impfstoffen-durch-die-eu-kommission-verschweigt/", "https://www.drugs.com/history/azd1222.html", "https://clinicaltrials.gov/ct2/show/NCT04400838", "https://www.drugs.com/clinical_trials/statement-astrazeneca-oxford-sars-cov-2-vaccine-azd1222-covid-19-vaccine-trials-temporary-pause-18833.html", "https://www.ncbi.nlm.nih.gov/pmc/articles/PMC4242194/", "https://www.medrxiv.org/content/10.1101/2020.04.17.20061440v1", "https://www.laborwert.info/immunsystem/", "https://www.sciencedaily.com/releases/2012/03/120301143426.htm", "https://www.biorxiv.org/content/10.1101/2020.05.21.108308v1.full.pdf", "https://www.netdoktor.de/anatomie/immunsystem-staerken/", "https://web.archive.org/web/20081225090224/http://www.pei.de/cln_115/nn_992504/DE/infos/fachkreise/impf-fach/hpv/studien.html", "https://www.zentrum-der-gesundheit.de/artikel/impfungen/aluminium-in-impfstoffen-ia?utm_source=nl&utm_medium=newsletter&utm_campaign=NL13101&newsletter=NL13101", "https://www.atsdr.cdc.gov/ToxProfiles/tp22-p.pdf#:~:text=A%20Toxicological%20Profile%20for%20Aluminum%2C%20Draft%20for%20Public,status%20of%20previously%20released%20profiles%2C%20contact%20ATSDR%20at%3A", "https://scienceblogs.de/lob-der-krankheit/2008/12/01/aluminium-die-evidenz/", "https://pubmed.ncbi.nlm.nih.gov/11115725/", "https://scienceblogs.de/lob-der-krankheit/2008/12/01/aluminium-die-evidenz/", "https://www.impfkritik.de/zusatzstoffe/aluminiumhydroxid.html", "https://pubmed.ncbi.nlm.nih.gov/23609067/", "https://pubmed.ncbi.nlm.nih.gov/22099159/", "https://www.arznei-telegramm.de/html/2009_11/0911508_01.html", "https://www.impfkritik.de/zusatzstoffe/squalen.html", "https://www.pei.de/DE/newsroom/veroffentlichungen-arzneimittel/sicherheitsinformationen-human/narkolepsie/narkolepsie-studien-europa.html", "https://www.arznei-telegramm.de/html/2009_11/0911093_01.html", "http://medcraveonline.com/IJVV/IJVV-04-00072.pdf", "https://www.cdc.gov/vaccinesafety/concerns/concerns-history.html", "https://www.eurosurveillance.org/content/10.2807/1560-7917.ES2015.20.4.21022", "https://www.cochrane.org/CD001269/ARI_vaccines-prevent-influenza-healthy-adults", "https://www.cochrane.org/CD004876/ARI_vaccines-preventing-seasonal-influenza-and-its-complications-people-aged-65-or-older", "https://www.cochrane.org/CD005187/ARI_influenza-vaccination-healthcare-workers-who-care-people-aged-60-or-older-living-long-term-care", "https://pubmed.ncbi.nlm.nih.gov/31607599/", "https://www.cochrane.org/CD009982/PREG_haemophilus-influenzae-type-b-and-viral-influenza-vaccinations-during-pregnancy-for-improving-maternal-neonatal-and-infant-health-outcomes", "https://multipolar-magazin.de/artikel/diskussion-pcr-test", "https://www.cochrane.org/CD004879/ARI_vaccines-preventing-influenza-healthy-children", "https://www.gesundheitlicheaufklaerung.de/dr-klaus-hartmann-impfstoffe-sicherheit/", "https://ec.europa.eu/commission/presscorner/detail/de/ip_20_1680", "https://www.n-tv.de/wirtschaft/Tesla-mischt-beim-Curevac-Impfstoff-mit-article21886866.html", "https://multipolar-magazin.de/artikel/faktencheck-pandemie", "https://multipolar-magazin.de/artikel/faktencheck-fallzahlen", "https://multipolar-magazin.de/artikel/das-schweigen-der-viren", "https://multipolar-magazin.de/artikel/diskussion-pcr-test", null, "https://multipolar-magazin.de/artikel/faktencheck-grippeschutzimpfung?nachEmpfehlungen=1#diskussion", "https://multipolar-magazin.de/artikel/faktencheck-grippeschutzimpfung?nachAktualitaet=1#diskussion", "https://multipolar-magazin.de/login", "https://multipolar-magazin.de/login", "https://influenza.rki.de/Saisonberichte/2018.pdf", "https://twitter.com/SHomburg/status/1304125035469328385", "https://multipolar-magazin.de/login", "#", null, null, "https://multipolar-magazin.de/passwort-vergessen", "mailto:abo@multipolar-magazin.de", "mailto:abo@multipolar-magazin.de", "https://www.handelsblatt.com/politik/international/republikaner-mike-johnson-sanfter-ton-harte-botschaften-das-ist-der-neue-sprecher-des-us-repraesentantenhauses-/29466352.html", "https://www.t-online.de/nachrichten/ausland/usa/id_100267248/suedchinesisches-meer-i-biden-sendet-warnung-an-china.html", "https://www.faz.net/aktuell/politik/ausland/israel-bereitet-in-gaza-naechste-kampfphase-mit-panzern-vor-19269466.html", "https://www.infosperber.ch/politik/die-usa-sollen-israel-vor-sich-selber-retten/", "https://www.hintergrund.de/politik/welt/dass-in-israel-eine-fuenfte-kolonne-operierte-bestreitet-heute-niemand-mehr/", "https://www.wsj.com/world/middle-east/hamas-fighters-trained-in-iran-before-oct-7-attacks-e2a8dbb9", "https://www.sueddeutsche.de/politik/tuerkei-erdogan-hamas-israel-1.6293637https://www.sueddeutsche.de/politik/tuerkei-erdogan-hamas-israel-1.6293637", "https://www.algemeiner.com/2023/10/22/overwhelming-majority-israeli-arabs-oppose-hamas-violence-poll/", "https://www.foreignaffairs.com/israel/what-palestinians-really-think-hamas", "https://www.jungewelt.de/artikel/461814.ukrainekrieg-vor-mageren-jahren.html", "https://www.tagesschau.de/inland/reaktionen-abschieberegelungen-100.html", "https://www.ndr.de/nachrichten/info/umfrage-Wagenknecht-Partei-potenzial-mecklenburg-vorpommern-afd,umfragewagenknecht100.html", "https://www.mdr.de/nachrichten/mitmachen/mdrfragt/ergebnisse-wagenknecht-partei-100.html", "https://www.welt.de/politik/deutschland/article248179106/Wagenknecht-Partei-Absolut-abenteuerlich-sieht-der-Forsa-Chef-die-Umfragewerte.html", "https://www.welt.de/kultur/kino/plus248187508/Doku-Arena-196-ueber-Hans-Georg-Maassen-Campact-Kampagne-und-Fassadendemokratie.html?", "https://www.faz.net/aktuell/feuilleton/medien/rbb-interner-compliance-bericht-in-teilen-veroeffentlicht-19267986.html", "https://multipolar-magazin.de/empfehlungen", "https://multipolar-magazin.de/artikel/in-der-wahrheit-leben", "https://multipolar-magazin.de/artikel/in-der-wahrheit-leben", "https://multipolar-magazin.de/artikelarchiv", "https://multipolar-magazin.de/impressum", "https://multipolar-magazin.de/datenschutz", "/atom.xml", "https://multipolar-magazin.de/datenschutz"]}