{"title": "Coronam\u00fcde? Wir auch. Was uns im Herbst, Winter und Fr\u00fchling erwartet", "author": "Marie-Jos\u00e9 Kolly", "url": "https://www.republik.ch/2020/09/16/coronamuede-wir-auch-was-uns-im-herbst-winter-und-fruehling-erwartet", "hostname": "republik.ch", "description": "Sie haben die Schnauze voll und sehnen sich zum ersten Mal in Ihrem Leben nach einer Impfnadel? Wir haben ein paar Neuigkeiten. (Auch gute.) Ein Realit\u00e4tscheck.", "sitename": "Republik", "date": "2020-09-16", "id": null, "license": null, "body": null, "comments": "", "commentsbody": null, "raw_text": null, "text": "Coronam\u00fcde? Wir auch. Was uns im Herbst, Winter und Fr\u00fchling erwartet.\nSie sitzen daheim, haben die Schnauze voll und sehnen sich zum ersten Mal in Ihrem Leben nach einer Impfnadel? Wir haben ein paar Neuigkeiten. (Auch gute.)\nVon\n[Marie-Jos\u00e9 Kolly](/~mkolly) (Text) und Martin Fengel (Illustrationen), 16.09.2020\nDie Republik ist ein digitales Magazin f\u00fcr Politik, Wirtschaft, Gesellschaft und Kultur \u2013 finanziert von seinen Leserinnen. Es ist komplett werbefrei und unabh\u00e4ngig. L\u00f6sen Sie jetzt ein Abo oder eine Mitgliedschaft!\nEs ist Dienstag, es ist September, f\u00fcr die Velofahrt zu den Redaktionsr\u00e4umen w\u00e4ren Handschuhe gar nicht so schlecht gewesen. Der bange Gedanke:\n[Bald werden die Temperaturen noch virusfreundlicher](https://twitter.com/richardneher/status/1293857065425866754?s=20). Der n\u00e4chste Gedanke: Es ist [wieder ](/2020/03/04/das-coronavirus-geht-um-sollten-sie-angst-haben-und-wenn-ja-was-dann) [einmal](/2020/05/18/was-wissen-wir-eigentlich-unterdessen-ueber-das-corornavirus) Zeit f\u00fcr einen Anruf bei Epidemiologe Marcel Salath\u00e9. Um Punkt 10 Uhr geht er ran.\nHallo, Herr Salath\u00e9, sind Sie auch coronam\u00fcde?\n\u00abJa. Wer ist das nicht? Lassen Sie sich davon nicht ablenken!\u00bb, sagt Salath\u00e9. \u00abWir haben so vieles geschafft. Jetzt gilt es noch, den Winter gut herumzubringen, und dann bin ich zuversichtlich.\u00bb\nAuf was genau?\n\u00abZuversichtlich, dass die Pandemie unser Leben bald nicht mehr dominieren wird, unseren Alltag weniger stark einschr\u00e4nkt.\u00bb Dazu brauche es noch etwas Arbeit \u2013 von Forschern, Logistikerinnen, Kantonen.\nMehr dazu: sp\u00e4ter.\nTags darauf holt das Videotelefon Zoom das Arbeitszimmer des Immunologen Daniel Speiser auf den Redaktionsbildschirm. Er ist auch coronam\u00fcde.\nHerr Speiser, mit welchen \u2013 evidenzgetriebenen \u2013 Gef\u00fchlen blicken Sie auf die kommenden Monate?\n\u00abMit gemischten Gef\u00fchlen.\u00bb\nWarum?\n\u00abWir wissen einfach noch nicht, ob wir die Infektionszahlen im Griff behalten k\u00f6nnen. Nimmt die Krankheit \u00fcberhand, f\u00e4llt das \u00f6ffentliche Leben auseinander. Viele Leute ziehen sich von allein zur\u00fcck, die Wirtschaft lahmt.\u00bb\nWas k\u00f6nnen wir dagegen tun? Worauf hoffen? Mehr dazu: sp\u00e4ter.\nSpeiser ist zuversichtlich: \u00abWir m\u00fcssen einfach noch ein bisschen auf die Z\u00e4hne beissen\u00bb, sagt er, \u00abund ich glaube, das geht besser, wenn wir das Problem sachlich anschauen k\u00f6nnen. Wenn alle wissen, worum es geht.\u00bb\nDieses Wissen ist zentral. Marcel Salath\u00e9 betont das Wort public in public health. \u00abAm besten funktioniert health, das zeigt uns die Geschichte der Epidemiologie, wenn the public die Strategien gegen die Pandemie erstens kennt und zweitens mittr\u00e4gt. Sonst sind wir zum Scheitern verurteilt.\u00bb\nDar\u00fcber haben wir mit Salath\u00e9 und Speiser gesprochen. \u00dcber die Strategien, die bereits bekannten und die k\u00fcnftig m\u00f6glichen. Aus ihrem Wissen, ihren Einsch\u00e4tzungen, ihren Unsicherheiten und dem, was die weitere Forschungslandschaft hervorgebracht hat, ist entstanden: ein Realit\u00e4tscheck f\u00fcr Herbst, Winter und Fr\u00fchling.\nVon Corona-M\u00fcden f\u00fcr Corona-M\u00fcde.\nSeit dem Fr\u00fchling wartet gef\u00fchlt die ganze Welt auf einen Impfstoff. Wann ist er bereit?\nEs kommt darauf an, wen Sie fragen. Und \u2013 wir kommen noch dazu \u2013 es kommt auch darauf an, wie Sie fragen.\nZuerst dazu, wer was sagt.\nDie amerikanischen Centers for Disease Control and Prevention (CDC): Die Beh\u00f6rde hat Ende August\n[alle US-Bundesstaaten zur Bereitschaft aufgerufen](https://www.nytimes.com/2020/09/02/health/covid-19-vaccine-cdc-plans.html): f\u00fcr den Fall, dass zwei Impfstoffe, [die zurzeit noch in klinischen Versuchen getestet werden](https://www.nytimes.com/interactive/2020/science/coronavirus-vaccine-tracker.html), auf den sp\u00e4ten Oktober oder fr\u00fchen November schon zugelassen w\u00fcrden. (Die beiden Impfstoffe werden zwar nicht explizit mit Namen genannt, die Beschreibungen passen aber auf die Projekte [der Firmen Pfizer und Moderna](https://www.nytimes.com/2020/09/02/health/covid-19-vaccine-cdc-plans.html).) Das w\u00e4re \u2013 vielleicht nicht ganz zuf\u00e4llig \u2013 eine Punktlandung auf die Pr\u00e4sidentenwahl vom 3. November hin.\nKurz darauf haben mehrere Pharmaunternehmen\n[gemeinsam \u00f6ffentlich Stellung genommen](https://investors.modernatx.com/news-releases/news-release-details/biopharma-leaders-unite-stand-science). Sie geloben, die Zulassungsgesuche f\u00fcr ihre Stoffe erst einzureichen, falls und nachdem die letzte Phase des jeweiligen klinischen Versuchs die Wirksamkeit und die Sicherheit demonstriert haben wird. Implizit heisst das: Sie wollen sich [von der Trump-Administration, die eine Beschleunigung der Prozesse in Aussicht gestellt hat, nicht unter Druck setzen lassen](https://www.nytimes.com/2020/09/04/science/covid-vaccine-pharma-pledge.html). Einzelne Wissenschaftler und Mitglieder der amerikanischen Zulassungsstelle, der Food and Drug Administration, versprachen, eher zu k\u00fcndigen, als zuzulassen, dass der Regulierungsprozess abgek\u00fcrzt wird.\nDie Firma Moderna, die der Schweiz 4,5 Millionen Impfdosen zugesichert hat: Blieb der Republik bis Redaktionsschluss eine Antwort schuldig. Ebenso die Eidgen\u00f6ssische Kommission f\u00fcr Impffragen.\nDie Firma Pfizer, die ihren Stoff wie Moderna in der letzten von drei Versuchsphasen testet: Will in den Vereinigten Staaten\n[schon im Oktober ein Zulassungsgesuch einreichen](https://www.pfizer.com/news/press-release/press-release-detail/pfizer-and-biontech-share-positive-early-data-lead-mrna). Andere Firmen planen, [bis Ende Jahr parat zu sein](https://www.nytimes.com/2020/09/04/science/covid-vaccine-pharma-pledge.html).\nDie schweizerische Zulassungsstelle Swissmedic: \u00abDas kann ich nicht prophezeien\u00bb, sagt J\u00f6rg Schl\u00e4pfer, Mitglied der Gesch\u00e4ftsleitung, am Telefon zur Republik. \u00abDie Firmen entscheiden, wann sie ein Zulassungsgesuch einreichen.\u00bb\nWissen Sie denn, wann Moderna so weit sein will?\n\u00abDazu d\u00fcrfen wir nichts sagen, Informationen aus Firmengespr\u00e4chen sind nicht \u00f6ffentlich.\u00bb\nDas Bundesamt f\u00fcr Gesundheit (BAG): Kann auch noch nichts sagen. \u00abEs h\u00e4ngt davon ab, wann der Moderna-Impfstoff die klinischen Tests durchlaufen haben wird und anschliessend zugelassen werden kann\u00bb, schreibt die Medienstelle. Es k\u00f6nne immer zu Verz\u00f6gerungen kommen. Und: \u00abParallel sind wir im Gespr\u00e4ch mit anderen Unternehmen.\u00bb Da heute noch nicht klar sei, wer sich durchsetzen werde, erh\u00f6he ein diversifiziertes Vorgehen die Chancen auf einen schnellen und sicheren Zugang zu einem zuk\u00fcnftigen Impfstoff.\nDer Epidemiologe Marcel Salath\u00e9: \u00abDas ist eine Frage f\u00fcr einen Immunologen.\u00bb\nDer Immunologe Daniel Speiser: \u00abGenaue Zeitangaben wie \u2039Ende November\u203a kann man nicht machen \u2013 das grenzt an Unfug. Solche Angaben, etwa in den USA oder Russland, sind machtpolitisch motiviert.\u00bb\nOkay, zum Gl\u00fcck hat die Republik\n[kein Problem mit ungenauen Zeitangaben \u2013 im Gegenteil](/2020/04/28/wie-wir-mit-studien-und-statistiken-zu-corona-umgehen).\nNochmals Speiser: \u00abWenn es richtig gut l\u00e4uft, sehen wir vielleicht schon vor Ende 2020 eine Zulassung in den USA. Und dann, auch wenn alles gut l\u00e4uft, vermutlich einige Wochen sp\u00e4ter eine in der Schweiz.\u00bb\nUnd wenn es schiefl\u00e4uft?\nSpeiser: \u00abDann vielleicht sogar erst nach Ende 2021.\u00bb\nWarum ist die Spanne zwischen all diesen Terminangaben so breit? Das l\u00e4sst sich am Fall der Firma Astra Zeneca erkl\u00e4ren, die zusammen mit Forschenden der Universit\u00e4t Oxford einen Impfstoff entwickelt:\nAnfang September hat sie ihre klinischen Versuche auf Eis gelegt, weil eine Testperson\n[eine m\u00f6glicherweise gef\u00e4hrliche Entz\u00fcndung entwickelte](https://www.statnews.com/2020/09/08/astrazeneca-covid-19-vaccine-study-put-on-hold-due-to-suspected-adverse-reaction-in-participant-in-the-u-k/). Es war unklar, ob diese als Nebenwirkung des Impfstoffs auftrat oder unabh\u00e4ngig davon. Eine knappe Woche sp\u00e4ter [konnte man Teile der Studie wieder aufnehmen](https://www.nytimes.com/2020/09/12/health/astrazeneca-coronavirus-vaccine-trial-resumes.html).\nEs ist durchaus \u00fcblich, dass ein klinischer Versuch aus Sicherheitsgr\u00fcnden unterbrochen wird. Und Astra Zeneca hat damit bisher nur wenig Zeit verloren. \u00abAber in anderen F\u00e4llen kann es mehrere Wochen kosten, einen solchen Zwischenfall zu untersuchen\u00bb, sagt Immunologe Speiser. Ob und wie es dann weitergehe, wisse jeweils niemand: \u00abDas kann, wie bei Astra Zeneca, eine kurze Episode sein \u2013 oder gar das Ende dieses Projekts.\u00bb So oder so verz\u00f6gert sich damit der Termin, an dem das Mittel auf den Markt kommen k\u00f6nnte.\nSo kann es jedem Projekt ergehen. Aber die Welt hat ja mehrere Pferde im Rennen (oder Velos, wenn Sie das vorziehen). \u00abVermutlich werden viele davon auf der Strecke bleiben \u2013 weil sie sich als zu wenig sicher oder zu wenig wirksam herausstellen\u00bb, sagt Speiser.\n[Ich will es genauer wissen: Wie wird der Moderna-Impfstoff entwickelt?]\nDie Impfstoffe, die zurzeit in verschiedenen klinischen Phasen stecken, basieren auf unterschiedlichen Technologien. Die Firmen Moderna und Pfizer entwickeln neuartige, sogenannte mRNA-Impfstoffe. Das Botenmolek\u00fcl mRNA tr\u00e4gt Erbinformation als eine Art Bauanleitung f\u00fcr das Stachelprotein,\n[mit dem Sars-CoV-2 an menschliche Zellen andockt](/2020/05/18/was-wissen-wir-eigentlich-unterdessen-ueber-das-corornavirus), in den K\u00f6rper. So k\u00f6nnen die Zellen das Protein selber herstellen und das Immunsystem darauf trainieren, [es zu erkennen und Antik\u00f6rper dagegen zu produzieren](https://www.bag.admin.ch/bag/de/home/das-bag/aktuell/medienmitteilungen.msg-id-80005.html).\nBisher hat es zwar\n[noch nie ein Impfstoff auf mRNA-Basis auf den Markt geschafft](https://www.thelancet.com/journals/lancet/article/PIIS0140-6736(20)31252-6/fulltext), aber [die Resultate der klinischen Versuche sind vielversprechend](https://www.webmd.com/lung/news/20200610/covid-19-latest-updates). Der gr\u00f6sste Vorteil dieser Technologie: Sie ist schnell. Man kann mRNA direkt von der Virussequenz ableiten. Und man kann [in kurzer Zeit sehr viel Impfstoff herstellen](https://www.nature.com/articles/nrd.2017.243#Sec21), sogar noch vergleichsweise g\u00fcnstig. (Viel aufwendiger ist es zum Beispiel, jeweils den Grippeimpfstoff in H\u00fchnereiern zu z\u00fcchten.)\n\u00abViele Fachleute sind der Meinung, dass das einen guten Impfstoff abgeben k\u00f6nnte\u00bb, sagt Daniel Speiser \u00fcber den mRNA-Ansatz. Diese Firmen h\u00e4tten zwar einen R\u00fcckstand in Sachen Erfahrung, daf\u00fcr seien sie spezialisiert auf Tempo. Bei Entwicklungen mit den bew\u00e4hrten Impfstoff-Technologien gebe es daf\u00fcr vielleicht weniger ung\u00fcnstige \u00dcberraschungen. Aber das seien \u00abWahrscheinlichkeits\u00fcberlegungen\u00bb. Genaue Voraussagen sind nicht m\u00f6glich.\nGenerell arbeiten mehrere Forschungsteams an mehreren Standorten mit Pharmafirmen zusammen, insgesamt sind zurzeit\n[\u00fcber 30 Projekte so weit, dass sie schon an Menschen getestet werden](https://www.nytimes.com/interactive/2020/science/coronavirus-vaccine-tracker.html). Der Geschwindigkeit halber haben Firmen [die Produktionsmaschinen schon angeworfen](https://www.wsj.com/articles/from-freezer-farms-to-jets-logistics-operators-prepare-for-a-covid-19-vaccine-11598639012), als sich die Impfstoffe noch in den ersten Testphasen befanden.\nIn standardisierten klinischen Studien testet man Heilmittel in drei Phasen an Menschen:\nMan testet das Mittel auf Sicherheit und Vertr\u00e4glichkeit hin.\nMan ermittelt seine optimale Dosierung.\nMan pr\u00fcft in einer grossen Stichprobe von Testpersonen, ob sich seine Wirkung von der eines Placebos statistisch signifikant unterscheidet und welche Nebenwirkungen dabei auftreten.\nDie Mittel der Firmen Moderna und Pfizer\n[sowie 7 weitere Projekte](https://www.nytimes.com/interactive/2020/science/coronavirus-vaccine-tracker.html) befinden sich zurzeit in der dritten Phase ihrer klinischen Versuche. Moderna etwa hat [Ende Juli damit begonnen](https://clinicaltrials.gov/ct2/show/NCT04470427), 30\u2019000 Erwachsene [in verschiedenen amerikanischen Gliedstaaten](https://clinicaltrials.gov/ct2/show/NCT04470427#contacts) zu rekrutieren. Testpersonen sollen bis zu zwei Jahre lang beobachtet werden. Klingt zwar etwas langwierig, aber super. Kann sonst noch etwas schiefgehen?\nEhm \u2013 ja. Denn durch Forschung allein gelangt kein Impfstoff in Ihren K\u00f6rper. Damit w\u00e4ren wir jetzt bei der Frage, wie \u00abImpfstoff bereit\u00bb gemeint ist. Das kann n\u00e4mlich heissen:\nEin Mittel hat alle Phasen des klinischen Versuchs durchlaufen und wurde f\u00fcr sicher und wirksam befunden.\nOder: Es ist in der Schweiz zur Zulassung eingereicht worden.\nOder: Es ist zugelassen (das heisst: Die Zulassungsstelle hat die Dokumentation aus den klinischen Versuchen gepr\u00fcft und f\u00fcr gut befunden).\nOder: Es ist in so grossen Mengen produziert und abgepackt worden, dass es auch f\u00fcr die Schweiz reicht. Es steht bereit f\u00fcr den Transport.\nOder: Ihre Haus\u00e4rztin hat es erhalten und hat Zeit f\u00fcr Sie. Sie hat das Mittel in die Spritze gezogen und Ihren Oberarm desinfiziert. Es kann losgehen.\nEs gibt noch erhebliche Unsicherheiten, was die Wirksamkeit der Impfstoffe, den Zulassungsprozess und all die kleinen und grossen logistischen H\u00fcrden angeht. Klingt ziemlich abstrakt, ist aber hoch spannend, denn \u00fcber die Forschungsergebnisse hinaus spielen verdammt viele Faktoren eine Rolle dabei, ob und wann diese Nadel Sie endlich sticht.\nWenn Sie nun denken, damit w\u00e4ren die gr\u00f6ssten H\u00fcrden abgehakt, dann liegen Sie vermutlich falsch. Die allergr\u00f6sste H\u00fcrde, sagt Immunologe Daniel Speiser, werde vermutlich sein, dass sich viele Menschen nicht impfen lassen werden wollen. Auch deshalb seien saubere Standards bei Entwicklung und Zulassung so wichtig: Alles andere sch\u00fcre auch Misstrauen bei den Personen, die Impfungen grunds\u00e4tzlich positiv gegen\u00fcberst\u00fcnden.\nAlso, etwas ausf\u00fchrlicher und der Reihe nach.\nDie H\u00fcrden bei der Wirksamkeit: Es kann gut sein, dass zumindest manche der entwickelten Impfstoffe nicht einen kompletten, sondern\n[nur einen partiellen Schutz bieten werden](https://www.statnews.com/2020/08/25/four-scenarios-on-how-we-might-develop-immunity-to-covid-19/). Zum Beispiel Schutz vor schwerer Lungenkrankheit \u2013 aber nicht vor Symptomen im oberen Atemtrakt. Erfahrene Forschende f\u00fcrchten, [dass die Wirkstoffe entt\u00e4uschen werden](https://www.washingtonpost.com/health/2020/08/02/covid-vaccine/) und dass so das Vertrauen in die Impfstoffe erodiert. Virologe Christian Drosten [h\u00e4lt dem in der \u00abZeit\u00bb entgegen](https://www.zeit.de/2020/33/corona-zweite-welle-eindaemmung-massnahmen-christian-drosten): \u00abSelbst wenn sie keinen vollst\u00e4ndigen Schutz b\u00f6ten, w\u00fcrden sie die Verbreitung des Virus deutlich verlangsamen und die Krankheit weniger schwer verlaufen lassen. Das sollten wir nicht zerreden.\u00bb\nM\u00f6glich ist auch, dass ein Impfstoff f\u00fcr bestimmte Bev\u00f6lkerungsgruppen \u2013 sagen wir j\u00fcngere Menschen \u2013 wirksamer ist, ein anderer f\u00fcr \u00e4ltere (daf\u00fcr h\u00e4tte er vielleicht mehr Nebenwirkungen).\n[Solche Resultate werden vermutlich erst Schritt f\u00fcr Schritt eintreffen](https://blogs.sciencemag.org/pipeline/archives/2020/08/25/preparing-for-the-vaccine-results). Sobald es dann ein breiteres Bild der verschiedenen, sicheren, wirksamen und zugelassenen Mittel gibt, kann man sie entsprechend kombinieren.\nDie H\u00fcrden bei der Zulassung: Ein sicherer, wirksamer Impfstoff muss von einer staatlichen Stelle zugelassen werden \u2013 dann erst kommt er auf den Markt. In den Vereinigten Staaten ist daf\u00fcr die Food and Drug Administration zust\u00e4ndig, in der Schweiz ist das die Swissmedic. Dort pr\u00fcfen interdisziplin\u00e4re Teams die Resultate aus den klinischen Studien, sie kl\u00e4ren m\u00f6gliche immunologische Probleme und die Qualit\u00e4t der Herstellung ab. Vielleicht stellen sie auch R\u00fcckfragen an das Pharmaunternehmen, formulieren Bedenken, warten auf Antworten. Das braucht alles Zeit.\nDa es gerade eilt, gibt es die M\u00f6glichkeit, vor Abschluss der Forschung ein Gesuch f\u00fcr ein\n[beschleunigtes oder befristetes Zulassungsverfahren](https://www.swissmedic.ch/swissmedic/de/home/ueber-uns/publikationen/visible/swissmedic-visible-june-2020.spa.v1.app/de/covid-19.html) einzureichen. [Das Schweizer Heilmittelgesetz sieht dies zum Beispiel](https://www.admin.ch/opc/de/classified-compilation/20002716/index.html#a9a) bei lebensbedrohenden Krankheiten vor, wenn das Arzneimittel vereinbar ist mit dem \u00abSchutz der Gesundheit\u00bb, man von ihm einen \u00abgrossen therapeutischen Nutzen\u00bb erwartet und in der Schweiz kein zugelassenes, anwendbares, \u00abgleichwertiges Arzneimittel verf\u00fcgbar ist\u00bb. Kurz: wenn der erwartete Nutzen gr\u00f6sser ist als die potenziellen Risiken.\nDer Ruf nach Beschleunigung birgt die Gefahr, dass Beteiligte vom \u00fcblichen Qualit\u00e4tsstandard abweichen und unsichere oder wenig wirksame Stoffe zugelassen werden. Und: Ist ein Stoff einmal auf dem Markt, wird es schwierig,\n[Testpersonen zu finden f\u00fcr andere Medikamente oder Impfstoffe](https://blogs.sciencemag.org/pipeline/archives/2020/08/25/preparing-for-the-vaccine-results). Viele wollen sich dann nicht mehr auf eine Studie einlassen, bei der sie zufallsm\u00e4ssig Placebo statt Wirkstoff erhalten k\u00f6nnten.\nUm Sicherheitsrisiken, die sich aus der Beschleunigung ergeben k\u00f6nnten, auszuschliessen, tauschten sich \u00aballe Beteiligten bereits in einer fr\u00fchen Phase der mehrstufigen Verfahren aus\u00bb, schreibt uns Lukas Jaggi, Mediensprecher bei Swissmedic. Man halte Ressourcen bereit und plane zurzeit etwa Prozesse parallel, die sonst nacheinander abliefen. Gesuche im Zusammenhang mit Covid-19 behandle man \u00abpriorit\u00e4r, ohne die wissenschaftliche Pr\u00fcfung \u2039abzuk\u00fcrzen\u203a, denn die Arzneimittelsicherheit geht vor\u00bb.\nGeht es schneller, wenn ein Impfstoff anderswo, etwa in den USA, schon zugelassen wurde?\n\u00abWir sind im Austausch mit vielen Zulassungsbeh\u00f6rden und kennen jeweils die Schl\u00fcsse, die andere aus ihrer Begutachtung ziehen\u00bb, sagt J\u00f6rg Schl\u00e4pfer von Swissmedic. \u00abAber wir pr\u00fcfen unabh\u00e4ngig davon jedes Gesuch selber auf Sicherheit, Wirksamkeit und hohe Qualit\u00e4t des Impfstoffs.\u00bb\nDie H\u00fcrden f\u00fcr die Logistik: Ein zugelassener Impfstoff muss in grossen Mengen hergestellt und dann zum Beispiel in spezielle Glasampullen \u2013\n[bei denen es Engp\u00e4sse gibt](https://www.businessinsider.com/coronavirus-vaccine-glass-vial-shortage-could-delay-global-rollout-2020-5?r=US&IR=T) \u2013 abgepackt werden. Manchmal liegt zwischen diesen beiden Schritten noch ein Transport. Sind die abgepackten Impfdosen einmal bereit, geht es an den weltweiten Vertrieb.\nDazwischen muss man das Zeug irgendwo lagern.\n[Den von der Schweiz bestellten Moderna-Impfstoff bei minus 20 Grad, den von Pfizer sogar bei noch tieferen Temperaturen](https://www.wsj.com/articles/from-freezer-farms-to-jets-logistics-operators-prepare-for-a-covid-19-vaccine-11598639012). Das heisst, dass eine sogenannte K\u00fchlkette bereitstehen muss: f\u00fcr den gesamten Transport, f\u00fcr Lagerungsphasen sowie in den Spit\u00e4lern und Praxen, die Patienten mit dem Mittel impfen. Viele \u00c4rzte seien f\u00fcr solche Minustemperaturen gar nicht ausger\u00fcstet, sagt Immunologe Daniel Speiser. [Ausserdem kann es bei jedem Transportschritt zu Verz\u00f6gerungen kommen](https://www.wsj.com/articles/from-freezer-farms-to-jets-logistics-operators-prepare-for-a-covid-19-vaccine-11598639012): Ein Flug f\u00e4llt aus, ein Lastwagen f\u00e4hrt in einen Graben, die K\u00fchlkette wird unterbrochen, eine Verpackung geht kaputt, das Gesundheitspersonal kommt mit dem Impfen nicht nach.\nSo viel bis zum ersten Nadelstich.\nDie meisten Impfstoffe,\n[die sich zurzeit in fortgeschrittenen Testphasen befinden](https://blogs.sciencemag.org/pipeline/archives/2020/08/25/preparing-for-the-vaccine-results), werden in zwei Dosen verabreicht, um ausreichenden Schutz zu bieten. Sie m\u00fcssen also ein paar Wochen nach der ersten Spritze f\u00fcr eine zweite zur\u00fcck zu Ihrer Haus\u00e4rztin. Damit werden viele der logistischen H\u00fcrden gleich doppelt so hoch. Und damit verl\u00e4ngert sich auch die Zeit, bis Sie gegen Sars-CoV-2 (teilweise) immun sein werden.\n\u00ab\n[The Atlantic](https://www.theatlantic.com/health/archive/2020/07/covid-19-vaccine-reality-check/614566/)\u00bb und die \u00ab [Washington Post](https://www.washingtonpost.com/health/2020/08/02/covid-vaccine/)\u00bb schrieben darum schon im Sommer: Ein wirksamer Impfstoff ist erst der Anfang vom Ende.\nFrage an Immunologe Speiser: Wie lange wird es dauern, bis auf der ganzen Welt breite Bev\u00f6lkerungsschichten geimpft sind?\n\u00abWenn alles richtig gut l\u00e4uft: vielleicht zwei bis drei Jahre. Aber das ist ein Sunshine-Szenario.\u00bb Ein grosser Fortschritt w\u00e4re bereits, wenn man Risikogruppen und besonders exponierte Personen sch\u00fctzen k\u00f6nnte.\nMoment kurz, Sie haben vorhin von \u00abNebenwirkungen\u00bb geschrieben. Welche Nebenwirkungen?\nGehen wir f\u00fcr einmal vom Schlimmsten aus.\nManche Impfungen wirken \u2013 in wenigen Personen \u2013 wie ein Katalysator:\n[Sie machen den Krankheitsverlauf schwerer](https://www.thelancet.com/journals/lancet/article/PIIS0140-6736(20)31252-6/fulltext). Dahinter k\u00f6nnen verschiedene Mechanismen stecken. Zum Beispiel: Das Immunsystem bildet Antik\u00f6rper, [die die Viren nur scheinbar neutralisieren](https://www.nature.com/articles/s41586-020-2538-8), ihnen in Realit\u00e4t aber den Weg in die menschlichen Zellen erleichtern.\nFrage an Immunologe Daniel Speiser: Wie wahrscheinlich ist dieses Ph\u00e4nomen?\n\u00abNach den jetzigen Erkenntnissen: sehr unwahrscheinlich. Aber Experten werden das Ph\u00e4nomen sehr nahe beobachten, und es wird lange dauern, bis man diese Nebenwirkung ausschliessen kann. Gerade weil sie so selten ist und man sie unter Umst\u00e4nden erst sp\u00e4t entdeckt.\u00bb\nDeshalb testet man so rigoros und an so vielen Testpersonen, ob die Impfstoffe tats\u00e4chlich nur den sch\u00fctzenden Teil des Immunsystems aktivieren.\nViel h\u00e4ufigere Nebenwirkungen sind Fieber oder Schmerzen an der Injektionsstelle, welche die Sicherheit aber kaum beeintr\u00e4chtigen. Laut Immunologe Daniel Speiser kommt das gerade beim mRNA-Impfstoff von Moderna etwas h\u00e4ufiger vor als \u00fcblich. Bei ungef\u00e4hrlichen Nebenwirkungen verschiebt sich die Sorge von Expertinnen auf die Frage, ob die Bev\u00f6lkerung sie akzeptiert.\nWas, wenn das Virus mutiert \u2013 war dann die bisherige Impfstoff-Forschung f\u00fcr die Tonne?\nDie eher gute Nachricht: Viren, auch Sars-CoV-2, ver\u00e4ndern sich st\u00e4ndig. Sie vervielf\u00e4ltigen sich, und dabei entstehen kleine Fehler im Erbgut. Die bisherigen Daten dazu lassen aber lediglich auf Mutationen schliessen, die dem erwartbaren Grundrauschen entsprechen.\n[Vermutlich sind zurzeit keine Ver\u00e4nderungen dabei](https://nzzas.nzz.ch/wissen/die-draengendsten-corona-fragen-virologin-gibt-antworten-ld.1575124), welche das Virus t\u00f6dlicher \u2013 oder weniger t\u00f6dlich \u2013 machen k\u00f6nnten.\nViel Aufmerksamkeit hat im Sommer die Mutation D614G erhalten, die schon seit dem Winter zirkuliert und vermutlich die am weitesten verbreitete Version von Sars-CoV-2 ist. Umstritten ist, ob sie ansteckender ist als andere Versionen \u2013\n[die Datenlage ist noch zu d\u00fcnn f\u00fcr eine abschliessende Antwort](https://www.letemps.ch/sciences/sarscov2-mute). Die Bef\u00fcrchtung basiert unter anderem darauf, dass die Mutation an der Stelle des Genoms auftritt, die das Stachelprotein betrifft. \u00dcber dieses dringt das Virus in die menschlichen Zellen ein.\nDie nur wenig schlechtere Nachricht: Vielleicht m\u00fcssten Sie eine k\u00fcnftige Impfung nicht nur wegen der abklingenden Immunit\u00e4t alle paar Jahre erneuern, sondern auch, weil sie dem sich ver\u00e4ndernden Virus angepasst werden muss. \u00abAber ich gehe nicht davon aus, dass das kurzfristig ein Problem sein wird\u00bb, sagt die Molekular-Epidemiologin Emma Hodcroft.\nDie vorliegenden Varianten von Sars-CoV-2 seien nach wie vor sehr \u00e4hnlich wie die Version, die man Ende 2019 entdeckt habe. Mit so kleinen Unterschieden k\u00f6nne ein Impfstoff umgehen: Er bringe dem K\u00f6rper bei, mehrere Teile des Virus zu erkennen. \u00abEntsteht dann in einem Teil eine Mutation, wird der Impfstoff h\u00f6chstwahrscheinlich trotzdem funktionieren\u00bb, sagt Hodcroft.\nViren, die schon lange unter Menschen leben, sind viel diverser \u2013 bei der Grippe zirkulieren von Jahr zu Jahr andere Familien, weshalb in der Regel jedes Jahr eine neue Impfung ansteht. Von Sars-CoV-2 gibt es bisher erst eine solche Familie. \u00abIn f\u00fcnf bis zehn Jahren werden wir aber nach Mutationen schauen m\u00fcssen, die einen Impfstoff beeinflussen k\u00f6nnten\u00bb, sagt Hodcroft. Bis dahin w\u00e4ren Wissenschaftlerinnen auch gut ausger\u00fcstet, um darauf zu reagieren. \u00abVielleicht wird es aber auch gar nie so weit kommen.\u00bb\nIch bleibe mal optimistisch. Wird die Pandemie mit einem wirksamen und verf\u00fcgbaren Impfstoff nur noch eine b\u00f6se Erinnerung sein?\nSo einfach ist es leider nicht. Vielleicht haben Sie gelesen oder geh\u00f6rt, dass manche Genesene\n[sich erneut mit dem Virus infiziert haben](https://www.nature.com/articles/d41586-020-02506-y).\nDas ist per se noch kein Grund zur Panik: Erstens wurde \u00fcber diese vereinzelten F\u00e4lle intensiv berichtet, das Ph\u00e4nomen wirkt also vermutlich gr\u00f6sser, als es ist. Zweitens passen mehrere dieser F\u00e4lle in bekannte immunologische Muster: eine erste milde Infektion \u2013 zu mild, um langfristige Immunit\u00e4t zu generieren \u2013 und eine zweite,\n[dann ganz ohne Beschwerden](https://www.nature.com/articles/d41586-020-02506-y). Oder: eine zweite Infektion mit Symptomen, aber milderen. Das illustriert zwar, dass die Immunit\u00e4t bei manchen Genesenen rasch zur\u00fcckgeht, was man auch an ihren Antik\u00f6rpern im Blut sieht. Es zeigt aber auch, dass das Immunsystem ein Ged\u00e4chtnis hat und bei einem zweiten Aufeinandertreffen mit Sars-CoV-2 anders reagieren kann.\nWenn der K\u00f6rper erstmals mit einem Krankheitserreger in Ber\u00fchrung kommt und ihn bemerkt, ruft er weisse Blutk\u00f6rperchen zu Hilfe, die auf den Erreger losgehen. Speziell an Sars-CoV-2 ist, dass das Virus \u00abein talentierter Cheib\u00bb ist, wie Immunologe Daniel Speiser sagt, und das Immunsystem austrickst. Es erkennt das Virus erst relativ sp\u00e4t, reagiert dementsprechend sp\u00e4t \u2013 und inzwischen\n[hat sich das Virus heimlich vermehren und Schaden anrichten k\u00f6nnen](https://www.theatlantic.com/health/archive/2020/08/covid-19-immunity-is-the-pandemics-central-mystery/614956/). [Ich will es genauer wissen: Wie funktioniert die Immunabwehr?]\nVorweg: Was hier folgt, sind nur die allergr\u00f6bsten Grundz\u00fcge. Denn,\n[wie der US-Wissenschaftsjournalist Ed Yong neulich schrieb](https://www.theatlantic.com/health/archive/2020/08/covid-19-immunity-is-the-pandemics-central-mystery/614956/): \u00abImmunologie ist, wo die Intuition hingeht, um zu sterben.\u00bb\nDie weissen Blutk\u00f6rperchen sind zwar schnell, aber sie sind Generalisten: Egal, was die Infektion hervorgerufen hat, sie bek\u00e4mpfen es. Wenn das nicht reicht, holen sie Verst\u00e4rkung bei den Spezialistinnen: sogenannten T-Zellen, die speziell auf verschiedene Erreger zugeschnitten sind.\nIst erst einmal die richtige T-Zelle gefunden und aktiviert, so vermehrt sie sich, ihre Klone gehen auf virusbefallene Zellen los und zerst\u00f6ren sie.\nZus\u00e4tzlich aktivieren sie sogenannte B-Zellen, die Antik\u00f6rper produzieren. (Diese gehen nicht in den Zellen, sondern ausserhalb davon auf das Virus los.)\nDas Gute an den T-Zellen: Sie werden sich k\u00fcnftig an diesen spezifischen Erreger erinnern. Kommt der K\u00f6rper erneut mit Sars-CoV-2 in Kontakt, werden sie schneller reagieren. Sie werden ihn nicht vor einer Ansteckung sch\u00fctzen \u2013 ihre Aufgabe ist es ja, erst virusbefallene Zellen zu zerst\u00f6ren \u2013, aber sie k\u00f6nnten daf\u00fcr sorgen, dass die Infektion schneller erkannt und bek\u00e4mpft wird und so milder verl\u00e4uft.\nDas Gute an den B-Zellen: Im besten Fall erkennen sie das Virus ebenfalls k\u00fcnftig wieder und legen direkt mit der Produktion von Antik\u00f6rpern los.\nAuf den sogenannten T-Zellen, die zum Ged\u00e4chtnis des Immunsystems geh\u00f6ren, ruhen die Hoffnungen f\u00fcr das Problem, dass die Antik\u00f6rper\n[im Blut mancher genesener Covid-19-Patientinnen schnell abnehmen](https://www.theatlantic.com/health/archive/2020/08/covid-19-immunity-is-the-pandemics-central-mystery/614956/). [Verschiedene](https://www.statnews.com/2020/08/25/four-scenarios-on-how-we-might-develop-immunity-to-covid-19/) [Experten](https://www.ndr.de/nachrichten/info/54-Eine-Empfehlung-fuer-Herbst,audio739306.html) gehen davon aus, dass Reinfektionen erstens selten bleiben und zweitens meist nur zu milden Erkrankungen f\u00fchren werden.\nHeisst diese eher schwache Immunit\u00e4t bei Genesenen, dass auch eine Impfung nur kurzfristig Schutz bieten wird, Herr Speiser?\n\u00abEs sieht so aus, als k\u00f6nnten manche Impfstoffe eine l\u00e4nger anhaltende Immunit\u00e4t induzieren als die Krankheit selbst\u00bb, sagt der Immunologe. Wenn alles richtig gut gehe, k\u00f6nnte man damit mehrere Jahre immun werden.\nOkay, das mit der Impfung ist noch unsicher. Gibt es andere Strategien, mit denen wir eine gr\u00f6ssere Herbstwelle abfangen k\u00f6nnten?\nDazu sagt das Bundesamt f\u00fcr Gesundheit: \u00abIn der besonderen Lage liegt die Zust\u00e4ndigkeit bei den Kantonen. Sie haben die Kompetenz und kennen Situation und Terrain von nah, um Massnahmen zu beschliessen.\u00bb\nFrage also an den Epidemiologen Marcel Salath\u00e9: Was k\u00f6nnen die Kantone im Herbst tun, solange kein Impfstoff verf\u00fcgbar ist?\n\u00abWir m\u00fcssen gar nicht so viel anderes machen als bisher. Aber wir k\u00f6nnen das Bisherige noch effizienter machen.\u00bb Heisst: Schneller testen. Kontakte schneller ermitteln. Sie schneller isolieren.\nUnd daf\u00fcr, sagt Salath\u00e9, sei es gar nicht so schlecht, dass die Kantone unterschiedlich vorgingen. Jeder entwickle seine L\u00f6sungsans\u00e4tze. So k\u00f6nnten sie voneinander lernen \u2013 etwa von denen, die lokale Ausbr\u00fcche besonders effizient unter Kontrolle br\u00e4chten. Und Massnahmen w\u00fcrden besser akzeptiert, wenn sie auf die lokale oder regionale Lage zugeschnitten seien \u2013 und sinnvoll wirkten. Sie erinnern sich: In public health steht das Wort public.\nWir haben also noch Spielraum, bevor es wieder \u00abShutdown\u00bb heisst.\nUnbedingt. Mehr noch. Wenn es nochmals zum Shutdown kommt, dann w\u00e4re das ein ganz schlechtes Zeichen.\nEs w\u00fcrde bedeuten, dass wir die Kontrolle \u00fcber die Infektionszahlen erneut verloren h\u00e4tten. Und das, obwohl wir nun sehr viel besser aufgestellt sind als damals, im M\u00e4rz. Denken Sie an Testkapazit\u00e4ten, Contact-Tracing, Quarant\u00e4nebestimmungen, Masken. Und an das Wissen und die Erfahrung, die wir in der Zwischenzeit ansammeln konnten.\nStatt in \u00abShutdown\u00bb versus \u00abOffen\u00bb k\u00f6nnten wir aber vermehrt in Zwischenl\u00f6sungen denken, sagt Epidemiologin Emma Hodcroft: \u00abIn welcher Situation sind lokale \u00d6ffnungen und Schliessungen spezifischer Einrichtungen sinnvoll?\u00bb Das m\u00fcsse man sich aus verschiedenen Perspektiven anschauen: Gesellschaft, Wirtschaft, Wissenschaft. Idealerweise: vor dem Winter.\nEpidemiologe Marcel Salath\u00e9 geht ebenfalls nicht davon aus, dass es wieder zu einem nationalen Shutdown kommen wird: \u00abIn der Regel macht dieses Giesskannenprinzip auch nicht viel Sinn \u2013 ausser, wenn man schon zu sp\u00e4t dran ist.\u00bb Nur wenn es an so vielen Orten so stark brenne wie im M\u00e4rz, sei eine totale Notbremse n\u00f6tig.\nTesten, Quarant\u00e4ne, Kontaktverfolgung, Masken \u2026 Gibt es denn auch irgendwelche neuen Ideen?\nDie gibt es. Die Frage ist nur, was sie taugen. Wir gehen hier auf zwei m\u00f6gliche Strategien ein: eine, die erwiesenermassen taugt. Und eine, die, O-Ton Marcel Salath\u00e9, \u00abvielleicht nicht superrealistisch ist\u00bb.\nDer Gedanke, der taugt: Zielt auf die Effizienz des Contact-Tracings ab,\n[wie zum Beispiel Virologe Christian Drosten in der \u00abZeit\u00bb erkl\u00e4rt](https://www.zeit.de/2020/33/corona-zweite-welle-eindaemmung-massnahmen-christian-drosten/komplettansicht). Wenn die Fallzahlen steigen und Contact-Tracerinnen st\u00e4rker beansprucht werden, ohne viel mehr Ressourcen zu haben, dann werden sie sich auf die wichtigsten F\u00e4lle beschr\u00e4nken m\u00fcssen. Welche? Sie erinnern sich vermutlich daran, dass die \u00dcbertragungen nicht gleich verteilt sind: Manche Infizierte stecken niemanden oder nur eine weitere Person an. Andere [sehr viele mehr](https://www.sciencemag.org/news/2020/05/why-do-some-covid-19-patients-infect-many-others-whereas-most-don-t-spread-virus-all). Geht man Ersteren nach, schickt man Einzelpersonen in Quarant\u00e4ne. Geht man Letzteren nach, findet man ganze Cluster von m\u00f6glichen Infizierten.\nNehmen wir an, eine Person hat an einer Geburtstagsparty mehrere andere angesteckt. Hier startet, noch unbemerkt, ein Cluster. Entwickelt nun einer der Geburtstagsg\u00e4ste ein paar Tage sp\u00e4ter Symptome, w\u00e4re es doch sinnvoll,\n[so Drosten](https://www.ndr.de/nachrichten/info/54-Eine-Empfehlung-fuer-Herbst,audio739306.html), als Erstes alle anderen G\u00e4ste zu informieren und in Quarant\u00e4ne zu schicken \u2013 damit dieses Cluster kein weiteres verursacht. Daf\u00fcr muss man den einen Gast nicht priorit\u00e4r danach befragen, wen er in den letzten zwei Wochen alles angesteckt haben k\u00f6nnte. Sondern nach besuchten Veranstaltungen, bei denen er sich angesteckt haben k\u00f6nnte \u2013 und bei denen gleichzeitig ein solches Quell-Cluster entstanden sein k\u00f6nnte.\nEs lohnt sich,\n[und das zeigen die Erfahrungen von Japan](https://asiatimes.com/2020/06/japans-contact-tracing-method-is-old-but-gold/), nicht nur vorw\u00e4rts in der \u00dcbertragungskette zu schauen, sondern auch r\u00fcckw\u00e4rts. Japan hat es so geschafft, [w\u00e4hrend der ersten Covid-Welle ohne Shutdown auszukommen](https://www.zeit.de/2020/33/corona-zweite-welle-eindaemmung-massnahmen-christian-drosten/komplettansicht).\nDie vielleicht nicht superrealistische Idee: Daf\u00fcr\n[pl\u00e4diert der Harvard-Epidemiologe Michael Mina in der \u00abNew York Times](https://www.nytimes.com/2020/07/03/opinion/coronavirus-tests.html)\u00bb. Sie geht so:\nWir entwickeln die sogenannten Antigen-Schnelltests weiter, lassen sie im Schnellverfahren zu, und dann testen sich alle Menschen jeden Tag selber auf Sars-CoV-2. Ihr Test ist positiv? Bleiben Sie zu Hause, lassen Sie das Resultat mit einem sogenannten PCR-Test \u2013 dem Goldstandard, den nur das Gesundheitspersonal ausf\u00fchren kann \u2013 best\u00e4tigen. Sobald der Papierstreifen des Antigen-Schnelltests \u00abnegativ\u00bb anzeigt, d\u00fcrfen Sie aus dem Haus.\n\u00abWir brauchen die besten Mittel, um das Virus zu finden und einzud\u00e4mmen, nicht einen perfekten Test, den niemand anwenden kann\u00bb, schreibt Mina. Das klingt an sich vern\u00fcnftig, die Sache hat aber ein paar Haken \u2013 finden nebst Epidemiologe Salath\u00e9 auch\n[viele](https://www.nytimes.com/2020/09/06/health/coronavirus-rapid-test.html) [andere](https://pca.st/qs3pxdls) Experten.\nDer Haken: In der Theorie klingt die Strategie attraktiv, praktisch ist sie kaum umsetzbar.\nDenn:\nDie schnellen, g\u00fcnstigen Antigen-Tests sind\n[bedeutend weniger pr\u00e4zise als PCR-Tests](https://www.ncbi.nlm.nih.gov/pmc/articles/PMC7383555/). Das Risiko, dass eine infizierte und ansteckende Person nicht als solche erkannt wird, [ist hoch](https://www.nytimes.com/2020/09/06/health/coronavirus-rapid-test.html?referringSource=articleShare)und vermutlich noch h\u00f6her, wenn Laien statt Labors die Tests durchf\u00fchren. In Regionen, wo das Virus wenig verbreitet ist, [k\u00f6nnte man sogar mehr falsche als richtige positive Resultate erhalten](https://www.theatlantic.com/science/archive/2020/08/abbott-covid-19-rapid-tests-trump/615826/)(die Mathematik hinter diesem Ph\u00e4nomen [haben wir hier erkl\u00e4rt](https://www.republik.ch/2020/05/18/was-wissen-wir-eigentlich-unterdessen-ueber-das-corornavirus#14-warum-sind-wir-nicht-laengst-mit-antikoerper-tests-und-immunitaets-nachweisen-versorgt)).\nDer Schnelltest soll zeigen, ob man noch ansteckend ist. Aber im Moment weiss schlicht niemand, wie viele Viren jemand im K\u00f6rper haben muss, um sie auf andere zu \u00fcbertragen.\n[M\u00f6glicherweise unterscheidet sich diese Menge sogar von Person zu Person](https://www.nytimes.com/2020/09/06/health/coronavirus-rapid-test.html?referringSource=articleShare). Virologe Drosten schl\u00e4gt vor, hierf\u00fcr [erst einmal Schwellenwerte f\u00fcr PCR-Tests zu definieren und anhand deren zu validieren](https://www.ndr.de/nachrichten/info/54-Eine-Empfehlung-fuer-Herbst,audio739306.html).\nEin Nasen-Rachen-Abstrich, wie er f\u00fcr PCR-Tests ben\u00f6tigt wird, ist zwar sehr unangenehm, aber auch sehr sensitiv \u2013 wenn ihn Gesundheitsexpertinnen durchf\u00fchren. Tests, die man daheim selber ausf\u00fchrt,\n[m\u00fcssten mit anderen Abstrichmethoden auskommen](https://www.theatlantic.com/science/archive/2020/08/abbott-covid-19-rapid-tests-trump/615826/)(etwa ein Abstrich aus der Nase oder Spucke).\nMan kann nicht ohne weiteres davon ausgehen, dass jeder und jede die Disziplin hat, sich selber regelm\u00e4ssig zu testen. Und sich bei einem positiven Ergebnis auch freiwillig in Quarant\u00e4ne zu begeben \u2013 das zeigen zum Beispiel\n[die Erfahrungen mit Studierenden der Universit\u00e4t Illinois](https://www.bloomberg.com/news/articles/2020-09-11/how-coronavirus-rampaged-through-university-of-illinois-college-campus). \u00abWir m\u00fcssen damit rechnen, dass niemand sich perfekt verh\u00e4lt\u00bb, sagt Epidemiologin Emma Hodcroft.\nAll das k\u00f6nnte dazu f\u00fchren, dass das Vertrauen in die Tests erodiert. Das w\u00fcrde die Umsetzung dieser Idee, die stark auf Eigenverantwortung basiert, zus\u00e4tzlich erschweren.\nBisher hat niemand untersucht, ob die Idee auch in der Realit\u00e4t taugt. Also ob man eine Pandemie mit einer schnellen, g\u00fcnstigen und weniger pr\u00e4zisen Teststrategie (Antigen-Tests) wirklich ebenso gut oder gar besser kontrollieren kann als mit einer langsamen, teuren und pr\u00e4ziseren (PCR-Tests).\nDie aktuell zugelassenen Antigen-Tests wurden nicht f\u00fcr die \u00f6ffentliche Verwendung entwickelt,\n[zurzeit wenden sie Mitarbeitende im Gesundheitswesen an](https://www.nytimes.com/2020/09/06/health/coronavirus-rapid-test.html). Schnelltests f\u00fcr eine breitere \u00d6ffentlichkeit m\u00fcssten in den USA erst einmal die Standards der Zulassungsstelle und in Europa [eine Konformit\u00e4tsbewertung erf\u00fcllen](https://www.swissmedic.ch/swissmedic/de/home/medizinprodukte/regulierung-medizinprodukte/medical-device-regulation_online-guide.html#1288050509). Und dann in sehr grosser Menge produziert und vertrieben werden, wenn jeder und jede sich jeden Tag testen soll. Die logistischen H\u00fcrden w\u00e4ren enorm.\nRealistischer w\u00e4re es, Schnelltests vermehrt in Spit\u00e4lern und Arztpraxen einzusetzen, etwa f\u00fcr vorl\u00e4ufige Resultate zur Infektiosit\u00e4t einer Patientin, bevor aus dem PCR-Test ein genaueres Resultat vorliegt. Oder um einen Genesenen aus der Isolation \u00abfreizutesten\u00bb, sofern ein k\u00fcnftiger Schnelltest anzeigte, er sei nicht mehr ansteckend.\nSolange Impfstoffe und Schnelltests noch keine L\u00f6sung sind: Wie sch\u00fctze ich mich und andere am besten?\nGrunds\u00e4tzlich gilt: Je n\u00e4her Sie bei infizierten Person sind und je l\u00e4nger dieser Kontakt anh\u00e4lt, desto wahrscheinlicher, dass Sie sich anstecken.\nZudem verfestigt sich die Annahme, dass sogenannte Aerosole \u2013 kontaminierte Kleinstpartikel, die in der Luft h\u00e4ngen \u2013 bei der Verbreitung von Sars-CoV-2\n[eine gr\u00f6ssere Rolle spielen als urspr\u00fcnglich angenommen](https://academic.oup.com/cid/advance-article/doi/10.1093/cid/ciaa939/5867798) (Schmierinfektionen via Oberfl\u00e4chen daf\u00fcr eine kleinere). In einem \u00fcberf\u00fcllten oder schlecht gel\u00fcfteten Raum ist eine Ansteckung gem\u00e4ss einem noch nicht peer-reviewten wissenschaftlichen Artikel [viel wahrscheinlicher als draussen an der frischen Luft](https://www.medrxiv.org/content/10.1101/2020.02.28.20029272v2), wo sich die Aerosole schnell zerstreuen.\nStellen nun alle Innenr\u00e4ume eine Gefahr dar, Herr Salath\u00e9?\n\u00abDavon gehe ich nicht aus\u00bb, sagt der Epidemiologe, \u00abdenn sonst h\u00e4tten wir viel h\u00f6here Fallzahlen.\u00bb Bei der Frage nach Ansteckungen \u00fcber Aerosole sei aber vieles noch ungekl\u00e4rt; hier w\u00fcrden Wissenschaftlerinnen laufend mehr herausfinden.\nDaraus ergeben sich folgende Empfehlungen:\nBleiben Sie auf Abstand. Auch zu Menschen, die nicht husten oder niesen \u2013 ansteckend sind Infizierte auch,\n[bevor sie Symptome zeigen](https://www.ndr.de/nachrichten/info/54-Eine-Empfehlung-fuer-Herbst,audio739306.html).\nWaschen Sie sich die H\u00e4nde. Auch wenn es mittlerweile einen breiten Konsens gibt, dass Schmierinfektionen nicht die haupts\u00e4chliche Infektionsroute sind, k\u00f6nnen Sie sich \u00fcber kontaminierte Fl\u00e4chen anstecken.\nHalten Sie Ihre Maske griffbereit. Sie reduziert die Zahl der Viruspartikel, die Sie in die Luft atmen, sprechen, husten oder niesen, falls Sie infiziert sind. Und sie sch\u00fctzt Ihre Mitmenschen \u00fcbrigens nicht nur vor Tr\u00f6pfcheninfektionen,\n[schreibt Virologe Christian Drosten](https://twitter.com/c_drosten/status/1301120470566277120): \u00abMasken verringern Aerosole auch durch das Abfangen von gr\u00f6sseren Tr\u00f6pfchen, bevor diese in der Luft eintrocknen und zu leichten Aerosolpartikeln werden.\u00bb\nWenn Sie sich mit mehreren Mitmenschen in Innenr\u00e4umen aufhalten: L\u00fcften Sie regelm\u00e4ssig. Mehr Luft bedeutet mehr Luftmolek\u00fcle, welche die potenziellen Viruspartikel\n[zerstreuen und verd\u00fcnnen](https://www.bmj.com/content/370/bmj.m3223). L\u00fcften Sie h\u00e4ufiger, sobald das Wetter herbstlicher wird: In warmer, trockener Luft verdunsten diese Partikel schneller als in k\u00fchler, feuchter Luft.\nL\u00fcften Sie besonders h\u00e4ufig, wenn solche Aufenthalte Sprechen, Singen, Schreien oder heftiges Atmen beinhalten (denken Sie an ein langes Meeting auf engem Raum, Karaoke, Clubbing und Fitnesscenter). Denn mehr Luftausstoss bedeutet mehr Virusausstoss.\nF\u00fchren Sie ein\n[Cluster- und Kontakttagebuch](https://www.zeit.de/2020/33/corona-zweite-welle-eindaemmung-massnahmen-christian-drosten/komplettansicht), in dem Sie f\u00fcr jeden Tag Ihre Situationen mit Cluster-Potenzial sowie sonstige Kontakte notieren (Sie nahmen an einer grossen Sitzung teil, standen an einem Geburtstagsap\u00e9ro herum, trafen eine Freundin zum Tee). Falls Sie krank werden, helfen Sie damit den Contact-Tracern, weitere m\u00f6gliche Infizierte zu finden. Falls Ihnen das zu kompliziert ist: Installieren Sie [die Swiss-Covid-App](https://www.bag.admin.ch/bag/de/home/krankheiten/ausbrueche-epidemien-pandemien/aktuelle-ausbrueche-epidemien/novel-cov/swisscovid-app-und-contact-tracing.html)oder das entsprechende Pendant an Ihrem Wohnort. Sie \u00fcbernimmt manche der Tagebuch-Aufgaben. Und wenn mich Sars-CoV-2 trotzdem erwischt \u2013 habe ich mehr Behandlungsm\u00f6glichkeiten als im Fr\u00fchling?\nJa.\nF\u00fcr Remdesivir etwa, das erste Medikament,\n[das in der Schweiz (befristet) f\u00fcr die Behandlung von Covid-19 in Spit\u00e4lern zugelassen wurde](https://www.swissmedic.ch/swissmedic/de/home/news/coronavirus-covid-19/erweitert_einsatz_remdesivir.html#:~:text=02.07.2020,w%C3%A4hrend%20die%20Zulassungsunterlagen%20begutachtet%20werden.), konnte nachgewiesen werden: Schwer kranke Patientinnen, die mit diesem antiviralen Stoff behandelt werden, [k\u00f6nnen schneller aus dem Spital entlassen werden](https://www.nejm.org/doi/full/10.1056/NEJMoa2007764).\nF\u00fcr Dexamethason \u2013 ein\n[Steroidhormon, das \u00dcberreaktionen des Immunsystems d\u00e4mpft](https://www.nzz.ch/wissenschaft/das-cortison-praeparat-dexamethason-kann-schwer-erkrankte-covid-19-patienten-retten-ld.1561567) \u2013 gibt es erst vorl\u00e4ufige Resultate aus der Forschung. Sie legen aber nahe, dass das Mittel bei hospitalisierten Patienten [die Sterberate senkt](https://www.nejm.org/doi/full/10.1056/NEJMoa2021436), wenn man es zum richtigen Zeitpunkt einsetzt.\nAuch Blutplasma von genesenen Covid-19-Patienten wird als Behandlung eingesetzt. Es enth\u00e4lt Antik\u00f6rper, die der K\u00f6rper von neuen Patienten braucht, um sich gegen Sars-CoV-2 zur Wehr zu setzen. Plasma hat wegen\n[einer Notfallzulassung in den USA](https://www.fda.gov/news-events/press-announcements/fda-issues-emergency-use-authorization-convalescent-plasma-potential-promising-covid-19-treatment#:~:text=Today%2C%20the%20U.S.%20Food%20and,efforts%20to%20fight%20COVID%2D19.) viel Aufmerksamkeit erhalten, seine Wirksamkeit gegen Covid-19 [konnte bisher aber nicht nachgewiesen werden](https://jamanetwork.com/journals/jama/article-abstract/2766943).\nAlle drei Mittel werden in der Schweiz verwendet, und weitere Behandlungsm\u00f6glichkeiten\n[werden in klinischen Studien erforscht](https://ncs-tf.ch/de/policy-briefs/impact-of-therapies-against-covid-19-on-mortality-21-aug-20-en-2/download). \u00abJe mehr wir forschen und lernen, desto besser wird es aussehen\u00bb, sagt Immunologe Daniel Speiser.\nEs\n[gibt zwar immer wieder Engp\u00e4sse, etwa wenn ein anderes Land grosse Best\u00e4nde kauft](https://www.theguardian.com/us-news/2020/jun/30/us-buys-up-world-stock-of-key-covid-19-drug). Dies ist bei Remdesivir, auf welches das Pharmaunternehmen Gilead ein Patent hat, problematischer als bei Dexamethason, einem \u00e4lteren und g\u00fcnstig erh\u00e4ltlichen Mittel. Gilead [vergibt seit Mai aber auch Lizenzen an Generika-Hersteller](https://www.statnews.com/pharmalot/2020/05/12/gilead-generics-remdesivir-covid19-coronavirus-licenses/). Von Corona-M\u00fcden an Corona-M\u00fcde: Lassen Sie uns nochmals auf die Z\u00e4hne beissen.\nWir machen uns vorsichtshalber auf einen langen, ziemlich harten Winter gefasst. Tun Sie das auch. Aber mit der Zuversicht, dass die Strategien, die uns durch die dunkleren Jahreszeiten bringen sollen, greifen \u2013 und sogar noch effizienter greifen k\u00f6nnten. Und mit vorsichtigem Optimismus, dass eine Zeit naht, in der wir die gr\u00f6ssten \u00c4ngste und Einschr\u00e4nkungen hinter uns lassen k\u00f6nnen.\nEine der besten Aussagen, die wir bisher zur Pandemie gelesen haben, geht so:\nDie L\u00e4nder, die gegen Covid-19 besser gefahren sind [als die USA], sind keinem einheitlichen Rezept gefolgt. Viele haben Masken breit eingesetzt; Neuseeland hat das nicht getan. Viele haben extensiv getestet; Japan hat das nicht getan. Viele hatten wissenschaftsorientierte Regierungen, die fr\u00fch handelten; Hongkong hatte das nicht \u2013 stattdessen kompensierte eine Graswurzelbewegung f\u00fcr die nachl\u00e4ssige Regierung. Viele L\u00e4nder waren kleine Inseln; nicht so das grosse, kontinentale Deutschland.\nJede dieser Nationen hatte Erfolg, weil sie gen\u00fcgend Dinge richtig gemacht hat.\n[Wissenschaftsjournalist Ed Yong im Magazin \u00abThe Atlantic](https://www.theatlantic.com/magazine/archive/2020/09/coronavirus-american-failure/614191/)\u00bb.\nWir brauchen nicht die perfekte Strategie, um ohne Shutdown oder \u00fcberlastete Spit\u00e4ler durch den Winter zu kommen \u2013 und dar\u00fcber hinaus. Wir brauchen lediglich gen\u00fcgend Dinge richtig zu machen.\nDavon sind Epidemiologe Marcel Salath\u00e9 und Immunologe Daniel Speiser \u00fcberzeugt:\nJe mehr Zeit verstreicht, desto st\u00e4rker festigt sich das bisher aufgebaute Wissen und desto mehr finden wir heraus \u00fcber Sars-CoV-2.\nJe mehr wir wissen, desto effizienter k\u00f6nnen wir den tricksenden Cheib und die Krankheit, die er ausl\u00f6st, bek\u00e4mpfen.\nDesto weniger Menschen erkranken schwer am Coronavirus.\nDesto weniger Menschen sterben daran.\nDesto weniger kostet es uns, solidarisch mit den Schw\u00e4chsten unter uns zu sein.\nDesto mehr werden die Dinge wieder genau so wie vorher.\nWenn wir das wollen, versteht sich.", "language": null, "image": "https://cdn.repub.ch/s3/republik-assets/repos/republik/article-coronamuede-was-uns-im-herbst-winter-und-fruehling-erwartet/images/d997ee5743e9e5d30f9a9402a140a1acfa5f04d6.jpeg?size=1500x750", "pagetype": "website", "links": ["https://wiki.selfhtml.org/wiki/JavaScript/Tutorials/JavaScript_aktivieren", "/", "/angebote", "/~mkolly", "https://cdn.repub.ch/pdf/2020/09/16/coronamuede-wir-auch-was-uns-im-herbst-winter-und-fruehling-erwartet.pdf", "https://www.republik.ch/2020/09/16/coronamuede-wir-auch-was-uns-im-herbst-winter-und-fruehling-erwartet", "https://www.republik.ch/2020/09/16/coronamuede-wir-auch-was-uns-im-herbst-winter-und-fruehling-erwartet", "/dialog?t=article&id=0bbd2cbe-72b0-4dfd-a41b-af675b6c7d76", "/angebote?package=ABO", "/angebote?package=MONTHLY_ABO", "/", "https://twitter.com/richardneher/status/1293857065425866754?s=20", "/2020/03/04/das-coronavirus-geht-um-sollten-sie-angst-haben-und-wenn-ja-was-dann", "/2020/05/18/was-wissen-wir-eigentlich-unterdessen-ueber-das-corornavirus", null, "https://www.nytimes.com/2020/09/02/health/covid-19-vaccine-cdc-plans.html", "https://www.nytimes.com/interactive/2020/science/coronavirus-vaccine-tracker.html", "https://www.nytimes.com/2020/09/02/health/covid-19-vaccine-cdc-plans.html", "https://investors.modernatx.com/news-releases/news-release-details/biopharma-leaders-unite-stand-science", "https://www.nytimes.com/2020/09/04/science/covid-vaccine-pharma-pledge.html", "https://www.pfizer.com/news/press-release/press-release-detail/pfizer-and-biontech-share-positive-early-data-lead-mrna", "https://www.nytimes.com/2020/09/04/science/covid-vaccine-pharma-pledge.html", "/2020/04/28/wie-wir-mit-studien-und-statistiken-zu-corona-umgehen", "https://www.statnews.com/2020/09/08/astrazeneca-covid-19-vaccine-study-put-on-hold-due-to-suspected-adverse-reaction-in-participant-in-the-u-k/", "https://www.nytimes.com/2020/09/12/health/astrazeneca-coronavirus-vaccine-trial-resumes.html", null, "/2020/05/18/was-wissen-wir-eigentlich-unterdessen-ueber-das-corornavirus", "https://www.bag.admin.ch/bag/de/home/das-bag/aktuell/medienmitteilungen.msg-id-80005.html", "https://www.thelancet.com/journals/lancet/article/PIIS0140-6736(20)31252-6/fulltext", "https://www.webmd.com/lung/news/20200610/covid-19-latest-updates", "https://www.nature.com/articles/nrd.2017.243#Sec21", "https://www.nytimes.com/interactive/2020/science/coronavirus-vaccine-tracker.html", "https://www.wsj.com/articles/from-freezer-farms-to-jets-logistics-operators-prepare-for-a-covid-19-vaccine-11598639012", "https://www.nytimes.com/interactive/2020/science/coronavirus-vaccine-tracker.html", "https://clinicaltrials.gov/ct2/show/NCT04470427", "https://clinicaltrials.gov/ct2/show/NCT04470427#contacts", null, "https://www.statnews.com/2020/08/25/four-scenarios-on-how-we-might-develop-immunity-to-covid-19/", "https://www.washingtonpost.com/health/2020/08/02/covid-vaccine/", "https://www.zeit.de/2020/33/corona-zweite-welle-eindaemmung-massnahmen-christian-drosten", "https://blogs.sciencemag.org/pipeline/archives/2020/08/25/preparing-for-the-vaccine-results", "https://www.swissmedic.ch/swissmedic/de/home/ueber-uns/publikationen/visible/swissmedic-visible-june-2020.spa.v1.app/de/covid-19.html", "https://www.admin.ch/opc/de/classified-compilation/20002716/index.html#a9a", "https://blogs.sciencemag.org/pipeline/archives/2020/08/25/preparing-for-the-vaccine-results", "https://www.businessinsider.com/coronavirus-vaccine-glass-vial-shortage-could-delay-global-rollout-2020-5?r=US&IR=T", "https://www.wsj.com/articles/from-freezer-farms-to-jets-logistics-operators-prepare-for-a-covid-19-vaccine-11598639012", "https://www.wsj.com/articles/from-freezer-farms-to-jets-logistics-operators-prepare-for-a-covid-19-vaccine-11598639012", "https://blogs.sciencemag.org/pipeline/archives/2020/08/25/preparing-for-the-vaccine-results", "https://www.theatlantic.com/health/archive/2020/07/covid-19-vaccine-reality-check/614566/", "https://www.washingtonpost.com/health/2020/08/02/covid-vaccine/", null, "https://www.thelancet.com/journals/lancet/article/PIIS0140-6736(20)31252-6/fulltext", "https://www.nature.com/articles/s41586-020-2538-8", null, "https://nzzas.nzz.ch/wissen/die-draengendsten-corona-fragen-virologin-gibt-antworten-ld.1575124", "https://www.letemps.ch/sciences/sarscov2-mute", null, "https://www.nature.com/articles/d41586-020-02506-y", "https://www.nature.com/articles/d41586-020-02506-y", "https://www.theatlantic.com/health/archive/2020/08/covid-19-immunity-is-the-pandemics-central-mystery/614956/", null, "https://www.theatlantic.com/health/archive/2020/08/covid-19-immunity-is-the-pandemics-central-mystery/614956/", "https://www.theatlantic.com/health/archive/2020/08/covid-19-immunity-is-the-pandemics-central-mystery/614956/", "https://www.statnews.com/2020/08/25/four-scenarios-on-how-we-might-develop-immunity-to-covid-19/", "https://www.ndr.de/nachrichten/info/54-Eine-Empfehlung-fuer-Herbst,audio739306.html", null, null, null, "https://www.zeit.de/2020/33/corona-zweite-welle-eindaemmung-massnahmen-christian-drosten/komplettansicht", "https://www.sciencemag.org/news/2020/05/why-do-some-covid-19-patients-infect-many-others-whereas-most-don-t-spread-virus-all", "https://www.ndr.de/nachrichten/info/54-Eine-Empfehlung-fuer-Herbst,audio739306.html", "https://asiatimes.com/2020/06/japans-contact-tracing-method-is-old-but-gold/", "https://www.zeit.de/2020/33/corona-zweite-welle-eindaemmung-massnahmen-christian-drosten/komplettansicht", "https://www.nytimes.com/2020/07/03/opinion/coronavirus-tests.html", "https://www.nytimes.com/2020/09/06/health/coronavirus-rapid-test.html", "https://pca.st/qs3pxdls", "https://www.ncbi.nlm.nih.gov/pmc/articles/PMC7383555/", "https://www.nytimes.com/2020/09/06/health/coronavirus-rapid-test.html?referringSource=articleShare", "https://www.theatlantic.com/science/archive/2020/08/abbott-covid-19-rapid-tests-trump/615826/", "https://www.republik.ch/2020/05/18/was-wissen-wir-eigentlich-unterdessen-ueber-das-corornavirus#14-warum-sind-wir-nicht-laengst-mit-antikoerper-tests-und-immunitaets-nachweisen-versorgt", "https://www.nytimes.com/2020/09/06/health/coronavirus-rapid-test.html?referringSource=articleShare", "https://www.ndr.de/nachrichten/info/54-Eine-Empfehlung-fuer-Herbst,audio739306.html", "https://www.theatlantic.com/science/archive/2020/08/abbott-covid-19-rapid-tests-trump/615826/", "https://www.bloomberg.com/news/articles/2020-09-11/how-coronavirus-rampaged-through-university-of-illinois-college-campus", "https://www.nytimes.com/2020/09/06/health/coronavirus-rapid-test.html", "https://www.swissmedic.ch/swissmedic/de/home/medizinprodukte/regulierung-medizinprodukte/medical-device-regulation_online-guide.html#1288050509", null, "https://academic.oup.com/cid/advance-article/doi/10.1093/cid/ciaa939/5867798", "https://www.medrxiv.org/content/10.1101/2020.02.28.20029272v2", "https://www.ndr.de/nachrichten/info/54-Eine-Empfehlung-fuer-Herbst,audio739306.html", "https://twitter.com/c_drosten/status/1301120470566277120", "https://www.bmj.com/content/370/bmj.m3223", "https://www.zeit.de/2020/33/corona-zweite-welle-eindaemmung-massnahmen-christian-drosten/komplettansicht", "https://www.bag.admin.ch/bag/de/home/krankheiten/ausbrueche-epidemien-pandemien/aktuelle-ausbrueche-epidemien/novel-cov/swisscovid-app-und-contact-tracing.html", null, "https://www.swissmedic.ch/swissmedic/de/home/news/coronavirus-covid-19/erweitert_einsatz_remdesivir.html#:~:text=02.07.2020,w%C3%A4hrend%20die%20Zulassungsunterlagen%20begutachtet%20werden.", "https://www.nejm.org/doi/full/10.1056/NEJMoa2007764", "https://www.nzz.ch/wissenschaft/das-cortison-praeparat-dexamethason-kann-schwer-erkrankte-covid-19-patienten-retten-ld.1561567", "https://www.nejm.org/doi/full/10.1056/NEJMoa2021436", "https://www.fda.gov/news-events/press-announcements/fda-issues-emergency-use-authorization-convalescent-plasma-potential-promising-covid-19-treatment#:~:text=Today%2C%20the%20U.S.%20Food%20and,efforts%20to%20fight%20COVID%2D19.", "https://jamanetwork.com/journals/jama/article-abstract/2766943", "https://ncs-tf.ch/de/policy-briefs/impact-of-therapies-against-covid-19-on-mortality-21-aug-20-en-2/download", "https://www.theguardian.com/us-news/2020/jun/30/us-buys-up-world-stock-of-key-covid-19-drug", "https://www.statnews.com/pharmalot/2020/05/12/gilead-generics-remdesivir-covid19-coronavirus-licenses/", null, "https://www.theatlantic.com/magazine/archive/2020/09/coronavirus-american-failure/614191/", "https://www.republik.ch/2020/09/16/coronamuede-wir-auch-was-uns-im-herbst-winter-und-fruehling-erwartet", "/dialog?t=article&id=0bbd2cbe-72b0-4dfd-a41b-af675b6c7d76", "/angebote?package=ABO", "/angebote?package=MONTHLY_ABO", "/", "https://www.instagram.com/republikmagazin/", "https://www.facebook.com/RepublikMagazin", "https://twitter.com/RepublikMagazin", "https://republik.social/@republik_magazin", "/", "/angebote?group=", "/abholen", "/anmelden", "/about", "/format/jobs", "/cockpit", "/faq", "https://project-r.construction/", "/veranstaltungen", "/community", "/komplizin", "/etikette", "/agb", "/datenschutz", "/statuten", "/aktionariat", "/impressum", "mailto:kontakt@republik.ch", "/impressum", "https://github.com/republik/plattform"]}