{"title": "Long Covid - Symptome & H\u00e4ufigkeit | Praxis Breitenberger", "author": "Markus Breitenberger", "url": "https://www.praxis-breitenberger.de/ratgeber/infektion/long-covid-haeufigkeit-symptome-impfung/", "hostname": "praxis-breitenberger.de", "description": "Alle Informationen zu Long Covid \u25ba Was ist Long Covid? \u25ba H\u00e4ufigkeit & Symptome \u25ba Long Covid nach Impfung \u25ba jetzt informieren!", "sitename": "Praxis Breitenberger", "date": "2022-10-05", "id": null, "license": null, "body": null, "comments": "", "commentsbody": null, "raw_text": null, "text": "Kurz zusammengefasst:\n- Bis heute gibt es keine einheitliche Definition des Begriffs \u201eLong Covid\u201c.\n- Hierzulande geht man von Long Covid aus, wenn Beschwerden nach einer Covid-19-Infektion l\u00e4nger als 4 Wochen anhalten.\n- Wie viele Menschen betroffen sind, ist unklar. Gesch\u00e4tzt wird, dass zwischen 10 und 40 Prozent der Corona-Infizierten Long Covid entwickelt.\n- Long Covid \u00e4u\u00dfert sich durch unterschiedliche Symptome; die Intensit\u00e4t der Beschwerden wie auch die Dauer des Syndroms variieren bei Betroffenen.\n- Bei einem Gro\u00dfteil der Erkrankten geh\u00f6rt eine Fatigue (M\u00fcdigkeit) zum Beschwerdebild.\n- Eine standardisierte Behandlung gibt es nicht. Ein ganzheitliches, individuell abgestimmtes Konzept mit verschiedenen Therapiebausteinen kann helfen.\nInhaltsverzeichnis\nWas ist Long Covid?\nNoch immer gibt es keine einheitliche Definition f\u00fcr Long Covid bzw. f\u00fcr ein Long-Covid-Syndrom. Ein Gro\u00dfteil der Symptome erinnert an ein\n[ Chronisches Fatigue Syndrom (ME/CFS)](https://www.praxis-breitenberger.de/ratgeber/autoimmunerkrankung/chronisches-erschoepfungssyndrom/), allen voran Ersch\u00f6pfung und die damit verbundenen k\u00f6rperlichen und kognitiven Beeintr\u00e4chtigungen. Noch l\u00e4sst sich nicht genau sagen, ob Long Covid als eigenst\u00e4ndige Erkrankung oder als eine Form von ME/CFS verstanden werden muss.\nAb wann spricht man von Long Covid?\nHierzulande orientieren sich die medizinischen Fachgesellschaften an der Leitlinien-Empfehlung des britischen National Institute for Health and Care Excellence (NICE), die Ende 2020 formuliert wurde.\nDanach geht man von Long Covid aus, wenn die Beschwerden auch vier Wochen nach der akuten Krankheitsphase einer SARS-CoV-2-Infektion fortbestehen bzw. neu auftreten.\nEin weiteres Kriterium f\u00fcr die Diagnose \u201eLong Covid\u201c ist laut deutscher Leitlinie (Stand 17.8.2022), wenn sich eine Grunderkrankung, die der Betroffene schon vor der Corona-Infektion hatte, im Anschluss an eine Covid-19-Infektion verschlechtert.\nWas ist Post Covid?\nEin anderer Ansatz ist die Definition des \u201ePost-Covid-Syndroms\u201c (post-acute sequelae of Covid-19): Halten die Beschwerden l\u00e4nger als zw\u00f6lf Wochen nach durchgemachter Covid-19-Erkrankung an und l\u00e4sst sich f\u00fcr sie keine andere Erkl\u00e4rung finden, liegt ein Post-Covid-Syndrom vor.\nLaut Weltgesundheitsorganisation (WHO) liegt \u201ePost Covid\u201c vor, wenn die Beschwerden noch drei Monate nach der Infektion bestehen und dann mindestens zwei Monate anhalten.\nDen Begriff \u201eLong Covid\u201c verwendet die WHO dagegen nicht mehr.\nUnterscheidung: Long Covid oder Post Covid?\nAuch die von der Deutschen Gesellschaft f\u00fcr Pneumologie und Beatmungsmedizin e.V. (DGP) formulierte\n[ S1-Leitlinie zu Post-COVID/Long-COVID](https://www.awmf.org/leitlinien/detail/ll/020-027.html) greift die zeitliche Abgrenzung zwischen Long Covid und Post Covid auf, doch fasst sie die beiden Begriffe zu Long-/Post-Covid zusammen.\nAu\u00dferdem regen die Autoren an, auch die Intensit\u00e4t der Beschwerden bei der Diagnosefindung zu ber\u00fccksichtigen. Denn anders als genesene Patienten, die nach einer\n[SARS-CoV-2-Infektion](https://www.praxis-breitenberger.de/ratgeber/infektion/corona/) zwar weiterhin unter Symptomen leiden, sich durch sie jedoch nicht wesentlich beeintr\u00e4chtigt f\u00fchlen, ist den meisten von Long-/Post-Covid-Betroffenen gemeinsam, dass sie sich aufgrund ihrer starken Beschwerden in der Bew\u00e4ltigung ihres Alltags wie auch in ihrer Lebensqualit\u00e4t erheblich beeintr\u00e4chtigt f\u00fchlen und auf eine Behandlung angewiesen sind.\nUnterscheidung: Long- oder Post- Covid vs Post-Intensive-Care-Syndrom (PICS)\nAbzugrenzen ist Long- oder Post- Covid vom sogenannten Post-Intensive-Care-Syndrom, kurz PICS, das sich zwar durch teilweise \u00e4hnliche Symptome \u00e4u\u00dfert, jedoch Folge einer l\u00e4ngeren Intensivtherapie ist. Hiervon sind oft auch Covid-19-Patienten betroffen, die aufgrund eines schweren Verlaufs l\u00e4nger auf der Intensivstation behandelt werden mussten.\nLong Covid nach Omikron\nVerschiedene Studien legen nahe, dass die Omikron-Variante des SARS-CoV-2-Virus seltener zu Long Covid f\u00fchrt als die Delta-Variante.\nAls besonders aussagekr\u00e4ftig gilt eine britischen Studie, die Mitte Juni im Fachjournal \u201cThe Lancet\u201d ver\u00f6ffentlicht wurde und f\u00fcr die britische Wissenschaftler die Daten von knapp 56.000 Omikron-Infizierten mit denen von etwa 41.000 Delta-F\u00e4llen verglichen haben.\nDemnach bekamen rund 10,8 Prozent der Delta-Patienten, aber nur 4,4 Prozent der Omikron-Infizierten Long Covid.\nRichtig ist jedoch auch: Da Omikron von allen Subtypen bislang die mit Abstand ansteckendste Variante ist, sind die Fallzahlen stark angestiegen. Dies wiederum hat dazu gef\u00fchrt hat, dass auch die Zahl der Long Covid-F\u00e4lle deutlich zugenommen hat.\nWie viele Long-Covid-F\u00e4lle gibt es in Deutschland?\nWie viele Long Covid-F\u00e4lle es derzeit in Deutschland gibt, ist unklar. Die Deutsche Gesellschaft f\u00fcr Pneumologie und Beatmungsmedizin sch\u00e4tzt, dass bis zu 15 Prozent aller Erkrankten mit Long Covid zu k\u00e4mpfen haben, das Robert Koch-Institut geht von rund 10 Prozent aller Covid-19-Infizierten aus, die an Long Covid leiden.\nForschungseinrichtungen wie die Gutenberg-Universit\u00e4t Mainz gehen davon aus, dass bis zu 40 Prozent nach einer durchgemachten Covid-19-Erkrankung Long-Covid-Symptome entwickeln.\nDerzeit laufen in Deutschland verschiedene Untersuchungen, um genauere Daten zu bekommen, darunter beispielsweise ein von der nordrheinwestf\u00e4lischen Landesregierung finanziertes Forschungsprojekt namens Beyond Covid-19-Studie, an der verschiedene Universit\u00e4tskliniken in NRW beteiligt sind. Dabei geht es auch darum, weitere Informationen \u00fcber die Ursachen und Auswirkungen von Long Covid zu erhalten.\nWie viele Long-Covid-F\u00e4lle gibt es weltweit?\nWas die H\u00e4ufigkeit von Long Covid betrifft, kommen internationale Studien teilweise zu ganz unterschiedlichen Ergebnissen. Deshalb kann derzeit nur vorsichtig gesch\u00e4tzt werden, wie viele Long Covid-Kranke es tats\u00e4chlich gibt.\nBeispielsweise sind laut einem Umbrella Review mit 23 \u00dcbersichts- und 102 Originalarbeiten 7,5 Prozent bis 41 Prozent Corona-Infizierte von Long-Covid-typischen Langzeitsymptomen betroffen.\nLaut einer aktuellen Studie aus Wuhan haben sogar 55 Prozent der getesteten Covid-19-Patienten auch zwei Jahre sp\u00e4ter noch immer mit mindestens einem Long-Covid-Symptom zu k\u00e4mpfen.\nAltersverteilung bei Long Covid\nHier gibt es lt. dem Deutschen \u00c4rzteblatt von 2020 eine Verkehrung der Verh\u00e4ltnisse von akuter Covid-Infektion zu Long Covid: W\u00e4hrend die meisten Menschen, die an Covid-19 schwer erkranken sehr alt sind, sind es vor allem Menschen jungen und mittleren Alters, die einer Studie zufolge \u00fcber Long-Covid-Beschwerden klagen.\nUrsachen\nDie genaue Ursache des Long-Covid-Syndroms ist nach wie vor nicht gekl\u00e4rt.\nEs gilt jedoch als sicher, dass Betroffene auch nach einem milden oder moderaten Covid-19-Verlauf ohne Krankenhausaufenthalt langanhaltende Symptome entwickeln k\u00f6nnen!\nVermutlich ist das Long-Covid-Syndrom multifaktoriell bedingt und auch Ursachen nicht bei allen Betroffenen gleich. Sehr wahrscheinlich spielen \u2013 neben einer Regulationsst\u00f6rung des vegetativen Nervensystems \u2013 vor allem\n[autoimmune Prozesse](https://www.praxis-breitenberger.de/ratgeber/autoimmunerkrankung/erkrankung-homoeopathie/) eine wichtige Rolle. Daf\u00fcr spricht zum Beispiel, dass im Blut von Long-Covid-Patienten oft verschiedene Autoantik\u00f6rper nachweisbar sind. Bislang ist jedoch kein Autoantik\u00f6rper bekannt, der speziell durch das Coronavirus ausgel\u00f6st wird.\nNeueste Untersuchungen zu Long Covid\nBeinahe t\u00e4glich werden neue Studien, Erkl\u00e4rungsans\u00e4tze und Vermutungen \u00fcber Ursachen und Heilungsm\u00f6glichkeiten von Long Covid ver\u00f6ffentlicht. Viele davon mit einem fragw\u00fcrdigen Hintergrund. In diesem Beitrag lesen Sie aktuell gesicherte Erkenntnisse \u00fcber Ursachen und Ausl\u00f6ser von Long Covid.\nLong Covid als Folge von Silent Inflammations\nBei einem Teil der Betroffenen lassen sich neben bestimmten Immunzellen auch entz\u00fcndungsf\u00f6rdernde Zytokine im Blut nachweisen. Sie zeigen an, dass sich Entz\u00fcndungsreaktionen (Inflammation) im K\u00f6rper abspielen. Darauf st\u00fctzt sich u.a. der Erkl\u00e4rungsansatz, dass schwelende Entz\u00fcndungsprozesse am Krankheitsgeschehen von Long Covid beteiligt sind. Dies zeigt sich auch bei vielen anderen chronischen Zivilisationskrankheiten, wie\n[Autoimmunerkrankungen](https://www.praxis-breitenberger.de/ratgeber/autoimmunerkrankung/) und [Krebserkrankungen](https://www.praxis-breitenberger.de/ratgeber/krebs/krebserkrankung/).\nLong Covid als Folge von reaktiviertem Epstein-Barr-Virus\nLaut einer aktuellen US-amerikanischen Studie k\u00f6nnte die schon l\u00e4nger diskutierte Hypothese stimmen, wonach an der Entstehung des Long-Covid-Beschwerdebilds reaktivierte Epstein-Barr-Viren (EBV) wesentlich beteiligt sind. Laut Studie waren bei den untersuchten Long-Covid-Patienten die Antik\u00f6rper, die das Epstein-Barr-Virus bek\u00e4mpfen, erh\u00f6ht.\nZur Erkl\u00e4rung: Das Epstein-Barr-Virus, das zum Beispiel das Pfeiffersche Dr\u00fcsenfieber ausl\u00f6st, geh\u00f6rt zur Familie der Herpesviren. Einmal infiziert, verbleibt ein Vertreter dieser Gruppe ein Leben lang im K\u00f6rper \u2013 und kann durch bestimmte Ausl\u00f6ser eine erneute Infektion hervorrufen. Werden Eppstein-Barr-Viren reaktiviert, reagiert das Immunsystem mit der Bildung von spezifischen Antik\u00f6rpern, um das Virus unsch\u00e4dlich zu machen.\nLong Covid als Folge eines niedrigen Cortisolspiegels\nDie gleiche US-amerikanische Untersuchung hat ergeben, dass Long Covid-Patienten eine ungew\u00f6hnlich niedrige Konzentration von Cortisol im Blut haben, was einer\n[Nebennierenschw\u00e4che](https://www.praxis-breitenberger.de/ratgeber/stress/nebennierenschwaeche/) in Phase III-IV entspricht.\nDas k\u00f6rpereigene Hormon, das in der Nebenniere gebildet wird und unter anderem entz\u00fcndungshemmend wirkt, hat zudem die Aufgabe, daf\u00fcr zu sorgen, dass dem K\u00f6rper in Stresssituationen gen\u00fcgend Energie zur Verf\u00fcgung steht.\nDas bedeutet im Umkehrschluss: Ist der Cortisolspiegel erniedrigt, k\u00f6nnen Symptome wie Ersch\u00f6pfung,\n[chronische M\u00fcdigkeit ](https://www.praxis-breitenberger.de/ratgeber/autoimmunerkrankung/chronisches-erschoepfungssyndrom/)und Schw\u00e4chegef\u00fchl die Folgen sein \u2013 Beschwerden, wie sie typisch f\u00fcr Long Covid sind.\nDie Studie empfiehlt deshalb, den Cortisolspiegel k\u00fcnftig als Biomarker f\u00fcr die Diagnostik von Long Covid zu nutzen. Sie k\u00f6nnen das bequem von zuhause testen:\n[Stress & Ersch\u00f6pfung Test](https://www.medivere.de/shop/Alle/Stress-Erschoepfung-Test.html?af=100287)\nLaborchemische Analyse von Adrenalin, Cortisol im Tagesprofil, DHEA, Dopamin, Noradrenalin und Serotonin zur Bestimmung der aktuellen neuroendokrinen Situation. Eine einfach zu verstehende Anleitung liegt bei. Das Testergebnis leiten Sie an meine Praxis weiter und Sie erhalten von mir eine Analyse und ggf. eine kostenpflichtige Therapieempfehlung. Geben Sie im 1. Bestellschritt den Gutscheincode AP34961 ein, um 5% Rabatt zu erhalten.\nLong Covid durch Mastzellaktivierungssyndrom (MCAS)\nLaut einer anderen Studie eines US-amerikanischen Forscherteams k\u00f6nnte in einigen F\u00e4llen auch eine \u00dcberaktivit\u00e4tsst\u00f6rung von Mastzellen an der Entstehung von Long Covid beteiligt sein \u2013 getriggert durch die vorausgegangene Covid-19-Erkrankung.\nBekannt ist, dass es im Rahmen von autoimmunbedingten Entz\u00fcndungsreaktionen auch zu einer \u00dcberaktivierung der Mastzellen kommen kann, was als\n[Mastzellaktivierungssyndrom (MCAS)](https://www.kloesterl-infoportal.de/Spezialtherapien/Aktuelles_Thema/MCAS/Mastzellaktivierungssyndrom_Komplexes_Krankheitsbild.php) bezeichnet wird.\nAls Immunzellen geh\u00f6ren Mastzellen ihm Kampf gegen Krankheitserreger zur ersten Abwehrstation: Nach dem Kontakt mit Viren, Bakterien oder Allergenen bilden sie zahlreiche Botenstoffe (Mediatoren) wie Prostaglandine oder Histamin.\nHyperaktive Mastzellen setzen \u00fcberm\u00e4\u00dfig viele Botenstoffe frei, die dann eine Vielzahl von Symptomen hervorrufen k\u00f6nnen (s.\n[Histaminintoleranz](https://www.praxis-breitenberger.de/ratgeber/allergien/histaminintoleranz/)) \u2013 und diese sind den Symptomen von Long Covid sehr \u00e4hnlich.\nAls sicher gilt, dass Menschen, die an einem Mastzell-Aktivierungssyndrom leiden, ein hohes Risiko f\u00fcr einen schwereren Verlauf einer SARS-CoV-2-Infektion haben.\nLong Covid durch autoimmune St\u00f6rung des Blutflusses?\nSeit l\u00e4ngerem wird diskutiert, ob eine autoimmunbedingte St\u00f6rung der Mikrozirkulation in den feinsten Blutgef\u00e4\u00dfen und eine damit einhergehende chronische Unterversorgung mit Sauerstoff Ausl\u00f6ser zumindest f\u00fcr einen Teil der Long-Covid-Symptome sein k\u00f6nnte.\nIn einer\n[aktuellen Studie](https://www.ncbi.nlm.nih.gov/pmc/articles/PMC7595761/) an COVID-19-Rekonvaleszenten, die weiterhin Beschwerden hatten, wurde eine gesteigerte Entz\u00fcndungsaktivit\u00e4t der Aorta, Iliakal- und Femoralarterien im Sinne einer Vaskulitis nachgewiesen. Die Autoren der Studie erkl\u00e4ren: \u201c\u2026sticht doch die Gerinnungsproblematik derart heraus, dass ein gewisser nebenwirkungsarmer Schutz der Patienten angebracht erscheint.\u201d\nAus diesem Grund wird Patienten nach COVID-19-Erkrankung prophylaktische eine dreimonatige Thrombozytenaggregationshemmung empfohlen:\n[ThromboPhenol 150/50, 60 Kapseln](https://www.biogena.com/de/at/produkte/produkt.thrombopenol-150-50-gold.html?afid=V22880)\nT\u00e4glich 1 Kapsel mit 1 Glas Wasser einnehmen. Hilft Blutpl\u00e4ttchen auf nat\u00fcrliche Weise glatt zu halten, sorgt f\u00fcr normale Blutpl\u00e4ttchen-Funktionen und tr\u00e4gt zur Flie\u00dff\u00e4higkeit des Blutes bei. Der positive Effekt tritt nach der Einnahme von einer einzigen Kapsel ein und wurde von der EFSA (European Food Safety Authority) best\u00e4tigt.\nLong Covid durch resistente SARS-CoV-2-Viren oder Virusreste?\nAuch wenn es bislang keinen Hinweis darauf gibt, dass das Virus bei Long Covid im K\u00f6rper noch aktiv ist, vertreten einige Experten die Theorie, dass SARS-CoV-2-Viren oder Virusreste im K\u00f6rper verbleiben und dann zu Krankheitstriggern werden.\nSo k\u00f6nnten z.B. Virusbestandteile zu einem anhaltenden Abwehrkampf des Immunsystems f\u00fchren \u2013 und so Long-Covid-Symptome hervorrufen.\nLong Covid durch vorbestehende Erkrankungen und Risikofaktoren\nAktuelle Daten legen zudem nahe, dass neben einer hohen Viruslast w\u00e4hrend der akuten Infektion vor allem einige vorbestehende Erkrankungen und Risikofaktoren die Wahrscheinlichkeit f\u00fcr Long Covid erh\u00f6hen \u2013 das gilt sowohl f\u00fcr Kinder und Jugendliche wie f\u00fcr Erwachsene.\nSo sind laut Robert Koch-Institut vor allem Diabetiker und Personen gef\u00e4hrdet, die bereits eine Infektion mit dem Epstein Barr Virus durchgemacht haben. Aber auch\n[Asthma](https://www.praxis-breitenberger.de/ratgeber/allergien/allergisches-asthma/)-, [Multiple Sklerose](https://www.praxis-breitenberger.de/ratgeber/autoimmunerkrankung/multiple-sklerose-ms-symptome-verlauf-therapie/)\u2013 und [Adipositas](https://www.praxis-breitenberger.de/ratgeber/maennergesundheit/uebergewicht/)-Kranke tragen ein h\u00f6heres Risiko.\nAndererseits sind zahlreiche F\u00e4lle bekannt, die vor der Corona-Infektion gesund waren und trotzdem Long Covid entwickeln.\nFrauen erkranken h\u00e4ufiger an Long Covid\nSehr wahrscheinlich spielt auch das Geschlecht eine gr\u00f6\u00dfere Rolle: Frauen, vor allem im j\u00fcngeren und mittleren Erwachsenenalter, sind doppelt so oft von Long Covid betroffen als M\u00e4nner.\nFakt ist: bei der Modulation der antiviralen Immunantwort spielen Sexualhormone eine wichtige Rolle!\nStudien zeigen, dass pr\u00e4menopausale Frauen im Vergleich zu M\u00e4nnern und postmenopausalen Frauen eine robustere Immunantwort haben, die einen potentiell lebensbedrohlichen Zytokinsturm verhindern kann.\nDaher ist es sinnvoll neben den Stresshormonen auch die Sexualhormone zu bestimmen, um schwere Verl\u00e4ufe einer COVID-19-Erkrankung zu verhindern. Eine entscheidende Rolle dabei spielen die Hormone Estradiol, Progesteron und Testosteron. Sie k\u00f6nnen das bequem von zuhause im Speichel testen:\n[Stress & Ersch\u00f6pfung plus Test](https://www.medivere.de/shop/Alle/Stress-Erschoepfung-plus-Test.html?af=100287)\nLaborchemische Analyse von Adrenalin, Cortisol im Tagesprofil, DHEA, Dopamin, Noradrenalin, Serotonin, Testosteron, Progesteron und \u00d6stradiol zur Bestimmung der aktuellen neuroendokrinen Situation. Das Testergebnis leiten Sie an meine Praxis weiter und Sie erhalten von mir eine Analyse und ggf. eine kostenpflichtige Therapieempfehlung. Geben Sie im 1. Bestellschritt den Gutscheincode AP34961 ein, um 5% Rabatt zu erhalten.\nAnzahl der akuten Symptome entscheidend f\u00fcr Long Covid\nZudem scheint die Gefahr, ein Long-Covid-Syndrom zu entwickeln, h\u00f6her zu sein, wenn in der ersten Krankheitswoche der akuten Corona-Infektion mehr als f\u00fcnf Symptome auftreten.\nLong Covid erkennen\nBislang gibt es keine einheitliche diagnostische Empfehlung, mit der Long Covid zweifelsfrei nachgewiesen werden kann. In den letzten Monaten haben jedoch verschiedene Untersuchungen eine Reihe von Anhaltspunkten f\u00fcr die Diagnosefindung geliefert.\nDiagnose von Long Covid durch:\n- sorgf\u00e4ltige Anamnese\n- gezielte Labordiagnostik\nDiagnostik\nLeider sind immer noch viele \u00c4rztInnen \u00fcberfordert und/oder unzureichend ausgebildet, um eine gezielte Long-Covid-Diagnostik anbieten zu k\u00f6nnen. Dabei stellen mittlerweile einige Laborinstitute sehr gute Screenings zur Verf\u00fcgung.\nImmundiagnostik bei Long Covid\nMit Bestimmung von Entz\u00fcndungsparametern wie C-reaktives Protein (CRP bzw. wrCRP) und (proentz\u00fcndlichen) Zytokinen wie TNF-alpha, Interleukin-6 oder Interleukin-8 zum Nachweis von m\u00f6glichen Entz\u00fcndungsreaktionen im K\u00f6rper. Ein sogenannter \u201cZytokinsturm\u201d ist verantwortlich f\u00fcr schwere Verl\u00e4ufe einer Infektion mit SARS-CoV-2.\nHinzu kommt eine Untersuchung des Bluts auf verschiedene (Auto-)Antik\u00f6rper, zum Beispiel ANA-Antik\u00f6rper, Phospholipid-Antik\u00f6rper, Antik\u00f6rper gegen die Schilddr\u00fcse (\n[Hashimoto-Thyreoiditis](https://www.praxis-breitenberger.de/ratgeber/schilddruese/hashimoto-thyreoiditis/)) oder auch Autoantik\u00f6rper, die sich gegen Stressrezeptoren richten und oft vorhanden sind, wenn eine Fatigue besteht.\nEpstein-Barr-Virus-Diagnostik bei Long Covid\nBestimmung von Antik\u00f6rpern speziell gegen das Epstein-Barr-Virus (EBV-AK) und erg\u00e4nzend ein PCR-Test auf EBV-DNA f\u00fchrt zu diagnostischer Klarheit, um eine m\u00f6gliche Reaktivierung abzukl\u00e4ren.\nErstellung eines Mikron\u00e4hrstoffprofils bei Long Covid\nBei Long Covid ist es wichtig N\u00e4hrstoffm\u00e4ngel aufzudecken. Bereits eine suboptimale Mikron\u00e4hrstoff-Versorgung kann zu St\u00f6rungen des Stoffwechsels f\u00fchren und sich fatal auswirken, wenn der K\u00f6rper mit einer so komplexen Erkrankung wie Long Covid zu k\u00e4mpfen hat.\nWichtige Mikron\u00e4hrstoffe sind neben Vitaminen und vitamin\u00e4hnlichen Stoffen auch Mineralstoffe, Spurenelemente oder Aminos\u00e4uren. Wichtige N\u00e4hrstoffe sind zum Beispiel die Vitamine D3, A, E, C und die Vitamine der B-Familie, aber auch Coenzym Q10, Eisen oder Zink.\nS\u00e4ure-Basen-Haushalt bei Long Covid\nNahezu alle chronischen Zivilastionskrankheiten entstehen auf der Basis eines gest\u00f6rten S\u00e4ure-Basen-Haushalts mit einer Verschiebung zu einer sauren Stoffwechsellage. Sie k\u00f6nnen diese Risikofaktor selbst von zuhause ganz einfach und zuverl\u00e4ssig im Urin testen und dann ggf behandeln.\n[S\u00e4ure-Basen-Test](https://www.medivere.de/shop/Frau/Darmgesundheit/Saeure-Basen-Test-nach-Sander.html?af=100287)\nDas Testergebnis leiten Sie an meine Praxis weiter und Sie erhalten von mir eine Analyse und ggf. eine kostenpflichtige Therapieempfehlung. Geben Sie im 1. Bestellschritt den Gutscheincode AP34961 ein, um 5% Rabatt zu erhalten.\nATP zur \u00dcberpr\u00fcfung der Mitochondrien-Funktion bei Long Covid\nATP (Adenosintriphosphat) ist ein Energietr\u00e4ger und wird in den Mitochondrien, den Kraftwerken der K\u00f6rperzellen gebildet. Sind die Mitochondrien in ihrer Funktion beeintr\u00e4chtigt, steht den Zellen zu wenig ATP zur Verf\u00fcgung. Dadurch kann der K\u00f6rper nicht mehr ausreichend Energie generieren und es kommt zu einem ausgepr\u00e4gten Leistungsabfall.\nUm abzukl\u00e4ren, ob Long-Covid-Symptome wie Fatigue durch eine Stoffwechselst\u00f6rung im Energiehaushalt der K\u00f6rperzellen hervorgerufen wird, kann eine Mitochondrien-Diagnostik mit einem ATP-Profil (Thiomersal Blockade) im Blut Aufschluss geben und messen wie viel ATP in den K\u00f6rperzellen vorhanden ist.\nBestimmung eines Cortisol-Tagesprofils bei Long Covid\nAktuelle Studien zeigen, dass die Cortisolkonzentration im Blut und Speichel bei Long-Covid-Patienten erniedrigt ist, was man als\n[Nebennierenschw\u00e4che](https://www.praxis-breitenberger.de/ratgeber/stress/nebennierenschwaeche/) Phase III-IV bezeichnet. Erg\u00e4nzend kann auch das Hormon DHEA (Dehydro-Epi-Androsteron) gemessen werden \u2013 der Gegenspieler von Cortisol.\nDie aktiven Hormone lassen sich am besten im Speicheltest als Tagesprofil darstellen:\n[Stress & Ersch\u00f6pfung Test](https://www.medivere.de/shop/Alle/Stress-Erschoepfung-Test.html?af=100287)\nLaborchemische Analyse von Adrenalin, Cortisol im Tagesprofil, DHEA, Dopamin, Noradrenalin und Serotonin zur Bestimmung der aktuellen neuroendokrinen Situation. Eine einfach zu verstehende Anleitung liegt bei. Das Testergebnis leiten Sie an meine Praxis weiter und Sie erhalten von mir eine kostenpflichtige Analyse und ggf. eine Therapieempfehlung. Geben Sie im 1. Bestellschritt den Gutscheincode AP34961 ein, um 5% Rabatt zu erhalten.\nWelche Laborwerte sind noch wichtig bei Long Covid?\nHinzu kommt die Bestimmung von allgemeinen Laborparametern, um m\u00f6gliche Funktionsst\u00f6rungen von Organen abzukl\u00e4ren, zum Beispiel die Messung der Nieren-, Schilddr\u00fcsen- und Leberwerte oder der Blutgerinnung. Erg\u00e4nzend k\u00f6nnen weiterf\u00fchrende Untersuchungsmethoden, gegebenenfalls auch mithilfe von bildgebenden Verfahren, wie etwa internistische, kardiologische und/oder neurologische Untersuchungen durchgef\u00fchrt werden.\n\u2026\n[mehr](https://www.ganzimmun.de/labor/wichtige-laborinformationen/long-covid-/-post-covid-syndrom) zu Labor-Diagnostik bei Long Covid\nSymptome\nDie Symptome, die bei Long Covid auftreten, k\u00f6nnen sehr verschieden sein. Dabei k\u00f6nnen die Beschwerden einzeln oder in Kombination auftreten, sie k\u00f6nnen unterschiedlich stark ausgepr\u00e4gt sein und unterschiedlich lange andauern.\nDie h\u00e4ufigsten Symptome bei Long Covid\n- Fatigue mit M\u00fcdigkeit, Ersch\u00f6pfung und stark eingeschr\u00e4nkte Belastbarkeit\n[Kopfschmerzen](https://www.praxis-breitenberger.de/ratgeber/homoeopathie/homoeopathie-bei-kopfschmerzen/)\n- Brain fog mit Konzentrations- und Ged\u00e4chtnisproblemen\n- Haarausfall\n- Schlafst\u00f6rungen\n- St\u00f6rungen von Geschmack und Geruch\n- Brustschmerzen, Kurzatmigkeit, Husten\n- Muskelschmerzen und Muskelschw\u00e4che\n[Depressive Verstimmungen](https://www.praxis-breitenberger.de/ratgeber/psyche/normale-depression/), Angstst\u00f6rungen\n- Hauterscheinungen\n- \u00dcbelkeit,\n[Durchfall](https://www.praxis-breitenberger.de/ratgeber/homoeopathie/homoeopathie-bei-durchfall/), verminderter Appetit\n- Gewichtsverlust\n- Schwindel, Gleichgewichtsst\u00f6rungen\n[Tinnitus](https://www.praxis-breitenberger.de/ratgeber/stress/tinnitus/)\n- Gelenkschmerzen\n- Nervenst\u00f6rungen (Neuropathien), z.B. Kribbeln und Missempfindungen in H\u00e4nden und/oder F\u00fc\u00dfen\n- Sensorische Einschr\u00e4nkungen wie beeintr\u00e4chtigtes H\u00f6r- oder Sehverm\u00f6gen\nM\u00fcdigkeit bei Long Covid\nAnhaltende M\u00fcdigkeit, die sich weder durch Ausschlafen noch durch l\u00e4ngere Erholungsphasen verbessert, ist ein charakteristisches Symptom von Long Covid. Typischerweise f\u00fchlen sich die Betroffenen \u00fcber Wochen und Monate geistig und k\u00f6rperlich so m\u00fcde und ersch\u00f6pft, dass sie ihren Alltag kaum mehr bew\u00e4ltigen k\u00f6nnen. Diese Form, die weit \u00fcber eine normale M\u00fcdigkeit oder Ersch\u00f6pfung hinaus geht, wird auch Fatigue genannt wird.\nDas Ersch\u00f6pfungssyndrom ist auch im Zusammenhang mit anderen Erkrankungen bekannt. Die Grenzen der Long-Covid-Fatigue zum\n[Chronischen Fatigue-Syndrom](https://www.praxis-breitenberger.de/ratgeber/autoimmunerkrankung/chronisches-erschoepfungssyndrom/) sind flie\u00dfend. Beispielsweise k\u00f6nnen auch Long Covid-Patienten von sogenannten Post-Exertional Malaise-Episoden betroffen sein. Hierbei kann bereits eine leichte k\u00f6rperliche oder geistige Belastung gen\u00fcgen, um eine erhebliche, tagelang andauernde Verschlechterung der Beschwerden hervorzurufen.\nWie lange die ausgepr\u00e4gte M\u00fcdigkeit bzw. eine Fatigue bei Long Covid-Patienten anh\u00e4lt, l\u00e4sst sich derzeit nicht vorherherzusagen.\nWie lange dauert Long Covid?\nWie lange Long Covid insgesamt besteht, ist individuell unterschiedlich. Laut einer Studie aus Wuhan scheinen die Long-Covid-Symptome mit der Zeit zwar schw\u00e4cher und weniger zu werden, doch:\nca. 55 Prozent der Betroffenen f\u00fchlt sich auch zwei Jahre nach der akuten Covid-19-Infektion k\u00f6rperlich und seelisch beeintr\u00e4chtigt.\nDerzeit l\u00e4sst sich noch nicht endg\u00fcltig absehen, wie lange Long-Covid-Symptome im Einzelfall anhalten. Auch kann \u2013 Stand jetzt \u2013 nicht v\u00f6llig ausgeschlossen werden, dass es einen Anteil von Erkrankten gibt, bei denen die Beschwerden einen chronischen Verlauf nehmen und damit bestehen bleiben.\nMit Blick auf die vergangenen zweieinhalb Jahre halten viele Mediziner Letzteres jedoch f\u00fcr sehr unwahrscheinlich. Denn bislang konnten die allermeisten Betroffenen wieder weitgehend beschwerdefrei ihre gewohnten Alltagsaktivit\u00e4ten wieder aufnehmen \u2013 wenn auch oft erst nach einigen Monaten und nach ganzheitlicher\n[Behandlung](https://www.praxis-breitenberger.de/ratgeber/infektion/long-covid-haeufigkeit-symptome-impfung/#Behandlung).\nLong Covid bei Kindern\nAuch Kinder k\u00f6nnen an Long Covid erkranken \u2013 wenn auch deutlich seltener als Erwachsene. J\u00fcngere Kinder sind sehr viel seltener betroffen als Jugendliche. Einer Metaanalyse zufolge liegt das Risiko f\u00fcr Kinder, nach einer durchgemachten Corona-Infektion an Long Covid zu erkranken, zwischen 0,8 und 13,3 Prozent\n[. ] Erkrankt ein Kind an Long Covid, leidet es unter denselben Symptomen wie betroffene Erwachsene.\nLong Covid nach Impfung\nErsten Sch\u00e4tzungen zufolge entwickeln etwa 0,02 Prozent der Menschen, die sich zum Schutz von einer SARS-CoV-2-Virus-Infektion haben impfen lassen, Symptome, die dem Krankheitsbild Long Covid sehr \u00e4hnlich sind. Die Dunkelziffer ist dabei sehr wahrscheinlich deutlich h\u00f6her, weil ein kausaler Zusammenhang zwischen Impfung und Long Covid oft nicht registriert und noch h\u00e4ufiger von einigen \u00c4rztInnen hartn\u00e4ckig negiert wird.\nF\u00fcr diese unerw\u00fcnschte Nebenwirkung hat sich der Begriff Post-Vaccine-Syndrom oder PostVac-Syndrom etabliert \u2013 auch wenn er bislang nicht einheitlich definiert ist. Ob es sich tats\u00e4chlich um dasselbe Krankheitsbild handelt, ist derzeit Gegenstand von Untersuchungen.\nDas Paul-Ehrlich-Institut (PEI) pr\u00fcft gerade den Zusammenhang von Long-Covid-Symptomen und der Corona-Impfung. Was genau das PostVac-Syndrom ausl\u00f6sen kann, ist noch unklar. Vermutlich sind \u2013 wie bei Long Covid nach einer durchgemachten Corona-Infektion \u2013 mehrere Ausl\u00f6ser beteiligt.\nSch\u00fctzt eine Impfung vor Long Covid?\nSo wie eine Impfung keinen vollst\u00e4ndiger Schutz vor einer SARS-CoV-2-Infektion gew\u00e4hrleistet, so l\u00e4sst sich mit ihr auch Long Covid nicht g\u00e4nzlich verhindern \u2013 auch dann nicht, wenn eine dreifache Corona-Schutzimpfung sowie eine Auffrischimpfung erfolgt ist.\nEs ist m\u00f6glich, dass man trotz Impfung Symptome eines Long-Covid-Syndroms entwickeln kann.\nMCAS und PEG-Sensitivit\u00e4t nach Corona-Impfung\nDer \u00c4rzteverband Deutscher Allergologen hat im Dezember 2021 mit anderen Fachgesellschaften einen Leitfaden zum Thema\n[Umgang mit Allergien auf COVID-19-Impfstoffe](https://www.ncbi.nlm.nih.gov/pmc/articles/PMC8666189/) erstellt, der das Risiko beschreibt nach einer Corona-Impfung an Allergien, allergischem Schock oder einer Mastzellaktivierung zu leiden.\nEs gibt Untersuchungen, wonach Betroffene in 15 bis 20 Prozent der F\u00e4lle nach oder durch eine Corona-Impfung eine Form der \u00fcberm\u00e4\u00dfigen Mastzellenaktivierung entwickeln \u2013 \u00e4hnlich einem\n[Mastzellaktivierungssyndrom (MCAS](https://www.kloesterl-infoportal.de/Spezialtherapien/Aktuelles_Thema/MCAS/MCAS_Therapeuteninfo_12-2021.pdf)), das mit verschiedenen allergie\u00e4hnlichen Beschwerden einhergeht.\n\u00dcberaktive Mastzellen setzen vermehrt verschiedene Botenstoffe frei, darunter auch Histamin. F\u00e4llt im K\u00f6rper zu viel Histamin an, sind die unterschiedlichsten Symptome m\u00f6glich \u2013 bis hin zu Hautreaktionen, Verdauungsst\u00f6rungen, Atembeschwerden und/oder einer ausgepr\u00e4gten M\u00fcdigkeit.\nAusl\u00f6ser k\u00f6nnte eine Sensitivit\u00e4t auf Polyethylenglycol, kurz PEG, sein. Denn das Polymer ist in den RNA-Impfstoffen gegen das SARS-CoV-2-Virus als Hilfsstoff enthalten, indem es physikalisch an Lipid-Nanopartikel gebunden ist.\nPEG (auch Macrogol genannt) ist auch Bestandteil zahlreicher Produkte des t\u00e4glichen Lebens wie Kosmetika, Textilien, Reinigungsmitteln oder auch Arzneimitteln.\nEine Sensitivit\u00e4t auf PEG f\u00fchrt dann zu einer Vielzahl von Symptomen, die durch Gegenst\u00e4nde des t\u00e4glichen Gebrauchs ausgel\u00f6st werden k\u00f6nnen.\nWie kann man Long Covid vorbeugen?\nDie beste M\u00f6glichkeit, Long Covid vorzubeugen, ist, nicht an einer SARS-CoV-2-Infektion zu erkranken. Da die derzeit vorherrschende Omikron-Variante und ihre Untergruppen deutlich ansteckender sind als fr\u00fchere Varianten, macht es Sinn, die bekannten Schutzma\u00dfnahmen zumindest in Innenr\u00e4umen mit gro\u00dfen Menschenmengen umzusetzen. Ob das auf Dauer eine dem individuellen und gemeinschaftlichen Leben dienliche Ma\u00dfnahme ist, kann jeder Mensch f\u00fcr sich selbst beantworten.\nVor allem mit einem gesunden Lebensstil (frische Luft, guter Schlaf, naturbelassene Nahrung, soziale Kontakte\u2026) l\u00e4sst sich sowohl das Risiko f\u00fcr eine Infektion mit SARS-CoV-2 als auch f\u00fcr einen schweren Krankheitsverlauf von COVID-19 und Long Covid reduzieren.\nBehandlung von Long Covid\nEine urs\u00e4chliche Therapie von Long Covid gibt es bislang nicht. Im Vordergrund steht deshalb eine Behandlung der Symptome, bei der meist verschiedene Therapiebausteine zum Einsatz kommen. Idealerweise ist ein solches Therapiekonzept ganzheitlich ausgerichtet.\nDieser komplement\u00e4rmedizinische Behandlungsansatz hat sich bisher in meiner Praxis bew\u00e4hrt:\n- Hom\u00f6opathische Konstitutionsbehandlung\n- Orthemolekulare Medizin\nmit Verwendung von Vitaminen, Mineralstoffen, Spurenelementen und Fetts\u00e4uren zur Vermeidung und Behandlung von Krankheiten\n- Psychotherapie\nwenn n\u00f6tig, um psychosomatische Ursachen und/oder Folgen von Long Covid zu behandeln\nWas hilft bei Long Covid?\nAn dieser Stelle m\u00f6chte ich insbesondere von Long Covid betroffenen Menschen helfen, die nicht in meine Praxis kommen k\u00f6nnen und dennoch von einem bew\u00e4hrten orthemolekularen Therapieansatz profitieren m\u00f6chten.\nSie k\u00f6nnen die Pr\u00e4parate, die allesamt erfolgreich in der Praxis erprobt und garantiert rein und frei von Farb-, Konservierungs- und technischen Hilfsstoffen sind \u00fcber den jeweiligen Link bestellen und \u00fcber einen Zeitraum von 3-4 Monate kurm\u00e4\u00dfig einnehmen.\nBasisbehandlung bei Long Covid\n[PostCovid-Bundle](https://www.biogena.com/de-AT/produkte/pc-bundle.html?xtxsearchselecthit=1%EF%BB%BF?afid=V22880)\nEinnahmeempfehlung \u00fcber 3 Monate: jeweils 1 Kapsel t\u00e4glich. Drei ausgew\u00e4hlte Mikron\u00e4hrstoff-Pr\u00e4parate, die beste Studienergebnisse bei Long Covid zeigen. Ashwagandha ist ein pflanzliches Adaptogen, das zu geistigem und k\u00f6rperlichem Wohlbefinden beitr\u00e4gt und Ersch\u00f6pfungszust\u00e4nde um 60 % reduziert. Ubiquinol ist die aktive Form von Coenzym Q10, welches an der Energieproduktion und am Zellschutz beteiligt ist. NADH ist ein wichtiger Cofaktor f\u00fcr verschiedene Prozesse im zellul\u00e4ren Energiestoffwechsel. Gemeinsam reduzieren sie das subjektive Ersch\u00f6pfungsempfinden, verbessern signifikant die Lebensqualit\u00e4t sowie die Schlafdauer und Schlafqualit\u00e4t.\nUnspezifische Immunstimulanz bei Long Covid\n[Astragalus 300/12, 60 Kapseln](https://www.biogena.com/de-AT/produkte/astragalus-5005-60-kapseln.html?xtxsearchselecthit=1?afid=V22880) (2 Packungen f\u00fcr eine 4-Monats-Kur)\nT\u00e4glich 1 Kapsel\n+\n[ImmunoMyk, 90 Kapseln](https://www.biogena.com/de-DE/produkte/immunomyk.html?xtxsearchselecthit=1?afid=V22880) (3 Packungen f\u00fcr 3-Monats-Kur)\nT\u00e4glich 3 x 1 Kapsel mit viel Fl\u00fcssigkeit zu den Mahlzeiten einnehmen. Die Vitalpilze Reishi und Shiitake besitzen aktivierende Effekte auf Lymphozyten, Leukozyten und nat\u00fcrliche Killerzellen.\nAntientz\u00fcndliche Behandlung bei Long Covid\n[Curcuma 500, 60 Kapseln](https://www.biogena.com/de/at/produkte/produkt.curcuma-500.html?afid=V22880) (6 Packungen f\u00fcr eine 3-Monats-Kur)\nT\u00e4glich 2 mal 2 Kapseln mit viel Fl\u00fcssigkeit zu einer Mahlzeit einnehmen. Biogena Curcuma 500 ist ein Kombinationspr\u00e4parat mit 500 mg des standardisierten und klinisch gepr\u00fcften Spezialextrakts Curcumin C3 Complex\u00ae und mit Schwarzer-Pfeffer-Extrakt, das die antientz\u00fcndliche Wirkung von Curcuma steigert. Zur Unterst\u00fctzung der Immunfunktion und zum Erhalt der normalen Immunabwehr.\n+\n[Astaxanthin 4mg, 60 Kapseln](https://www.biogena.com/de-DE/produkte/astaxanthin-4mg-60-kapseln.html?xtxsearchselecthit=1?afid=V22880) (2 Packungen f\u00fcr eine 4-Monats-Kur)\nT\u00e4glich 1 Kapsel zur Mahlzeit einnehmen. Nat\u00fcrliches Astaxanthin gilt als eines der st\u00e4rksten Antioxidantien und geh\u00f6rt chemisch zur Gruppe der Carotinoide. So wirkt Astaxanthin z.B. 6000-mal st\u00e4rker als Vitamin C, 770-mal st\u00e4rker als Coenzym Q10, 100-mal st\u00e4rker als Vitamin E, 55-mal st\u00e4rker als synthetisches Astaxanthin, 5-mal st\u00e4rker als Beta-Carotin, 3-mal st\u00e4rker als Lutein, 2-mal st\u00e4rker als Lycopin.\n+\n[Schwarzk\u00fcmmel\u00f6l 1000, 90 Kapseln](https://www.biogena.com/de-AT/produkte/schwarzkuemmeloel-1000-kapseln.html?xtxsearchselecthit=1?afid=V22880) (3 Packungen f\u00fcr 3 Monate)\nT\u00e4glich 3 Kapseln mit viel Fl\u00fcssigkeit zu einer Mahlzeit einnehmen. Nigella sativa, Echter Schwarzk\u00fcmmel, ist als Gold der Pharaonen bekannt und wird seit \u00fcber 2000 Jahre als Heilmittel angewendet. Das aus den Samen gewonnene \u00d6l eignet sich vor allem gegen Erkrankungen, die durch St\u00f6rungen im Immunsystem, Entz\u00fcndungsreaktionen oder durch erh\u00f6hten oxidativen Stress verursacht werden. Therapiebegleitend bei Autoimmunerkrankungen, Metabolischem Syndrom, Diabetes, Asthma, Heuschnupfen, Staub- und Kontaktallergien.\nUnterst\u00fctzung der Nebennierenrinde bei Long Covid\n[Glanduplex, 90 Kapseln](https://www.biogena.com/de/at/produkte/produkt.glanduplex-energetisiert.html?afid=V22880) (ausreichend f\u00fcr 3-Monats-Kur)\nT\u00e4glich 1 Kapsel einnehmen. Eine Kombination von ausgew\u00e4hlten Mikron\u00e4hrstoffen zur Unterst\u00fctzung des Hormonstoffwechsels von Steroidhormonen und Neurotransmittern der Nebenniere und zur erh\u00f6hten Aufnahme von wichtigen Vitaminen und Mineralstoffen\n+\n[Rhodiola Rosea, 90 Kapseln](https://www.biogena.com/de/at/produkte/produkt.rhodiola-rosea.html?afid=V22880) (2 Packungen f\u00fcr 3 Monats-Kur)\nT\u00e4glich 2 Kapseln, die Sie mit viel Fl\u00fcssigkeit au\u00dferhalb der Mahlzeiten einnehmen. Enth\u00e4lt standardisierten Rosenwurz-Extrakt zur Unterst\u00fctzung der k\u00f6rperlichen und kognitiven Leistungsf\u00e4higkeit in Zeiten vermehrter emotionaler, geistiger oder k\u00f6rperlicher Belastung. Wirkt zus\u00e4tzlich entz\u00fcndungshemmend.\nLong Covid und Schlaflosigkeit\n[5-Hydroxy-Tryptophan 100](https://www.biogena.com/de/at/produkte/produkt.5-hydroxy-tryptophan-100-60-kapseln.html?xtxsearchselecthit=1?afid=V22880) , 60 Kapseln (2 Packungen f\u00fcr 4 Monate)\nT\u00e4glich 1 Kapsel mit viel Fl\u00fcssigkeit einnehmen. Bei 5-HTP handelt es sich um eine Aminos\u00e4ure, die eine direkte Vorstufe des Botenstoffs Serotonin ist. Serotonin tr\u00e4gt auch den Beinamen \u201eGl\u00fcckshormon\u201c, da dieser Botenstoff ma\u00dfgeblich an der Regulierung des Wohlbefindens beteiligt ist.\noder\n[Amino-Abendtrunk, 30 Sticks](https://www.biogena.com/de/at/produkte/produkt.amino-abendtrunk-30-sticks.html?xtxsearchselecthit=1?afid=V22880) (3 Packungen f\u00fcr eine 3-Monats-Kur)\nDen Inhalt eines Sticks (5g) in reichlich warmen Wasser oder warmer Milch (125-250 ml) unter R\u00fchren aufl\u00f6sen und 30-60 Minuten vor dem Schlafengehen trinken. Eine nat\u00fcrliche Hilfe, um besser in den Schlaf zu kommen und tiefer und l\u00e4nger durchzuschlafen. Ashwagandhawurzel-Extrakt unterst\u00fctzt eine normale Einschlafphase, Hopfen tr\u00e4gt zu einem normalen Schlaf bei, Magnesium und Vitamin B6 unterst\u00fctzen die normale Funktion des Nervensystems und der Psyche. Die Aminos\u00e4ure Glycin verbessert nachweislich die Schlafqualit\u00e4t und zeigt einen positiven Effekt auf Schl\u00e4frigkeit, Erm\u00fcdung und Leistungsf\u00e4higkeit tags\u00fcber. Zus\u00e4tzlich wirkt L-Tryptophan durch eine Erh\u00f6hung des Serotoningehalts positiv auf den Melatoninspiegel im K\u00f6rper und hat damit eine schlaff\u00f6rdernde Wirkung und verbessert zudem tags\u00fcber die Stimmungslage, die Stresstoleranz und die Schmerzwahrnehmung.\nWas Betroffene mit Long Covid tun k\u00f6nnen\nHilfreiche Therapiema\u00dfnahmen, je nach vorherrschenden Symptomen:\n- Atemmuskeltraining, Atemphysiotherapie, Reflektorische Atemtherapie\n- leichte Physiotherapie\n- Ergotherapie\n- leichtes k\u00f6rperliches Training, aber nur dann, wenn es gut vertragen wird\n- Schwindeltraining\n- Sensibilit\u00e4tstraining der Nerven bei Beeintr\u00e4chtigung der Sensibilit\u00e4t\n- Ma\u00dfnahmen zur psychischen Stabilisierung, z.B. Psychotherapie/Kognitive Verhaltenstherapie\n- Entspannungstechniken wie z.B. Yoga, Meditation und Autogenes Training\n- Ern\u00e4hrungstherapie mit Umstellung auf eine gesunde, pflanzenbasierte Vollwertkost\n- F\u00fcr Betroffene selbst gilt es, den Lebensstil so anzupassen, dass das individuelle Belastungsniveau m\u00f6glichst nicht \u00fcberschritten wird.\n- Ein Riechtraining mithilfe von bestimmten D\u00fcften kann bei Riechst\u00f6rungen helfen\nWie Sie wieder riechen lernen bei Long Covid\nRiechen (eher schnuppern als tief einatmen) Sie jeden Tag 2-3 mal t\u00e4glich je 30 Sekunden abwechselnd an: Kaffee, Nelke, Pfefferminz, Zimt. Stellen Sie sich w\u00e4hrend des Schnupperns vor, was Sie da riechen. Nach 1-3 Wochen stellt sich in der Regel ein normales Riechverm\u00f6gen wieder ein.\nIst Long Covid heilbar?\nMithilfe einer individuell abgestimmten ganzheitlichen Therapie ist es m\u00f6glich, Long Covid zu \u00fcberwinden und wieder vollst\u00e4ndig zu genesen. Wichtig ist, dass nicht nur das Beschwerdebild und der bisherige Krankheitsverlauf bei der Festlegung der geeigneten Therapiestrategie ber\u00fccksichtigt wird, sondern auch die Pers\u00f6nlichkeit und Lebensumst\u00e4nde des Betroffenen.\n[Sie k\u00f6nnen gerne online einen Termin vereinbaren](https://www.praxis-breitenberger.de/homoeopathie-muenchen/terminbuchung-homoeopathie/)\nErstellungsdatum:\n05.10.2022\nAutoren:\n[Markus Breitenberger](https://www.praxis-breitenberger.de/zur-person/), Heilpraktiker und Hom\u00f6opath in eigener Praxis seit \u00fcber 20 Jahren. Autor von 2 Gesundheitsratgebern zum Thema Autoimmunerkrankungen (GU-Verlag). [Dr. Nicole Schaenzler](https://www.praxis-breitenberger.de/redaktionsteam-dr-schaenzler/), Philologin und Medizinjournalistin. Herausgeberin eines Gesundheitsmagazins und Fachautorin zahlreicher B\u00fccher zu medizinischen Themen.\nQuellen:\n[S1-Leitlinie zu Post-COVID/Long-COVID](https://www.awmf.org/leitlinien/detail/ll/020-027.html); Deutsche Gesellschaft f\u00fcr Pneumologie und Beatmungsmedizin e.V. (DGP); Registernummer 020-027 Stand: 17.08.2022 (in \u00dcberarbeitung), g\u00fcltig bis 31.08.2023 [Vasileios Nttas, Manqi Gao, Erin A. West u.a.: Long Covidthrough the public health lens: An umbrella review](https://www.research-collection.ethz.ch/handle/20.500.11850/543558) (15. M\u00e4rz 2022) [Petra Zimmermann, Laure F. Pittet, Nigel Curtis: The challenge of studying long COVID: An updated review. In: Pediatric Infectious Disease Journal](https://journals.lww.com/pidj/Fulltext/2022/05000/The_Challenge_of_Studying_Long_COVID__An_Updated.16.aspx). Band 41, Ausg. 5, Mai 2022 (Metanalyse mit Auswertung von 27 Studien) [Paul Kuodi, Yanay Gorelik, Hiba Zayyad u.a.: Association between vaccination status and reported incidence of post-acute COVID-19 symptoms in Israel: a cross-sectional study of patients tested between March 2020 and November 2021 (Preprint)](https://www.medrxiv.org/content/10.1101/2022.01.05.22268800v2) [Jon Klein, Jamie Wood, Jillian Jaycox u.a.:Distinctive features of Long COVID identified by immune profiling (9.8.2022) Preprint](https://www.medrxiv.org/content/10.1101/2022.08.09.22278592v1#:~:text=Individuals%20diagnosed%20with%20Long%20COVID,these%20debilitating%20symptoms%20are%20unclear.) [Bing-Mae Chin, Tian-Lu Cheng, Steve R. Roffler (American Chemical Society): Polyethylene Glycol Immunogenicity: Theoretical, Clinical, and Practical Aspects of Anti-Polyethylene Glycol Antibodies. In: ACS Nano](https://pubmed.ncbi.nlm.nih.gov/34469112/) (1.9.2021) [Leonard B. Weinstock, Jill B. Bach, Arthur S. Walters: Mast cell activation symptoms are common in Long-COVID. In: International Journal of Infectious Diseases](http://www.ijidonline.com/article/S1201-9712(21)00751-7/fulltext) (Band 112, 1. November 2021) [Lixue Huang, Xia Li, Xiaoying Gu, ua.: Health outcomes in people 2 years after surviving hospitalization with COVID-19: a longitudinal cohort study. In: The Lancet \u2013 Respiratory Medicine](http://www.thelancet.com/journals/lanres/article/PIIS2213-2600(22)00126-6/fulltext), 11. Mai 2022 [Paul-Ehrlich-Institut (PEI). Coronavirus und Covid-19: Sicherheit von COVID-19-Impfstoffen](https://www.pei.de/DE/newsroom/dossier/coronavirus/coronavirus-inhalt.html;jsessionid=A35C8EF53EB0CFF9CFE2BDC15C7BF764.intranet221?nn=169730&cms_pos=6)", "language": null, "image": "https://www.praxis-breitenberger.de/wp-content/uploads/2022/10/LongCovid_Symptome-1024x573.jpg", "pagetype": "article", "links": ["https://www.praxis-breitenberger.de/", "https://www.praxis-breitenberger.de/", "#", "https://www.praxis-breitenberger.de/homoeopathie-muenchen/", "https://www.praxis-breitenberger.de/psychotherapie-muenchen/", "https://www.praxis-breitenberger.de/paarberatung-muenchen/", "https://www.praxis-breitenberger.de/ratgeber-uebersicht/", "https://www.praxis-breitenberger.de/zur-person/", "https://www.praxis-breitenberger.de/terminvereinbarung/", "https://www.praxis-breitenberger.de/zur-person/", "https://www.praxis-breitenberger.de/redaktionsteam-dr-schaenzler/", "https://www.praxis-breitenberger.de/qualitaetsrichtlinien/", "https://www.facebook.com/sharer.php?u=https://www.praxis-breitenberger.de/ratgeber/infektion/long-covid-haeufigkeit-symptome-impfung/", "https://www.linkedin.com/shareArticle?mini=true&url=https://www.praxis-breitenberger.de/ratgeber/infektion/long-covid-haeufigkeit-symptome-impfung/", "https://twitter.com/intent/tweet?url=https://www.praxis-breitenberger.de/ratgeber/infektion/long-covid-haeufigkeit-symptome-impfung/&text=Long+Covid%3A+H%C3%A4ufigkeit%2C+Symptome%2C+Impfung", "https://www.xing.com/social_plugins/share/new?url=https://www.praxis-breitenberger.de/ratgeber/infektion/long-covid-haeufigkeit-symptome-impfung/", "https://wa.me/?text=https://www.praxis-breitenberger.de/ratgeber/infektion/long-covid-haeufigkeit-symptome-impfung/", "mailto:?subject=Long Covid: H\u00e4ufigkeit, Symptome, Impfung&body=https://www.praxis-breitenberger.de/ratgeber/infektion/long-covid-haeufigkeit-symptome-impfung/", "#Was_ist_Long_Covid", "#Ursachen", "#Neueste_Untersuchungen_zu_Long_Covid", "#Long_Covid_erkennennbsp", "#Diagnostik", "#Symptome", "#Long_Covid_bei_Kindern", "#Long_Covid_nach_Impfung", "#Behandlung_von_Long_Covid", "https://www.praxis-breitenberger.de/ratgeber/autoimmunerkrankung/chronisches-erschoepfungssyndrom/", "https://www.awmf.org/leitlinien/detail/ll/020-027.html", "https://www.praxis-breitenberger.de/ratgeber/infektion/corona/", "https://www.praxis-breitenberger.de/ratgeber/autoimmunerkrankung/erkrankung-homoeopathie/", "https://www.praxis-breitenberger.de/ratgeber/autoimmunerkrankung/", "https://www.praxis-breitenberger.de/ratgeber/krebs/krebserkrankung/", "https://www.praxis-breitenberger.de/ratgeber/stress/nebennierenschwaeche/", "https://www.praxis-breitenberger.de/ratgeber/autoimmunerkrankung/chronisches-erschoepfungssyndrom/", "https://www.medivere.de/shop/Alle/Stress-Erschoepfung-Test.html?af=100287", "https://www.kloesterl-infoportal.de/Spezialtherapien/Aktuelles_Thema/MCAS/Mastzellaktivierungssyndrom_Komplexes_Krankheitsbild.php", "https://www.praxis-breitenberger.de/ratgeber/allergien/histaminintoleranz/", "https://www.ncbi.nlm.nih.gov/pmc/articles/PMC7595761/", "https://www.biogena.com/de/at/produkte/produkt.thrombopenol-150-50-gold.html?afid=V22880", "https://www.praxis-breitenberger.de/ratgeber/allergien/allergisches-asthma/", "https://www.praxis-breitenberger.de/ratgeber/autoimmunerkrankung/multiple-sklerose-ms-symptome-verlauf-therapie/", "https://www.praxis-breitenberger.de/ratgeber/maennergesundheit/uebergewicht/", "https://www.medivere.de/shop/Alle/Stress-Erschoepfung-plus-Test.html?af=100287", "https://www.praxis-breitenberger.de/ratgeber/schilddruese/hashimoto-thyreoiditis/", "https://www.medivere.de/shop/Frau/Darmgesundheit/Saeure-Basen-Test-nach-Sander.html?af=100287", "https://www.praxis-breitenberger.de/ratgeber/stress/nebennierenschwaeche/", "https://www.medivere.de/shop/Alle/Stress-Erschoepfung-Test.html?af=100287", "https://www.ganzimmun.de/labor/wichtige-laborinformationen/long-covid-/-post-covid-syndrom", "https://www.praxis-breitenberger.de/ratgeber/homoeopathie/homoeopathie-bei-kopfschmerzen/", "https://www.praxis-breitenberger.de/ratgeber/psyche/normale-depression/", "https://www.praxis-breitenberger.de/ratgeber/homoeopathie/homoeopathie-bei-durchfall/", "https://www.praxis-breitenberger.de/ratgeber/stress/tinnitus/", "https://www.praxis-breitenberger.de/ratgeber/autoimmunerkrankung/chronisches-erschoepfungssyndrom/", "https://www.praxis-breitenberger.de/ratgeber/infektion/long-covid-haeufigkeit-symptome-impfung/#Behandlung", null, null, "https://www.ncbi.nlm.nih.gov/pmc/articles/PMC8666189/", "https://www.kloesterl-infoportal.de/Spezialtherapien/Aktuelles_Thema/MCAS/MCAS_Therapeuteninfo_12-2021.pdf", "https://www.biogena.com/de-AT/produkte/pc-bundle.html?xtxsearchselecthit=1%EF%BB%BF?afid=V22880", "https://www.biogena.com/de-AT/produkte/astragalus-5005-60-kapseln.html?xtxsearchselecthit=1?afid=V22880", "https://www.biogena.com/de-DE/produkte/immunomyk.html?xtxsearchselecthit=1?afid=V22880", "https://www.biogena.com/de/at/produkte/produkt.curcuma-500.html?afid=V22880", "https://www.biogena.com/de-DE/produkte/astaxanthin-4mg-60-kapseln.html?xtxsearchselecthit=1?afid=V22880", "https://www.biogena.com/de-AT/produkte/schwarzkuemmeloel-1000-kapseln.html?xtxsearchselecthit=1?afid=V22880", "https://www.biogena.com/de/at/produkte/produkt.glanduplex-energetisiert.html?afid=V22880", "https://www.biogena.com/de/at/produkte/produkt.rhodiola-rosea.html?afid=V22880", "https://www.biogena.com/de/at/produkte/produkt.5-hydroxy-tryptophan-100-60-kapseln.html?xtxsearchselecthit=1?afid=V22880", "https://www.biogena.com/de/at/produkte/produkt.amino-abendtrunk-30-sticks.html?xtxsearchselecthit=1?afid=V22880", "https://www.praxis-breitenberger.de/homoeopathie-muenchen/terminbuchung-homoeopathie/", "https://www.praxis-breitenberger.de/zur-person/", "https://www.praxis-breitenberger.de/redaktionsteam-dr-schaenzler/", "https://www.awmf.org/leitlinien/detail/ll/020-027.html", "https://www.research-collection.ethz.ch/handle/20.500.11850/543558", "https://journals.lww.com/pidj/Fulltext/2022/05000/The_Challenge_of_Studying_Long_COVID__An_Updated.16.aspx", "https://www.medrxiv.org/content/10.1101/2022.01.05.22268800v2", "https://www.medrxiv.org/content/10.1101/2022.08.09.22278592v1#:~:text=Individuals%20diagnosed%20with%20Long%20COVID,these%20debilitating%20symptoms%20are%20unclear.", "https://pubmed.ncbi.nlm.nih.gov/34469112/", "http://www.ijidonline.com/article/S1201-9712(21)00751-7/fulltext", "http://www.thelancet.com/journals/lanres/article/PIIS2213-2600(22)00126-6/fulltext", "https://www.pei.de/DE/newsroom/dossier/coronavirus/coronavirus-inhalt.html;jsessionid=A35C8EF53EB0CFF9CFE2BDC15C7BF764.intranet221?nn=169730&cms_pos=6", "https://www.facebook.com/sharer.php?u=https://www.praxis-breitenberger.de/ratgeber/infektion/long-covid-haeufigkeit-symptome-impfung/", "https://www.linkedin.com/shareArticle?mini=true&url=https://www.praxis-breitenberger.de/ratgeber/infektion/long-covid-haeufigkeit-symptome-impfung/", "https://twitter.com/intent/tweet?url=https://www.praxis-breitenberger.de/ratgeber/infektion/long-covid-haeufigkeit-symptome-impfung/&text=Long+Covid%3A+H%C3%A4ufigkeit%2C+Symptome%2C+Impfung", "https://www.xing.com/social_plugins/share/new?url=https://www.praxis-breitenberger.de/ratgeber/infektion/long-covid-haeufigkeit-symptome-impfung/", "https://wa.me/?text=https://www.praxis-breitenberger.de/ratgeber/infektion/long-covid-haeufigkeit-symptome-impfung/", "mailto:?subject=Long Covid: H\u00e4ufigkeit, Symptome, Impfung&body=https://www.praxis-breitenberger.de/ratgeber/infektion/long-covid-haeufigkeit-symptome-impfung/", "https://www.praxis-breitenberger.de/ratgeber/autoimmunerkrankung/", "https://www.praxis-breitenberger.de/ratgeber/infektion/", "https://www.praxis-breitenberger.de/qualitaetsrichtlinien/", "https://www.praxis-breitenberger.de", "https://www.praxis-breitenberger.de/ratgeber/", "https://www.praxis-breitenberger.de/ratgeber/autoimmunerkrankung/", "tel:00498920244844", "mailto:info@praxis-breitenberger.de", "https://www.praxis-breitenberger.de/behandlungskosten/", "https://www.praxis-breitenberger.de/faq/", "https://www.praxis-breitenberger.de/ratgeber/", "https://www.praxis-breitenberger.de/datenschutz/", "https://www.praxis-breitenberger.de/impressum/", "https://www.praxis-breitenberger.de/homoeopathie/", "https://www.praxis-breitenberger.de/psychotherapie/", "https://www.praxis-breitenberger.de/paarberatung/", "#", "https://www.praxis-breitenberger.de/", "#", "https://www.praxis-breitenberger.de/homoeopathie-muenchen/", "https://www.praxis-breitenberger.de/psychotherapie-muenchen/", "https://www.praxis-breitenberger.de/paarberatung-muenchen/", "https://www.praxis-breitenberger.de/ratgeber-uebersicht/", "https://www.praxis-breitenberger.de/zur-person/", "https://www.praxis-breitenberger.de/terminvereinbarung/"]}