{"title": "Waldbrand-Facts: Unsinnige Argumentationsmuster erkennen und widerlegen!", "author": "Gastbeitrag", "url": "https://www.volksverpetzer.de/analyse/waldbrand-fakes-erkennen-widerlegen/", "hostname": "volksverpetzer.de", "description": "Der Zusammenhang von Klimawandel und Waldbr\u00e4nden wird oft emotional und faktenfern diskutiert. Wir lassen einen Experten zu Wort kommen.", "sitename": "Volksverpetzer", "date": "2023-09-30", "id": null, "license": null, "body": null, "comments": "", "commentsbody": null, "raw_text": null, "text": "Gastbeitrag von Ramesh Gl\u00fcckler\nMit Wald- und Vegetationsbr\u00e4nden ist dieses Jahr ein \u2013 im wahrsten Sinn des Wortes \u2013 besonders hei\u00dfes, aber auch komplexes Thema Inhalt vieler Nachrichtenmeldungen aus aller Welt. Von\n[au\u00dferordentlichen Br\u00e4nde in Kanada](https://www.tagesschau.de/wissen/klima/waldbraende-kanada-klimawandel-100.html), die nicht nur bisherige Rekorde brechen, sondern auch [medienwirksam New York City in orange-braunen Rauch tauchen](https://www.dw.com/de/rauch-von-waldbr%C3%A4nden-in-kanada-h%C3%BCllt-usa-ein/video-65875968), \u00fcber den besonders betroffenen Mittelmeerraum, wo geschockte [Urlauber vor den Flammen fl\u00fcchten](https://www.spiegel.de/ausland/rhodos-touristen-werden-vor-braenden-in-sicherheit-gebracht-urlaubsparadies-in-flammen-a-03608c13-b351-45e6-8a90-ebf32bab14e2), bis nach Hawaii, wo der [historische Ort Lahaina nahezu v\u00f6llig niederbrannte](https://www.tagesschau.de/ausland/amerika/biden-hawaii-maui-100.html). An vielen Orten der Welt mussten Menschen ihr Hab und Gut zur\u00fccklassen, mit ungewissem Ausgang. Viele andere Menschen konnten tragischerweise nicht rechtzeitig fliehen. Diese Schicksale verbinden Vegetationsbr\u00e4nde. Es handelt sich um ein wichtiges Thema, das vermehrt im Zentrum der \u00f6ffentlichen Aufmerksamkeit steht. Und zu dem ebenfalls vermehrt irref\u00fchrende Argumentationsmuster die Runde machen.\nFeuer\u00f6kologie: Die wissenschaftliche Sicht auf Waldbr\u00e4nde\nAus Sicht der \u00d6kologie sind Wald- bzw. Vegetationsbr\u00e4nde ein komplexer Prozess zwischen Vegetation, Klima, und Landschaft. Entstehung, Ausbreitung, Intensit\u00e4t, all diese und mehr Eigenschaften werden durch eine Vielzahl von Faktoren bestimmt, die sich je nach betrachteter Zeitskala \u2013 vom einzelnen Brand bis zur langzeitlichen Feueraktivit\u00e4t \u2013 unterscheiden. Dabei ist Feuer mindestens seit rund 420 Millionen Jahren, als sich fr\u00fche Landpflanzen ausbreiteten, ein wichtiger Bestandteil des terrestrischen Lebensraums (\n[Santos et al., 2023](https://besjournals.onlinelibrary.wiley.com/doi/10.1111/1365-2435.14387)). In vielen Regionen der Erde erzeugen Vegetationsbr\u00e4nde ein Mosaik aus Vegetation unterschiedlicher Entwicklungsstadien und f\u00f6rdern somit aktiv die Biodiversit\u00e4t ( [Kelly et al., 2020](https://www.science.org/doi/10.1126/science.abb0355)).\nAber Feuer ist nicht gleich Feuer, Lebensr\u00e4ume sind an bestimmte Feuerregime angepasst. Das bedeutet, dass Frequenz, Ausdehnung und Intensit\u00e4t von Vegetationsbr\u00e4nden \u00fcber l\u00e4ngere Zeitr\u00e4ume bestimmte Eigenschaften aufweisen. Durch Ver\u00e4nderungen dieser Eigenschaften kann diese nat\u00fcrliche Balance auch kippen, mit Auswirkungen auf das \u00d6kosystem (\n[Scheffer et al., 2012](https://www.pnas.org/doi/abs/10.1073/pnas.1219844110)). Und dann kommen ja auch noch wir Menschen ins Spiel. Mal nutzen wir Feuer aktiv zu unserer Gunst, mal versuchen wir es m\u00f6glichst auf Abstand zu halten. Andernorts ver\u00e4ndern wir die Vegetation und mit unseren Siedlungen und unserer Infrastruktur durchschneiden wir Landschaften und setzen dem Brandgeschehen Grenzen.\nIdeologisierte Debatten lenken vom Stand der Wissenschaft zum Thema Waldbrand ab\nDiese vielen Faktoren machen eine gesellschaftliche Debatte von Vegetationsbr\u00e4nden schwierig. Wald- und Vegetationsbr\u00e4nde sind immer auch mit dem Klima verbunden. Darum entstehen manchmal schon auf einer grundlegenden Ebene hitzige Streitgespr\u00e4che \u00fcber den wahren Einfluss des Klimawandels auf eine extreme Feuersaison, wie sie dieses Jahr vielerorts eintrat. Obwohl es sich bei Klimawandel und globaler Erw\u00e4rmung erstmal um wissenschaftliche Themenbereiche handelt (zu denen, bezogen auf den menschlichen Einfluss, wissenschaftlicher Konsens in mehr als 99 % aller publizierter Fachartikel herrscht, siehe\n[Lynas et al., 2021](https://iopscience.iop.org/article/10.1088/1748-9326/ac2966)), zeigen sich Gespr\u00e4che dazu oft als politisch ideologisiert und emotional aufgeladen, es kursieren viele irref\u00fchrende Inhalte und Argumente. Teilweise scheint dies auch nicht ungewollt zu sein. So streuen [libert\u00e4re \u201eThink Tanks\u201c](https://correctiv.org/en/top-stories/2020/02/11/the-heartland-lobby/?lang=de), finanziert aus der fossilen Lobby, seit Jahren Desinformation und Zweifel an evidenzbasierten Aussagen zum Klimawandel. Ein Beispiel hierf\u00fcr werden wir gleich noch sehen.\nWaldbrand-Fakes: Verbreiten sich leider wie ein Lauffeuer\nDieser irref\u00fchrende Diskurs l\u00e4sst sich nun zunehmend auch in Bezug auf Vegetationsbr\u00e4nde beobachten. Grunds\u00e4tzlich gilt: Aufgrund der Komplexit\u00e4t des Themas sollte man bereits skeptisch sein, wenn vermeintlich simple Zusammenh\u00e4nge im Mittelpunkt eines Arguments stehen und daraus sehr generalisierte R\u00fcckschl\u00fcsse gezogen werden. Nicht umsonst widmet sich seit rund 70 Jahren eine eigene wissenschaftliche Disziplin, die Feuer\u00f6kologie, der Analyse von Vegetationsbr\u00e4nden, ihren Ausl\u00f6sern und Auswirkungen.\nLeider sind die realen Zusammenh\u00e4nge oft so komplex, dass sich das auch in der L\u00e4nge und \u201eLesefreundlichkeit\u201c einer Richtigstellung widerspiegelt (wie man vielleicht auch an diesem Beitrag sehen kann). Zudem arbeitet Wissenschaft nie mit allumfassenden Wahrheiten, sondern mit offen kommunizierten Wahrscheinlichkeiten und Unsicherheiten. F\u00e4lschlicherweise kann das den Eindruck erwecken, der wissenschaftliche Standpunkt sei nicht glaubhafter als ein gegens\u00e4tzlicher, faktenwidriger. Daher verbreiten sich\n[Richtigstellungen h\u00e4ufig nicht so leicht](https://klickwinkel.de/tutorials/wie-sich-fake-news-verbreiten/) wie irref\u00fchrende Fakes. Umso wichtiger ist es also, wissenschaftlich belegte Inhalte zu teilen und ihnen Reichweite zu verschaffen.\nHier nun drei Beispiele unsinniger Argumentationsmuster zu Vegetationsbr\u00e4nden, die sich besonders oft zu wiederholen scheinen \u2013 und wie man sie mit Fakten widerlegt!\n1. Fakt: Nat\u00fcrlich hat Temperatur (bzw. globale Erw\u00e4rmung) einen Einfluss auf Waldbr\u00e4nde!\nTL;DR: In wissenschaftlichen Publikationen wurden bereits seit Jahren vielf\u00e4ltige Zusammenh\u00e4nge zwischen Temperatur und Vegetationsbr\u00e4nden aufgezeigt. Diese Zusammenh\u00e4nge unterscheiden sich je nach Lokalit\u00e4t und betrachteter Zeitspanne (vom einzelnen Brand bis hin zu langfristigen Trends) und zeigen sich auf vielf\u00e4ltige Weise. Bei Aussagen wie \u201eSelbst bei h\u00f6heren Temperaturen entz\u00fcndet sich der Wald nicht selbst, globale Erw\u00e4rmung h\u00e4ngt also nicht mit Vegetationsbr\u00e4nden zusammen\u201c handelt es sich um hinf\u00e4llige Strohmann-Argumente, denn eine derartige \u201espontane Selbstentz\u00fcndung\u201c steht gar nicht im Raum. Daraus ein Argument gegen den Einfluss des Klimawandels auf Vegetationsbr\u00e4nde zu machen, ist dar\u00fcber hinaus ein logischer Fehlschluss.\nDa geht das Strohmann-Argument in Rauch auf\nDas Abstreiten eines Zusammenhangs von Temperatur und Vegetationsbr\u00e4nden hat einen prominenten und reichweitenstarken Verfechter. Inhalte dieser Art wurden vom Fernsehmoderator und Autor J\u00f6rg Kachelmann in sozialen Medien geteilt und scheinen auch Anklang zu finden. Nicht selten liest man \u00e4hnliche Versionen, weitergetragen durch andere Menschen, in den Kommentaren zu Waldbrand-Berichten. Oft lesen sich Teile davon in etwa so: \u201eBei ausreichender Trockenheit kann es auch im Winter brennen\u201c, \u201eSelbst bei 50\u00b0C wird sich ein Wald nicht spontan selbst entz\u00fcnden\u201c, oder \u201eEin nasses St\u00fcck Holz brennt bei 40\u00b0C auch nicht besser als bei 30\u00b0C\u201c. Damit soll ausgesagt werden, der Klimawandel (in diesem Fall: h\u00f6here Temperaturen durch die globale Erw\u00e4rmung) spiele bei Waldbr\u00e4nden keine Rolle. Alle drei genannten Statements erscheinen f\u00fcr sich genommen korrekt, und dennoch sind sie in diesem Kontext mindestens irref\u00fchrend.\nIm Volksverpetzer wurde dieses Thema, auch in Bezug auf Beitr\u00e4ge von J\u00f6rg Kachelmann,\n[bereits vor einiger Zeit aufgegriffen](https://www.volksverpetzer.de/analyse/waldbraenden-klima/). Das Ergebnis, schon damals: H\u00f6here Temperaturen beeinflusse Waldbr\u00e4nde durchaus indirekt. Bei steigender Lufttemperatur und gleichbleibendem Wassergehalt sinkt die relative Luftfeuchte, eine Austrocknung der Vegetation wird erleichtert. Trockenere Vegetation ben\u00f6tigt weniger Energie in Form von Hitze, um in eine Verbrennungsreaktion \u00fcberzugehen. Ein Vegetationsbrand kann so leichter entstehen, sich schneller ausbreiten, und gleichzeitig steigt (je nach Brennmaterial) auch die Feuerintensit\u00e4t und damit die Flammenh\u00f6he. In einem Wald bestimmt unter anderem die Flammenh\u00f6he ob sich ein Bodenfeuer zu einem schwerwiegenderen Kronenbrand entwickelt. Nie scheint jemand tats\u00e4chlich eine \u201espontane Selbstentz\u00fcndung\u201c bei hohen Temperaturen in den Raum zu stellen oder zu leugnen, dass ein Vegetationsbrand nat\u00fcrlich auch bei niedrigen Temperaturen auftreten kann \u2013 dabei handelt es sich also sehr wahrscheinlich in den meisten F\u00e4llen um hinf\u00e4llige [Strohmann-Argumente](https://link.springer.com/chapter/10.1007/978-3-658-25835-1_42).\nTemperatur hat vielf\u00e4ltige Auswirkungen auf Vegetationsbr\u00e4nde\nWaldexperte Bernhard Henning schreibt in \u201e\n[Waldbrand: Pr\u00e4vention, Bek\u00e4mpfung, Wiederbewaldung](https://shop.feuerwehrmagazin.de/products/waldbrand-praevention-bekaempfung-wiederbewaldung)\u201c: \u201eZuk\u00fcnftig werden Feuergeschehen hingegen ma\u00dfgeblich durch den Temperaturanstieg bestimmt werden. [\u2026] Ansteigende Temperaturen k\u00f6nnen die Waldbrandgefahr durch verschiedene Faktoren erh\u00f6hen. Eine Ver\u00e4nderung der klimatischen Verh\u00e4ltnisse kann zu einem Wandel in der Vegetationszusammensetzung f\u00fchren. Zudem haben h\u00f6here Temperaturen einen Einfluss auf die Verf\u00fcgbarkeit von Brennmaterial sowie dessen Entz\u00fcndlichkeit.\u201c. Henning erw\u00e4hnt dabei einen weiteren, wichtigen Punkt, n\u00e4mlich die indirekte Auswirkung eines Temperaturanstiegs in Form einer \u00c4nderung der Vegetationszusammensetzung. Auch das beeinflusst Vegetationsbr\u00e4nde und ist Forschungsgegenstand der Feuer\u00f6kologie ( [Yang et al., 2023](https://besjournals.onlinelibrary.wiley.com/doi/10.1111/1365-2664.14486)). Dazu z\u00e4hlt, je nach Lokalit\u00e4t, auch eine Verl\u00e4ngerung der Feuersaison durch fr\u00fchere Schneeschmelze im Fr\u00fchling und sp\u00e4tere Schneebedeckung in Herbst und Winter, was zu l\u00e4ngeren Trockenperioden und auch einem erh\u00f6hten Maximum der saisonalen Verf\u00fcgbarkeit von Brennmaterial f\u00fchren kann ( [Rocca et al., 2014](https://doi.org/10.1016/j.foreco.2014.04.005); [Gergel et al., 2017](https://link.springer.com/article/10.1007/s10584-017-1899-y); [Scholten et al., 2022](https://www.science.org/doi/abs/10.1126/science.abn4419)). Das \u201eFeuerwetter\u201c ist hierbei ebenfalls ein wichtiger Begriff. Es gibt weltweit Indizes mit denen die witterungsbedingte Vegetationsbrandgefahr aus verschiedenen meteorologischen Gr\u00f6\u00dfen abgesch\u00e4tzt werden kann. Was die meisten gemeinsam haben: Die Lufttemperatur ist ein fester Bestandteil. Beispielhaft zeigt sich das beim gut etablierten \u201e [Canadian Forest Fire Danger Rating System](https://cwfis.cfs.nrcan.gc.ca/background/summary/fwi)\u201c und auch beim daraus abgeleiteten [Waldbrandgefahrenindex](https://www.dwd.de/DE/fachnutzer/landwirtschaft/dokumentationen/allgemein/basis_waldbrandgefahrenindex_doku.html?nn=16102) des Deutschen Wetterdienstes.\nAllerdings gibt es f\u00fcr den Einfluss steigender Temperaturen auf Vegetationsbr\u00e4nde im Zuge der globalen Erw\u00e4rmung noch viele weitere Indizien. In einem neuen\n[Bericht der World Weather Attribution Initiative](https://www.worldweatherattribution.org/climate-change-more-than-doubled-the-likelihood-of-extreme-fire-weather-conditions-in-eastern-canada/), die Auswirkungen des Klimawandels explizit beziffert, hei\u00dft es unter anderem: \u201eDer Klimawandel hat die kumulative Schwere der Feuersaison 2023 in Qu\u00e9bec bis Ende Juli um etwa 50% erh\u00f6ht, und das Auftreten von Br\u00e4nden dieser Schwere ist mindestens siebenmal wahrscheinlicher\u201c, und weiter, \u201eVer\u00e4nderungen des Feuerwetters gehen mit einem Anstieg der Temperatur und einem R\u00fcckgang der Luftfeuchte einher, die beide auf die vom Menschen verursachte Erw\u00e4rmung zur\u00fcckzuf\u00fchren sind [\u2026]\u201c.\nWissenschaft entlarvt die Leugnung eines Zusammenhangs mit der Temperatur als Strohfeuer\nEin \u00e4hnliches Bild zeigt sich beim Blick in wissenschaftliche Fachartikel. Schon vor rund 20 Jahren fand man in Kanada einen Zusammenhang zwischen gr\u00f6\u00dferen j\u00e4hrlichen Brandfl\u00e4chen und h\u00f6heren Temperaturen aufgrund der Emission von Treibhausgasen (\n[Gillett et al., 2004](https://agupubs.onlinelibrary.wiley.com/doi/full/10.1029/2004GL020876)). Schon zuvor gab es dieselbe Erkenntnis in Australien ( [Williams et al., 2001](https://link.springer.com/article/10.1023/A:1010706116176)). In Griechenland k\u00f6nnte es in der zweiten H\u00e4lfte dieses Jahrhunderts, besonders unter Szenarien mit einer starken globalen Erw\u00e4rmung, bis zu 40 zus\u00e4tzliche Tage im Jahr mit hoher Feuergefahr geben, verglichen mit dem sp\u00e4ten 20. Jahrhundert ( [Rovithakis et al., 2022](https://iopscience.iop.org/article/10.1088/1748-9326/ac5f94)).\nAuch in Kalifornien k\u00f6nnen nat\u00fcrliche Faktoren allein die starke Zunahme der Brandfl\u00e4che zwischen 1971 und 2021 nicht erkl\u00e4ren. Es ist ma\u00dfgeblich der menschliche Einfluss hinter der globalen Erw\u00e4rmung, der diesen Trend verursacht (\n[Turco et al., 2023](https://www.pnas.org/doi/10.1073/pnas.2213815120)). In W\u00e4ldern der borealen und gem\u00e4\u00dfigten Zone gibt es eine ausgepr\u00e4gte Sensitivit\u00e4t von Waldbr\u00e4nden zum Klima. Deshalb nehmen Wissenschaftler mit fortschreitender Erw\u00e4rmung eine Intensivierung der Waldbrandaktivit\u00e4t an ( [Seidl et al., 2020](https://onlinelibrary.wiley.com/doi/10.1111/ecog.04995)). In Mexiko ist die Lufttemperatur einer der Faktoren, welche die r\u00e4umliche Verteilung von Waldbr\u00e4nden erkl\u00e4ren ( [Montoya et al., 2023](https://www.publish.csiro.au/WF/WF22154)).\nStudien: Hitze erh\u00f6ht Wahrscheinlichkeit von Buschbr\u00e4nden\nEin Zusammenhang zwischen Brandfl\u00e4che und Feuerwetter, welches auch Temperatur beinhaltet, ist ebenfalls ausschlaggebend f\u00fcr Vegetationsbr\u00e4nde in Australien, die mit dem menschlichen Einfluss auf den Klimawandel in Verbindung gebracht werden k\u00f6nnen (\n[Canadell et al., 2021](https://www.nature.com/articles/s41467-021-27225-4)). Eine andere Studie aus Australien zeigt, dass sich die Wahrscheinlichkeit von Buschbr\u00e4nden vor allem durch extreme Hitze erkl\u00e4ren l\u00e4sst \u2013 welche durch die globale Erw\u00e4rmung doppelt so h\u00e4ufig vorkommt als noch um 1980 ( [van Oldenborgh et al., 2021](https://nhess.copernicus.org/articles/21/941/2021/)). Selbst in humiden tropischen W\u00e4ldern Indonesiens gibt es laut [Fernandes et al. (2017)](https://iopscience.iop.org/article/10.1088/1748-9326/aa6884/meta) einen Zusammenhang zwischen Waldbr\u00e4nden und Lufttemperatur, und das sogar in Jahren, die nicht explizit von Trockenheit gekennzeichnet sind. In einer Auswertung globaler Trends schreiben [Jones et al. (2022)](https://agupubs.onlinelibrary.wiley.com/doi/10.1029/2020RG000726): \u201eInsgesamt \u00fcbt der Klimawandel einen immer st\u00e4rkeren Druck auf die zunehmende H\u00e4ufigkeit und Intensit\u00e4t von Br\u00e4nden weltweit aus, indem er die Frequenz und Intensit\u00e4t des Feuerwetters erh\u00f6ht, und dieser Effekt wird sich mit jeder weiteren Erw\u00e4rmung noch verst\u00e4rken\u201c.\nAuch Feuerwehr best\u00e4tigt: Lufttemperatur hat Einfluss auf Br\u00e4nde\nEs zeichnet sich also ein eindeutiges Bild ab. Nat\u00fcrlich hat die Lufttemperatur, und damit die globale Erw\u00e4rmung, Auswirkungen auf das Vegetationsbrandgeschehen, und das auf vielf\u00e4ltige, meist indirekte Weise und auf verschiedenen Zeitskalen. Diese Schlussfolgerung l\u00e4sst sich hier sogar ziehen bevor man diejenigen befragt, die das aus eigener Erfahrung wissen m\u00fcssen: Feuerwehrm\u00e4nner und -frauen, die in der Bek\u00e4mpfung von Vegetationsbr\u00e4nden im Einsatz sind. Dass ein Anstieg der Lufttemperatur direkte Auswirkungen auf die Beurteilung einer aktiven Einsatzlage haben kann, lernt man beispielsweise bereits in einf\u00fchrenden Kursen des US-amerikanischen\n[Wildland Fire Learning Portal](https://wildlandfirelearningportal.net/). Vielleicht kann man also all denjenigen, die einen Einfluss von Temperatur auf Vegetationsbr\u00e4nde leugnen, einfach mal den Dienst in einer Freiwilligen Feuerwehr ans Herz legen.\n2. Fakt: Brandursache \u201eBrandstiftung\u201c \u00e4ndert nichts am Einfluss des Klimawandels auf Vegetationsbr\u00e4nde!\nTL;DR: Brandgeschehen in diesem Kontext auf die Z\u00fcndquelle zu reduzieren ist eine grobe und unzutreffende Vereinfachung. Denn unabh\u00e4ngig von der Z\u00fcndquelle hat die globale Erw\u00e4rmung einen Einfluss auf Vegetationsbr\u00e4nde. Es stimmt, dass in Deutschland menschliches Handeln die h\u00e4ufigste \u2013 wenn auch nicht alleinige \u2013 Brandursache ist. Doch das bedeutet nicht, dass dies auch in allen anderen L\u00e4ndern zutrifft. So sind viele Entz\u00fcndungen in der borealen Zone nat\u00fcrlichen Ursprungs (Blitzschlag). Klimawandel bedeutet auch, dass die Anzahl der Blitzschl\u00e4ge, sowie deren Entz\u00fcndungspotential, zunehmen kann. Die auf den Menschen zur\u00fcckzuf\u00fchrenden Entz\u00fcndungen haben vielf\u00e4ltige Ursachen, die sich nie komplett verhindern lassen werden. Durch bessere Entz\u00fcndungseigenschaften der Vegetation bei ausgepr\u00e4gtem Feuerwetter k\u00f6nnte die h\u00e4ufigste Art von Brandstiftungen, die durch Fahrl\u00e4ssigkeit, sogar noch beg\u00fcnstigt werden.\nWer Brandstiftung einem Einfluss des Klimawandels entgegensetzt, verbrennt sich wom\u00f6glich die Finger\nHier wird die Feueraktivit\u00e4t ausschlie\u00dflich auf die Z\u00fcndquelle reduziert, um dann im f\u00fcr Deutschland h\u00e4ufigen Fall von (absichtlicher wie unabsichtlicher) Brandstiftung gegen einen Einfluss des Klimawandels zu argumentieren. Es ist richtig, dass in Deutschland menschliches Handeln der h\u00e4ufigste Ausl\u00f6ser f\u00fcr Vegetationsbr\u00e4nde ist. Das\n[Umweltbundesamt](https://www.umweltbundesamt.de/daten/land-forstwirtschaft/waldbraende#ursachen-fur-waldbrande) (UBA) schreibt hierzu:\n\u201eAls Hauptursache f\u00fcr das Waldbrandgeschehen [in Deutschland] kann gem\u00e4\u00df den Daten der Waldbrandstatistik menschliches Handeln identifiziert werden (sofern eine Ursache ermittelbar ist) [Anm. des Autors: Eine Ursache war 2021 f\u00fcr 47,3% aller Waldbr\u00e4nde ermittelbar].\u201cQuelle:\n[Umweltbundesamt]\nZum Vergleich: In\n[Brandenburg](https://forst.brandenburg.de/sixcms/media.php/9/Waldbrandstatistik%202022.pdf) waren Entz\u00fcndungen durch Blitzschl\u00e4ge, der h\u00e4ufigsten nat\u00fcrlichen Brandursache zwischen 2003 und 2022 durchschnittlich f\u00fcr 5,7% aller Br\u00e4nde verantwortlich.\nNicht selten scheint hier im Hintergrund die Annahme zu stehen, es w\u00fcrde keine dieser Nachrichten zu katastrophalen Vegetationsbr\u00e4nden geben, wenn man nur diese Brandstiftungen verhindere. Selbst wenn man die vergleichsweise geringe Anzahl von Br\u00e4nden mit nat\u00fcrlicher Ursache ignoriert, macht man es sich so jedoch zu einfach. Denn die meisten der Brandstiftungen (UBA: 23,4% im Jahr 2021) erfolgen unabsichtlich aus Fahrl\u00e4ssigkeit, trotz vielfach kommunizierter Verhaltensregeln bei Waldbrandgefahr.\nNun k\u00f6nnte man diskutieren, Regeln zu versch\u00e4rfen und weitere Ma\u00dfnahmen gegen Waldbr\u00e4nde einzuf\u00fchren, um zu versuchen, unabsichtliche Brandstiftungen auf ein absolutes Minimum zu reduzieren. Das wird jedoch nur einen geringen Einfluss auf die Br\u00e4nde haben, die mit voller Absicht gestiftet werden (UBA: 16,8% im Jahr 2021). Menschliche Brandursachen sind vielf\u00e4ltig. Sie umfassen neben dem au\u00dfer Kontrolle geratenen Lagerfeuer je nach Lokalit\u00e4t auch landwirtschaftliche Arbeit oder die Munitionsbelastung in B\u00f6den. Letztere kann in seltenen F\u00e4llen nicht nur eine Brandursache sein (hier trifft der Begriff einer \u201espontanen Selbstentz\u00fcndung\u201c tats\u00e4chlich zu) oder aktive Vegetationsbr\u00e4nde weiter ausdehnen, sondern stellt als Erbe des Kriegs auch eine\n[erhebliche Gefahr](https://www.mdr.de/nachrichten/deutschland/gesellschaft/waldbrand-munition-102.html) f\u00fcr die Feuerwehren dar. Es zeigt sich: Hinter dem Begriff der Brandstiftung verbergen sich vielf\u00e4ltige Ursachen, die sich unm\u00f6glich in G\u00e4nze kontrollieren lassen.\nDurch Klimawandel k\u00f6nnten fahrl\u00e4ssige Brandstiftungen h\u00e4ufiger werden\nDas bereits zitierte Umweltbundesamt schreibt au\u00dferdem:\n\u201eKlima und Witterung hingegen beeinflussen zusammen mit den lokalen Gegebenheiten (wie dem Vorhandensein von brennbarem Material) die Disposition einer Waldfl\u00e4che f\u00fcr die Entz\u00fcndung und in Folge das weitere Brandgeschehen (Feuerausbreitung).\u201cQuelle:\n[Umweltbundesamt]\nDies best\u00e4tigt auch ein Blick in die\n[Waldbrandstatistik](https://forst.brandenburg.de/sixcms/media.php/9/Waldbrandstatistik%202022.pdf) des Landes Brandenburg von 2022: \u201eZwar waren Fahrl\u00e4ssigkeit und Brandstiftung erneut h\u00e4ufige Ursache von Waldbr\u00e4nden, aber die Witterung bestimmt deren Ausma\u00df und Intensit\u00e4t mit\u201c. Es wird also deutlich: Ein Einfluss des Klimas auf Vegetationsbr\u00e4nde l\u00e4sst sich nicht bereits mit der Z\u00fcndquelle ausschlie\u00dfen. Wie wahrscheinlich eine Entz\u00fcndung ist, wie schnell sich ein Feuer ausbreiten kann, wie intensiv es ist, das wird auch von anderen Faktoren beeinflusst. Hier sind wir wieder bei den klimatisch gesteuerten Faktoren von Feuerwetter, der Vegetationszusammensetzung und der L\u00e4nge der j\u00e4hrlichen schneefreien Vegetationsperiode.\nKlimawandel beeinflusst nat\u00fcrliche und menschliche Ursachen f\u00fcr Waldbr\u00e4nde\nAu\u00dferhalb Deutschlands gibt es Regionen, in denen sogar die Mehrzahl aller Vegetationsbr\u00e4nde durch nat\u00fcrliche Ursachen wie Blitzschlag ausgel\u00f6st wird. Hierzu z\u00e4hlt vor allem die n\u00f6rdlich gelegene boreale Zone in Alaska, Kanada, Nordeuropa und Sibirien (\n[Veraverbeke et al., 2017](https://www.nature.com/articles/nclimate3329); [Dijkstra et al., 2022](https://www.mdpi.com/2073-445X/11/5/651)). Eine andere nat\u00fcrliche \u201eZ\u00fcndquelle\u201c in dieser Region sind Vegetationsbr\u00e4nde, die sogar bei einsetzendem Schneefall nicht ans Aufh\u00f6ren denken. Sie schwelen selbst bei strengen sibirischen Wintern im Boden weiter, bis sie im Fr\u00fchjahr darauf wieder zu einem Brand in Vollausdehnung werden k\u00f6nnen. Solche \u00fcberwinternden Br\u00e4nde werden manchmal auch als \u201eZombie-Feuer\u201c bezeichnet. Sie trugen im Jahr 2020 rund 7,5 % zur gesamten Waldbrandfl\u00e4che in der ostsibirischen Republik Sacha bei, extremes Feuerwetter beg\u00fcnstigt ihr Auftreten ( [Xu et al., 2022](https://iopscience.iop.org/article/10.1088/1748-9326/ac59aa/meta)).\nDie globale Erw\u00e4rmung kann au\u00dferdem die maximale verf\u00fcgbare potenzielle Energie f\u00fcr Konvektion (CAPE), eine wichtige Gr\u00f6\u00dfe der Meteorologie, erh\u00f6hen (\n[Langenbrunner, 2020](https://www.nature.com/articles/s41558-020-0701-8)). Diese h\u00e4ngt direkt zusammen mit einer gesteigerten H\u00e4ufigkeit von Blitzschl\u00e4gen ( [Romps et al., 2014](https://doi.org/10.1126/science.1259100)). Auch in den hohen Breiten werden Blitzeinschl\u00e4ge h\u00e4ufiger stattfinden ( [Chen et al., 2021](https://www.nature.com/articles/s41558-021-01011-y)), von denen jeder wiederum mit h\u00f6herer Wahrscheinlichkeit zu einer Entz\u00fcndung f\u00fchren kann ( [Hessilt et al., 2022](https://iopscience.iop.org/article/10.1088/1748-9326/ac6311/meta)). Sowohl nat\u00fcrliche als auch menschliche Brandursachen k\u00f6nnen also durch den Klimawandel beeinflusst werden.\n\u00dcbrigens: In einer anderen Sache hat J\u00f6rg Kachelmann definitiv Recht \u2013 durch\n[weggeworfene Glasscherben](https://www.spektrum.de/frage/koennen-glasscherben-waldbraende-verursachen/1668836) entstehen Waldbr\u00e4nde eher nicht. Nat\u00fcrlich soll das jetzt aber niemandem Anlass geben Glasm\u00fcll im Wald zu hinterlassen.\n3. Fakt: Viele Regionen weltweit erleben in den vergangenen Jahrzehnten steigende Feueraktivit\u00e4t!\nTL;DR: In afrikanischen Savannen geht seit 2001 die Brandfl\u00e4che zur\u00fcck. Die Ursache daf\u00fcr sind auf den Menschen zur\u00fcckzuf\u00fchrende landwirtschaftliche Entwicklungen. Dieser Trend l\u00e4sst sich aber nicht einfach auf andere Regionen der Welt \u00fcbertragen, von denen viele intensivierende Waldbrandaktivit\u00e4t erfahren. Klimawandelleugner verwenden Daten, die aus dem Kontext gerissen wurden, um eine Aussage zu st\u00fctzen, die wissenschaftlich nicht haltbar ist.\nProfessioneller Klimawandelleugner gie\u00dft \u00d6l ins Feuer\nEine besonders manipulativ anmutende Argumentation ver\u00f6ffentlichte der Autor Bj\u00f8rn Lomborg im\n[Wall Street Journal](https://www.wsj.com/articles/climate-change-hasnt-set-the-world-on-fire-global-warming-burn-record-low-713ad3a6) und der [New York Post](https://nypost.com/2023/08/01/climate-change-is-not-the-reason-for-the-rise-of-wildfires/). Seitdem wurde sie regelm\u00e4\u00dfig auf Social Media geteilt. Hauptpfeiler des Arguments ist der aus dem Kontext gerissene Trend der globalen j\u00e4hrlichen Brandfl\u00e4che, die seit dem Jahr 2001 abgenommen hat. Dem gegen\u00fcber stellt Lomborg die H\u00e4ufigkeit der Nennung von Vegetationsbr\u00e4nden in Nachrichten. Seine stumpfe Behauptung: \u201eDie Welt brennt immer weniger; Feuer ist immer mehr in den Nachrichten\u201c. Diese irref\u00fchrende, wenn nicht sogar manipulative [Argumentation wurde im Volksverpetzer bereits widerlegt](https://www.volksverpetzer.de/faktencheck/lomborg-widerlegt-waldbraende-nehmen-zu/). Sogar die von Lomborg zitierten Wissenschaftler widersprachen dessen unzul\u00e4ssiger Interpretation dort klar. Daher sei an dieser Stelle der Blick in diese vorhergehende Analyse w\u00e4rmstens empfohlen.\nDas Perfide an solchen Argumentationsmustern ist, dass sie zum Teil auf echten Daten basieren und damit wirklich \u00fcberraschen k\u00f6nnen. So kann der Fake durchaus \u00fcberzeugend wirken. Klimawandelleugner wollen, dass Fragen in eurem Kopf auftauchen wie: Wenn die globale Brandfl\u00e4che abnimmt, was soll dann diese ganze Berichterstattung? Genau diesen Effekt des Misstrauens in Nachrichten \u00fcber m\u00f6gliche Auswirkungen des Klimawandels wollen sie erzielen. Hier ger\u00e4t man schnell in die unendlichen Gefilde der Verschw\u00f6rungsideologien. Vielleicht erkl\u00e4rt das auch, weshalb die Leugnung des menschengemachten Klimawandels insbesondere unter Verschw\u00f6rungsgl\u00e4ubigen weit verbreitet ist (\n[Uscinski et al., 2017](https://doi.org/10.1093/acrefore/9780190228620.013.328)).\nLomborgs Argumentation l\u00e4sst wichtigen Kontext aus\nAber nochmal zum Hauptproblem von Lomborgs Argumentation: Fehlender (oder ausgelassener?) Kontext. Neben einigen anderen Problemen auf die man hinweisen k\u00f6nnte, ist es das schwerwiegendste, denn es entkr\u00e4ftet Lomborgs gesamte Argumentation. Die j\u00e4hrliche Brandfl\u00e4che ist global nicht gleich verteilt. Manche Regionen haben h\u00e4ufigere und/oder gr\u00f6\u00dfere Vegetationsbr\u00e4nde, andere Regionen erfahren nahezu keine. Entsprechend unterschiedlich k\u00f6nnen Trends in verschiedenen Regionen ausfallen. Summiert man jedoch die globale Brandfl\u00e4che auf, dann wird der Trend ma\u00dfgeblich von der Region mit den h\u00f6chsten Brandfl\u00e4chen bestimmt.\nUnd genauso ist es hier: Afrikanische Savannen sind riesig und brennen weitfl\u00e4chig, gleichzeitig nahm hier die Brandfl\u00e4che zuletzt ab. Allerdings stecken wir Menschen dahinter. Schon 2017 wurde in der wissenschaftlichen Fachliteratur der offensichtliche Grund hinter diesem Trend in Teilen Afrikas und anderer Savannen ausgemacht. Dieser steckt unter anderem in der Entwicklung und dem Ausbau der Landwirtschaft. Durch Fragmentierung der Landschaft und Abkehr von der aktiven Nutzung von Feuer werden in den Savannen sowohl Entz\u00fcndungen als auch maximale Ausbreitung von Br\u00e4nden limitiert (\n[Andela et al., 2017](https://www.science.org/doi/10.1126/science.aal4108); [Jones et al., 2022](https://agupubs.onlinelibrary.wiley.com/doi/10.1029/2020RG000726)). Der globale R\u00fcckgang ist also eigentlich vielmehr ein R\u00fcckgang in afrikanischen Savannen, und zwar aufgrund weniger, durch Menschen gelegte Feuer im Zuge einer Weiterentwicklung traditioneller Landwirtschaft.\nRekordverd\u00e4chtige Waldbr\u00e4nde werden vielerorts h\u00e4ufiger\nTats\u00e4chlich verh\u00e4lt sich der Trend der Brandfl\u00e4che au\u00dferhalb der Savannen meist anders. Der bereits genannte boreale Nadelwald, der gr\u00f6\u00dfte terrestrische Lebensraum der Welt, war in den vergangenen Jahren gekennzeichnet durch eine Zunahme der Waldbrandaktivit\u00e4t (\n[K\u00f6ster et al., 2021](https://doi.org/10.1016/j.coesh.2021.100258)). Kanada erlebte dieses Jahr die mit Abstand [extremste Waldbrandsaison seit Aufzeichnungsbeginn](https://www.cbc.ca/radio/ideas/world-on-fire-canada-s-worst-wildfire-season-on-record-1.6946472). \u00c4hnlich trifft das auf Australien in 2019/2020 zu ( [Filkov et al., 2020](https://doi.org/10.1016/j.jnlssr.2020.06.009)). Die Bilder aus dieser [extremen Feuersaison](https://www.volksverpetzer.de/analyse/australien/) sind um die Welt gegangen.\nIm Mittelmeerraum, wo es aufgrund klimatischer und menschlicher Faktoren seit den 1960ern eine starke Zunahme der Brandfl\u00e4che gab (\n[Shakesby, 2011](https://doi.org/10.1016/j.earscirev.2011.01.001)), k\u00f6nnten besonders ausgedehnte Vegetationsbr\u00e4nden k\u00fcnftig keine Seltenheit mehr sein ( [Roy\u00e9 et al., 2019](https://doi.org/10.1002/ldr.3450)).\nF\u00fcr Europa zeigt sich sogar, dass der Klimawandel den Trend der hier ebenfalls tendenziell abnehmenden Brandfl\u00e4che umkehren k\u00f6nnte. Wissenschaftler prognostizieren eine Verdoppelung der Wahrscheinlichkeit sehr gro\u00dfer Br\u00e4nde bis Ende des Jahrhunderts bei einem mittleren Emissionsszenario (\n[Gr\u00fcnig et al., 2022](https://onlinelibrary.wiley.com/doi/10.1111/gcb.16547)). Klimawandelleugner rei\u00dfen den globalen Trend der Brandfl\u00e4che aus dem Kontext, um eine Aussage zu st\u00fctzen, die wissenschaftlich nicht haltbar ist.\nAbschlie\u00dfend zu diesem Punkt sollte auch hier betont werden, dass Bj\u00f8rn Lomborg, der in seinen B\u00fcchern \u00fcber eine \u201eKlimapanik\u201c schreibt und f\u00fcr eine endlose Flut an kontroversen Meinungsartikeln verantwortlich ist, direkt mit Institutionen in Verbindung steht, die aus der fossilen Lobby finanziert werden. Das \u201eHeartland Institute\u201c ist beispielsweise bekannt daf\u00fcr, Leugner des Klimawandels zu beheimaten, die aktiv\n[Zweifel an der Wissenschaft s\u00e4en](https://www.theguardian.com/environment/2012/feb/15/leak-exposes-heartland-institute-climate). Schaut hier f\u00fcr eine Zusammenstellung gerne nochmal in die bereits erw\u00e4hnte fr\u00fchere [Analyse beim Volksverpetzer](https://www.volksverpetzer.de/faktencheck/lomborg-widerlegt-waldbraende-nehmen-zu/). Es scheint, die Waldbrandaktivit\u00e4t der letzten Jahre habe auch solche manipulativen Institutionen \u201ewachger\u00fcttelt\u201c. Allerdings in dem Sinne, dass die Leugnung wissenschaftlicher Erkenntnisse zu Vegetationsbr\u00e4nden nun ebenfalls auf die Agenda gesetzt wurde. Man darf also durchaus erwarten, dass aus dieser Richtung auch k\u00fcnftig Desinformation gestreut wird.\nZusammenfassung: Den Waldbrand-Fakes Feuer unter dem Hintern machen!\nDie Lufttemperatur ist eine wichtige Einflussgr\u00f6\u00dfe f\u00fcr das Brandgeschehen. Das betrifft sowohl st\u00fcndliche Temperaturschwankungen einer aktiven Einsatzlage der Brandbek\u00e4mpfung, wie auch langfristige klimatische Trends, jeweils mit unterschiedlichen Wirkungsmechanismen. Die globale Erw\u00e4rmung hat vielf\u00e4ltige und meist indirekt Auswirkungen auf Vegetationsbr\u00e4nde. Dar\u00fcber ist seit vielen Jahren in wissenschaftlicher Fachliteratur zu lesen. Das gilt auch f\u00fcr menschlich verursachte Br\u00e4nde. Argumentationsmuster, die diese Auswirkungen leugnen, basieren oft auf einer unzutreffenden Vereinfachung der Komplexit\u00e4t von Vegetationsbr\u00e4nden, auf Strohmann-Argumenten, auf logischen Fehlschl\u00fcssen, sowie auf dem Auslassen von wichtigem Kontext und/oder auf einer manipulativen und unzul\u00e4ssigen Interpretation von Daten.\nDass die genannten Argumente in sich selbst nicht schl\u00fcssig sind wird auch sichtbar, wenn man sie nebeneinanderstellt. Einmal geht es um Brandstiftung durch den Menschen, ein anderes Mal um eine vom Menschen verursachte Reduzierung der Brandfl\u00e4che. Beides wird als Argument gegen einen Einfluss des Klimawandels auf Vegetationsbr\u00e4nde verwendet. In keinem beider F\u00e4lle ist das jedoch legitim. Vor dem Hintergrund aktiver Desinformation gegen wissenschaftliche Erkenntnisse ist es wichtiger denn je, irref\u00fchrende Argumentationsmuster zu erkennen und zu widerlegen. Denn leider werden sie uns auch weiterhin im gesellschaftlichen Diskurs begleiten.\nDieser Artikel ist ein Gastbeitrag von Ramesh Gl\u00fcckler. Nach einem Master of Science in Klima- und Umweltwandel an der Johannes Gutenberg-Universit\u00e4t Mainz befindet er sich derzeit in der Abschlussphase seiner Promotion in Geo\u00f6kologie am Alfred-Wegener-Institut, Helmholtz-Zentrum f\u00fcr Polar- und Meeresforschung in Potsdam. Er forscht und publiziert seit mehreren Jahren zur Waldbrandaktivit\u00e4t im borealen Nadelwald Sibiriens. Nebenbei engagiert er sich bei der Freiwilligen Feuerwehr in Potsdam.", "language": null, "image": "https://www.volksverpetzer.de/wp-content/uploads/2023/09/Vorlage5.png", "pagetype": "article", "links": ["https://www.volksverpetzer.de/", "https://www.volksverpetzer.de", "https://www.volksverpetzer.de/ueber-uns/", "https://www.volksverpetzer.de/credits/", "https://www.volksverpetzer.de/app/", "https://volksverpetzer-shop.de", "https://www.volksverpetzer.de/videos/", "https://www.volksverpetzer.de/unterstutzen/", "https://www.volksverpetzer.de/author/gast/", "https://www.volksverpetzer.de/category/analyse/", "https://www.tagesschau.de/wissen/klima/waldbraende-kanada-klimawandel-100.html", "https://www.dw.com/de/rauch-von-waldbr%C3%A4nden-in-kanada-h%C3%BCllt-usa-ein/video-65875968", "https://www.spiegel.de/ausland/rhodos-touristen-werden-vor-braenden-in-sicherheit-gebracht-urlaubsparadies-in-flammen-a-03608c13-b351-45e6-8a90-ebf32bab14e2", "https://www.tagesschau.de/ausland/amerika/biden-hawaii-maui-100.html", "https://besjournals.onlinelibrary.wiley.com/doi/10.1111/1365-2435.14387", "https://www.science.org/doi/10.1126/science.abb0355", "https://www.pnas.org/doi/abs/10.1073/pnas.1219844110", "https://iopscience.iop.org/article/10.1088/1748-9326/ac2966", "https://correctiv.org/en/top-stories/2020/02/11/the-heartland-lobby/?lang=de", "https://klickwinkel.de/tutorials/wie-sich-fake-news-verbreiten/", "https://www.volksverpetzer.de/analyse/waldbraenden-klima/", "https://link.springer.com/chapter/10.1007/978-3-658-25835-1_42", "https://shop.feuerwehrmagazin.de/products/waldbrand-praevention-bekaempfung-wiederbewaldung", "https://besjournals.onlinelibrary.wiley.com/doi/10.1111/1365-2664.14486", "https://doi.org/10.1016/j.foreco.2014.04.005", "https://link.springer.com/article/10.1007/s10584-017-1899-y", "https://www.science.org/doi/abs/10.1126/science.abn4419", "https://cwfis.cfs.nrcan.gc.ca/background/summary/fwi", "https://www.dwd.de/DE/fachnutzer/landwirtschaft/dokumentationen/allgemein/basis_waldbrandgefahrenindex_doku.html?nn=16102", "https://www.worldweatherattribution.org/climate-change-more-than-doubled-the-likelihood-of-extreme-fire-weather-conditions-in-eastern-canada/", "https://agupubs.onlinelibrary.wiley.com/doi/full/10.1029/2004GL020876", "https://link.springer.com/article/10.1023/A:1010706116176", "https://iopscience.iop.org/article/10.1088/1748-9326/ac5f94", "https://www.pnas.org/doi/10.1073/pnas.2213815120", "https://onlinelibrary.wiley.com/doi/10.1111/ecog.04995", "https://www.publish.csiro.au/WF/WF22154", "https://www.nature.com/articles/s41467-021-27225-4", "https://nhess.copernicus.org/articles/21/941/2021/", "https://iopscience.iop.org/article/10.1088/1748-9326/aa6884/meta", "https://agupubs.onlinelibrary.wiley.com/doi/10.1029/2020RG000726", "https://wildlandfirelearningportal.net/", "https://www.umweltbundesamt.de/daten/land-forstwirtschaft/waldbraende#ursachen-fur-waldbrande", "https://www.umweltbundesamt.de/daten/land-forstwirtschaft/waldbraende#ursachen-fur-waldbrande", "https://forst.brandenburg.de/sixcms/media.php/9/Waldbrandstatistik%202022.pdf", "https://www.mdr.de/nachrichten/deutschland/gesellschaft/waldbrand-munition-102.html", "https://www.umweltbundesamt.de/daten/land-forstwirtschaft/waldbraende#ursachen-fur-waldbrande", "https://forst.brandenburg.de/sixcms/media.php/9/Waldbrandstatistik%202022.pdf", "https://www.nature.com/articles/nclimate3329", "https://www.mdpi.com/2073-445X/11/5/651", "https://iopscience.iop.org/article/10.1088/1748-9326/ac59aa/meta", "https://www.nature.com/articles/s41558-020-0701-8", "https://doi.org/10.1126/science.1259100", "https://www.nature.com/articles/s41558-021-01011-y", "https://iopscience.iop.org/article/10.1088/1748-9326/ac6311/meta", "https://www.spektrum.de/frage/koennen-glasscherben-waldbraende-verursachen/1668836", "https://www.wsj.com/articles/climate-change-hasnt-set-the-world-on-fire-global-warming-burn-record-low-713ad3a6", "https://nypost.com/2023/08/01/climate-change-is-not-the-reason-for-the-rise-of-wildfires/", "https://www.volksverpetzer.de/faktencheck/lomborg-widerlegt-waldbraende-nehmen-zu/", "https://www.volksverpetzer.de/faktencheck/lomborg-widerlegt-waldbraende-nehmen-zu/", "https://doi.org/10.1093/acrefore/9780190228620.013.328", "https://www.science.org/doi/10.1126/science.aal4108", "https://agupubs.onlinelibrary.wiley.com/doi/10.1029/2020RG000726", "https://doi.org/10.1016/j.coesh.2021.100258", "https://www.cbc.ca/radio/ideas/world-on-fire-canada-s-worst-wildfire-season-on-record-1.6946472", "https://doi.org/10.1016/j.jnlssr.2020.06.009", "https://www.volksverpetzer.de/analyse/australien/", "https://www.volksverpetzer.de/analyse/australien/", "https://doi.org/10.1016/j.earscirev.2011.01.001", "https://doi.org/10.1002/ldr.3450", "https://onlinelibrary.wiley.com/doi/10.1111/gcb.16547", "https://www.theguardian.com/environment/2012/feb/15/leak-exposes-heartland-institute-climate", "https://www.volksverpetzer.de/faktencheck/lomborg-widerlegt-waldbraende-nehmen-zu/", "https://www.volksverpetzer.de/unterstutzen/", "https://volksverpetzer-shop.de/", "https://www.volksverpetzer.de/unterstutzen/", "https://volksverpetzer-shop.de/", "https://www.volksverpetzer.de/", "https://www.volksverpetzer.de/ueber-uns/", "https://www.volksverpetzer.de/category/video/", "https://volksverpetzer-shop.de/", "https://www.volksverpetzer.de/spenden/", "https://www.volksverpetzer.de/impressum-volksverpetzer/", "https://www.volksverpetzer.de/impressum-volksverpetzer/", "https://www.volksverpetzer.de/datenschutzerklaerung/", "https://www.paypal.com/donate/?hosted_button_id=8LXQZGF3BDWVU", "https://steadyhq.com/volksverpetzer", "https://volksverpetzer-shop.de/", "https://twitter.com/Volksverpetzer", "https://www.reddit.com/r/Volksverpetzer/", "https://www.facebook.com/volksverpetzer", "https://www.youtube.com/c/Volksverpetzer", "https://t.me/dervolksverpetzer", "https://www.instagram.com/volksverpetzer", "https://digitalcourage.social/@Volksverpetzer", "https://digitalcourage.social/@Volksverpetzer", "https://botsin.space/@faktenbot", "https://www.volksverpetzer.de/impressum-volksverpetzer/", "https://www.volksverpetzer.de/datenschutzerklaerung/", "#", "#", "#", "https://cookiedatabase.org/tcf/purposes/", "#", "#", "#", "#"]}