{"title": "Wunderheiler - Was steckt dahinter? Betrug oder Alternative zur Schulmedizin?", "author": null, "url": "https://www.funk.net/channel/ykollektiv-1059/wunderheiler-was-steckt-dahinter-betrug-oder-alternative-zur-schulmedizin-1649890", "hostname": "funk.net", "description": "Wenn die Schulmedizin an ihre Grenzen st\u00f6\u00dft, weichen einige Menschen auf Alternativen aus und suchen zum Beispiel bei Geist- oder Wunderheilern nach Hilfe. Eige", "sitename": "Funk", "date": "2019-12-19", "id": null, "license": null, "body": null, "comments": "", "commentsbody": null, "raw_text": null, "text": "19. Dezember 2019\nWunderheiler - Was steckt dahinter? Betrug oder Alternative zur Schulmedizin?\nWenn die Schulmedizin an ihre Grenzen st\u00f6\u00dft, weichen einige Menschen auf Alternativen aus und suchen zum Beispiel bei Geist- oder Wunderheilern nach Hilfe. Eigenen Aussagen zufolge wollen einige Heiler sogar Krebs, Depressionen und Autoimmunerkrankungen heilen k\u00f6nnen. Reporterin Victoria van Violence will wissen, was Geist- und Wunderheiler genau machen, will verstehen wie sie arbeiten und macht den Selbstversuch. Daf\u00fcr besucht Victoria eine Messe f\u00fcr alternative Heilmethoden in Berlin- Zehlendorf und trifft dort Wunderheiler und sogenannte \u201eEnergie-Arbeiter\u201c. Sie trifft auch eine junge Frau, die unter Depressionen litt und \u00fcber eine Facebook Selbsthilfegruppe an eine Wunderheilerin geriet, die sie aufforderte ihre Antidepressiva abzusetzen. Victoria l\u00e4sst auch eine \"White Time Healing\"- Behandlung an sich durchf\u00fchren und fragt eine Medizinerin ob und welche Risiken die Geist- und Wunderheilkunde birgt. ------------ Reporterin: Victoria van Violence Kamera: Antonia Schanze, Andy Lehmann, Philipp Katzer Schnitt: Eike Bartsch, Henrik Paro Recherche: Jannis Byell ------------ Musik aus dem Film: Uriah Heep - Easy Living // The Cult - She Sells Sanctuary // Led Zeppelin - Stairway to Heaven // The Cure - A Forest ------------ Weiterf\u00fchrende Artikel zum Thema: SWR: Alternative Therapeuten. Woran erkennt man seri\u00f6se Heiler? https://www.swr.de/odysso/alternative-therapeuten-woran-erkennt-man-serioese-heiler/-/id=1046894/did=16129304/nid=1046894/1trioi0/index.html Focus: Handauflegen, Beten, MeditierenWundersame Heiler oder geldgierige Scharlatane? Das umstrittene Gesch\u00e4ft der Geistheiler https://www.focus.de/gesundheit/ratgeber/psychologie/geistheilung-das-gefaehrliche-geschaeft-der-alternativmedizin_id_8538789.html NDR: Krebs. Dubiose Heiler und Therapeuten erkennen https://www.ndr.de/ratgeber/gesundheit/Krebs-Dubiose-Heilmethoden-erkennen,krebstherapien100.html Deutschlandfunk Kultur: Traditionelle chinesische Medizin. Gesunde Alternative oder Trend https://www.deutschlandfunkkultur.de/traditionelle-chinesische-medizin-gesunde-alternative-oder.1008.de.html?dram:article_id=462414 ------------ Du m\u00f6chtest ein Thema vorschlagen? Schreib uns: kommentare@y-kollektiv.de ------------ Wir sind Y! - ein Netzwerk von jungen JournalistInnen. In unseren Web-Reportagen zeigen wir die Welt, wie wir sie erleben. Recherche machen wir transparent. \u25ba Hier kannst Du uns ABONNIEREN: https://goo.gl/8yBDdh \u25ba FACEBOOK: https://www.facebook.com/YKollektiv/ \u25ba TWITTER: https://twitter.com/Y_Kollektiv \u25ba SPOTIFY: https://spoti.fi/2L7CGNc ------------ \u25ba #ykollektiv geh\u00f6rt zu #funk: YouTube: http://youtube.com/funkofficial funk Web-App: http://go.funk.net Facebook: https://www.facebook.com/funk/ \u25ba Eine Produktion der sendef\u00e4hig GmbH http://facebook.com/sendefaehig // http://sendefaehig.com\nY-Kollektiv\nDie Dokus und Reportagen zeigen menschlich und nah Themen jenseits des normalen Streams: z.B. zu Impfgegnern oder Modern Stalking.\n19. Dezember 2019\nWunderheiler - Was steckt dahinter? Betrug oder Alternative zur Schulmedizin?\nWenn die Schulmedizin an ihre Grenzen st\u00f6\u00dft, weichen einige Menschen auf Alternativen aus und suchen zum Beispiel bei Geist- oder Wunderheilern nach Hilfe. Eigenen Aussagen zufolge wollen einige Heiler sogar Krebs, Depressionen und Autoimmunerkrankungen heilen k\u00f6nnen. Reporterin Victoria van Violence will wissen, was Geist- und Wunderheiler genau machen, will verstehen wie sie arbeiten und macht den Selbstversuch. Daf\u00fcr besucht Victoria eine Messe f\u00fcr alternative Heilmethoden in Berlin- Zehlendorf und trifft dort Wunderheiler und sogenannte \u201eEnergie-Arbeiter\u201c. Sie trifft auch eine junge Frau, die unter Depressionen litt und \u00fcber eine Facebook Selbsthilfegruppe an eine Wunderheilerin geriet, die sie aufforderte ihre Antidepressiva abzusetzen. Victoria l\u00e4sst auch eine \"White Time Healing\"- Behandlung an sich durchf\u00fchren und fragt eine Medizinerin ob und welche Risiken die Geist- und Wunderheilkunde birgt. ------------ Reporterin: Victoria van Violence Kamera: Antonia Schanze, Andy Lehmann, Philipp Katzer Schnitt: Eike Bartsch, Henrik Paro Recherche: Jannis Byell ------------ Musik aus dem Film: Uriah Heep - Easy Living // The Cult - She Sells Sanctuary // Led Zeppelin - Stairway to Heaven // The Cure - A Forest ------------ Weiterf\u00fchrende Artikel zum Thema: SWR: Alternative Therapeuten. Woran erkennt man seri\u00f6se Heiler? https://www.swr.de/odysso/alternative-therapeuten-woran-erkennt-man-serioese-heiler/-/id=1046894/did=16129304/nid=1046894/1trioi0/index.html Focus: Handauflegen, Beten, MeditierenWundersame Heiler oder geldgierige Scharlatane? Das umstrittene Gesch\u00e4ft der Geistheiler https://www.focus.de/gesundheit/ratgeber/psychologie/geistheilung-das-gefaehrliche-geschaeft-der-alternativmedizin_id_8538789.html NDR: Krebs. Dubiose Heiler und Therapeuten erkennen https://www.ndr.de/ratgeber/gesundheit/Krebs-Dubiose-Heilmethoden-erkennen,krebstherapien100.html Deutschlandfunk Kultur: Traditionelle chinesische Medizin. Gesunde Alternative oder Trend https://www.deutschlandfunkkultur.de/traditionelle-chinesische-medizin-gesunde-alternative-oder.1008.de.html?dram:article_id=462414 ------------ Du m\u00f6chtest ein Thema vorschlagen? Schreib uns: kommentare@y-kollektiv.de ------------ Wir sind Y! - ein Netzwerk von jungen JournalistInnen. In unseren Web-Reportagen zeigen wir die Welt, wie wir sie erleben. Recherche machen wir transparent. \u25ba Hier kannst Du uns ABONNIEREN: https://goo.gl/8yBDdh \u25ba FACEBOOK: https://www.facebook.com/YKollektiv/ \u25ba TWITTER: https://twitter.com/Y_Kollektiv \u25ba SPOTIFY: https://spoti.fi/2L7CGNc ------------ \u25ba #ykollektiv geh\u00f6rt zu #funk: YouTube: http://youtube.com/funkofficial funk Web-App: http://go.funk.net Facebook: https://www.facebook.com/funk/ \u25ba Eine Produktion der sendef\u00e4hig GmbH http://facebook.com/sendefaehig // http://sendefaehig.com\n335 Videos\n[vor 3 Monaten07:36](/channel/ykollektiv-1059/nach-7-jahren-ciao-funk-1922648)\nNach 7 Jahren: Ciao funk!\nNach sieben Jahren Y-Kollektiv hei\u00dft es jetzt: Next Level Y-Kollektiv! Wir wechseln von funk in die ARD Mediathek. Mit funk sind wir gro\u00df geworden, haben gut recherchierten Journalismus auf YouTube ver\u00f6ffentlicht, konnten immer anspruchsvollere Recherchen umsetzen, auch zu polarisierenden Themen - jetzt ist es Zeit, Platz zu machen f\u00fcr neue Creator:innen. Es wird sich nichts daran \u00e4ndern, wie wir unsere Reportagen machen. Es \u00e4ndert sich einfach nur der Ort, an dem ihr sie finden k\u00f6nnt: Ab sofort findet ihr uns prim\u00e4r in der ARD Mediathek. Unsere gr\u00f6\u00dferen Recherchen gibt\u2019s in ihrer vollen L\u00e4nge ab sofort nur noch da. Und zwar alles montags.\n[vor 4 Monaten23:18](/channel/ykollektiv-1059/unterwegs-mit-der-kripo-in-berlin-diese-bilder-lassen-sie-nicht-mehr-los-ykollektiv-1922509)\nUnterwegs mit der Kripo in Berlin \u2013 Diese Bilder lassen sie nicht mehr los | Y-Kollektiv\nAufgebrochene Geldschr\u00e4nke, Raub und Messerstechereien: Die Kommissar:innen Julia und Christian arbeiten beim Kriminaldauerdienst der Berliner Polizei. Zwei Tage begleiten wir die beiden bei ihren Eins\u00e4tzen. Mit der aufregenden Welt der Fernsehkrimis hat das nicht viel zu tun. Wir erfahren, wie die beiden damit umgehen, jeden Tag mit schweren Straftaten und schwierigen Schicksalen konfrontiert zu sein.\n[vor 4 Monaten23:46](/channel/ykollektiv-1059/mit-dem-schluessel-in-der-faust-nach-hause-was-tun-gegen-angstorte-ykollektiv-1922258)\nMit dem Schl\u00fcssel in der Faust nach Hause: Was tun gegen Angstorte? | Y-Kollektiv\n\u201eMeld dich, wenn du zu Hause bist\u201c \u2013 f\u00fcr viele Frauen sind solche Verabschiedungen ganz normal. Besonders Bahnh\u00f6fe und Vorpl\u00e4tze gelten nachts als Angst-Orte, weil dort \u201egruselige\u201c Gestalten abh\u00e4ngen, es \u00fcberall dunkle Ecken und unbeleuchtete Gassen gibt. Woher kommt diese Angst im \u00f6ffentlichen Raum und was k\u00f6nnen wir gegen sie tun?\n[vor 4 Monaten22:30](/channel/ykollektiv-1059/kollaps-der-notfallmedizin-stress-fehler-endlosdienst-ykollektiv-1922081)\nKollaps der Notfallmedizin: Stress, Fehler & Endlosdienst | Y-Kollektiv\nArbeiten am Limit: Das ist der Alltag des medizinischen Personals in Deutschland. Neben der hohen Arbeitsbelastung und 12-Stunden-Schichten herrscht auch wirtschaftlicher Druck. Y-Kollektiv Reporter Johannes Musial begleitet den Alltag von \u00c4rzt:innen und Notfallsanit\u00e4ter:innen: Was sind die Herausforderungen im Arbeitsablauf? Und was gibt dem medizinischen Personal die Motivation weiterzumachen?\n[vor 4 Monaten24:37](/channel/ykollektiv-1059/sexuelle-uebergriffe-finanzielle-ausbeutung-der-traum-vom-modelleben-ykollektiv-1921569)\nSexuelle \u00dcbergriffe & finanzielle Ausbeutung: Der Traum vom Modelleben? | Y-Kollektiv\nDas glamour\u00f6se Modelleben: Shootings, Reisen, die Cover weltweiter Modemagazine. Dies ist der Traum vieler junger Frauen. Doch das Gesch\u00e4ft mit der Sch\u00f6nheit hat eine dunkle Seite: sexuelle \u00dcbergriffe, finanzielle Ausbeutung, ein krankmachendes K\u00f6rperideal und Machtmissbrauch. Nur wenige aktive Models, Agent:Innen oder Fotograf:Innen trauen sich dar\u00fcber zu sprechen. Reporterin Anne Thiele m\u00f6chte diese Missst\u00e4nde aufdecken und spricht mit betroffenen Models, die sexuelle \u00dcbergriffe und Bel\u00e4stigung erlebt haben. Denn gerade am Anfang der Karriere nutzen unseri\u00f6se Fotograf:Innen und Agenturen die Unwissenheit ihrer jungen Klient:Innen mit dubiosen Shootings und hohen Agenturbeitr\u00e4gen aus. Diese Spannungsverh\u00e4ltnisse zwischen Angst, Druck, \u00dcbergriffe, aber auch Gegenwehr beleuchten wir in der neuen Y-Reportage.\n[vor 4 Monaten24:57](/channel/ykollektiv-1059/wenn-du-20-millionen-hast-kannst-du-so-gerade-gut-leben-millionaer-durch-fba-ykollektiv-1921095)\n\"Wenn du 20 Millionen hast, kannst du so gerade gut leben\": Million\u00e4r durch FBA | Y-Kollektiv\nAuf TikTok und YouTube zeigen etliche Leute wie sie mit Amazon FBA reich geworden sind. Das Konzept: Ware aus China einkaufen und auf Amazon teurer weiter verkaufen. Aber funktioniert das wirklich? Reporterin Carolin von der Groeben trifft Timo, der genau das geschafft hat. Nicklas bietet teuer Coachings an und verdient sein Geld vor allem damit anderen FBA beizubringen. Und Frank hat mit FBA viel Geld verloren - was ist also dran am Traum vom gro\u00dfen Geld mit Amazon FBA?\n[vor 4 Monaten25:00](/channel/ykollektiv-1059/so-brutal-ist-es-als-hochgewichtige-person-in-dieser-gesellschaft-zu-leben-ykollektiv-1920551)\nSo brutal ist es, als hochgewichtige Person in dieser Gesellschaft zu leben | Y-Kollektiv\nSeit ihrer Kindheit wird die 36-j\u00e4hrige, hochgewichtige, Nora mit Bodyshaming konfrontiert. Als Fat- Acceptance- Aktivistin und Feministin f\u00e4llt ihr die Entscheidung nicht leicht, ob sie sich ihren Magen verkleinern lassen sollte. Macht sie es f\u00fcr sich, oder um einem Sch\u00f6nheitsideal zu entsprechen? \u00dcber zwei Jahre hinweg begleitet Reporterin Lena Elfers sie auf ihrem Weg der Entscheidungsfindung. Dabei gew\u00e4hrt Nora einen sehr intimen Einblick, was jahrelange Stigmatisierungen mit einer Seele anrichten k\u00f6nnen. Au\u00dferdem spricht sie mit Experte Friedrich Schorb, einem deutschen Forscher der Fatness Studies, der diese Erfahrungen aus professioneller Sicht einordnet.", "language": null, "image": "https://www.funk.net/api/frontend/webapp/thumbnails/5dfb5c3c40d5dd00017d0c7b?width=600&height=340&quality=85", "pagetype": "website", "links": ["/", "/channel/ykollektiv-1059", "/channel/ykollektiv-1059", "/channel/ykollektiv-1059/nach-7-jahren-ciao-funk-1922648", "/channel/ykollektiv-1059/unterwegs-mit-der-kripo-in-berlin-diese-bilder-lassen-sie-nicht-mehr-los-ykollektiv-1922509", "/channel/ykollektiv-1059/mit-dem-schluessel-in-der-faust-nach-hause-was-tun-gegen-angstorte-ykollektiv-1922258", "/channel/ykollektiv-1059/kollaps-der-notfallmedizin-stress-fehler-endlosdienst-ykollektiv-1922081", "/channel/ykollektiv-1059/sexuelle-uebergriffe-finanzielle-ausbeutung-der-traum-vom-modelleben-ykollektiv-1921569", "/channel/ykollektiv-1059/wenn-du-20-millionen-hast-kannst-du-so-gerade-gut-leben-millionaer-durch-fba-ykollektiv-1921095", "/channel/ykollektiv-1059/so-brutal-ist-es-als-hochgewichtige-person-in-dieser-gesellschaft-zu-leben-ykollektiv-1920551", "https://www.ardmediathek.de/ard/", "https://www.zdf.de/"]}