{"title": "Kapitel 7 - Bundesbeihilfeverordnung (BBhV)", "author": "Buzer De", "url": "https://www.buzer.de/gesetz/8634/b26267.htm", "hostname": "buzer.de", "description": "Kapitel 7 BBhV \u00dcbergangs- und Schlussvorschriften Bundesbeihilfeverordnung", "sitename": "buzer.de", "date": "2009-02-13", "id": null, "license": null, "body": null, "comments": "", "commentsbody": null, "raw_text": null, "text": "Bundesrecht - tagaktuell konsolidiert - alle Fassungen seit 2006\nTools:\nUpdate via:\nKapitel 7 - Bundesbeihilfeverordnung (BBhV)\nV. v. 13.02.2009\nGeltung ab 14.02.2009; FNA: 2030-2-30-1\n|\n[BGBl. I S. 326](https://www.buzer.de/outb/bgbl/0326091.htm)( [Nr. 8](/s1.htm?g=nr+8.2009)); zuletzt ge\u00e4ndert durch [Artikel 1](/gesetz/14293/a255242.htm)V. v. 01.12.2020 [BGBl. I S. 2713](/gesetz/14293/index.htm)\nGeltung ab 14.02.2009; FNA: 2030-2-30-1\n[Beamte](/fna/2030-Beamte.htm)\n|\n[Anlage 1 (zu \u00a7 6 Absatz 2) Ausgeschlossene und teilweise ausgeschlossene Untersuchungen und Behandlungen](/gesetz/8634/a159991.htm) [Anlage 2 (zu \u00a7 6 Absatz 3 Satz 4) H\u00f6chstbetr\u00e4ge f\u00fcr die Angemessenheit der Aufwendungen f\u00fcr Heilpraktikerleistungen](/gesetz/8634/a177729.htm) [Anlage 3 (zu den \u00a7\u00a7 18 bis 21) Ambulant durchgef\u00fchrte psychotherapeutische Behandlungen und Ma\u00dfnahmen der psychosomatischen Grundversorgung](/gesetz/8634/a159992.htm) [Anlage 5 (zu \u00a7 22 Absatz 2 Nummer 1) Arzneimittel, die \u00fcberwiegend der Erh\u00f6hung der Lebensqualit\u00e4t dienen](/gesetz/8634/a177731.htm) [Anlage 6 (zu \u00a7 22 Absatz 2 Nummer 3 Buchstabe c) Beihilfef\u00e4higkeit nicht verschreibungspflichtiger Arzneimittel](/gesetz/8634/a177732.htm) [Anlage 8 (zu \u00a7 22 Absatz 4) Von der Beihilfef\u00e4higkeit ausgeschlossene oder beschr\u00e4nkt beihilfef\u00e4hige Arzneimittel](/gesetz/8634/a159993.htm) [Anlage 10 (zu \u00a7 23 Absatz 1 und \u00a7 24 Absatz 1) Leistungserbringerinnen und Leistungserbringer f\u00fcr Heilmittel](/gesetz/8634/a177734.htm) [Anlage 11 (zu \u00a7 25 Absatz 1 und 4) Beihilfef\u00e4hige Aufwendungen f\u00fcr Hilfsmittel, Ger\u00e4te zur Selbstbehandlung und Selbstkontrolle, K\u00f6rperersatzst\u00fccke](/gesetz/8634/a159995.htm) [Anlage 12 (zu \u00a7 25 Absatz 1, 2 und 4) Nicht beihilfef\u00e4hige Hilfsmittel, Ger\u00e4te zur Selbstbehandlung und Selbstkontrolle](/gesetz/8634/a159996.htm) [Anlage 13 (zu \u00a7 41 Absatz 1 Satz 3) Nach \u00a7 41 Absatz 1 Satz 3 beihilfef\u00e4hige Fr\u00fcherkennungsuntersuchungen, Vorsorgema\u00dfnahmen und Schutzimpfungen](/gesetz/8634/a177735.htm) [Anlage 14 (zu \u00a7 41 Absatz 3) Fr\u00fcherkennungsprogramm f\u00fcr erblich belastete Personen mit einem erh\u00f6hten famili\u00e4ren Brust- oder Eierstockkrebsrisiko](/gesetz/8634/a188445.htm) [Anlage 14a (zu \u00a7 41 Absatz 4) Fr\u00fcherkennungsprogramm f\u00fcr erblich belastete Personen mit einem erh\u00f6hten famili\u00e4ren Darmkrebsrisiko](/gesetz/8634/a212490.htm)\nKapitel 7 \u00dcbergangs- und Schlussvorschriften\n\u00a7 58 \u00dcbergangsvorschriften\n\u00a7 58 hat\n[10 fr\u00fchere Fassungen](/gesetz/8634/al159989.htm)und wird in [9 Vorschriften zitiert](/gesetz/8634/v159989.htm)\n(1) Die Anpassung des Betrages nach\n[\u00a7 6 Absatz 2 Satz 1](https://www.buzer.de/gesetz/8634/a159937.htm)auf Grund der S\u00e4tze 6 und 7 des [\u00a7 6 Absatz 2](https://www.buzer.de/gesetz/8634/a159937.htm)erfolgt erstmals f\u00fcr die Beantragung der Beihilfe im Jahr 2024.\n(2) Die\n[\u00a7\u00a7 141](https://www.buzer.de/141_SGB_11.htm), [144 Absatz 1 und 3](https://www.buzer.de/144_SGB_11.htm)und [\u00a7 145 des Elften Buches Sozialgesetzbuch](https://www.buzer.de/145_SGB_11.htm)gelten entsprechend.\n(3)\n[\u00a7 51a](https://www.buzer.de/gesetz/8634/a212489.htm)gilt nicht f\u00fcr bis zum 31. Juli 2018 eingef\u00fchrte Verfahren zur direkten Abrechnung von beihilfef\u00e4higen Aufwendungen nach [\u00a7 26 Absatz 1 Nummer 1, 2, 4 und 5](https://www.buzer.de/gesetz/8634/a159957.htm).\n(4) Die Ber\u00fccksichtigungsf\u00e4higkeit von Kindern, die sich in Schul- oder Berufsausbildung befinden und deren Schul- oder Berufsabschluss sich im Jahr 2020 durch die COVID-19-Pandemie verz\u00f6gert, verl\u00e4ngert sich um den Zeitraum der Verz\u00f6gerung.\nText in der Fassung der\n[Berichtigung der Neunten Verordnung zur \u00c4nderung der Bundesbeihilfeverordnung B. v. 1. M\u00e4rz 2021 BGBl. I S. 343](/gesetz/14515/a268368.htm)m.W.v. 1. Januar 2021\n\u00a7 59 Inkrafttreten\nDiese Verordnung tritt am Tag nach der Verk\u00fcndung*) in Kraft.\n---\n---\n- *)\n- Anm. d. Red.: Die Verk\u00fcndung erfolgte am 13. Februar 2009.\nAnlage 1 (zu\n[\u00a7 6 Absatz 2](https://www.buzer.de/gesetz/8634/a159937.htm)) Ausgeschlossene und teilweise ausgeschlossene Untersuchungen und Behandlungen\nAnlage 1 hat\n[6 fr\u00fchere Fassungen](/gesetz/8634/al159991.htm)und wird in [8 Vorschriften zitiert](/gesetz/8634/v159991.htm)\nAbschnitt 1\nV\u00f6lliger Ausschluss\n- 1.1\n- Anwendung tonmodulierter Verfahren, Audio-Psycho-Phonologie-Therapie (zum Beispiel nach Tomatis, H\u00f6rtraining nach Volf, audiovokale Integration und Therapie, Psychophonie-Verfahren zur Behandlung einer Migr\u00e4ne)\n- 1.2\n- Atlastherapie nach Arlen\n- 1.3\n- autohomologe Immuntherapien\n- 1.4\n- autologe-Target-Cytokine-Therapie nach Klehr\n- 1.5\n- ayurvedische Behandlungen, zum Beispiel nach Maharishi\n- 2.1\n- Behandlung mit nicht beschleunigten Elektronen nach Nuhr\n- 2.2\n- Biophotonen-Therapie\n- 2.3\n- Bioresonatorentests\n- 2.4\n- Blutkristallisationstests zur Erkennung von Krebserkrankungen\n- 2.5\n- Bogomoletz-Serum\n- 2.6\n- brechkraftver\u00e4ndernde Operation der Hornhaut des Auges (Keratomileusis) nach Barraquer\n- 2.7\n- Bruchheilung ohne Operation\n- 3.1\n- Colon-Hydro-Therapie und ihre Modifikationen\n- 3.2\n- computergest\u00fctzte mechanische Distraktionsverfahren, zur nichtoperativen segmentalen Distraktion an der Wirbels\u00e4ule (zum Beispiel SpineMED-Verfahren, DRX 9000, Accu-SPINA)\n- 3.3\n- computergest\u00fctztes Gesichtsfeldtraining zur Behandlung nach einer neurologischbedingten Erkrankung oder Sch\u00e4digung\n- 3.4\n- cytotoxologische Lebensmitteltests\n- 4.1\n- DermoDyne-Therapie (DermoDyne-Lichtimpfung)\n- 5.1\n- Elektroneuralbehandlungen nach Croon\n- 5.2\n- Elektronneuraldiagnostik\n- 5.3\n- epidurale Wirbels\u00e4ulenkathetertechnik nach Racz\n- 6.1\n- Frischzellentherapie\n- 7.1\n- Ganzheitsbehandlungen auf bioelektrisch-heilmagnetischer Grundlage (zum Beispiel Bioresonanztherapie, Decoderdermographie, Elektroakupunktur nach Voll, elektronische Systemdiagnostik, Medikamententests nach der Bioelektrischen Funktionsdiagnostik, Mora-Therapie)\n- 7.2\n- gezielte vegetative Umstimmungsbehandlung oder gezielte vegetative Gesamtumschaltung durch negative statische Elektrizit\u00e4t\n- 8.1\n- Heileurhythmie\n- 8.2\n- H\u00f6henfl\u00fcge zur Asthma- oder Keuchhustenbehandlung\n- 8.3\n- Hornhautimplantation refraktiv zur Korrektur der Presbyopie\n- 9.1\n- immunoaugmentative Therapie\n- 9.3\n- isobare oder hyperbare Inhalationstherapien mit ionisiertem oder nichtionisiertem Sauerstoff oder Ozon einschlie\u00dflich der oralen, parenteralen oder perkutanen Aufnahme (zum Beispiel h\u00e4matogene Oxidationstherapie, Sauerstoff-Darmsanierung, Sauerstoff-Mehrschritt-Therapie nach von Ardenne)\n- 10.1\n- (frei)\n- 11.1\n- kinesiologische Behandlung\n- 11.2\n- Kirlian-Fotografie\n- 11.3\n- kombinierte Serumtherapie (zum Beispiel Wiedemann-Kur)\n- 11.4\n- konduktive F\u00f6rderung nach Pet\u00f6\n- 12.1\n- Laser-Behandlung im Bereich der physikalischen Therapie\n- 13.1\n- modifizierte Eigenblutbehandlung (zum Beispiel nach Garthe, Blut-Kristall-Analyse unter Einsatz der Pr\u00e4parate Autohaemin, Antihaemin und Anhaemin) und sonstige Verfahren, bei denen aus k\u00f6rpereigenen Substanzen der Patientin oder des Patienten individuelle Pr\u00e4parate gefertigt werden (zum Beispiel Gegensensibilisierung nach Theurer, Clustermedizin)\n- 14.1\n- Neurostimulation nach Molsberger\n- 14.2\n- neurotopische Diagnostik und Therapie\n- 14.3\n- niedrig dosierter, gepulster Ultraschall\n- 15.1\n- osmotische Entw\u00e4sserungstherapie\n- 16.1\n- photodynamische Therapie in der Parodontologie\n- 16.2\n- Psycotron-Therapie\n- 16.3\n- pulsierende Signaltherapie\n- 16.4\n- Pyramidenenergiebestrahlung\n- 17.1\n- (frei)\n- 18.1\n- Regeneresen-Therapie\n- 18.2\n- Reinigungsprogramm mit Megavitaminen und Ausschwitzen\n- 18.3\n- Rolfing-Behandlung\n- 19.1\n- Schwingfeld-Therapie\n- 19.2\n- SIPARI-Methode\n- 20.1\n- Thermoregulationsdiagnostik\n- 20.2\n- Transorbitale Wechselstromstimulation bei Optikusatrophie (zum Beispiel SAVIR-Verfahren)\n- 20.3\n- Trockenzellentherapie\n- 21.1\n- (frei)\n22.2 Vibrationsmassage des Kreuzbeins\n- 23.1\n- (frei)\n- 24.1\n- (frei)\n- 25.1\n- (frei)\n- 26.1\n- Zellmilieu-Therapie\nAbschnitt 2\nTeilweiser Ausschluss\n- 1.\n- Chelattherapie\nAufwendungen sind nur beihilfef\u00e4hig bei Behandlung von Schwermetallvergiftung, Morbus Wilson und Siderose. Alternative Schwermetallausleitungen geh\u00f6ren nicht zur Behandlung einer Schwermetallvergiftung.\n- 2.\n- Extrakorporale Sto\u00dfwellentherapie (ESWT) im orthop\u00e4dischen und schmerztherapeutischen Bereich\nAufwendungen sind nur beihilfef\u00e4hig bei Behandlung von Tendinosis calcarea, Pseudarthrose, Fasziitis plantaris, therapierefrakt\u00e4re Epicondylitis humeri radialis und therapierefrakt\u00e4re Achillodynie. Auf der Grundlage des Beschlusses der Bundes\u00e4rztekammer zur Analogbewertung der ESWT sind Geb\u00fchren nach Nummer 1800 der Anlage zur\n[Geb\u00fchrenordnung f\u00fcr \u00c4rzte](https://www.buzer.de/gesetz/5678/index.htm)beihilfef\u00e4hig. Daneben sind keine Zuschl\u00e4ge beihilfef\u00e4hig.\n- 3.\n- Hyperbare Sauerstofftherapie (\u00dcberdruckbehandlung)\nAufwendungen sind nur beihilfef\u00e4hig bei Behandlung von Kohlenmonoxidvergiftung, Gasgangr\u00e4n, chronischen Knocheninfektionen, Septik\u00e4mien, schweren Verbrennungen, Gasembolien, peripherer Isch\u00e4mie, diabetisches Fu\u00dfsyndrom ab Wagner Stadium II oder von Tinnitusleiden, die mit Perzeptionsst\u00f6rungen des Innenohres verbunden sind.\n- 4.\n- Hyperthermiebehandlung\nAufwendungen sind nur beihilfef\u00e4hig bei Tumorbehandlungen in Kombination mit Chemo- oder Strahlentherapie.\n- 5.\n- Klimakammerbehandlung\nAufwendungen sind nur beihilfef\u00e4hig, wenn andere \u00fcbliche Behandlungsmethoden nicht zum Erfolg gef\u00fchrt haben und die Festsetzungsstelle auf Grund des Gutachtens von einer \u00c4rztin oder einem Arzt, die oder den sie bestimmt, vor Beginn der Behandlung zugestimmt hat.\n- 6.\n- Lanthasol-Aerosol-Inhalationskur\nAufwendungen sind nur beihilfef\u00e4hig, wenn die Aerosol-Inhalationskuren mit hochwirksamen Medikamenten, zum Beispiel Aludrin, durchgef\u00fchrt werden.\n- 7.\n- Magnetfeldtherapie\nAufwendungen sind nur beihilfef\u00e4hig bei Behandlung von atrophen Pseudarthrosen, bei Endoprothesenlockerung, idiopathischer H\u00fcftnekrose und verz\u00f6gerter Knochenbruchheilung, wenn die Magnetfeldtherapie in Verbindung mit einer sachgerechten chirurgischen Therapie durchgef\u00fchrt wird, sowie bei psychiatrischen Erkrankungen.\n- 8.\n- Ozontherapie\nAufwendungen sind nur beihilfef\u00e4hig bei Gasinsufflationen, wenn damit arterielle Verschlusserkrankungen behandelt werden. Vor Aufnahme der Behandlung ist die Zustimmung der Festsetzungsstelle einzuholen.\n- 9.\n- Radiale extrakorporale Sto\u00dfwellentherapie (r-ESWT)\nAufwendungen sind nur beihilfef\u00e4hig im orthop\u00e4dischen und schmerztherapeutischen Bereich bei Behandlung der therapierefrakt\u00e4ren Epicondylitis humeri radialis oder einer therapierefrakt\u00e4ren Fasciitis plantaris. Auf der Grundlage des Beschlusses der Bundes\u00e4rztekammer zur Analogbewertung der r-ESWT sind Geb\u00fchren nach Nummer 302 der Anlage zur\n[Geb\u00fchrenordnung f\u00fcr \u00c4rzte](https://www.buzer.de/gesetz/5678/index.htm)beihilfef\u00e4hig. Zuschl\u00e4ge sind nicht beihilfef\u00e4hig.\n- 10.\n- Therapeutisches Reiten (Hippotherapie)\nAufwendungen sind nur beihilfef\u00e4hig bei ausgepr\u00e4gten cerebralen Bewegungsst\u00f6rungen (Spastik) oder schwerer geistiger Behinderung, sofern die \u00e4rztlich verordnete Behandlung von Angeh\u00f6rigen der Gesundheits- oder Medizinalfachberufe (zum Beispiel Krankengymnastin oder Krankengymnast) mit entsprechender Zusatzausbildung durchgef\u00fchrt wird. Die Aufwendungen sind nach den Nummern 4 bis 6 der\n[Anlage 9](https://www.buzer.de/gesetz/8634/a159994.htm)beihilfef\u00e4hig.\n- 11.\n- Thymustherapie und Behandlung mit Thymuspr\u00e4paraten\nAufwendungen sind nur beihilfef\u00e4hig bei Krebsbehandlungen, wenn andere \u00fcbliche Behandlungsmethoden nicht zum Erfolg gef\u00fchrt haben.\n- 12.\n- Visusverbessernde Ma\u00dfnahmen\n- a)\n- Austausch nat\u00fcrlicher Linsen\nBei einer reinen visusverbessernden Operation sind Aufwendungen nur beihilfef\u00e4hig, wenn der Austausch die einzige M\u00f6glichkeit ist, um eine Verbesserung des Visus zu erreichen. Die Aufwendungen f\u00fcr die Linsen sind dabei nur bis zur H\u00f6he der Kosten einer Monofokallinse, h\u00f6chstens bis zu 270 Euro pro Linse beihilfef\u00e4hig. Satz 2 gilt auch f\u00fcr Linsen bei einer Kataraktoperation.\n- b)\n- Chirurgische Hornhautkorrektur durch Laserbehandlung\nAufwendungen sind nur beihilfef\u00e4hig, wenn eine Korrektur durch eine Brille oder Kontaktlinsen nach augen\u00e4rztlicher Feststellung nicht m\u00f6glich ist.\n- c)\n- Implantation einer additiven Linse, auch einer Add-on-Intraokularlinse\nAufwendungen sind nur beihilfef\u00e4hig, wenn die Implantation die einzige M\u00f6glichkeit ist, um eine Verbesserung des Visus zu erreichen.\n- d)\n- Implantation einer phaken Intraokularlinse\nAufwendungen sind nur beihilfef\u00e4hig, wenn die Implantation die einzige M\u00f6glichkeit ist, um eine Verbesserung des Visus zu erreichen.\nText in der Fassung des\n[Artikels 1 Neunte Verordnung zur \u00c4nderung der Bundesbeihilfeverordnung V. v. 1. Dezember 2020 BGBl. I S. 2713, 2021 I 343](/gesetz/14293/a255242.htm)m.W.v. 1. Januar 2021\nAnlage 2 (zu \u00a7\n[6](https://www.buzer.de/gesetz/8634/a159937.htm) Absatz 3 Satz 4) H\u00f6chstbetr\u00e4ge f\u00fcr die Angemessenheit der Aufwendungen f\u00fcr Heilpraktikerleistungen\nAnlage 2 hat\n[3 fr\u00fchere Fassungen](/gesetz/8634/al177729.htm)und wird in [5 Vorschriften zitiert](/gesetz/8634/v177729.htm)\n|Nummer||Leistungsbeschreibung||vereinbarter|\nH\u00f6chstbetrag\n|1 - 10 Allgemeine Leistungen|\n|1||F\u00fcr die eingehende, das gew\u00f6hnliche Ma\u00df \u00fcbersteigende Untersuchung||12,50 \u20ac|\n|2a||Erhebung der hom\u00f6opathischen Erstanamnese mit einer Mindestdauer von|\neiner Stunde je Behandlungsfall\n|80,00 \u20ac|\n|2b||Durchf\u00fchrung des vollst\u00e4ndigen Krankenexamens mit Repertorisation nach den|\nRegeln der klassischen Hom\u00f6opathie\nAnmerkung: Die Leistung nach Nummer 2b ist in einer Sitzung nur einmal und\ninnerhalb von sechs Monaten h\u00f6chstens dreimal berechnungsf\u00e4hig.\n|35,00 \u20ac|\n|3||Kurze Information, auch mittels Fernsprecher, oder Ausstellung einer Wiederholungsver-|\nordnung, als einzige Leistung pro Inanspruchnahme der Heilpraktikerin/des Heilprakti-\nkers\n|3,00 \u20ac|\n|4||Eingehende Beratung, die das gew\u00f6hnliche Ma\u00df \u00fcbersteigt, von mindestens 15 Minuten|\nDauer, gegebenenfalls einschlie\u00dflich einer Untersuchung\nAnmerkung: Eine Leistung nach Nummer 4 ist nur als alleinige Leistung oder im Zusammenhang mit\neiner Leistung nach Nummer 1 oder Nummer 17.1 beihilfef\u00e4hig.\n|18,50 \u20ac|\n|5||Beratung, auch mittels Fernsprecher, gegebenenfalls, einschlie\u00dflich einer kurzen Unter-|\nsuchung\nAnmerkung: Eine Leistung nach Nummer 5 ist nur einmal pro Behandlungsfall neben einer anderen\nLeistung beihilfef\u00e4hig.\n|9,00 \u20ac|\n|6||F\u00fcr die gleichen Leistungen wie unter Nummer 5, jedoch au\u00dferhalb der normalen|\nSprechstundenzeit\n|13,00 \u20ac|\n|7||F\u00fcr die gleichen Leistungen wie unter Nummer 5, jedoch bei Nacht, zwischen 20 und|\n7 Uhr\n|18,00 \u20ac|\n|8||F\u00fcr die gleichen Leistungen wie unter Nummer 5, jedoch sonn- und feiertags|\nAnmerkung: Als allgemeine Sprechstunde gilt die durch Aushang festgesetzte Zeit, selbst wenn sie\nnach 20 Uhr festgesetzt ist. Eine Berechnung des Honorars nach den Nummern 6 bis 8 kann also\nnur dann erfolgen, wenn die Beratung au\u00dferhalb der festgesetzten Zeiten stattfand und der Patient\nnicht schon vor Ablauf derselben im Wartezimmer anwesend war. Ebenso k\u00f6nnen f\u00fcr Sonn- und\nFeiertage nicht die daf\u00fcr vorgesehenen erh\u00f6hten Honorare zur Berechnung kommen, wenn der\nHeilpraktiker gewohnheitsm\u00e4\u00dfig an Sonn- und Feiertagen Sprechstunden h\u00e4lt.\n|20,00 \u20ac|\n|9 Hausbesuch einschlie\u00dflich Beratung|\n|9.1||bei Tag||24,00 \u20ac|\n|9.2||in dringenden F\u00e4llen (Eilbesuch, sofort ausgef\u00fchrt)||26,00 \u20ac|\n|9.3||bei Nacht und an Sonn- und Feiertagen||29,00 \u20ac|\n|10 Nebengeb\u00fchren f\u00fcr Hausbesuche|\n|10.1||f\u00fcr jede angefangene Stunde bei Tag bis zu 2 km Entfernung zwischen Praxis- und|\nBesuchsort\n|4,00 \u20ac|\n|10.2||f\u00fcr jede angefangene Stunde bei Nacht bis zu 2 km Entfernung zwischen Praxis- und|\nBesuchsort\n|8,00 \u20ac|\n|10.5||f\u00fcr jeden zur\u00fcckgelegten km bei Tag von 2 bis 25 km Entfernung zwischen Praxis- und|\nBesuchsort\n|1,00 \u20ac|\n|10.6||f\u00fcr jeden zur\u00fcckgelegten km bei Nacht von 2 bis 25 km Entfernung zwischen Praxis- und|\nBesuchsort\n|2,00 \u20ac|\n|10.7||Handelt es sich um einen Fernbesuch von \u00fcber 25 km Entfernung zwischen Praxis- und|\nBesuchsort, so k\u00f6nnen pro Kilometer an Reisekosten in Anrechnung gebracht werden.\nAnmerkung: Die Wegkilometer werden nach dem jeweils g\u00fcnstigsten benutzbaren Fahrtweg berech-\nnet. Besucht der Heilpraktiker mehrere Patienten bei einer Besuchsfahrt, werden die Fahrtkosten\nentsprechend aufgeteilt.\n|0,20 \u20ac|\n|10.8||Handelt es sich bei einem Krankenbesuch um eine Reise, welche l\u00e4nger als 6 Stunden|\ndauert, so kann die Heilpraktikerin/der Heilpraktiker anstelle des Wegegeldes die\ntats\u00e4chlich entstandenen Reisekosten in Abrechnung bringen und au\u00dferdem f\u00fcr den\nZeitaufwand pro Stunde Reisezeit berechnen. Die Patientin bzw. der Patient ist hiervon\nvorher in Kenntnis zu setzen.\n|16,00 \u20ac|\n|11 Schriftliche Auslassungen und Krankheitsbescheinigungen|\n|11.1||Kurze Krankheitsbescheinigung oder Brief im Interesse der Patientin/des Patienten||5,00 \u20ac|\n|11.2||Ausf\u00fchrlicher|\nKrankheits-\nbericht oder\nGutachten\n(DIN A4\nengzeilig\nmaschinen-\ngeschrieben)\n|Ausf\u00fchrlicher schrift-|\nlicher Krankheits-\nund Befundbericht\n(einschlie\u00dflich Anga-\nben zur Anamnese,\nzu den Befunden,\nzur epikritischen\nBewertung und ge-\ngebenenfalls zur\nTherapie)\n|15,00 \u20ac|\n|Schriftliche gutach-|\nterliche \u00c4u\u00dferung\n|16,00 \u20ac|\n|11.3||Individuell angefertigter schriftlicher|\nDi\u00e4tplan bei Ern\u00e4hrungs- und\nStoffwechselerkrankungen\n|8,00 \u20ac|\n|12 Chemisch-physikalische Untersuchungen|\n|12.1||Harnuntersuchungen qualitativ mittels Verwendung eines Mehrfachreagenztr\u00e4gers|\n(Teststreifen) durch visuellen Farbvergleich\nAnmerkung: Die einfache qualitative Untersuchung auf Zucker und Eiwei\u00df sowie die Bestimmung\ndes ph-Wertes und des spezifischen Gewichtes sind nicht berechnungsf\u00e4hig.\n|3,00 \u20ac|\n|12.2||Harnuntersuchung quantitativ (es ist anzugeben, auf welchen Stoff untersucht wurde,|\nzum Beispiel Zucker usw.)\n|4,00 \u20ac|\n|12.4||Harnuntersuchung, nur Sediment||4,00 \u20ac|\n|12.7||Blutstatus (nicht neben den Nummern 12.9, 12.10, 12.11)||10,00 \u20ac|\n|12.8||Blutzuckerbestimmung||2,00 \u20ac|\n|12.9||H\u00e4moglobinbestimmung||3,00 \u20ac|\n|12.10||Differenzierung des gef\u00e4rbten Blutausstriches||6,00 \u20ac|\n|12.11||Z\u00e4hlung der Leuko- und Erythrozyten||Erythrozytenzahl und/oder H\u00e4matokrit und/|\noder H\u00e4moglobin und/oder mittleres Zell-\nvolumen (MCV) und die errechneten Kenn-\ngr\u00f6\u00dfen (zum Beispiel MCH, MCHC) und\ndie Erythrozytenverteilungskurve und/oder\nLeukozytenzahl und/oder Thrombozyten-\nzahl\n|3,00 \u20ac|\n|Differenzierung der Leukozyten, elektro-|\nnisch-zytometrisch, zytochemisch-zytome-\ntrisch oder mittels mechanisierter Muster-\nerkennung (Bildanalyse)\n|1,00 \u20ac|\n|12.12||Blutk\u00f6rperchen-Senkungsgeschwindigkeit einschl. Blutentnahme||3,00 \u20ac|\n|12.13||Einfache mikroskopische und/oder chemische Untersuchungen von K\u00f6rperfl\u00fcssigkeiten|\nund Ausscheidungen auch mit einfachen oder schwierigen F\u00e4rbeverfahren sowie Dun-\nkelfeld, pro Untersuchung\nAnmerkung: Die Art der Untersuchung ist anzugeben.\n|6,00 \u20ac|\n|12.14||Aufwendige Chemogramme von K\u00f6rperfl\u00fcssigkeiten und Ausscheidungen je nach|\nUmfang pro Einzeluntersuchung\nAnmerkung: Die Art der Untersuchung ist anzugeben.\n|7,00 \u20ac|\n|13 Sonstige Untersuchungen|\n|13.1||Sonstige Untersuchungen unter Zuhilfenahme spezieller Apparaturen oder F\u00e4rbeverfah-|\nren besonders schwieriger Art, zum Beispiel ph-Messungen im str\u00f6menden Blut oder\nUntersuchungen nach v. Bremer, Enderlein usw.\nAnmerkung: Die Art der Untersuchung ist anzugeben.\n|6,00 \u20ac|\n|14 Spezielle Untersuchungen|\n|14.1||Binokulare mikroskopische Untersuchung des Augenvordergrundes|\nAnmerkung: Eine Leistung nach Nummer 14.1 kann nicht neben einer Leistung nach Nummer 1 oder\nNummer 4 berechnet werden. Leistungen nach den Nummern 14.1 und 14.2 k\u00f6nnen nicht neben-\neinander berechnet werden.\n|8,00 \u20ac|\n|14.2||Binokulare Spiegelung des Augenhintergrundes|\nAnmerkung: Eine Leistung nach Nummer 14.1 kann nicht neben einer Leistung nach Nummer 1 oder\nNummer 4 berechnet werden. Leistungen nach den Nummern 14.1 und 14.2 k\u00f6nnen nicht neben-\neinander berechnet werden.\n|8,00 \u20ac|\n|14.3||Grundumsatzbestimmung nach Read||5,00 \u20ac|\n|14.4||Grundumsatzbestimmung mit Hilfe der Atemgasuntersuchung||20,00 \u20ac|\n|14.5||Pr\u00fcfung der Lungenkapazit\u00e4t (Spirometrische Untersuchung)||7,00 \u20ac|\n|14.6||Elektrokardiogramm mit Phonokardiogramm und Ergometrie, vollst\u00e4ndiges Programm||41,00 \u20ac|\n|14.7||Elektrokardiogramm mit Standardableitungen, Goldbergerableitungen, Nehbsche Ab-|\nleitungen, Brustwandableitungen\n|14,00 \u20ac|\n|14.8||Oszillogramm-Methoden||11,00 \u20ac|\n|14.9||Spezielle Herz-Kreislauf-Untersuchungen|\nAnmerkung: Nicht neben Nummer 1 oder Nummer 4 berechenbar.\n|8,00 \u20ac|\n|14.10||Ultraschall-Gef\u00e4\u00dfdoppler-Untersuchung zu peripheren Venendruck-/ oder Str\u00f6mungs-|\nmessungen\n|9,00 \u20ac|\n|17 Neurologische Untersuchungen|\n|17.1||Neurologische Untersuchung||21,00 \u20ac|\n|18 - 23 Spezielle Behandlungen|\n|20 Atemtherapie, Massagen|\n|20.1||Atemtherapeutische Behandlungsverfahren||8,00 \u20ac|\n|20.2||Nervenpunktmassage nach Cornelius, Aurelius u. a., Spezialnervenmassage||6,00 \u20ac|\n|20.3||Bindegewebsmassage||6,00 \u20ac|\n|20.4||Teilmassage (Massage einzelner K\u00f6rperteile)||4,00 \u20ac|\n|20.5||Gro\u00dfmassage||6,00 \u20ac|\n|20.6||Sondermassagen||Unterwasserdruckstrahlmassage (Wannen-|\ninhalt mindestens 400 Liter, Leistung der\nApparatur mindestens 4 bar)\n|8,00 \u20ac|\n|20.6||Sondermassagen||Massage im extramuskul\u00e4ren Bereich (zum|\nBeispiel Bindegewebsmassage, Periost-\nmassage, manuelle Lymphdrainage)\n|6,00 \u20ac|\n|Extensionsbehandlung mit Schr\u00e4gbett, Ex-|\ntensionstisch, Perlger\u00e4t\n|6,00 \u20ac|\n|20.7||Behandlung mit physikalischen oder medicomechanischen Apparaten||6,00 \u20ac|\n|20.8||Einreibungen zu therapeutischen Zwecken in die Haut||4,00 \u20ac|\n|21 Akupunktur|\n|21.1||Akupunktur einschlie\u00dflich Pulsdiagnose||23,00 \u20ac|\n|21.2||Moxibustionen, Injektionen und Quaddelungen in Akupunkturpunkte||7,00 \u20ac|\n|22 Inhalationen|\n|22.1||Inhalationen, soweit sie von der Heilpraktikerin/dem Heilpraktiker mit den verschiedenen|\nApparaten in der Sprechstunde ausgef\u00fchrt werden\n|3,00 \u20ac|\n|24 - 30 Blutentnahmen - Injektionen - Infusionen - Hautableitungsverfahren|\n|24 Eigenblut, Eigenharn|\n|24.1||Eigenblutinjektion||11,00 \u20ac|\n|25 Injektionen, Infusionen|\n|25.1||Injektion, subkutan||5,00 \u20ac|\n|25.2||Injektion, intramuskul\u00e4r||5,00 \u20ac|\n|25.3||Injektion, intraven\u00f6s, intraarteriell||7,00 \u20ac|\n|25.4||Intrakutane Reiztherapie (Quaddelbehandlung), pro Sitzung||7,00 \u20ac|\n|25.5||Injektion, intraartikul\u00e4r||11,50 \u20ac|\n|25.6||Neural- oder segmentgezielte Injektionen nach Hunecke||11,50 \u20ac|\n|25.7||Infusion||8,00 \u20ac|\n|25.8||Dauertropfeninfusion|\nAnmerkung: Die Beihilfef\u00e4higkeit der mit der Infusion eingebrachten Medikamente richtet sich nach\ndem Beihilferecht des jeweiligen Beihilfetr\u00e4gers.\n|12,50 \u20ac|\n|26 Blutentnahmen|\n|26.1||Blutentnahme||3,00 \u20ac|\n|26.2||Aderlass||12,00 \u20ac|\n|27 Hautableitungsverfahren, Hautreizverfahren|\n|27.1||Setzen von Blutegeln, ggf. einschl. Verband||5,00 \u20ac|\n|27.2||Skarifikation der Haut||4,00 \u20ac|\n|27.3||Setzen von Schr\u00f6pfk\u00f6pfen, unblutig||5,00 \u20ac|\n|27.4||Setzen von Schr\u00f6pfk\u00f6pfen, blutig||5,00 \u20ac|\n|27.5||Schr\u00f6pfkopfmassage einschl. Gleitmittel||5,00 \u20ac|\n|27.6||Anwendung gro\u00dfer Saugapparate f\u00fcr ganze Extremit\u00e4ten||5,00 \u20ac|\n|27.7||Setzen von Fontanellen||5,00 \u20ac|\n|27.8||Setzen von Cantharidenblasen||5,00 \u20ac|\n|27.9||Reinjektion des Blaseninhaltes (aus Nummer 27.8)||5,00 \u20ac|\n|27.10||Anwendung von Pustulantien||5,00 \u20ac|\n|27.12||Biersche Stauung||5,00 \u20ac|\n|28 Infiltrationen|\n|28.1||Behandlung mittels paravertebraler Infiltration, einmalig||9,00 \u20ac|\n|28.2||Behandlung mittels paravertebraler Infiltration, mehrmalig||15,00 \u20ac|\n|29 Roedersches Verfahren|\n|29.1||Roedersches Behandlungs- und Mandelabsaugverfahren||5,00 \u20ac|\n|30 Sonstiges|\n|30.1||Sp\u00fclung des Ohres||5,00 \u20ac|\n|31 Wundversorgung, Verb\u00e4nde und Verwandtes|\n|31.1||Er\u00f6ffnung eines oberfl\u00e4chlichen Abszesses||9,00 \u20ac|\n|31.2||Entfernung von Aknepusteln pro Sitzung||8,00 \u20ac|\n|32 Versorgung einer frischen Wunde|\n|32.1||bei einer kleinen Wunde||8,00 \u20ac|\n|32.2||bei einer gr\u00f6\u00dferen und verunreinigten Wunde||13,00 \u20ac|\n|33 Verb\u00e4nde (au\u00dfer zur Wundbehandlung)|\n|33.1||Verb\u00e4nde, jedes Mal||5,00 \u20ac|\n|33.2||Elastische St\u00fctz- und Pflasterverb\u00e4nde||7,00 \u20ac|\n|33.3||Kompressions- oder Zinkleimverband||10,00 \u20ac|\n|Anmerkung: Die Beihilfef\u00e4higkeit des f\u00fcr den Verband verbrauchten Materials richtet sich nach dem|\nBeihilferecht des jeweiligen Beihilfetr\u00e4gers.\n|34 Gelenk- und Wirbels\u00e4ulenbehandlung|\n|34.1||Chiropraktische Behandlung||4,00 \u20ac|\n|34.2||Gezielter chiropraktischer Eingriff an der Wirbels\u00e4ule|\nAnmerkung: Die Leistung nach Nummer 34.2 ist nur einmal je Sitzung berechnungsf\u00e4hig.\n|17,00 \u20ac|\n|35 Osteopathische Behandlung|\n|35.1||des Unterkiefers||11,00 \u20ac|\n|35.2||des Schultergelenkes und der Wirbels\u00e4ule||21,00 \u20ac|\n|35.3||der Handgelenke, des Oberschenkels, des Unterschenkels, des Vorderarmes und der|\nFu\u00dfgelenke\n|21,00 \u20ac|\n|35.4||des Schl\u00fcsselbeins und der Kniegelenke||12,00 \u20ac|\n|35.5||des Daumens||10,00 \u20ac|\n|35.6||einzelner Finger und Zehen||10,00 \u20ac|\n|36 Hydro- und Elektrotherapie, Medizinische B\u00e4der und sonstige hydrotherapeutische Anwendungen|\nAnmerkung: Alle nicht aufgef\u00fchrten B\u00e4der sind nicht beihilfef\u00e4hig.\n|36.1||Leitung eines ansteigenden Vollbades||7,00 \u20ac|\n|36.2||Leitung eines ansteigenden Teilbades||4,00 \u20ac|\n|36.3||Spezialdarmbad (subaquales Darmbad)||13,00 \u20ac|\n|36.4||Kneippsche G\u00fcsse||4,00 \u20ac|\n|37 Elektrische B\u00e4der und Hei\u00dfluftb\u00e4der|\nAnmerkung: Alle nicht aufgef\u00fchrten B\u00e4der sind nicht beihilfef\u00e4hig.\n|37.1||Teilhei\u00dfluftbad, zum Beispiel Kopf oder Arm||3,00 \u20ac|\n|37.2||Ganzhei\u00dfluftbad, zum Beispiel Rumpf oder Beine||5,00 \u20ac|\n|37.3||Hei\u00dfluftbad im geschlossenen Kasten||5,00 \u20ac|\n|37.4||Elektrisches Vierzellenbad||4,00 \u20ac|\n|37.5||Elektrisches Vollbad (Stangerbad)||8,00 \u20ac|\n|38 Spezialpackungen|\nAnmerkung: Alle nicht aufgef\u00fchrten Packungen sind nicht beihilfef\u00e4hig.\n|38.1||Fangopackungen||3,00 \u20ac|\n|38.2||Paraffinpackungen, \u00f6rtliche||3,00 \u20ac|\n|38.3||Paraffinganzpackungen||3,00 \u20ac|\n|38.4||Kneippsche Wickel- und Ganzpackungen, Prie\u00dfnitz- und Schlenzpackungen||3,00 \u20ac|\n|39 Elektro-physikalische Heilmethoden|\n|39.1||Einfache oder \u00f6rtliche Lichtbestrahlungen||3,00 \u20ac|\n|39.2||Ganzbestrahlungen||8,00 \u20ac|\n|39.4||Faradisation, Galvanisation und verwandte Verfahren (Schwellstromger\u00e4te)||4,00 \u20ac|\n|39.5||Anwendung der Influenzmaschine||4,00 \u20ac|\n|39.6||Anwendung von Heizsonnen (Infrarot)||4,00 \u20ac|\n|39.7||Verschorfung mit hei\u00dfer Luft und hei\u00dfen D\u00e4mpfen||8,00 \u20ac|\n|39.8||Behandlung mit hochgespannten Str\u00f6men, Hochfrequenzstr\u00f6men in Verbindung mit|\nverschiedenen Apparaten\n|3,00 \u20ac|\n|39.9||Langwellenbehandlung (Diathermie), Kurzwellen- und Mikrowellenbehandlung||3,00 \u20ac|\n|39.10||Magnetfeldtherapie mit besonderen Spezialapparaten||4,00 \u20ac|\n|39.11||Elektromechanische und elektrothermische Behandlung (je nach Aufwand und Dauer)||4,00 \u20ac|\n|39.12||Niederfrequente Reizstromtherapie, zum Beispiel Jono-Modulator||4,00 \u20ac|\n|39.13||Ultraschall-Behandlung||4,00 \u20ac|\nText in der Fassung des\n[Artikels 1 F\u00fcnfte Verordnung zur \u00c4nderung der Bundesbeihilfeverordnung V. v. 18. Juli 2014 BGBl. I S. 1154](/gesetz/11236/a188439.htm)m.W.v. 26. Juli 2014\nAnlage 3 (zu den\n[\u00a7\u00a7 18](https://www.buzer.de/gesetz/8634/a159949.htm) bis [21](https://www.buzer.de/gesetz/8634/a159952.htm)) Ambulant durchgef\u00fchrte psychotherapeutische Behandlungen und Ma\u00dfnahmen der psychosomatischen Grundversorgung\nAnlage 3 hat\n[5 fr\u00fchere Fassungen](/gesetz/8634/al159992.htm)und wird in [9 Vorschriften zitiert](/gesetz/8634/v159992.htm)\nAbschnitt 1 Psychotherapeutische Leistungen\n- 1.\n- Nicht beihilfef\u00e4hig sind Aufwendungen f\u00fcr:\n- a)\n- Familientherapie,\n- b)\n- Funktionelle Entspannung nach Marianne Fuchs,\n- c)\n- Gespr\u00e4chspsychotherapie (zum Beispiel nach Rogers),\n- d)\n- Gestalttherapie,\n- e)\n- K\u00f6rperbezogene Therapie,\n- f)\n- Konzentrative Bewegungstherapie,\n- g)\n- Logotherapie,\n- h)\n- Musiktherapie,\n- i)\n- Heileurhythmie,\n- j)\n- Psychodrama,\n- k)\n- Respiratorisches Biofeedback,\n- l)\n- Transaktionsanalyse.\n- 2.\n- Nicht zu den psychotherapeutischen Leistungen im Sinne der\n[\u00a7\u00a7 18](https://www.buzer.de/gesetz/8634/a159949.htm) [bis](https://www.buzer.de/s1.htm?a=18-21&ag=8634) [21](https://www.buzer.de/gesetz/8634/a159952.htm)geh\u00f6ren:\n- a)\n- Behandlungen, die zur schulischen, beruflichen oder sozialen Anpassung oder F\u00f6rderung bestimmt sind,\n- b)\n- Ma\u00dfnahmen der Erziehungs-, Ehe-, Familien-, Lebens-, Paar- oder Sexualberatung,\n- c)\n- Heilp\u00e4dagogische und \u00e4hnliche Ma\u00dfnahmen sowie\n- d)\n- Psychologische Ma\u00dfnahmen, die der Aufarbeitung und \u00dcberwindung sozialer Konflikte dienen.\nAbschnitt 2 Psychosomatische Grundversorgung\n- 1.\n- Aufwendungen f\u00fcr eine verbale Intervention sind nur beihilfef\u00e4hig, wenn die Behandlung durchgef\u00fchrt wird von einer Fach\u00e4rztin oder einem Facharzt f\u00fcr\n- a)\n- Allgemeinmedizin,\n- b)\n- Augenheilkunde,\n- c)\n- Frauenheilkunde und Geburtshilfe,\n- d)\n- Haut- und Geschlechtskrankheiten,\n- e)\n- Innere Medizin,\n- f)\n- Kinder- und Jugendlichenmedizin,\n- g)\n- Kinder- und Jugendpsychiatrie und -psychotherapie,\n- h)\n- Neurologie,\n- i)\n- Phoniatrie und P\u00e4daudiologie,\n- j)\n- Psychiatrie und Psychotherapie,\n- k)\n- Psychotherapeutische Medizin oder Psychosomatische Medizin und Psychotherapie oder\n- l)\n- Urologie.\n- 2.\n- Aufwendungen f\u00fcr \u00fcbende und suggestive Interventionen (autogenes Training, progressive Muskelrelaxation nach Jacobson, Hypnose) sind nur dann beihilfef\u00e4hig, wenn die Behandlung durchgef\u00fchrt wird von\n- a)\n- einer \u00c4rztin oder einem Arzt,\n- b)\n- einer Psychologischen Psychotherapeutin oder einem Psychologischen Psychotherapeuten,\n- c)\n- einer Kinder- und Jugendlichenpsychotherapeutin oder einem Kinder- und Jugendlichenpsychotherapeuten,\n- d)\n- einer Psychotherapeutin oder einem Psychotherapeuten.\nAbschnitt 3 Tiefenpsychologisch fundierte und analytische Psychotherapie\n- 1.\n- Leistungen der anerkannten Psychotherapieform tiefenpsychologisch fundierte oder analytische Psychotherapie d\u00fcrfen bei Personen, die das 18. Lebensjahr vollendet haben, nur von folgenden Personen erbracht werden:\n- a)\n- Psychotherapeutinnen und Psychotherapeuten mit einer Weiterbildung f\u00fcr die Behandlung von Erwachsenen in diesem Verfahren,\n- b)\n- Psychologischen Psychotherapeutinnen und Psychologischen Psychotherapeuten mit einer vertieften Ausbildung in diesem Verfahren.\n- 2.\n- Leistungen der anerkannten Psychotherapieform tiefenpsychologisch fundierte oder analytische Psychotherapie d\u00fcrfen bei Personen, die das 18. Lebensjahr noch nicht vollendet haben, nur von folgenden Personen erbracht werden:\n- a)\n- Psychotherapeutinnen und Psychotherapeuten mit einer Weiterbildung f\u00fcr die Behandlung von Kindern und Jugendlichen in diesem Verfahren,\n- b)\n- Psychologischen Psychotherapeutinnen und Psychologischen Psychotherapeuten mit einer vertieften Ausbildung in diesem Verfahren und einer Zusatzqualifikation f\u00fcr die Behandlung von Kindern und Jugendlichen, die die Anforderungen des\n[\u00a7 6 Absatz 4](https://www.buzer.de/gesetz/8634/a159937.htm)der Psychotherapievereinbarung erf\u00fcllt,\n- c)\n- Kinder- und Jugendlichenpsychotherapeutinnen und Kinder- und Jugendlichenpsychotherapeuten mit einer vertieften Ausbildung in diesem Verfahren.\n- 3.\n- Wird die Behandlung von einer \u00e4rztlichen Psychotherapeutin oder einem \u00e4rztlichen Psychotherapeuten durchgef\u00fchrt, muss diese Person Fach\u00e4rztin oder Facharzt f\u00fcr eines der folgenden Fachgebiete sein:\n- a)\n- Psychotherapeutische Medizin,\n- b)\n- Psychiatrie und Psychotherapie oder Psychosomatische Medizin und Psychotherapie,\n- c)\n- Kinder- und Jugendlichenpsychiatrie und -psychotherapie oder\n- d)\n- \u00c4rztin oder Arzt mit der Bereichs- oder Zusatzbezeichnung \u201ePsychotherapie\" oder \u201ePsychoanalyse\".\n[Geb\u00fchrenordnung f\u00fcr \u00c4rzte](https://www.buzer.de/gesetz/5678/index.htm)) durchf\u00fchren. Eine \u00c4rztin oder ein Arzt mit der Bereichs- oder Zusatzbezeichnung \u201ePsychoanalyse\" oder mit der vor dem 1. April 1984 verliehenen Bereichsbezeichnung \u201ePsychotherapie\" kann auch analytische Psychotherapie (Nummern 863 und 864 der Anlage zur [Geb\u00fchrenordnung f\u00fcr \u00c4rzte](https://www.buzer.de/gesetz/5678/index.htm)) durchf\u00fchren.\n- 4.\n- Voraussetzung f\u00fcr die Beihilfef\u00e4higkeit der Aufwendungen in Ausnahmef\u00e4llen (\n[\u00a7 19 Absatz 1 Nummer 3 und 4](https://www.buzer.de/gesetz/8634/a159950.htm)) ist, dass vor Beginn der Behandlung eine erneute eingehende Begr\u00fcndung der Therapeutin oder des Therapeuten vorgelegt wird und die Festsetzungsstelle vor Beginn der Behandlung zugestimmt hat. Zeigt sich bei der Therapie, dass das Behandlungsziel innerhalb der vorgesehenen Anzahl der Sitzungen nicht erreicht wird, kann in Ausnahmef\u00e4llen eine weitere begrenzte Behandlungsdauer anerkannt werden. Die Anerkennung darf erst im letzten Behandlungsabschnitt erfolgen. Voraussetzung f\u00fcr die Anerkennung ist eine Indikation nach [\u00a7 18a Absatz 1 und 2](https://www.buzer.de/gesetz/8634/a188444.htm), die nach ihrer besonderen Symptomatik und Struktur eine besondere tiefenpsychologisch fundierte oder analytische Bearbeitung erfordert und eine hinreichende Prognose \u00fcber das Erreichen des Behandlungsziels erlaubt.\nAbschnitt 4 Verhaltenstherapie\n- 1.\n- Leistungen der Verhaltenstherapie d\u00fcrfen bei Personen, die das 18. Lebensjahr vollendet haben, nur von folgenden Personen erbracht werden:\n- a)\n- Psychotherapeutinnen und Psychotherapeuten mit einer Weiterbildung f\u00fcr die Behandlung von Erwachsenen in diesem Verfahren,\n- b)\n- Psychologischen Psychotherapeutinnen und Psychologischen Psychotherapeuten mit einer vertieften Ausbildung in diesem Verfahren.\n- 2.\n- Leistungen der Verhaltenstherapie d\u00fcrfen bei Personen, die das 18. Lebensjahr noch nicht vollendet haben, nur von folgenden Personen erbracht werden:\n- a)\n- Psychotherapeutinnen und Psychotherapeuten mit einer Weiterbildung f\u00fcr die Behandlung von Kindern und Jugendlichen in diesem Verfahren,\n- b)\n- Psychologischen Psychotherapeutinnen und Psychologischen Psychotherapeuten mit einer vertieften Ausbildung in diesem Verfahren und einer Zusatzqualifikation f\u00fcr die Behandlung von Kindern- und Jugendlichen, die die Anforderungen des\n[\u00a7 6 Absatz 4](https://www.buzer.de/gesetz/8634/a159937.htm)der Psychotherapeutenvereinbarung erf\u00fcllt,\n- c)\n- Kinder- und Jugendlichenpsychotherapeutinnen und Kinder- und Jugendlichenpsychotherapeuten mit einer vertieften Ausbildung in diesem Verfahren.\n- 3.\n- Wird die Behandlung von einer \u00e4rztlichen Psychotherapeutin oder einem \u00e4rztlichen Psychotherapeuten durchgef\u00fchrt, muss diese Person Fach\u00e4rztin oder Facharzt f\u00fcr eines der folgenden Fachgebiete sein:\n- a)\n- Psychotherapeutische Medizin oder Psychosomatische Medizin,\n- b)\n- Psychiatrie und Psychotherapie,\n- c)\n- Kinder- und Jugendlichenpsychiatrie und -psychotherapie oder\n- d)\n- \u00c4rztin oder Arzt mit der Bereichs- oder Zusatzbezeichnung \u201ePsychotherapie\".\nAbschnitt 5 Systemische Therapie\n- 1.\n- Leistungen der Systemischen Therapie d\u00fcrfen nur von folgenden Personen erbracht werden:\n- a)\n- Psychotherapeutinnen und Psychotherapeuten mit einer Weiterbildung in diesem Verfahren,\n- b)\n- Psychologischen Psychotherapeutinnen und Psychologischen Psychotherapeuten mit einer vertieften Ausbildung in diesem Verfahren,\n- c)\n- Psychologischen Psychotherapeutinnen und Psychologischen Psychotherapeuten mit einer vertieften Ausbildung in einem Verfahren nach Abschnitt 3 oder 4 und einer Zusatzqualifikation f\u00fcr dieses Verfahren, die die Anforderungen des\n[\u00a7 6 Absatz 8](https://www.buzer.de/gesetz/8634/a159937.htm)der Psychotherapievereinbarung erf\u00fcllt.\n- 2.\n- Wird die Behandlung von einer \u00e4rztlichen Psychotherapeutin oder einem \u00e4rztlichen Psychotherapeuten durchgef\u00fchrt, muss diese Person Fach\u00e4rztin oder Facharzt f\u00fcr eines der folgenden Fachgebiete sein:\n- a)\n- Psychiatrie und Psychotherapie,\n- b)\n- Psychosomatische Medizin und Psychotherapie oder\n- c)\n- \u00c4rztin oder Arzt mit der Zusatzbezeichnung \u201ePsychotherapie\" mit erfolgreicher Weiterbildung auf dem Gebiet der Systemischen Therapie.\nAbschnitt 6 Eye-Movement-Desensitization-and-Reprocessing-Behandlung\n- 1.\n- Leistungen der Eye-Movement-Desensitization-and-Reprocessing-Behandlung d\u00fcrfen nur von folgenden Personen erbracht werden:\n- a)\n- Psychotherapeutinnen und Psychotherapeuten mit einer Weiterbildung in einem Verfahren nach Abschnitt 3 oder 4,\n- b)\n- Psychologischen Psychotherapeutinnen und Psychologischen Psychotherapeuten mit einer vertieften Ausbildung in einem Verfahren nach Abschnitt 3 oder 4.\n- 2.\n- Wird die Behandlung von einer Psychologischen Psychotherapeutin oder einem Psychologischen Psychotherapeuten, einer Psychotherapeutin oder einem Psychotherapeuten durchgef\u00fchrt, muss diese Person Kenntnisse und praktische Erfahrungen in der Behandlung der posttraumatischen Belastungsst\u00f6rung und in der Eye-Movement-Desensitization-and-Reprocessing-Behandlung erworben haben.\n- 3.\n- Wurde die Qualifikation nach Nummer 1 oder Nummer 2 bei Psychologischen Psychotherapeutinnen oder Psychologischen Psychotherapeuten nicht im Rahmen der Ausbildung und bei Psychotherapeutinnen oder Psychotherapeuten nicht im Rahmen der Weiterbildung erworben, muss die behandelnde Person\n- a)\n- in mindestens 40 Stunden eingehende Kenntnisse in der Theorie der Traumabehandlung und der Eye-Movement-Desensitization-and-Reprocessing-Behandlung erworben haben und\n- b)\n- mindestens 40 Stunden Einzeltherapie mit mindestens f\u00fcnf abgeschlossenen Eye-Movement-Desensitizationand-Reprocessing-Behandlungsabschnitten unter Supervision von mindestens 10 Stunden mit Eye-Movement-Desensitization-and-Reprocessing-Behandlung durchgef\u00fchrt haben.\n- 4.\n- Wird die Behandlung von einer \u00e4rztlichen Psychotherapeutin oder einem \u00e4rztlichen Psychotherapeuten durchgef\u00fchrt, muss diese Person\n- a)\n- die Voraussetzungen nach Abschnitt 3 oder 4 erf\u00fcllen und\n- b)\n- Kenntnisse und praktische Erfahrungen in der Behandlung der posttraumatischen Belastungsst\u00f6rung und in der Eye-Movement-Desensitization-and-Reprocessing-Behandlung erworben haben.\nText in der Fassung des\n[Artikels 1 Neunte Verordnung zur \u00c4nderung der Bundesbeihilfeverordnung V. v. 1. Dezember 2020 BGBl. I S. 2713, 2021 I 343](/gesetz/14293/a255242.htm)m.W.v. 1. Januar 2021\nAnlage 4 (zu\n[\u00a7 22 Absatz 1](https://www.buzer.de/gesetz/8634/a159953.htm)) Beihilfef\u00e4hige Medizinprodukte\nAnlage 4 hat\n[6 fr\u00fchere Fassungen](/gesetz/8634/al177730.htm)und wird in [13 Vorschriften zitiert](/gesetz/8634/v177730.htm)\n|Nr.||Produktbezeichnung||Medizinische Anwendungsf\u00e4lle |\n|0 |\n|1xklysma salinisch||Zur raschen und nachhaltigen Entleerung des Enddarms vor Ope-|\nrationen und diagnostischen Eingriffen; nicht zur Anwendung bei\nPersonen, die das sechste Lebensjahr noch nicht vollendet haben.\n|1 |\n|1.1||ALCON BSS||Zur Irrigation im Rahmen extraokularer und intraokularer Eingriffe. |\n|1.2||AMO |\nENDOSOL\n|F\u00fcr intraokulare und topische Sp\u00fclungen des Auges bei chirur-|\ngischen Prozeduren und f\u00fcr diagnostische und therapeutische\nMa\u00dfnahmen.\n|1.3||Ampuwa |\nf\u00fcr Sp\u00fclzwecke\n|Zum Anfeuchten von Tamponaden und Verb\u00e4nden; zur Atemluft-|\nbefeuchtung nur zur Anwendung in geschlossenen Systemen in\nmedizinisch notwendigen F\u00e4llen; jeweils in einer Menge, die aus-\nschlie\u00dflich f\u00fcr die einmalige Anwendung geeignet ist.\n|1.4||Amvisc||Zur Anwendung als Operationshilfe bei ophthalmischen Eingriffen |\nam vorderen Augenabschnitt.\n|1.5||Amvisc Plus||Zur Anwendung als Operationshilfe bei ophthalmischen Eingriffen |\nam vorderen Augenabschnitt.\n|1.6||Aqua B. Braun||Zur Sp\u00fclung und Reinigung bei operativen Eingriffen, zur Sp\u00fclung |\nvon Wunden und Verbrennungen, zum Anfeuchten von Wundtam-\nponaden, T\u00fcchern und Verb\u00e4nden, zur \u00dcberpr\u00fcfung der Durchl\u00e4s-\nsigkeit von Blasenkathetern und zur mechanischen Augensp\u00fclung.\n|2 |\n|2.1||Bausch & Lomb Balanced Salt |\nSolution\n|Zur Irrigation im Rahmen extraokularer und intraokularer Eingriffe. |\n|2.2||BD PosiFlushSP||Ausschlie\u00dflich zur Sp\u00fclung von In-situ-Gef\u00e4\u00dfzugangssystemen; |\nnicht in einem sterilen Umfeld verwendbar.\n|2.3||BD PosiFlushXS||Ausschlie\u00dflich zum Sp\u00fclen von In-situ-Gef\u00e4\u00dfzugangssystemen, bei |\nVerwendung aseptischer Technik in einem sterilen Umfeld.\n|2.4||belAir |\nNaCl 0,9 %\n|Als isotone Tr\u00e4gerl\u00f6sung bei der Verwendung von Inhalaten in Ver-|\nneblern oder Aerosolger\u00e4ten. Dies gilt nur f\u00fcr die F\u00e4lle, in denen der\nZusatz einer isotonen Tr\u00e4gerl\u00f6sung in der Fachinformation des\narzneistoffhaltigen Inhalats zwingend vorgesehen ist.\n|2.5||BSS DISTRA-SOL||Zur Sp\u00fclung der Vorderkammer w\u00e4hrend Kataraktoperationen und |\nanderer intraokularer Eingriffe.\n|2.6||BSS PLUS |\n(Alcon Pharma GmbH)\n|Als intraokulare Sp\u00fcll\u00f6sung bei chirurgischen Eingriffen im Auge, |\nbei denen eine intraokulare Perfusion erforderlich ist.\n|2.7||BSS STERILE SP\u00dcLL\u00d6SUNG |\n(Alcon Pharma GmbH)\n|Zur Irrigation im Rahmen extraokularer und intraokularer Eingriffe. |\n|3 unbesetzt |\n|4 |\n|4.1||Dimet 20||Behandlung des Kopfhaares bei Pediculosis capitis bei Personen, |\ndie\na) das zw\u00f6lfte Lebensjahr noch nicht vollendet haben,\nb) das zw\u00f6lfte, aber noch nicht das 18. Lebensjahr vollendet haben\nund an Entwicklungsst\u00f6rungen leiden.\n|4.2||Dk-line||Zur Anwendung als Operationshilfe in der Ophthalmochirurgie, zur |\nmechanischen Netzhautentfaltung nach Netzhautabl\u00f6sungen/PVR/\nPDR, Riesenrissen oder okularen Traumata sowie zur vereinfachten\nEntfernung subluxierter Linsen und Fremdk\u00f6rper aus dem Glas-\nk\u00f6rperraum.\n|4.3||DuoVisc||Zur Anwendung als Operationshilfe in der Ophthalmochirurgie des |\nvorderen Augenabschnitts bei Kataraktextraktion und Implantation\neiner Intraokularlinse.\n|5 |\n|5.1||EtoPril||Behandlung des Kopfhaares bei Pediculosis capitis bei Personen, |\ndie\na) das zw\u00f6lfte Lebensjahr noch nicht vollendet haben,\nb) das zw\u00f6lfte, aber noch nicht das 18. Lebensjahr vollendet haben\nund an Entwicklungsst\u00f6rungen leiden.\n|5.2||Eye-Lotion |\nBalanced Salt Solution\n|Zur Irrigation im Rahmen extraokularer und intraokularer Eingriffe. |\n|6 |\n|6.1||Freka-Clyss||Behandlung |\na) der Obstipation im Zusammenhang mit Tumorleiden, Megacolon\n(mit Ausnahme des toxischen Megacolons), Divertikulose,\nMukoviszidose oder neurogener Darml\u00e4hmung,\nb) vor diagnostischen Eingriffen,\nc) bei Opiat- sowie Opioidtherapie und\nd) in der Terminalphase\nbei Personen, die das zw\u00f6lfte Lebensjahr vollendet haben.\nBehandlung der Obstipation, zur raschen und nachhaltigen Ent-\nleerung des Enddarms vor Operationen, zur Vorbereitung von uro-\nlogischen, r\u00f6ntgenologischen und gyn\u00e4kologischen Untersuchun-\ngen sowie vor Rektoskopien bei Personen, die das zw\u00f6lfte, aber\nnoch nicht das 18. Lebensjahr vollendet haben und an Entwick-\nlungsst\u00f6rungen leiden.\n|6.2||Freka Drainjet NaCl 0,9 %||Zur internen und externen Anwendung wie Perfusion des extra-|\nkorporalen Systems bei der H\u00e4modialyse, postoperative Blasen-\nsp\u00fclung bei allen urologischen Eingriffen, Sp\u00fclungen im Magen-\nDarm-Trakt und von Fisteln und Drainagen. Auch zur Wundbehand-\nlung und zum Anfeuchten von T\u00fcchern und Verb\u00e4nden.\n|6.3||Freka Drainjet |\nPurisole SM verd\u00fcnnt\n|Zur intraoperativen und postoperativen Blasensp\u00fclung bei urologi-|\nschen Eingriffen.\n|7 unbesetzt |\n|8 |\n|8.1||Healon||F\u00fcr die intraokulare Verwendung bei Augenoperationen. |\n|8.2||Healon5||Als viskoelastische L\u00f6sung f\u00fcr die intraokulare Verwendung bei |\nOperationen am vorderen Augenabschnitt.\n|8.3||Healon GV||Als viskoelastische L\u00f6sung f\u00fcr die intraokulare Verwendung bei |\nOperationen am vorderen Augenabschnitt.\n|8.4||Hedrin Once Liquid Gel||Behandlung des Kopfhaares bei Pediculosis capitis bei Personen, |\ndie\na) den sechsten Lebensmonat, aber noch nicht das zw\u00f6lfte Lebens-\njahr vollendet haben,\nb) das zw\u00f6lfte, aber noch nicht das 18. Lebensjahr vollendet haben\nund an Entwicklungsst\u00f6rungen leiden.\n|8.5||HSO||Zur Anwendung als Operationshilfe bei ophthalmischen Eingriffen |\nam vorderen und hinteren Augenabschnitt.\n|8.6||HSO Plus||Zur Anwendung als Operationshilfe bei ophthalmischen Eingriffen |\nam vorderen und hinteren Augenabschnitt.\n|8.7||Hylo-Gel||Als synthetische Tr\u00e4nenfl\u00fcssigkeit bei Autoimmunerkrankungen |\n(Sj\u00f6gren-Syndrom mit deutlichen Funktionsst\u00f6rungen [trockenes\nAuge Grad 2], Epidermolysis bulosa, okulares Pemphigoid), Fehlen\noder Sch\u00e4digung der Tr\u00e4nendr\u00fcse, Fazialisparese oder bei\nLagophthalmus.\n|9 |\n|9.1||InstillaGel Lubri||Zur Anwendung bei Personen mit Katheterisierung. |\n|9.2||IsoFree||Als Tr\u00e4gerl\u00f6sung bei der Verwendung von Inhalaten in Verneblern |\noder Aerosolger\u00e4ten, wenn der Zusatz einer isotonen Tr\u00e4gerl\u00f6sung\nin der Fachinformation des arzneistoffhaltigen Inhalats zwingend\nvorgesehen ist.\n|9.3||ISOMOL||Behandlung |\na) der Obstipation im Zusammenhang mit Tumorleiden, Megacolon\n(mit Ausnahme des toxischen Megacolons), Divertikulose,\nDivertikulitis, Mukoviszidose oder neurogener Darml\u00e4hmung,\nb) bei phosphatbindender Medikation bei chronischer Nieren-\ninsuffizienz,\nc) bei Opiat- sowie Opioidtherapie und\nd) in der Terminalphase\nbei Personen, die das zw\u00f6lfte Lebensjahr vollendet haben.\nBehandlung der Obstipation bei Personen, die das zw\u00f6lfte, aber\nnoch nicht das 18. Lebensjahr vollendet haben und an Entwick-\nlungsst\u00f6rungen leiden.\n|9.4||Isotonische Kochsalzl\u00f6sung zur |\nInhalation (Eifelfango)\n|Als Tr\u00e4gerl\u00f6sung bei der Verwendung von Inhalaten in Verneblern |\noder Aerosolger\u00e4ten, wenn der Zusatz einer isotonen Tr\u00e4gerl\u00f6sung\nin der Fachinformation des arzneistoffhaltigen Inhalats zwingend\nvorgesehen ist.\n|10 unbesetzt |\n|11 |\n|11.1||Kinderlax elektrolytfrei||Zur Behandlung der Obstipation f\u00fcr Personen, die den f\u00fcnften |\nLebensmonat, aber noch nicht das zw\u00f6lfte Lebensjahr vollendet\nhaben.\n|11.2||Klistier Fresenius||Behandlung |\na) der Obstipation im Zusammenhang mit Tumorleiden, Megacolon\n(mit Ausnahme des kongenitalen Megacolons), Divertikulose,\nMukoviszidose oder neurogener Darml\u00e4hmung,\nb) vor diagnostischen Eingriffen,\nc) bei Opiat- sowie Opioidtherapie und\nd) in der Terminalphase\nbei Personen, die das zw\u00f6lfte Lebensjahr vollendet haben.\nBehandlung der Obstipation, zur raschen und nachhaltigen Ent-\nleerung des Enddarms vor Operationen, zur Vorbereitung von uro-\nlogischen, r\u00f6ntgenologischen und gyn\u00e4kologischen Untersuchun-\ngen sowie vor Rektoskopien bei Personen, die das zw\u00f6lfte, aber\nnoch nicht das 18. Lebensjahr vollendet haben und an Entwick-\nlungsst\u00f6rungen leiden.\n|11.3||Kochsalz 0,9 % |\nInhalat P\u00e4dia\n|Als Tr\u00e4gerl\u00f6sung bei der Verwendung von Inhalaten in Verneblern |\noder Aerosolger\u00e4ten, wenn der Zusatz einer Tr\u00e4gerl\u00f6sung in der\nFachinformation des arzneistoffhaltigen Inhalats zwingend vorge-\nsehen ist.\n|12 unbesetzt |\n|13 |\n|13.1||Macrogol AbZ||Behandlung |\na) der Obstipation im Zusammenhang mit Tumorleiden, Megacolon\n(mit Ausnahme des toxischen Megacolons), Divertikulose,\nDivertikulitis, Mukoviszidose oder neurogener Darml\u00e4hmung,\nb) bei phosphatbindender Medikation bei chronischer Nieren-\ninsuffizienz,\nc) bei Opiat- sowie Opioidtherapie und\nd) in der Terminalphase\nbei Personen, die das zw\u00f6lfte Lebensjahr vollendet haben.\nBehandlung der Obstipation bei Personen, die das zw\u00f6lfte, aber\nnoch nicht das 18. Lebensjahr vollendet haben und an Entwick-\nlungsst\u00f6rungen leiden.\n|13.2||Macrogol dura||Behandlung |\na) der Obstipation im Zusammenhang mit Tumorleiden, Megacolon\n(mit Ausnahme des toxischen Megacolons), Divertikulose,\nDivertikulitis, Mukoviszidose oder neurogener Darml\u00e4hmung,\nb) bei phosphatbindender Medikation bei chronischer Nieren-\ninsuffizienz,\nc) bei Opiat- sowie Opioidtherapie und\nd) in der Terminalphase\nbei Personen, die das zw\u00f6lfte Lebensjahr vollendet haben.\nBehandlung der Obstipation bei Personen, die das zw\u00f6lfte, aber\nnoch nicht das 18. Lebensjahr vollendet haben und an Entwick-\nlungsst\u00f6rungen leiden.\n|13.3||Macrogolratiopharm||Behandlung |\na) der Obstipation im Zusammenhang mit Tumorleiden, Megacolon\n(mit Ausnahme des toxischen Megacolons), Divertikulose,\nDivertikulitis, Mukoviszidose oder neurogener Darml\u00e4hmung,\nb) bei phosphatbindender Medikation bei chronischer Nieren-\ninsuffizienz,\nc) bei Opiat- sowie Opioidtherapie und\nd) in der Terminalphase\nbei Personen, die das zw\u00f6lfte Lebensjahr vollendet haben.\nBehandlung der Obstipation bei Personen, die das zw\u00f6lfte, aber\nnoch nicht das 18. Lebensjahr vollendet haben und an Entwick-\nlungsst\u00f6rungen leiden.\n|13.4||Macrogolratiopharm fl\u00fcssig Orange||Behandlung |\na) der Obstipation im Zusammenhang mit Tumorleiden, Megacolon\n(mit Ausnahme des toxischen Megacolons), Divertikulose,\nDivertikulitis, Mukoviszidose oder neurogener Darml\u00e4hmung,\nb) bei phosphatbindender Medikation bei chronischer Nieren-\ninsuffizienz,\nc) bei Opiat- sowie Opioidtherapie und\nd) in der Terminalphase\nbei Personen, die das zw\u00f6lfte Lebensjahr vollendet haben.\nBehandlung der Obstipation bei Personen, die das zw\u00f6lfte, aber\nnoch nicht das 18. Lebensjahr vollendet haben und an Entwick-\nlungsst\u00f6rungen leiden.\n|13.5||Macrogol TAD||Behandlung |\na) der Obstipation im Zusammenhang mit Tumorleiden, Megacolon\n(mit Ausnahme des toxischen Megacolons), Divertikulose,\nDivertikulitis, Mukoviszidose oder neurogener Darml\u00e4hmung,\nb) bei phosphatbindender Medikation bei chronischer Nieren-\ninsuffizienz,\nc) bei Opiat- sowie Opioidtherapie und\nd) in der Terminalphase\nbei Personen, die das zw\u00f6lfte Lebensjahr vollendet haben.\nBehandlung der Obstipation bei Personen, die das zw\u00f6lfte, aber\nnoch nicht das 18. Lebensjahr vollendet haben und an Entwick-\nlungsst\u00f6rungen leiden.\n|13.6||Medicoforum Laxativ||Behandlung |\na) der Obstipation im Zusammenhang mit Tumorleiden, Megacolon\n(mit Ausnahme des toxischen Megacolons), Divertikulose,\nDivertikulitis, Mukoviszidose oder neurogener Darml\u00e4hmung,\nb) bei phosphatbindender Medikation bei chronischer Nieren-\ninsuffizienz,\nc) bei Opiat- sowie Opioidtherapie und\nd) in der Terminalphase\nbei Personen, die das zw\u00f6lfte Lebensjahr vollendet haben.\nBehandlung der Obstipation bei Personen, die das zw\u00f6lfte, aber\nnoch nicht das 18. Lebensjahr vollendet haben und an Entwick-\nlungsst\u00f6rungen leiden.\n|13.7||Microvisc plus||Zur Anwendung als Operationshilfe in der Opthalmochirurgie des |\nvorderen Augenabschnitts.\n|13.8||Mosquito med L\u00e4use-Shampoo||Behandlung des Kopfhaares bei Pediculosis capitis bei Personen, |\ndie\na) das zw\u00f6lfte Lebensjahr noch nicht vollendet haben,\nb) das zw\u00f6lfte, aber noch nicht das 18. Lebensjahr vollendet haben\nund an Entwicklungsst\u00f6rungen leiden.\n|13.9||Mosquito med L\u00e4use-Shampoo 10||Behandlung des Kopfhaares bei Pediculosis capitis bei Personen, |\ndie\na) das zw\u00f6lfte Lebensjahr noch nicht vollendet haben,\nb) das zw\u00f6lfte, aber noch nicht das 18. Lebensjahr vollendet haben\nund an Entwicklungsst\u00f6rungen leiden.\n|13.10||MOVICOL||Behandlung |\na) der Obstipation im Zusammenhang mit Tumorleiden, Megacolon\n(mit Ausnahme des toxischen Megacolons), Divertikulose,\nDivertikulitis, Mukoviszidose oder neurogener Darml\u00e4hmung,\nb) bei phosphatbindender Medikation der chronischen Nieren-\ninsuffizienz,\nc) bei Opiat- oder Opioidtherapie und\nd) in der Terminalphase\nbei Personen, die das zw\u00f6lfte Lebensjahr vollendet haben.\nBehandlung der Obstipation bei Personen, die das zw\u00f6lfte, aber\nnoch nicht das 18. Lebensjahr vollendet haben und an Entwick-\nlungsst\u00f6rungen leiden.\n|13.11||MOVICOL aromafrei||Behandlung |\na) der Obstipation im Zusammenhang mit Tumorleiden, Megacolon\n(mit Ausnahme des toxischen Megacolons), Divertikulose,\nDivertikulitis, Mukoviszidose oder neurogener Darml\u00e4hmung,\nb) bei phosphatbindender Medikation bei chronischer Nieren-\ninsuffizienz,\nc) bei Opiat- sowie Opioidtherapie und\nd) in der Terminalphase\nbei Personen, die das zw\u00f6lfte Lebensjahr vollendet haben.\nBehandlung der Obstipation bei Personen, die das zw\u00f6lfte, aber\nnoch nicht das 18. Lebensjahr vollendet haben und an Entwick-\nlungsst\u00f6rungen leiden.\n|13.12||MOVICOL fl\u00fcssig Orange||Behandlung |\na) der Obstipation im Zusammenhang mit Tumorleiden, Megacolon\n(mit Ausnahme des toxischen Megacolons), Divertikulose,\nDivertikulitis, Mukoviszidose oder neurogener Darml\u00e4hmung,\nb) bei phosphatbindender Medikation bei chronischer Nieren-\ninsuffizienz,\nc) bei Opiat- sowie Opioidtherapie und\nd) in der Terminalphase\nbei Personen, die das zw\u00f6lfte Lebensjahr vollendet haben.\nBehandlung der Obstipation bei Personen, die das zw\u00f6lfte, aber\nnoch nicht das 18. Lebensjahr vollendet haben und an Entwick-\nlungsst\u00f6rungen leiden.\n|13.13||MOVICOL Junior aromafrei||Behandlung der Obstipation bei Personen, die das zweite, aber |\nnoch nicht das elfte Lebensjahr vollendet haben.\nBehandlung der Koprostase bei Personen, die das f\u00fcnfte, aber noch\nnicht das elfte Lebensjahr vollendet haben.\n|13.14||MOVICOL Junior Schoko||Behandlung der Obstipation bei Personen, die das zweite, aber |\nnoch nicht das elfte Lebensjahr vollendet haben.\n|13.15||MOVICOL Schoko||Behandlung |\na) der Obstipation im Zusammenhang mit Tumorleiden, Megacolon\n(mit Ausnahme des toxischen Megacolons), Divertikulose,\nDivertikulitis, Mukoviszidose oder neurogener Darml\u00e4hmung,\nb) bei phosphatbindender Medikation bei chronischer Nieren-\ninsuffizienz,\nc) bei Opiat- sowie Opioidtherapie und\nd) in der Terminalphase\nbei Personen, die das zw\u00f6lfte Lebensjahr vollendet haben.\nBehandlung der Obstipation bei Personen, die das zw\u00f6lfte, aber\nnoch nicht das 18. Lebensjahr vollendet haben und an Entwick-\nlungsst\u00f6rungen leiden.\n|13.16||MOVICOL V||Behandlung |\na) der Obstipation im Zusammenhang mit Tumorleiden, Megacolon\n(mit Ausnahme des toxischen Megacolons), Divertikulose,\nDivertikulitis, Mukoviszidose oder neurogener Darml\u00e4hmung,\nb) bei phosphatbindender Medikation bei chronischer Nieren-\ninsuffizienz,\nc) bei Opiat- sowie Opioidtherapie und\nd) in der Terminalphase\nbei Personen, die das zw\u00f6lfte Lebensjahr vollendet haben.\nBehandlung der Obstipation bei Personen, die das zw\u00f6lfte, aber\nnoch nicht das 18. Lebensjahr vollendet haben und an Entwick-\nlungsst\u00f6rungen leiden.\n|13.17||MucoClear 6 %||Zur symptomatischen Inhalationsbehandlung der Mukoviszidose |\nbei Personen, die das f\u00fcnfte Lebensjahr vollendet haben.\n|13.18||myVISC Hyal 1.0||Zur Anwendung als Operationshilfe in der Opthalmochirurgie des |\nvorderen Augenabschnitts.\n|14 |\n|14.1||NaCl 0,9 % B. Braun||Zur Sp\u00fclung und Reinigung bei operativen Eingriffen, zur Sp\u00fclung |\nvon Wunden und Verbrennungen, zum Anfeuchten von Wund-\ntamponaden, T\u00fcchern und Verb\u00e4nden, zur \u00dcberpr\u00fcfung der Durch-\nl\u00e4ssigkeit von Blasenkathetern sowie zur mechanischen Augen-\nsp\u00fclung.\n|14.2||NaCl 0,9 % Fresenius Kabi||Zur internen und externen Anwendung wie Perfusion des extra-|\nkorporalen Systems bei der H\u00e4modialyse, der postoperativen\nBlasensp\u00fclung bei allen urologischen Eingriffen, Sp\u00fclungen im\nMagen-Darm-Trakt und von Fisteln und Drainagen. Auch zur Wund-\nbehandlung und zum Anfeuchten von T\u00fcchern und Verb\u00e4nden;\njeweils in einer Menge, die ausschlie\u00dflich f\u00fcr die einmalige An-\nwendung geeignet ist.\n|14.3||Natriumchlorid-L\u00f6sung |\n6 % zur Inhalation\n|Zur symptomatischen Inhalationsbehandlung der Mukoviszidose |\nbei Personen, die das sechste Lebensjahr vollendet haben.\n|14.4||Nebusal 7 %||Zur symptomatischen Inhalationsbehandlung der Mukoviszidose |\nbei Personen, die das sechste Lebensjahr vollendet haben.\n|14.5||NYDA||Behandlung des Kopfhaares bei Pediculosis capitis bei Personen, |\ndie\na) das zw\u00f6lfte Lebensjahr noch nicht vollendet haben,\nb) das zw\u00f6lfte, aber noch nicht das 18. Lebensjahr vollendet haben\nund an Entwicklungsst\u00f6rungen leiden.\n|14.6||NYDA L\u00e4usespray||Behandlung des Kopfhaares bei Pediculosis capitis bei Personen, |\ndie\na) das zw\u00f6lfte Lebensjahr noch nicht vollendet haben,\nb) das zw\u00f6lfte, aber noch nicht das 18. Lebensjahr vollendet haben\nund an Entwicklungsst\u00f6rungen leiden.\n|15 |\n|15.1||OcuCoat||Zur Anwendung als Operationshilfe in der Ophthalmochirurgie des |\nvorderen Augenabschnitts.\n|15.2||Oculentis BSS||Zur Irrigation im Rahmen extraokularer und intraokularer Eingriffe. |\n|15.3||Okta-line||Zur Anwendung als Operationshilfe in der Ophthalmochirurgie, zur |\nmechanischen Netzhautentfaltung nach Netzhautabl\u00f6sungen/PVR/\nPDR, Riesenrissen, okularen Traumata sowie zur vereinfachten Ent-\nfernung subluxierter Linsen und Fremdk\u00f6rper aus dem Glask\u00f6rper-\nraum.\n|15.4||Optyluron NHS 1,0 %||Zur Anwendung als Operationshilfe in der Ophthalmochirurgie des |\nvorderen Augenabschnitts.\n|15.5||Optyluron NHS 1,4 %||Zur Anwendung als Operationshilfe in der Ophthalmochirurgie des |\nvorderen Augenabschnitts.\n|15.6||Oxane 1300||Zur intraokularen Tamponade bei schweren Formen der Netzhaut-|\nabl\u00f6sung sowie allen Netzhautabl\u00f6sungen, die mit anderen Thera-\npieformen nicht behandelt werden k\u00f6nnen. Ausgenommen ist die\nAnwendung bei zentralen Foramina mit Abl\u00f6sung und bei schweren\ndiabetischen Retinopathien.\n|15.7||Oxane 5700||Zur intraokularen Tamponade bei schweren Formen der Netzhaut-|\nabl\u00f6sung sowie allen Netzhautabl\u00f6sungen, die mit anderen Thera-\npieformen nicht behandelt werden k\u00f6nnen. Ausgenommen ist die\nAnwendung bei zentralen Foramina mit Abl\u00f6sung und bei schweren\ndiabetischen Retinopathien.\n|16 |\n|16.1||P\u00e4diaSalin 6 %||Zur symptomatischen Inhalationsbehandlung der Mukoviszidose f\u00fcr |\nPersonen, die das sechste Lebensjahr vollendet haben.\n|16.2||Paranix ohne Nissenkamm||Behandlung des Kopfhaares bei Pediculosis capitis bei Personen, |\ndie\na) das zw\u00f6lfte Lebensjahr noch nicht vollendet haben,\nb) das zw\u00f6lfte, aber noch nicht das 18. Lebensjahr vollendet haben\nund an Entwicklungsst\u00f6rungen leiden.\n|16.3||PARI NaCl Inhalationsl\u00f6sung||Als Tr\u00e4gerl\u00f6sung bei der Verwendung von Inhalaten in Verneblern |\noder Aerosolger\u00e4ten. Dies gilt nur f\u00fcr die F\u00e4lle, in denen der Zusatz\neiner Tr\u00e4gerl\u00f6sung in der Fachinformation des arzneistoffhaltigen\nInhalats zwingend vorgesehen ist.\n|16.4||ParkoLax||Behandlung |\na) der Obstipation im Zusammenhang mit Tumorleiden, Megacolon\n(mit Ausnahme des toxischen Megacolons), Divertikulose,\nDivertikulitis, Mukoviszidose oder neurogener Darml\u00e4hmung,\nb) bei phosphatbindender Medikation bei chronischer Nieren-\ninsuffizienz,\nc) bei Opiat- sowie Opioidtherapie und\nd) in der Terminalphase\nbei Personen, die das zw\u00f6lfte Lebensjahr vollendet haben.\nBehandlung der Obstipation bei Personen, die das zw\u00f6lfte, aber\nnoch nicht das 18. Lebensjahr vollendet haben und an Entwick-\nlungsst\u00f6rungen leiden.\n|16.5||Pe-Ha-Luron 1,0 %||Zur Anwendung als Operationshilfe in der Ophthalmochirurgie des |\nvorderen Augenabschnitts.\n|16.6||Pe-Ha-Visco 2,0 %||Zur Anwendung als Operationshilfe in der Ophthalmochirurgie des |\nvorderen Augenabschnitts.\n|16.7||POLYVISC 2,0 %||Zur Anwendung als Operationshilfe in der Ophthalmochirurgie des |\nvorderen Augenabschnitts.\n|16.8||POLYSOL||Zur Irrigation im Rahmen extraokularer und intraokularer Eingriffe. |\n|16.9||ProVisc||Zur Anwendung als Operationshilfe in der Ophthalmochirurgie des |\nvorderen Augenabschnitts bei Kataraktextraktion und Implantation\neiner Intraokularlinse.\n|16.10||PURI CLEAR||Zur Irrigation im Rahmen extraokularer und intraokularer Eingriffe. |\n|16.11||Purisole SM verd\u00fcnnt||Zur intraoperativen und postoperativen Blasensp\u00fclung bei urologi-|\nschen Eingriffen; jeweils in einer Menge, die ausschlie\u00dflich f\u00fcr die\neinmalige Anwendung geeignet ist.\n|17 unbesetzt |\n|18 |\n|18.1||Ringer B. Braun||Zur Sp\u00fclung und Reinigung bei operativen Eingriffen, zur Sp\u00fclung |\nvon Wunden und Verbrennungen sowie zur intraoperativen und\npostoperativen Sp\u00fclung bei endoskopischen Eingriffen.\n|18.2||Ringer Fresenius Sp\u00fcll\u00f6sung||Zum Freisp\u00fclen und Reinigen des Operationsgebietes, zum Feucht-|\nhalten des Gewebes, zur Wundsp\u00fclung bei \u00e4u\u00dferen Traumen und\nVerbrennungen, zur Sp\u00fclung bei diagnostischen Untersuchungen\nsowie zum Anfeuchten von Wunden und Verb\u00e4nden; jeweils in einer\nMenge, die ausschlie\u00dflich f\u00fcr die einmalige Anwendung geeignet\nist.\n|19 |\n|19.1||Saliva natura||Zur Behandlung krankheitsbedingter Mundtrockenheit bei onkolo-|\ngischen Erkrankungen oder Autoimmunerkrankungen.\n|19.2||Sentol||Zur Irrigation im Rahmen extraokularer und intraokularer Eingriffe. |\n|19.3||Serag BSS||Zur Irrigation im Rahmen extraokularer und intraokularer Eingriffe. |\n|19.4||Serumwerk-Augensp\u00fcll\u00f6sung BSS||Zur Irrigation im Rahmen extraokularer und intraokularer Eingriffe. |\n|20 |\n|20.1||TauroSept||Als Katheter-Block-L\u00f6sung zur Instillation von ven\u00f6sen Gef\u00e4\u00df-|\nkathetern zur Vorbeugung gegen Blutstrominfektionen f\u00fcr paren-\nteral ern\u00e4hrte Personen, die das 18. Lebensjahr vollendet haben.\nDies gilt nicht bei malignen Grunderkrankungen oder bereits vor-\nhandenem Katheter und katheterassoziierten Blutstrominfektionen\nin der Vorgeschichte.\n|20.2||TP SalineFlush||Ausschlie\u00dflich zum Sp\u00fclen von In-situ-Gef\u00e4\u00dfzugangssystemen. |\n|21 unbesetzt |\n|22 |\n|22.1||VISCOAT||Zur Anwendung bei ophthalmologischen Eingriffen am vorderen |\nAugenabschnitt, insbesondere bei Kataraktextraktion und Implan-\ntation einer Intraokularlinse.\n|22.2||VISMED||Als synthetische Tr\u00e4nenfl\u00fcssigkeit bei Autoimmunerkrankungen |\n(Sj\u00f6gren-Syndrom mit deutlichen Funktionsst\u00f6rungen [trockenes\nAuge Grad 2], Epidermolysis bullosa, okul\u00e4res Pemphigoid), Fehlen\noder Sch\u00e4digung der Tr\u00e4nendr\u00fcse, Fazialisparese oder bei\nLagophthalmus.\n|22.3||VISMED MULTI||Als synthetische Tr\u00e4nenfl\u00fcssigkeit bei Autoimmunerkrankungen |\n(Sj\u00f6gren-Syndrom mit deutlichen Funktionsst\u00f6rungen [trockenes\nAuge Grad 2], Epidermolysis bullosa, okul\u00e4res Pemphigoid), Fehlen\noder Sch\u00e4digung der Tr\u00e4nendr\u00fcse, Fazialisparese oder bei\nLagophthalmus.\n|23 unbesetzt |\n|24 unbesetzt |\n|25 unbesetzt |\n|26 |\n|26.1||Z-HYALIN||Zur Unterst\u00fctzung intraokularer Eingriffe am vorderen Augen- |\nabschnitt bei Kataraktoperationen.\nText in der Fassung des\n[Artikels 1 Neunte Verordnung zur \u00c4nderung der Bundesbeihilfeverordnung V. v. 1. Dezember 2020 BGBl. I S. 2713, 2021 I 343](/gesetz/14293/a255242.htm)m.W.v. 1. Januar 2021\nAnlage 5 (zu\n[\u00a7 22 Absatz 2 Nummer 1](https://www.buzer.de/gesetz/8634/a159953.htm)) Arzneimittel, die \u00fcberwiegend der Erh\u00f6hung der Lebensqualit\u00e4t dienen\nAnlage 5 hat\n[6 fr\u00fchere Fassungen](/gesetz/8634/al177731.htm)und wird in [11 Vorschriften zitiert](/gesetz/8634/v177731.htm)\nAbschnitt 1 Regulierung des K\u00f6rpergewichts (zentral wirkend)\n|Wirkstoff||Fertigarzneimittel, alle Wirkst\u00e4rken |\n|A 08 AA 01 Phentermin|| |\n|A 08 AA 02 Fenfluramin|| |\n|A 08 AA 03 Amfepramon||REGENON |\nTENUATE Retard\n|A 08 AA 04 Dexfenfluramin|| |\n|A 08 AA 05 Mazindol|| |\n|A 08 AA 06 Etilamfetamin|| |\n|A 08 AA 07 Cathin||ALVALIN|\n|A 08 AA 08 Clobenzorex|| |\n|A 08 AA 09 Mefenorex|| |\n|A 08 AA 10 Sibutramin|| |\n|A 08 AA 13 Phenylpropanolamin|| |\n|A 08 AA 62 Bupropion, Naltrexon||Mysimba|\n|A 08 AA 63 Phenylpropanolamin, Kombinationen|| |\n|A 08 AX 01 Rimonabant|| |\n|A 08 AX 02 Liraglutid |\nA 10 BJ 02\n(gilt nur bei der Anwendung zur Gewichtsreduktion\n|Saxenda|\n|A 08 AH 02 Fucus vesiculosus||Fucus-Gastreu S R59 |\nGracia\nRedumax\n|A 08 AH 01 Calotropis gigantea (madar)||Cefamadar|\nAbschnitt 2 Regulierung des K\u00f6rpergewichts (peripher wirkend)\n|Wirkstoff||Fertigarzneimittel, alle Wirkst\u00e4rken |\n|A 08 AB 01 Orlistat||alli |\nXENICAL\nalle generischen Orlistat-Fertigarzneimittel\nAbschnitt 3 Behandlung der sexuellen Dysfunktion\n|Wirkstoff||Fertigarzneimittel, alle Wirkst\u00e4rken |\n|G 04 BE 01 Alprostadil |\n(au\u00dfer als Diagnostikum)\n|CAVERJECT |\nCAVERJECT Impuls\nMUSE\nVIRIDAL\nVitaros HEXAL\n|G 04 BE 02 Papaverin|| |\n|G 04 BE 03 Sildenafil||VIAGRA |\nalle generischen Sildenafil-Fertigarzneimittel\n|G 04 BE 04 Yohimbin||YOCON GLENWOOD |\n|V 03 AB 36 Phentolamin |\n(gilt nur bei der Anwendung zur Behandlung der sexuel-\nlen Dysfunktion)\nC 04 AB 01\n(gilt nur bei der Anwendung zur Behandlung der sexuel-\nlen Dysfunktion)\n| |\n|G 04 BE 06 Moxisylyt|| |\n|G 04 BE 07 Apomorphin|| |\n|G 04 BE 08 Tadalafil |\n(au\u00dfer Tadalafil 5 mg zur Behandlung des benignen\nProstatasyndroms bei M\u00e4nnern, die das 18. Lebensjahr\nvollendet haben)\n|CIALIS |\nalle generischen Tadalafil-Fertigarzneimittel\n|G 04 BE 09 Vardenafil||LEVITRA |\nalle generischen Vardenafil-Fertigarzneimittel\n|G 04 BE 10 Avanafil||SPEDRA|\n|N 01 BB 20 Lidocain; Prilocain||Fortacin|\n|G 04 BE 30 Kombinationen|| |\n|G 04 BE 52 Papaverin Kombinationen|| |\n|G 04 BX 14 Dapoxetinhydrochlorid||Priligy|\n|Turnera diffusa||Cefagil |\nDESEO\nNeradin\n|Turnera diffusa Kombinationen||Damiana N Oligoplex |\nVirilis - Gastreu S R41\nYohimbin Vitalkomplex\nAbschnitt 4 Bek\u00e4mpfung der Nikotinabh\u00e4ngigkeit\n|Wirkstoff||Fertigarzneimittel, alle Wirkst\u00e4rken |\n|N 07 BA 01 Nicotin||NIQUITIN |\nNicopass\nNicorette\nNicotinell\nNikofrenon\n|N 07 BA 02 Bupropion |\nN 06 AX 12\n(gilt nur bei Anwendung zur Behandlung der Nikotin-\nabh\u00e4ngigkeit)\n|ZYBAN|\n|N 07 BA 03 Varenicline||Champix|\nAbschnitt 5 Steigerung des sexuellen Verlangens\n|Wirkstoff||Fertigarzneimittel, alle Wirkst\u00e4rken |\n|G 03 BA 03 Testosteron|| |\n|Turnera diffusa||Cefagil |\nDESEO\nNeradin\nRemisens\n|Turnera diffusa Kombinationen||Damiana N Oligoplex |\nVirilis - Gastreu S R41\nYohimbin Vitalkomplex\nAbschnitt 6 Verbesserung des Haarwuchses\n|Wirkstoff||Fertigarzneimittel, alle Wirkst\u00e4rken |\n|D 11 AX 01 Minoxidil||ALOPEXY 5 % |\nREGAINE\nMinoxidil BIO-H-TIN-Pharma\nMinoxicutan\n|D 11 AX 10 Finasterid||PROPECIA |\nFinahair\nFinapil\nalle generischen Finasterid-Fertigarzneimittel\n|Estradiolbenzoat; Prednisolon, Salicyls\u00e4ure||ALPICORT F |\n|Alfatradiol||ELL CRANELL |\nPANTOSTIN\n|Dexamethason; Alfatradiol|| |\n|Thiamin; Calcium pantothenat; Hefe, medizinisch; |\nL-Cystin; Keratin\n|Pantovigar|\n|H 02 AB 01 Betamethasonacetat |\n(gilt f\u00fcr das Anwendungsgebiet Alopecia areata)\n|Celestan |\nalle generischen Betamethasonacetat-Fertigarzneimittel\n|H 02 AB 08 Triamcinolon |\n(Triamcinolonacetonid, Triamcinolonhexacetonid)\n(gilt f\u00fcr das Anwendungsgebiet Alopecia areata)\n|Volon |\nLederlon\nalle generischen Triamcinolon-Fertigarzneimittel\nAbschnitt 7 Verbesserung des Aussehens\n|Wirkstoff||Fertigarzneimittel, alle Wirkst\u00e4rken |\n|M 03 AX 01 Clostridium botulinum Toxin Typ A||Azzalure |\nVistabel\nBocouture Vial\nText in der Fassung des\n[Artikels 1 Neunte Verordnung zur \u00c4nderung der Bundesbeihilfeverordnung V. v. 1. Dezember 2020 BGBl. I S. 2713, 2021 I 343](/gesetz/14293/a255242.htm)m.W.v. 1. Januar 2021\nAnlage 6 (zu\n[\u00a7 22 Absatz 2 Nummer 3 Buchstabe c](https://www.buzer.de/gesetz/8634/a159953.htm)) Beihilfef\u00e4higkeit nicht verschreibungspflichtiger Arzneimittel\nAnlage 6 hat\n[4 fr\u00fchere Fassungen](/gesetz/8634/al177732.htm)und wird in [7 Vorschriften zitiert](/gesetz/8634/v177732.htm)\nSchwerwiegende Erkrankungen und Standardtherapeutika zu deren Behandlung sind:\n- 1.\n- Abf\u00fchrmittel nur zur Behandlung von Erkrankungen im Zusammenhang mit Tumorleiden, Megacolon, Divertikulose, Divertikulitis, Mukoviszidose, neurogener Darml\u00e4hmung, vor diagnostischen Eingriffen, bei phosphatbindender Medikation bei chronischer Niereninsuffizienz, Opiat- sowie Opioidtherapie und in der Terminalphase.\n- 2.\n- Acetylsalicyls\u00e4ure (bis 300 mg/Dosiseinheit) als Thrombozyten-Aggregationshemmer bei koronarer Herzkrankheit (gesichert durch Symptomatik und erg\u00e4nzende nichtinvasive oder invasive Diagnostik) und in der Nachsorge von Herzinfarkt und Schlaganfall sowie nach arteriellen Eingriffen.\n- 3.\n- Acetylsalicyls\u00e4ure und Paracetamol nur zur Behandlung schwerer und schwerster Schmerzen in Co-Medikation mit Opioiden.\n- 4.\n- Acidosetherapeutika nur zur Behandlung von dialysepflichtiger Nephropathie und chronischer Niereninsuffizienz sowie bei Neoblase, Ileumconduit, Nabelpouch und Implantation der Harnleiter in den D\u00fcnndarm.\n- 5.\n- Topische An\u00e4sthetika und/oder Antiseptika nur zur Selbstbehandlung schwerwiegender generalisierter blasenbildender Hauterkrankungen (zum Beispiel Epidermolysis bullosa, hereditaria; Pemphigus).\n- 6.\n- Antihistaminika\nnur in Notfallsets zur Behandlung bei Bienen-, Wespen-, Hornissengift-Allergien,\nnur zur Behandlung schwerer rezidivierender Urticarien,\nnur bei schwerwiegendem anhaltendem Pruritus,\nnur zur Behandlung bei persistierender allergischer Rhinitis mit schwerwiegender Symptomatik, bei der eine topische nasale Behandlung mit Glukokortikoiden nicht ausreichend ist.\n- 7.\n- Antimykotika nur zur Behandlung von Pilzinfektionen im Mund- und Rachenraum.\n- 8.\n- Antiseptika und Gleitmittel nur f\u00fcr Personen mit Katheterisierung.\n- 9.\n- Arzneistofffreie Injektions-/Infusions-, Tr\u00e4ger- und Elektrolytl\u00f6sungen sowie parenterale Osmodiuretika bei Hirn\u00f6dem (Mannitol, Sorbitol).\n- 10.\n- Calciumverbindungen (mindestens 300 mg Calcium-Ion/Dosiseinheit) und Vitamin D (freie oder fixe Kombination) sowie Vitamin D als Monopr\u00e4parat bei ausreichender Calciumzufuhr \u00fcber die Nahrung\nnur zur Behandlung der manifesten Osteoporose,\nnur zeitgleich zur Steroidtherapie bei Erkrankungen, die voraussichtlich einer mindestens sechsmonatigen Steroidtherapie in einer Dosiseinheit von wenigstens 7,5 mg Prednisolon\u00e4quivalent bed\u00fcrfen, bei Bisphosphonat-Behandlung nach der Angabe in der jeweiligen Fachinformation bei zwingender Notwendigkeit.\n- 11.\n- Calciumverbindungen als Monopr\u00e4parate\nbei Pseudohypo- und Hypoparathyreodismus,\nbei Bisphosphonat-Behandlung nach der Angabe in der jeweiligen Fachinformation, bei zwingender Notwendigkeit.\n- 12.\n- Levocarnitin nur zur Behandlung bei endogenem Carnitinmangel.\n- 13.\n- Citrate nur zur Behandlung von Harnkonkrementen.\n- 14.\n- Dinatriumcromoglycat-(DNCG-)haltige Arzneimittel (oral) nur zur symptomatischen Behandlung der systemischen Mastozytose.\n- 15.\n- E.-coli-Stamm Nissle 1917 nur zur Behandlung der Colitis ulcerosa in der Remissionsphase bei Unvertr\u00e4glichkeit von Mesalazin.\n- 16.\n- Eisen-(II)-Verbindungen nur zur Behandlung von gesicherter Eisenmangelan\u00e4mie.\n- 17.\n- Flohsamen und Flohsamenschalen nur zur unterst\u00fctzenden Quellmittel-Behandlung bei Morbus Crohn, Kurzdarmsyndrom und HIV-assoziierter Diarrh\u00f6.\n- 18.\n- Fols\u00e4ure und Folinate nur bei Therapie mit Fols\u00e4ureantagonisten sowie zur Behandlung des kolorektalen Karzinoms.\n- 19.\n- Ginkgo-biloba-Bl\u00e4tter-Extrakt (Aceton-Wasser-Auszug, standardisiert 240 mg Tagesdosiseinheit) nur zur Behandlung der Demenz.\n- 20.\n- Glukokortikoide, topisch nasal nur zur Behandlung bei persistierender allergischer Rhinitis mit schwerwiegender Symptomatik\n- 21.\n- Harnstoffhaltige Dermatika mit einem Harnstoffgehalt von mindestens 5 Prozent nur bei gesicherter Diagnose bei Ichthyosen, wenn keine therapeutischen Alternativen f\u00fcr die jeweilige Patientin oder den jeweiligen Patienten indiziert sind.\n- 22.\n- Iodid nur zur Behandlung von Schilddr\u00fcsenerkrankungen.\n- 23.\n- Iod-Verbindungen nur zur Behandlung von Ulcera und Dekubitalgeschw\u00fcren.\n- 24.\n- Kaliumverbindungen als Monopr\u00e4parate nur zur Behandlung der Hypokali\u00e4mie.\n- 25.\n- Lactulose und Lactitol nur zur Senkung der enteralen Ammoniakresorption bei Leberversagen im Zusammenhang mit der hepatischen Enzephalopathie.\n- 26.\n- L\u00f6sungen und Emulsionen zur parenteralen Ern\u00e4hrung einschlie\u00dflich der notwendigen Vitamine und Spurenelemente.\n- 27.\n- Magnesiumverbindungen, oral, nur bei angeborenen Magnesiumverlusterkrankungen.\n- 28.\n- Magnesiumverbindungen, parenteral, nur zur Behandlung bei nachgewiesenem Magnesiummangel und zur Behandlung bei erh\u00f6htem Eklampsierisiko.\n- 29.\n- Metixenhydrochlorid nur zur Behandlung des Parkinson-Syndroms.\n- 30.\n- Mistel-Pr\u00e4parate, parenteral, auf Mistellektin normiert, nur in der palliativen Therapie von malignen Tumoren zur Verbesserung der Lebensqualit\u00e4t.\n- 31.\n- Niclosamid nur zur Behandlung von Bandwurmbefall.\n- 32.\n- Nystatin nur zur Behandlung von Mykosen bei immunsupprimierten Personen.\n- 33.\n- Ornithinaspartat nur zur Behandlung des hepatischen (Pr\u00e4-)Komas und der episodischen, hepatischen Enzephalopathie.\n- 34.\n- Pankreasenzyme nur zur Behandlung der chronischen, exokrinen Pankreasinsuffizienz oder Mukoviszidose sowie zur Behandlung der funktionellen Pankreasinsuffizienz nach Gastrektomie bei Vorliegen einer Steatorrhoe.\n- 35.\n- Phosphatbinder nur zur Behandlung der Hyperphosphat\u00e4mie bei chronischer Niereninsuffizienz und Dialyse.\n- 36.\n- Phosphatverbindungen bei Hypophosphat\u00e4mie, die durch eine entsprechende Ern\u00e4hrung nicht behoben werden kann.\n- 37.\n- Salicyls\u00e4urehaltige Zubereitungen (mindestens 2 Prozent Salicyls\u00e4ure) in der Dermatotherapie als Teil der Behandlung der Psoriasis und hyperkeratotischer Ekzeme.\n- 38.\n- Synthetischer Speichel nur zur Behandlung krankheitsbedingter Mundtrockenheit bei onkologischen oder Autoimmun-Erkrankungen.\n- 39.\n- Synthetische Tr\u00e4nenfl\u00fcssigkeit bei Autoimmun-Erkrankungen (Sj\u00f6gren-Syndrom mit deutlichen Funktionsst\u00f6rungen [trockenes Auge Grad 2], Epidermolysis bullosa, okulares Pemphigoid), Fehlen oder Sch\u00e4digung der Tr\u00e4nendr\u00fcse, Fazialisparese oder bei Lagophthalmus.\n- 40.\n- Vitamin K als Monopr\u00e4parat nur bei nachgewiesenem, schwerwiegendem Vitaminmangel, der durch eine entsprechende Ern\u00e4hrung nicht behoben werden kann.\n- 41.\n- Wasserl\u00f6sliche Vitamine, auch in Kombinationen, nur bei der Dialyse.\n- 42.\n- Wasserl\u00f6sliche Vitamine, Benfotiamin und Fols\u00e4ure als Monopr\u00e4parate nur bei nachgewiesenem, schwerwiegendem Vitaminmangel, der durch eine entsprechende Ern\u00e4hrung nicht behoben werden kann (Fols\u00e4ure: 5 mg/Dosiseinheit).\n- 43.\n- Zinkverbindungen als Monopr\u00e4parat nur zur Behandlung der enteropathischen Akrodermatitis und durch H\u00e4modialysebehandlung bedingtem nachgewiesenem Zinkmangel sowie zur Hemmung der Kupferaufnahme bei Morbus Wilson.\n- 44.\n- Arzneimittel zur sofortigen Anwendung\nAntidote bei akuten Vergiftungen,\nLokalan\u00e4sthetika zur Injektion,\napothekenpflichtige nicht verschreibungspflichtige Arzneimittel, die im Rahmen der \u00e4rztlichen Behandlung zur sofortigen Anwendung in der Praxis verf\u00fcgbar sein m\u00fcssen, k\u00f6nnen verordnet werden, wenn entsprechende Vereinbarungen zwischen den Verb\u00e4nden der Krankenkassen und den Kassen\u00e4rztlichen Vereinigungen getroffen werden.\nText in der Fassung des\n[Artikels 1 Neunte Verordnung zur \u00c4nderung der Bundesbeihilfeverordnung V. v. 1. Dezember 2020 BGBl. I S. 2713, 2021 I 343](/gesetz/14293/a255242.htm)m.W.v. 1. Januar 2021\nAnlage 7 (aufgehoben)\nAnlage 7 hat\n[6 fr\u00fchere Fassungen](/gesetz/8634/al177733.htm)und wird in [9 Vorschriften zitiert](/gesetz/8634/v177733.htm)\nText in der Fassung des\n[Artikels 1 Neunte Verordnung zur \u00c4nderung der Bundesbeihilfeverordnung V. v. 1. Dezember 2020 BGBl. I S. 2713, 2021 I 343](/gesetz/14293/a255242.htm)m.W.v. 1. Januar 2021\nAnlage 8 (zu\n[\u00a7 22 Absatz 4](https://www.buzer.de/gesetz/8634/a159953.htm)) Von der Beihilfef\u00e4higkeit ausgeschlossene oder beschr\u00e4nkt beihilfef\u00e4hige Arzneimittel\nAnlage 8 hat\n[5 fr\u00fchere Fassungen](/gesetz/8634/al159993.htm)und wird in [7 Vorschriften zitiert](/gesetz/8634/v159993.htm)\nFolgende Wirkstoffe oder Wirkstoffgruppen sind nur unter den genannten Voraussetzungen beihilfef\u00e4hig:\n- 1.\n- Alkoholentw\u00f6hnungsmittel sind nur beihilfef\u00e4hig zur Unterst\u00fctzung der\n- a)\n- Aufrechterhaltung der Abstinenz bei alkoholkranken Patientinnen oder Patienten im Rahmen eines therapeutischen Gesamtkonzepts mit begleitenden psychosozialen und soziotherapeutischen Ma\u00dfnahmen,\n- b)\n- Reduktion des Alkoholkonsums bei alkoholkranken Patientinnen oder Patienten, die zu einer Abstinenztherapie hingef\u00fchrt werden, f\u00fcr die aber entsprechende Therapiem\u00f6glichkeiten nicht zeitnah zur Verf\u00fcgung stehen, f\u00fcr die Dauer von h\u00f6chstens drei Monaten, in Ausnahmef\u00e4llen f\u00fcr die Dauer von weiteren drei Monaten.\n- 2.\n- Antidiabetika, orale, sind nur beihilfef\u00e4hig nach einer Therapie mit nichtmedikament\u00f6sen Ma\u00dfnahmen, die erfolglos war; die Anwendung anderer therapeutischer Ma\u00dfnahmen ist zu dokumentieren.\n- 3.\n- Antidysmenorrhoika sind nur beihilfef\u00e4hig als\n- a)\n- Prostaglandinsynthetasehemmer bei Regelschmerzen,\n- b)\n- systemische hormonelle Behandlung von Regelanomalien.\n- 4.\n- Clopidogrel als Monotherapie zur Pr\u00e4vention atherothrombotischer Ereignisse bei Personen mit Herzinfarkt, mit isch\u00e4mischem Schlaganfall oder mit nachgewiesener peripherer arterieller Verschlusskrankheit ist nur beihilfef\u00e4hig f\u00fcr Personen mit\n- a)\n- Amputation oder Gef\u00e4\u00dfintervention, bedingt durch periphere arterielle Verschlusskrankheit (pAVK), oder\n- b)\n- diagnostisch eindeutig gesicherter typischer Claudicatio intermittens mit Schmerzr\u00fcckbildung in weniger als 10 Minuten bei Ruhe oder\n- c)\n- Acetylsalicyls\u00e4ure-Unvertr\u00e4glichkeit, soweit wirtschaftlichere Alternativen nicht eingesetzt werden k\u00f6nnen.\n- 5.\n- Clopidogrel in Kombination mit Acetylsalicyls\u00e4ure bei akutem Koronarsyndrom zur Pr\u00e4vention atherothrombotischer Ereignisse ist nur beihilfef\u00e4hig bei Patienten mit\n- a)\n- akutem Koronarsyndrom ohne ST-Strecken-Hebung w\u00e4hrend eines Behandlungszeitraums von bis zu zw\u00f6lf Monaten,\n- b)\n- Myokardinfarkt mit ST-Strecken-Hebung, f\u00fcr die eine Thrombolyse infrage kommt, w\u00e4hrend eines Behandlungszeitraums von bis zu 28 Tagen,\n- c)\n- akutem Koronarsyndrom mit ST-Strecken-Hebungs-Infarkt, denen bei einer perkutanen Koronarintervention ein Stent implantiert worden ist.\n- 6.\n- Glinide zur Behandlung des Diabetes mellitus Typ 2; hierzu z\u00e4hlen:\n- a)\n- Nateglinid\n- b)\n- Repaglinid.\n- 7.\n- Insulinanaloga, schnell wirkend zur Behandlung des Diabetes mellitus Typ 2; hierzu z\u00e4hlen:\n- a)\n- Insulin Aspart,\n- b)\n- Insulin Glulisin,\n- c)\n- Insulin Lispro.\n- a)\n- die gegen den Wirkstoff Humaninsulin allergisch sind,\n- b)\n- bei denen trotz Intensivierung der Therapie eine stabile ad\u00e4quate Stoffwechsellage mit Humaninsulin nicht erreichbar ist, dies aber mit schnell wirkenden Insulinanaloga nachweislich gelingt, oder\n- c)\n- bei denen auf Grund unverh\u00e4ltnism\u00e4\u00dfig hoher Humaninsulindosen eine Therapie mit schnell wirkenden Insulinanaloga im Einzelfall wirtschaftlicher ist.\n- 8.\n- Insulinanaloga, lang wirkend zur Behandlung von Diabetes mellitus Typ 2; hierzu z\u00e4hlen:\n- a)\n- Insulin glargin,\n- b)\n- Insulin detemir.\n- a)\n- eine Behandlung mit Insulin glargin f\u00fcr Personen, bei denen im Rahmen einer intensivierten Insulintherapie auch nach individueller \u00dcberpr\u00fcfung des Therapieziels und individueller Anpassung des Ausma\u00dfes der Blutzuckersenkung in Ausnahmef\u00e4llen ein hohes Risiko f\u00fcr schwere Hypoglyk\u00e4mien bestehen bleibt, oder\n- b)\n- Personen, die gegen intermedi\u00e4r wirkende Humaninsuline allergisch sind.\n- 9.\n- Prostatamittel sind nur beihilfef\u00e4hig\n- a)\n- einmalig f\u00fcr eine Dauer von 24 Wochen als Therapieversuch sowie\n- b)\n- l\u00e4ngerfristig, sofern der Therapieversuch nach Buchstabe a erfolgreich verlaufen ist.\n- 10.\n- Saftzubereitungen sind f\u00fcr Erwachsene nur beihilfef\u00e4hig in Ausnahmef\u00e4llen; die Gr\u00fcnde m\u00fcssen dabei in der Person liegen.\nText in der Fassung des\n[Artikels 1 Neunte Verordnung zur \u00c4nderung der Bundesbeihilfeverordnung V. v. 1. Dezember 2020 BGBl. I S. 2713, 2021 I 343](/gesetz/14293/a255242.htm)m.W.v. 1. Januar 2021\nAnlage 9 (zu\n[\u00a7 23 Absatz 1](https://www.buzer.de/gesetz/8634/a159954.htm)) H\u00f6chstbetr\u00e4ge f\u00fcr beihilfef\u00e4hige Aufwendungen f\u00fcr Heilmittel\nAnlage 9 hat\n[3 fr\u00fchere Fassungen](/gesetz/8634/al159994.htm)und wird in [9 Vorschriften zitiert](/gesetz/8634/v159994.htm)\nAbschnitt 1 Leistungsverzeichnis\n|Nr.||Leistung||beihilfef\u00e4higer |\nH\u00f6chstbetrag\nin Euro\nbis 31.12.2018\n|beihilfef\u00e4higer |\nH\u00f6chstbetrag\nin Euro\nab 1.1.2019\n|Bereich Inhalation|| |\n|1||Inhalationstherapie, auch mittels Ultraschallvernebelung|| |\n|a) als Einzelinhalation||8,00||8,80|\n|b) als Rauminhalation in einer Gruppe, je Teilnehmerin oder Teilnehmer||4,30||4,80|\n|c) als Rauminhalation in einer Gruppe bei Anwendung ortsgebundener nat\u00fcr- |\nlicher Heilw\u00e4sser, je Teilnehmerin oder Teilnehmer\n|6,80||7,50|\n|Aufwendungen f\u00fcr die f\u00fcr Inhalationen erforderlichen Zus\u00e4tze sind daneben |\ngesondert beihilfef\u00e4hig.\n| |\n|2||Radon-Inhalation|| |\n|a) im Stollen||13,60||14,90|\n|b) mittels Hauben||16,60||18,20|\n|Bereich Krankengymnastik, Bewegungs\u00fcbungen|| |\n|3||Physiotherapeutische Erstbefundung zur Erstellung eines Behandlungsplans||15,00||16,50|\n|4||Krankengymnastik, auch auf neurophysiologischer Grundlage, Atemtherapie, |\neinschlie\u00dflich der zur Leistungserbringung erforderlichen Massage, als Einzel-\nbehandlung, Richtwert: 20 Minuten\n|23,40||25,70|\n|5||Krankengymnastik auf neurophysiologischer Grundlage (Bobath, Vojta, Proprio- |\nzeptive Neuromuskul\u00e4re Fazilitation (PNF)) bei zentralen Bewegungsst\u00f6rungen\nnach Vollendung des 18. Lebensjahres, als Einzelbehandlung, Richtwert:\n30 Minuten\n|30,70||33,80|\n|6||Krankengymnastik auf neurophysiologischer Grundlage (Bobath, Vojta) bei |\nzentralen Bewegungsst\u00f6rungen f\u00fcr Kinder l\u00e4ngstens bis zur Vollendung des\n18. Lebensjahres als Einzelbehandlung, Richtwert: 45 Minuten\n|41,20||45,30|\n|7||Krankengymnastik in einer Gruppe (2 bis 5 Personen), Richtwert: 25 Minuten |\nje Teilnehmerin oder Teilnehmer\n|7,40||8,20|\n|8||Krankengymnastik bei zerebralen Dysfunktionen in einer Gruppe (2 bis 4 Perso- |\nnen), Richtwert: 45 Minuten je Teilnehmerin oder Teilnehmer\n|13,00||14,30|\n|9||Krankengymnastik (Atemtherapie) bei Mukoviszidose und schweren Bronchial- |\nerkrankungen als Einzelbehandlung, Richtwert: 60 Minuten\n|64,90||71,40|\n|10||Krankengymnastik im Bewegungsbad|| |\n|a) als Einzelbehandlung einschlie\u00dflich der erforderlichen Nachruhe, Richtwert: |\n30 Minuten\n|28,30||31,20|\n|b) in einer Gruppe (2 bis 3 Personen), je Teilnehmerin oder Teilnehmer ein- |\nschlie\u00dflich der erforderlichen Nachruhe, Richtwert: 30 Minuten\n|17,80||19,50|\n|c) in einer Gruppe (4 bis 5 Personen), je Teilnehmerin oder Teilnehmer ein- |\nschlie\u00dflich der erforderlichen Nachruhe, Richtwert: 30 Minuten\n|14,20||15,60|\n|11||Manuelle Therapie, Richtwert: 30 Minuten||27,00||29,70|\n|12||Chirogymnastik (funktionelle Wirbels\u00e4ulengymnastik), Richtwert: 20 Minuten||17,30||19,00|\n|13||Bewegungs\u00fcbungen|| |\n|a) als Einzelbehandlung, Richtwert: 20 Minuten||9,20||10,20|\n|b) in einer Gruppe (2 bis 5 Personen), Richtwert: 20 Minuten||6,00||6,60|\n|14||Bewegungs\u00fcbungen im Bewegungsbad|| |\n|a) als Einzelbehandlung einschlie\u00dflich der erforderlichen Nachruhe, Richtwert: |\n30 Minuten\n|28,30||31,20|\n|b) in einer Gruppe (2 bis 3 Personen), je Teilnehmerin oder Teilnehmer ein- |\nschlie\u00dflich der erforderlichen Nachruhe, Richtwert: 30 Minuten\n|17,80||19,50|\n|c) in einer Gruppe (4 bis 5 Personen), je Teilnehmerin oder Teilnehmer ein- |\nschlie\u00dflich der erforderlichen Nachruhe, Richtwert: 30 Minuten\n|14,20||15,60|\n|15||Erweiterte ambulante Physiotherapie (EAP), Richtwert: 120 Minuten je Behand- |\nlungstag\n|98,30||108,10|\n|16||Ger\u00e4tegest\u00fctzte Krankengymnastik (KG-Ger\u00e4t) einschlie\u00dflich Medizinischen |\nAufbautrainings (MAT) und Medizinischer Trainingstherapie (MTT), je Sitzung\nf\u00fcr eine parallele Einzelbehandlung (bis zu 3 Personen), Richtwert: 60 Minuten,\nbegrenzt auf maximal 25 Behandlungen je Kalenderhalbjahr\n|42,00||46,20|\n|17||Traktionsbehandlung mit Ger\u00e4t (zum Beispiel Schr\u00e4gbrett, Extensionstisch, |\nPerl'sches Ger\u00e4t, Schlingentisch) als Einzelbehandlung, Richtwert: 20 Minuten\n|8,00||8,80|\n|Bereich Massagen|| |\n|18||Massage einzelner oder mehrerer K\u00f6rperteile|| |\n|a) Klassische Massagetherapie (KMT), Segment-, Periost-, Reflexzonen-, |\nB\u00fcrsten- und Colonmassage, Richtwert: 20 Minuten\n|16,60||18,20|\n|b) Bindegewebsmassage (BGM), Richtwert: 30 Minuten||16,60||18,20|\n|19||Manuelle Lymphdrainage (MLD)|| |\n|a) Teilbehandlung, Richtwert: 30 Minuten||23,40||25,70|\n|b) Gro\u00dfbehandlung, Richtwert: 45 Minuten||35,00||38,50|\n|c) Ganzbehandlung, Richtwert: 60 Minuten||53,00||58,30|\n|d) Kompressionsbandagierung einer Extremit\u00e4t, Aufwendungen f\u00fcr das not- |\nwendige Polster- und Bindenmaterial (zum Beispiel Mullbinden, Kurzzug-\nbinden, Flie\u00dfpolsterbinden) sind daneben beihilfef\u00e4hig\n|11,30||12,40|\n|20||Unterwasserdruckstrahlmassage einschlie\u00dflich der erforderlichen Nachruhe, |\nRichtwert: 20 Minuten\n|27,70||30,50|\n|Bereich Palliativversorgung|| |\n|21||Physiotherapeutische Komplexbehandlung in der Palliativversorgung, Richtwert: |\n60 Minuten\n|60,00||66,00|\n|Bereich Packungen, Hydrotherapie, B\u00e4der|| |\n|22||Hei\u00dfe Rolle einschlie\u00dflich der erforderlichen Nachruhe||12,40||13,60|\n|23||Warmpackung eines oder mehrerer K\u00f6rperteile einschlie\u00dflich der erforderlichen |\nNachruhe\n| |\n|a) bei Anwendung wiederverwendbarer Packungsmaterialien (zum Beispiel |\nFango-Paraffin, Moor-Paraffin, Pelose, Turbatherm)\n|14,20||15,60|\n|b) bei Anwendung einmal verwendbarer nat\u00fcrlicher Peloide (Heilerde, Moor, |\nNaturfango, Pelose, Schlamm, Schlick) ohne Verwendung von Folie oder\nVlies zwischen Haut und Peloid\n| |\n|aa) Teilpackung||32,90||36,20|\n|bb) Gro\u00dfpackung||43,40||47,80|\n|24||Schwitzpackung (zum Beispiel spanischer Mantel, Salzhemd, Dreiviertel-Packung |\nnach Kneipp) einschlie\u00dflich der erforderlichen Nachruhe\n|17,90||19,70|\n|25||Kaltpackung (Teilpackung)|| |\n|a) Anwendung von Lehm, Quark oder \u00c4hnlichem||9,20||10,20|\n|b) Anwendung einmal verwendbarer Peloide (Heilerde, Moor, Naturfango, |\nPelose, Schlamm, Schlick) ohne Verwendung von Folie oder Vlies zwischen\nHaut und Peloid\n|18,50||20,30|\n|26||Heublumensack, Peloidkompresse||11,00||12,10|\n|27||Wickel, Auflagen, Kompressen und andere, auch mit Zusatz||5,50||6,10|\n|28||Trockenpackung||3,70||4,10|\n|29||a) Teilguss, Teilblitzguss, Wechselteilguss||3,70||4,10|\n|b) Vollguss, Vollblitzguss, Wechselvollguss||5,50||6,10|\n|c) Abklatschung, Abreibung, Abwaschung||4,90||5,40|\n|30||a) an- oder absteigendes Teilbad (zum Beispiel nach Hauffe) einschlie\u00dflich der |\nerforderlichen Nachruhe\n|14,80||16,20|\n|b) an- oder absteigendes Vollbad (\u00dcberw\u00e4rmungsbad) einschlie\u00dflich der er- |\nforderlichen Nachruhe\n|24,00||26,40|\n|31||Wechselbad einschlie\u00dflich der erforderlichen Nachruhe|| |\n|a) Teilbad||11,00||12,10|\n|b) Vollbad||16,00||17,60|\n|32||B\u00fcrstenmassagebad einschlie\u00dflich der erforderlichen Nachruhe||22,80||25,10|\n|33||Naturmoorbad einschlie\u00dflich der erforderlichen Nachruhe|| |\n|a) Teilbad||39,40||43,30|\n|b) Vollbad||47,90||52,70|\n|34||Sandbad einschlie\u00dflich der erforderlichen Nachruhe|| |\n|a) Teilbad||34,40||37,90|\n|b) Vollbad||39,40||43,30|\n|35||Balneo-Phototherapie (Sole-Phototherapie) und Licht-\u00d6l-Bad einschlie\u00dflich |\nNachfetten und der erforderlichen Nachruhe\n|39,40||43,30|\n|36||Medizinisches Bad mit Zusatz|| |\n|a) Hand- oder Fu\u00dfbad||8,00||8,80|\n|b) Teilbad einschlie\u00dflich der erforderlichen Nachruhe||16,00||17,60|\n|c) Vollbad einschlie\u00dflich der erforderlichen Nachruhe||22,20||24,40|\n|d) bei mehreren Zus\u00e4tzen je weiterer Zusatz||3,70||4,10|\n|37||Gashaltiges Bad|| |\n|a) gashaltiges Bad (zum Beispiel Kohlens\u00e4urebad, Sauerstoffbad) einschlie\u00df- |\nlich der erforderlichen Nachruhe\n|23,40||25,70|\n|b) gashaltiges Bad mit Zusatz einschlie\u00dflich der erforderlichen Nachruhe||27,00||29,70|\n|c) Kohlendioxidgasbad (Kohlens\u00e4uregasbad) einschlie\u00dflich der erforderlichen |\nNachruhe\n|25,20||27,70|\n|d) Radon-Bad einschlie\u00dflich der erforderlichen Nachruhe||22,20||24,40|\n|e) Radon-Zusatz, je 500.000 Millistat||3,70||4,10|\n|38||Aufwendungen f\u00fcr andere als die in diesem Abschnitt bezeichneten B\u00e4der sind |\nnicht beihilfef\u00e4hig. Bei Teil- und Vollb\u00e4dern mit ortsgebundenen nat\u00fcrlichen\nHeilw\u00e4ssern erh\u00f6hen sich die H\u00f6chstbetr\u00e4ge nach Nummer 36 Buchstabe a\nbis c und nach Nummer 37 Buchstabe b um 3,70 Euro und ab 1.1.2019 um\n4,10 Euro. Weitere Zus\u00e4tze hierzu sind nach Ma\u00dfgabe der Nummer 36 Buch-\nstabe d beihilfef\u00e4hig.\n| |\n|Bereich K\u00e4lte- und W\u00e4rmebehandlung|| |\n|39||K\u00e4ltetherapie bei einem oder mehreren K\u00f6rperteilen mit lokaler Applikation inten- |\nsiver K\u00e4lte in Form von Eiskompressen, tiefgek\u00fchlten Eis- oder Gelbeuteln,\ndirekter Abreibung, Kaltgas und Kaltluft mit entsprechenden Apparaturen sowie\nEisteilb\u00e4dern in Fu\u00df- oder Armbadewannen\n|11,80||12,90|\n|40||W\u00e4rmetherapie mittels Hei\u00dfluft bei einem oder mehreren K\u00f6rperteilen, Richt- |\nwert: 20 Minuten\n|6,80||7,50|\n|41||Ultraschall-W\u00e4rmetherapie||10,80||11,90|\n|Bereich Elektrotherapie|| |\n|42||Elektrotherapie einzelner oder mehrerer K\u00f6rperteile mit individuell eingestellten |\nStromst\u00e4rken und Frequenzen\n|7,40||8,20|\n|43||Elektrostimulation bei L\u00e4hmungen||14,20||15,60|\n|44||Iontophorese||7,40||8,20|\n|45||Hydroelektrisches Teilbad (Zwei- oder Vierzellenbad)||13,60||14,90|\n|46||Hydroelektrisches Vollbad (zum Beispiel Stangerbad), auch mit Zusatz, ein- |\nschlie\u00dflich der erforderlichen Nachruhe\n|26,40||29,00|\n|Bereich Stimm-, Sprech- und Sprachtherapie|| |\n|47||Stimm-, sprech- und sprachtherapeutische Erstbefundung zur Erstellung eines |\nBehandlungsplans, einmal je Behandlungsfall\n|98,20||108,00|\n|48||Einzelbehandlung bei Atem-, Stimm-, Sprech-, Sprach-, H\u00f6r- und Schluck- |\nst\u00f6rungen\n| |\n|a) Richtwert: 30 Minuten||38,00||41,80|\n|b) Richtwert: 45 Minuten||53,60||59,00|\n|c) Richtwert: 60 Minuten||62,60||68,90|\n|d) Richtwert: 90 Minuten||94,00||103,40|\n|Aufwendungen f\u00fcr die Vor- und Nachbereitung, die Verlaufsdokumentation, den |\nsprachtherapeutischen Bericht sowie f\u00fcr die Beratung der Patientin oder des\nPatienten und ihrer oder seiner Bezugspersonen sind daneben nicht beihilfef\u00e4hig.\n| |\n|49||Gruppenbehandlung bei Atem-, Stimm-, Sprech-, Sprach-, H\u00f6r- und Schluck- |\nst\u00f6rungen, je Teilnehmerin oder Teilnehmer\n| |\n|a) Gruppe (2 Personen), Richtwert: 45 Minuten||45,80||50,40|\n|b) Gruppe (3 bis 5 Personen), Richtwert: 45 Minuten||31,40||34,60|\n|c) Gruppe (2 Personen), Richtwert: 90 Minuten||61,40||67,60|\n|d) Gruppe (3 bis 5 Personen), Richtwert: 90 Minuten||51,00||56,10|\n|Aufwendungen f\u00fcr die Vor- und Nachbereitung, die Verlaufsdokumentation, den |\nsprachtherapeutischen Bericht sowie f\u00fcr die Beratung der Patientin oder des\nPatienten und ihrer oder seiner Bezugspersonen sind daneben nicht beihilfef\u00e4hig.\n| |\n|Bereich Ergotherapie (Besch\u00e4ftigungstherapie)|| |\n|50||Funktionsanalyse und Erstgespr\u00e4ch einschlie\u00dflich Beratung und Behandlungs- |\nplanung, einmal je Behandlungsfall\n|38,00||41,80|\n|51||Einzelbehandlung|| |\n|a) bei motorisch-funktionellen St\u00f6rungen, Richtwert: 30 Minuten||38,00||41,80|\n|b) bei sensomotorischen oder perzeptiven St\u00f6rungen, Richtwert: 45 Minuten||49,80||54,80|\n|c) bei psychisch-funktionellen St\u00f6rungen, Richtwert: 60 Minuten||65,80||72,30|\n|d) bei psychisch-funktionellen St\u00f6rungen als Belastungserprobung, Richtwert: |\n120 Minuten\n|116,50||128,20|\n|e) als Beratung zur Integration in das h\u00e4usliche und soziale Umfeld im Rahmen |\neines Hausbesuchs, einmal pro Behandlungsfall\n| |\n|aa) bis zu 3 Einheiten am Tag, je Einheit|| |\n|aaa) bei motorisch-funktionellen St\u00f6rungen||37,00||40,70|\n|bbb) bei sensomotorischen oder perzeptiven St\u00f6rungen||49,40||54,40|\n|bb) bis zu 2 Einheiten am Tag, je Einheit bei psychisch-funktionellen |\nSt\u00f6rungen\n|61,60||67,70|\n|52||Gruppenbehandlung|| |\n|a) bei motorisch-funktionellen St\u00f6rungen, Richtwert: 30 Minuten, je Teilnehmerin |\noder Teilnehmer\n|14,50||16,00|\n|b) bei sensomotorischen oder perzeptiven St\u00f6rungen, Richtwert: 45 Minuten, |\nje Teilnehmerin oder Teilnehmer\n|18,70||20,60|\n|c) bei psychisch-funktionellen St\u00f6rungen, Richtwert: 90 Minuten, je Teilnehmerin |\noder Teilnehmer\n|34,40||37,90|\n|d) bei psychisch-funktionellen St\u00f6rungen als Belastungserprobung, Richtwert: |\n180 Minuten, je Teilnehmerin oder Teilnehmer\n|63,80||70,20|\n|53||Hirnleistungstraining/Neuropsychologisch orientierte Einzelbehandlung, Richt- |\nwert: 30 Minuten\n|42,00||46,20|\n|54||Hirnleistungstraining als Gruppenbehandlung, Richtwert: 45 Minuten, je Teil- |\nnehmerin oder Teilnehmer\n|18,70||20,60|\n|Bereich Podologie|| |\n|55||Hornhautabtragung an beiden F\u00fc\u00dfen||24,20||26,70|\n|56||Hornhautabtragung an einem Fu\u00df||17,20||18,90|\n|57||Nagelbearbeitung an beiden F\u00fc\u00dfen||22,80||25,10|\n|58||Nagelbearbeitung an einem Fu\u00df||17,20||18,90|\n|59||Podologische Komplexbehandlung (Hornhautabtragung und Nagelbearbeitung) |\nbeider F\u00fc\u00dfe\n|37,80||41,60|\n|60||Podologische Komplexbehandlung (Hornhautabtragung und Nagelbearbeitung) |\neines Fu\u00dfes\n|24,20||26,70|\n|61||Erstversorgung mit einer Federstahldraht-Orthonyxiespange nach Ross-Fraser, |\neinteilig, einschlie\u00dflich Abdruck und Anfertigung der Passiv-Nagel-Korrektur-\nSpange nach Modell, Applikation sowie Spangenkontrolle nach 1 bis 2 Wochen\n|176,90||194,60|\n|62||Regulierung der Orthonyxiespange nach Ross-Fraser, einteilig, einschlie\u00dflich |\nSpangenkontrolle nach 1 bis 2 Tagen\n|34,00||37,40|\n|63||Ersatzversorgung mit einer Orthonyxiespange nach Ross-Fraser, einteilig, in- |\nfolge Verlusts oder Bruchs der Spange bei vorhandenem Modell einschlie\u00dflich\nApplikation\n|58,90||64,80|\n|64||Versorgung mit einer konfektionierten bilateralen Federstahldraht-Orthonyxie- |\nspange, dreiteilig, einschlie\u00dflich individueller Spangenformung, Applikation und\nSpangensitzkontrolle nach 1 bis 2 Tagen\n|68,00||74,80|\n|65||Versorgung mit einer konfektionierten Klebespange, einteilig, einschlie\u00dflich |\nApplikation und Spangensitzkontrolle nach 1 bis 2 Tagen\n|34,00||37,40|\n|Bereich Ern\u00e4hrungstherapie|| |\n|66||Erstgespr\u00e4ch mit Behandlungsplanung, Richtwert: 60 Minuten||60,00||66,00|\n|67||Einzelbehandlung, Richtwert: 30 Minuten, begrenzt auf maximal 12 Behandlun- |\ngen pro Jahr\n|30,00||33,00|\n|68||Gruppenbehandlung, Richtwert: 30 Minuten, begrenzt auf maximal 12 Behand- |\nlungen pro Jahr\n|10,00||11,00|\n|Bereich Sonstiges|| |\n|69||\u00c4rztlich verordneter Hausbesuch||11,00||12,10|\n|70||Fahrtkosten f\u00fcr Fahrten der behandelnden Person (nur bei \u00e4rztlich verordnetem |\nHausbesuch) bei Benutzung eines Kraftfahrzeuges in H\u00f6he von 0,30 Euro je\nKilometer oder die niedrigsten Kosten eines regelm\u00e4\u00dfig verkehrenden Bef\u00f6rde-\nrungsmittels\n| |\n|71||Werden auf demselben Weg mehrere Patientinnen oder Patienten besucht, sind |\ndie Aufwendungen nach den Nummern 69 und 70 nur anteilig je Patientin oder\nPatient beihilfef\u00e4hig.\n| |\nRichtwert im Sinne des Leistungsverzeichnisses ist die Zeitangabe zur regelm\u00e4\u00dfigen Dauer der jeweiligen Therapiema\u00dfnahme (Regelbehandlungszeit). Er beinhaltet die Durchf\u00fchrung der Therapiema\u00dfnahme einschlie\u00dflich der Vor- und Nachbereitung. Die Regelbehandlungszeit darf nur aus medizinischen Gr\u00fcnden unterschritten werden.\nAbschnitt 2 Erweiterte ambulante Physiotherapie\n- 1.\n- Aufwendungen f\u00fcr eine EAP nach Abschnitt 1 Nummer 15 sind nur dann beihilfef\u00e4hig, wenn die Therapie in einer Einrichtung, die durch die gesetzlichen Krankenkassen oder Berufsgenossenschaften zur ambulanten Rehabilitation oder zur EAP zugelassen ist und bei einer der folgenden Indikationen angewendet wird:\n- a)\n- Wirbels\u00e4ulensyndrome mit erheblicher Symptomatik bei\n- aa)\n- nachgewiesenem frischem Bandscheibenvorfall (auch postoperativ),\n- bb)\n- Protrusionen mit radikul\u00e4rer, muskul\u00e4rer und statischer Symptomatik,\n- cc)\n- nachgewiesenen Spondylolysen und Spondylolisthesen mit radikul\u00e4rer, muskul\u00e4rer und statischer Symptomatik,\n- dd)\n- instabilen Wirbels\u00e4ulenverletzungen mit muskul\u00e4rem Defizit und Fehlstatik, wenn die Leistungen im Rahmen einer konservativen oder postoperativen Behandlung erbracht werden,\n- ee)\n- lockerer korrigierbarer thorakaler Scheuermann-Kyphose von mehr als 50\u00b0 Grad nach Cobb,\n- b)\n- Operationen am Skelettsystem bei\n- aa)\n- posttraumatischen Osteosynthesen,\n- bb)\n- Osteotomien der gro\u00dfen R\u00f6hrenknochen,\n- c)\n- prothetischer Gelenkersatz bei Bewegungseinschr\u00e4nkungen oder muskul\u00e4ren Defiziten bei\n- aa)\n- Schulterprothesen,\n- bb)\n- Knieendoprothesen,\n- cc)\n- H\u00fcftendoprothesen,\n- d)\n- operativ oder konservativ behandelte Gelenkerkrankungen, einschlie\u00dflich Instabilit\u00e4ten bei\n- aa)\n- Kniebandrupturen (Ausnahme isoliertes Innenband),\n- bb)\n- Schultergelenkl\u00e4sionen, insbesondere nach\n- aaa)\n- operativ versorgter Bankard-L\u00e4sion,\n- bbb)\n- Rotatorenmanschettenruptur,\n- ccc)\n- schwerer Schultersteife (frozen shoulder),\n- ddd)\n- Impingement-Syndrom,\n- eee)\n- Schultergelenkluxation,\n- fff)\n- tendinosis calcarea,\n- ggg)\n- periathritis humero-scapularis,\n- cc)\n- Achillessehnenrupturen und Achillessehnenabriss,\n- e)\n- Amputationen.\n- a)\n- einer Krankenhaus\u00e4rztin oder einem Krankenhausarzt,\n- b)\n- einer Fach\u00e4rztin oder einem Facharzt f\u00fcr Orthop\u00e4die, Neurologie oder Chirurgie,\n- c)\n- einer \u00c4rztin oder einem Arzt f\u00fcr Physikalische und Rehabilitative Medizin oder\n- d)\n- einer Allgemein\u00e4rztin oder einem Allgemeinarzt mit der Zusatzbezeichnung \u201ePhysikalische und Rehabilitative Medizin\".\n- 2.\n- Eine Verl\u00e4ngerung der erweiterten ambulanten Physiotherapie erfordert eine erneute \u00e4rztliche Verordnung. Eine Bescheinigung der Therapieeinrichtung oder von bei dieser besch\u00e4ftigten \u00c4rztinnen oder \u00c4rzten reicht nicht aus. Nach Abschluss der erweiterten ambulanten Physiotherapie ist der Festsetzungsstelle die Therapiedokumentation zusammen mit der Rechnung vorzulegen.\n- 3.\n- Die erweiterte ambulante Physiotherapie umfasst je Behandlungstag mindestens folgende Leistungen:\n- a)\n- Krankengymnastische Einzeltherapie,\n- b)\n- Physikalische Therapie,\n- c)\n- MAT.\n- 4.\n- Werden Lymphdrainage, Massage, Bindegewebsmassage, Isokinetik oder Unterwassermassage zus\u00e4tzlich erbracht, sind diese Leistungen mit dem H\u00f6chstbetrag nach Abschnitt 1 Nummer 15 abgegolten.\n- 5.\n- Die Patientin oder der Patient muss die durchgef\u00fchrten Leistungen auf der Tagesdokumentation unter Angabe des Datums best\u00e4tigen.\nAbschnitt 3 Medizinisches Aufbautraining\n- 1.\n- Aufwendungen f\u00fcr ein \u00e4rztlich verordnetes MAT nach Abschnitt 1 Nummer 16 mit Sequenztrainingsger\u00e4ten zur Behandlung von Funktions- und Leistungseinschr\u00e4nkungen im St\u00fctz- und Bewegungsapparat sind beihilfef\u00e4hig, wenn\n- a)\n- das Training verordnet wird von\n- aa)\n- einer Krankenhaus\u00e4rztin oder einem Krankenhausarzt,\n- bb)\n- einer Fach\u00e4rztin oder einem Facharzt f\u00fcr Orthop\u00e4die, Neurologie oder Chirurgie,\n- cc)\n- einer \u00c4rztin oder einem Arzt f\u00fcr Physikalische und Rehabilitative Medizin oder\n- dd)\n- einer Allgemein\u00e4rztin oder einem Allgemeinarzt mit der Zusatzbezeichnung \u201ePhysikalische und Rehabilitative Medizin\",\n- b)\n- Therapieplanung und Ergebniskontrolle von einer \u00c4rztin oder einem Arzt der Therapieeinrichtung vorgenommen werden und\n- c)\n- jede therapeutische Sitzung unter \u00e4rztlicher Aufsicht durchgef\u00fchrt wird; die Durchf\u00fchrung therapeutischer und diagnostischer Leistungen kann teilweise an speziell geschultes medizinisches Personal delegiert werden.\n- 2.\n- Die Beihilfef\u00e4higkeit ist auf maximal 25 Behandlungen je Kalenderhalbjahr begrenzt.\n- 3.\n- Die Angemessenheit und damit Beihilfef\u00e4higkeit der Aufwendungen richtet sich bei Leistungen, die von einer \u00c4rztin oder einem Arzt erbracht werden, nach dem Beschluss der Bundes\u00e4rztekammer zur Analogbewertung der Medizinischen Trainingstherapie. Danach sind folgende Leistungen bis zum 2,3-fachen der Geb\u00fchrens\u00e4tze der Anlage zur\n[Geb\u00fchrenordnung f\u00fcr \u00c4rzte](https://www.buzer.de/gesetz/5678/index.htm)beihilfef\u00e4hig:\n- a)\n- Eingangsuntersuchung zur Medizinischen Trainingstherapie einschlie\u00dflich biomechanischer Funktionsanalyse der Wirbels\u00e4ule, spezieller Schmerzanamnese und gegebenenfalls anderer funktionsbezogener Messverfahren sowie Dokumentation Nummer 842 der Anlage zur\n[Geb\u00fchrenordnung f\u00fcr \u00c4rzte](https://www.buzer.de/gesetz/5678/index.htm)analog. Aufwendungen f\u00fcr eine Kontrolluntersuchung (Nummer 842 der Anlage zur [Geb\u00fchrenordnung f\u00fcr \u00c4rzte](https://www.buzer.de/gesetz/5678/index.htm)analog) nach Abschluss der Behandlungsserie sind beihilfef\u00e4hig.\n- b)\n- Medizinische Trainingstherapie mit Sequenztraining einschlie\u00dflich progressiv-dynamischen Muskeltrainings mit speziellen Therapiemaschinen (Nummer 846 der Anlage zur\n[Geb\u00fchrenordnung f\u00fcr \u00c4rzte](https://www.buzer.de/gesetz/5678/index.htm)analog), zuz\u00fcglich zus\u00e4tzlichen Ger\u00e4te-Sequenztrainings (Nummer 558 der Anlage zur [Geb\u00fchrenordnung f\u00fcr \u00c4rzte](https://www.buzer.de/gesetz/5678/index.htm)analog) und begleitender krankengymnastischer \u00dcbungen (Nummer 506 der Anlage zur [Geb\u00fchrenordnung f\u00fcr \u00c4rzte](https://www.buzer.de/gesetz/5678/index.htm)). Aufwendungen f\u00fcr Leistungen nach Nummer 506, Nummer 558 analog sowie Nummer 846 analog der Anlage zur [Geb\u00fchrenordnung f\u00fcr \u00c4rzte](https://www.buzer.de/gesetz/5678/index.htm)sind pro Sitzung jeweils nur einmal beihilfef\u00e4hig.\n- 4.\n- Werden die Leistungen von zugelassenen Leistungserbringerinnen oder Leistungserbringern f\u00fcr Heilmittel erbracht, richtet sich die Angemessenheit der Aufwendungen nach Abschnitt 1 Nummer 16.\n- 5.\n- Aufwendungen f\u00fcr Fitness- und Kr\u00e4ftigungsmethoden, die nicht den Anforderungen nach Nummer 1 entsprechen, sind nicht beihilfef\u00e4hig. Dies ist auch dann der Fall, wenn sie an identischen Trainingsger\u00e4ten mit gesundheitsf\u00f6rdernder Zielsetzung durchgef\u00fchrt werden.\nAbschnitt 4 Palliativversorgung\n- 1.\n- Aufwendungen f\u00fcr Palliativversorgung nach Abschnitt 1 Nummer 21 sind gesondert beihilfef\u00e4hig, sofern sie nicht bereits von\n[\u00a7 40 Absatz 1](https://www.buzer.de/gesetz/8634/a159971.htm)umfasst sind.\n- 2.\n- Aufwendungen f\u00fcr Palliativversorgung werden als beihilfef\u00e4hig anerkannt bei\n- a)\n- passiven Bewegungsst\u00f6rungen mit Verlust, Einschr\u00e4nkung und Instabilit\u00e4t funktioneller Bewegung im Bereich der Wirbels\u00e4ule, der Gelenke, der discoligament\u00e4ren Strukturen,\n- b)\n- aktiven Bewegungsst\u00f6rungen bei Muskeldysbalancen oder -insuffizienz,\n- c)\n- atrophischen und dystrophischen Muskelver\u00e4nderungen,\n- d)\n- spastischen L\u00e4hmungen (cerebral oder spinal bedingt),\n- e)\n- schlaffen L\u00e4hmungen,\n- f)\n- abnormen Bewegungen/Koordinationsst\u00f6rungen bei Erkrankungen des zentralen Nervensystems,\n- g)\n- Schmerzen bei strukturellen Ver\u00e4nderungen im Bereich der Bewegungsorgane,\n- h)\n- funktionellen St\u00f6rungen von Organsystemen (zum Beispiel Herz-Kreislauferkrankungen, Lungen-/Bronchialerkrankungen, Erkrankungen eines Schlie\u00dfmuskels oder der Beckenbodenmuskulatur),\n- i)\n- unspezifischen schmerzhaften Bewegungsst\u00f6rungen, Funktionsst\u00f6rungen, auch bei allgemeiner Dekonditionierung.\n- 3.\n- Aufwendungen f\u00fcr physiotherapeutische Komplexbehandlung in der Palliativversorgung nach Abschnitt 1 Nummer 21 umfassen folgende Leistungen:\n- a)\n- Behandlung einzelner oder mehrerer K\u00f6rperteile entsprechend dem individuell erstellten Behandlungsplan,\n- b)\n- Wahrnehmungsschulung,\n- c)\n- Behandlung von Organfehlfunktionen (zum Beispiel Atemtherapie),\n- d)\n- dosiertes Training (zum Beispiel Bewegungs\u00fcbungen),\n- e)\n- angepasstes, ger\u00e4tegest\u00fctztes Training,\n- f)\n- Anwendung entstauender Techniken,\n- g)\n- Anwendung von Massagetechniken im Rahmen der lokalen Beeinflussung im Behandlungsgebiet als vorbereitende oder erg\u00e4nzende Ma\u00dfnahme der krankengymnastischen Behandlung,\n- h)\n- erg\u00e4nzende Beratung,\n- i)\n- Begleitung in der letzten Lebensphase,\n- j)\n- Anleitung oder Beratung der Bezugsperson,\n- k)\n- Hilfsmittelversorgung,\n- l)\n- interdisziplin\u00e4re Absprachen.\nText in der Fassung des\n[Artikels 1 Achte Verordnung zur \u00c4nderung der Bundesbeihilfeverordnung V. v. 24. Juli 2018 BGBl. I S. 1232](/1_8._BBhVAendV.htm)m.W.v. 31. Juli 2018\nAnlage 10 (zu\n[\u00a7 23 Absatz 1](https://www.buzer.de/gesetz/8634/a159954.htm) und [\u00a7 24 Absatz 1](https://www.buzer.de/gesetz/8634/a159955.htm)) Leistungserbringerinnen und Leistungserbringer f\u00fcr Heilmittel\nAnlage 10 hat\n[3 fr\u00fchere Fassungen](/gesetz/8634/al177734.htm)und wird in [6 Vorschriften zitiert](/gesetz/8634/v177734.htm)\nDie Beihilfef\u00e4higkeit setzt voraus, dass das Heilmittel in einem der folgenden Bereiche und von einer der folgenden Personen angewandt wird und dass die Anwendung dem Berufsbild der Leistungserbringerin oder des Leistungserbringers entspricht:\n- 1.\n- Bereich Inhalation, Krankengymnastik, Bewegungs\u00fcbungen, Massagen, Palliativversorgung, Packungen, Hydrotherapie, B\u00e4der, K\u00e4lte- und W\u00e4rmebehandlung, Elektrotherapie\n- a)\n- Physiotherapeutin oder Physiotherapeut,\n- b)\n- Masseurin und medizinische Bademeisterin oder Masseur und medizinischer Bademeister,\n- c)\n- Krankengymnastin oder Krankengymnast,\n- 2.\n- Bereich Stimm-, Sprech- und Sprachtherapie\n- a)\n- Logop\u00e4din oder Logop\u00e4de,\n- b)\n- Sprachtherapeutin oder Sprachtherapeut,\n- c)\n- staatlich gepr\u00fcfte Atem-, Sprech- und Stimmlehrerin der Schule Schlaffhorst-Andersen oder staatlich gepr\u00fcfter Atem-, Sprech- und Stimmlehrer der Schule Schlaffhorst-Andersen,\n- d)\n- Sprachheilp\u00e4dagogin oder Sprachheilp\u00e4dagoge,\n- e)\n- klinische Linguistin oder klinischer Linguist,\n- f)\n- klinische Sprechwissenschaftlerin oder klinischer Sprechwissenschaftler,\n- g)\n- bei Kindern f\u00fcr sprachtherapeutische Leistungen bei Sprachentwicklungsst\u00f6rungen, Stottern oder Poltern auch\n- aa)\n- Sprachheilp\u00e4dagogin oder Sprachheilp\u00e4dagoge,\n- bb)\n- Diplomlehrerin f\u00fcr Sprachgesch\u00e4digte oder Sprachgest\u00f6rte oder Diplomlehrer f\u00fcr Sprachgesch\u00e4digte oder Sprachgest\u00f6rte,\n- cc)\n- Diplomvorschulerzieherin f\u00fcr Sprachgesch\u00e4digte oder Sprachgest\u00f6rte oder Diplomvorschulerzieher f\u00fcr Sprachgesch\u00e4digte oder Sprachgest\u00f6rte,\n- dd)\n- Diplomerzieherin f\u00fcr Sprachgesch\u00e4digte oder Sprachgest\u00f6rte oder Diplomerzieher f\u00fcr Sprachgesch\u00e4digte oder Sprachgest\u00f6rte,\n- h)\n- Diplompatholinguistin oder Diplompatholinguist,\n- 3.\n- Bereich Ergotherapie (Besch\u00e4ftigungstherapie einschlie\u00dflich Bereich K\u00e4lte- und W\u00e4rmebehandlung)\n- a)\n- Ergotherapeutin oder Ergotherapeut,\n- b)\n- Besch\u00e4ftigungs- und Arbeitstherapeutin oder Besch\u00e4ftigungs- und Arbeitstherapeut,\n- 4.\n- Bereich Podologie\n- a)\n- Podologin oder Podologe,\n- b)\n- medizinische Fu\u00dfpflegerin oder medizinischer Fu\u00dfpfleger nach\n[\u00a7 1 des Podologengesetzes](https://www.buzer.de/gesetz/6059/a83875.htm),\n- 5.\n- Bereich Ern\u00e4hrungstherapie\n- a)\n- Di\u00e4tassistentin oder Di\u00e4tassistent,\n- b)\n- Oecotrophologin oder Oecotrophologe,\n- c)\n- Ern\u00e4hrungswissenschaftlerin oder Ern\u00e4hrungswissenschaftler.\nText in der Fassung des\n[Artikels 1 Neunte Verordnung zur \u00c4nderung der Bundesbeihilfeverordnung V. v. 1. Dezember 2020 BGBl. I S. 2713, 2021 I 343](/gesetz/14293/a255242.htm)m.W.v. 1. Januar 2021\nAnlage 11 (zu\n[\u00a7 25 Absatz 1 und 4](https://www.buzer.de/gesetz/8634/a159956.htm)) Beihilfef\u00e4hige Aufwendungen f\u00fcr Hilfsmittel, Ger\u00e4te zur Selbstbehandlung und Selbstkontrolle, K\u00f6rperersatzst\u00fccke\nAnlage 11 hat\n[8 fr\u00fchere Fassungen](/gesetz/8634/al159995.htm)und wird in [14 Vorschriften zitiert](/gesetz/8634/v159995.htm)\nAbschnitt 1 Hilfsmittel, Ger\u00e4te zur Selbstbehandlung und Selbstkontrolle, K\u00f6rperersatzst\u00fccke\nDie Aufwendungen f\u00fcr die Anschaffung der nachstehend aufgef\u00fchrten Hilfsmittel, Ger\u00e4te und K\u00f6rperersatzst\u00fccke sind - gegebenenfalls im Rahmen der H\u00f6chstbetr\u00e4ge - beihilfef\u00e4hig, wenn sie von einer \u00c4rztin oder einem Arzt verordnet werden:\n9.2 Infusionsbesteck oder -ger\u00e4t und Zubeh\u00f6r\n9.3 Inhalationsger\u00e4t, einschlie\u00dflich Sauerstoff und Zubeh\u00f6r, jedoch keine Luftbefeuchter, -filter, -w\u00e4scher\n9.4 Innenschuh, orthop\u00e4discher\n9.5 Insulinapplikationshilfen und Zubeh\u00f6r (Insulindosierger\u00e4t, -pumpe, -injektor)\n9.6 Irisschale mit geschw\u00e4rzter Pupille bei entstellenden Ver\u00e4nderungen der Hornhaut eines blinden Auges\n22.2 Vibrationstrainer bei Taubheit\nAufwendungen f\u00fcr \u00e4rztlich verordnete Voll- oder Teilper\u00fccken einschlie\u00dflich Befestigungselementen wie Klebestreifen und Spangen sowie Materialien zur Befestigung sind bis zu einem Betrag von 512 Euro beihilfef\u00e4hig, wenn, vor\u00fcbergehend oder langfristig, gro\u00dffl\u00e4chiger und massiver Haarverlust wegen einer Krankheit oder im Zusammenhang mit einer Krankheit vorliegt, insbesondere bei:\nAbschnitt 3 Blindenhilfsmittel und Mobilit\u00e4tstraining\nUnterabschnitt 1 Allgemeine Bestimmungen der Beihilfef\u00e4higkeit von Sehhilfen\nDie Aufwendungen f\u00fcr die Anschaffung der nachstehend aufgef\u00fchrten Hilfsmittel, Ger\u00e4te und K\u00f6rperersatzst\u00fccke sind - gegebenenfalls im Rahmen der H\u00f6chstbetr\u00e4ge - beihilfef\u00e4hig, wenn sie von einer \u00c4rztin oder einem Arzt verordnet werden:\n- 1.1\n- Abduktionslagerungskeil\n- 1.2\n- Absaugger\u00e4t (zum Beispiel bei Kehlkopferkrankung)\n- 1.3\n- Adaptionshilfen\n- 1.4\n- Anpassungen f\u00fcr diverse Gebrauchsgegenst\u00e4nde (zum Beispiel Universalhalter f\u00fcr Schwerstbehinderte zur Erleichterung der K\u00f6rperpflege und zur Nahrungsaufnahme)\n- 1.5\n- Alarmger\u00e4t f\u00fcr Epileptikerinnen oder Epileptiker\n- 1.6\n- Anatomische Brillenfassung\n- 1.7\n- Anus-praeter-Versorgungsartikel\n- 1.8\n- Anzieh- oder Ausziehhilfen\n- 1.9\n- Aquamat\n- 1.10\n- Armmanschette\n- 1.11\n- Armtragegurt oder -tuch\n- 1.12\n- Arthrodesensitzkissen oder -sitzkoffer\n- 1.13\n- Atemtherapieger\u00e4te\n- 1.14\n- Atomiseur (zur Medikamenten-Aufspr\u00fchung)\n- 1.15\n- Auffahrrampen f\u00fcr einen Krankenfahrstuhl\n- 1.16\n- Aufrichteschlaufe\n- 1.17\n- Aufrichtstuhl (f\u00fcr Aufrichtfunktion sind bis zu 150 Euro beihilfef\u00e4hig)\n- 1.18\n- Aufstehgestelle\n- 1.19\n- Auftriebshilfe (bei Schwerstbehinderung)\n- 1.20\n- Augenbadewanne, -dusche, -sp\u00fclglas, -flasche, -pinsel, -pipette oder -st\u00e4bchen\n- 1.21\n- Augenschielklappe, auch als Folie\n- 2.1\n- Badestrumpf\n- 2.2\n- Badewannensitz (bei Schwerstbehinderung, Totalendoprothese, H\u00fcftgelenk-Luxations-Gefahr oder Polyarthritis)\n- 2.3\n- Badewannenverk\u00fcrzer\n- 2.4\n- Ballspritze\n- 2.5\n- Behinderten-Dreirad\n- 2.6\n- Bestrahlungsmaske f\u00fcr ambulante Strahlentherapie\n- 2.7\n- Bettn\u00e4sser-Weckger\u00e4t\n- 2.8\n- Beugebandage\n- 2.9\n- Billroth-Batist-L\u00e4tzchen\n- 2.10\n- Blasenfistelbandage\n- 2.11\n- Blindenf\u00fchrhund (einschlie\u00dflich Geschirr, Leine, Halsband, Maulkorb)\n- 2.12\n- Blindenleitger\u00e4t (Ultraschallbrille, Ultraschallleitger\u00e4t)\n- 2.13\n- Blindenstock, -langstock oder -taststock\n- 2.14\n- Blutgerinnungsmessger\u00e4t (bei erforderlicher Dauerantikoagulation oder k\u00fcnstlichem Herzklappenersatz)\n- 2.15\n- Blutlanzette\n- 2.16\n- Blutzuckermessger\u00e4t\n- 2.17\n- Bracelet\n- 2.18\n- Bruchband\n- 3.1\n- Clavicula-Bandage\n- 3.2\n- Cochlea-Implantate einschlie\u00dflich Zubeh\u00f6r\n- 3.3\n- Communicator (bei dysarthrischen Sprechst\u00f6rungen)\n- 3.4\n- Computerspezialausstattung f\u00fcr Behinderte; Spezialhardware und Spezialsoftware bis zu 3.500 Euro, gegebenenfalls zuz\u00fcglich bis zu 5.400 Euro f\u00fcr eine Braillezeile mit 40 Modulen\n- 4.1\n- Defibrillatorweste\n- 4.2\n- Dekubitus-Schutzmittel (zum Beispiel Auf- oder Unterlagen f\u00fcr das Bett, Spezialmatratzen, Keile, Kissen, Auf- oder Unterlagen f\u00fcr den Rollstuhl, Sch\u00fctzer f\u00fcr Ellenbogen, Unterschenkel und F\u00fc\u00dfe)\n- 4.3\n- Delta-Gehrad\n- 4.4\n- Drehscheibe, Umsetzhilfen\n- 4.5\n- Duschsitz oder -stuhl\n- 5.1\n- Einlagen, orthop\u00e4dische, einschlie\u00dflich der zur Anpassung notwendigen Ganganalyse\n- 5.2\n- Einmal-Schutzhose bei Querschnittgel\u00e4hmten\n- 5.3\n- Ekzemmanschette\n- 5.4\n- Elektroscooter bis zu 2.500 Euro, ausgenommen Zulassung und Versicherung\n- 5.5\n- Elektrostimulationsger\u00e4t\n- 5.6\n- Epicondylitisbandage oder -spange mit Pelotten\n- 5.7\n- Epitrainbandage\n- 5.8\n- Ern\u00e4hrungssonde\n- 6.1\n- Fepo-Ger\u00e4t (funktionelle elektronische Peronaeus-Prothese)\n- 6.2\n- Fersenschutz (Kissen, Polster, Schale, Schoner)\n- 6.3\n- Fingerling\n- 6.4\n- Fingerschiene\n- 6.5\n- Fixationshilfen\n- 6.6\n- Fu\u00dfteil-Entlastungsschuh (Einzelschuhversorgung)\n- 7.1\n- Gehgipsgalosche\n- 7.2\n- Gehhilfen und -\u00fcbungsger\u00e4te\n- 7.3\n- Geh\u00f6rschutz\n- 7.4\n- Genutrain-Aktiv-Kniebandage\n- 7.5\n- Ger\u00e4t zur Behandlung mit elektromagnetischen Wechselfeldern bei atropher Pseudarthrose, Endoprothesenlockerung, idiopathischer H\u00fcftnekrose oder verz\u00f6gerter Knochenbruchheilung (in Verbindung mit einer sachgerechten chirurgischen Therapie)\n- 7.6\n- Ger\u00e4t zur kontinuierlichen Gewebezuckermessung (Continuous Glucose Monitoring - CGM, Flash Glucose Monitoring - FGM) einschlie\u00dflich Sensoren bei Personen mit einem insulinpflichtigen Diabetes mellitus; daneben sind Aufwendungen f\u00fcr \u00fcbliche Blutzuckermessger\u00e4te einschlie\u00dflich der erforderlichen Blutteststreifen beihilfef\u00e4hig\n- 7.7\n- Gesichtsteilersatzst\u00fccke (Ektoprothese, Epithese)\n- 7.8\n- Gilchrist-Bandage\n- 7.9\n- Gipsbett, Liegeschale\n- 7.10\n- Glasst\u00e4bchen\n- 7.11\n- Gummihose bei Blasen- oder Darminkontinenz\n- 7.12\n- Gummistr\u00fcmpfe\n- 8.1\n- Halskrawatte, Hals-, Kopf-, Kinnst\u00fctze\n- 8.2\n- Handgelenkriemen\n- 8.3\n- Hebekissen\n- 8.4\n- Heimdialyseger\u00e4t\n- 8.5\n- Helfende Hand, Scherenzange\n- 8.6\n- Herz-Atmungs-\u00dcberwachungsger\u00e4t oder -monitor\n- 8.7\n- Hochtontherapieger\u00e4t\n- 8.8\n- H\u00f6rger\u00e4te (Hinter-dem-Ohr-Ger\u00e4te [HdO-Ger\u00e4te] sowie In-dem-Ohr-Ger\u00e4te [IdO-Ger\u00e4te] einschlie\u00dflich Otoplastik, Taschenger\u00e4te, H\u00f6rbrillen, Schallsignale \u00fcberleitende Ger\u00e4te [C.R.O.S.-Ger\u00e4te, Contralateral Routing of Signals], drahtlose H\u00f6rhilfen), alle f\u00fcnf Jahre einschlie\u00dflich der Nebenkosten, es sei denn, aus medizinischen oder technischen Gr\u00fcnden ist eine vorzeitige Verordnung zwingend erforderlich; Aufwendungen sind f\u00fcr Personen ab 15 Jahren auf 1.500 Euro je Ohr begrenzt, gegebenenfalls zuz\u00fcglich der Aufwendungen f\u00fcr eine medizinisch indizierte notwendige Fernbedienung; der H\u00f6chstbetrag kann \u00fcberschritten werden, soweit dies erforderlich ist, um eine ausreichende Versorgung bei beidseitiger an Taubheit grenzender Schwerh\u00f6rigkeit oder bei vergleichbar schwerwiegenden Sachverhalten zu gew\u00e4hrleisten\n9.2 Infusionsbesteck oder -ger\u00e4t und Zubeh\u00f6r\n9.3 Inhalationsger\u00e4t, einschlie\u00dflich Sauerstoff und Zubeh\u00f6r, jedoch keine Luftbefeuchter, -filter, -w\u00e4scher\n9.4 Innenschuh, orthop\u00e4discher\n9.5 Insulinapplikationshilfen und Zubeh\u00f6r (Insulindosierger\u00e4t, -pumpe, -injektor)\n9.6 Irisschale mit geschw\u00e4rzter Pupille bei entstellenden Ver\u00e4nderungen der Hornhaut eines blinden Auges\n- 10.1\n- (frei)\n- 11.1\n- Kan\u00fclen und Zubeh\u00f6r\n- 11.2\n- Katapultsitz\n- 11.3\n- Katheter, auch Ballonkatheter, und Zubeh\u00f6r\n- 11.4\n- Kieferspreizger\u00e4t\n- 11.5\n- Klosett-Matratze f\u00fcr den h\u00e4uslichen Bereich bei dauernder Bettl\u00e4gerigkeit und bestehender Inkontinenz\n- 11.6\n- Klumpfu\u00dfschiene\n- 11.7\n- Klumphandschiene\n- 11.8\n- Klyso\n- 11.9\n- Knetmaterial f\u00fcr \u00dcbungszwecke bei cerebral-paretischen Kindern\n- 11.10\n- Kniekappe/-bandage, Kreuzgelenkbandage\n- 11.11\n- Kniepolster/-rutscher bei Unterschenkelamputation\n- 11.12\n- Kn\u00f6chel- und Gelenkst\u00fctzen\n- 11.13\n- K\u00f6rperersatzst\u00fccke einschlie\u00dflich Zubeh\u00f6r, abz\u00fcglich eines Eigenanteils von 15 Euro f\u00fcr Brustprothesenhalter und 40 Euro f\u00fcr Badeanz\u00fcge, Bodys oder Korseletts f\u00fcr Brustprothesentr\u00e4gerinnen\n- 11.14\n- Kompressionsstr\u00fcmpfe/-strumpfhose\n- 11.15\n- Koordinator nach Schielbehandlung\n- 11.16\n- Kopfring mit Stab, Kopfschreiber\n- 11.17\n- Kopfsch\u00fctzer\n- 11.18\n- Korrektursicherungsschuh\n- 11.19\n- Krabbler f\u00fcr Spastikerinnen und Spastiker\n- 11.20\n- Krampfaderbinde\n- 11.21\n- Krankenfahrstuhl und Zubeh\u00f6r\n- 11.22\n- Krankenpflegebett\n- 11.23\n- Krankenstock\n- 11.24\n- Kreuzst\u00fctzbandage\n- 11.25\n- Kr\u00fccke\n- 12.1\n- Latextrichter bei Querschnittl\u00e4hmung\n- 12.2\n- Leibbinde, jedoch keine Nieren-, Flanell- und W\u00e4rmeleibbinden\n- 12.3\n- Lesehilfen (Lesest\u00e4nder, Blattwendestab, Blattwendeger\u00e4t, Blattleseger\u00e4t, Auflagegestell)\n- 12.4\n- Lichtsignalanlage f\u00fcr Geh\u00f6rlose und hochgradig Schwerh\u00f6rige\n- 12.5\n- Lifter (Krankenlifter, Multilift, Bad-Helfer, Krankenheber oder Badewannenlifter)\n- 12.6\n- Lispelsonde\n- 12.7\n- Lumbalbandage\n- 13.1\n- Malleotrain-Bandage\n- 13.2\n- Mangoldsche Schn\u00fcrbandage\n- 13.3\n- Manutrain-Bandage\n- 13.4\n- Ma\u00dfschuhe, orthop\u00e4dische, die nicht serienm\u00e4\u00dfig herstellbar sind, abz\u00fcglich eines Eigenanteils von 64 Euro:\n- 13.4.1\n- Stra\u00dfenschuhe (Erstausstattung zwei Paar, Ersatzbeschaffung regelm\u00e4\u00dfig fr\u00fchestens nach zwei Jahren),\n- 13.4.2\n- Hausschuhe (Erstausstattung zwei Paar, Ersatzbeschaffung regelm\u00e4\u00dfig fr\u00fchestens nach zwei Jahren),\n- 13.4.3\n- Sportschuhe (Erstausstattung ein Paar, Ersatzbeschaffung regelm\u00e4\u00dfig fr\u00fchestens nach zwei Jahren),\n- 13.4.4\n- Badeschuhe (Erstausstattung ein Paar, Ersatzbeschaffung regelm\u00e4\u00dfig fr\u00fchestens nach vier Jahren),\n- 13.5\n- Milchpumpe\n- 13.6\n- Mundsperrer\n- 13.7\n- Mundstab/-greifstab\n- 14.1\n- Narbensch\u00fctzer\n- 14.2\n- Neurodermitis-Overall f\u00fcr Personen, die das zw\u00f6lfte Lebensjahr noch nicht vollendet haben (zwei pro Jahr und bis zu 80 Euro je Overall)\n- 15.1\n- Orthese, Orthoprothese, Korrekturschienen, Korsetts und \u00c4hnliches, auch Haltemanschetten und \u00c4hnliches\n- 15.2\n- Orthesenschuhe, abz\u00fcglich eines Eigenanteils von 64 Euro\n- 15.3\n- Orthop\u00e4dische Zurichtungen an Konfektionsschuhen (h\u00f6chstens sechs Paar Schuhe pro Jahr)\n- 16.1\n- Pavlik-Bandage\n- 16.2\n- Peak-Flow-Meter\n- 16.3\n- Penisklemme\n- 16.4\n- Peronaeusschiene, Heidelberger Winkel\n- 16.5\n- Phonator\n- 16.6\n- Polarimeter\n- 16.7\n- Psoriasiskamm\n- 17.1\n- Quengelschiene\n- 18.1\n- Rauchwarnmelder f\u00fcr Geh\u00f6rlose und hochgradig Schwerh\u00f6rige\n- 18.2\n- Reflektometer\n- 18.3\n- Rektophor\n- 18.4\n- Rollator\n- 18.5\n- Rollbrett\n- 18.6\n- Rutschbrett\n- 19.1\n- Schede-Rad\n- 19.2\n- Schr\u00e4gliegebrett\n- 19.3\n- Schutzbrille f\u00fcr Blinde\n- 19.4\n- Schutzhelm f\u00fcr Behinderte\n- 19.5\n- Schwellstromapparat\n- 19.6\n- Segofix-Bandagensystem\n- 19.7\n- Sitzkissen f\u00fcr Oberschenkelamputierte\n- 19.8\n- Sitzschale, wenn Sitzkorsett nicht ausreicht\n- 19.9\n- Skolioseumkr\u00fcmmungsbandage\n- 19.10\n- Spastikerhilfen (Gymnastik-/\u00dcbungsger\u00e4te)\n- 19.11\n- Spezialschuhe f\u00fcr Diabetiker, abz\u00fcglich eines Eigenanteils von 64 Euro\n- 19.12\n- Sphinkter-Stimulator\n- 19.13\n- Sprachverst\u00e4rker nach Kehlkopfresektion\n- 19.14\n- Spreizfu\u00dfbandage\n- 19.15\n- Spreizhose/-schale/-wagenaufsatz\n- 19.16\n- Spritzen\n- 19.17\n- Stabilisationsschuhe bei Sprunggelenksch\u00e4den, Achillessehnensch\u00e4den oder L\u00e4hmungszust\u00e4nden (eine gleichzeitige Versorgung mit Orthesen oder Orthesenschuhen ist ausgeschlossen)\n- 19.18\n- Steh\u00fcbungsger\u00e4t\n- 19.19\n- Stomaversorgungsartikel, Sphinkter-Plastik\n- 19.20\n- Strickleiter zum Aufrichten und \u00dcbersetzen Gel\u00e4hmter\n- 19.21\n- Stubbies\n- 19.22\n- Stumpfschutzh\u00fclle\n- 19.23\n- Stumpfstrumpf\n- 19.24\n- Suspensorium\n- 19.25\n- Symphyseng\u00fcrtel\n- 20.1\n- Talocrur (Sprunggelenkmanschette nach Dr. Grisar)\n- 20.2\n- Therapeutische Bewegungsger\u00e4te (nur mit Spasmenschaltung)\n- 20.3\n- Therapiestuhl\n- 20.4\n- Tinnitusger\u00e4t\n- 20.5\n- Toilettenhilfen bei Schwerbehinderten oder Personen mit H\u00fcfttotalendoprothese\n- 20.6\n- Tracheostomaversorgungsartikel, auch Wasserschutzger\u00e4t (Larchel)\n- 20.7\n- Tragegurtsitz\n- 21.1\n- \u00dcbertragungsanlagen - zur Befriedung von allgemeinen Grundbed\u00fcrfnissen des t\u00e4glichen Lebens zus\u00e4tzlich zu einem H\u00f6rger\u00e4t oder einem Cochlea-Implantat oder wenn bei peripherer Normalh\u00f6rigkeit auf Grund einer auditiven Verarbeitungs- und Wahrnehmungsst\u00f6rung eine pathologische Einschr\u00e4nkung des Sprachverstehens im St\u00f6rschall besteht\n- 21.2\n- \u00dcbungsschiene\n- 21.3\n- Urinale\n- 21.4\n- Urostomiebeutel\n22.2 Vibrationstrainer bei Taubheit\n- 23.1\n- Wasserfeste Gehhilfe\n- 23.2\n- Wechseldruckger\u00e4t\n- 24.1\n- (frei)\n- 25.1\n- (frei)\n- 26.1\n- Zyklomat-Hormon-Pumpe.\nAufwendungen f\u00fcr \u00e4rztlich verordnete Voll- oder Teilper\u00fccken einschlie\u00dflich Befestigungselementen wie Klebestreifen und Spangen sowie Materialien zur Befestigung sind bis zu einem Betrag von 512 Euro beihilfef\u00e4hig, wenn, vor\u00fcbergehend oder langfristig, gro\u00dffl\u00e4chiger und massiver Haarverlust wegen einer Krankheit oder im Zusammenhang mit einer Krankheit vorliegt, insbesondere bei:\n- 1.\n- Chemotherapie,\n- 2.\n- Strahlenbehandlung,\n- 3.\n- vor\u00fcbergehender oder dauerhafter Medikamentengabe,\n- 4.\n- Operationen,\n- 5.\n- Infekten oder entz\u00fcndlichen Erkrankungen,\n- 6.\n- Stoffwechselerkrankungen,\n- 7.\n- psychischen Erkrankungen mit oder durch Haarverlust,\n- 8.\n- sonstigen Erkrankungen mit Haarverlust,\n- 9.\n- Deformation des Kopfes mit entstellender Wirkung,\n- 10.\n- Unfallfolgen.\n- 1.\n- seit der vorangegangenen Beschaffung einer Voll- oder Teilper\u00fccke aus Kunststoff ein Jahr vergangen ist,\n- 2.\n- seit der vorangegangenen Beschaffung einer Voll- oder Teilper\u00fccke aus Echthaar zwei Jahre vergangen sind oder\n- 3.\n- sich bei Kindern vor Ablauf der vorgenannten Zeitr\u00e4ume die Kopfform ge\u00e4ndert hat.\nAbschnitt 3 Blindenhilfsmittel und Mobilit\u00e4tstraining\n- 1.\n- Aufwendungen f\u00fcr zwei Langst\u00f6cke sowie gegebenenfalls elektronische Blindenleitger\u00e4te nach \u00e4rztlicher Verordnung sind beihilfef\u00e4hig.\n- 2.\n- Aufwendungen f\u00fcr die erforderliche Unterweisung im Gebrauch dieser Hilfsmittel (Mobilit\u00e4tstraining) sind in folgendem Umfang beihilfef\u00e4hig:\n- a)\n- Aufwendungen f\u00fcr eine Ausbildung im Gebrauch des Langstockes sowie f\u00fcr eine Schulung in Orientierung und Mobilit\u00e4t bis zu folgenden H\u00f6chstbetr\u00e4gen:\n- aa)\n- Unterrichtsstunde \u00e0 60 Minuten, einschlie\u00dflich 15 Minuten Vor- und Nachbereitung sowie der Erstellung von Unterrichtsmaterial, bis zu 100 Unterrichtsstunden 63,50 Euro,\n- bb)\n- Fahrtzeit der Trainerin oder des Trainers je Zeitstunde, wobei jede angefangene Stunde im 5-Minuten-Takt anteilig berechnet wird 50,48 Euro,\n- cc)\n- Fahrtkosten der Trainerin oder des Trainers je gefahrenen Kilometer 0,30 Euro oder die niedrigsten Kosten eines regelm\u00e4\u00dfig verkehrenden Bef\u00f6rderungsmittels,\n- dd)\n- notwendige Unterkunft und Verpflegung der Trainerin oder des Trainers, soweit eine t\u00e4gliche R\u00fcckkehr zum Wohnort der Trainerin oder des Trainers nicht zumutbar ist, je Tag 26 Euro.\n- b)\n- Aufwendungen f\u00fcr ein erforderliches Nachtraining (zum Beispiel bei Wegfall eines noch vorhandenen Sehrestes, Wechsel des Wohnortes) werden entsprechend Buchstabe a anerkannt,\n- c)\n- Aufwendungen f\u00fcr ein erg\u00e4nzendes Training an Blindenleitger\u00e4ten k\u00f6nnen in der Regel bis zu 30 Stunden anerkannt werden, gegebenenfalls einschlie\u00dflich der Kosten f\u00fcr Unterkunft und Verpflegung sowie der Fahrtkosten der Trainerin oder des Trainers in entsprechendem Umfang. Die Anerkennung weiterer Stunden ist m\u00f6glich, wenn die Trainerin oder der Trainer oder eine \u00c4rztin oder ein Arzt die Notwendigkeit bescheinigt.\n- 3.\n- Die entstandenen Aufwendungen f\u00fcr das Mobilit\u00e4tstraining sind durch die Rechnung einer Blindenorganisation nachzuweisen. Ersatzweise kann auch eine unmittelbare Abrechnung durch die Mobilit\u00e4tstrainerin oder den Mobilit\u00e4tstrainer akzeptiert werden, falls sie oder er zur Rechnungsstellung gegen\u00fcber den gesetzlichen Krankenkassen berechtigt ist. Bei Umsatzsteuerpflicht (ein Nachweis des Finanzamtes ist vorzulegen) erh\u00f6hen sich die beihilfef\u00e4higen Aufwendungen um die jeweils g\u00fcltige Umsatzsteuer.\n- 4.\n- Aufwendungen f\u00fcr \u00e4rztlich verordnete elektronische Systeme zur Informationsverarbeitung und Informationsausgabe f\u00fcr Blinde sind beihilfef\u00e4hig.\nUnterabschnitt 1 Allgemeine Bestimmungen der Beihilfef\u00e4higkeit von Sehhilfen\n- 1.\n- Voraussetzung f\u00fcr die Beihilfef\u00e4higkeit der Aufwendungen f\u00fcr die erstmalige Beschaffung einer Sehhilfe ist, dass diese von einer Augen\u00e4rztin oder einem Augenarzt verordnet worden ist. Bei der Ersatzbeschaffung gen\u00fcgt die Refraktionsbestimmung von einer Augenoptikerin oder einem Augenoptiker; die Aufwendungen hierf\u00fcr sind bis zu 13 Euro beihilfef\u00e4hig.\n- 2.\n- Aufwendungen f\u00fcr erneute Beschaffung einer Sehhilfe sind beihilfef\u00e4hig, wenn bei gleichbleibendem Visus seit dem Kauf der bisherigen Sehhilfe drei, bei weichen Kontaktlinsen zwei Jahre vergangen sind oder vor Ablauf dieses Zeitraums die erneute Beschaffung der Sehhilfe notwendig ist, weil\n- a)\n- sich die Refraktion ge\u00e4ndert hat,\n- b)\n- die bisherige Sehhilfe verloren gegangen oder unbrauchbar geworden ist,\n- c)\n- sich die Kopfform ge\u00e4ndert hat.\n- 3.\n- Als Sehhilfen zur Verbesserung des Visus sind beihilfef\u00e4hig:\n- a)\n- Brillengl\u00e4ser,\n- b)\n- Kontaktlinsen,\n- c)\n- vergr\u00f6\u00dfernde Sehhilfen.\n- 4.\n- Bei Personen, die der Vollzeitschulpflicht unterliegen, sind Aufwendungen f\u00fcr eine Brille beihilfef\u00e4hig, wenn sie f\u00fcr die Teilnahme am Schulsport erforderlich ist. Die H\u00f6he der beihilfef\u00e4higen Aufwendungen richtet sich nach dem Unterabschnitt 2 Nummer 1 und 2; f\u00fcr die Brillenfassung sind Aufwendungen bis zu 52 Euro beihilfef\u00e4hig.\n- 1.\n- Aufwendungen f\u00fcr Brillengl\u00e4ser sind bis zu folgenden H\u00f6chstbetr\u00e4gen beihilfef\u00e4hig:\n- a)\n- f\u00fcr verg\u00fctete Gl\u00e4ser mit Gl\u00e4serst\u00e4rken bis +/-6 Dioptrien (dpt):\n- aa)\n- Einst\u00e4rkengl\u00e4ser:\n- aaa)\n- f\u00fcr ein sph\u00e4risches Glas 31,00 Euro,\n- bbb)\n- f\u00fcr ein zylindrisches Glas 41,00 Euro,\n- bb)\n- Mehrst\u00e4rkengl\u00e4ser:\n- aaa)\n- f\u00fcr ein sph\u00e4risches Glas 72,00 Euro,\n- bbb)\n- f\u00fcr ein zylindrisches Glas 92,50 Euro,\n- b)\n- f\u00fcr verg\u00fctete Gl\u00e4ser mit Gl\u00e4serst\u00e4rken \u00fcber +/-6 dpt zuz\u00fcglich je Glas 21,00 Euro,\n- c)\n- f\u00fcr Dreistufen- oder Multifokalgl\u00e4ser zuz\u00fcglich je Glas 21,00 Euro,\n- d)\n- f\u00fcr Gl\u00e4ser mit prismatischer Wirkung zuz\u00fcglich je Glas 21,00 Euro.\n- 2.\n- Zus\u00e4tzlich zu den Aufwendungen nach Nummer 1 sind Mehraufwendungen f\u00fcr Kunststoff-, Leicht- und Lichtschutzgl\u00e4ser bei den jeweils genannten Indikationen bis zu folgenden H\u00f6chstbetr\u00e4gen beihilfef\u00e4hig:\n- a)\n- f\u00fcr Kunststoffgl\u00e4ser und hochbrechende mineralische Gl\u00e4ser (Leichtgl\u00e4ser) zuz\u00fcglich je Glas 21,00 Euro,\n- aa)\n- f\u00fcr Gl\u00e4serst\u00e4rken ab +6/-8 dpt,\n- bb)\n- f\u00fcr Anisometropien ab 2 dpt,\n- cc)\n- unabh\u00e4ngig von der Gl\u00e4serst\u00e4rke\n- aaa)\n- f\u00fcr Personen, die das 14. Lebensjahr noch nicht vollendet haben,\n- bbb)\n- f\u00fcr Personen mit chronischem Druckekzem der Nase, mit Fehlbildungen oder Missbildungen des Gesichts, insbesondere im Nasen- und Ohrenbereich, wenn trotz optimaler Anpassung unter Verwendung von Silikatgl\u00e4sern ein befriedigender Sitz der Brille nicht gew\u00e4hrleistet ist,\n- ccc)\n- f\u00fcr Brillen, die im Rahmen der Vollzeitschulpflicht f\u00fcr die Teilnahme am Schulsport erforderlich sind,\n- b)\n- f\u00fcr Lichtschutzgl\u00e4ser oder fototrope Gl\u00e4ser zuz\u00fcglich je Glas 11,00 Euro,\n- aa)\n- bei umschriebenen Transparenzverlusten (Tr\u00fcbungen) im Bereich der brechenden Medien, die zu Lichtstreuungen f\u00fchren (zum Beispiel Hornhautnarben, Linsentr\u00fcbungen, Glask\u00f6rpertr\u00fcbungen),\n- bb)\n- bei krankhaften, andauernden Pupillenerweiterungen,\n- cc)\n- bei Fortfall der Pupillenverengung (zum Beispiel absolute oder reflektorische Pupillenstarre, Adie-Kehrer-Syndrom),\n- dd)\n- bei chronisch-rezidivierenden Reizzust\u00e4nden der vorderen und mittleren Augenabschnitte, die medikament\u00f6s nicht behebbar sind (zum Beispiel Keratoconjunctivitis, Iritis, Cyclitis),\n- ee)\n- bei entstellenden Ver\u00e4nderungen im Bereich der Lider und ihrer Umgebung (zum Beispiel Lidkolobom, Lagophthalmus, Narbenzug) und Behinderung des Tr\u00e4nenflusses,\n- ff)\n- bei Ciliarneuralgie,\n- gg)\n- bei Blendung auf Grund entz\u00fcndlicher oder degenerativer Erkrankungen der Netzhaut, der Aderhaut oder der Sehnerven,\n- hh)\n- bei totaler Farbenblindheit,\n- ii)\n- bei unertr\u00e4glichen Blendungserscheinungen bei praktischer Blindheit,\n- jj)\n- bei intrakraniellen Erkrankungen, bei denen nach \u00e4rztlicher Erfahrung eine pathologische Lichtempfindlichkeit besteht (zum Beispiel Hirnverletzungen, Hirntumoren),\n- kk)\n- bei Gl\u00e4serst\u00e4rken ab +10 dpt wegen Vergr\u00f6\u00dferung der Eintrittspupille.\n- 3.\n- Nicht beihilfef\u00e4hig sind Aufwendungen f\u00fcr:\n- a)\n- hochbrechende Lentikulargl\u00e4ser,\n- b)\n- entspiegelte Gl\u00e4ser,\n- c)\n- polarisierende Gl\u00e4ser,\n- d)\n- Gl\u00e4ser mit h\u00e4rtender Oberfl\u00e4chenbeschichtung,\n- e)\n- Gl\u00e4ser und Zurichtungen an der Brille zur Verhinderung von Unfallsch\u00e4den am Arbeitsplatz oder f\u00fcr den Freizeitbereich,\n- f)\n- Bildschirmbrillen,\n- g)\n- Brillenversicherungen,\n- h)\n- Gl\u00e4ser f\u00fcr eine sogenannte Zweitbrille, deren Korrektionsst\u00e4rken bereits den vorhandenen Gl\u00e4sern entsprechen (Mehrfachverordnung),\n- i)\n- Gl\u00e4ser f\u00fcr eine sogenannte Reservebrille, die zum Beispiel aus Gr\u00fcnden der Verkehrssicherheit ben\u00f6tigt werden,\n- j)\n- Gl\u00e4ser f\u00fcr Sportbrillen, au\u00dfer im Fall des Unterabschnitts 1 Nummer 5,\n- k)\n- Brillenetuis,\n- l)\n- Brillenfassungen, au\u00dfer im Fall des Unterabschnitts 1 Nummer 5.\n- 1.\n- Aufwendungen f\u00fcr Kontaktlinsen zur Verbesserung des Visus sind beihilfef\u00e4hig bei:\n- a)\n- Myopie ab 8 dpt,\n- b)\n- Hyperopie ab 8 dpt,\n- c)\n- irregul\u00e4rem Astigmatismus, wenn damit eine um mindestens 20 Prozent verbesserte Sehst\u00e4rke gegen\u00fcber Brillengl\u00e4sern erreicht wird,\n- d)\n- Astigmatismus rectus und inversus ab 3 dpt,\n- e)\n- Astigmatismus obliquus (Achslage 45\u00b0 +/-30\u00b0 oder 135\u00b0 +/-30\u00b0) ab 2 dpt,\n- f)\n- Keratokonus,\n- g)\n- Aphakie,\n- h)\n- Aniseikonie von mehr als 7 Prozent (die Aniseikoniemessung ist nach einer allgemein anerkannten reproduzierbaren Bestimmungsmethode durchzuf\u00fchren und zu dokumentieren),\n- i)\n- Anisometropie ab 2 dpt.\n- 2.\n- Aufwendungen f\u00fcr Kurzzeitlinsen sind je Kalenderjahr nur beihilfef\u00e4hig\n- a)\n- f\u00fcr sph\u00e4rische Kontaktlinsen bis zu 154 Euro,\n- b)\n- f\u00fcr torische Kontaktlinsen bis zu 230 Euro.\n- 3.\n- Bei Vorliegen einer Indikation nach Nummer 1 sind zus\u00e4tzlich Aufwendungen f\u00fcr eine Brille nach Unterabschnitt 2 ungeachtet von Unterabschnitt 1 Nummer 2 beihilfef\u00e4hig. Liegt keine Indikation nach Nummer 1 vor, sind nur die vergleichbaren Kosten f\u00fcr Gl\u00e4ser beihilfef\u00e4hig.\n- 4.\n- Nicht beihilfef\u00e4hig sind:\n- a)\n- Kontaktlinsen als postoperative Versorgung (auch als Verbandlinse oder Verbandschale) nach nicht beihilfef\u00e4higen Eingriffen,\n- b)\n- Kontaktlinsen in farbigen Ausf\u00fchrungen zur Ver\u00e4nderung oder Verst\u00e4rkung der k\u00f6rpereigenen Farbe der Iris,\n- c)\n- One-Day-Linsen,\n- d)\n- multifokale Mehrst\u00e4rkenkontaktlinsen,\n- e)\n- Kontaktlinsen mit Lichtschutz und sonstigen Kantenfiltern,\n- f)\n- Reinigungs- und Pflegemittel f\u00fcr Personen, die das 18. Lebensjahr vollendet haben.\n- 1.\n- Aufwendungen f\u00fcr folgende \u00e4rztlich verordnete vergr\u00f6\u00dfernde Sehhilfen sind beihilfef\u00e4hig:\n- a)\n- optisch vergr\u00f6\u00dfernde Sehhilfen f\u00fcr die N\u00e4he bei einem mindestens 1,5-fachen Vergr\u00f6\u00dferungsbedarf vorrangig als Hellfeldlupe, Hand- und Standlupe, gegebenenfalls mit Beleuchtung, oder Brillengl\u00e4ser mit Lupenwirkung (Lupengl\u00e4ser); in Ausnahmef\u00e4llen als Fernrohrlupenbrillensystem (zum Beispiel nach Galilei, Kepler) einschlie\u00dflich der Systemtr\u00e4ger,\n- b)\n- elektronisch vergr\u00f6\u00dfernde Sehhilfen f\u00fcr die N\u00e4he als mobile oder nicht mobile Systeme bei einem mindestens 6-fachen Vergr\u00f6\u00dferungsbedarf,\n- c)\n- optisch vergr\u00f6\u00dfernde Sehhilfen f\u00fcr die Ferne als fokussierende Handfernrohre oder Monokulare.\n- 2.\n- Nicht beihilfef\u00e4hig sind Aufwendungen f\u00fcr:\n- a)\n- Fernrohrlupenbrillensysteme (zum Beispiel nach Galilei oder Kepler) f\u00fcr die Zwischendistanz (Raumkorrektur) oder die Ferne,\n- b)\n- separate Lichtquellen (zum Beispiel zur Kontrasterh\u00f6hung oder zur Ausleuchtung der Lekt\u00fcre),\n- c)\n- Fresnellinsen.\n- 1.\n- Aufwendungen f\u00fcr folgende therapeutische Sehhilfen zur Behandlung einer Augenverletzung oder Augenerkrankung sind beihilfef\u00e4hig, wenn die Sehhilfe von einer Fach\u00e4rztin oder einem Facharzt f\u00fcr Augenheilkunde verordnet worden ist:\n- a)\n- Glas mit Lichtschutz mit einer Transmission bis 75 Prozent bei\n- aa)\n- Substanzverlusten der Iris, die den Blendschutz herabsetzen (zum Beispiel Iriskolobom, Aniridie, traumatische Mydriasis, Iridodialyse),\n- bb)\n- Albinismus.\n- b)\n- Glas mit Ultraviolett-(UV-)Kantenfilter (400 Nanometer Wellenl\u00e4nge) bei\n- aa)\n- Aphakie,\n- bb)\n- Photochemotherapie zur Absorption des langwelligen UV-Lichts,\n- cc)\n- UV-Schutz nach Pseudophakie, wenn keine Intraokularlinse mit UV-Schutz implantiert wurde,\n- dd)\n- Iriskolobom,\n- ee)\n- Albinismus.\n- c)\n- Glas mit Kantenfilter als Bandpassfilter mit einem Transmissionsmaximum bei einer Wellenl\u00e4nge von 450 Nanometer bei Blauzapfenmonochromasie. Ist beim Kantenfilterglas zus\u00e4tzlich ein Refraktionsausgleich und gegebenenfalls auch eine Transmissionsminderung notwendig, sind die Aufwendungen f\u00fcr die entsprechenden Gl\u00e4ser nach Unterabschnitt 2 beihilfef\u00e4hig. Vorbehaltlich einer erfolgreichen Austestung sind zus\u00e4tzlich die Aufwendungen f\u00fcr einen konfektionierten Seitenschutz beihilfef\u00e4hig.\n- d)\n- Glas mit Kantenfilter (Wellenl\u00e4nge gr\u00f6\u00dfer als 500 Nanometer) als Langpassfilter zur Vermeidung der St\u00e4bchenbleichung und zur Kontrastanhebung bei\n- aa)\n- angeborenem Fehlen von oder angeborenem Mangel an Zapfen in der Netzhaut (Achromatopsie, inkomplette Achromatopsie),\n- bb)\n- dystrophischen Netzhauterkrankungen (zum Beispiel Zapfendystrophien, Zapfen-St\u00e4bchen-Dystrophien, St\u00e4bchen-Zapfen-Dystrophien, Retinopathia pigmentosa, Chorioidemie),\n- cc)\n- Albinismus.\n- e)\n- Horizontale Prismen in Gl\u00e4sern ab 3 Prismendioptrien und Folien mit prismatischer Wirkung ab 3 Prismendioptrien (Gesamtkorrektur auf beiden Augen) sowie vertikale Prismen und Folien ab 1 Prismendioptrie, bei\n- aa)\n- krankhaften St\u00f6rungen in der sensorischen und motorischen Zusammenarbeit der Augen mit dem Ziel, Binokularsehen zu erm\u00f6glichen und die sensorische Zusammenarbeit der Augen zu verbessern,\n- bb)\n- Augenmuskelparesen, um Muskelkontrakturen zu beseitigen oder zu verringern.\n- f)\n- Okklusionsschalen oder -linsen bei dauerhaft therapeutisch nicht anders beeinflussbarer Doppelwahrnehmung;\n- g)\n- Kunststoff-Bifokalgl\u00e4ser mit besonders gro\u00dfem Nahteil zur Behebung des akkommodativen Schielens bei Personen, die das 18. Lebensjahr noch nicht vollendet haben;\n- h)\n- Okklusionspflaster und -folien als Amblyopietherapeutika, nachrangig Okklusionskapseln;\n- i)\n- Uhrglasverb\u00e4nde oder konfektionierter Seitenschutz bei unvollst\u00e4ndigem Lidschluss (zum Beispiel infolge einer Gesichtsl\u00e4hmung) oder bei Zustand nach Keratoplastik, um das Austrocknen der Hornhaut zu vermeiden;\n- j)\n- Irislinsen mit durchsichtigem, optisch wirksamem Zentrum bei Substanzverlusten der Iris, die den Blendschutz herabsetzen (zum Beispiel Iriskolobom, Aniridie, traumatische Mydriasis, Iridodialyse oder Albinismus);\n- k)\n- Verbandlinsen oder -schalen bei oder nach\n- aa)\n- Hornhauterosionen oder -epitheldefekten,\n- bb)\n- Abrasio nach Operation,\n- cc)\n- Ver\u00e4tzung oder Verbrennung,\n- dd)\n- Hornhautverletzungen (perforierend oder lamellierend),\n- ee)\n- Keratoplastik,\n- ff)\n- Hornhautentz\u00fcndungen und -ulzerationen (zum Beispiel Keratitis bullosa, Keratitis neuroparalytica, Keratitis e lagophtalmo, Keratitis filiformis);\n- l)\n- Kontaktlinsen als Medikamententr\u00e4ger zur kontinuierlichen Medikamentenzufuhr;\n- m)\n- Kontaktlinsen\n- aa)\n- bei ausgepr\u00e4gtem, fortgeschrittenem Keratokonus mit keratokonusbedingten pathologischen Hornhautver\u00e4nderungen und Hornhautradius unter 7 Millimeter zentral oder im Apex,\n- bb)\n- nach Hornhauttransplantation oder Keratoplastik;\n- n)\n- Kunststoffgl\u00e4ser als Schutzgl\u00e4ser bei\n- aa)\n- erheblich sturzgef\u00e4hrdeten Personen, die an Epilepsie oder an Spastiken erkrankt sind,\n- bb)\n- funktionell Ein\u00e4ugigen (bestkorrigierter Visus mindestens eines Auges unter 0,2).\n- 2.\n- Nicht beihilfef\u00e4hig sind Aufwendungen f\u00fcr\n- a)\n- Kantenfilter bei\n- aa)\n- altersbedingter Makuladegeneration,\n- bb)\n- diabetischer Retinopathie,\n- cc)\n- Opticusatrophie (au\u00dfer im Zusammenhang mit einer dystrophischen Netzhauterkrankung),\n- dd)\n- Fundus myopicus,\n- b)\n- Verbandlinsen oder -schalen nach nicht beihilfef\u00e4higen Eingriffen,\n- c)\n- Okklusionslinsen und -schalen als Amblyopietherapeutikum.\nText in der Fassung des\n[Artikels 1 Neunte Verordnung zur \u00c4nderung der Bundesbeihilfeverordnung V. v. 1. Dezember 2020 BGBl. I S. 2713, 2021 I 343](/gesetz/14293/a255242.htm)m.W.v. 1. Januar 2021\nAnlage 12 (zu\n[\u00a7 25 Absatz 1, 2 und 4](https://www.buzer.de/gesetz/8634/a159956.htm)) Nicht beihilfef\u00e4hige Hilfsmittel, Ger\u00e4te zur Selbstbehandlung und Selbstkontrolle\nAnlage 12 hat\n[5 fr\u00fchere Fassungen](/gesetz/8634/al159996.htm)und wird in [8 Vorschriften zitiert](/gesetz/8634/v159996.htm)\nNicht zu den beihilfef\u00e4higen Hilfsmitteln geh\u00f6ren Gegenst\u00e4nde, die weder notwendig noch wirtschaftlich angemessen (\n9.2 Inuma-Ger\u00e4t (alpha, beta, gamma)\n9.3 Ionisierungsger\u00e4te (zum Beispiel Ionisator, Pollimed 100)\n9.4 Ionopront, Permox-Sauerstofferzeuger\n[\u00a7 6 Absatz 1](https://www.buzer.de/gesetz/8634/a159937.htm)) sind, die einen geringen oder umstrittenen therapeutischen Nutzen oder einen geringen Abgabepreis haben ( [\u00a7 25 Absatz 2](https://www.buzer.de/gesetz/8634/a159956.htm)) oder die zur allgemeinen Lebenshaltung geh\u00f6ren. Nicht beihilfef\u00e4hig sind insbesondere folgende Gegenst\u00e4nde:\n- 1.1\n- Adju-Set/-Sano\n- 1.2\n- Angoraw\u00e4sche\n- 1.3\n- antiallergene Matratzen, Matratzenbez\u00fcge und Bettbez\u00fcge\n- 1.4\n- Aqua-Therapie-Hose\n- 1.5\n- Arbeitsplatte zum Krankenfahrstuhl\n- 1.6\n- Augenheizkissen\n- 1.7\n- Autofahrerr\u00fcckenst\u00fctze\n- 1.8\n- Autokindersitz\n- 1.9\n- Autokofferraumlifter\n- 1.10\n- Autolifter\n- 2.1\n- Badewannengleitschutz/-kopfst\u00fctze/-matte\n- 2.2\n- Bandagen (soweit nicht in\n[Anlage 11](https://www.buzer.de/gesetz/8634/a159995.htm)aufgef\u00fchrt)\n- 2.3\n- Basalthermometer\n- 2.4\n- Bauchgurt\n- 2.5\n- Bestrahlungsger\u00e4te/-lampen zur Selbstbehandlung, soweit nicht in\n[Anlage 11](https://www.buzer.de/gesetz/8634/a159995.htm)aufgef\u00fchrt\n- 2.6\n- Bett (soweit nicht in\n[Anlage 11](https://www.buzer.de/gesetz/8634/a159995.htm)aufgef\u00fchrt)\n- 2.7\n- Bettbrett/-f\u00fcllung/-lagerungskissen/-platte/-rost/-st\u00fctze\n- 2.8\n- Bett-Tisch\n- 2.9\n- Bidet\n- 2.10\n- Bildschirmbrille\n- 2.11\n- Bill-Wanne\n- 2.12\n- Blinden-Uhr\n- 2.13\n- Blutdruckmessger\u00e4t\n- 2.14\n- Br\u00fcckentisch\n- 3.1\n- (frei)\n- 4.1\n- Dusche\n- 5.1\n- Einkaufsnetz\n- 5.2\n- Einmal-Handschuhe, es sei denn, sie sind bei regelm\u00e4\u00dfiger Katheterisierung, zur endotrachialen Absaugung, im Zusammenhang mit sterilem Ansaugkatheter oder bei Querschnittgel\u00e4hmten zur Darmentleerung erforderlich\n- 5.3\n- Eisbeutel und -kompressen\n- 5.4\n- Elektrische Schreibmaschine\n- 5.5\n- Elektrische Zahnb\u00fcrste\n- 5.6\n- Elektrofahrzeuge, soweit nicht in\n[Anlage 11](https://www.buzer.de/gesetz/8634/a159995.htm)aufgef\u00fchrt\n- 5.7\n- Elektro-Luftfilter\n- 5.8\n- Elektronic-Muscle-Control (EMC 1000)\n- 5.9\n- Erektionshilfen\n- 5.10\n- Ergometer\n- 5.11\n- Ess- und Trinkhilfen\n- 5.12\n- Expander\n- 6.1\n- Fieberthermometer\n- 6.2\n- Fu\u00dfgymnastik-Rolle, Fu\u00dfwippe (zum Beispiel Venentrainer)\n- 7.1\n- Garage f\u00fcr Krankenfahrzeuge\n- 8.1\n- Handschuhe, es sei denn, sie sind nach Nummer 11.21 der\n[Anlage 11](https://www.buzer.de/gesetz/8634/a159995.htm)erforderlich\n- 8.2\n- Handtrainer\n- 8.3\n- H\u00e4ngeliege\n- 8.4\n- Hantel (Federhantel)\n- 8.5\n- Hausnotrufsystem\n- 8.6\n- Hautschutzmittel\n- 8.7\n- Heimtrainer\n- 8.8\n- Heizdecke/-kissen\n- 8.9\n- Hilfsger\u00e4te f\u00fcr die Hausarbeit\n- 8.10\n- H\u00f6hensonne\n- 8.11\n- H\u00f6rkissen\n- 8.12\n- H\u00f6rkragen Akusta-Coletta\n9.2 Inuma-Ger\u00e4t (alpha, beta, gamma)\n9.3 Ionisierungsger\u00e4te (zum Beispiel Ionisator, Pollimed 100)\n9.4 Ionopront, Permox-Sauerstofferzeuger\n- 10.1\n- (frei)\n- 11.1\n- Katzenfell\n- 11.2\n- Klingelleuchten, die nicht von Nummer 12.4 der\n[Anlage 11](https://www.buzer.de/gesetz/8634/a159995.htm)erfasst sind\n- 11.3\n- Knickfu\u00dfstrumpf\n- 11.4\n- Knoche Natur-Bruch-Slip\n- 11.5\n- Kolorimeter\n- 11.6\n- Kommunikationssystem\n- 11.7\n- Kraftfahrzeug einschlie\u00dflich behindertengerechter Umr\u00fcstung\n- 11.8\n- Krankenunterlagen, es sei denn,\n- a)\n- sie sind in direktem Zusammenhang mit der Behandlung einer Krankheit erforderlich (Blasen- oder Darminkontinenz im Rahmen einer Dekubitusbehandlung oder bei Dermatitiden),\n- b)\n- neben der Blasen- oder Darminkontinenz liegen so schwere Funktionsst\u00f6rungen vor (zum Beispiel Halbseitenl\u00e4hmung mit Sprachverlust), dass sonst der Eintritt von Dekubitus oder Dermatitiden droht,\n- c)\n- die Teilnahme am gesellschaftlichen Leben wird damit wieder erm\u00f6glicht\n- 11.9\n- Kreislaufger\u00e4t\n- 12.1\n- Lagerungskissen/-st\u00fctze, ausgenommen Nummer 1.1 der\n[Anlage 11](https://www.buzer.de/gesetz/8634/a159995.htm)\n- 12.2\n- Language-Master\n- 12.3\n- Luftreinigungsger\u00e4te\n- 13.1\n- Magnetfolie\n- 13.2\n- Monophonator\n- 13.3\n- Munddusche\n- 14.1\n- Nackenheizkissen\n- 15.1\n- \u00d6ldispersionsapparat\n- 16.1\n- Pulsfrequenzmesser\n- 17.1\n- (frei)\n- 18.1\n- Rotlichtlampe\n- 18.2\n- R\u00fcckentrainer\n- 19.1\n- Salbenpinsel\n- 19.2\n- Schlaftherapieger\u00e4t\n- 19.3\n- Schuhe, soweit nicht in\n[Anlage 11](https://www.buzer.de/gesetz/8634/a159995.htm)aufgef\u00fchrt\n- 19.4\n- Spezialsitze\n- 19.5\n- Spirometer\n- 19.6\n- Spranzbruchband\n- 19.7\n- Sprossenwand\n- 19.8\n- Sterilisator\n- 19.9\n- Stimm\u00fcbungssystem f\u00fcr Kehlkopflose\n- 19.10\n- Stockroller\n- 19.11\n- Stockst\u00e4nder\n- 19.12\n- Stufenbett\n- 19.13\n- SUNTRONIC-System (AS 43)\n- 20.1\n- Taktellger\u00e4t\n- 20.2\n- Tamponapplikator\n- 20.3\n- Tandem f\u00fcr Behinderte\n- 20.4\n- Telefonverst\u00e4rker\n- 20.5\n- Telefonhalter\n- 20.6\n- Therapeutische W\u00e4rme-/K\u00e4ltesegmente\n- 20.7\n- Treppenlift, Monolift, Plattformlift\n- 21.1\n- \u00dcbungsmatte\n- 21.2\n- Ultraschalltherapieger\u00e4te\n- 21.3\n- Urin-Pr\u00fcfger\u00e4t\n- 23.1\n- Waage\n- 23.2\n- Wandstandger\u00e4t\n- 24.1\n- (frei)\n- 25.1\n- (frei)\n- 26.1\n- Zahnpflegemittel\n- 26.2\n- Zweirad f\u00fcr Behinderte.\nText in der Fassung des\n[Artikels 1 Neunte Verordnung zur \u00c4nderung der Bundesbeihilfeverordnung V. v. 1. Dezember 2020 BGBl. I S. 2713, 2021 I 343](/gesetz/14293/a255242.htm)m.W.v. 1. Januar 2021\nAnlage 13 (zu\n[\u00a7 41 Absatz 1 Satz 3](https://www.buzer.de/gesetz/8634/a159972.htm)) Nach [\u00a7 41 Absatz 1 Satz 3](https://www.buzer.de/gesetz/8634/a159972.htm) beihilfef\u00e4hige Fr\u00fcherkennungsuntersuchungen, Vorsorgema\u00dfnahmen und Schutzimpfungen\nAnlage 13 hat\n[5 fr\u00fchere Fassungen](/gesetz/8634/al177735.htm)und wird in [9 Vorschriften zitiert](/gesetz/8634/v177735.htm)\n1 Fr\u00fcherkennungsuntersuchungen und Vorsorgema\u00dfnahmen\n- 1.1\n- Telemedizinische Betreuung (Telemonitoring) bei chronischer Herzinsuffizienz\n- 1.2\n- Fr\u00fcherkennungsuntersuchungen\n- 1.2.1\n- U 10 bei Personen, die das siebte, aber noch nicht das neunte Lebensjahr vollendet haben\n- 1.2.2\n- U 11 bei Personen, die das neunte, aber noch nicht das elfte Lebensjahr vollendet haben\n- 1.2.3\n- J 2 bei Personen, die das 16., aber noch nicht das 18. Lebensjahr vollendet haben\n- 2.1\n- Fr\u00fchsommer-Meningoenzephalitis-(FSME-)Schutzimpfungen ohne Einschr\u00e4nkungen\n- 2.2\n- Grippeschutzimpfungen ohne Einschr\u00e4nkungen\nText in der Fassung des\n[Artikels 1 Neunte Verordnung zur \u00c4nderung der Bundesbeihilfeverordnung V. v. 1. Dezember 2020 BGBl. I S. 2713, 2021 I 343](/gesetz/14293/a255242.htm)m.W.v. 1. Januar 2021\nAnlage 14 (zu\n[\u00a7 41 Absatz 3](https://www.buzer.de/gesetz/8634/a159972.htm)) Fr\u00fcherkennungsprogramm f\u00fcr erblich belastete Personen mit einem erh\u00f6hten famili\u00e4ren Brust- oder Eierstockkrebsrisiko\nAnlage 14 hat\n[5 fr\u00fchere Fassungen](/gesetz/8634/al188445.htm)und wird in [7 Vorschriften zitiert](/gesetz/8634/v188445.htm)\nAufwendungen f\u00fcr die Teilnahme am Fr\u00fcherkennungsprogramm f\u00fcr erblich belastete Personen mit einem erh\u00f6hten famili\u00e4ren Brust- oder Eierstockkrebsrisiko setzen sich aus den Aufwendungen f\u00fcr\n- 1.\n- Risikofeststellung und interdisziplin\u00e4re Beratung,\n- 2.\n- genetische Analyse,\n- 3.\n- Teilnahme an einem Strukturierten Fr\u00fcherkennungsprogramm\n- 1.\n- Risikofeststellung und interdisziplin\u00e4re Beratung\nPro Familie sind die Aufwendungen f\u00fcr eine einmalige Risikofeststellung mit interdisziplin\u00e4rer Erstberatung, Stammbaumerfassung und Mitteilung des Genbefundes pauschal in H\u00f6he von 900 Euro beihilfef\u00e4hig. Die Pauschale beinhaltet auch die Beratung weiterer Familienmitglieder.\n- 2.\n- Genetische Analyse\nAufwendungen f\u00fcr eine genetische Analyse bei einer an Brust- oder Eierstockkrebs erkrankten Person (Indexfall) sind pauschal in H\u00f6he von 4.500 Euro beihilfef\u00e4hig. Wird eine ratsuchende gesunde Person nur hinsichtlich der mutierten Gensequenz untersucht, sind die Aufwendungen in H\u00f6he von 250 Euro beihilfef\u00e4hig.\nDie genetische Analyse wird bei den Indexf\u00e4llen durchgef\u00fchrt. Dabei handelt es sich in der Regel um einen diagnostischen Gentest, dessen Kosten der erkrankten Person zugerechnet werden. Dagegen werden die Kosten einer sich als pr\u00e4diktiver Gentest darstellenden genetischen Analyse der Indexperson der gesunden ratsuchenden Person zugerechnet. Ein pr\u00e4diktiver Gentest liegt vor, wenn sich aus dem Test keine Therapieoptionen f\u00fcr die Indexperson mehr ableiten lassen, die genetische Analyse also keinen diagnostischen Charakter hat. Eine solche Situation ist gesondert durch eine schriftliche \u00e4rztliche Stellungnahme zu attestieren.\n- 3.\n- Teilnahme an einem Strukturierten Fr\u00fcherkennungsprogramm\nAufwendungen f\u00fcr die Teilnahme an einem strukturierten Fr\u00fcherkennungsprogramm sind einmal j\u00e4hrlich in H\u00f6he von pauschal 580 Euro beihilfef\u00e4hig.\n- 4.\n- Im Deutschen Konsortium Famili\u00e4rer Brust- und Eierstockkrebs zusammengeschlossene universit\u00e4re Zentren\n- a)\n- Berlin\nCharit\u00e9 - Universit\u00e4tszentrum Berlin, Brustzentrum\n- b)\n- Dresden\nMedizinische Fakult\u00e4t der Technischen Universit\u00e4t Dresden\nKlinik und Poliklinik f\u00fcr Frauenheilkunde und Geburtshilfe\n- c)\n- D\u00fcsseldorf\nUniversit\u00e4tsklinikum D\u00fcsseldorf, Frauenklinik, Brustzentrum\n- d)\n- Erlangen\nUniversit\u00e4tsklinikum Erlangen Famili\u00e4res Brust- und Eierstockkrebszentrum\n- e)\n- Frankfurt\nUniversit\u00e4tsklinikum Frankfurt Klinik f\u00fcr Frauenheilkunde und Geburtshilfe\n- f)\n- Freiburg\nInstitut f\u00fcr Humangenetik des Universit\u00e4tsklinikums Freiburg\n- g)\n- G\u00f6ttingen\nUniversit\u00e4ts-Medizin G\u00f6ttingen, Brustzentrum, Gyn\u00e4kologisches Krebszentrum\n- h)\n- Greifswald\nInstitut f\u00fcr Humangenetik der Universit\u00e4tsmedizin Greifswald\n- i)\n- Halle\nUniversit\u00e4tsklinikum Halle, Klinik und Poliklinik f\u00fcr Gyn\u00e4kologie\n- j)\n- Hamburg\nBrustzentrum Klinik und Poliklinik f\u00fcr Gyn\u00e4kologie\nUniversit\u00e4tsklinikum Hamburg-Eppendorf\n- k)\n- Hannover\nInstitut f\u00fcr Humangenetik, Medizinische Hochschule Hannover\n- l)\n- Heidelberg\nInstitut f\u00fcr Humangenetik der Universit\u00e4t Heidelberg\n- m)\n- Kiel\nKlinik f\u00fcr Gyn\u00e4kologie und Geburtshilfe des Universit\u00e4tsklinikums Schleswig-Holstein\n- n)\n- K\u00f6ln\nZentrum Famili\u00e4rer Brust- und Eierstockkrebs\n- o)\n- Leipzig\nInstitut f\u00fcr Humangenetik der Universit\u00e4t Leipzig\nZentrum f\u00fcr famili\u00e4ren Brust- und Eierstockkrebs\n- p)\n- Mainz\nZentrum f\u00fcr famili\u00e4ren Brust- und Eierstockkrebs der Universit\u00e4tsmedizin Mainz, Institut f\u00fcr Humangenetik und Klinik f\u00fcr Frauengesundheit\n- q)\n- M\u00fcnchen\nUniversit\u00e4tsfrauenklinik der Ludwig-Maximilians-Universit\u00e4t M\u00fcnchen-Gro\u00dfhadern\nUniversit\u00e4tsfrauenklinik der Technischen Universit\u00e4t M\u00fcnchen am Klinikum rechts der Isar\n- r)\n- M\u00fcnster\nInstitut f\u00fcr Humangenetik der Universit\u00e4t M\u00fcnster\n- s)\n- Regensburg\nInstitut f\u00fcr Humangenetik, Universit\u00e4t Regensburg\n- t)\n- T\u00fcbingen\nUniversit\u00e4t T\u00fcbingen, Institut f\u00fcr Humangenetik\n- u)\n- Ulm\nFrauenklinik und Poliklinik der Universit\u00e4t Ulm\n- v)\n- W\u00fcrzburg\nInstitut f\u00fcr Humangenetik der Universit\u00e4t W\u00fcrzburg\nText in der Fassung der\n[Berichtigung der Neunten Verordnung zur \u00c4nderung der Bundesbeihilfeverordnung B. v. 1. M\u00e4rz 2021 BGBl. I S. 343](/gesetz/14515/a268368.htm)m.W.v. 1. Januar 2021\nAnlage 14a (zu\n[\u00a7 41 Absatz 4](https://www.buzer.de/gesetz/8634/a159972.htm)) Fr\u00fcherkennungsprogramm f\u00fcr erblich belastete Personen mit einem erh\u00f6hten famili\u00e4ren Darmkrebsrisiko\nAnlage 14a hat\n[3 fr\u00fchere Fassungen](/gesetz/8634/al212490.htm)und wird in [6 Vorschriften zitiert](/gesetz/8634/v212490.htm)\nAufwendungen f\u00fcr die Teilnahme am Fr\u00fcherkennungsprogramm f\u00fcr erblich belastete Personen mit einem erh\u00f6hten famili\u00e4ren Darmkrebsrisiko setzen sich aus den Aufwendungen f\u00fcr\n- 1.\n- Risikofeststellung und interdisziplin\u00e4re Beratung,\n- 2.\n- Tumorgewebsdiagnostik,\n- 3.\n- genetische Analyse (Untersuchung auf Keimbahnmutation),\n- 4.\n- Fr\u00fcherkennungsma\u00dfnahmen\n- 1.\n- Risikofeststellung und interdisziplin\u00e4re Beratung\nUnter der Voraussetzung, dass die revidierten Bethesda-Kriterien in der Familie der ratsuchenden Person erf\u00fcllt sind, sind die Aufwendungen f\u00fcr die erstmalige Risikofeststellung und interdisziplin\u00e4re Beratung einschlie\u00dflich Erhebung des Familienbefundes und Organisation der diagnostischen Abkl\u00e4rung einmalig in H\u00f6he von 600 Euro beihilfef\u00e4hig. Aufwendungen f\u00fcr jede weitere Beratung einer Person, in deren Familie bereits das Lynch-Syndrom oder Polyposis-Syndrom bekannt ist, sind in H\u00f6he von 300 Euro beihilfef\u00e4hig.\n- 2.\n- Tumorgewebsdiagnostik\nAufwendungen f\u00fcr die immunhistochemische Untersuchung am Tumorgewebe hinsichtlich der Expression der Mismatch-Reparatur-Gene MLH1, MSH2, MSH6 und PMS sowie gegebenenfalls die Mikrosatellitenanalyse und Testung auf somatische Mutationen im Tumorgewebe sind in H\u00f6he von 500 Euro beihilfef\u00e4hig. Ist die Analyse des Tumorgewebes negativ und das Ergebnis eindeutig, sind Aufwendungen f\u00fcr weitere Untersuchungen auf eine Mutation nicht beihilfef\u00e4hig. Bei Verdacht eines Polyposis-Syndroms entf\u00e4llt eine Tumorgewebsdiagnostik.\n- 3.\n- Genetische Analyse (Untersuchung auf Keimbahnmutation)\nAufwendungen f\u00fcr eine genetische Analyse zur Mutationssuche auf eine bis dahin in der Familie nicht identifizierten Keimbahnmutation bei einem Indexfall oder bei Vorliegen der Voraussetzungen bei einem ratsuchenden Verdachtsfall sind in H\u00f6he von 3.500 Euro beihilfef\u00e4hig, wenn die Einschlusskriterien und m\u00f6glichst eine abgeschlossene Tumorgewebsdiagnostik, die auf das Vorliegen einer MMR-Mutation hinweist, vorliegen. Aufwendungen f\u00fcr die pr\u00e4diktive oder diagnostische Testung weiterer Personen auf eine in der Familie bekannte Genmutation sind in H\u00f6he von 350 Euro beihilfef\u00e4hig.\n- 4.\n- Fr\u00fcherkennungsma\u00dfnahmen\nUnter den Voraussetzungen, dass ein Lynch- oder ein Polyposis-Syndrom vorliegt, sind Aufwendungen f\u00fcr eine j\u00e4hrliche endoskopische Untersuchung des Magendarmtraktes einschlie\u00dflich Biopsien, Polypektomien und Videoendoskopien in H\u00f6he von 540 Euro beihilfef\u00e4hig.\n- 5.\n- Kliniken des Deutschen HNPCC-Konsortiums\n- a)\n- Berlin\nCharit\u00e9 - Universit\u00e4tsmedizin Berlin\n- b)\n- Bochum\nRuhr-Universit\u00e4t Bochum\nKnappschaftskrankenhaus, Medizinische Universit\u00e4tsklinik\n- c)\n- Bonn\nInstitut f\u00fcr Humangenetik, Biomedizinisches Zentrum\n- d)\n- Dresden\nAbteilung Chirurgische Forschung, Universit\u00e4tsklinikum Carl Gustav Carus\n- e)\n- D\u00fcsseldorf\nInstitut f\u00fcr Humangenetik und Anthropologie, Universit\u00e4tsklinikum D\u00fcsseldorf\n- f)\n- Halle\nUniversit\u00e4tsklinikum Halle\n- g)\n- Hannover\nMedizinische Hochschule\n- h)\n- Heidelberg\nAbteilung f\u00fcr Angewandte Tumorbiologie, Pathologisches Institut des Universit\u00e4tsklinikums Heidelberg\n- i)\n- K\u00f6ln\nUniversit\u00e4tsklinikum K\u00f6ln\n- j)\n- Leipzig\nUniversit\u00e4t Leipzig\n- k)\n- L\u00fcbeck\nKlinik f\u00fcr Chirurgie, Universit\u00e4t zu L\u00fcbeck und Universit\u00e4tsklinikum Schleswig-Holstein, Campus L\u00fcbeck\n- l)\n- M\u00fcnchen\nMedizinische Klinik, Ludwig-Maximilians-Universit\u00e4t\nMedizinisch-Genetisches Zentrum\n- m)\n- M\u00fcnster\nUniversit\u00e4tsklinikum M\u00fcnster\n- n)\n- T\u00fcbingen\nUniversit\u00e4t T\u00fcbingen\n- o)\n- Ulm\nUniversit\u00e4tsklinikum Ulm\n- p)\n- Wuppertal\nHELIOS Universit\u00e4tsklinikum Wuppertal\nText in der Fassung der\n[Berichtigung der Neunten Verordnung zur \u00c4nderung der Bundesbeihilfeverordnung B. v. 1. M\u00e4rz 2021 BGBl. I S. 343](/gesetz/14515/a268368.htm)m.W.v. 1. Januar 2021\nAnlage 15 (aufgehoben)\nAnlage 15 hat\n[4 fr\u00fchere Fassungen](/gesetz/8634/al201428.htm)und wird in [4 Vorschriften zitiert](/gesetz/8634/v201428.htm)\nText in der Fassung des\n[Artikels 1 Neunte Verordnung zur \u00c4nderung der Bundesbeihilfeverordnung V. v. 1. Dezember 2020 BGBl. I S. 2713, 2021 I 343](/gesetz/14293/a255242.htm)m.W.v. 1. Januar 2021\nAnlage 16 (zu\n[\u00a7 51a Absatz 2](https://www.buzer.de/gesetz/8634/a212489.htm)) Antrag auf Gew\u00e4hrung von Beihilfe und auf Direktabrechnung\nAnlage 16 hat\n[2 fr\u00fchere Fassungen](/gesetz/8634/al212491.htm)und wird in [4 Vorschriften zitiert](/gesetz/8634/v212491.htm)\nText in der Fassung des\n[Artikels 1 Neunte Verordnung zur \u00c4nderung der Bundesbeihilfeverordnung V. v. 1. Dezember 2020 BGBl. I S. 2713, 2021 I 343](/gesetz/14293/a255242.htm)m.W.v. 1. Januar 2021\nLink zu dieser Seite: https://www.buzer.de/gesetz/8634/b26267.htm\n[](/newsletter.htm?t=121&alarmAddTitle=8634)\nBBhV\n\u00c4nderungen\nBBhV\nCompliance\n\u00c4nderungen\n\u00fcberwachen\nSie werden \u00fcber jede verk\u00fcndete oder in Kraft tretende \u00c4nderung per Mail informiert, sofort, w\u00f6chentlich oder in dem Intervall, das Sie gew\u00e4hlt haben.\nStellen Sie Ihr Paket zu \u00fcberwachender Vorschriften beliebig zusammen.\nJetzt anmelden!\nWeitere Vorteile:\nKonsolidierte Vorschriften selbst bei Inkrafttreten \"am Tage nach der Verk\u00fcndung\", Synopse zu jeder \u00c4nderungen, Begr\u00fcndungen des Gesetzgebers", "language": null, "image": null, "pagetype": null, "links": ["/index.htm", "#", "#b", "/index.htm", "/s.htm", "/fna/index.htm", "/z.htm", "/v.htm", "/h.htm", "/quality.htm", "https://www.buzer.de/k.htm", "/i.htm", "/li.htm", "/gesetz/8634/b26267.htm?setmobile=1", "/outb/gapp/?id=dli.buzerde", "/gesetze-ticker.htm", "/gesetze_feed.xml", "https://www.buzer.de/rechtskataster.htm", "/danke.htm", "/werben.htm", "/index.htm", "/gesetz/8634/index.htm", "https://www.buzer.de/newsletter.htm?t=1&alarmAddTitle=8634", "https://www.buzer.de/outb/bgbl/0326091.htm", "/s1.htm?g=nr+8.2009", "/gesetz/14293/a255242.htm", "/gesetz/14293/index.htm", "/fna/2030-Beamte.htm", "https://www.buzer.de/gesetz/8634/l.htm", "/gesetz/8634/v0.htm", "https://www.buzer.de/gesetz/8634/b26267.htm", "/gesetz/8634/a159989.htm", "/gesetz/8634/a159990.htm", "/gesetz/8634/a159991.htm", "/gesetz/8634/a177729.htm", "/gesetz/8634/a159992.htm", "/gesetz/8634/a177730.htm", "/gesetz/8634/a177731.htm", "/gesetz/8634/a177732.htm", "/gesetz/8634/a177733.htm", "/gesetz/8634/a159993.htm", "/gesetz/8634/a159994.htm", "/gesetz/8634/a177734.htm", "/gesetz/8634/a159995.htm", "/gesetz/8634/a159996.htm", "/gesetz/8634/a177735.htm", "/gesetz/8634/a188445.htm", "/gesetz/8634/a212490.htm", "/gesetz/8634/a201428.htm", "/gesetz/8634/a212491.htm", "/gesetz/8634/al159989.htm", "/gesetz/8634/v159989.htm", "https://www.buzer.de/gesetz/8634/a159937.htm", "https://www.buzer.de/gesetz/8634/a159937.htm", "https://www.buzer.de/141_SGB_11.htm", "https://www.buzer.de/144_SGB_11.htm", "https://www.buzer.de/145_SGB_11.htm", "https://www.buzer.de/gesetz/8634/a212489.htm", "https://www.buzer.de/gesetz/8634/a159957.htm", "/gesetz/14515/a268368.htm", "https://www.buzer.de/gesetz/8634/index.htm#artanc159989", "/Gesetze_PDF_ausdrucken.htm", "#", "https://www.buzer.de/gesetz/8634/index.htm#artanc159990", "/Gesetze_PDF_ausdrucken.htm", "#", "https://www.buzer.de/gesetz/8634/a159937.htm", "/gesetz/8634/al159991.htm", "/gesetz/8634/v159991.htm", "https://www.buzer.de/gesetz/5678/index.htm", "https://www.buzer.de/gesetz/5678/index.htm", "https://www.buzer.de/gesetz/8634/a159994.htm", "/gesetz/14293/a255242.htm", "https://www.buzer.de/gesetz/8634/index.htm#artanc159991", "/Gesetze_PDF_ausdrucken.htm", "#", "https://www.buzer.de/gesetz/8634/a159937.htm", "/gesetz/8634/al177729.htm", "/gesetz/8634/v177729.htm", "/gesetz/11236/a188439.htm", "https://www.buzer.de/gesetz/8634/index.htm#artanc177729", "/Gesetze_PDF_ausdrucken.htm", "#", "https://www.buzer.de/gesetz/8634/a159949.htm", "https://www.buzer.de/gesetz/8634/a159952.htm", "/gesetz/8634/al159992.htm", "/gesetz/8634/v159992.htm", "https://www.buzer.de/gesetz/8634/a159949.htm", "https://www.buzer.de/s1.htm?a=18-21&ag=8634", "https://www.buzer.de/gesetz/8634/a159952.htm", "https://www.buzer.de/gesetz/8634/a159937.htm", "https://www.buzer.de/gesetz/5678/index.htm", "https://www.buzer.de/gesetz/5678/index.htm", "https://www.buzer.de/gesetz/8634/a159950.htm", "https://www.buzer.de/gesetz/8634/a188444.htm", "https://www.buzer.de/gesetz/8634/a159937.htm", "https://www.buzer.de/gesetz/8634/a159937.htm", "/gesetz/14293/a255242.htm", "https://www.buzer.de/gesetz/8634/index.htm#artanc159992", "/Gesetze_PDF_ausdrucken.htm", "#", "https://www.buzer.de/gesetz/8634/a159953.htm", "/gesetz/8634/al177730.htm", "/gesetz/8634/v177730.htm", "/gesetz/14293/a255242.htm", "https://www.buzer.de/gesetz/8634/index.htm#artanc177730", "/Gesetze_PDF_ausdrucken.htm", "#", "https://www.buzer.de/gesetz/8634/a159953.htm", "/gesetz/8634/al177731.htm", "/gesetz/8634/v177731.htm", "/gesetz/14293/a255242.htm", "https://www.buzer.de/gesetz/8634/index.htm#artanc177731", "/Gesetze_PDF_ausdrucken.htm", "#", "https://www.buzer.de/gesetz/8634/a159953.htm", "/gesetz/8634/al177732.htm", "/gesetz/8634/v177732.htm", "/gesetz/14293/a255242.htm", "https://www.buzer.de/gesetz/8634/index.htm#artanc177732", "/Gesetze_PDF_ausdrucken.htm", "#", "/gesetz/8634/al177733.htm", "/gesetz/8634/v177733.htm", "/gesetz/14293/a255242.htm", "https://www.buzer.de/gesetz/8634/index.htm#artanc177733", "/Gesetze_PDF_ausdrucken.htm", "#", "https://www.buzer.de/gesetz/8634/a159953.htm", "/gesetz/8634/al159993.htm", "/gesetz/8634/v159993.htm", "/gesetz/14293/a255242.htm", "https://www.buzer.de/gesetz/8634/index.htm#artanc159993", "/Gesetze_PDF_ausdrucken.htm", "#", "https://www.buzer.de/gesetz/8634/a159954.htm", "/gesetz/8634/al159994.htm", "/gesetz/8634/v159994.htm", "https://www.buzer.de/gesetz/5678/index.htm", "https://www.buzer.de/gesetz/5678/index.htm", "https://www.buzer.de/gesetz/5678/index.htm", "https://www.buzer.de/gesetz/5678/index.htm", "https://www.buzer.de/gesetz/5678/index.htm", "https://www.buzer.de/gesetz/5678/index.htm", "https://www.buzer.de/gesetz/5678/index.htm", "https://www.buzer.de/gesetz/8634/a159971.htm", "/1_8._BBhVAendV.htm", "https://www.buzer.de/gesetz/8634/index.htm#artanc159994", "/Gesetze_PDF_ausdrucken.htm", "#", "https://www.buzer.de/gesetz/8634/a159954.htm", "https://www.buzer.de/gesetz/8634/a159955.htm", "/gesetz/8634/al177734.htm", "/gesetz/8634/v177734.htm", "https://www.buzer.de/gesetz/6059/a83875.htm", "/gesetz/14293/a255242.htm", "https://www.buzer.de/gesetz/8634/index.htm#artanc177734", "/Gesetze_PDF_ausdrucken.htm", "#", "https://www.buzer.de/gesetz/8634/a159956.htm", "/gesetz/8634/al159995.htm", "/gesetz/8634/v159995.htm", "/gesetz/14293/a255242.htm", "https://www.buzer.de/gesetz/8634/index.htm#artanc159995", "/Gesetze_PDF_ausdrucken.htm", "#", "https://www.buzer.de/gesetz/8634/a159956.htm", "/gesetz/8634/al159996.htm", "/gesetz/8634/v159996.htm", "https://www.buzer.de/gesetz/8634/a159937.htm", "https://www.buzer.de/gesetz/8634/a159956.htm", "https://www.buzer.de/gesetz/8634/a159995.htm", "https://www.buzer.de/gesetz/8634/a159995.htm", "https://www.buzer.de/gesetz/8634/a159995.htm", "https://www.buzer.de/gesetz/8634/a159995.htm", "https://www.buzer.de/gesetz/8634/a159995.htm", "https://www.buzer.de/gesetz/8634/a159995.htm", "https://www.buzer.de/gesetz/8634/a159995.htm", "https://www.buzer.de/gesetz/8634/a159995.htm", "/gesetz/14293/a255242.htm", "https://www.buzer.de/gesetz/8634/index.htm#artanc159996", "/Gesetze_PDF_ausdrucken.htm", "#", "https://www.buzer.de/gesetz/8634/a159972.htm", "https://www.buzer.de/gesetz/8634/a159972.htm", "/gesetz/8634/al177735.htm", "/gesetz/8634/v177735.htm", "/gesetz/14293/a255242.htm", "https://www.buzer.de/gesetz/8634/index.htm#artanc177735", "/Gesetze_PDF_ausdrucken.htm", "#", "https://www.buzer.de/gesetz/8634/a159972.htm", "/gesetz/8634/al188445.htm", "/gesetz/8634/v188445.htm", "/gesetz/14515/a268368.htm", "https://www.buzer.de/gesetz/8634/index.htm#artanc188445", "/Gesetze_PDF_ausdrucken.htm", "#", "https://www.buzer.de/gesetz/8634/a159972.htm", "/gesetz/8634/al212490.htm", "/gesetz/8634/v212490.htm", "/gesetz/14515/a268368.htm", "https://www.buzer.de/gesetz/8634/index.htm#artanc212490", "/Gesetze_PDF_ausdrucken.htm", "#", "/gesetz/8634/al201428.htm", "/gesetz/8634/v201428.htm", "/gesetz/14293/a255242.htm", "https://www.buzer.de/gesetz/8634/index.htm#artanc201428", "/Gesetze_PDF_ausdrucken.htm", "#", "https://www.buzer.de/gesetz/8634/a212489.htm", "/gesetz/8634/al212491.htm", "/gesetz/8634/v212491.htm", "/gesetz/14293/a255242.htm", "https://www.buzer.de/gesetz/8634/index.htm", "/Gesetze_PDF_ausdrucken.htm", "#", "/newsletter.htm?t=121&alarmAddTitle=8634", "/li.htm", "/gesetze-ticker.htm", null]}