{"title": "\u00a7 60 - Infektionsschutzgesetz (IfSG)", "author": "Buzer De", "url": "https://www.buzer.de/60_IfSG.htm", "hostname": "buzer.de", "description": "(1) Wer durch eine Schutzimpfung oder durch eine andere Ma\u00dfnahme der spezifischen Prophylaxe, die 1. von einer zust\u00e4ndigen Landesbeh\u00f6rde \u00f6ffentlich empfohlen und in ihrem Bereich vorgenommen wurde, 1a. gegen das Coronavirus SARS-CoV-2", "sitename": "buzer.de", "date": "2000-07-20", "id": null, "license": null, "body": null, "comments": "", "commentsbody": null, "raw_text": null, "text": "Bundesrecht - tagaktuell konsolidiert - alle Fassungen seit 2006\nTools:\nUpdate via:\n\u00a7 60 - Infektionsschutzgesetz (IfSG)\nArtikel 1 G. v. 20.07.2000\nGeltung ab 01.01.2001; FNA: 2126-13\n| |\n[BGBl. I S. 1045](https://www.buzer.de/outb/bgbl/1045001.htm); zuletzt ge\u00e4ndert durch [Artikel 2](/gesetz/15943/a299139.htm)G. v. 17.07.2023 [BGBl. 2023 I Nr. 190](/gesetz/15943/index.htm)\nGeltung ab 01.01.2001; FNA: 2126-13\n[Krankheitsbek\u00e4mpfung, Impfwesen](/fna/2126-Krankheitsbek\u00e4mpfung,%20Impfwesen.htm)\n| |\n\u00a7 60 Versorgung bei Impfschaden und bei Gesundheitssch\u00e4den durch andere Ma\u00dfnahmen der spezifischen Prophylaxe\n\u00a7 60 hat\n[2 fr\u00fchere Fassungen](#buildInHistory)und wird in [15 Vorschriften zitiert](#buildInZitate)\n(1) 1Wer durch eine Schutzimpfung oder durch eine andere Ma\u00dfnahme der spezifischen Prophylaxe, die\n- 1.\n- von einer zust\u00e4ndigen Landesbeh\u00f6rde \u00f6ffentlich empfohlen und in ihrem Bereich vorgenommen wurde,\n- 1a.\n- gegen das Coronavirus SARS-CoV-2 aufgrund einer Rechtsverordnung nach\n[\u00a7 20i Absatz 3 Satz 2 Nummer 1 Buchstabe a](https://www.buzer.de/20i_SGB_V.htm), auch in Verbindung mit Nummer 2, des [F\u00fcnften Buches Sozialgesetzbuch](https://www.buzer.de/SGB_V.htm)vorgenommen wurde,\n- 2.\n- auf Grund dieses Gesetzes angeordnet wurde,\n- 3.\n- gesetzlich vorgeschrieben war oder\n- 4.\n- auf Grund der Verordnungen zur Ausf\u00fchrung der Internationalen Gesundheitsvorschriften durchgef\u00fchrt worden ist,\n[\u00a7 2 Nr. 11](https://www.buzer.de/2_IfSG.htm)oder in dessen entsprechender Anwendung bei einer anderen Ma\u00dfnahme wegen der gesundheitlichen und wirtschaftlichen Folgen der Sch\u00e4digung auf Antrag Versorgung in entsprechender Anwendung der Vorschriften des [Bundesversorgungsgesetzes](https://www.buzer.de/BVG.htm), soweit dieses Gesetz nichts Abweichendes bestimmt. 2Satz 1 Nr. 4 gilt nur f\u00fcr Personen, die zum Zwecke der Wiedereinreise in den Geltungsbereich dieses Gesetzes geimpft wurden und die ihren Wohnsitz oder gew\u00f6hnlichen Aufenthalt in diesem Gebiet haben oder nur vor\u00fcbergehend aus beruflichen Gr\u00fcnden oder zum Zwecke der Ausbildung aufgegeben haben, sowie deren Angeh\u00f6rige, die mit ihnen in h\u00e4uslicher Gemeinschaft leben. 3Als Angeh\u00f6rige gelten die in [\u00a7 10 des F\u00fcnften Buches Sozialgesetzbuch](https://www.buzer.de/10_SGB_V.htm)genannten Personen.\n(2) 1Versorgung im Sinne des Absatzes 1 erh\u00e4lt auch, wer als Deutscher au\u00dferhalb des Geltungsbereichs dieses Gesetzes einen Impfschaden durch eine Impfung erlitten hat, zu der er auf Grund des Impfgesetzes vom 8. April 1874 in der im Bundesgesetzblatt Teil III, Gliederungsnummer 2126-5, ver\u00f6ffentlichten bereinigten Fassung, bei einem Aufenthalt im Geltungsbereich dieses Gesetzes verpflichtet gewesen w\u00e4re. 2Die Versorgung wird nur gew\u00e4hrt, wenn der Gesch\u00e4digte\n- 1.\n- nicht im Geltungsbereich dieses Gesetzes geimpft werden konnte,\n- 2.\n- von einem Arzt geimpft worden ist und\n- 3.\n- zur Zeit der Impfung in h\u00e4uslicher Gemeinschaft mit einem Elternteil oder einem Sorgeberechtigten gelebt hat, der sich zur Zeit der Impfung aus beruflichen Gr\u00fcnden oder zur Ausbildung nicht nur vor\u00fcbergehend au\u00dferhalb des Geltungsbereichs dieses Gesetzes aufgehalten hat.\n(3) 1Versorgung im Sinne des Absatzes 1 erh\u00e4lt auch, wer au\u00dferhalb des Geltungsbereichs dieses Gesetzes einen Impfschaden erlitten hat infolge einer Pockenimpfung auf Grund des Impfgesetzes oder infolge einer Pockenimpfung, die in den in\n[\u00a7 1 Abs. 2 Nr. 3 des Bundesvertriebenengesetzes](https://www.buzer.de/gesetz/4827/a66821.htm)bezeichneten Gebieten, in der Deutschen Demokratischen Republik oder in Berlin (Ost) gesetzlich vorgeschrieben oder auf Grund eines Gesetzes angeordnet worden ist oder war, soweit nicht auf Grund anderer gesetzlicher Vorschriften Entsch\u00e4digung gew\u00e4hrt wird. 2Anspr\u00fcche nach Satz 1 kann nur geltend machen, wer\n- 1.\n- als Deutscher bis zum 8. Mai 1945,\n- 2.\n- als Berechtigter nach den\n[\u00a7\u00a7 1](https://www.buzer.de/gesetz/4827/a66821.htm) [bis](https://www.buzer.de/s1.htm?a=1-4&ag=4827) [4 des Bundesvertriebenengesetzes](https://www.buzer.de/gesetz/4827/a66824.htm)oder des [\u00a7 1 des Fl\u00fcchtlingshilfegesetzes](https://www.buzer.de/gesetz/4206/a58483.htm)in der Fassung der Bekanntmachung vom [15. Mai 1971 (BGBl. I S. 681](https://www.buzer.de/gesetz/4206/index.htm)), das zuletzt durch [Artikel 24 des Gesetzes vom 26. Mai 1994 (BGBl. I S. 1014](https://www.buzer.de/gesetz/7402/a145684.htm)) ge\u00e4ndert worden ist, in der jeweils geltenden Fassung,\n- 3.\n- als Ehegatte oder Abk\u00f6mmling eines Sp\u00e4taussiedlers im Sinne des\n[\u00a7 7 Abs. 2 des Bundesvertriebenengesetzes](https://www.buzer.de/gesetz/4827/a66827.htm)oder\n- 4.\n- im Wege der Familienzusammenf\u00fchrung gem\u00e4\u00df\n[\u00a7 94 des Bundesvertriebenengesetzes](https://www.buzer.de/gesetz/4827/a66848.htm)in der vor dem 1. Januar 1993 geltenden Fassung\n(4) 1Die Hinterbliebenen eines Gesch\u00e4digten im Sinne der Abs\u00e4tze 1 bis 3 erhalten auf Antrag Versorgung in entsprechender Anwendung der Vorschriften des\n[Bundesversorgungsgesetzes](https://www.buzer.de/BVG.htm). 2Partner einer ehe\u00e4hnlichen Gemeinschaft erhalten Leistungen in entsprechender Anwendung der [\u00a7\u00a7 40](https://www.buzer.de/40_BVG.htm), [40a](https://www.buzer.de/40a_BVG.htm)und [41 des Bundesversorgungsgesetzes](https://www.buzer.de/41_BVG.htm), sofern ein Partner an den Sch\u00e4digungsfolgen verstorben ist und der andere unter Verzicht auf eine Erwerbst\u00e4tigkeit die Betreuung eines gemeinschaftlichen Kindes aus\u00fcbt; dieser Anspruch ist auf die ersten drei Lebensjahre des Kindes beschr\u00e4nkt. 3Satz 2 gilt entsprechend, wenn ein Partner in der Zeit zwischen dem 1. November 1994 und dem 23. Juni 2006 an den Sch\u00e4digungsfolgen verstorben ist.\n(5) 1Als Impfschaden im Sinne des\n[\u00a7 2 Nr. 11](https://www.buzer.de/2_IfSG.htm)gelten auch die Folgen einer gesundheitlichen Sch\u00e4digung, die durch einen Unfall unter den Voraussetzungen des [\u00a7 1 Abs. 2 Buchstabe e oder f](https://www.buzer.de/1_BVG.htm)oder des [\u00a7 8a des Bundesversorgungsgesetzes](https://www.buzer.de/8a_BVG.htm)herbeigef\u00fchrt worden sind. 2Einem Impfschaden im Sinne des Satzes 1 steht die Besch\u00e4digung eines am K\u00f6rper getragenen Hilfsmittels, einer Brille, von Kontaktlinsen oder von Zahnersatz infolge eines Impfschadens im Sinne des Absatzes 1 oder eines Unfalls im Sinne des Satzes 1 gleich.\n(6) Im Rahmen der Versorgung nach Absatz 1 bis 5 finden die Vorschriften des zweiten Kapitels des\n[Zehnten Buches Sozialgesetzbuch](https://www.buzer.de/SGB_X.htm)\u00fcber den Schutz der Sozialdaten Anwendung.\nText in der Fassung des\n[Artikels 1 Zweites Gesetz zur \u00c4nderung des Infektionsschutzgesetzes und weiterer Gesetze G. v. 28. Mai 2021 BGBl. I S. 1174](/gesetz/14649/a271775.htm)m.W.v. 27. Dezember 2020 []\nFr\u00fchere Fassungen von\n[\u00a7 60 IfSG](#)\nDie nachfolgende Aufstellung zeigt alle \u00c4nderungen dieser Vorschrift. \u00dcber die Links aktuell und vorher k\u00f6nnen Sie jeweils alte Fassung (a.F.) und neue Fassung (n.F.) vergleichen. Beim \u00c4nderungsgesetz finden Sie dessen Volltext sowie die Begr\u00fcndung des Gesetzgebers.\n|vergleichen mit||mWv (verk\u00fcndet)||neue Fassung durch|\n|aktuell |[Artikel 1 Zweites Gesetz zur \u00c4nderung des Infektionsschutzgesetzes und weiterer Gesetze](https://www.buzer.de/gesetz/14649/a271775.htm)\nvom 28.05.2021 BGBl. I S. 1174\n[aktuell](https://www.buzer.de/gesetz/2148/al0-147871.htm) [vorher](https://www.buzer.de/gesetz/2148/al922-0.htm) [Artikel 5 Gesetz zur \u00c4nderung von Vorschriften des Sozialen Entsch\u00e4digungsrechts und des Gesetzes \u00fcber einen Ausgleich f\u00fcr Dienstbesch\u00e4digungen im Beitrittsgebiet](https://www.buzer.de/gesetz/7230/a143025.htm)\nvom 19.06.2006 BGBl. I S. 1305\n[aktuell](https://www.buzer.de/gesetz/2148/al0-922.htm)\nBitte beachten Sie, dass r\u00fcckwirkende \u00c4nderungen - soweit vorhanden - nach dem Verk\u00fcndungsdatum des \u00c4nderungstitels (Datum in Klammern) und nicht nach dem Datum des Inkrafttretens in diese Liste einsortiert sind.\n[]\nZitierungen von\n[\u00a7 60 IfSG](#)\nSie sehen die Vorschriften, die auf \u00a7 60 IfSG verweisen. Die Liste ist unterteilt nach Zitaten in\n[IfSG selbst](#intern), [Erm\u00e4chtigungsgrundlagen](#grundl), [anderen geltenden Titeln](#andere), [\u00c4nderungsvorschriften](#aender)und in [aufgehobenen Titeln](#aufge). []\ninterne Verweise\n[\u00a7 22 IfSG Impf-, Genesenen- und Testdokumentation](/22_IfSG.htm?m=/60_IfSG.htm)(vom 19.03.2022)\n... Verhalten bei ungew\u00f6hnlichen Impfreaktionen, 2. die sich gegebenenfalls aus den \u00a7\u00a7 60 bis 64 ergebenden Anspr\u00fcche bei Eintritt eines Impfschadens sowie 3. Stellen, bei ...\n[\u00a7 61 IfSG Gesundheitsschadensanerkennung](/61_IfSG.htm?m=/60_IfSG.htm)(vom 21.12.2007)\n... Anerkennung eines Gesundheitsschadens als Folge einer Sch\u00e4digung im Sinne des \u00a7 60 Abs. 1 Satz 1 gen\u00fcgt die Wahrscheinlichkeit des urs\u00e4chlichen Zusammenhangs. Wenn diese ... obersten Landesbeh\u00f6rde der Gesundheitsschaden als Folge einer Sch\u00e4digung im Sinne des \u00a7 60 Abs. 1 Satz 1 anerkannt werden. Die Zustimmung kann allgemein erteilt ...\n[\u00a7 62 IfSG Heilbehandlung](/62_IfSG.htm?m=/60_IfSG.htm)\n... Gesch\u00e4digten im Sinne von \u00a7 60 Abs. 1 bis 3 sind im Rahmen der Heilbehandlung auch heilp\u00e4dagogische Behandlung, ...\n[\u00a7 63 IfSG Konkurrenz von Anspr\u00fcchen, Anwendung der Vorschriften nach dem Bundesversorgungsgesetz, \u00dcbergangsregelungen zum Erstattungsverfahren an die Krankenkassen](/63_IfSG.htm?m=/60_IfSG.htm)(vom 01.07.2011)\n... Treffen Anspr\u00fcche aus \u00a7 60 mit Anspr\u00fcchen aus \u00a7 1 des Bundesversorgungsgesetzes oder aus anderen Gesetzen zusammen, ... eine einheitliche Rente festzusetzen. (2) Trifft ein Versorgungsanspruch nach \u00a7 60 mit einem Schadensersatzanspruch auf Grund fahrl\u00e4ssiger Amtspflichtverletzung zusammen, so ... B\u00fcrgerlichen Gesetzbuchs nicht dadurch ausgeschlossen, dass die Voraussetzungen des \u00a7 60 vorliegen. (3) Bei Impfsch\u00e4den gilt \u00a7 4 Abs. 1 Nr. 2 des Siebten Buches ...\n[\u00a7 64 IfSG Zust\u00e4ndige Beh\u00f6rde f\u00fcr die Versorgung](/64_IfSG.htm?m=/60_IfSG.htm)\n... Die Versorgung nach den \u00a7\u00a7 60 bis 63 Abs. 1 wird von den f\u00fcr die Durchf\u00fchrung des Bundesversorgungsgesetzes ...\n[\u00a7 66 IfSG Zahlungsverpflichteter](/66_IfSG.htm?m=/60_IfSG.htm)(vom 27.12.2020)\n... dem der Schaden verursacht worden ist. (2) Versorgung wegen eines Impfschadens nach den \u00a7\u00a7 60 bis 63 ist zu gew\u00e4hren 1. in den F\u00e4llen des \u00a7 60 Absatz 1 a) ... nach den \u00a7\u00a7 60 bis 63 ist zu gew\u00e4hren 1. in den F\u00e4llen des \u00a7 60 Absatz 1 a) von dem Land, in dem der Schaden verursacht worden ist oder, b) wenn ... oder dessen Angeh\u00f6riger t\u00e4tig ist oder war, 2. in den F\u00e4llen des \u00a7 60 Abs. 2 a) von dem Land, in dem der Gesch\u00e4digte bei Eintritt des Impfschadens im ... oder gew\u00f6hnlichen Aufenthalt gehabt hat, 3. in den F\u00e4llen des \u00a7 60 Abs. 3 von dem Land, in dem der Gesch\u00e4digte seinen Wohnsitz oder gew\u00f6hnlichen Aufenthalt im ...\n[\u00a7 67 IfSG Pf\u00e4ndung](/67_IfSG.htm?m=/60_IfSG.htm)\n... \u00dcbertragung, Verpf\u00e4ndung und Pf\u00e4ndung der Anspr\u00fcche nach den \u00a7\u00a7 60 , 62 und 63 Abs. 1 richten sich nach den Vorschriften des ...\n[\u00a7 68 IfSG Rechtsweg](/68_IfSG.htm?m=/60_IfSG.htm)(vom 17.09.2022)\n... (2) F\u00fcr \u00f6ffentlich-rechtliche Streitigkeiten in Angelegenheiten der \u00a7\u00a7 60 bis 63 Abs. 1 ist der Rechtsweg vor den Sozialgerichten gegeben. Soweit das ...\n[]\nZitat in folgenden Normen\nSozialgesetzbuch (SGB) Erstes Buch (I) - Allgemeiner Teil - (SGB I)\nArtikel I G. v. 11.12.1975 BGBl. I S. 3015; zuletzt ge\u00e4ndert durch Artikel 4 G. v. 20.12.2022 BGBl. I S. 2759\n[\u00a7 68 SGB I Besondere Teile dieses Gesetzbuches](/68_SGB_I.htm?m=/60_IfSG.htm)(vom 01.09.2021)\n... des Bundesgrenzschutzgesetzes, c) \u00a7 47 des Zivildienstgesetzes, d) \u00a7 60 des Infektionsschutzgesetzes , e) \u00a7\u00a7 4 und 5 des H\u00e4ftlingshilfegesetzes, f) \u00a7 1 ...\nSozialgesetzbuch Vierzehntes Buch - Soziale Entsch\u00e4digung - (SGB XIV)\nArtikel 1 G. v. 12.12.2019 BGBl. I S. 2652; zuletzt ge\u00e4ndert durch Artikel 8 G. v. 06.06.2023 BGBl. 2023 I Nr. 146\n[\u00a7 141 SGB XIV Besonderer zeitlicher Geltungsbereich f\u00fcr Gesch\u00e4digte durch Schutzimpfungen oder einer anderen Ma\u00dfnahme der spezifischen Prophylaxe](/141_SGB_14.htm?m=/60_IfSG.htm)\n... gesch\u00e4digt worden sind, erhalten Leistungen nach diesem Buch, wenn die Voraussetzungen nach \u00a7 60 des Infektionsschutzgesetzes in der bis zum 31. Dezember 2023 geltenden Fassung erf\u00fcllt waren. Hinterbliebene ...\n[]\nZitate in \u00c4nderungsvorschriften\nGesetz zur \u00c4nderung des Bundesversorgungsgesetzes und anderer Vorschriften des Sozialen Entsch\u00e4digungsrechts\nG. v. 13.12.2007 BGBl. I S. 2904\n[Artikel 2 BVGuSozEntsR\u00c4ndG \u00c4nderung des Infektionsschutzgesetzes](/gesetz/8009/a153168.htm?m=/60_IfSG.htm)\n... a) Absatz 1 wird wie folgt gefasst: (1) Treffen Anspr\u00fcche aus \u00a7 60 mit Anspr\u00fcchen aus \u00a7 1 des Bundesversorgungsgesetzes oder aus anderen Gesetzen zusammen, ...\nGesetz zur \u00c4nderung von Vorschriften des Sozialen Entsch\u00e4digungsrechts und des Gesetzes \u00fcber einen Ausgleich f\u00fcr Dienstbesch\u00e4digungen im Beitrittsgebiet\nG. v. 19.06.2006 BGBl. I S. 1305\n[Artikel 5 SozEntschR\u00c4ndG \u00c4nderung des Infektionsschutzgesetzes](/gesetz/7230/a143025.htm?m=/60_IfSG.htm)\n... \u00a7 60 Abs. 4 des Infektionsschutzgesetzes vom 20. Juli 2000 (BGBl. I S. 1045), das zuletzt durch Artikel ...\nGesetz zur Regelung des Sozialen Entsch\u00e4digungsrechts\nG. v. 12.12.2019 BGBl. I S. 2652; zuletzt ge\u00e4ndert durch Artikel 10 G. v. 06.06.2023 BGBl. 2023 I Nr. 146\n[Artikel 46 SozERG \u00c4nderung des Infektionsschutzgesetzes](/gesetz/13714/a232843.htm?m=/60_IfSG.htm)\n... wird wie folgt ge\u00e4ndert: 1. In der Inhalts\u00fcbersicht werden die Angaben zu den \u00a7\u00a7 60 bis 64 gestrichen. 2. \u00a7 2 Nummer 11 wird aufgehoben. 3. In \u00a7 22 ... In \u00a7 22 Absatz 3 Nummer 2 werden die W\u00f6rter \u201eauf die sich gegebenenfalls aus den \u00a7\u00a7 60 bis 64 ergebenden Anspr\u00fcche bei Eintritt eines Impfschadens\" durch die W\u00f6rter ... \u201ediesen jeweils\" durch das Wort \u201edieser\" ersetzt. 5. Die \u00a7\u00a7 60 bis 64 werden aufgehoben. 6. \u00a7 66 wird wie folgt ge\u00e4ndert: a) Die ...\nMasernschutzgesetz\nG. v. 10.02.2020 BGBl. I S. 148\n[Artikel 1 MasSchG \u00c4nderung des Infektionsschutzgesetzes](/1_Masernschutzgesetz.htm?m=/60_IfSG.htm)\n... Verhalten bei ungew\u00f6hnlichen Impfreaktionen, 2. die sich gegebenenfalls aus den \u00a7\u00a7 60 bis 64 ergebenden Anspr\u00fcche bei Eintritt eines Impfschadens sowie 3. Stellen, bei ...\nZweites Gesetz zur \u00c4nderung des Infektionsschutzgesetzes und weiterer Gesetze\nG. v. 28.05.2021 BGBl. I S. 1174\n[Artikel 1 2. IfSGua\u00c4ndG \u00c4nderung des Infektionsschutzgesetzes](/gesetz/14649/a271775.htm?m=/60_IfSG.htm)\n... gestrichen. 5. Nach \u00a7 60 Absatz 1 Satz 1 Nummer 1 wird folgende Nummer 1a eingef\u00fcgt: \u201e1a. gegen das Coronavirus SARS-CoV-2 ... \u00a7 66 Absatz 2 Nummer 1 wird wie folgt gefasst: \u201e1. in den F\u00e4llen des \u00a7 60 Absatz 1 a) von dem Land, in dem der Schaden verursacht worden ist oder, b) wenn ...\nLink zu dieser Seite: https://www.buzer.de/60_IfSG.htm\n[](/newsletter.htm?t=121&alarmAddTitle=2148)\nIfSG\n\u00c4nderungen\nIfSG\nCompliance\n\u00c4nderungen\n\u00fcberwachen\nSie werden \u00fcber jede verk\u00fcndete oder in Kraft tretende \u00c4nderung per Mail informiert, sofort, w\u00f6chentlich oder in dem Intervall, das Sie gew\u00e4hlt haben.\nStellen Sie Ihr Paket zu \u00fcberwachender Vorschriften beliebig zusammen.\nJetzt anmelden!\nWeitere Vorteile:\nKonsolidierte Vorschriften selbst bei Inkrafttreten \"am Tage nach der Verk\u00fcndung\", Synopse zu jeder \u00c4nderungen, Begr\u00fcndungen des Gesetzgebers", "language": null, "image": null, "pagetype": null, "links": ["/index.htm", "#", "#b", "/index.htm", "/s.htm", "/fna/index.htm", "/z.htm", "/v.htm", "/h.htm", "/quality.htm", "https://www.buzer.de/k.htm", "/i.htm", "/li.htm", "/60_IfSG.htm?setmobile=1", "/outb/gapp/?id=dli.buzerde", "/gesetze-ticker.htm", "/gesetze_feed.xml", "https://www.buzer.de/rechtskataster.htm", "/danke.htm", "/werben.htm", "/index.htm", "/IfSG.htm", "https://www.buzer.de/newsletter.htm?t=1&alarmAddTitle=2148", "https://www.buzer.de/outb/bgbl/1045001.htm", "/gesetz/15943/a299139.htm", "/gesetz/15943/index.htm", "/fna/2126-Krankheitsbek\u00e4mpfung,%20Impfwesen.htm", "https://www.buzer.de/gesetz/2148/l.htm", "/outb/dipbt/14-1113/50.htm", "/gesetz/2148/v0.htm", "https://www.buzer.de/gesetz/2148/b6044.htm", "https://www.buzer.de/59_IfSG.htm", "https://www.buzer.de/61_IfSG.htm", "#buildInHistory", "#buildInZitate", "https://www.buzer.de/20i_SGB_V.htm", "https://www.buzer.de/SGB_V.htm", "https://www.buzer.de/2_IfSG.htm", "https://www.buzer.de/BVG.htm", "https://www.buzer.de/10_SGB_V.htm", "https://www.buzer.de/gesetz/4827/a66821.htm", "https://www.buzer.de/gesetz/4827/a66821.htm", "https://www.buzer.de/s1.htm?a=1-4&ag=4827", "https://www.buzer.de/gesetz/4827/a66824.htm", "https://www.buzer.de/gesetz/4206/a58483.htm", "https://www.buzer.de/gesetz/4206/index.htm", "https://www.buzer.de/gesetz/7402/a145684.htm", "https://www.buzer.de/gesetz/4827/a66827.htm", "https://www.buzer.de/gesetz/4827/a66848.htm", "https://www.buzer.de/BVG.htm", "https://www.buzer.de/40_BVG.htm", "https://www.buzer.de/40a_BVG.htm", "https://www.buzer.de/41_BVG.htm", "https://www.buzer.de/2_IfSG.htm", "https://www.buzer.de/1_BVG.htm", "https://www.buzer.de/8a_BVG.htm", "https://www.buzer.de/SGB_X.htm", "/gesetz/14649/a271775.htm", "https://www.buzer.de/59_IfSG.htm", "https://www.buzer.de/61_IfSG.htm", null, "https://www.buzer.de/IfSG.htm#artanc30443", "/Gesetze_PDF_ausdrucken.htm", "#", "#", "https://www.buzer.de/gesetz/2148/al147871-0.htm", "https://www.buzer.de/gesetz/14649/a271775.htm", "https://www.buzer.de/gesetz/2148/al0-147871.htm", "https://www.buzer.de/gesetz/2148/al922-0.htm", "https://www.buzer.de/gesetz/7230/a143025.htm", "https://www.buzer.de/gesetz/2148/al0-922.htm", null, "https://www.buzer.de/IfSG.htm#artanc30443", "/Gesetze_PDF_ausdrucken.htm", "#", "#", "#intern", "#grundl", "#andere", "#aender", "#aufge", null, "/22_IfSG.htm?m=/60_IfSG.htm", "/61_IfSG.htm?m=/60_IfSG.htm", "/62_IfSG.htm?m=/60_IfSG.htm", "/63_IfSG.htm?m=/60_IfSG.htm", "/64_IfSG.htm?m=/60_IfSG.htm", "/66_IfSG.htm?m=/60_IfSG.htm", "/67_IfSG.htm?m=/60_IfSG.htm", "/68_IfSG.htm?m=/60_IfSG.htm", null, "https://www.buzer.de/IfSG.htm", "/Gesetze_PDF_ausdrucken.htm", "#", "/68_SGB_I.htm?m=/60_IfSG.htm", "/141_SGB_14.htm?m=/60_IfSG.htm", null, "https://www.buzer.de/IfSG.htm", "/Gesetze_PDF_ausdrucken.htm", "#", "/gesetz/8009/a153168.htm?m=/60_IfSG.htm", "/gesetz/7230/a143025.htm?m=/60_IfSG.htm", "/gesetz/13714/a232843.htm?m=/60_IfSG.htm", "/1_Masernschutzgesetz.htm?m=/60_IfSG.htm", "/gesetz/14649/a271775.htm?m=/60_IfSG.htm", "https://www.buzer.de/IfSG.htm", "/Gesetze_PDF_ausdrucken.htm", "#", "/newsletter.htm?t=121&alarmAddTitle=2148", "/li.htm", "/gesetze-ticker.htm", null]}