{"title": "Hashimoto Thyreoiditis: Ganzheitliche Behandlung", "author": "Markus Breitenberger", "url": "https://www.praxis-breitenberger.de/ratgeber/schilddruese/hashimoto-thyreoiditis/", "hostname": "praxis-breitenberger.de", "description": "Schilddr\u00fcsenentz\u00fcndung stoppen \u25ba Ganzheitliche Behandlung der Hashimoto-Thyreoiditis \u25ba Markus Breitenberger, Hashimoto-Spezialist in M\u00fcnchen.", "sitename": "Praxis Breitenberger", "date": "2011-01-10", "id": null, "license": null, "body": null, "comments": "", "commentsbody": null, "raw_text": null, "text": "Kurz zusammengefasst:\n- Hashimoto-Thyreoiditis ist eine Autoimmunerkrankung, die Schilddr\u00fcsengewebe zerst\u00f6rt.\n- Dabei bildet das k\u00f6rpereigene Immunsystem Antik\u00f6rper gegen Schilddr\u00fcsengewebe, was zu einer chronischen Entz\u00fcndung der Schilddr\u00fcse f\u00fchrt.\n- Es kann zu Symptomen einer \u00dcber- und Unterfunktion der Schilddr\u00fcse kommen. Typisch sind Beschwerden wie M\u00fcdigkeit, Antriebslosigkeit, K\u00e4ltegef\u00fchl, Gewichtszunahme, Haarausfall und Konzentrationsschw\u00e4che.\n- Die herk\u00f6mmliche Therapie besteht darin die fehlende Hormonmenge durch synthetische Hormone wie L-Thyroxin zu ersetzen. H\u00e4ufig f\u00fchrt das nicht zu einer vollst\u00e4ndigen Linderung der Beschwerden.\nInhaltsverzeichnis\nWas ist Hashimoto-Thyreoiditis?\nHashimoto-Thyreoiditis (syn.: Hashimoto-Syndrom, chronische Autoimmunthyreoiditis, Autoimmunthyreopathie, chronisch lymphozyt\u00e4re Thyreoiditis) ist eine\n[Autoimmunerkrankung](https://www.praxis-breitenberger.de/ratgeber/autoimmunerkrankung/erkrankung-homoeopathie/), also ein fehlgeleiteter Prozess im Immunsystem, der zu einer meist schmerzlosen, chronischen Schilddr\u00fcsenentz\u00fcndung f\u00fchrt.\nIn der Folge kommt es zu einer Verkleinerung (Zerst\u00f6rung der Dr\u00fcsenzellen), oder seltener zu einer Vergr\u00f6\u00dferung (Ersatz der Dr\u00fcsenzellen durch Bindegewebe) der Schilddr\u00fcse. In beiden F\u00e4llen schwinden hormonproduzierende Zellen, und es kommt zu einer Unterfunktion der Schilddr\u00fcse mit zahlreichen negativen Folgen f\u00fcr den Organismus.\nDie Erkrankung verl\u00e4uft in Sch\u00fcben. Unbehandelt ist dieser Verlauf lebenslang und laut Schulmedizin unheilbar.\nHashimoto: Woher kommt der Name?\nDie Erkrankung ist nach dem japanischen Arzt Dr. Hakaru Hashimoto benannt, der sie 1912 zum ersten Mal beschrieben hat.\nWieviele Menschen haben das Hashimoto-Syndrom?\nEntgegen dem exotischen Namen ist eine Hashimoto-Thyreoiditis die h\u00e4ufigste Ursache f\u00fcr eine chronische Entz\u00fcndung und prim\u00e4re Unterfunktion der Schilddr\u00fcse bei meist ausreichender\n[Jodversorgung](https://www.praxis-breitenberger.de/ratgeber/schilddruese/jod-schilddruese/). In der gr\u00f6\u00dften bev\u00f6lkerungsbasierten Verlaufsstudie zu dieser Erkrankung, der Wickham-Studie, konnte Folgendes gezeigt werden:\n- Bei 10 Prozent der Gesamtbev\u00f6lkerung lassen sich erh\u00f6hte Auto-Antik\u00f6rperwerte im Blut feststellen\n- Bei 7,5 Prozent der Bev\u00f6lkerung ist zudem der (basale) TSH-Wert erh\u00f6ht bei normalen Werten der freien Schilddr\u00fcsenhormone fT3 und fT4 (subklinische Hypothyreose)\n- 1,9 Prozent der Bev\u00f6lkerung haben eine manifeste Unterfunktion der Schilddr\u00fcse, das hei\u00dft der TSH-Wert ist erh\u00f6ht und die Schilddr\u00fcsenhormone fT3 und fT4 sind erniedrigt\nWer erkrankt an Hashimoto?\nBetroffen sind insbesondere berufst\u00e4tige Frauen zwischen dem 30. und 60. Lebensjahr bzw. 8 Prozent aller Frauen vor und 16 Prozent aller Frauen nach der Menopause. Insgesamt leiden Frauen an einem Hashimoto-Syndrom etwa 10 Mal h\u00e4ufiger als M\u00e4nner.\nWelche Aufgaben hat die Schilddr\u00fcse?\nDie Schilddr\u00fcse wird wegen ihrer Form auch als Schmetterlingsorgan bezeichnet. Die Wirkung einer gesunden Schilddr\u00fcsenaktivit\u00e4t f\u00fchrt ebenfalls dazu, dass wir uns leicht, unbeschwert und beweglich f\u00fchlen wie ein Schmetterling.\nDie Schilddr\u00fcse ist quasi die Chefetage unseres Organismus. Wenn es hier eine St\u00f6rung gibt, funktioniert nur noch sehr wenig ohne Probleme. Ver\u00e4nderungen in der Schilddr\u00fcse, beeintr\u00e4chtigen nicht nur den ganzen K\u00f6rper, sondern werfen uns auch psychisch aus der Bahn.\nAufgaben der Schilddr\u00fcse:\n- W\u00e4rmeproduktion\n- Sauerstoffumsatz\n- Eisenstoffwechsel\n- k\u00f6rperliche und geistige Energie\n- Regulation unseres Wasserhaushalts\n- Eiwei\u00df- Fett- und Kohlenhydratstoffwechsel\n- Kalkstoffwechsel und (Knochen-)Wachstum\n- Verdauung\n- seelisches Gleichgewicht.\nDas alles schafft eine walnussgro\u00dfe Hormondr\u00fcse mit 18 Gramm (Frauen) bis 25 Gramm (M\u00e4nner) Gewicht!\nSymptome\nWenn die Hormonleistung der Schilddr\u00fcse nicht ausreichend ist, wie es bei der Hashimoto-Thyreoiditis der Fall ist, dann f\u00fchlen sich die Betroffenen nicht wie Schmetterlinge, sondern wie verpuppte Raupen.\nWoran erkennt man Hashimoto?\n- M\u00fcdigkeit\n- Apathie, Antriebslosigkeit\n- Nebliges, watteartiges Gef\u00fchl im Kopf\n- Konzentrationsst\u00f6rung\n- Nerv\u00f6se Depression bzw. Entscheidungsschw\u00e4che\n- K\u00e4lteempfindlichkeit\n- Muskel- und Gelenkschmerzen\n- Gewichtszunahme und hartn\u00e4ckiges\n[\u00dcbergewicht](https://www.praxis-breitenberger.de/ratgeber/maennergesundheit/uebergewicht/)\n- Teigige und trockene Haut\n- Verstopfung\n- Haarausfall\n- Br\u00fcchige Haare\n[Infektanf\u00e4lligkeit](https://www.praxis-breitenberger.de/ratgeber/infektion/infektanfaelligkeit-ursachen-behandlung-hilfe/) [Keine Lust auf Sex](https://www.praxis-breitenberger.de/ratgeber/partnerschaft/sexuelle-probleme/) [Unerf\u00fcllter Kinderwunsch](https://www.praxis-breitenberger.de/ratgeber/frauengesundheit/unerfuellter-kinderwunsch/)\n|mit|\nmeist verbessert\nmeist nicht ver\u00e4ndert\nHashimoto-Symptome werden h\u00e4ufig nicht erkannt\nSehr belastend f\u00fcr Hashimoto-Patienten ist die Situation, dass ein Zusammenhang zwischen diesen Symptomen und einer Schilddr\u00fcsenunterfunktion vom Typ Hashimoto selbst von Fachleuten negiert wird, wenn der TSH-Wert im Referenzbereich liegt.\nEine Hashimoto-Thyreoiditis kann auch immer wieder mit \u00dcberfunktionssymptomen durchsetzt sein in Phasen eines akuten Entz\u00fcndungsschubs. Hier sollte ausgeschlossen werden, dass nicht ein\n[Morbus Basedow](https://www.praxis-breitenberger.de/ratgeber/autoimmunerkrankung/morbus-basedow/) Ursache f\u00fcr den angeheizten Stoffwechsel ist.\nBei subklinischer Unterfunktion werden klimakterische Beschwerden verschleiert; Symptome treten dann nach L-Thyroxin-Substitution auf und werden h\u00e4ufig als Symptome einer Schilddr\u00fcsen\u00fcberfunktion fehlgedeutet.\nPolyglandul\u00e4res Autoimmunsyndrom und Hashimoto\nHashimoto-Thyreoiditis und auch Morbus Basedow k\u00f6nnen gemeinsam mit anderen Autoimmunerkrankungen als polyglandul\u00e4res Autoimmunsyndrom (PAS Typ I bis Typ III) auftreten. Dabei sind mindestens zwei endokrine Organe betroffen, bei denen autoimmune Prozesse zugrunde liegen.\nFolgende Erkrankungen treten dabei geh\u00e4uft in Kombination auf: Z\u00f6liakie, Alopezia areata, Vitiligo, pernizi\u00f6se An\u00e4mie,\n[rheumatoide Arthritis](https://www.praxis-breitenberger.de/ratgeber/autoimmunerkrankung/rheumatoide-arthritis/), mukokutane Candidiasis, Morbus Addison, chronischer Hypoparathyreoidismus, Typ-1-Diabetes.\nWelcher Arzt ist f\u00fcr Hashimoto zust\u00e4ndig?\nF\u00fcr die Diagnose und Behandlung von Erkrankungen der hormonbildenden Dr\u00fcsen wie der Schilddr\u00fcse, ist ein Endokrinologe (Facharzt f\u00fcr Endokrinologie) zust\u00e4ndig. Das Fachgebiet Endokrinologie ist ein wichtiges Teilgebiet der Inneren Medizin. Es befasst sich mit der Funktion und der Regulation der Hormone und des Hormonsystems.\nWas k\u00f6nnen \u00c4rzte bei Hashimoto machen?\nTrotz dieser Spezialisierung k\u00f6nnen Endokrinologen in der Regel keine Aussagen \u00fcber Ursachen von Hashimoto-Thyreoiditis machen. Die Behandlung erfolgt symptomatisch mit Hormonpr\u00e4paraten wie\n[L-Thyroxin oder selten mit nat\u00fcrlichen Hormonen](https://www.praxis-breitenberger.de/ratgeber/schilddruese/l-thyroxin/) und der Behandlungserfolg wird nur an einer Normalisierung der TSH-, T3- und T4-Werte bemessen.\nSind diese Laborparameter im Normbereich, gelten die Patienten als gesund. H\u00e4ufig noch anhaltende Beschwerden werden dann nicht mehr mit einer Schildr\u00fcsenfunktionsst\u00f6rung in Zusammenhang gebracht.\nDas ist f\u00fcr die Mehrzahl der Patienten zu Recht entt\u00e4uschend und unbefriedigend, wollen Sie doch mehr \u00fcber Ausl\u00f6ser und nat\u00fcrliche Behandlungsm\u00f6glichkeiten des Hashimoto-Syndroms in Erfahrung bringen. Tats\u00e4chlich gibt es eine Vielzahl an Erfahrungsberichten von physischen und/oder psychischen Ursachen der Hashimoto-Thyreoiditis \u2013 und erfreulicherweise auch immer wieder sehr gute Therapieerfolge durch eine nat\u00fcrliche Behandlung von Hashimoto neben oder anstatt einer Hormonsubstitution.\nWichtig ist immer den Menschen im Zentrum der Behandlung zu sehen und nicht nur seine erkrankte Schilddr\u00fcse.\nUrsachen\n- Genetische Vorbelastung\nEs besteht eine famili\u00e4re Veranlagung zu Hashimoto-Thyreoiditis. Verwandte ersten Grades, also Eltern, Geschwister und Kinder eines Hashimoto-Patienten, scheinen besonders anf\u00e4llig zu sein. Kinder von Eltern mit Hashimoto-Syndrom haben eine Wahrscheinlichkeit von 25 Prozent, dass sie auch eine lymphozyt\u00e4re Thyreoiditis entwickeln. Ein spezifisches Vererbungsmuster liegt jedoch nicht vor. Das zeigt: Gesundheit ist kein Zufall und es w\u00e4re interessant noch mehr zu verstehen, warum manche Menschen nicht erkranken, obwohl sie diese Veranlagung haben. Das wird im Wissenschaftsbereich der\n[Salutogenese](https://www.praxis-breitenberger.de/ratgeber/gesundheit/salutogenese/)bereits erforscht.\n- Molekulare Mimikry\nEinige Viren und Bakterien k\u00f6nnen ihr Aussehen an die der k\u00f6rpereigenen Zellen anpassen. Dadurch entsteht eine gro\u00dfe \u00c4hnlichkeit zwischen k\u00f6rperfremden und eigenen Strukturen, dem eine verh\u00e4ngnisvolle Kettenreaktion folgt: wenn das Immunsystem diese fremden Eindringlinge angreift, bek\u00e4mpft es automatisch auch k\u00f6rpereigenes Gewebe. Ein bekanntes Beispiel daf\u00fcr ist das Rheumatische Fieber, wenn eine Immunantwort gegen\n[Streptokokken](https://www.praxis-breitenberger.de/ratgeber/infektion/streptokokken-angina/)bei einer Mandelentz\u00fcndung auch die Herzklappen angreift und zerst\u00f6rt.\n- Zelltr\u00fcmmer als Fremdk\u00f6rper\nDiese Theorie geht davon aus, dass Schilddr\u00fcsenzellen durch eine Infektion gesch\u00e4digt wurden, wodurch Zelltr\u00fcmmer ins Blut gelangten. Im Blut werden Schilddr\u00fcsenzellen vom Immunsystem als Fremdk\u00f6rper identifiziert und bek\u00e4mpft. Schilddr\u00fcsenzellen werden also als \u201cFeind\u201d und damit als Antigen erkannt, gegen die Abwehrreaktionen erfolgen m\u00fcssen.\n- Stress und pers\u00f6nliche Krisen\nDie meisten Hashimoto-Patienten in meiner Praxis berichten von belastenden Lebenssituationen vor Ausbruch der Erkrankung, wie Probleme in der Partnerschaft,\n[Trennung](https://www.praxis-breitenberger.de/ratgeber/partnerschaft/trennung/), [Schwierigkeiten im System der Herkunftsfamilie](https://www.praxis-breitenberger.de/familienaufstellung/), Mobbing am Arbeitsplatz, Sinnverlust im Leben. Der Stress entsteht dabei meist durch Entscheidungs-Konflikte und \u201cZwickm\u00fchlen\u201d, wo es einfach keinen Ausweg zu geben scheint. Geh\u00e4uft geht es um Themen von Kummer, Kr\u00e4nkung und Entt\u00e4uschung mit unterdr\u00fcckten Emotionen.\nAusl\u00f6ser f\u00fcr Hashimoto\n- Hormonelle Umstellungsphasen: seltener in der Schwangerschaft, h\u00e4ufig nach Entbindung und in der Stillzeit, seltener w\u00e4hrend Pilleneinnahme, h\u00e4ufiger nach Absetzen der Pille, Pr\u00e4menopause, Hormonsubstitution in der Menopause. Meist mit hohem \u00d6strogen-, aber niedrigem Progesteronspiegel\n[\u00d6strogendominanz bzw. Progesteronmangel](https://www.praxis-breitenberger.de/ratgeber/frauengesundheit/oestrogendominanz-progesteronmangel/)z.B. in der Pubert\u00e4t [Polyzystisches Ovarsyndrom](https://www.praxis-breitenberger.de/ratgeber/frauengesundheit/pco-syndrom/); Frauen mit dieser Erkrankung leiden viermal h\u00e4ufiger an einem Hashimoto-Syndrom [Leaky Gut Syndrom](https://www.praxis-breitenberger.de/ratgeber/magen-darm/leaky-gut-syndrom/) [Dysbiose](https://www.praxis-breitenberger.de/ratgeber/magen-darm/darmflora-aufbauen-dysbiose-mikrobiom/)\n- Virusinfektionen: Pfeiffersches Dr\u00fcsenfieber, Mumps, R\u00f6teln, Herpes u.a.\n- Immunstimulierende Medikamente und Impfungen: Interferon-\u03b1, Interleukin-2 etc.\n[Jod-\u00dcberdosierung](https://www.praxis-breitenberger.de/ratgeber/schilddruese/jod-schilddruese/)durch R\u00f6ntgenkontrastmittel (Herzkatheteruntersuchung, Angiographie, CT), Medikamente (z.B. Amiodaron), Milchprodukte aus konventioneller Landwirtschaft, Nahrungserg\u00e4nzungsmittel, die getrocknete Algen und Seetang enthalten. Dahinter steckt meist eine Schwermetallbelastung, die durch eine [H\u00e4mopyrrolurie (HPU)](http://amzn.to/2Fi3c7T)oder [Kryptopyrrolurie (KPU)](http://amzn.to/2oSOHMx)besonders stark ausgepr\u00e4gt sein kann. Es gibt einen Urintest, der Hinweise darauf geben kann [Vitamin D-Mangel](https://www.praxis-breitenberger.de/ratgeber/schilddruese/vitamin-d/)\nVitamin D und Hashimoto\nVitamin D wirkt nachweislich modulierend auf das Immunsystem und bietet Schutz vor vielen Autoimmunerkrankungen und Krebsarten. Der Vitamin-D-Wert sollte \u00fcber 30 ng/ml liegen. Bei den meisten Patienten in meiner Praxis sind diese Werte eher die Ausnahme.\nBesonders Patienten mit Autoimmunkrankheiten, neurologischen Erkrankungen, Ersch\u00f6pfungszust\u00e4nden,\n[Infektanf\u00e4lligkeit](https://www.praxis-breitenberger.de/ratgeber/infektion/infektanfaelligkeit-ursachen-behandlung-hilfe/) und [Depressionen](https://www.praxis-breitenberger.de/ratgeber/psyche/normale-depression/) haben oft sehr niedrige Vitamin-D-Werte. Diese Menschen sollten immer auf einen Vitamin-D-Spiegel von mindestens 40-60 ng/ml eingestellt werden \u2013 langj\u00e4hrig chronisch erkrankte Patienten profitieren von einem Wert zwischen 60-80 ng/ml.\nHashimoto und Schwangerschaft\nViele Hashimoto-Patientinnen, die gern ein Kind bekommen m\u00f6chten, bef\u00fcrchten, dass sich ihre Erkrankung ung\u00fcnstig auf ihre Schwangerschaft auswirken k\u00f6nnte. Zu ihrer Beruhigung sei gesagt: Auch wenn das Risiko f\u00fcr eine Fehlgeburt im Vergleich zu gesunden Frauen tats\u00e4chlich leicht erh\u00f6ht ist, so erlebt doch die gro\u00dfe Mehrzahl der Frauen, die an einer Hashimoto-Thyreoiditis erkrankt sind, eine normale Schwangerschaft und Entbindung.\nWichtig ist, dass die\n[Schilddr\u00fcsenhormone (fT3, fT4) und TSH bereits zum Zeitpunkt der Planung einer Schwangerschaft im Normbereich](https://www.praxis-breitenberger.de/ratgeber/schilddruese/schilddruesenwerte-schwangerschaft/) liegen. W\u00e4hrend der Schwangerschaft sollten die Schilddr\u00fcsenhormone regelm\u00e4\u00dfig, am besten alle vier bis sechs Wochen, kontrolliert werden. Weichen die ermittelten Werte vom Referenzbereich ab, k\u00f6nnen auch engmaschige Kontrolluntersuchungen alle zwei Wochen notwendig sein.\nEinige Hashimoto-Patientinnen f\u00fchlen sich w\u00e4hrend ihrer Schwangerschaft deutlich besser. Dies geht nicht zuletzt auf den kontinuierlichen Anstieg des weiblichen Hormons Progesteron zur\u00fcck, das f\u00fcr den Erhalt der Schwangerschaft in den ersten drei Monaten sorgt und sp\u00e4ter das weitere Wachstum des Ungeborenen f\u00f6rdert. Der positive Effekt von Progesteron auf das Krankheitsbild einer Hashimoto-Thyreoiditis ist messbar, denn oft sinkt auch der TPO-Antik\u00f6rperspiegel \u2013 nicht selten sogar in den Normalbereich.\nNach der Geburt kommt es bei der Mutter jedoch h\u00e4ufig zu einem erneuten Anstieg der Antik\u00f6rper. Deshalb sind nicht nur w\u00e4hrend der Schwangerschaft, sondern auch in den ersten sechs Monate nach der Geburt regelm\u00e4\u00dfige Kontrolluntersuchungen wichtig.\nMitunter werden im Blut des Neugeborenen TPO-Antik\u00f6rper nachgewiesen, die \u00fcber die Plazenta (Mutterkuchen) \u00fcbertragen wurden. Die TPO-Antik\u00f6rper sind f\u00fcr S\u00e4uglinge jedoch v\u00f6llig ungef\u00e4hrlich und werden meist in den ersten Lebensmonaten vollst\u00e4ndig abgebaut.\nSchilddr\u00fcsenhormone in der Schwangerschaft\nFrauen, die zum Ausgleich einer Unterfunktion der Schilddr\u00fcse regelm\u00e4\u00dfig Schilddr\u00fcsenhormonpr\u00e4parate wie\n[L-Thyroxin](https://www.praxis-breitenberger.de/ratgeber/schilddruese/l-thyroxin/) einnehmen m\u00fcssen, brauchen keine Bedenken zu haben, dass die Tabletten dem ungeborenen Kind schaden k\u00f6nnten. Im Gegenteil: F\u00fcr die ungest\u00f6rte Entwicklung des Ungeborenen (und Vorbeugung bleibender Sch\u00e4den) ist es sogar von elementarer Bedeutung, dass eine bestehende Unterfunktion medikament\u00f6s optimal ausgeglichen wird.\nOft steigt der Bedarf an Schilddr\u00fcsenhormonen im Laufe der Schwangerschaft an, mitunter um bis zu 50 Prozent. In diesem Fall ist es wichtig, die erforderliche Dosis nicht auf einmal, sondern unter therapeutischer Anleitung Schritt f\u00fcr Schritt zu erh\u00f6hen.\nDiagnose\nEine Hashimoto-Thyreoiditis kann durch eine Sonographie (Ultraschall) und entsprechende Laborwerte eindeutig festgestellt werden.\nSonographie der Schilddr\u00fcse\nEine echoarme Schilddr\u00fcse, die entweder diffus vergr\u00f6\u00dfert, verkleinert und/oder mit vielen kleinen Infiltraten versehen ist, ist mit einer Wahrscheinlichkeit von 95 Prozent beweisend f\u00fcr das Vorliegen einer Hashimoto-Thyreoiditis \u2013 auch ohne den Nachweis von TPO- und TG-Antik\u00f6rpern.\nHashimoto: Welche Blutwerte sind wichtig?\nPunkt 1 \u2013 7\nSind die Mindestanforderung, um eine differenzierte Diagnose stellen zu k\u00f6nnen, was als Grundlage f\u00fcr eine erfolgreiche Behandlung gilt. Wer dem widerspricht, nimmt Patienten mit Hashimoto-Syndrom und deren Beschwerden nicht ernst!\nPunkt 8 \u2013 16\nSind unter bestimmten Voraussetzungen wichtige Erg\u00e4nzungen.\nPunkt 9 \u2013 10\nEmpfehle ich allen Menschen mit Hashimoto-Thyreoiditis bei gegebenen Symptomen schon vor Beginn der Schilddr\u00fcsen-Behandlung bestimmen zu lassen. Sie ersparen sich damit viel vergeudete Zeit und Frustration in der Therapie.\n1. Kleines Blutbild\n2. TSH\nNur morgens bestimmen lassen, m\u00f6glichst immer zur gleichen Uhrzeit, wegen Schwankungen im Tagesverlauf. Er steigt im Laufe eines Tages an und hat den h\u00f6chsten Wert um Mitternacht.\nPatienten, die Schilddr\u00fcsenhormone einnehmen, sollten dies auch am Tag der Blutentnahme beibehalten, weil die Bestimmung von TSH die Situation abbilden soll, wie sie allt\u00e4glich vorliegt.\nDer TSH-Wert ist keine starre Gr\u00f6\u00dfe und kann sich auch innerhalb von Minuten \u00e4ndern. Er kann vor\u00fcbergehend erh\u00f6ht sein, beispielsweise nach k\u00f6rperlicher Anstrengung. Fastet jemand oder ist krank, dann sinkt der TSH-Wert ab, um einige Tage danach wieder anzusteigen. Einige jodhaltige Medikamente lassen TSH ansteigen und auch Psychopharmaka beeinflussen den TSH-Wert. Ebenfalls ist TSH altersabh\u00e4ngig und bei Kindern und \u00e4lteren Menschen h\u00f6her. Die Interpretation der Werte braucht viel Fingerspitzengef\u00fchl.\nTSH wird von der Hirnanhangsdr\u00fcse (Hypophyse) gebildet. Sie reagiert auf einen Schilddr\u00fcsenhormonmangel, der im Labor noch nicht unbedingt erkennbar sein muss (latente Schilddr\u00fcsenunterfunktion), mit einer erh\u00f6hten TSH-Produktion. Bei erh\u00f6hten TSH-Werten zwischen 5 und 10 mU/l haben nur etwa 30 Prozent der Patienten nach 15 Jahren eine manifeste Schilddr\u00fcsenunterfunktion entwickelt, wie in einer gro\u00dfen Studie aus Schweden gezeigt wurde. Das hei\u00dft, dass man bei leicht erh\u00f6hten TSH-Werten und gutem Allgemeinbefinden erstmal abwarten kann.\nWelcher TSH-Wert ist empfehlenswert bei Hashimoto?\nDer TSH-Wert sollte zwischen 0,4 und 4,0 mU/l liegen.\nWenn er bei der ersten Messung nur etwas \u00fcber 4,0 mU/l betr\u00e4gt, sollte diese unbedingt nach zwei bis drei Monaten wiederholt werden bevor Schilddr\u00fcsenhormone gegeben werden.\nEine Ausnahme bilden Personen mit ausgepr\u00e4gten Symptomen,\n[Frauen mit Kinderwunsch](https://www.praxis-breitenberger.de/ratgeber/frauengesundheit/unerfuellter-kinderwunsch/), Schwangere und Patienten mit [Fettstoffwechselst\u00f6rung](https://www.praxis-breitenberger.de/ratgeber/herz-kreislauf/hypercholesterinaemie/). Hier sollte man einen TSH unter 2,5 mU/l anstreben.\nVon vielen Endokrinologen wird versucht den TSH-Wert zwischen 0,4 und 1,5 mU/l im unteren Normalbereich einzustellen. Dies wird meist mit einer L-Thyroxin-Dosis von 1,5 Mikrogramm/kg K\u00f6rpergewicht erreicht. Bei bestehenden Knoten in der Schilddr\u00fcse wird sogar ein Wert unter 1,0 mU/l angestrebt, um einer Entartung vorzubeugen.\n[Neueste Untersuchungen](https://blog.endokrinologie.net/revolution-in-der-schilddruesendiagnostik-4521/) weisen auf eine \u00fcberf\u00e4llige Revolution in der Schilddr\u00fcsendiagnostik hin: Die Rolle von TSH als wichtigstem Parameter f\u00fcr die Diagnostik von Funktionsst\u00f6rungen der Schilddr\u00fcse wird in Frage gestellt.\nWichtiger als Laborwerte sollten immer das subjektive Wohlbefinden des Patienten sein.\n3. freie Schilddr\u00fcsenhormone: fT4 und fT3\nDie freien Schilddr\u00fcsenhormone sollten zu Beginn der Behandlung bestimmt werden, um zwischen einer manifesten oder subklinischen \u00dcber- oder Unterfunktion der Schilddr\u00fcse unterscheiden zu k\u00f6nnen. Die freien Formen sind biologisch aktiv und korrelieren mit der Schilddr\u00fcsenfunktion. Bei einer \u00dcberfunktion oder bei\n[Unterfunktion der Schilddr\u00fcse in der Schwangerschaft](https://www.praxis-breitenberger.de/ratgeber/schilddruese/schilddruesenwerte-schwangerschaft/) werden die freien Schilddr\u00fcsenhormone regelm\u00e4\u00dfig bestimmt.\nAuch f\u00fcr die Diagnose einer nicht selten vorkommenden Umwandlungsst\u00f6rung (Konversionsst\u00f6rung) m\u00fcssen diese beiden Werte wenigstens einmal zu Beginn der Behandlung bestimmt werden.\nSie k\u00f6nnen jetzt einen Hashimoto-Test bequem von zuhause ohne l\u00e4stige Diskussionen mit dem Arzt durchf\u00fchren. Der Test bestimmt die f\u00fcr Hashimoto wichtigsten 5 Laborparameter: TSH, fT4, fT3, TPO-AK und TAK:\n[Bestellen Sie den Hashimoto-Test](https://amzn.to/39jRwPJ)\n4. Hashimoto: Welche Antik\u00f6rper sind wichtig?\nTPO-Antik\u00f6rper (TPO-AK) sind zu 95 Prozent erh\u00f6ht\nTG-Antik\u00f6rper (TG-Ak oder TAK) sind zu 70 Prozent erh\u00f6ht.\nManchmal sind die Antik\u00f6rper zu Beginn negativ und zeigen sich erst im weiteren Verlauf der Erkrankung. Man nennt das eine seronegative Autoimmunthyreopathie. Die Diagnose wird dann anhand der Sonographie gestellt.\nHeute wei\u00df man, dass die Bildung von Antik\u00f6rpern nicht die Ursache, sondern die Folge einer Hashimoto-Thyreoiditis sein kann, was einen Unterschied zu anderen Autoimmunkrankheiten darstellt. Die Hauptakteure der Autoaggression bei Hashimoto-Syndrom sind spezialisierte Abwehrzellen der wei\u00dfen Blutk\u00f6rperchen, sog. \u201cLymphozyten\u201d. Daher auch die Bezeichnung \u201cchronisch lymphozyt\u00e4re Thyreoiditis\u201d f\u00fcr Hashimoto-Thyreoiditis.\nDie Antik\u00f6rper-Konzentrationen k\u00f6nnen im Krankheitsverlauf stark schwanken. Eine Kontrolle der Antik\u00f6rper ist nur ein Mal pro Jahr notwendig, um \u00fcber die Verordnung von Selen zu entscheiden. Ansonsten lassen die Antik\u00f6rper keine sicheren R\u00fcckschl\u00fcsse \u00fcber das Stadium und den Verlauf der Erkrankung zu.\nDie TRAK-Antik\u00f6rper (TSH-Rezeptor-Antik\u00f6rper) sind wichtige Hinweise f\u00fcr\n[Morbus Basedow](https://www.praxis-breitenberger.de/ratgeber/autoimmunerkrankung/morbus-basedow/) und werden nur bestimmt, wenn es zu Symptomen einer Schilddr\u00fcsen\u00fcberfunktion (Hyperthyreose) kommt.\n5. Ferritin (Eisenspeicher) und Holo-Transcobalamin (aktives Vitamin B12) bei Hashimoto bestimmen\nEin Eisenmangel und eine dadurch bedingte An\u00e4mie kommt h\u00e4ufig vor bei Menschen mit Hashimoto-Thyreoiditis, weil das Immunsystem bei chronischen Entz\u00fcndungen einen h\u00f6heren Verbrauch an Eisen hat. Der Eisenmangel selbst beg\u00fcnstigt v.a. bei Frauen weitere Entz\u00fcndungssch\u00fcbe.\nEisenmangel f\u00fchrt auch zu einem Mangel an Schilddr\u00fcsenhormonen (T3, T4), die aus Jod und Tyrosin gebildet werden und daf\u00fcr das eisenabh\u00e4ngige Enzym TPO (Thyreoperoxidase) ben\u00f6tigen.\nEine An\u00e4mie verl\u00e4uft in verschiedenen Phasen. Mit den \u00fcblicherweise bestimmten Laborwerten (Hb, H\u00e4matokrit, MCV, MCH, MCHC, Transferrins\u00e4ttigung etc.) lassen sich nur fortgeschrittene Stadien des Eisenmangels (manifeste An\u00e4mie) feststellen.\nDer Ferritin-Wert zeigt einen Eisenmangel schon im Fr\u00fchstadium an (latente An\u00e4mie) und sollte daher bei allen Patienten mit Hashimoto-Syndrom \u00fcberpr\u00fcft werden. Bei einem Ferritin-Wert von weniger als 20 \u03bcg/l kann Jod nicht in die Schilddr\u00fcse eingebaut werden und damit werden noch weniger Hormone (T3, T4) produziert.\nDie Schilddr\u00fcsenhormone T3 und T4 sind wiederum wichtig f\u00fcr die Vitamin-B12-Aufnahme und die Blutbildung. Wenn die Schilddr\u00fcsenhormone reduziert sind, wird auch weniger Vitamin B12 und Eisen aufgenommen. Dadurch kommt es zu einer weiteren Drosselung der Herstellung von T3 und T4 in der Schilddr\u00fcse \u2013 ein folgenschwerer Kreislauf beginnt.\nBesonders bei Menschen mit einer hohen Stressbelastung und/oder Alkoholkonsum, bei Veganern, Vegetariern, Schwangeren, \u00e4lteren Menschen und/oder Patienten mit einer Schilddr\u00fcsenunterfunktion oder Magen-Darm-Erkrankungen ist das Risiko eines Vitamin-B12-Mangels deutlich erh\u00f6ht.\nBei dieser Risikogruppe sollte auf jeden Fall auf einen m\u00f6glichen Vitamin B12-Mangel untersucht werden. Allerdings ist das \u00fcblicherweise im Blut bestimmte Gesamt-Vitamin B12 ein sp\u00e4ter, relativ unsensitiver und unspezifischer Biomarker des Vitamin-B12-Mangels, weil dabei vorwiegend die inaktive Speicherform gemessen wird. Neueste Forschungsergebnisse zeigen, dass bei einer Gesamt-Vitamin-B12-Konzentration zwischen 200 bis 550 pg/ml ein B12-Mangel nicht sicher ausgeschlossen werden kann.\nDagegen kann die Bestimmung von Holo-Transcobalamin (Holo-TC) einen Vitamin-B12-Mangel schon in seinen fr\u00fchesten Anfangsstadien aufdecken, wodurch er der sensitivste aller verf\u00fcgbaren Test ist. Niedrige Werte (< 35 pmol/l) sind der sicherste Marker eines Vitamin-B12-Mangels.\n[Vitamin B12 Urintest](https://www.medivere.de/shop/Frau/Mikronaehrstoffe-Vitalstoffmangel/Vitamin-B12-Urintest.html?af=100287) \u2013 bequem und sicher von Zuhause kontrollieren.\n6. Vitamin D\nDie meisten Patienten mit Hashimoto-Thyreoiditis haben einen Vitamin D-Mangel mit vielen nachteiligen Folgen.\nMit dem\n[Vitamin D Test](https://www.medivere.de/shop/Frau/Mikronaehrstoffe-Vitalstoffmangel/Vitamin-D-Test.html?af=100287) selbst den eigenen Bedarf bestimmen.\n7. Magnesium ist wichtig zur Aufnahme von Vitamin D\n8. TT3 (Gesamt T3) und rT3 (reverses T3)\nDer Quotient aus TT3 und rT3 dient als bedeutsamer Indikator der T4 >T3-Konversion und muss bestimmt werden, wenn eine Umwandlungsst\u00f6rung vermutet wird. Das ist der Fall, wenn eine der folgenden Situationen gegeben ist:\n- Hohes fT4 + niedriges fT3 + normwertiger oder erniedrigter TSH-Wert; das kann auch unter einer hochdosierten Therapie mit T4-Monopr\u00e4paraten ( L-Thyroxin, Euthyrox) auftreten, wenn ein \u00dcberangebot an T4 herrscht und der K\u00f6rper darauf reagiert, indem er immer weniger T4 in T3 \u2013 daf\u00fcr aber in rT3 \u2013 umwandelt.\n[Unbefriedigende Resultate einer T4-Monotherapie](https://www.praxis-breitenberger.de/ratgeber/schilddruese/l-thyroxin/)bei schweren anderen Grunderkrankungen neben Hashimoto-Thyreoiditis\n- Differenz zwischen den relativen fT4 und fT3-Werten um mehr als 5 Prozent. Diese Werte k\u00f6nnen Sie selbst berechnen mit einem fT3/fT4-Prozentrechner, den Sie im Internet finden.\nWie entsteht rT3?\nDie Schilddr\u00fcse eines gesunden Erwachsenen stellt pro Tag 95 \u2013 110 Mikrogramm T4 sowie 10 \u2013 25 Mikrogramm T3 her. T4 wird fast ausschlie\u00dflich durch die Schilddr\u00fcse gebildet, wohingegen T3 nur zu etwa 25 Prozent direkt in der Schilddr\u00fcse produziert wird, w\u00e4hrend ca. 75 Prozent durch Konversion (Dejodierung) in Leber, Darm und Niere aus T4 entstehen.\nBei diesem Prozess kann auch das physiologisch inaktive reverse T3 (rT3) aus T4 gebildet werden, das einer bedarfsgerechten Regulation der Schilddr\u00fcsenhormone dient, um einer \u00dcberfunktionssymptomatik vorzubeugen. Bei geringem Bedarf erfolgt im K\u00f6rper also eine vermehrte Dejodierung von T4 zum inaktivem rT3, um einem zu hohen T3-Spiegel entgegen zu wirken. Das Problem dabei: Die molekularen Strukturen von inaktivem rT3 und aktivem T3 sind sehr \u00e4hnlich, sodass T3-Rezeptoren von rT3 blockiert werden. Das gebildete rT3 ist dann nicht nur physiologisch inaktiv, sondern kann zus\u00e4tzlich die Wirkung von T3 durch Blockierung von T3-Rezeptoren behindern.\nLiegt ein sog. \u201cLow-T3-Syndrom\u201d (funktionelle Hypothyreose) mit niedrigem TT3 und hohem rT3 vor, k\u00f6nnen Hashimoto-Patienten von einer Kombinationstherapie mit T4/T3 (statt einer reinen Monosubstitution mit T4), wie z.B. mit\n[Novothyral oder besser mit Prothyrid](https://www.praxis-breitenberger.de/ratgeber/schilddruese/l-thyroxin/), profitieren.\nM\u00f6gliche Ursachen der Umwandlungsst\u00f6rung:\n- Selenmangel\n- Schwere Allgemeinerkrankungen (Hepatitis, Leberzirrhose, Diabetes, fortgeschrittene Herzinsuffizienz, entz\u00fcndliche Prozesse\u2026)\n- Anorexie\n- Medikamente bzw. R\u00f6ntgenkontrastmittel\n- Umwelt-Schadstoffe\n- Antik\u00f6rper gegen Dejodasen\n- Ersch\u00f6pfung, Depressionen\n- Cortisol-\u00dcberschuss durch physischen (Unf\u00e4lle, Operationen, Hungern\u2026) und emotionalen Stress.\nUnter Behandlung und Besserung dieser Ursachen kommt es zur Normalisierung der Schilddr\u00fcsenwerte. Eine der h\u00e4ufigsten Gr\u00fcnde f\u00fcr eine Umwandlungsst\u00f6rung ist bei den meisten Patienten mit Hashimoto-Thyreoiditis eine\n[Nebennierenschw\u00e4che](https://www.praxis-breitenberger.de/ratgeber/stress/nebennierenschwaeche/) durch anhaltenden Stress:\n9. Cortisol und DHEA im Speichel als Hinweis f\u00fcr eine Nebennierenschw\u00e4che\nWenn die vermeintlichen Schilddr\u00fcsen-Symptome sich nicht bessern durch die Hormonsubstitution, wird die Schilddr\u00fcse meist mit ansteigenden Hormon-Dosierungen \u201cbehandelt\u201d. Diese Prozedur verschlechtert die Gesamtsituation der Patienten erheblich! Tats\u00e4chlich m\u00fcssen unbedingt die Nebennieren getestet und ggf. behandelt werden. Lesen Sie mehr \u00fcber\n[Nebennierenschw\u00e4che](https://www.praxis-breitenberger.de/ratgeber/stress/nebennierenschwaeche/), die sich hinter den Symptomen von Hashimoto-Thyreoiditis verbergen kann.\nMit dem\n[Stressprofil](https://www.medivere.de/shop/Frau/Hormonstoffwechsel/Stressprofil.html?af=100287) k\u00f6nnen Sie Ihr Cortisol-Tagesprofil testen und herausfinden, ob eine Nebennierenschw\u00e4che der eigentliche Grund f\u00fcr Ihre vermeintlichen Hashimoto-Symptome ist! Sie sollten diesen Test machen, wenn Sie an Hashimoto-Syndrom leiden und in der Vergangenheit unter anhaltendem oder wiederkehrendem Stress gelitten haben und sich h\u00e4ufig m\u00fcde und ersch\u00f6pft f\u00fchlen. Die Symptome einer Nebennierenschw\u00e4che, die anfangs mit erh\u00f6hten Cortisol-Werten im Speichel korrelieren, sind von den Symptomen einer Schilddr\u00fcsenunterfunktion vom Typ Hashimoto oft nicht zu unterscheiden.\n10. Testen Sie mit diesem Stuhltest, ob Ihre Darmflora intakt ist\n[Gesundheitscheck Darm](https://www.medivere.de/shop/Frau/Darmgesundheit/Gesundheitscheck-Darm.html?af=100287) ist eine mikrobiologische Analyse der aeroben und anaeroben Leitkeime, Schimmelpilze, Hefen sowie die quantitative Untersuchung auf Verdauungsr\u00fcckst\u00e4nde, \u03b1-1-Antitrypsin, Calprotectin, Gallens\u00e4uren, Pankreas Elastase, sekretorisches IgA. Sinnvoll, wenn Sie unter Verdauungsproblemen leiden und/oder Stulunregelm\u00e4\u00dfigkeiten haben und/oder Bl\u00e4hungsbeschwerden haben. Dahinter steht meist eine [Dysbiose](https://www.praxis-breitenberger.de/ratgeber/magen-darm/darmflora-aufbauen-dysbiose-mikrobiom/).\nWenn die Darmflora nicht in Ordnung ist, k\u00f6nnen bis zu 20 Prozent des einzig stoffwechselaktiven Hormons der Schilddr\u00fcse (T3) nicht hergestellt werden.\n11. Stuhltest auf Leaky-Gut-Syndrom \u2013 Ursache von Hashimoto?\n[Gesundheitscheck Darm Plus](https://www.medivere.de/shop/Frau/Darmgesundheit/Gesundheitscheck-Darm-plus.html?af=100287), wenn Sie an einigen der folgenden Symptomen leiden: M\u00fcdigkeit, Leistungsabfall, depressive Verstimmungen, [chronische Magen-Darm-Beschwerden](https://www.praxis-breitenberger.de/ratgeber/magen-darm/reizdarmsyndrom/), Bauchkr\u00e4mpfe, V\u00f6llegef\u00fchl, Reflux, Infektanf\u00e4lligkeit, [Allergien](https://www.praxis-breitenberger.de/ratgeber/allergien/allergien-homoepathie/), Nahrungsmittelunvertr\u00e4glichkeiten.\n12. Testen Sie auf eine latente Glutenunvertr\u00e4glichkeit\n[Dieser Test ist sinnvoll f\u00fcr Hashimoto-Patienten](https://amzn.to/3wEBOb6), die zus\u00e4tzlich an diesen Symptomen leiden: Verdauungsbeschwerden, Reizdarm, aufgetriebener Bauch, Abgeschlagenheit, Kopfschmerzen, depressive Verstimmungen, Reizbarkeit, Knochen- Gelenk- und Muskelschmerzen.\nIst die Stuhlprobe positiv auf Gliadin-/Transglutaminase-Antik\u00f6rper, sollte die Aufnahme von Gluten f\u00fcr 10-12 Wochen gemieden werden. Verbessern sich die Symptome deutlich, bzw. verschlechtern diese sich nach wieder eingef\u00fchrter glutenhaltiger Kost, kann von einer Glutenunvertr\u00e4glichkeit ausgegangen werden.\n13. Jodausscheidung im Morgenurin und eigenen Jodbedarf testen\n[Jodid-Urintest](https://www.medivere.de/shop/Frau/Gewicht/Jodid-Urintest.html?af=100287): so k\u00f6nnen Sie herausfinden, ob Ihr hartn\u00e4ckiges \u00dcbergewicht oder Ihre Schlappheit einen Jodmangel als Ursache hat.\n14. Frauen testen mit diesem Speicheltest eine \u00d6strogendominanz\n[\u00d6strogendominanz](https://www.medivere.de/shop/Frau/Hormonstoffwechsel/Hormonprofil-Frau.html?af=100287) k\u00f6nnen Sie leicht erkennen mit einer laborchemische Analyse der Steroidhormone Estradiol, Estriol und Progesteron im Speichel. Diesen Test sollten Frauen machen mit einer Schilddr\u00fcsenunterfunktion und den folgenden Symptomen: PMS, unerf\u00fcllter Kinderwunsch, Libidoverlust, Stimmungsschwankungen, Konzentrationsst\u00f6rungen, Schlafprobleme, Wassereinlagerungen.\nVerschiedene Studien zeigen, dass Frauen mit Hashimoto-Syndrom nicht selten gleichzeitig an Progesteronmangel und einer \u00d6strogendominanz leiden. Dominant wirkende \u00d6strogene verhindern dann, dass die K\u00f6rperzellen die Schilddr\u00fcsenhormone T3 und T4 richtig verwerten k\u00f6nnen. Dann kann es zu Symptomen einer Schilddr\u00fcsenunterfunktion kommen, obwohl die Schilddr\u00fcse eigentlich gen\u00fcgend Hormone aussch\u00fcttet.\n15. H\u00e4mopyrrolurie (HPU) im Urintest\n[H\u00e4mopyrrolurie (HPU) Urintest](https://www.medivere.de/shop/Alle/Haemopyrrolurie-HPU-Urintest.html?af=100287), um H\u00e4mopyrrol (HPU) im Urin zu bestimmen und einen funktionellen Vitamin-B6- und Zink-Mangel auszuschlie\u00dfen. Sinnvoll, wenn Sie an Hashimoto-Thyreoiditis und zugleich an einigen der folgenden Symptome leiden: blasse Gesichtsfarbe, M\u00fcdigkeit, Ersch\u00f6pfung, Gesichtsschwellung, Empfindlichkeit auf Sonnenlicht, Schlafst\u00f6rungen, Depression, Reizbarkeit, Hautver\u00e4nderungen u.a.\nDieser Test untersucht auf eine h\u00e4ufig vorkommende Stoffwechselerkrankung, die von der Schulmedizin nicht anerkannt wird. HPU f\u00fchrt zu einem Vitalstoffverlust und infolgedessen zu Mangelerscheinungen, die chronische Erkrankungen wie Hashimoto-Syndrom ausl\u00f6sen k\u00f6nnen. Behandelt man die H\u00e4mopyrrolurie, dann bessern sich sehr oft auch die Symptome der Hashimoto-Thyreoiditis.\n16. Glukose und Insulin (n\u00fcchtern) oder Adiponektin oder C-Peptid\nSollte bestimmt werden bei Hei\u00dfhunger-Attacken und anfallsweiser Zittrigkeit. Eine\n[ Insulinresistenz](https://www.praxis-breitenberger.de/ratgeber/frauengesundheit/insulinresistenz/) kann damit nachgewiesen werden, die nicht selten bei Hashimoto-Thyreoiditis mit [PCO-Syndrom](https://www.praxis-breitenberger.de/ratgeber/frauengesundheit/pco-syndrom/) und unerf\u00fclltem Kinderwunsch auftritt.\nBehandlung\nIhr Hashimoto-Spezialist in M\u00fcnchen\nSeit 20 Jahren besch\u00e4ftige ich mich in meiner Praxis in M\u00fcnchen schwerpunktm\u00e4\u00dfig mit Hashimoto-Thyreoiditis und anderen Autoimmunerkrankungen. Dabei konnte ich in vielen Behandlungssitzungen mit meinen Patienten lernen was in der Hashimoto-Therapie wirklich hilft und was nicht.\nDie Grundlage f\u00fcr eine erfolgreiche Behandlung ist relativ einfach: fundierte Kenntnisse \u00fcber m\u00f6gliche Ursachen von Autoimmunerkrankungen, ausreichend Zeit f\u00fcr eine ausf\u00fchrliche Befundaufnahme, eine individualisierte Behandlung und ein offenes Interesse an Menschen und deren ganz spezieller Lebenssituation.\nKann man Hashimoto-Syndrom heilen?\nMit der herk\u00f6mmlichen sog. Schulmedizin ist keine kausale Behandlung der Hashimoto-Thyreoiditis m\u00f6glich. Es werden nur die Symptome behandelt \u2013 und leider auch das h\u00e4ufig nur mit m\u00e4\u00dfigem Erfolg.\nMit einer komplement\u00e4rmedizinischen Behandlung, die das Beste aus Schulmedizin, Naturheilkunde und Klassischer Hom\u00f6opathie vereint, gibt es durchaus gut dokumentierte Heilungsverl\u00e4ufe bei Hashimoto-Thyreoiditis. Als absolute Basis der Behandlung sollte vor irgendeiner Form von Therapie eine ausf\u00fchrliche Diagnose stehen.\nEs folgt eine stufenweise Therapie, die je nach Auff\u00e4lligkeiten in der Diagnostik individuell angepasst wird:\n- Ausgleich von N\u00e4hrstoffdefiziten (wie unten beschrieben)\n[Behandlung der Nebennierenschw\u00e4che](https://www.praxis-breitenberger.de/ratgeber/stress/nebennierenschwaeche/#Nebennierenschwaeche_behandeln) [Behandlung des Leaky-Gut-Syndroms](https://www.praxis-breitenberger.de/ratgeber/magen-darm/leaky-gut-syndrom/) [Behandlung einer \u00d6strogendominanz](https://www.praxis-breitenberger.de/ratgeber/frauengesundheit/oestrogendominanz-progesteronmangel/) [Darmsanierung](https://www.praxis-breitenberger.de/ratgeber/magen-darm/darmflora-aufbauen-dysbiose-mikrobiom/#Darmflora_aufbauen_und_staerken)\n- Antientz\u00fcndliche Strategien\n[Richtige Ern\u00e4hrung](https://www.praxis-breitenberger.de/ratgeber/schilddruese/hashimoto-thyreoiditis/#Richtige_Ernaehrung)bei Hashimoto-Thyreoiditis [Hom\u00f6opathische Konstitutionsbehandlung](https://www.praxis-breitenberger.de/homoeopathie/)\nErfolgt von Anfang an parallel zu allen anderen Ma\u00dfnahmen, um die eigentliche Ursache f\u00fcr die Schilddr\u00fcsenentz\u00fcndung, die Fehlregulation im Immunsystem, behandeln zu k\u00f6nnen\n[Psychotherapie als Selbsterfahrung](https://www.praxis-breitenberger.de/psychotherapie/)\nKann ein entscheidender Erfolgsfaktor in der Therapie sein, um sich den eigenen Bed\u00fcrfnissen und Zielen im Leben wieder bewusst zu werden und das eigene Leben wieder in die Hand zu nehmen.\nBei Autoaggressionsprozessen, wie sie der Hashimoto-Thyreoiditis zugrunde liegen, ist es zu Entfremdungsprozessen gekommen. Auf zellbiologischer Ebene kann man dies an der Bildung von Auto-Antik\u00f6rpern deutlich sehen.\nMeist sind Menschen mit Autoimmunkrankheiten sich selbst aber in einem gr\u00f6\u00dferen Zusammenhang fremd geworden \u2013 sie f\u00fchlen sich nicht mehr in (der) Ordnung.\nImmer wieder berichten mir Patienten in der Praxis: \u201cIch kenne mich gar nicht mehr wieder\u201d, \u201cIch funktioniere nur noch, bin wie gel\u00e4hmt und hab mein Leben nicht mehr im Griff\u201d, \u201cIch bin mir irgendwie selbst total fremd geworden\u201d\u2026\nEin entscheidendes Therapieziel ist es dann, dass Sie wieder mehr M\u00f6glichkeiten im Denken, F\u00fchlen und Handeln bekommen, um ein selbstbestimmtes Leben in Gemeinschaft gestalten und genie\u00dfen zu k\u00f6nnen. Es ist wichtig wieder auf klare Ziele zugehen zu k\u00f6nnen, anstatt nur vom Abgrund davon zu laufen.\nIch unterst\u00fctze Sie dabei als Experte f\u00fcr Lebensweisen, die ein gesundes Leben wahrscheinlicher machen. Die Basis dieser Herangehensweise ist die Humanistische Psychologie, die ich anbiete in Kurzzeittherapie in Einzelsitzungen oder als mehrj\u00e4hrige Gruppentherapie, z.B. in der\n[M\u00fcnchner Gruppe](https://www.praxis-breitenberger.de/gruppentherapie/).\nAusgleich von N\u00e4hrstoffdefiziten bei Hashimoto\nIch m\u00f6chte hier allen Hashimoto-Betroffenen \u2013 auch denen, die nicht nach M\u00fcnchen in meine Praxis kommen k\u00f6nnen \u2013 die M\u00f6glichkeit geben von meiner praktischen Erfahrung mit Mikron\u00e4hrstoffen und Vitaminen in der Behandlung einer chronischen Entz\u00fcndung der Schilddr\u00fcse zu profitieren.\nDie meisten Hashimoto-Patienten profitieren sehr von der kurm\u00e4\u00dfigen Einnahme \u00fcber 3 Monate von: Magnesium + Selen + Resveratrol + L-Tyrosin\nResveratrol hilft bei chronischer Entz\u00fcndung\nDie wirksamste antioxidativ wirkende Substanz aus dem Naturreich und damit unverzichtbar in der Behandlung von chronischen Entz\u00fcndungen. Sch\u00fctzt die K\u00f6rperzellen vor freien Radikalen und stabilisiert das Immunsystem. Durch effektives trans-Resveratrol in Kombination mit Polyphenolen aus Traubenkernextrakt werden die n\u00fctzlichen Eigenschaften dieses Mittels optimiert.\n[OPC Resveratrol Formula, 60 Kapseln](https://www.biogena.com/de/at/produkte/produkt.opc-resveratrol-formula.html?afid=V22880) (2 Packungen f\u00fcr 3-Monats-Kur)\nNehmen Sie im ersten Monat t\u00e4glich 2 Kapseln zu einer Mahlzeit ein und reduzieren Sie in Monat 2 und 3 auf t\u00e4glich 1 Kapsel.\nL-Tyrosin kann bei M\u00fcdigkeit und Konzentrationsproblemen helfen\nDiese semi-essentielle Aminos\u00e4ure ist f\u00fcr Hashimoto-Patienten sehr wichtig, weil sie Ausgangsstoff f\u00fcr Thyroxin und damit die Hormone T4 und T3 ist. Ein L-Tyrosin-Mangel bewirkt immer eine eingeschr\u00e4nkte Schilddr\u00fcsenleistung. Zudem ist L-Tyrosin f\u00fcr die Biosynthese der Nebennieren-Hormone Adrenalin und Noradrenalin, ebenso wie f\u00fcr das \u201cGl\u00fcckshormon\u201d Dopamin eine wichtige Vorl\u00e4ufersubstanz. Wenn die Nebenniere \u00fcber einen l\u00e4ngeren Zeitraum diese Stresshormone vermehrt herstellen musste, k\u00f6nnen sich die L-Tyrosin-Reserven ersch\u00f6pfen. Die Folgen sind: Depressive Verstimmungen, M\u00fcdigkeit, Konzentrationsprobleme.\n[L-Tyrosin 400, 60 Kapseln](https://www.biogena.com/de/at/produkte/produkt.l-tyrosin-400.html?afid=V22880) (3 Packungen f\u00fcr 3-Monats-Kur)\nT\u00e4glich 2 Kapseln mit viel Fl\u00fcssigkeit circa 30 Minuten vor einer Mahlzeit einnehmen. Achtung: dieses Mittel d\u00fcrfen Sie nicht einnehmen, wenn eine (vor\u00fcbergehende) Schilddr\u00fcsen\u00fcberfunktion vorliegt oder Sie gleichzeitig MAO-Hemmer zur Behandlung einer Depression einnehmen!\nWieviel Selen bei Hashimoto?\nEin Selen-Mangel kann Hashimoto beg\u00fcnstigen und verst\u00e4rken. Die Supplementierung mit Selen bei Hashimoto z\u00e4hlt mittlerweile zur Standardtherapie. So kann eine 3-monatige Selentherapie mit 200 Mikrogramm erh\u00f6hte TPO-Antik\u00f6rper signifikant senken.\n[Selen forte, 60 Kapseln](https://www.biogena.com/de/at/produkte/produkt.selen-forte.html?afid=V22880) (2 Packungen f\u00fcr 3-Monats-Kur)\nT\u00e4glich 1 Kapsel mit etwas Wasser einnehmen\nSelen ist ein bedeutsamer Cofaktor f\u00fcr die Bildung von aktiven Schilddr\u00fcsenhormonen und zugleich notwendig f\u00fcr die Umwandlung der inaktiven Form der Schilddr\u00fcsenhormone (T4) in die aktive Form (T3). Selen ist das Schutzelement f\u00fcr die Schilddr\u00fcse, denn bei der Herstellung von Schilddr\u00fcsenhormonen werden in hohem Ma\u00dfe reaktive Sauerstoffspezies gebildet, die das Schilddr\u00fcsengewebe sch\u00e4digen k\u00f6nnen.\nZusammenfassung der positiven Wirkungen von Selen bei Patienten mit Hashimoto-Syndrom:\n- Wirkt als Antioxidanz gegen die Entz\u00fcndung\n- Senkt TPO-Antik\u00f6rper-Spiegel\n- Wichtig f\u00fcr Umwandlung von T4 in T3 als Bestandteil der Dejodasen\n- Entgiftung und Schutz der Leberzellen, d.h. mehr Umwandlung von T4 in T3\nVerschiedene Studien haben eine deutliche Absenkung der Antik\u00f6rper gegen die thyreoidale Peroxidase (TPO-AK) bei Patienten mit Autoimmunthyreopathie unter Seleneinnahme gezeigt (Schmidt K. et al. 1998; G\u00e4rtner, R., 2002; Scheck, R. und Adler, M., 2007). Erfahren Sie mehr \u00fcber den\n[Einfluss einer Selensubstitution auf den Verlauf einer Autoimmunthyreoiditis.](https://edoc.ub.uni-muenchen.de/751/1/Gasnier_Barbara.pdf)\nBraucht man Magnesium bei Hashimoto?\nMagnesium wird im K\u00f6rper zur Aktivierung von Vitamin D ben\u00f6tigt, weil es unerl\u00e4sslich f\u00fcr alle Enzyme im Vitamin-D-Stoffwechsel ist. Zudem hat Magnesium eine deutlich entz\u00fcndungshemmende Wirkung, die bei Autoimmunerkrankungen von gro\u00dfer Bedeutung ist.\n[Siebensalz Magnesium, 180 Kapseln](https://www.biogena.com/de/at/produkte/produkt.siebensalz-magnesium.html?afid=V22880) (ausreichend f\u00fcr 3 Monate)\nNehmen Sie 2 Kapseln abends ein. Biogena Siebensalz Magnesium liefert sieben verschiedene Magnesiumverbindungen als ideale Mischung aus unterschiedlich l\u00f6slichen und magnesiumreichen Verbindungen. Hierdurch wird eine gute Magnesiumversorgung erzielt \u2013 egal welche pH-Wert-Situation im Magen-Darm-Trakt vorherrscht. Magnesium darf nicht mit Eisenpr\u00e4paraten kombiniert werden.\nVitamin D einnehmen bei Hashimoto (wenn der Wert < 40 ng/ml)\n[Vitamin D3 Tropfen](https://www.biogena.com/de/at/produkte/produkt.vitamin-d3-tropfen-1000-ie-25-ml.html?afid=V22880)\nT\u00e4glich 1 Tropfen (enth\u00e4lt Vitamin D3 1.000 I.E.) bringt in ca. 6 bis 8 Wochen den gew\u00fcnschten Erfolg. In abweichenden F\u00e4llen kann im Rahmen meiner Therapie eine individuelle Dosis berechnet werden.\nEisen einnehmen bei Hashimoto ( wenn Ferritin < 35 \u00b5g/l; Zielwert ca. 100 \u00b5g/l)\nEisenmangel tritt als Folge von Hashimoto-Thyreoiditis sehr h\u00e4ufig auf, weil bei einer chronischen Entz\u00fcndung der Eisenverbrauch des Organismus gesteigert ist. Eisenmangel f\u00fchrt wiederum zu einem Mangel an Schilddr\u00fcsenhormonen, weil T3 und T4 gebildet werden, indem Jod durch das Enzym Thyreoperoxidase (TPO) in Tyrosin eingebaut wird und das Enzym TPO eisenabh\u00e4ngig ist. Der Eisenmangel beg\u00fcnstigt wiederum die Entz\u00fcndungssch\u00fcbe (v.a. bei Frauen) und somit kommt ein Teufelskreis in Gang, der durch die Einnahme von Eisen und Antioxidantien gestoppt werden muss. Ist der Eisenmangel behoben, sieht man oft bald einen Abfall der Antik\u00f6rperspiegel.\nBei Eisenmangel wird vom Arzt meist \u201cFerro Sanol Duodenal\u201d in Kapselform verordnet. Viele Patienten klagen unter der Einnahme unter Beschwerden wie: Magen-Darm-Beschwerden, Durchfall, Verstopfung, Sodbrennen, \u00dcbelkeit und Erbrechen.\nIch empfehle meinen Patienten ein rein pflanzliches Eisen, das in punkto Bioverf\u00fcgbarkeit und Vertr\u00e4glichkeit wesentlich besser ist. Das ist die R\u00fcckmeldung von Patienten und Laboranalyse.\n[MoFerrin 21, 60 Kapseln](https://www.biogena.com/de/at/produkte/produkt.moferrin-21-60-kapseln.html?afid=V22880)\nEnth\u00e4lt 21 Milligramm rein pflanzliches Eisen in Kombination mit 40 Milligramm Vitamin C aus Amla- und Acerola-Extrakt, wodurch die Eisenaufnahme verbessert wird. Nehmen Sie t\u00e4glich 1 Kapsel n\u00fcchtern oder 1\u20132 Stunden nach einer Mahlzeit. Halten Sie einen zeitlichen Abstand von min. zwei Stunden zur Einnahme von L-Thyroxin, Magnesium und Selen ein.\nSie k\u00f6nnen die Aufnahme des Eisens zus\u00e4tzlich noch verbessern, wenn Sie Moferrin 21 kombinieren mit:\n[Anaemodoron, Dilution, Fa. Weleda](http://amzn.to/2H3zsro) nehmen Sie 3 mal t\u00e4glich 15 Tropfen vor der Mahlzeit mit wenig Wasser ein.\nVitamin B12 bei Hashimoto (wenn < 390 ng/l)\nNeben Fols\u00e4ure und Eisen ist Vitamin B12 vor allem f\u00fcr die Bildung der roten Blutk\u00f6rperchen verantwortlich. Vitamin B12 tr\u00e4gt zu einem normalen Energiestoffwechsel und zur Verringerung von M\u00fcdigkeit bei, st\u00e4rkt die Nerven, sorgt f\u00fcr einen gesunden Schlaf, einen normalen Homocysteinstoffwechsel (Arteriosskleroseprophylaxe) und eine normale Funktion des Immunsystems \u2013 alles, was Hashimoto-Patienten gut gebrauchen k\u00f6nnen.\n[Vitamin B12 liquid](https://www.biogena.com/de/at/produkte/produkt.vitamin-b12-tropfen-25-ml.html?xtxsearchselecthit=1?afid=V22880)\nGeben Sie t\u00e4glich 1/2 Pipette (0,5 ml) n\u00fcchtern in den Mund und belassen Sie die Fl\u00fcssigkeit einige Zeit dort bevor Sie es schlucken. Dieses Pr\u00e4parat enth\u00e4lt die drei im K\u00f6rper nat\u00fcrlicherweise vorkommenden und biologisch wirksamen Vitamin-B12-Verbindungen: Methylcobalamin, Hydroxocobalamin und Adenosylcobalamin, die besser und schneller aufgenommen werden als die herk\u00f6mmliche Verschreibung des synthetischen, biologisch inaktiven Vitamin B12 (Cyanocobalamin).\nFolgende Personengruppen haben einen erh\u00f6htem Bedarf an Vitamin B12:\n- Vegetarier und Veganer, da Vitamin B12 haupts\u00e4chlich in tierischen Lebensmitteln (Leber, Fleisch, Milch, Eier) enthalten ist\n- \u00c4ltere Personen\n- Menschen mit viel Stress\n- Personen, die rauchen und regelm\u00e4\u00dfig Alkohol trinken\n- Menschen, die viel Sport treiben\n- Stillende M\u00fctter\n- Menschen mit wenig Magens\u00e4ure (Anazidit\u00e4t) wie es bei Schilddr\u00fcsen-Unterfunktion oft vorkommt\n- Patienten, die regelm\u00e4\u00dfig Medikamente einnehmen: Magens\u00e4ureblocker, Metformin\n- Patienten mit Magen-Darm-Erkrankungen, Darmentz\u00fcndungen, Dysbiose oder Leaky-Gut-Syndrom\nFolgende Symptome k\u00f6nnen auf einen Mangel hinweisen: M\u00fcdigkeit, Schw\u00e4che, Schwindel, blasse Haut und Schleimh\u00e4ute, Kurzatmigkeit, Schlafst\u00f6rungen, Nervenschmerzen, Par\u00e4sthesien (Kribbeln, Pelzigkeit), Ged\u00e4chtnis- und Konzentrationsst\u00f6rungen.\nIch empfehle vorzugsweise Pr\u00e4parate der Fa. Biogena, weil sie Reinsubstanzen sind, also laktosefrei, fruktosefrei (nicht alle), glutenfrei und f\u00fcr Vegetarier geeignet.\nWieviel Jod bei Hashimoto?\nSollen Hashimoto-Patienten jodhaltige Nahrungsmittel meiden? Diese Frage wird mir oft in der Praxis gestellt und ich m\u00f6chte sie hier f\u00fcr Sie beantworten.\nJod ist ein essentielles Spurenelement, wie auch Kupfer, Selen, Zink, Eisen u.a., was bedeutet, dass es der K\u00f6rper nicht selbst herstellen kann und es daher mit der Nahrung zugef\u00fchrt werden muss. Allerdings ist die F\u00e4higkeit der Schilddr\u00fcse Jod aufzunehmen und zu speichern bei Hashimoto-Syndrom eingeschr\u00e4nkt.\nJod ist in den Mengen, wie es \u00fcber die Nahrung \u2013 auch mit jodierten Nahrungsmitteln \u2013 aufgenommen wird, f\u00fcr Hashimoto-Patienten unbedenklich. Probleme kann es geben, wenn\n[ dauerhaft zu viel Jod](https://www.praxis-breitenberger.de/ratgeber/schilddruese/jod-schilddruese/#Jodueberschuss_Folgen) aufgenommen wird (> 200 Mikrogramm/Tag [)](https://www.praxis-breitenberger.de/ratgeber/schilddruese/jod-schilddruese/#Jodueberschuss_Folgen). Dadurch kann der Entz\u00fcndungsprozess, gerade bei jodempfindlichen Menschen, weiter angeheizt werden. Diese Reaktion ist besonders stark, wenn gleichzeitig ein Selenmangel vorliegt.\nEine verantwortungsvolle\n[Jodaufnahme nach den individuellen Bed\u00fcrfnissen](https://www.praxis-breitenberger.de/ratgeber/schilddruese/jod-schilddruese/#Jod_Tagesbedarf) ist wichtig, um Erkrankungen der Schilddr\u00fcse zu verhindern bzw. deren Krankheitsverlauf g\u00fcnstig zu beeinflussen.\nEinen nachgewiesenen Jodmangel muss man immer langsam ausgleichen. Am besten wird die F\u00e4higkeit zur Jodaufnahme zu Beginn der Behandlung mit hom\u00f6opathischen Jod-Dosen getestet, bevor \u00fcber die Nahrung und mit schwermetallgepr\u00fcften Braunalgen (Kelp) weiter vorsichtig rejodiert wird.\n[Phyto-Jod 200, 90 Kapseln](https://www.biogena.com/de-AT/produkte/phyto-jod-200.html?xtxsearchselecthit=1?afid=V22880)\nJeden 2. Tag 1 Kapsel mit viel Fl\u00fcssigkeit nach einer Mahlzeit einnehmen. Im Hinblick auf Nachhaltigkeit sind vor allem Meeresalgen als besonders wertvolle Jodlieferanten anzusehen. Aus diesem Grund wurde Phyto-Jod 200 mit nat\u00fcrlichem Jod aus der als Kelp bezeichneten Braunalge Ascophyllum nodosum entwickelt. Bio-zertifiziert.\nBitte nehmen Sie das folgende hom\u00f6opathische Mittel ein, bevor Sie mit Phyto-Jod beginnen, um zu testen, ob bei Ihnen eine Jodempfindlichkeit vorliegt:\n[Fucus vesiculosus D4 (Blasentang)](http://amzn.to/2p3qAe5)\nT\u00e4glich morgens 3 Globuli lutschen f\u00fcr 2 Wochen \u2013 ggf. absetzen wenn Sie folgende Symptome wahrnehmen: Unruhe, Reizbarkeit, Schwei\u00dfneigung, Schlafst\u00f6rung.\nRichtige Ern\u00e4hrung\nWie bei allen chronischen Entz\u00fcndungserkrankungen, so spielt auch bei der Hashimoto-Thyreoiditis die richtige Ern\u00e4hrung eine wichtige Rolle. Dabei geht es nicht darum, sich strikt an eine spezielle \u201eHashimoto-Di\u00e4t\u201c zu halten. Vielmehr kommt es darauf an, den Organismus gezielt mit den N\u00e4hrstoffen zu versorgen, die ihm als Folge der Erkrankung nicht mehr in ausreichendem Ma\u00dfe zur Verf\u00fcgung stehen, und zugleich Lebensmitteln den Vorzug zu geben, die einen entz\u00fcndungshemmenden Effekt haben.\nStudien bescheinigen der anti-entz\u00fcndlichen Ern\u00e4hrungsweise, dass sie gerade bei Menschen mit einer\n[Autoimmunerkrankung](https://www.praxis-breitenberger.de/ratgeber/autoimmunerkrankung/erkrankung-homoeopathie/) zu einer deutlichen Besserung ihrer Beschwerden beitr\u00e4gt. Dazu geh\u00f6rt auch, m\u00f6glichst konsequent auf Lebensmittel zu verzichten, die Entz\u00fcndungen f\u00f6rdern (s. unten), die Zufuhr von Kohlenhydraten zu reduzieren und stattdessen bevorzugt (pflanzliche) Eiwei\u00dfe zu verzehren. Zudem profitieren einige Hashimoto-Patienten von einer glutenfreien Ern\u00e4hrung.\nWichtige Hinweise f\u00fcr die individuelle Umstellung der Ern\u00e4hrungsweise liefern Untersuchungen wie eine Blutanalyse, ein Urin- oder Stuhltest (s. Diagnose), mit denen z.B. ein Mangel an N\u00e4hrstoffen oder ein\n[Leaky-Gut-Syndrom](https://www.praxis-breitenberger.de/ratgeber/magen-darm/leaky-gut-syndrom/) aufgedeckt werden k\u00f6nnen. Eine latente Glutenunvertr\u00e4glichkeit, die nicht dem Vollbild einer Z\u00f6liakie oder einheimischen Sprue entspricht, l\u00e4sst sich mit dem Nachweis von Anti-Gliadin-sIgA sowie Anti-Transglutaminase-IgA im Stuhl bequem von zuhause aus untersuchen.\nGibt es eine Hashimoto-Di\u00e4t?\nEs gibt keine Hashimoto-Di\u00e4t, die f\u00fcr alle Hashimoto-Patienten gleicherma\u00dfen gut ist. Auch wenn viele Hashimoto-Betroffene erwiesenerma\u00dfen von einer Ern\u00e4hrungsumstellung profitieren, so bleibt es letztlich jedem selbst \u00fcberlassen, wie er sie im t\u00e4glichen Leben umsetzt.\nWer z.B. feststellt, dass sich durch eine glutenfreie Ern\u00e4hrung keine Besserung einstellt, oder \u2013 umgekehrt \u2013 dass sich Kohlgerichte (s. unten) nicht ung\u00fcnstig auf seine Beschwerden auswirken, f\u00fcr den macht es nur wenig Sinn, sich trotzdem in Verzicht zu \u00fcben. So gesehen, kommt es bei einer \u00c4nderung der Ern\u00e4hrungsgewohnheiten immer auch auf die individuelle Vertr\u00e4glichkeit und die pers\u00f6nlichen Geschmacksvorlieben an.\nWas soll man essen bei Hashimoto?\nIm Zentrum einer anti-entz\u00fcndlichen Ern\u00e4hrungsweise stehen pflanzliche (nat\u00fcrliche) Antioxidantien, die den K\u00f6rper vor Freien Radikalen sch\u00fctzen und mit denen sich Entz\u00fcndungsreaktionen sehr effektiv unterbrechen lassen. Besonders wirksame Antioxidantien sind die Vitamine A, C und E, die Spurenelemente Selen und Zink sowie verschiedene sekund\u00e4re Pflanzenstoffe.\nDiese befinden sich in frischem Obst und Gem\u00fcse, in Salaten, Kr\u00e4utern und Sprossen, aber auch in N\u00fcssen und Pflanzen\u00f6len, die reich an Omega-3-Fetts\u00e4uren sind (s. unten). Auch H\u00fclsenfr\u00fcchte geh\u00f6ren zu den Antioxidantien, die zudem viel Eisen und hochwertige Eiwei\u00dfe liefern.\nEtwa 700 Gramm Obst und Gem\u00fcse pro Tag sollten die Basis der Ern\u00e4hrung bilden. Bei der Auswahl der Gem\u00fcsesorten m\u00fcssen Hashimoto-Patienten allerdings genauer hinschauen. Denn einige, eigentlich entz\u00fcndungshemmende Gem\u00fcsesorten, wie etwa Gr\u00fcnkohl, sind f\u00fcr sie unter Umst\u00e4nden weniger gut geeignet, weil sie Inhaltsstoffe enthalten, die die Jodaufnahme in die Schilddr\u00fcse hemmen (s. unten).\nBei Obst haben sich die Sorten als besonders g\u00fcnstig erwiesen, die nur wenig Fruchtzucker (Fruktose) enthalten. Dazu geh\u00f6ren z.B. alle Beerensorten, Limetten, Kiwi, Grapefruit, Pfirsiche, Orangen, Aprikosen, Guave, Papaya und Acerola.\nGew\u00fcrze wie Ingwer, Pfeffer, Kurkuma oder Koriander enthalten viele sekund\u00e4re Pflanzenstoffe mit antioxidativer Wirkung und wirken deshalb entz\u00fcndungshemmend. Diejenigen unter Ihnen, die es sich einfach machen m\u00f6chten und dennoch nicht auf die Heilkraft von Kurkuma verzichten m\u00f6chten, nehmen:\n[Curcuma 500, 60 Kapseln](https://www.biogena.com/de/at/produkte/produkt.curcuma-500.html?afid=V22880)\nPatentierter Curcumin C3 Komplex aus der Gelbwurz und Bioperine aus schwarzem Pfeffer, das die Bioverf\u00fcgbarkeit von Kurkuma erh\u00f6ht. Nehmen Sie 1 Kapsel pro Tag nach dem Mittagessen ein.\nEiner der wichtigsten N\u00e4hrstoffe f\u00fcr die Gesundheit der Schilddr\u00fcse und speziell f\u00fcr Hashimoto-Patienten ist Selen (s. Behandlung). Hashimoto-Betroffene sollten deshalb gezielt selenreiche Nahrungsmittel auf ihren w\u00f6chentlichen Speiseplan setzen. Neben Eiern und einigen Fischarten wie Lachs, Makrele oder Kabeljau gibt es auch eine Reihe von pflanzlichen Lebensmitteln, die viel Selen enthalten, allen voran Para- und Kokosn\u00fcsse, aber auch H\u00fclsenfr\u00fcchte, Steinpilze und Garnelen.\nOmega-3-Fetts\u00e4uren (wie Alpha-Linolens\u00e4ure, Eicosapentaens\u00e4ure und Docosahexaens\u00e4ure) dienen u.a. als Vorl\u00e4ufer von Botenstoffen im K\u00f6rper, die f\u00fcr die Eind\u00e4mmung von Entz\u00fcndungen verantwortlich sind. Zugleich sind sie der nat\u00fcrliche Gegenspieler der Omega-6-Fetts\u00e4uren, die entz\u00fcndungsf\u00f6rdernde Botenstoffe bilden. Menschen mit Schilddr\u00fcsenunterfunktion haben zudem geh\u00e4uft erh\u00f6hte Blutfettwerte. Omega-3-Fetts\u00e4uren k\u00f6nnen den Triglyceridspiegel senken, tragen zu einer Verbesserung der LDL-Werte und Erh\u00f6hung der HDL-Werte bei und k\u00f6nnen nachweislich den\n[Bluthochdruck senken](https://www.praxis-breitenberger.de/ratgeber/herz-kreislauf/bluthochdruck/#Bluthochdruck_senken).\nHashimoto-Patienten haben einen besonders hohen Bedarf an Omega-3-Fetts\u00e4uren und sollten deshalb bevorzugt Nahrungsmittel essen, die viele Omega-3-Fetts\u00e4uren enthalten. Der beste Omega-3-Lieferant ist Fisch\u00f6l, insbesondere von Kaltwasser-Seefischen. Hohe Gehalte finden sich aber auch in gemahlenem Leinsamen, Waln\u00fcssen, gr\u00fcnem Blattgem\u00fcse und in Chia-Samen.\nDas richtige \u00d6l zur Zubereitung von Speisen ist eine weitere wichtige S\u00e4ule der anti-entz\u00fcndlichen Ern\u00e4hrung: \u00d6le wie\n[Lein- bzw. Hanf\u00f6l](https://amzn.to/2LqMnJO) oder [Raps\u00f6l](https://amzn.to/2uxeXjh) enthalten besonders viel Omega-3-Fetts\u00e4uren. Aber auch kaltgepresstes Oliven- und [Walnuss\u00f6l](https://amzn.to/2L7h4Vf) sind g\u00fcnstig. Dagegen sollten Distel- oder Sonnenblumen\u00f6l sparsam verwendet werden, weil sie reich an entz\u00fcndungsf\u00f6rdernden Omega-6-Fetts\u00e4uren sind. Und: Palmfett, Butter-, Schweine- und G\u00e4nseschmalz sollten ganz vom t\u00e4glichen Speiseplan gestrichen werden.\nEs empfiehlt sich, sich mindestens zweimal pro Woche eine Fischmahlzeit zuzubereiten. Beispielsweise enthalten Lachs, Thunfisch oder Makrele besonders viel Omega-3-Fetts\u00e4uren und wirken den Entz\u00fcndungsprozessen deshalb effektiv entgegen.\nWenn Sie nicht regelm\u00e4\u00dfig fettreichen Meeresfisch essen m\u00f6chten, k\u00f6nnen Sie auch durch dieses Pr\u00e4parat f\u00fcr eine ausgeglichene Versorgung mit Omega-3-Fetts\u00e4uren sorgen:\n[Omega-3-Fetts\u00e4uren, 180 Kapseln als 3-Monats-Packung](https://www.biogena.com/de/at/produkte/produkt.omega-3-duo.html?afid=V22880)\nEnth\u00e4lt die standardisierten Omega-3-Fetts\u00e4uren EPA (Eicosapentaens\u00e4ure) und DHA (Docosahexaens\u00e4ure). Nehmen Sie t\u00e4glich 2 mal je 1 Kapsel zur Mahlzeit.\nEiwei\u00df und seine Bausteine, die Aminos\u00e4uren, sind f\u00fcr den K\u00f6rper unentbehrlich. Weil der K\u00f6rper acht der insgesamt 20 Aminos\u00e4uren nicht selbst herstellen kann, sollte man etwa 50 bis 55 Gramm Eiwei\u00df am Tag essen. Am besten wird der Bedarf vorwiegend mit pflanzlichen Eiwei\u00dfen gedeckt, denn sie k\u00f6nnen leichter verstoffwechselt werden als Eiwei\u00dfe tierischer Herkunft. Gute Eiwei\u00dflieferanten sind z.B. H\u00fclsenfr\u00fcchte, Quinoa, N\u00fcsse oder Sojabohnen. Da Sojabohnen Goitrogene (s. unten) enthalten, sollte man jedoch zun\u00e4chst pr\u00fcfen, ob sie gut vertragen werden.\nAuch Kohlenhydrate sind f\u00fcr den K\u00f6rper lebenswichtig. Doch kommt es hierbei vor allem auf die Art der Kohlenhydrate an. Vor allem industriell verarbeitete Kohlenhydrate wie Haushaltszucker, Wei\u00dfmehl, wei\u00dfer Reis, Cornflakes oder weiterverarbeitete Kartoffeln bestehen \u00fcberwiegend aus einfachen (kurzkettigen) Kohlenhydraten. Und sie sorgen nicht nur f\u00fcr einen schnellen bzw. zu hohen Anstieg des Blutzuckerspiegels und\n[Insulinresistenz](https://www.praxis-breitenberger.de/ratgeber/frauengesundheit/insulinresistenz/), sondern fachen auch Entz\u00fcndungen an.\nSinnvoller ist eine Ern\u00e4hrung nach der Glyk\u00e4mischen Last. Danach sind vor allem naturbelassene (langkettige), ballaststoffreiche Kohlenhydrate g\u00fcnstig, die z.B. in Vollkornprodukten, H\u00fclsenfr\u00fcchten, zuckerarmem Obst und frischem Gem\u00fcse stecken. Leaky-Gut-Syndrom-Patienten sollten mit Vollkornprodukten allerdings vorsichtig sein.\nProbiotika, aber auch Pr\u00e4biotika wie die l\u00f6slichen Ballaststoffe Inulin oder Oligfruktose st\u00e4rken die Darmflora. Ein darmgesundes Lebensmittel ist z.B. probiotischer Joghurt: Seine anregende Wirkung auf den Stoffwechsel der\n[Darmflora](https://www.praxis-breitenberger.de/ratgeber/magen-darm/darmflora-aufbauen-dysbiose-mikrobiom/) ist wissenschaftlich belegt.\nLassen Sie sich inspirieren von Rezepten, die speziell f\u00fcr Menschen mit Autoimmunerkrankungen zusammengestellt wurden. Sie werden staunen, wie sehr sich Konzentration und Energie durch passende Mahlzeiten verbessern k\u00f6nnen.\n[Paleo-Kochbuch f\u00fcr Menschen mit Hashimoto und anderen Autoimmunerkrankungen](https://www.amazon.de/gp/product/3432103360/ref=as_li_tl?ie=UTF8&camp=1638&creative=6742&creativeASIN=3432103360&linkCode=as2&tag=breitenberger-21&linkId=dc61e4daa68e14d6b742c13177f639ab)\nWas darf man nicht essen bei Hashimoto?\nTierische Lebensmittel sollten grunds\u00e4tzlich mit Bedacht verzehrt werden, insbesondere wenn sie viel Fett enthalten. Denn die meisten Fleisch- und Wurstsorten, aber auch Innereien, Schweine-, G\u00e4nse- und Butterschmalz, fettreiche Milchprodukte, Eigelb und viele Fertiggerichte enthalten viel Arachidons\u00e4ure, die zu den Omega-6-Fetts\u00e4uren geh\u00f6rt. Aus dieser S\u00e4ure bildet der K\u00f6rper bestimmte Entz\u00fcndungsbotenstoffe, die hochgradig entz\u00fcndungsf\u00f6rdernd wirken.\nDas hei\u00dft jedoch nicht, dass die Aufnahme von Omega-6-Fetts\u00e4uren generell vermieden werden sollte. Vielmehr kommt es auf das richtige Verh\u00e4ltnis an. So empfiehlt die Deutsche Gesellschaft f\u00fcr Ern\u00e4hrung (DGE), Omega-6-Fetts\u00e4urem im Verh\u00e4ltnis von Omega-3-Fetts\u00e4uren im Verh\u00e4ltnis von h\u00f6chstens 5:1 aufzunehmen. Ideal ist deshalb z.B., wenn der Konsum von (magerem) Fleisch und Wurst auf ein- bis zweimal pro Woche reduziert wird. Bei Milch- und K\u00e4seprodukten sollte man auf einen geringen Fettgehalt achten. Und statt in Schweine- und Butterschmalz lassen sich Gerichte auch gut in Raps\u00f6l zubereiten.\nWelche Lebensmittel meiden bei Hashimoto?\nEs gibt Nahrungsmittel, die Hashimoto-Patienten meiden sollten. Sie enthalten sogenannte Goitrogene (engl. goiter = Kropf), die im K\u00f6rper zu bestimmten Substanzen (Thiocyanate) umgebaut werden, die die Jodaufnahme in die Schilddr\u00fcse behindern. Dadurch wird der Einbau von Jod in Tyrosin und damit die Produktion von Schilddr\u00fcsenhormonen blockiert.\n- Kohlarten wie Blumenkohl, Wei\u00dfkohl, Chinakohl, Gr\u00fcnkohl, Rosenkohl, Wirsing\n- Brunnen- und Kapuzinerkresse\n- Radieschen\n- Steckr\u00fcben\n- Senf, Meerettich\n- Hirse\n- Bittermandeln\n- Pinienkerne\n- Sojaprodukte\n- Mais\n- Zwiebeln, Knoblauch und andere Lauchgem\u00fcse\nOb ein v\u00f6lliger Verzicht tats\u00e4chlich notwendig ist, wird kontrovers diskutiert. Kritiker verweisen darauf, dass schon eine sehr, sehr gro\u00dfe (kaum erreichbare) Menge verzehrt werden m\u00fcsse, um Hashimoto-Patienten gef\u00e4hrlich zu werden. Anders gesagt: Wer sich durch den Verzehr von goitrogenen Lebensmitteln nicht beeintr\u00e4chtigt f\u00fchlt, braucht sie eigentlich auch nicht von seinem Speiseplan zu streichen.\nWichtig ist schlie\u00dflich auch, dass die Mahlzeiten aus frischen Zutaten (am besten Bio-Ware) zubereitet werden. Demgegen\u00fcber sollte auf Lebensmittel, die chemische Zusatzstoffe, k\u00fcnstliche Aromen oder Geschmacksverst\u00e4rker enthalten, wie sie z.B. in vielen \u201eFertigprodukten\u201c enthalten sind, m\u00f6glichst verzichtet werden.\nHashimoto und Gluten(unvertr\u00e4glichkeit)\nGluten ist ein Klebereiwei\u00df, das in vielen Getreidesorten vorkommt, so etwa in Weizen, Roggen, Hafer, Gerste, Dinkel und Gr\u00fcnkern. Der konsequente Verzicht auf glutenhaltige Lebensmittel ist notwendig, wenn eine Glutenunvertr\u00e4glichkeit bzw. die Autoimmunerkrankung Z\u00f6liakie festgestellt wurde. Aber auch einige Hashimoto-Patienten, bei denen eine Unvertr\u00e4glichkeit des Klebereiwei\u00dfes nicht nachgewiesen werden konnte, f\u00fchlen sich deutlich besser, wenn sie glutenhaltige Nahrungsmittel meiden.\nDeshalb lohnt sich ein Versuch, sich f\u00fcr eine Weile glutenfrei zu ern\u00e4hren. Dies gilt umso mehr, wenn der Darm Probleme bereitet, etwa, weil ein\n[Leaky-Gut-Syndrom](https://www.praxis-breitenberger.de/ratgeber/magen-darm/leaky-gut-syndrom/#Symptome) besteht. Bessern sich die Symptome, sollten Betroffene die glutenfreie Ern\u00e4hrung mindestens solange beibehalten, bis der Darm wieder gesund ist. Glutenfreie Alternativen sind: Amarant, Buchweizen, Kichererbsen, Quinoa und Reis. Ansonsten gilt: Bleibt eine sp\u00fcrbare Verbesserung der Krankheitsbeschwerden aus, ist es auch nicht notwendig, weiterhin auf Gluten zu verzichten.\nL-Thyroxin\n\u00dcblicherweise werden bei Hashimoto-Thyreoiditis\n[T4-Monopr\u00e4parate (z.B. L-Thyroxin, Euthyrox)](https://www.praxis-breitenberger.de/ratgeber/schilddruese/l-thyroxin/) in den Dosierungen von 25 bis 200 Mikrogramm pro Tablette eingesetzt.\nGerade bei Umwandlungsst\u00f6rungen von T4 in T3, die entstehen k\u00f6nnen durch Selenmangel, Ersch\u00f6pfung, Depressionen, emotionalen Stress und schweren Allgemeinerkrankungen etc. ist die Einnahme eines\n[T4-T3-Kombipr\u00e4parates](https://www.praxis-breitenberger.de/ratgeber/schilddruese/l-thyroxin/#Alternativen) oder von [Schilddr\u00fcsen-Extrakt](https://www.praxis-breitenberger.de/ratgeber/schilddruese/l-thyroxin/#Natuerliche_Hormontherapie) ratsam.\nEs herrscht Einigkeit, dass bei manifester Schilddr\u00fcsenunterfunktion, d.h. erh\u00f6htem TSH-Wert und erniedrigtem fT4, eine Hormon-Substitution mit L-Thyroxin selbstverst\u00e4ndlich ist. Viel h\u00e4ufiger ist aber die subklinische Unterfunktion mit erh\u00f6htem TSH und normalen oder grenzwertigem fT4 und fT3. Hier besteht Uneinigkeit bei \u00c4rzten und Verwirrung bei Patienten, ab welchem TSH-Wert eine Hormonbehandlung erfolgen sollte.\nNach meiner Erfahrung kann diese Entscheidung nur unter Ber\u00fccksichtigung der individuellen Situation der Patientin oder des Patienten getroffen werden. Verschiedene Faktoren m\u00fcssen beachtet werden:\n- Wie lange besteht die Erkrankung schon?\n- Ist die Schilddr\u00fcse gr\u00f6\u00dfenver\u00e4ndert?\n- Gibt es Knoten in der Schilddr\u00fcse?\n- Liegen Begleiterkrankungen vor?\n- Besteht eine\n[Fettstoffwechselst\u00f6rung](https://www.praxis-breitenberger.de/ratgeber/herz-kreislauf/hypercholesterinaemie/)? Das kardiovaskul\u00e4re Risiko mu\u00df durch [Senkung von LDL-Cholesterin](https://www.praxis-breitenberger.de/ratgeber/herz-kreislauf/metabolisches-syndrom/#Behandlung)minimiert werden.\n- Wie alt ist die Patientin / der Patient? Patienten \u00fcber 65 Jahre mit subklinischer Schilddr\u00fcsenunterfunktion haben eine dreifach h\u00f6here Wahrscheinlichkeit, an Demenz zu erkranken!\n- Liegt ein\n[Kinderwunsch](https://www.praxis-breitenberger.de/ratgeber/frauengesundheit/unerfuellter-kinderwunsch/)vor? Frauen mit einer AIT haben eine dreimal h\u00f6here Fr\u00fchabortrate als gesunde Frauen!\n- Besteht eine\n[Schwangerschaft](https://www.praxis-breitenberger.de/ratgeber/schilddruese/schilddruesenwerte-schwangerschaft/)?\n- Wie ist das subjektive Wohlbefinden?\nEine Substitution mit L-Thyroxin bis zu einem TSH von 4,0 \u2013 6,0 mU/l ist optional.\n\u201cEin leicht erh\u00f6hter TSH-Wert bedeutet kein Gesundheitsrisiko. Daher ist es sinnvoll, bei einem TSH-Wert von vier oder leicht h\u00f6her, erst einmal abzuwarten und die Werte regelm\u00e4\u00dfig zu kontrollieren. Viele f\u00fchlen sich nach einer Hormoneinnahme nicht besser. Man muss die Patienten behandeln und nicht ihre Laborwerte.\u201dSchilddr\u00fcsenexperte Prof. R. G\u00e4rtner, endokrinologische Abteilung LMU, M\u00fcnchen\nHormone allein reicht nicht\nObwohl hierzulande bis zu acht Millionen Menschen an einer Hashimoto-Thyreoiditis erkrankt sind, ist der Aufkl\u00e4rungsbedarf bei den Betroffenen \u00fcber ihre Erkrankung enorm gro\u00df. Vor allem suchen sie nach einer Behandlung, die ihnen wirklich hilft. Denn die Schulmedizin behandelt nur die Symptome der autoimmunbedingten Schilddr\u00fcsenentz\u00fcndung. Viele Menschen mit Hashimoto machen jedoch die Erfahrung, dass sich trotz regelm\u00e4\u00dfiger Tabletteneinnahme ihre Beschwerden kaum oder gar nicht bessern.\nLesen Sie auch dazu:\n[Jod & Schilddr\u00fcse](https://www.praxis-breitenberger.de/ratgeber/schilddruese/jod-schilddruese/) [Vitamin D](https://www.praxis-breitenberger.de/ratgeber/schilddruese/vitamin-d/): Nutzen, Mangel & Bedarf [L-Thyroxin](https://www.praxis-breitenberger.de/ratgeber/schilddruese/l-thyroxin/): Wirkung & Nebenwirkungen [Schilddr\u00fcsenwerte in der Schwangerschaft](https://www.praxis-breitenberger.de/ratgeber/schilddruese/schilddruesenwerte-schwangerschaft/) [Online Termin vereinbaren beim Hashimoto-Spezialisten in M\u00fcnchen](https://www.praxis-breitenberger.de/online-terminbuchung/)\nH\u00e4ufige Fragen (FAQ) zu Hashimoto-Thyreoiditis\nDiese Fragen werden h\u00e4ufig zum Thema \u201cHashimoto-Thyreoiditis\u201d gestellt:\nErstellungsdatum:\n10.01.2011\nAutoren:\n[Markus Breitenberger](https://www.praxis-breitenberger.de/zur-person/), Heilpraktiker und Hom\u00f6opath. Seit \u00fcber 20 Jahren behandelt er in eigener Praxis schwerpunktm\u00e4\u00dfig Menschen mit Autoimmunerkrankungen. Autor von 2 B\u00fcchern zum Thema Autoimmunerkrankungen und Hashimoto-Thyreoiditis und zahlreichen medizinischen Fachartikeln. [Dr. Nicole Schaenzler](https://www.praxis-breitenberger.de/redaktionsteam-dr-schaenzler/), Philologin und Medizinjournalistin. Herausgeberin eines Gesundheitsmagazins und Fachautorin zahlreicher B\u00fccher zu medizinischen Themen.\nQuellen:\n[Breitenberger / Schaenzler: Autoimmunerkrankungen in den Griff bekommen: Die besten ganzheitlichen Therapien (GU Ratgeber Gesundheit)](https://www.gu.de/produkte/koerper-geist-seele/beschwerden-und-erkrankungen/autoimmunerkrankungen-in-den-griff-bekommen-schaenzler-2019/) [Breitenberger / Schaenzler: Hashimoto ganzheitlich behandeln: \u2026 und wieder in Balance kommen (GU Ratgeber Gesundheit)](https://www.buecher.de/shop/fachbuecher/hashimoto-ganzheitlich-behandeln/schaenzler-nicole-breitenberger-markus/products_products/detail/prod_id/49699066/) [Gesundheitsportal gesund.bund.de, eine Initiative des Bundesministeriums f\u00fcr Gesundheit](https://gesund.bund.de/schilddruesenunterfunktion) [Hahn, A. et al. Ern\u00e4hrung: Physiologische Grundlagen, Pr\u00e4vention, Therapie, 3. neu bearbeitete und erweiterte Auflage. Stuttgart: Wissenschaftliche Verlagsgesellschaft Stuttgart, 2016](https://www.wissenschaftliche-verlagsgesellschaft.de/bereiche/ernaehrung/view/titel/55048.html) [Drutel, A. et al. 2013. Selenium and the thyroid gland: more good news for clinicians. Clin Endocrinol. 78(2):155-164. doi: 10.1111/cen.12066](https://pubmed.ncbi.nlm.nih.gov/23046013/) [G\u00e4rtner, R. et al. 2002. Selenium supplementation in patients with autoimmune thyroiditis decreases thyroid peroxidase antibodies concentrations. J Clin Endocrinol Metab. 87(4):1687-1691. doi: 10.1210/jcem.87.4.8421](https://pubmed.ncbi.nlm.nih.gov/11932302/) [Gr\u00f6ber, U. Arzneimittel und Mikron\u00e4hrstoffe: Medikationsorientierte Supplementierung, 3. aktualisierte und erweiterte Auflage. Stuttgart: WVG Wissenschaftliche Verlagsgesellschaft Stuttgart, 2014](https://www.wissenschaftliche-verlagsgesellschaft.de/titel/58112.html) [Normal Thyroid Function and the Risk of Atrial Fibrillation: the Rotterdam Study, The Journal of Clinical Endocrinology & Metabolism, Volume 100, Issue 10, 1 October 2015, Pages 3718\u20133724](https://academic.oup.com/jcem/article/100/10/3718/2835789) [Autoimmunerkrankung Hashimoto-Thyreoiditis noch nicht genug erforscht, Was \u00fcbersieht die Medizin?, Anna Clemens in Spektrum.de, 11/2019](https://www.spektrum.de/news/autoimmunerkrankung-hashimoto-thyreoiditis-noch-nicht-genug-erforscht/1682326) [Hashimoto-Thyreoiditis: Laborkosmetik vermeiden, \u00c4rztezeitung.at, 02/2018](https://www.aerztezeitung.at/archiv/oeaez-2018/oeaez-4-25022018/hashimoto-thyreoiditis-laborkosmetik-vermeiden.html)", "language": null, "image": "https://www.praxis-breitenberger.de/wp-content/uploads/2021/01/Hashimoto_720.png", "pagetype": "article", "links": ["https://www.praxis-breitenberger.de/", "https://www.praxis-breitenberger.de/", "#", "https://www.praxis-breitenberger.de/homoeopathie-muenchen/", "https://www.praxis-breitenberger.de/psychotherapie-muenchen/", "https://www.praxis-breitenberger.de/paarberatung-muenchen/", "https://www.praxis-breitenberger.de/ratgeber-uebersicht/", "https://www.praxis-breitenberger.de/zur-person/", "https://www.praxis-breitenberger.de/terminvereinbarung/", "https://www.praxis-breitenberger.de/zur-person/", "https://www.praxis-breitenberger.de/redaktionsteam-dr-schaenzler/", "https://www.praxis-breitenberger.de/qualitaetsrichtlinien/", "https://www.facebook.com/sharer.php?u=https://www.praxis-breitenberger.de/ratgeber/schilddruese/hashimoto-thyreoiditis/", "https://www.linkedin.com/shareArticle?mini=true&url=https://www.praxis-breitenberger.de/ratgeber/schilddruese/hashimoto-thyreoiditis/", "https://twitter.com/intent/tweet?url=https://www.praxis-breitenberger.de/ratgeber/schilddruese/hashimoto-thyreoiditis/&text=Hashimoto-Thyreoiditis+mit+Hom%C3%B6opathie+behandeln%3A+Ern%C3%A4hrung%2C+Symptome+%26+Therapie", "https://www.xing.com/social_plugins/share/new?url=https://www.praxis-breitenberger.de/ratgeber/schilddruese/hashimoto-thyreoiditis/", "https://wa.me/?text=https://www.praxis-breitenberger.de/ratgeber/schilddruese/hashimoto-thyreoiditis/", "mailto:?subject=Hashimoto-Thyreoiditis mit Hom\u00f6opathie behandeln: Ern\u00e4hrung, Symptome & Therapie&body=https://www.praxis-breitenberger.de/ratgeber/schilddruese/hashimoto-thyreoiditis/", "#Was_ist_Hashimoto-Thyreoiditis", "#Symptome", "#Ursachen", "#Diagnose", "#Behandlung", "#Richtige_Ernaehrung", "#L-Thyroxin", "#Haeufige_Fragen_FAQ_zu_Hashimoto-Thyreoiditis", "https://www.praxis-breitenberger.de/ratgeber/autoimmunerkrankung/erkrankung-homoeopathie/", "https://www.amazon.de/Hashimoto-ganzheitlich-behandeln-Ratgeber-Gesundheit/dp/3833861991/ref=as_li_ss_il?_encoding=UTF8&qid=1544510656&sr=8-1&linkCode=li1&tag=breitenberger-21&linkId=b167c1ae9f3ec050849060616d0ec2f8&language=de_DE", "https://www.amazon.de/Hashimoto-ganzheitlich-behandeln-Ratgeber-Gesundheit/dp/3833861991/ref=as_li_ss_il?_encoding=UTF8&qid=1544510656&sr=8-1&linkCode=li1&tag=breitenberger-21&linkId=b167c1ae9f3ec050849060616d0ec2f8&language=de_DE", "https://www.praxis-breitenberger.de/ratgeber/schilddruese/jod-schilddruese/", "https://www.praxis-breitenberger.de/ratgeber/maennergesundheit/uebergewicht/", "https://www.praxis-breitenberger.de/ratgeber/infektion/infektanfaelligkeit-ursachen-behandlung-hilfe/", "https://www.praxis-breitenberger.de/ratgeber/partnerschaft/sexuelle-probleme/", "https://www.praxis-breitenberger.de/ratgeber/frauengesundheit/unerfuellter-kinderwunsch/", "https://www.praxis-breitenberger.de/ratgeber/schilddruese/l-thyroxin/", "https://www.praxis-breitenberger.de/ratgeber/autoimmunerkrankung/morbus-basedow/", "https://www.praxis-breitenberger.de/ratgeber/autoimmunerkrankung/rheumatoide-arthritis/", "https://www.praxis-breitenberger.de/ratgeber/schilddruese/l-thyroxin/", "https://www.praxis-breitenberger.de/ratgeber/gesundheit/salutogenese/", "https://www.praxis-breitenberger.de/ratgeber/infektion/streptokokken-angina/", "https://www.praxis-breitenberger.de/ratgeber/partnerschaft/trennung/", "https://www.praxis-breitenberger.de/familienaufstellung/", "https://www.praxis-breitenberger.de/ratgeber/frauengesundheit/oestrogendominanz-progesteronmangel/", "https://www.praxis-breitenberger.de/ratgeber/frauengesundheit/pco-syndrom/", "https://www.praxis-breitenberger.de/ratgeber/magen-darm/leaky-gut-syndrom/", "https://www.praxis-breitenberger.de/ratgeber/magen-darm/darmflora-aufbauen-dysbiose-mikrobiom/", "https://www.praxis-breitenberger.de/ratgeber/schilddruese/jod-schilddruese/", "http://amzn.to/2Fi3c7T", "http://amzn.to/2oSOHMx", "https://www.praxis-breitenberger.de/ratgeber/schilddruese/vitamin-d/", "https://www.praxis-breitenberger.de/ratgeber/infektion/infektanfaelligkeit-ursachen-behandlung-hilfe/", "https://www.praxis-breitenberger.de/ratgeber/psyche/normale-depression/", "https://www.praxis-breitenberger.de/ratgeber/schilddruese/schilddruesenwerte-schwangerschaft/", "https://www.praxis-breitenberger.de/ratgeber/schilddruese/l-thyroxin/", "https://www.praxis-breitenberger.de/ratgeber/schilddruese/jod-schilddruese/", "https://www.praxis-breitenberger.de/ratgeber/frauengesundheit/unerfuellter-kinderwunsch/", "https://www.praxis-breitenberger.de/ratgeber/herz-kreislauf/hypercholesterinaemie/", "https://blog.endokrinologie.net/revolution-in-der-schilddruesendiagnostik-4521/", "https://www.praxis-breitenberger.de/ratgeber/schilddruese/schilddruesenwerte-schwangerschaft/", "https://amzn.to/39jRwPJ", "https://www.praxis-breitenberger.de/ratgeber/autoimmunerkrankung/morbus-basedow/", "https://www.medivere.de/shop/Frau/Mikronaehrstoffe-Vitalstoffmangel/Vitamin-B12-Urintest.html?af=100287", "https://www.medivere.de/shop/Frau/Mikronaehrstoffe-Vitalstoffmangel/Vitamin-D-Test.html?af=100287", "https://www.praxis-breitenberger.de/ratgeber/schilddruese/l-thyroxin/", "https://www.praxis-breitenberger.de/ratgeber/schilddruese/l-thyroxin/", "https://www.praxis-breitenberger.de/ratgeber/stress/nebennierenschwaeche/", "https://www.praxis-breitenberger.de/ratgeber/stress/nebennierenschwaeche/", "https://www.medivere.de/shop/Frau/Hormonstoffwechsel/Stressprofil.html?af=100287", "https://www.medivere.de/shop/Frau/Darmgesundheit/Gesundheitscheck-Darm.html?af=100287", "https://www.praxis-breitenberger.de/ratgeber/magen-darm/darmflora-aufbauen-dysbiose-mikrobiom/", "https://www.medivere.de/shop/Frau/Darmgesundheit/Gesundheitscheck-Darm-plus.html?af=100287", "https://www.praxis-breitenberger.de/ratgeber/magen-darm/reizdarmsyndrom/", "https://www.praxis-breitenberger.de/ratgeber/allergien/allergien-homoepathie/", "https://amzn.to/3wEBOb6", "https://www.medivere.de/shop/Frau/Gewicht/Jodid-Urintest.html?af=100287", "https://www.medivere.de/shop/Frau/Hormonstoffwechsel/Hormonprofil-Frau.html?af=100287", "https://www.medivere.de/shop/Alle/Haemopyrrolurie-HPU-Urintest.html?af=100287", "https://www.praxis-breitenberger.de/ratgeber/frauengesundheit/insulinresistenz/", "https://www.praxis-breitenberger.de/ratgeber/frauengesundheit/pco-syndrom/", "https://youtu.be/0zTefjPpaCk", "https://www.praxis-breitenberger.de/ratgeber/stress/nebennierenschwaeche/#Nebennierenschwaeche_behandeln", "https://www.praxis-breitenberger.de/ratgeber/magen-darm/leaky-gut-syndrom/", "https://www.praxis-breitenberger.de/ratgeber/frauengesundheit/oestrogendominanz-progesteronmangel/", "https://www.praxis-breitenberger.de/ratgeber/magen-darm/darmflora-aufbauen-dysbiose-mikrobiom/#Darmflora_aufbauen_und_staerken", "https://www.praxis-breitenberger.de/ratgeber/schilddruese/hashimoto-thyreoiditis/#Richtige_Ernaehrung", "https://www.praxis-breitenberger.de/homoeopathie/", "https://www.praxis-breitenberger.de/psychotherapie/", "https://www.praxis-breitenberger.de/gruppentherapie/", "https://www.biogena.com/de/at/produkte/produkt.opc-resveratrol-formula.html?afid=V22880", "https://www.biogena.com/de/at/produkte/produkt.l-tyrosin-400.html?afid=V22880", "https://www.biogena.com/de/at/produkte/produkt.selen-forte.html?afid=V22880", "https://edoc.ub.uni-muenchen.de/751/1/Gasnier_Barbara.pdf", "https://www.biogena.com/de/at/produkte/produkt.siebensalz-magnesium.html?afid=V22880", "https://www.biogena.com/de/at/produkte/produkt.vitamin-d3-tropfen-1000-ie-25-ml.html?afid=V22880", "https://www.biogena.com/de/at/produkte/produkt.moferrin-21-60-kapseln.html?afid=V22880", "http://amzn.to/2H3zsro", "https://www.biogena.com/de/at/produkte/produkt.vitamin-b12-tropfen-25-ml.html?xtxsearchselecthit=1?afid=V22880", "https://www.praxis-breitenberger.de/ratgeber/schilddruese/jod-schilddruese/#Jodueberschuss_Folgen", "https://www.praxis-breitenberger.de/ratgeber/schilddruese/jod-schilddruese/#Jodueberschuss_Folgen", "https://www.praxis-breitenberger.de/ratgeber/schilddruese/jod-schilddruese/#Jod_Tagesbedarf", "https://www.biogena.com/de-AT/produkte/phyto-jod-200.html?xtxsearchselecthit=1?afid=V22880", "http://amzn.to/2p3qAe5", "https://www.praxis-breitenberger.de/ratgeber/autoimmunerkrankung/erkrankung-homoeopathie/", "https://www.praxis-breitenberger.de/ratgeber/magen-darm/leaky-gut-syndrom/", "https://www.biogena.com/de/at/produkte/produkt.curcuma-500.html?afid=V22880", "https://www.praxis-breitenberger.de/ratgeber/herz-kreislauf/bluthochdruck/#Bluthochdruck_senken", "https://amzn.to/2LqMnJO", "https://amzn.to/2uxeXjh", "https://amzn.to/2L7h4Vf", "https://www.biogena.com/de/at/produkte/produkt.omega-3-duo.html?afid=V22880", "https://www.praxis-breitenberger.de/ratgeber/frauengesundheit/insulinresistenz/", "https://www.praxis-breitenberger.de/ratgeber/magen-darm/darmflora-aufbauen-dysbiose-mikrobiom/", "https://www.amazon.de/gp/product/3432103360/ref=as_li_tl?ie=UTF8&camp=1638&creative=6742&creativeASIN=3432103360&linkCode=as2&tag=breitenberger-21&linkId=dc61e4daa68e14d6b742c13177f639ab", "https://www.praxis-breitenberger.de/ratgeber/magen-darm/leaky-gut-syndrom/#Symptome", "https://www.praxis-breitenberger.de/ratgeber/schilddruese/l-thyroxin/", "https://www.praxis-breitenberger.de/ratgeber/schilddruese/l-thyroxin/#Alternativen", "https://www.praxis-breitenberger.de/ratgeber/schilddruese/l-thyroxin/#Natuerliche_Hormontherapie", "https://www.praxis-breitenberger.de/ratgeber/herz-kreislauf/hypercholesterinaemie/", "https://www.praxis-breitenberger.de/ratgeber/herz-kreislauf/metabolisches-syndrom/#Behandlung", "https://www.praxis-breitenberger.de/ratgeber/frauengesundheit/unerfuellter-kinderwunsch/", "https://www.praxis-breitenberger.de/ratgeber/schilddruese/schilddruesenwerte-schwangerschaft/", "https://www.praxis-breitenberger.de/ratgeber/schilddruese/jod-schilddruese/", "https://www.praxis-breitenberger.de/ratgeber/schilddruese/vitamin-d/", "https://www.praxis-breitenberger.de/ratgeber/schilddruese/l-thyroxin/", "https://www.praxis-breitenberger.de/ratgeber/schilddruese/schilddruesenwerte-schwangerschaft/", "https://www.praxis-breitenberger.de/online-terminbuchung/", "https://www.praxis-breitenberger.de/zur-person/", "https://www.praxis-breitenberger.de/redaktionsteam-dr-schaenzler/", "https://www.gu.de/produkte/koerper-geist-seele/beschwerden-und-erkrankungen/autoimmunerkrankungen-in-den-griff-bekommen-schaenzler-2019/", "https://www.buecher.de/shop/fachbuecher/hashimoto-ganzheitlich-behandeln/schaenzler-nicole-breitenberger-markus/products_products/detail/prod_id/49699066/", "https://gesund.bund.de/schilddruesenunterfunktion", "https://www.wissenschaftliche-verlagsgesellschaft.de/bereiche/ernaehrung/view/titel/55048.html", "https://pubmed.ncbi.nlm.nih.gov/23046013/", "https://pubmed.ncbi.nlm.nih.gov/11932302/", "https://www.wissenschaftliche-verlagsgesellschaft.de/titel/58112.html", "https://academic.oup.com/jcem/article/100/10/3718/2835789", "https://www.spektrum.de/news/autoimmunerkrankung-hashimoto-thyreoiditis-noch-nicht-genug-erforscht/1682326", "https://www.aerztezeitung.at/archiv/oeaez-2018/oeaez-4-25022018/hashimoto-thyreoiditis-laborkosmetik-vermeiden.html", "https://www.herold-innere-medizin.de/index.htm?information.htm&0", "https://www.amboss.com/de/aerztinnen-aerzte", "https://www.lehmanns.de/shop/medizin-pharmazie/51385047-9783990522165-mikronaehrstoff-coach", "https://www.facebook.com/sharer.php?u=https://www.praxis-breitenberger.de/ratgeber/schilddruese/hashimoto-thyreoiditis/", "https://www.linkedin.com/shareArticle?mini=true&url=https://www.praxis-breitenberger.de/ratgeber/schilddruese/hashimoto-thyreoiditis/", "https://twitter.com/intent/tweet?url=https://www.praxis-breitenberger.de/ratgeber/schilddruese/hashimoto-thyreoiditis/&text=Hashimoto-Thyreoiditis+mit+Hom%C3%B6opathie+behandeln%3A+Ern%C3%A4hrung%2C+Symptome+%26+Therapie", "https://www.xing.com/social_plugins/share/new?url=https://www.praxis-breitenberger.de/ratgeber/schilddruese/hashimoto-thyreoiditis/", "https://wa.me/?text=https://www.praxis-breitenberger.de/ratgeber/schilddruese/hashimoto-thyreoiditis/", "mailto:?subject=Hashimoto-Thyreoiditis mit Hom\u00f6opathie behandeln: Ern\u00e4hrung, Symptome & Therapie&body=https://www.praxis-breitenberger.de/ratgeber/schilddruese/hashimoto-thyreoiditis/", "https://www.praxis-breitenberger.de/ratgeber/autoimmunerkrankung/", "https://www.praxis-breitenberger.de/ratgeber/frauengesundheit/", "https://www.praxis-breitenberger.de/ratgeber/schilddruese/", "https://www.praxis-breitenberger.de/qualitaetsrichtlinien/", "https://www.praxis-breitenberger.de", "https://www.praxis-breitenberger.de/ratgeber/", "https://www.praxis-breitenberger.de/ratgeber/autoimmunerkrankung/", "tel:00498920244844", "mailto:info@praxis-breitenberger.de", "https://www.praxis-breitenberger.de/behandlungskosten/", "https://www.praxis-breitenberger.de/faq/", "https://www.praxis-breitenberger.de/ratgeber/", "https://www.praxis-breitenberger.de/datenschutz/", "https://www.praxis-breitenberger.de/impressum/", "https://www.praxis-breitenberger.de/homoeopathie/", "https://www.praxis-breitenberger.de/psychotherapie/", "https://www.praxis-breitenberger.de/paarberatung/", "#", "https://www.praxis-breitenberger.de/", "#", "https://www.praxis-breitenberger.de/homoeopathie-muenchen/", "https://www.praxis-breitenberger.de/psychotherapie-muenchen/", "https://www.praxis-breitenberger.de/paarberatung-muenchen/", "https://www.praxis-breitenberger.de/ratgeber-uebersicht/", "https://www.praxis-breitenberger.de/zur-person/", "https://www.praxis-breitenberger.de/terminvereinbarung/"]}