{"title": "Markelstr. 61, 12163 Berlin", "author": null, "url": "https://www.hausarztpraxis-steglitz.de/", "hostname": "hausarztpraxis-steglitz.de", "description": "Hausarztpraxis Steglitz", "sitename": "hausarztpraxis-steglitz.de", "date": "2023-03-01", "id": null, "license": null, "body": null, "comments": "", "commentsbody": null, "raw_text": null, "text": "Herzlich Willkommen,die Hausarztpraxis Steglitz bietet Ihnen umfassende haus\u00e4rztliche Versorgung und ein breites allgemeinmedizinisches Diagnostik- und Therapiespektrum aus einer Hand. Wir verstehen die haus\u00e4rztliche Medizin als eine auf den einzelnen Menschen und sein Umfeld bezogene, dauerhaft angelegte Arzt-Patienten-Beziehung. Wir sch\u00e4tzen und achten das uns entgegengebrachte Vertrauen und m\u00f6chten Ihnen als Hausarztpraxis partnerschaftlich zur Seite stehen.\nDurch unsere universit\u00e4re Anbindung an die Charit\u00e9-Universit\u00e4tsmedizin Berlin und die Ausbildung von Medizinstudierenden verbinden wir die t\u00e4gliche Versorgung unserer Patienten mit den aktuellen wissenschaftlichen Standards der Medizin. Sie k\u00f6nnen neben der hochqualifizierten allgemeinmedizinischen Versorgung auch unser durch Zusatzqualifikationen erweitertes Behandlungsspektrum in der Sportmedizin, der Ern\u00e4hrungsmedizin und im Bereich der Naturheilverfahren erwarten.\nAktuelles:\nImpfung gegen COVID-19 mit angepasstem Impfstoff und Impfung gegen saisonale GrippeLiebe Patient*innen, wie gewohnt k\u00f6nnen Sie sich auch dieses Jahr vor Beginn der Infektsaison entsprechend der\n[Empfehlungen der STIKO](https://www.rki.de/SharedDocs/FAQ/COVID-Impfen/FAQ_Liste_STIKO_Empfehlungen.html)bei uns pr\u00e4ventiv impfen lassen. Beachten Sie dabei bitte, dass die STIKO einen Mindestabstand von mindestens 12 Monaten zwischen der Auffrischimpfung und letztem immunologischen Ereignis (Impfung gegen COVID-19 oder Infekt mit Coronavirus) empfiehlt. Die Impfkampagne gegen die saisonale Grippe sowie gegen COVID-19 beginnen wir ab dem 16.10.2023 Montag bis Freitag 9-11 Uhr ohne Voranmeldung bzw. im Rahmen der Terminsprechstunde. Aus Kapazit\u00e4tsgr\u00fcnden kann es notwendig werden, die Anzahl der t\u00e4glichen Impfungen zu begrenzen und auf einen anderen Tag zu verweisen. F\u00fcr diesen Fall bitten wir um Ihr Verst\u00e4ndnis.\nOffene Sprechstunde nun auch mit Termin m\u00f6glichNeben und zus\u00e4tzlich zu unserer offenen Sprechstunde k\u00f6nnen Sie ab 19.06.23 bei akuten Anliegen auch einen Termin f\u00fcr die offene Sprechstunde buchen (Achtung: F\u00fcr alle anderen Anliegen bitte weiterhin einen Termin in unseren regul\u00e4ren Terminsprechstunden buchen. Hier geht es explizit nur um akute Anliegen!). Damit soll k\u00fcnftig die Wartezeit in der offenen Sprechstunde durch bessere Planbarkeit verk\u00fcrzt werden. Sie werden hierf\u00fcr auf die Seite der Terminservicestelle der Kassen\u00e4rztlichen Bundesvereinigung (KBV) weitergeleitet. Im n\u00e4chsten Absatz wird Ihnen das Vorgehen f\u00fcr die Terminbuchung Schritt f\u00fcr Schritt erkl\u00e4rt:\nGehen Sie auf den unten stehenden Link zur Terminservicestelle: W\u00e4hlen Sie dort \"Nein\" bei der Frage nach einem Vermittlungscode. W\u00e4hlen Sie nun die Fachgruppe \"Hausarzt\" und geben unsere Postleitzahl 12163 sowie Ihre email-Adresse ein. Nach Eingabe der per email erhaltenen PIN sehen Sie alle verf\u00fcgbaren Termine. Aus organisatorischen Gr\u00fcnden kann die/der tats\u00e4chliche Behandler/in von der/dem gebuchten Behandler/in abweichen. Wir bitten zudem darum, f\u00fcr Infekte weiterhin unsere separate Infektsprechstunde zu nutzen.\n[Terminbuchung \u00fcber Terminservice der KBV: hier anklicken](https://eterminservice.de/terminservice)\nMFA in Voll- oder Teilzeit gesuchtWir suchen ab sofort zur Verst\u00e4rkung unseres Teams eine/n MFA in Voll- oder Teilzeit. Es erwartet Sie ein freundliches, engagiertes Team. Wir freuen uns \u00fcber Ihre Bewerbung unter info@hausarztpraxis-steglitz.de !\nVorgehen bei positivem Corona-Schnelltest und AtemwegsinfektenAm 01.04.2023 sind die Corona-Sonderregelungen zur telefonischen Krankschreibung ausgelaufen. Eine telefonische Krankschreibung ist aktuell nur noch m\u00f6glich, wenn die Pflicht bzw. Empfehlung zur Absonderung im Krankheitsfall wie bspw. bei einer Corona-Infektion besteht. Patienten mit anderen Atemwegsinfekten m\u00fcssen sich ab dem 01.04.2023 f\u00fcr eine Krankschreibung pers\u00f6nlich in unserer Sprechstunde vorstellen.\nSollten Sie einen positiven Schnelltest auf SARS-CoV-2 haben und eine Arbeitsunf\u00e4higkeitsbescheinigung (AU) ohne pers\u00f6nlichen Arztkontakt ben\u00f6tigen, bitten wir um Kontaktaufnahme per Email an info@hausarztpraxis-steglitz.de (Kontaktdaten hinterlassen!). Die M\u00f6glichkeit der telefonischen AU richtet sich nur an Bestandspatienten!\nPatienten, die bez\u00fcglich ihres Infektes (egal ob Corona oder anderer grippaler Infekt) pers\u00f6nlich vom Arzt gesehen werden wollen, haben Montag bis Freitag 8:00 bis 11:30 Uhr die M\u00f6glichkeit \u00fcber unserer terminlose Infektsprechstunde gesehen zu werden. Hier k\u00f6nnen sich auch Patienten vorstellen, die bisher nicht in der Praxis bekannt sind. Die Anmeldung erfolgt \u00fcber den Hauptempfang. Sollten Sie Zeichen eines Atemwegsinfektes haben tragen Sie beim Betreten der Praxis sowie in der Infektsprechstunde bitte eine FFP-2-Maske!\nAmbulante Polygraphie - SchlafdiagnostikAb sofort k\u00f6nnen wir bei bestehendem Verdacht auf eine schlafbezogene Atemst\u00f6rung (SBAS) eine ambulante Schlafdiagnostik mittels portablem Messsystem durchf\u00fchren. Wir freuen uns, unsere diagnostischen M\u00f6glichkeiten um diese Methode erweitern zu k\u00f6nnen. Die Symptome einer SBAS dr\u00fccken sich h\u00e4ufig durch n\u00e4chtliches Schnarchen mit Atemaussetzern sowie Tagesm\u00fcdigkeit/-schl\u00e4frigkeit aus. Weitere m\u00f6gliche Symptome sind Abgeschlagenheit, Leistungsknick, Wesens\u00e4nderung, intellektueller Leistungsverfall, unruhiger Schlaf, Durchschlafst\u00f6rungen| morgendliche Abgeschlagenheit, diffuse, dumpfe Kopfschmerzen, Mundtrockenheit, vermehrter Harndrang, Libidost\u00f6rungen, Potenzst\u00f6rungen. Sprechen Sie uns gerne an, wenn Sie das Vorliegen einer SBAS f\u00fcr sich in Betracht ziehen.\nEine gute \u00dcbersicht mit Hintergrund- und Therapieinformationen bietet Ihnen das kostenfrei zum Download bereitgestellte\n[Nachschlagewerk \"Schlafapnoe\"](https://www.schlafapnoe-selbsthilfegruppe.de/download-patientenbrosch%C3%BCre/).\nReiseimpfberatungNutzen Sie rechtzeitig vor Ihrem Urlaub die M\u00f6glichkeit sich bei uns umf\u00e4nglich reisemedizinisch beraten zu lassen. Hier stellen wir fest, welche Impfungen vor Antritt der Reise erforderlich sind und geben Ihnen weiterf\u00fchrende Hinweise, damit Sie eine unbeschwerte Reise erleben und gesund wieder zur\u00fcckkehren k\u00f6nnen. Schreiben Sie uns gerne vorab eine Mail an info@hausarztpraxis-steglitz.de, in der Sie Ihr(e) Reiseziel(e), die Reisedauer, den Reisemodus (bspw. Hotelreise/Rucksackreise unter einfachen Bedingungen o.\u00e4.) und den Reisebeginn angeben. Bis auf Gelbfieber sind alle g\u00e4ngigen Reiseimpfungen bei uns impfbar.\n\u00d6FFNUNGSZEITEN / ANFAHRT\nSie finden uns in derMarkelstr. 61, 12163 Berlin (Steglitz)\nTelefon\n[(030) 79 111 00](tel:+49307911100)\nFax\n[(030) 79 337 58](fax:+49307933758)\nEmail: info@hausarztpraxis-steglitz.de\nDirekt zur\n[Online-Terminbuchung](https://www.doctolib.de/praxis/berlin/hausarztpraxis-steglitz)\nDirekt zum\n[Rezepttelefon](#rezepttelefon)\nUnsere \u00d6ffungszeitenAllgemeine \u00d6ffnungszeiten\n(Zeiten der offenen Sprechstunden ohne Termin sowie Notfallsprechstunden s. u.)\nMontag 8:00 bis 12:00 und 15:00 bis 19:00Uhr\nDienstag 8:00 bis 12:00 und 15:00 bis 19:00Uhr\nMittwoch 8:00 bis 12:00\nDonnerstag 8:00 bis 12:00 und 15:00 bis 19:00Uhr\nFreitag 8:00 bis 12:00\nSamstag Notfallsprechstunde\nOffene Sprechstunde ohne Termin\n(Letzte Annahme 30 Minuten vor Ende der Sprechstunde! Bei zu hohem Patientenaufkommen behalten wir uns vor, die Annahme f\u00fcr die morgendliche Akutsprechstunde bereits um 10:30 Uhr zu beenden. Bitte weichen Sie in diesem Fall auf die nachfolgenden offenen Sprechstunden aus. )\nMo-Fr 8.00 bis 11.30 Uhr\nMo, Di, Do: 15.00-16.30 Uhr\nNotfallsprechstunde\nSamstag 10:00 bis 11:30 Uhr\nVideosprechstunde\nDirekt \u00fcber unser\n[Buchungsportal](https://www.doctolib.de/praxis/berlin/hausarztpraxis-steglitz)verf\u00fcgbar. Sie ben\u00f6tigen einen Computer mit Internetnanschluss, Kamera, Mikrofon und Kopfh\u00f6rer oder ein Smartphone.\nBlutentnahmen\nfinden Montag bis Donnerstag ohne Voranmeldung in der Zeit von 8:00 bis 9:30 Uhr statt.\nunsere digitale Visitenkarte\nfinden Sie\n[hier zum Download](https://www.hausarztpraxis-steglitz.de/wp-content/uploads/2020/10/Hausarztpraxis-Steglitz.vcf). So k\u00f6nnen Sie komfortabel unsere Kontaktdaten in Ihrem digitalen Adressbuch speichern.\nunseren Anamnese-Fragebogen\ngibt es hier\n[zum herunterladen](https://www.hausarztpraxis-steglitz.de/wp-content/uploads/2021/01/Anamnesebogen.pdf). Dies ist unser Fragebogen f\u00fcr Menschen, die zum ersten Mal zu uns kommen (oder lange nicht bei uns waren). Wir freuen uns, wenn uns dieser Bogen ausgef\u00fcllt zum ersten Besuch mitgebracht wird. Falls nicht, haben wir aber auch welche vor Ort!\nSo kommen Sie zu unsU9 bis Bahnhof Walther-Schreiber-Platz oder Schlo\u00dfstra\u00dfe, 250 m Fu\u00dfweg\nBus 186, M48 oder M85 bis Haltestelle Walther-Schreiber-Platz oder Schlo\u00dfstra\u00dfe, 250 m Fu\u00dfweg\nBus 282 bis Haltestelle Schlo\u00dfstra\u00dfe, 250 m Fu\u00dfweg\nS1 bis Bahnhof Feuerbachstra\u00dfe, 500 m Fu\u00dfweg\nParkm\u00f6glichkeiten finden Sie in den umliegenden Parkh\u00e4usern. Die n\u00e4chstgelegenen Parkh\u00e4user finden Sie in der Bornstr. 4 (Forum Steglitz) und der Treitschkestr. 7 (Boulevard Berlin). Daneben befindet sich im Umfeld der Hausarztpraxis Steglitz das Parkhaus des Schloss Stra\u00dfen Center am Walther-Schreiber-Platz 1 und das Parkhaus Schlo\u00dfstra\u00dfe-D\u00fcppelstra\u00dfe in der Schlo\u00dfstr. 110\nUNSER TEAM\nDr. med. Bernhard EtmerFacharzt f\u00fcr Allgemeinmedizin, Naturheilverfahren, Praxisteilhaber\nHerr Dr. Etmer versorgt seit mehr als zehn Jahren die Patienten des Markelstra\u00dfen-Kiezes. Engagiert steht er Ihnen bei allen medizinischen Sorgen und N\u00f6ten zur Seite. Der Mensch steht f\u00fcr ihn, gerade in Zeiten des rasanten medizinischen Fortschritts, stets im Mittelpunkt. Im Rahmen seiner Zusatzqualifikation greift Herr Dr. Etmer auch auf Behandlungsm\u00f6glichkeiten der Naturheilkunde zur\u00fcck. Er ist Lehrarzt im Fachbereich Allgemeinmedizin der Charit\u00e9-Universit\u00e4tsmedizin Berlin.\nDr. med. Veronika RuferFach\u00e4rztin f\u00fcr Allgemeinmedizin, Rettungsmedizin, Sportmedizin, Ern\u00e4hrungsmedizin DGEM\u00ae, Praxisteilhaberin\nDie Schwerpunkte von Fr. Dr. Rufer liegen neben der allgemeinmedizinischen Versorgung vor allem in der Diagnostik und Therapie der Erkrankungen des Herz-Kreislauf-Systems. Ihre Zusatzqualifikationen im Bereich der Sportmedizin mit Eignungsuntersuchung und individueller Trainingsplanerstellung, sowie der Ern\u00e4hrungsmedizin, runden ihr Profil ab. Neben ihrer Praxist\u00e4tigkeit engagiert sich Frau Dr. Rufer als Dozentin und Lehr\u00e4rztin der Charit\u00e9-Universit\u00e4tsmedizin in der Ausbildung von \u00e4rztlichen, sportwissenschaftlichen und ern\u00e4hrungstherapeutisch t\u00e4tigen Kollegen.\nDr. med. Maren HoldorffFach\u00e4rztin f\u00fcr Allgemeinmedizin, Sportmedizin, Praxisteilhaberin\nFrau Dr. Holdorff ist seit mehreren Jahren in der haus\u00e4rztlichen Patientenversorgung t\u00e4tig. Neben der allgemeinmedizinischen Behandlung liegen ihre Schwerpunkte in der Ultraschalluntersuchung des Bauches und der Schilddr\u00fcse, sowie der Funktionsdiagnostik von Herz-Kreislauf-Erkrankungen. Daneben ist sie auch als Sportmedizinerin in der Hausarztpraxis Steglitz t\u00e4tig. Sie ist Lehr\u00e4rztin im Fachbereich Allgemeinmedizin der Charit\u00e9-Universit\u00e4tsmedizin Berlin\nDr. med. Friedel B\u00fcterFacharzt f\u00fcr Allgemeinmedizin, Praxisteilhaber\nHerr Dr. B\u00fcter ist vielen Patienten schon aus seiner zweij\u00e4hrigen Weiterbildungszeit bis September 2017 in unserer Praxis bekannt. Nach einer weiteren Station in der Kinder- und Jugendmedizin hat er im Mai 2018 erfolgreich die Pr\u00fcfung zum Facharzt f\u00fcr Allgemeinmedizin absolviert. Im Laufe seiner Weiterbildung hat Herr B\u00fcter neben der Station in unserer Praxis drei Jahre in der Inneren Medizin mit den Schwerpunkten Kardiologie und Gastroenterologie sowie in der Chirurgie und Orthop\u00e4die gearbeitet. Nachdem Herr B\u00fcter vom Sommer 2018 bis Winter 2020 engagiert in Vertretung in unserer Praxis gearbeitet hat, freuen wir uns, dass er seit April 2020 als weiterer Partner in unser Praxisteam eingestiegen ist.\nDr. med. Lars UhlmannFacharzt f\u00fcr Allgemeinmedizin, Praxisteilhaber\nHerr Dr. Uhlmann sieht sich als echten \"Allrounder\" und Hausarzt im klassischen Sinne, der die ganze Familie betreut und dabei den Menschen als Ganzes in seinem pers\u00f6nlichen Umfeld betrachtet. Im Rahmen seiner Facharztausbildung konnte Herr Uhlmann auf seinen beruflichen Stationen in der Orthop\u00e4die, Inneren Medizin, Altersmedizin, Chirurgie, Allgemeinmedizin und Kinderheilkunde ein umfassendes allgemeinmedizinisches Wissen erwerben. Nach Erlangung des Facharztes f\u00fcr Allgemeinmedizin hat Herr Uhlmann als angestellter Hausarzt gearbeitet. Ab April 2022 ist er als weiterer Praxispartner der Hausarztpraxis Steglitz dauerhaft f\u00fcr die Versorgung seiner Patienten da. Damit kehrt er an den Ort zur\u00fcck, an dem er seinen allgemeinmedizinischen Weiterbildungsabschnitt absolvierte.\nDr. Anna IsringhausenFrau Dr. Isringhausen ist seit dem 01.03.2023 Teil unseres Teams. Sie befindet sich in der Weiterbildung zur Allgemeinmedizinerin. Ihre bisherigen Stationen f\u00fchrten sie vor allem in die Innere Medizin, wo sie in verschiedenen Krankenh\u00e4usern umf\u00e4ngliche Erfahrungen sammeln konnte. Ihre letzte Station absolvierte Frau Isringhausen in einer allgemeinmedizinischen Praxis. Wir freuen uns, dass uns Frau Isringhausen k\u00fcnftig in der Patientenversorgung unterst\u00fctzen wird.\nFranziska SchmittSeit Juni 2022 geh\u00f6rt Fr. Schmitt zu unserem Team. Nach dem Abschluss ihrer Ausbildung zur medizinischen Fachangestellten hat Frau Schmitt zun\u00e4chst vier Jahre Berufserfahrung in einer allgemeinmedizinische Praxis gesammelt. Nach Abschluss ihres Medizinstudiums war Frau Schmitt in zwei verschiedenen Krankenh\u00e4usern in der Abteilung f\u00fcr Geriatrie t\u00e4tig. Dort konnte sie reichlich klinische Erfahrung sammeln. Sie befindet sich aktuell in der Weiterbildung zur Fach\u00e4rztin f\u00fcr Allgemeinmedizin.\nPablo FiedlerHerr Fiedler ist seit Januar 2022 als Arzt in Weiterbildung zum Facharzt f\u00fcr Allgemeinmedizin ein Teil unseres Teams. Vielen Patienten d\u00fcrfte er noch aus seiner Zeit als engagierter und freundlicher PJ Student Mitte 2019 in unserer Praxis in Erinnerung sein. Nachdem Herr Fiedler nach Abschluss seines Medizinstudiums nun 1, 5 Jahre reichhaltige Erfahrungen in der station\u00e4ren Versorgung geriatrischer Patienten sammeln konnte, freuen wir uns sehr, ihn nun wieder in unserem Team als kompetenten Kollegen begr\u00fc\u00dfen zu d\u00fcrfen.\nUnsere medizinischen Fachangestellten und Praxisassistentinnen\nEine gute Behandlung in unserer Praxis ist immer eine Teamleistung\nUnser Team steht Ihnen als kompetenter und vertrauensw\u00fcrdiger Ansprechpartner zur Seite. Sowohl \u00c4rzte als auch Medizinische Fachangestellte besuchen kontinuierlich Weiterbildungskurse, damit wir Sie individuell und nach aktuellem Wissen beraten k\u00f6nnen.\nIn unserem langj\u00e4hrigen Team der Medizinischen Fachangestellten finden Sie folgende Zusatzqualifikationen:\nUnser Team steht Ihnen als kompetenter und vertrauensw\u00fcrdiger Ansprechpartner zur Seite. Sowohl \u00c4rzte als auch Medizinische Fachangestellte besuchen kontinuierlich Weiterbildungskurse, damit wir Sie individuell und nach aktuellem Wissen beraten k\u00f6nnen.\nIn unserem langj\u00e4hrigen Team der Medizinischen Fachangestellten finden Sie folgende Zusatzqualifikationen:\n- Zertifiziertes Wundmanagement\n- Von den Krankenkassen finanzierte und qualit\u00e4tsgesicherte Patienten-Schulungen (DMP) zum Thema:\n- Herz-Kreislauf-Erkrankungen (KHK)\n- Bluthochdruck\n- Diabetes mellitus, insulin- und nicht insulinpflichtig\n- Asthma bronchiale\n- Chronisch obstruktive Lungenerkrankung (COPD)\n- Zertifizierte Impfassistenz\n- Sozialassistenz\nUNSERE LEISTUNGEN\nUnser Team bietet ein breites allgemeinmedizinisches Diagnostik- und Therapiespektrum. Hier erfahren Sie mehr Details \u00fcber die Leistungen der Hausarztpraxis Steglitz. Wenn Sie noch Fragen haben, sprechen Sie mit uns!\nAllgemeinmedizinWir bieten Ihnen in unserer Praxis eine vollst\u00e4ndige haus\u00e4rztliche Betreuung.\nDiese umfasst die folgenden diagnostischen Leistungen:\nRuhe-EKG\nBelastungs-EKG\nLangzeit-Blutdruckmessung (24 Stunden)\nLangzeit-EKG (24 Stunden)\nLungenfunktionsdiagnostik\nBauch- und Schilddr\u00fcsensonographie\nSchlaf-Polygraphie\nLabordiagnostik\nVorsorgeuntersuchungenDie Hausarztpraxis Steglitz sieht einen ihrer Schwerpunkte in der Pr\u00e4vention. Folgende Vorsorgeuntersuchungen, deren Kosten f\u00fcr gesetzlich Versicherte die Krankenkassen komplett \u00fcbernehmen, werden bei uns durchgef\u00fchrt:\nCheck up 35\nAb dem 35. Lebensjahr haben Sie alle drei Jahre die M\u00f6glichkeit, sich vorsorglich \u00e4rztlich und mittels laborchemischer Analysen untersuchen zu lassen.\nHautkrebsscreening\nEbenfalls ab dem 35. Lebensjahr werden Sie von uns alle zwei Jahre genauestens auf m\u00f6gliche Hautver\u00e4nderungen untersucht und ggf. zur weiteren Therapie \u00fcberwiesen.\nBeratung zur Darmspiegelung\nSchutzimpfungen\nBringen Sie doch einfach bei Ihrem n\u00e4chsten Praxisbesuch Ihren Impfausweis mit oder lassen Sie sich einen neuen erstellen - unsere \u00c4rzte f\u00fcllen auf Ihren Wunsch hin die Impfl\u00fccken bzw. beraten Sie gern.\nErweiterte Vorsorgeleistungen\nSie k\u00f6nnen den Basis Check up auf Wunsch und nach Bedarf durch eine Vielzahl diagnostischer und therapeutischer Vorsorgeleistungen erg\u00e4nzen. Die Fr\u00fcherkennung des individuellen Risikoprofils erm\u00f6glicht eine rechtzeitige Lebensstil\u00e4nderung sowie eine optimale Therapieplanung. Bitte beachten Sie, dass diese erweiterten Vorsorgeleistungen von den Krankenkassen z.T. nicht \u00fcbernommen werden. Unsere Haus\u00e4rzte beraten Sie gern.\nVorsorgeuntersuchungen f\u00fcr Jugendliche - J1 und J2\nAuch und gerade f\u00fcr Jugendliche ist Vorsorge besonders wichtig: J1 hei\u00dft die entsprechende Untersuchung f\u00fcr Jugendliche zwischen dem 12. und 14. Lebensjahr. Einige Krankenkassen bieten auch eine J2 f\u00fcr Jugendliche zwischen 16 und 17 Jahren an. Fragen Sie bei Ihrer Kasse nach, ob sie diese Untersuchung \u00fcbernimmt. Die J1 wird von den gesetzlichen Krankenkassen vollst\u00e4ndig bezahlt. Die J1 beinhaltet einen Check der k\u00f6rperlichen und seelischen Gesundheit. Dazu werden die Gr\u00f6\u00dfe, das Gewicht, ggf. das Blut, der Harn, der Blutdruck sowie der Zustand der Organe, des Skelettsystems und der Sinnesfunktionen \u00fcberpr\u00fcft. Zudem wird der Impfstatus kontrolliert. Dar\u00fcber hinaus werden bei der Untersuchung neben famili\u00e4ren und schulischen Problemen auch Themen wie Ess-St\u00f6rungen, Drogenmissbrauch oder Verh\u00fctung angesprochen.\nBehandlung chronischer ErkrankungenIm Rahmen der Disease-Management-Programme (DMP) der Krankenkassen bieten wir Ihnen auch Schulungen in den folgenden Bereichen an:\nDiabetes mellitus Typ II, insulinpflichtig und nicht-insulinpflichtig\nAsthma bronchiale\nChronische Bronchitis (COPD)\nHypertonus f\u00fcr Patienten mit Diabetes mellitus und koronarer Herzkrankheit\nFragen Sie uns nach den n\u00e4chstm\u00f6glichen Teilnahmeterminen!\nWir freuen uns, wenn wir Ihnen neueste, wissenschaftlich gesicherte Informationen im Umgang mit Ihrer chronischen Erkrankung mit auf den Weg geben k\u00f6nnen!\nErn\u00e4hrungsmedizinWie kommt man zum Ziel?\nFach\u00e4rztliche Untersuchung, Befunderhebung, ggf. Laborkontrolle, Therapieplan (ggf. mit medikament\u00f6ser Unterst\u00fctzung)\nQualifizierte, individuelle Betreuung und Motivation \u00fcber den gesamten Behandlungszeitraum bei uns in der Praxis\nF\u00fcr Privatpatienten und Selbstzahler:Abrechnung nach der Geb\u00fchrenordnung f\u00fcr \u00c4rzte\nF\u00fcr Kassenpatienten:Die meisten Kassen \u00fcbernehmen 70-100% der Kosten der Ern\u00e4hrungsberatung!\nBeispiel 1 Zur Reduktion, aber auch zur Vermeidung von \u00dcbergewicht bzw. Fehlern\u00e4hrung: 3 Beratungstermine \u00e0 60 bzw. 30 min.\nBeispiel 2 Bei Fettleibigkeit (=Adipositas, d.h. BMI>30) und/oder Begleiterkrankungen wie Herz-Kreislauferkrankungen, Osteoporose, Nahrungsmittelallergien, Krebserkrankungen etc: 5 Beratungstermine \u00e0 60 bzw. 30 min\nSportmedizinRichtiges Training f\u00f6rdert nicht nur die Gesundheit, sondern auch das Wohlbefinden. Das hat eine Vielzahl wissenschaftlicher Studien in den letzten Jahren nachweisen k\u00f6nnen.\nDoch was bedeutet richtig?\nSollte das Training zu Ihrer pers\u00f6nlichen Lebensphilosophie, Ihrem Alltag, Ihrer k\u00f6rperlichen und seelischen Verfassung passen und Ihnen somit Freude bereiten und \"zu machen\" sein? Sollte Sport an Ihre eventuell vorhanden Gesundheitsst\u00f6rungen angepasst sein und diese m\u00f6glichst verbessern helfen? Wie erreichen Sie m\u00f6glichst effektiv Ihre ganz pers\u00f6nlichen Ziele, sei es Gewichtsreduktion, eine Steigerung der Leistungsf\u00e4higkeit, der Erhalt von Lebensqualit\u00e4t, der Schutz vor weiteren Erkrankungen oder einmal den Marathon laufen? Mit unserer sportmedizinischen Qualifikation m\u00f6chten wir Sie Ihrem \"richtigen Training\" n\u00e4herbringen und den Verlauf optimieren helfen. Vor Aufnahme einer regelm\u00e4\u00dfigen Sportart, insbesondere nach Sportpause, wenn Sie \u00e4lter als 35 Jahre alt sind oder Vorerkrankungen mitbringen, aber auch Kindern vor Eintritt in den Mannschaftssport wird eine \u00e4rztliche Untersuchung durch einen Sportmediziner empfohlen.\nTrainingsplanerstellung\nAuf Basis der klinisch-sportmedizinischen Untersuchung und der stufenweisen Belastung auf dem Fahrrad bzw. Laufband wird ein an Ihre M\u00f6glichkeiten und Erfordernisse angepasster Trainingsplan erstellt und mit Ihnen im Detail besprochen. Dieser umfasst alle wesentlichen Parameter f\u00fcr Ihr sicheres und effektives Training.\nTauchtauglichkeitsuntersuchungenZur Tauchausbildung und auch auf vielen Tauchbasen wird eine \u00e4rztliche Tauchtauglichkeitsuntersuchung gefordert. Diese darf nicht \u00e4lter als 24 Monate, ab 40 Jahren nicht \u00e4lter als 12 Monate sein. Gerne f\u00fchren wir eine qualifizierte Tauchtauglichkeitsuntersuchung nach den Leitlinien der GT\u00dcM (Gesellschaft f\u00fcr Tauch- und \u00dcberdruckmedizin) durch. Bitte vereinbaren Sie einen Termin.\nNaturheilkundeImmer mehr Menschen suchen Erg\u00e4nzungen zur klassischen Schulmedizin und besinnen sich auf Heilmethoden, die sich bereits in fr\u00fcheren Jahrhunderten bew\u00e4hrt haben. Oder aber es handelt sich um Methoden die ganzheitlich orientierte Therapeuten und Wissenschaftler erst in neuerer Zeit entwickelt haben. Dabei k\u00f6nnen die naturheilkundlichen Anwendungen aus heimischen Gefilden oder anderen Kulturkreisen kommen.\nViele dieser Verfahren beruhen auf langj\u00e4hrigen Erfahrungen und unterliegen wissenschaftlichen Pr\u00fcfungen. So finden sie zunehmend Eingang in die t\u00e4gliche \u00e4rztliche Praxis.\nDie Gemeinschaftspraxis bietet interessierten Patienten die erg\u00e4nzende Behandlung mit naturheilkundlichen Medikamenten und anderen Naturheilverfahren an. Bitte fragen Sie uns, welche M\u00f6glichkeiten wir anbieten.\nRezepttelefon\nUm Wartezeiten zu vermeiden, k\u00f6nnen Sie Rezepte im Voraus bestellen. Dazu hinterlassen Sie einfach eine Nachricht auf unserem Rezeptanrufbeantworter:\nTelefonnummer f\u00fcr Rezeptbestellung:\nWir bitten um zwei volle Werktage Bearbeitungszeit. (Rezepte, die am Freitag bestellt werden, k\u00f6nnen ab Dienstagnachmittag abgeholt werden).\nBitte bringen Sie zur Abholung Ihre Versichertenkarte Mit!\n\u00dcber das Rezepttelefon sind nur die durch uns verordneten Dauermedikamente verf\u00fcgbar, alle anderen Rezeptw\u00fcnsche m\u00fcssen zun\u00e4chst in der Sprechstunde besprochen werden. F\u00fcr Medikamente, die Sie von uns bisher nicht bekommen haben, kommen Sie bitte in die Sprechstunde.\nDie Daten, die Sie uns am Telefon mitteilen, werden von uns gespeichert und f\u00fcr Ihren Behandlungsvertrag verarbeitet. Informationen dazu entnehmen Sie bitte dem Aushang am Empfang oder\nTelefonnummer f\u00fcr Rezeptbestellung:\n[030 - 79 111 00](tel:+49307911100), dann w\u00e4hlen Sie Option \"2\".\nWir bitten um zwei volle Werktage Bearbeitungszeit. (Rezepte, die am Freitag bestellt werden, k\u00f6nnen ab Dienstagnachmittag abgeholt werden).\nBitte bringen Sie zur Abholung Ihre Versichertenkarte Mit!\n\u00dcber das Rezepttelefon sind nur die durch uns verordneten Dauermedikamente verf\u00fcgbar, alle anderen Rezeptw\u00fcnsche m\u00fcssen zun\u00e4chst in der Sprechstunde besprochen werden. F\u00fcr Medikamente, die Sie von uns bisher nicht bekommen haben, kommen Sie bitte in die Sprechstunde.\nDie Daten, die Sie uns am Telefon mitteilen, werden von uns gespeichert und f\u00fcr Ihren Behandlungsvertrag verarbeitet. Informationen dazu entnehmen Sie bitte dem Aushang am Empfang oder\n[unserer Datenschutzerkl\u00e4rung](http://www.hausarztpraxis-steglitz.de/datenschutzerklaerung).\nHausarztpraxis Steglitz in English\nWelcome, we're happy you are here!\nHausarztpraxis Steglitz is a GP-surgery based in Berlin, Germany. We offer the full range of GP (general practitioner, family medicine) services for people of all ages, apart from the very young. Our on-site services include vaccinations, check-ups, sonography (ultrasound-scanning), and ECG (resting, stress, holter). Due to additional specialisations in our team, we are also able to offer appointments for naturopathy, sports medicine, dietary medicine and skin cancer screening.\nWe offer daily open surgeries, called \"offene Sprechstunde\" and \"Notfallsprechstunde\" (see the times above at\nPlanned appointments may be\nDuring the Coronavirus-Pandemic we offer consultations for people with viral symptoms. These consultations are held in a separate office in the cellar. Please register in advance at the reception desk. Make sure to wear an FFP2-mask while visiting our office.\nThe team at Hausarztpraxis Steglitz understands family medicine as a long-term, trusting relationship, guided by up-to-date knowledge but focussed on individual needs. We want to be you partners and guides in all health topics.\nYou will benefit from our close working relationship with the renowned Charit\u00e9-Universit\u00e4tsmedizin Berlin: We offer clinical placements to final-year medical students and take pride in knowing some of our doctors are visiting professors. This allows for everyday connection of academic science and practice.\nHausarztpraxis Steglitz is a GP-surgery based in Berlin, Germany. We offer the full range of GP (general practitioner, family medicine) services for people of all ages, apart from the very young. Our on-site services include vaccinations, check-ups, sonography (ultrasound-scanning), and ECG (resting, stress, holter). Due to additional specialisations in our team, we are also able to offer appointments for naturopathy, sports medicine, dietary medicine and skin cancer screening.\nWe offer daily open surgeries, called \"offene Sprechstunde\" and \"Notfallsprechstunde\" (see the times above at\n[\u00d6ffnungszeiten](#anfahrt)).\nPlanned appointments may be\n[booked online](https://www.doctolib.de/praxis/berlin/hausarztpraxis-steglitz)or over the phone. Video consultations are also available.\nDuring the Coronavirus-Pandemic we offer consultations for people with viral symptoms. These consultations are held in a separate office in the cellar. Please register in advance at the reception desk. Make sure to wear an FFP2-mask while visiting our office.\nThe team at Hausarztpraxis Steglitz understands family medicine as a long-term, trusting relationship, guided by up-to-date knowledge but focussed on individual needs. We want to be you partners and guides in all health topics.\nYou will benefit from our close working relationship with the renowned Charit\u00e9-Universit\u00e4tsmedizin Berlin: We offer clinical placements to final-year medical students and take pride in knowing some of our doctors are visiting professors. This allows for everyday connection of academic science and practice.", "language": null, "image": null, "pagetype": null, "links": ["https://www.hausarztpraxis-steglitz.de", "#anfahrt", "#team", "#team", "#leistungen", "#rezepttelefon", "https://www.doctolib.de/praxis/berlin/hausarztpraxis-steglitz", "#english", "#", "#", "https://www.doctolib.de/praxis/berlin/hausarztpraxis-steglitz?utm_source=google-maps&utm_campaign=google-maps", "https://www.rki.de/SharedDocs/FAQ/COVID-Impfen/FAQ_Liste_STIKO_Empfehlungen.html", "https://eterminservice.de/terminservice", "https://www.schlafapnoe-selbsthilfegruppe.de/download-patientenbrosch%C3%BCre/", "tel:+49307911100", "fax:+49307933758", "https://www.doctolib.de/praxis/berlin/hausarztpraxis-steglitz", "#rezepttelefon", "https://www.doctolib.de/praxis/berlin/hausarztpraxis-steglitz", "https://www.hausarztpraxis-steglitz.de/wp-content/uploads/2020/10/Hausarztpraxis-Steglitz.vcf", "https://www.hausarztpraxis-steglitz.de/wp-content/uploads/2021/01/Anamnesebogen.pdf", "tel:+49307911100", "http://www.hausarztpraxis-steglitz.de/datenschutzerklaerung", "#anfahrt", "https://www.doctolib.de/praxis/berlin/hausarztpraxis-steglitz", "https://www.hausarztpraxis-steglitz.de/impressum", "https://www.hausarztpraxis-steglitz.de/datenschutzerklaerung"]}