{"title": "Alternativ- oder Schulmedizin?", "author": "Dr med Christian Gersch", "url": "https://www.drgersch.de/patienteninformationen/alternativmedizin-oder-schulmedizin", "hostname": "drgersch.de", "description": "Artikel von Dr. Gersch, einem niedergelassenen Arzt aus Kaiserslautern: \u00bbEs gibt eine recht deutliche Studie der Amerikanischen Yale-Universit\u00e4t. Hier geht es um 280 Patientinnen und Patienten (mittleres Alter 62 Jahre) mit noch nicht metastasierten Krebsarten der Brust, der Prostata, der Lunge und des Darms. Alle diese Patienten hatten auf jede konventionelle Therapie ihrer prinzipiell noch heilbaren Tumoren verzichtet und sich ausschlie\u00dflich alternativmedizinisch behandeln lassen. Die \u00c4rzte um Skyler Johnson von der Yale School of Medicine in New Haven, Connecticut dann verglichen das Schicksal dieser 280 Menschen mit dem von 560 anderen Patienten, die vergleichbare Krebserkrankungen in vergleichbaren Stadien hatten, sich aber nach dem schulmedizinischen Standard behandeln lie\u00dfen. Die F\u00fcnf-Jahres-\u00dcberlebensrate ist ein \u00fcblicher Messwert f\u00fcr den Erfolg einer Krebstherapie. In dieser Studie lag die F\u00fcnf-Jahres-\u00dcberlebensrate unter alternativmedizinischer Krebsbehandlung mit 54,7 % deutlich niedriger als nach konventioneller Therapie mit 78,3 %. (...) \u00ab", "sitename": "Patienteninformation", "date": "2019-03-27", "id": null, "license": null, "body": null, "comments": "", "commentsbody": null, "raw_text": null, "text": "Es gibt eine recht deutliche Studie der Amerikanischen Yale-Universit\u00e4t. Hier geht es um 280 Patientinnen und Patienten (mittleres Alter 62 Jahre) mit noch nicht metastasierten Krebsarten der Brust, der Prostata, der Lunge und des Darms. Alle diese Patienten hatten auf jede konventionelle Therapie ihrer prinzipiell noch heilbaren Tumoren verzichtet und sich ausschlie\u00dflich alternativmedizinisch behandeln lassen. Die \u00c4rzte um Skyler Johnson von der Yale School of Medicine in New Haven, Connecticut dann\n[verglichen das Schicksal dieser 280 Menschen mit dem von 560 anderen Patienten](https://academic.oup.com/jnci/article/110/1/121/4064136), die vergleichbare Krebserkrankungen in vergleichbaren Stadien hatten, sich aber nach dem schulmedizinischen Standard behandeln lie\u00dfen. Die F\u00fcnf-Jahres-\u00dcberlebensrate ist ein \u00fcblicher Messwert f\u00fcr den Erfolg einer Krebstherapie. In dieser Studie lag die F\u00fcnf-Jahres-\u00dcberlebensrate unter alternativmedizinischer Krebsbehandlung mit 54,7 % deutlich niedriger als nach konventioneller Therapie mit 78,3 %.\nAus meiner Sicht kann eine klassisch \u00bbschulmedizinische\u00ab Therapie oft gut um \u00bbalternative\u00ab Ans\u00e4tze erweitert werden. W\u00e4hrend die westliche Medizin oft sehr gut bei akuten Krankheitsbildern funktioniert, offenbart sie bei chronischen Erkrankungen immer wieder ihre L\u00fccken und Fehler. Hier hilft ein \u00bbBlick \u00fcber den Tellerrand\u00ab oft weiter.\nIn meiner Praxis versuche ich, das beste von beiden Seiten zu verwenden. Eine gute schulmedizinische Diagnostik und Therapie, bis die Leitlinien aufh\u00f6ren oder keinen guten Rat mehr wissen. Und ab dann wissenschaftlich begr\u00fcndete, sinnvolle Alternativen. Oder vielleicht sogar ein Aufsp\u00fcren der Ursache und eine urs\u00e4chliche Behandlung. Aber das sind Dinge, f\u00fcr die fehlt in der normalen Kassenarztpraxis leider oft auch die daf\u00fcr notwendige Zeit.\nHaben Sie R\u00fcckfragen oder wollen Sie von uns beraten werden? Bitte vereinbaren Sie einen Termin mit uns. Termine sind auch telefonisch m\u00f6glich.\nBestehende Patienten k\u00f6nnen uns auch gerne \u00fcber\n[unsere App](https://www.drgersch.de/#app) kontaktieren.\nAlternativ- oder Schulmedizin? | Patienteninformationen | Privat\u00e4rztliche Praxis Dr. Gersch\nArtikel von Dr. Gersch, einem niedergelassenen Arzt aus Kaiserslautern: \u00bbEs gibt eine recht deutliche Studie der Amerikanischen Yale-Universit\u00e4t. Hier geht es um 280 Patientinnen und Patienten (mittleres Alter 62 Jahre) mit noch nicht metastasierten Krebsarten der Brust, der Prostata, der Lunge und des Darms. Alle diese Patienten hatten auf jede konventionelle Therapie ihrer prinzipiell noch heilbaren Tumoren verzichtet und sich ausschlie\u00dflich alternativmedizinisch behandeln lassen. Die \u00c4rzte um Skyler Johnson von der Yale School of Medicine in New Haven, Connecticut dann verglichen das Schicksal dieser 280 Menschen mit dem von 560 anderen Patienten, die vergleichbare Krebserkrankungen in vergleichbaren Stadien hatten, sich aber nach dem schulmedizinischen Standard behandeln lie\u00dfen. Die F\u00fcnf-Jahres-\u00dcberlebensrate ist ein \u00fcblicher Messwert f\u00fcr den Erfolg einer Krebstherapie. In dieser Studie lag die F\u00fcnf-Jahres-\u00dcberlebensrate unter alternativmedizinischer Krebsbehandlung mit 54,7 % deutlich niedriger als nach konventioneller Therapie mit 78,3 %. (...) \u00ab\nArtikel wird geladen...\n\u00a9 Praxis Dr. Gersch |\n[Impressum](https://www.drgersch.de/#impressum) | [Datenschutz](https://www.drgersch.de/#datenschutz) | [Vertr\u00e4ge hier k\u00fcndigen](https://www.drgersch.de/feedback.cgi?action=kuendigungsbutton) | [Kostenlose Video-Kompaktkurse mit Dr. Gersch](https://www.drgersch.de/kompaktkurs/auswahl/footer) | Youtube-Kan\u00e4le [Autoimmunerkrankungen](https://www.youtube.com/@lektinfrei) und [Atemtherapie](https://www.youtube.com/@buteyko-mit-dr.gersch) | [TikTok](https://www.tiktok.com/@dr.gersch)", "language": null, "image": "https://www.drgersch.de/images/cover.jpg", "pagetype": "article", "links": ["https://www.drgersch.de/bic", "/#impressum", "/#datenschutz", "#inhalt", "#inhalt", "#inhalt", "https://www.drgersch.de/", "https://www.drgersch.de", "https://academic.oup.com/jnci/article/110/1/121/4064136", "https://www.drgersch.de/bic", "https://www.drgersch.de/#app", "https://www.drgersch.de/#impressum", "https://www.drgersch.de/#datenschutz", "https://www.drgersch.de/feedback.cgi?action=kuendigungsbutton", "https://www.drgersch.de/kompaktkurs/auswahl/footer", "https://www.youtube.com/@lektinfrei", "https://www.youtube.com/@buteyko-mit-dr.gersch", "https://www.tiktok.com/@dr.gersch"]}