{"title": "(+49) 06831-3537", "author": null, "url": "https://hausarztpraxis-saarlouis.de/", "hostname": "hausarztpraxis-saarlouis.de", "description": "Willkommen in der haus\u00e4rztlichen Praxis Dr. Attila Csikai in Saarlouis. Wir betreuen Sie in allen F\u00e4llen von akuten Erkrankungen und internistischen F\u00e4llen, sowie bei allen Vorsorgeuntersuchungen und Impfungen. Dr. Csikai ist Facharzt f\u00fcr Innere Medizin und zertifizierter Taucherarzt GT\u00fcM IIa.", "sitename": "hausarztpraxis-saarlouis.de", "date": "2023-09-18", "id": null, "license": null, "body": null, "comments": "", "commentsbody": null, "raw_text": null, "text": "Herzlich Willkommen in der\nHAUSARZTPRAXIS SAARLOUIS\nDr./ Med. Univ. Budapest ATTILA CSIKAI\n[TERMIN](#Termin)\nWenn Sie einen Termin oder ein neues Rezept brauchen, rufen Sie uns bitte vorher an. In dringenden Notf\u00e4llen wenden Sie sich bitte an die Notrufnummern.\n[PRAXIS](#Praxis)\nBesuchen Sie unsere top ausgestattete Hausarztpraxis mit freundlich modern gestalteten R\u00e4ume in der alten gelben Villa im Herzen von Saarlouis.\n[LEISTUNGEN](#Leistung)\nErfahren Sie mehr \u00fcber unser Gesundheits-Angebot und alle Leistungen rund um Beratung, Diagnostik, Behandlung und Vorsorgeuntersuchungen.\n[TEAM](#Team)\nUm Ihnen auch in Zukunft eine Rundum-Versorgung garantieren zu k\u00f6nnen, haben wir unser erfahrenes und kompetentes Team f\u00fcr Sie erweitert.\nDR. ATTILA CSIKAI\nDer Mensch im Zentrum \u2013\nWir sind gerne f\u00fcr Sie da.\nUnsere Praxis ist gerne f\u00fcr Sie da. Ob es sich um eine allgemein\u00e4rztliche Akutbehandlung oder um einen medizinischen Notfall handelt, ob es sich um Vorsorgeuntersuchungen oder die Versorgung chronisch kranker Menschen handelt.\nDie Versorgung internistischer Erkrankungen, einschlie\u00dflich geriatrischer oder palliativmedizinischer Besonderheiten, findet genauso wie die konservative Behandlung orthop\u00e4discher Beschwerden, einschlie\u00dflich Schmerztherapie, nach aktuellen Behandlungskonzepten statt.\nGleichzeitig verfolgen wir einen ganzheitlichen Therapieansatz. Bei der Analyse von k\u00f6rperlichen Beschwerden, Befindlichkeiten oder psychischen Belastungen, beachten wir immer die gesamte Einheit von K\u00f6rper, Seele und Geist.\nHAUSARZTPRAXIS SAARLOUIS\nEinzigartig und nah.\nWir sind f\u00fcr Sie da.\nEin breites Therapieangebot und moderne Methoden bieten viele Alternativen.\n[Innere Medizin](#)\nDiagnostik und Therapie von internistischen Erkrankungen, z.B. Kardiologie, Gastroenterologie, Endokrinologie\n[Notfallmedizin](#)\nDiagnostik und Therapie von Erkrankungen, die keinen zeitlichen Aufschub erlauben, z.B. Herzinfarkt, Schlaganfall, Herzrhythmusst\u00f6rungen, Blutungen\n[Physikalische Therapie](#)\nTherapeutischer Einsatz von Physiotherapie, Ergotherapie, Elektrotherapie, Hydrotherapie usw.\n[Rehabilitationswesen](#)\nMedizinische Rehabilitation bei chronischen Erkrankungen mit Einschr\u00e4nkungen im allt\u00e4glichen Leben oder in der Arbeitswelt\n[Akupunktur TCM](#)\nNadelstichtechnik nach Traditioneller Chinesischer Medizin TCM zur Schmerztherapie oder anderen funktionellen St\u00f6rungen\n[Naturheilverfahren](#)\nGanzheitliche Therapie mit Einbeziehung von Bewegungstherapie, Ern\u00e4hrungstherapie, Ordnungstherapie, Phytotherapie\nSie brauchen einen Termin bei unseren \u00c4rzten, oder ein neues Rezept?\nDann rufen Sie uns an, wir helfen Ihnen gerne weiter.\nNEU: Ab dem 06.12.2022 bleibt die Praxis dienstagnachmittags GESCHLOSSEN.\nF\u00fcr medizinische Notf\u00e4lle h\u00f6ren Sie bitte den Anrufbeantworter Tel. 3537 ab.\nUnsere Sprechzeiten\nAu\u00dferhalb unserer Sprechzeiten wenden Sie sich bitte an den Allgemein\u00e4rztlichen Notfalldienst\nTelefon-Nummer 116 117\nBei Lebensgefahr w\u00e4hlen Sie bitte den\nNOTRUF 112\nTermin vereinbaren\n(+49) 06831-3537\nKennen Sie schon unser\nRezept-Telefon?\nF\u00fcr Wiederholungsrezepte und Wiederholungs-\u00dcberweisungen sprechen Sie Ihre W\u00fcnsche einfach auf unseren Anrufbeantworter:\n(+49) 06831-128 745\nOder schreiben Sie uns per E-Mail\n[info@hausarztpraxis-saarlouis.de](mailto:info@hausarztpraxis-saarlouis.de)\nUnser Leistungsangebot\nDIAGNOSTIK\nLabor\nEKG\nLangzeit-EKG\n24h-Blutdruckmessung\nErgometrie\nSpirometrie\nLaboruntersuchungen einschl. Speziallabor\nSonografie der Bauchorgane\nSonografie der Schilddr\u00fcse\nVORSORGEUNTERSUCHUNGEN\nGesundheitsuntersuchung, Check-up vor und nach dem 35. Lebensjahr\nImpfungen gem\u00e4\u00df STIKO (St\u00e4ndige Impfkommission)\nJugendschutzuntersuchungen\nHautkrebsscreening\nKrebsvorsorgeuntersuchung f\u00fcr M\u00e4nner\nBeratung zur Vorsorge-Koloskopie\nVorsorge des Bauchaortenaneurysma\nBERATUNG\nHaus\u00e4rztlich-internistische Betreuung chronisch kranker Menschen\nHausbesuche durch den Arzt oder eine qualifizierte MFA (Verah)\nGeriatrische Grundversorgung und Betreuung im Altenheim\nPsychosomatische Grundversorgung\nTHERAPIE\nInternistische und medikament\u00f6se Therapie\nChirotherapie und Physikalische Therapie\nSchmerztherapeutische Grundversorgung\nWundmanagement chronischer Wunden\nNaturheilverfahren\nTCM \u2013 Traditionelle Chinesische Medizin\nPalliativmedizinische Grundversorgung\nINDIVIDUELLE GESUNDHEITS-LEISTUNGEN (IGeL )\nIGeL-Leistungen sind Selbstzahlerleistungen\nIndividuelle Labor-Wunschleistungen, z.B. Check-Erg\u00e4nzungsuntersuchungen oder Intervall-Check\nUltraschall der Halsgef\u00e4\u00dfe\nAkupunktur (K\u00f6rperakupunktur nach TCM und Ohrakupunktur)\nEigenbluttherapie und Ozontherapie\nVitaminaufbaukuren\nLasertherapie zur Schmerzbehandlung\nKinesiotape\nSymbioselenkung im Darm-Mikrobiom\nReisemedizinische Beratung, Reiseimpfungen und Reiser\u00fcckkehrer-Medizin\nSporttauglichkeitsuntersuchung\nAtemschutz-Tauglichkeitsuntersuchung f\u00fcr Feuerwehrleute nach G26.3\nBeratung zur Patientenverf\u00fcgung und Betreuungsverf\u00fcgung\nTauchtauglichkeitsuntersuchung nach GT\u00dcM\nCHIROTHERAPIE\nUnser St\u00fctz-und Bewegungsapparat besteht aus einem empfindlichen Gleichgewicht zwischen stabilisierenden und mobilisierenden Strukturen und Funktionen, die sehr fein ineinander verkettet sind.\nAuch wenn es keine ausgepr\u00e4gten strukturellen St\u00f6rungen wie Verschlei\u00dferscheinungen oder Bandscheibenvorf\u00e4lle gibt, k\u00f6nnen sogenannte funktionelle St\u00f6rungen reichlich Beschwerden verursachen, zum Beispiel Blockierungen mit Kopfschmerzen, schmerzhaften Bewegungsst\u00f6rungen in und um den Bewegungsapparat oder Schwindel.\nL\u00e4nger andauernde Beschwerden und psychische Faktoren erschweren die Genesung zus\u00e4tzlich.\nDie Chirotherapie kann mit ihren manuellen Techniken diese funktionellen St\u00f6rungen l\u00f6sen. Im besten Fall gibt es eine sofortige Beschwerdebesserung.\nTCM Traditionelle Chinesische Therapie\nAkkupunktur\nSchr\u00f6pfen und Schr\u00f6pfkopfmassagen\nMoxibustion\nHAUSARZTPRAXIS SAARLOUIS\nUnsere Praxis im Gelben Haus\nHAUSARZTPRAXIS SAARLOUIS\nAktuelle News aus der Praxis\n[URLAUB im 3. Quartal 2023](https://hausarztpraxis-saarlouis.de/urlaub-im-2-quartal-2022)\nVom Donnerstag, den 18.09.2023 bis Freitag, den 22.09.2023 bleibt unsere Hausarztpraxis geschlossen.\nUnser Rezept-Telefon-Service ist in dieser Zeit ebenfalls nicht verf\u00fcgbar.\nE-Mail- und Fax-Eing\u00e4nge werden gespeichert. Die angeforderten Papiere k\u00f6nnen dann ab dem 25.09.2023 abgeholt werden.\nDie \u00e4rztliche Vertretung in dieser Zeit \u00fcbernehmen:\nFrau Andrea Kremers, Kaiser Friedrich-Ring 30 in Saarlouis, Tel. 2468\nHerr Dr. Sebastian Blass Vaubanstr. 27 in Saarlouis, Tel. 1270015\nFrau Dr. Bettina Bundschuh Kaiser-Friedrich-Ring 30 in Saarlouis, Tel. 2468 (ehemals Praxis Hanisch)\nAm Wochenende, an Br\u00fcckentagen und an Feiertagen ist die Bereitschaftsdienstpraxis Saarlouis, Kapuzinerstr. 4, Tel. 116117, ge\u00f6ffnet.\nIhr Praxisteam\nDr. Attila Csikai und Peter Sauer\n[NEUE Online Terminbuchung](https://hausarztpraxis-saarlouis.de/neue-online-terminbuchung)\nAb sofort sind Online-Terminbuchungen \u00fcber unsere Homepage m\u00f6glich, einfach\n[hier klicken](https://webtermin.medatixx.de/#/fedd9699-266a-47d4-b8bd-e07dc3182e2f/search) oder auf der Startseite den Button [Online Termin](https://hausarztpraxis-saarlouis.de/) anklicken\nDie Termine sind in unseren Praxisablauf zeitlich so integriert, dass z.B. Laboruntersuchungen in der Regel fr\u00fch morgens und die Infekt-Sprechstunde zu sp\u00e4teren Randzeiten geplant werden.\nNeupatienten beachten bitte, dass in unserer haus\u00e4rztlich-internistischen Praxis keine rein fach\u00e4rztlichen Untersuchungen stattfinden, wie z.B. Magen- und Darmspiegelungen oder Herz-Ultraschalluntersuchungen.\n[COVID-19 IMPFUNG](https://hausarztpraxis-saarlouis.de/covid-19-impfung)\nWir impfen weiterhin entsprechend den Vorgaben der\n[St\u00e4ndigen Impfkommission (STIKO)](https://www.rki.de/DE/Content/Kommissionen/STIKO/Empfehlungen/Impfempfehlungen_node.html;jsessionid=16D5C3C79E2F53F1F123C78351B6DC81.internet072) mit den Impfstoffen der Firmen Biontech/Pfizer und Moderna.\nNeue STIKO-Empfehlung zur COVID-19-Impfung\nDie STIKO hat ihre aktualisierte COVID-19-Impfempfehlung und die dazugeh\u00f6rige wissenschaftliche Begr\u00fcndung am 25.5.2023 im Epidemiologischen Bulletin 21/2023 ver\u00f6ffentlicht. Unter anderem empfiehlt die STIKO, dass Personen mit einem erh\u00f6hten Risiko f\u00fcr einen schweren Krankheitsverlauf (u.a. Personen ab 60 Jahre) sowie Personen mit erh\u00f6htem SARS-CoV-2-Infektionsrisiko zuk\u00fcnftig weitere Auffrischungsimpfungen \u2013 in der Regel im Mindestabstand von 12 Monaten zur letzten Impfung oder Infektion \u2013 erhalten, vorzugsweise im Herbst. Die COVID-19-Impfung wird in die allgemeinen STIKO-Impfempfehlungen 2023 aufgenommen.\n[Ihr \u00c4rzteteam](https://hausarztpraxis-saarlouis.de/ihr-aerzteteam)\nDr. Csikai und Herr Sauer begr\u00fc\u00dfen Sie recht herzlich gemeinsam als haus\u00e4rztliche Internisten in der Hausarztpraxis Saarlouis. Sie werden auch Studenten, Famulanten oder Assistenz\u00e4rzte kennenlernen, die zeitweise mit uns arbeiten. Denn die Ausbildung der nachfolgenden \u00c4rzte und Haus\u00e4rzte ist uns sehr wichtig.\nHAUSARZTPRAXIS SAARLOUIS\nUnser Team ist gerne f\u00fcr Sie da\nIhre Haus\u00e4rzte\nDr./Med. Univ. Budapest Attila Csikai\nFacharzt f\u00fcr Innere Medizin\nMedizinische Approbation an der Semmelweis Universit\u00e4t f\u00fcr Medizinwissenschaften in Budapest 1989\n1990-1992 Assistenzarzt in der Fachklinik f\u00fcr Konservative Orthop\u00e4die und Physikalische Therapie der Bliestal-Klinik in Blieskastel bei Herrn Dr. med. G\u00fcnther Finkbeiner\n1992-1994 Assistenzarzt in der Fachklinik f\u00fcr Innere Erkrankungen der Bliestal-Klinik in Blieskastel bei Herrn Dr. med. habil. Helmut M\u00fcller\n1994-1999 Assistenzarzt in der Inneren Medizin des CTT Caritas-Krankenhauses Dillingen bei Herrn Dr. med. W. R. Brandl\nSeit 01.01.2000 Niederlassung in hiesiger haus\u00e4rztlich-internistischen Praxis.\nNotfallmedizin\nNaturheilverfahren\nChirotherapie/Manuelle Medizin\nPhysikalische Therapie\nRehabilitationswesen\nFachkunde f\u00fcr Echokardiografie, Sigmoido-Koloskopie sowie der R\u00f6ntgendiagnostik des gesamten Skeletts\nAkupunktur-Diplom A und B der Deutschen \u00c4rztegesellschaft f\u00fcr Akupunktur D\u00c4GfA Taucherarzt IIa der Gesellschaft f\u00fcr Tauch- und \u00dcberdruckmedizin GT\u00dcM\nReisemedizinische Beratung DTG\nWeiterbildungserm\u00e4chtigung f\u00fcr Allgemeinmedizin\nHerr Peter Sauer\nFacharzt f\u00fcr Innere Medizin\nMedizinische Approbation 1987 in Homburg/Saar\n1987-1988 Assistenzarzt in der Neurologischen Abteilung des Krankenhauses Sulzbach bei Herrn Dr. med. Karst\n1988-1993 Assistenzarzt in der Abteilung f\u00fcr Innere Medizin im St. Michael-Krankenhaus V\u00f6lklingen bei Herrn Dr. med. W\u00f6rdehoff\n1994 Assistenzarzt in der Abteilung f\u00fcr Innere Medizin im St. Elisabeth-Krankenhaus Wadern bei Herrn Dr. med. Gard\n1995-1999 Assistenzarzt in der Abteilung f\u00fcr Innere Medizin im St. Michael-Krankenhaus V\u00f6lklingen bei Herrn Dr. med. W\u00f6rdehoff\nSeit 1999 Niederlassung in einer haus\u00e4rztlich-internistischen Praxis in Saarlouis.\nIhre Ansprechpartnerinnen\nFrau Petra Lef\u00e8vre\nMedizinische Fachangestellte\nImpfassistentin\nPraxisleitung\nDatenschutz\nbeauftragte\nFrau Martina Csikai\nExaminierte Krankenschwester\n[VERAH\u00ae (Versorgungsassistentin in der Hausarztpraxis)](https://www.verah.de/)\nN\u00e4Pa (Nicht\u00e4rztliche Praxisassistentin*)\nImpfassistentin\nFrau Monja Rodenberg\nMedizinische Fachangestellte\n[VERAH\u00ae (Versorgungsassistentin in der Hausarztpraxis)](https://www.verah.de/)\nN\u00e4Pa (Nicht\u00e4rztliche Praxisassistentin*)\nImpfassistentin\n* Nicht\u00e4rztliche Praxisassistent/innen unterst\u00fctzen den Hausarzt bei der Betreuung der Patienten. Sie f\u00fchren Hausbesuche sowie Besuche in Alten- und Pflegeheimen durch.\nPraxismitarbeiter, die diese Aufgabe \u00fcbernehmen wollen, ben\u00f6tigen eine Fortbildung. Die Bundes\u00e4rztekammer hat ein entsprechendes Fortbildungs-curriculum f\u00fcr Medizinische Fachangestellte und Angeh\u00f6rige anderer Gesundheitsberufe entwickelt.\nPraxismitarbeiter, die bereits eine Ausbildung zur VERAH absolviert haben, m\u00fcssen zur Erf\u00fcllung der Anforderungen der Delegations-Vereinbarung erg\u00e4nzende Ausbildungsstunden oder -module belegen\nFrau Sandra Langenfeld\nMedizinische Fachangestellte\nFrau Nurcan Altug\nMedizinische Fachangestellte\nFrau Chiara Cil\nKauffrau f\u00fcr B\u00fcromanagement\nHAUSARZTPRAXIS SAARLOUIS\nDas schreiben unsere Patienten\nGesammelte \u00f6ffentliche Rezensionen\nTrotz Hochbetrieb k\u00f6nnte ich heute kurzfristig noch einen Praxistermin erhalten. Daf\u00fcr vielen Dank. Freundliche Atmosph\u00e4re, helle Praxisr\u00e4ume und ein kompetenter Arzt. Klare Empfehlung.\nPeter\nSehr guter Arzt\nDieter Ritter\nSeit \u00fcber 8 Jahren der Hausarzt meines Vertrauens!\nDr. Csikai ist nun schon seit 8 Jahren mein Hausarzt und ich habe mich noch nie so gut aufgehoben gef\u00fchlt. Er nimmt sich jedes Mal viel Zeit f\u00fcr mich und bespricht mit mir alle Dinge bis ins Detail. Egal ob Vorsorgeuntersuchungen oder Behandlungen von akuten Erkrankungen, man ist bei ihm und seinen absolut tollen Kolleginnen stets in den besten H\u00e4nden.\nAnonym\nGewissenhafter Arzt mit R\u00fcckgrat\nEiner der wenigen \u00c4rzte welcher nicht nach dem Try and Error Prinzip vorgeht.\nDoc Csikai ist mir aus dem Rettungsdienst bekannt und ich habe dort seine Kompetenz am Patienten erlebt. Er nimmt sich Zeit und geht auf den Patienten ein. Ich bin mehr als zufrieden. Daher habe ich die Praxis als meinen Hausarzt gew\u00e4hlt.\nAnonym\nalles was Patient sich von Arzt erwartet\nals Hausarzt und Internist hervorragend. er schafft es sogar mir (trotz Spritzenphobie) Blut abzunehmen, ohne dass ganz Saarlouis in Aufruhr geraten muss\nAnonym\nUnser Familienarzt, \u00e4u\u00dferst kompetent und f\u00fcrsorglich.\nMeine ganze Familie wird schon seit vielen Jahren von ihm betreut. Man wird nicht standardm\u00e4\u00dfig behandelt, er nimmt sich Zeit und k\u00fcmmert sich hervorragend um seine Patienten. Wir haben sehr gro\u00dfes Vertrauen zu ihm.\nAuch seit Praxisteam ist super. In dieser Praxis ist man sehr gut aufgehoben. Prima, macht weiter so.\nAnonym\nkompetent gewissenhaft sorgf\u00e4ltig nimmt sich Zeit gutes Praxiszeitmanagement\nDr. Csikai ist ein sehr gewissenhafter und sorff\u00e4ltiger Arzt, der sich Zeit f\u00fcr seine Patienten nimmt. Er und sein Team sind sehr kompetent, freundlich und h\u00f6flich. Gut finde ich, dass man an f\u00e4llige Auffrischimpfungen und notwendige wiederkehrende Untersuchungen erinnert wird. Ich f\u00fchle mich in der Praxis in guten H\u00e4nden und kann sie mit bestem Gewissen weiterempfehlen. In dringenden F\u00e4llen erh\u00e4lt man kurzfristig einen Termin.\nAnonym\nKompetente und sehr f\u00fcrsorgliche Praxis\nIch bin 61 Jahre alt und Kassenpatientin. Seit \u00fcber 20Jahren bin ich in \u00e4rztlicher Behandlung bei Dr. Csikai.\nEr ist fachlich und menschlich ein sehr f\u00fcrsorglicher Arzt. Als es mir vor Jahren gesundheitlich nicht gut ging war er stets f\u00fcr mich da und nahm sich Zeit f\u00fcr die Behandlung.Die Praxis ist sehr kompetent und man f\u00fchlt sich wohl. Auch das Praxisteam ist sehr freundlich und zuvorkommend .Nicht vergessen sollte man das Dr. Csikai ein Arzt ist der noch Hausbesuche macht. Ich kann diese Praxis nur weiterempfehlen. Ich m\u00f6chte auf diese Weise einfach nur \" Danke \" sagen.\nAnonym\nSehr guter Arzt und super Team\nIch finde das der Herr Csikai ein super Arzt ist. Das Praxisteam ist super lieb und sehr zuvorkommend. Die Praxis ist in einer super sch\u00f6nen Stadtvilla und eine tip tope Austattung. Und das wichtigste ist das ich medizinisch gut versorgt bin.\nAnonym\nein Arzt, wie man sich ihn w\u00fcnscht\nEndlich mal ein Arzt, wo man nicht das Gef\u00fchl hat, abgefertigt zu werden.\nEr beherrscht noch klassische Methoden, die ich aus meiner Kindheit kenne.\nUnd zur Not kommt er auch nach Hause.\nAnonym\nBin seit mehreren Jahren bei dr.c. Er ist unser Hausarzt. Pers\u00f6nlich halte ich ihn als pragmatisch, routiniert, analytisch denkend. Habe nicht den. Eindruck, dass er die. Behandlung bei Privatpatienten in die L\u00e4nge f\u00fchren w\u00fcrde.\nEr betrachtet einen Patient g\u00e4nzlich.!! empfehle gerne dr.csikai weiter!!\nAnonym\nHerr Dr. Csikai machte einen sehr kompetenden Eindruck. F\u00fcr die Bratung nimmt er sich Zeit. Er vermittelt das Gef\u00fchl dass er sich der Probleme annimmt und ernst genommen wird.\nDas Team ist sehr freundlich und Aufmerksam.\nSehr zu empfehlen.\nAnonym\nHatte grad einen Hexenschuss und Dr. Csikai ist ohne zu z\u00f6gern noch vor seiner Sprechstunde zu mir nach Hause gekommen.\nIch bin selten krank, aber wenn ich was habe gehe ich zu ihm.\nMan wird grunds\u00e4tlich vern\u00fcnftig untersucht (was ja nicht mehr selbstverst\u00e4ndlich ist) der Dr.\nnimmt sich Zeit und hilft gezielt.\nEine ganz klare Empfehlung!\nAnonym\nSehr kompetenter und freundlicher Arzt. Wurde bis jetzt immer gut und erfolgreich behandelt.", "language": null, "image": null, "pagetype": null, "links": ["mailto:info@hausarztpraxis-saarlouis.de", "https://hausarztpraxis-saarlouis.de/", "https://hausarztpraxis-saarlouis.de/", "https://hausarztpraxis-saarlouis.de/#Termin", "https://hausarztpraxis-saarlouis.de/#Leistung", "https://hausarztpraxis-saarlouis.de/#Praxis", "https://hausarztpraxis-saarlouis.de/#Team", "https://hausarztpraxis-saarlouis.de/#News", "https://hausarztpraxis-saarlouis.de/datenschutz", "https://hausarztpraxis-saarlouis.de/impressum", "#Termin", "https://webtermin.medatixx.de/#/fedd9699-266a-47d4-b8bd-e07dc3182e2f", "#Termin", "#Termin", "#Praxis", "#Praxis", "#Leistung", "#Leistung", "#Team", "#Team", "#Termin", "#Team", "#", "#", "#", "#", "#", "#", "#", "#", "#", "#", "#", "#", "#", "#", "#", "#", "#", "#", "mailto:info@hausarztpraxis-saarlouis.de", "https://hausarztpraxis-saarlouis.de/urlaub-im-2-quartal-2022", "https://hausarztpraxis-saarlouis.de/urlaub-im-2-quartal-2022", "https://hausarztpraxis-saarlouis.de/neue-online-terminbuchung", "https://hausarztpraxis-saarlouis.de/neue-online-terminbuchung", "https://webtermin.medatixx.de/#/fedd9699-266a-47d4-b8bd-e07dc3182e2f/search", "https://hausarztpraxis-saarlouis.de/", "https://hausarztpraxis-saarlouis.de/covid-19-impfung", "https://hausarztpraxis-saarlouis.de/covid-19-impfung", "https://www.rki.de/DE/Content/Kommissionen/STIKO/Empfehlungen/Impfempfehlungen_node.html;jsessionid=16D5C3C79E2F53F1F123C78351B6DC81.internet072", "https://hausarztpraxis-saarlouis.de/ihr-aerzteteam", "https://hausarztpraxis-saarlouis.de/ihr-aerzteteam", "#", "#", "#", "https://www.verah.de/", "https://www.verah.de/"]}