{"title": "Podcastindex.org", "author": null, "url": "https://podcastindex.org/", "hostname": "podcastindex.org", "description": "The Podcast Index is here to preserve, protect and extend the open, independent podcasting ecosystem.", "sitename": "Podcastindex.org", "date": "2020-08-28", "id": null, "license": null, "body": null, "comments": "", "commentsbody": null, "raw_text": null, "text": "This website requires JavaScript to be enabled for full functionality.\nLet's preserve podcasting as a platform for free speech\nWe do this by enabling developers to have access to an open, categorized index that will always be available for free, for any use.\nListen to the\n[first episode](https://mp3s.nashownotes.com/PC20-01-2020-08-28-Final.mp3?_from=podcastindex.org)\nof \"Podcasting 2.0\", where we discuss the project, and its goals.\n[Podcasting 2.0 RSS Feed](http://mp3s.nashownotes.com/pc20rss.xml)\nPromise\nThe core, categorized index will always be available for free, for any use.\nOperations\nPodcast Index LLC is a software developer focused partnership that provides tools and data to\nanyone who aspires to create new and exciting Podcast experiences without the heavy lifting of\nindexing, aggregation and data management.\nFinancing\nThe core Podcast Index is financed by its founders and stakeholders: Podcasters, Developers and\nListeners.\nCorporate interests and advertising are antithetical to our business.\nPodcast Index LLC strives to grow by providing enhanced API services of value to developers and\norganizations.\nMission and Goal\nPreserve podcasting as a platform for free speech.\nRe-tool podcasting to a platform of value exchange that includes developers with podcasters and\nlisteners.\nDeveloper? Join the fun!\nSign up for an account and get API keys at:\n[https://api.podcastindex.org](https://api.podcastindex.org/signup)\nAPI Documentation is\n[here](https://podcastindex-org.github.io/docs-api/).\nWe build in the open. Get active in the\n[Github repos](https://github.com/Podcastindex-org).\nWe have a Mastodon server for collaboration. Join it\nhere:\n[Podcastindex.social](https://podcastindex.social/invite/hfcQYbjq).\nFollow us on\n[Twitter](https://twitter.com/PodcastindexOrg) or\n[Mastodon](https://noagendasocial.com/@podcastindex).\nShoot us an email at:\n[info@podcastindex.org](mailto:info@podcastindex.org)\nHelp us out...\nNone of this is free. If you get any value from this project, or if you just believe in it and want\nto help us out with hosting fees and paying the bills, a donation of any amount would be great.", "language": null, "image": null, "pagetype": "website", "links": ["https://podcastindex-org.github.io/docs-api/", "https://api.podcastindex.org/", "https://mp3s.nashownotes.com/PC20-01-2020-08-28-Final.mp3?_from=podcastindex.org", "http://mp3s.nashownotes.com/pc20rss.xml", "https://api.podcastindex.org/signup", "https://podcastindex-org.github.io/docs-api/", "https://github.com/Podcastindex-org", "https://podcastindex.social/invite/hfcQYbjq", "https://twitter.com/PodcastindexOrg", "https://noagendasocial.com/@podcastindex", "mailto:info@podcastindex.org"]}