{"title": "Impfstoffe gegen das SARS-Coronavirus-2", "author": "Tobias Welte", "url": "https://www.ncbi.nlm.nih.gov/pmc/articles/PMC8204600/", "hostname": "ncbi.nlm.nih.gov", "description": null, "sitename": "PubMed Central (PMC)", "date": "2021-04-06", "id": null, "license": null, "body": null, "comments": "", "commentsbody": null, "raw_text": null, "text": "Learn more:\n[PMC Disclaimer](/pmc/about/disclaimer/)| [PMC Copyright Notice](/pmc/about/copyright/) [10.1007/s15033-021-2716-x](//doi.org/10.1007%2Fs15033-021-2716-x) [34149947](https://pubmed.ncbi.nlm.nih.gov/34149947)\nImpfstoffe gegen das SARS-Coronavirus-2\nMit beispielloser Geschwindigkeit wurden verschiedene Impfstoffe gegen COVID-19 entwickelt. Knapp ein Jahr, nachdem die WHO den Pandemiefall ausgerufen hat, sind bereits verschiedene Impfstoffprinzipien zugelassen, die im Folgenden vorgestellt werden.\nMit der Einsicht, dass sich die zun\u00e4chst in China berichteten Coronainfektionen zu einer weltweiten Pandemie ausbreiten w\u00fcrde, begann eine Impfstoffentwicklung mit unterschiedlichen, teilweise f\u00fcr andere Impfstoffe bereits etablierten, teilweise jedoch vollkommen neuen Technologien. \u25b6\n[Abb. 1](/pmc/articles/PMC8204600/figure/Fig2/) gibt einen \u00dcberblick dar\u00fcber, in welche Richtung sich die Impfstoffentwicklung bewegt hat. Insgesamt befinden sich mehr als 200 Substanzen in der Entwicklung, von denen 60 bereits am Menschen in unterschiedlichen Studienphasen getestet worden sind (\u25b6 [Abb. 2](/pmc/articles/PMC8204600/figure/Fig3/)) [ [1](#CR1908), [2](#CR1912)].\nDie daraus entstandenen Impfstoffe wurden in weniger als einem halben Jahr in klinische Pr\u00fcfungen eingebracht. Vier SARS-CoV-2-Impfstoffe sind nach knapp einem Jahr bereits durch die European Medicines Agency (EMA) zugelassen und befinden sich bereits im klinischen Einsatz, weitere Impfstoffe stehen kurz vor der Zulassung. Als erster wurde Ende Mai BNT162b2 (BioNTech/Pfizer) von der EU-Kommission f\u00fcr Kinder und Jugendliche im Alter ab 12 Jahren zugelassen. Eine auch nur ann\u00e4hernd so schnelle Impfstoffentwicklung hat es nie zuvor in der Geschichte gegeben. \u25b6\n[Tab. 1](/pmc/articles/PMC8204600/table/Tab1/) beschreibt die wesentlichen Faktoren, die diese Entwicklung beg\u00fcnstigt haben.\n|Plattformen waren bereits etabliert|\nVorarbeiten wurden bereits w\u00e4hrend der SARS-Pandemie 2003 geleistet;\nVorarbeiten aus anderen Bereichen wie der Tumorvakzinierung wurden genutzt.\n|\u00f6ffentlich-private Partnerschaft|\nErhebliche staatliche Unterst\u00fctzung f\u00fcr Entwicklungsprogramme:\n\u25b6 Oxford University/AstraZenca\n\u25b6 BMG/Curevac T\u00fcbingen\n|schnelle Studiendurchf\u00fchrung||Aufgrund der hohen Krankheitslast konnten Effektivit\u00e4tsstudien schnell abgeschlossen werden.|\n|beschleunigte Zulassungsverfahren||Etablierung von Zulassungsprozessen, die eine fortlaufende \u00dcberpr\u00fcfung mit Anpassung der Zulassung erm\u00f6glichen.|\nMan muss man zwischen einem Emergency Approval (Notfallzulassung; UK, USA) und einer provisorischen Zulassung, wie sie die EU erteilt hat, unterscheiden. Der wesentliche Unterschied zwischen beiden Zulassungsverfahren liegt in den Haftungsbedingungen bei Nebenwirkungen, die bei der Notfallzulassung beim Geimpften selbst, bei der provisorischen Zulassung jedoch beim Hersteller (und zum Teil der zulassenden Beh\u00f6rde) liegt.\nIm Weiteren sollen von den vielen unterschiedlichen Impfstoffprinzipien nur die besprochen werden, f\u00fcr die es bereits ein zugelassenes Pr\u00e4parat gibt oder eine Zulassung beantragt wurde oder letzteres kurz bevorsteht. Im Wesentlichen sind hier drei verschiedene Impfstoffgruppen zu nennen, n\u00e4mlich die mRNA-Impfstoffe, die Vektorimpfstoffe, im Wesentlichen die adenoviralen Vektoren, und die proteinbasierten Impfstoffe.\n\u25b6\n[Abb. 3](/pmc/articles/PMC8204600/figure/Fig4/) zeigt am Beispiel eines proteinbasierten Impfstoffs die einzelnen Komponenten der impfinduzierten Immunit\u00e4t. Das intramuskul\u00e4r injizierte Vakzin wird von dendritischen Zellen aufgenommen, die durch sogenannte \"pattern recognition receptors\" (PRRs) aktiviert werden. Diese wandern zu dem das Gebiet drainierenden Lymphknoten, in dem es zu einer Aktivierung von T-Zellen kommt. Diese T-Zellen initiieren eine Entwicklung von B-Zellen, die verschiedene Antik\u00f6rperisotypen produzieren k\u00f6nnen. Plasmazellen mit kurzer Lebensdauer sorgen f\u00fcr einen schnellen Anstieg virusspezifischer Antik\u00f6rper, lang lebende Plasmazellen k\u00f6nnen auch nach Monaten noch Antik\u00f6rper aus Nischen im Knochenmark mobilisieren. CD8+ Ged\u00e4chtnis-T-Zellen k\u00f6nnen bei Kontakt mit dem Virus schnell proliferieren, CD8+ Effektor-T-Zellen spielen eine wesentliche Rolle f\u00fcr die Elimination des Virus [ [3](#CR1916)].\nF\u00fcr alle Impfstoffe ist momentan nicht abschlie\u00dfend gekl\u00e4rt, ob sie nur eine schwere Erkrankung, ob sie jede Form von Erkrankung oder ob sie auch eine Virus\u00fcbertragung verhindern. Erste Daten legen nahe, dass die Viruslast bei PCR-positiven Patienten nach Impfung deutlich niedriger ist als bei Nichtgeimpften [\n[4](#CR1920)]. Solange jedoch nicht abschlie\u00dfend gekl\u00e4rt ist, ob diese dann auch nicht mehr ansteckend sind, m\u00fcssen die Schutzma\u00dfnahmen (Abstand, Mund-Nasen-Maske, H\u00e4ndedesinfektion) auch bei Geimpften eingehalten werden.\nmRNA-Impfstoffe\nDie mRNA-Technologie wurde prim\u00e4r zur Tumorvakzinierung entwickelt und dann auf den SARS-CoV-2-Impfstoff \u00fcbertragen. Bei dieser Technik wird Boten-RNA (messenger-RNA, mRNA) des Virus appliziert. Damit die mRNA ins Zytoplasma der Zielzellen aufgenommen werden kann und nicht vorzeitig abgebaut wird, wird sie in Liposomen oder Lipidnanopartikeln verpackt. Im Zytoplasma bindet die mRNA an Replicaseenzyme und vermehrt sich selbstst\u00e4ndig. Durch Bindung an Ribosomen werden dann virale Proteine gebildet, hier wie bei praktisch allen Corona-Impfstoffen in erster Linie das Spike-Protein, das Bindeprotein von SARS-CoV-2 an Zielzellen wie Atemwegsepithelien. Diese werden von antigenpr\u00e4sentierenden Zellen aufgenommen und es wird eine Immunantwort erzeugt (\u00dcbersicht bei [\n[5](#CR1924)]).\nmRNA-Impfstoffe k\u00f6nnen selbst keine Infektion ausl\u00f6sen. Die mRNA verbleibt im Zytoplasma und wird nicht ins Genom aufgenommen, es besteht daher keine Gefahr einer genetischen Ver\u00e4nderung von Zellen. Sie wird schnell wieder abgebaut, Langzeitnebenwirkungen durch die mRNA selbst sind nicht zu bef\u00fcrchten, die Impfstoffnebenwirkungen sind Folge der Immunantwort. Mit mRNA-1273 (Moderna, USA) und BNT162b2 (Biontech/Pfizer, Deutschland/USA) sind zwei Vertreter dieser Gruppe zugelassen, mit \u00e4hnlichen Impfstoffen der Firmen Curevac und Arcturus befinden sich weitere Substanzen in der klinischen Pr\u00fcfung.\nF\u00fcr mRNA-1273 und BNT162b2 wurden wesentliche Phase-III-Daten, die dann f\u00fcr die Zulassung relevant waren, publiziert [\n[6](#CR1928), [7](#CR1932), [8](#CR1936), [9](#CR1940)]. Inzwischen liegen aus Gro\u00dfbritannien und Israel Daten zur Effektivit\u00e4t von BNT162b2 unter Alltagsbedingungen vor [ [10](#CR1944), [11](#CR1948)].\nF\u00fcr beide Impfstoffe konnte \u00fcbereinstimmend gezeigt werden, dass eine erste Impfung eine humorale (Antik\u00f6rperbildung, insbesondere neutralisierende Antik\u00f6rper) und eine zellul\u00e4re (T- und B-Ged\u00e4chtniszellen) Immunantwort ausl\u00f6st. Nach einer Boosterimpfung (f\u00fcr mRNA-1273 nach vier Wochen, f\u00fcr BNT162b2 nach drei bis sechs Wochen) kann die Impfantwort deutlich verbessert werden. In den klinischen Studien konnte f\u00fcr beide Impfstoffe eine Effektivit\u00e4t von \u00fcber 90 % nach der Boosterimpfung nachgewiesen werden. Die protektive Wirkung der Impfung setzt etwa eine Woche bis 10 Tage nach Impfung ein. Auch nach der ersten Impfung gibt es eine gewisse Schutzwirkung, die bei etwa 50-85 % (je nach Abstand zur Impfung) liegt, diese nimmt mit zunehmendem Abstand zur Erstimpfung jedoch ab. Aus den bisherigen Daten kann nur \u00fcber eine kurzzeitige Impfeffektivit\u00e4t des Impfstoffs f\u00fcr den Zeitraum von 4-12 Wochen nach Impfung berichtet werden. Aufgrund immunologischer Daten ist jedoch von einer deutlich l\u00e4ngeren Impfeffektivit\u00e4t auszugehen [\n[12](#CR1952)], inzwischen liegen Antik\u00f6rperdaten mehr als 6 Monate nach Impfung vor, die weiter eine hohe Effektivit\u00e4t anzeigen. Ob und wann eine weitere Auffrischungsimpfung notwendig ist, kann zum jetzigen Zeitpunkt nicht mit Sicherheit gesagt werden.\nF\u00fcr BNT162b2 liegen zudem Immunogenit\u00e4tsdaten im Hinblick auf die wichtigsten SARS-CoV-2-Varianten vor, die auch bei diesen Varianten eine gegen\u00fcber der klassischen Variante nicht abgeschw\u00e4chte Impfantwort zeigen [\n[13](#CR1956)].\nTypische Nebenwirkungen von mRNA-Impfstoffen sind leicht bis moderat und reichen von Schwellung und Schmerz an der Einstichstelle bis hin zu erk\u00e4ltungs\u00e4hnlichen Symptomen mit Fieber, Gliederschmerzen und eingeschr\u00e4nktem Allgemeinbefinden. Als schwere Nebenwirkung sind vor allem allergische Reaktionen bekannt, die wahrscheinlich durch das f\u00fcr die liposomalen Nanopartikel verwendete Polyethylenglykol oder Polysorbat bedingt ist [\n[14](#CR1960)]. M\u00f6glichkeiten zur Behandlung eines allergischen Schocks sollten daher an allen Impfstellen zur Verf\u00fcgung stehen. Da es sich in der Regel um eine allergische Sofortreaktion handelt, sollten die Geimpften 30 Minuten nach Impfung \u00fcberwacht werden. Grunds\u00e4tzlich k\u00f6nnen Impfstoffe Autoimmunerkrankungen ausl\u00f6sen. Bei Patienten mit bestehenden Autoimmunerkrankungen sollte die immunsupprimierende Therapie bei der Impfung beibehalten werden [ [15](#CR1964)].\nSehr seltene Nebenwirkungen wie eine neurologische Symptomatik mit starken Kopfschmerzen oder die Triggerung einer Herpes-Zoster-Erkrankung wurden beschrieben, waren jedoch stets reversibel. Aufgrund der provisorischen Zulassung unterliegen alle Impfstoffe einer strengen \u00dcberwachung, jeder Verdacht auf eine Nebenwirkung ist an die Regulationsbeh\u00f6rden zu melden. Die Geimpften sollten dezidiert dar\u00fcber aufgekl\u00e4rt werden, dass sie sich im Fall von Nebenwirkungen melden.\nAdenovirale Vektorimpfstoffe\nHier werden f\u00fcr Menschen nicht pathogene Viren dahingehend ver\u00e4ndert, dass sie f\u00fcr das Spike-Protein des SARS-CoV-2 kodieren k\u00f6nnen. Sowohl verschiedene Adenoviren als auch modifizierte Vaccina-Ankara-Viren wurden f\u00fcr die Impfstoffentwicklung genutzt, in der Praxis werden zurzeit nur adenovirale Vektoren verwendet.\nBei dieser Technologie fungiert das Vektorvirus als \"Genf\u00e4hre\". Es vermehrt sich im Zytoplasma der Zielzelle, wird von der antigenpr\u00e4sentierenden Zelle aufgenommen, die dann die Immunantwort, die auch in diesem Fall gegen das Spike-Protein von SARS-CoV-2 gerichtet ist, induziert. Grunds\u00e4tzlichen k\u00f6nnen Vektorimpfstoffe anders als mRNA-Impfstoffe durch eine Immunantwort gegen den Vektor inaktiviert werden, vor allem nach der Boosterimpfung scheint das m\u00f6glich [\n[5](#CR1924)].\nIn Deutschland zugelassen sind der von der Oxford University und AstraZeneca entwickelte Impfstoff, der ein Schimpansenadenovirus als Vektor nutzt, sowie der Impfstoff von Johnson & Johnson, der ein Adenovirus 26 verwendet. Anders als durch die EMA wird er in Deutschland (und anderen L\u00e4ndern) nur f\u00fcr Menschen \u00fcber 60 Jahren empfohlen, weil nach Impfung als seltene Nebenwirkungen Hirn- und Sinusvenenthrombosen (CVST), Thrombosen im Mesenterialstromgebiet und/oder eine gesteigerte intravasale Koagulopathie (DIC) auftraten. CVST-Symptome sind starke Kopfschmerzen, Schwindel, \u00dcbelkeit/Erbrechen und Sehst\u00f6rungen. Charakteristisch f\u00fcr DIC ist das gleichzeitige Auftreten multipler ven\u00f6ser oder arterieller Thromboembolien mit ausgepr\u00e4gter Thrombozytopenie und St\u00f6rungen der plasmatischen Gerinnung. Die Thrombozytopenie wurde auch bei den CVST beobachtet [\n[16](#CR1970)]. Symptome traten innerhalb von 7-14 Tagen nach der Schutzimpfung auf. Betroffen waren vor allem Frauen < 55 Jahren, die Komplikationen sind aber weder auf Frauen noch auf diese Altersgruppe beschr\u00e4nkt. Es gibt bisher keine Hinweise, dass Patientinnen mit vorbestehenden, heredit\u00e4ren oder erworbenen Gerinnungsst\u00f6rungen ein erh\u00f6htes Risiko f\u00fcr diese Komplikationen haben [ [17](#CR1974)]. In der DGHO-Empfehlung wird ein Diagnostikschema im Verdachtsfall und eine Therapieempfehlung vorgegeben. Die H\u00e4ufigkeit dieser Komplikation ist unklar, momentan wird von einer Inzidenz von 1:40.000 bis 1:100.000 ausgegangen. Nachdem in den USA \u00e4hnliche Komplikationen auch f\u00fcr den Impfstoff von Johnson & Johnson berichtet wurden, scheint es wahrscheinlich, dass der adenovirale Vektor generell f\u00fcr diese Komplikation verantwortlich ist [ [18](#CR1978)].\nDie europ\u00e4ische Zulassungsbeh\u00f6rde EMA sieht trotzdem generell weiter \u00fcberwiegend Vorteile f\u00fcr die Impfung mit diesem Typ Impfstoff, die die Nachteile \u00fcberwiegen. Die St\u00e4ndige Impfkommission (STIKO) hat sich daf\u00fcr entschieden, adenovirale Vektorimpfstoffe nur f\u00fcr Menschen \u00fcber 60 Jahren zu empfehlen, da diese eine deutlich h\u00f6here Wahrscheinlichkeit als J\u00fcngere haben, an COVID-19 zu versterben.\nIn den Zulassungsstudien zum Oxford/AstraZeneca-Impfstoff gab es eine gewisse Verwirrung, weil unterschiedliche Dosierungen verwendet wurden und die niedrige Dosierung eine bessere Effektivit\u00e4t zu zeigen schien [\n[19](#CR1982), [20](#CR1986)]. Bei der Nachanalyse fiel jedoch auf, dass in verschiedenen L\u00e4ndern unterschiedliche Zeitpunkte f\u00fcr die Boostergabe genutzt wurden: War der Zeitabstand f\u00fcr die zweite Impfung l\u00e4nger als 6 Wochen, war die Impfantwort besser. Wahrscheinlich war die Frage des Abstands f\u00fcr die unterschiedliche Impfeffektivit\u00e4t wesentlicher als die Frage der Dosierung. Die STIKO empfahl daher bis jetzt die Zweitimpfung nach 9-12 Wochen. Wie nach dem Stopp der Impfung mit diesem Impfstoff bei unter 60-J\u00e4hrigen im Hinblick auf die Zweitimpfung vorgegangen werden soll, ist unklar. Die STIKO hat eine Zweitimpfung mit anderen Impfstoffen ins Gespr\u00e4ch gebracht - Daten, die Wirksamkeit und Sicherheit eines solchen Vorgehens belegen, gibt es allerdings zurzeit nicht. M\u00f6glicherweise besteht bei einer nebenwirkungsfreien Erstimpfung mit adenoviralen Impfstoffen keine Gefahr, dass es bei Zweitimpfungen zu Komplikationen kommt. Da in Gro\u00dfbritannien zurzeit mit dem Oxford/AstraZeneca-Impfstoff in gro\u00dfem Stil zweitgeimpft wird, werden wir hier in K\u00fcrze entsprechende Daten bekommen.\nF\u00fcr den Oxford/AstraZeneca-Impfstoff steigt die Effektivit\u00e4t nach der ersten Impfung t\u00e4glich an und erreicht nach 4-5 Wochen in bisher nur als Preprint publizierten \"Real-Life-Studien\" aus England [\n[10](#CR1944)] und Schottland [ [21](#CR1994)] eine Effektivit\u00e4t zwischen 60 und 90 %. Allerdings zeigen beide Studien, dass die Zahl der schweren, eine Krankenhausaufnahme oder eine Intensivbehandlung erfordernde COVID-19-F\u00e4lle auf fast null zur\u00fcckgeht, sie best\u00e4tigen damit die Zulassungsstudien. Zumindest gegen\u00fcber der britischen SARS-CoV-2-Variante B.1.1.7, die inzwischen auch in Deutschland dominant ist, zeigt dieser Impfstoff zwar in vitro eine reduzierte Aktivit\u00e4t neutralisierender Antik\u00f6rper, jedoch klinisch eine Aktivit\u00e4t, die der der klassischen Virusvariante vergleichbar ist [ [22](#CR1998)].\nF\u00fcr den Impfstoff der Firma Johnson & Johnson, der ein Adenovirus 26 als Vektor nutzt, wurden bisher nur die Daten aus den Phase-I- und -II-Studien [\n[23](#CR2002)] sowie Immunogenit\u00e4tsdaten [ [24](#CR2006)] publiziert. Diese zeigen eine Effektivit\u00e4t von knapp 70 %. M\u00f6glicherweise braucht es bei diesem Impfstoff keine Boosterimpfung, was die Logistik der Impfung deutlich erleichtern w\u00fcrde.\nIn China wurde von der Firma CanSino in Peking ein Impfstoff entwickelt, der ein Adenovirus 5 als Vektor nutzt. Dieser Impfstoff wird in China und angrenzenden L\u00e4ndern breit verimpft. Daten zur Wirksamkeit wurden bisher nicht publiziert. Mehrere s\u00fcdamerikanische L\u00e4nder (Chile, Uruguay) haben ihr Impfprogramm auf diesem Impfstoff aufgebaut. Inzwischen h\u00e4ufen sich in Anbetracht steigender Fallzahlen in diesen L\u00e4ndern Zweifel an dessen Wirksamkeit. Die Effektivit\u00e4t scheint im Bereich von 50 % (oder darunter) zu liegen, der Grenzwert, den die WHO als Minimum f\u00fcr einen effektiven Impfstoff festgelegt hat. Ob die schlechte Wirksamkeit mit der zunehmenden Ausbreitung der brasilianischen Variante in S\u00fcdamerika zu tun hat, ist unklar.\nRussland hat bereits im Sommer seinen Sputnik V genannten Impfstoff pr\u00e4sentiert, der au\u00dfer in Russland auch in Ungarn und Serbien verimpft wird. F\u00fcr diesen Impfstoff werden sowohl Adenovirus-5- als auch Adenovirus-26-Vektoren verwendet. In einer gerade publizierten Arbeit war die Effektivit\u00e4t mit \u00fcber 90 % \u00fcberraschend hoch, allerdings wurde kein vollst\u00e4ndiges Studienprotokoll mit der Publikation vorgelegt [\n[25](#CR2010)]. Der russische Impfstoff wird momentan von der europ\u00e4ischen Arzneimittelbeh\u00f6rde evaluiert. Ob bei beiden letztgenannten Impfstoffen auch mit den f\u00fcr den Oxford/AstraZeneca beschriebenen Gerinnungskomplikationen gerechnet werden muss, ist unklar, aber durchaus m\u00f6glich.\nProteinbasierte Impfstoffe\nDas Prinzip der proteinbasierten Impfstoffe ist aus der Influenzaimpfstoffentwicklung gut bekannt. F\u00fcr die Immunantwort relevante Proteine werden injiziert und von den antigenpr\u00e4sentierenden Zellen aufgenommen, die dann die Immunreaktion induzieren. F\u00fcr eine ausreichende Immunantwort braucht es jedoch in der Regel ein das Immunsystem stimulierendes Adjuvans.\nDie Europ\u00e4ische Union hat gro\u00dfe Hoffnungen in den von Sanofi Aventis zusammen mit GSK entwickelten Impfstoff gesetzt, der jedoch in klinischen Studien keine ausreichende Effektivit\u00e4t zeigte. Wahrscheinlich wurde hier insgesamt zu wenig Antigen injiziert. Es wird jetzt versucht, mit einer anderen Dosierung eine bessere Effektivit\u00e4t zu erreichen, allerdings ist in diesem Jahr nicht mehr mit Ergebnissen zu rechnen.\nHoffnungsvoller ist der Impfstoff der Firma Novavax (mit einem MatrixM1-Adjuvans), der in Australien in einer Phase-III-Studie getestet wurde. F\u00fcr diesen Impfstoff pr\u00fcft die Europ\u00e4ische Arzneimittelbeh\u00f6rde zurzeit die vorliegenden Daten.\nDas Sicherheitsprofil der proteinbasierten Impfstoffe entspricht dem der beiden anderen Impfstofftechnologien.\nAlle genannten Impfstoffe haben keine Zulassung f\u00fcr Kinder und Jugendliche und f\u00fcr Schwangere, allerdings haben inzwischen in beiden Bereichen Studien begonnen, die eine Effektivit\u00e4t vermuten lassen.\nBei Patienten, die nachweislich eine COVID-19-Erkrankung durchgemacht haben, wird zurzeit eine Impfung nach 6 Monaten empfohlen, um vorher \u00fcberschie\u00dfende Immunreaktionen zu vermeiden.\nProf. Dr. med. Tobias Welte\nKlinik f\u00fcr Pneumologie\nMedizinische Hochschule Hannover\nCarl-Neuberg-Stra\u00dfe 1\n30659 Hannover\nwelte.tobias@mh-hannover.de\nLiteratur\n[PubMed](https://pubmed.ncbi.nlm.nih.gov/32704139)] [PubMed](https://pubmed.ncbi.nlm.nih.gov/33420405)] [PMC free article](/pmc/articles/PMC7754704/)] [ [PubMed](https://pubmed.ncbi.nlm.nih.gov/33353987)] [PubMed](https://pubmed.ncbi.nlm.nih.gov/33782619)] [ [CrossRef](//doi.org/10.1038%2Fs41591-021-01316-7)] [PMC free article](/pmc/articles/PMC7553736/)] [ [PubMed](https://pubmed.ncbi.nlm.nih.gov/33065034)] [PMC free article](/pmc/articles/PMC7556339/)] [ [PubMed](https://pubmed.ncbi.nlm.nih.gov/32991794)] [PMC free article](/pmc/articles/PMC7787219/)] [ [PubMed](https://pubmed.ncbi.nlm.nih.gov/33378609)] [PMC free article](/pmc/articles/PMC7583697/)] [ [PubMed](https://pubmed.ncbi.nlm.nih.gov/33053279)] [PMC free article](/pmc/articles/PMC7745181/)] [ [PubMed](https://pubmed.ncbi.nlm.nih.gov/33301246)] [https://www.medrxiv.org/content/10.1101/2021.03.01.21252652v1](https://www.medrxiv.org/content/10.1101/2021.03.01.21252652v1), Zugriff am 6.4.2021 [PMC free article](/pmc/articles/PMC7944975/)] [ [PubMed](https://pubmed.ncbi.nlm.nih.gov/33626250)] [ [CrossRef](//doi.org/10.1056%2FNEJMoa2101765)] [PMC free article](/pmc/articles/PMC8524784/)] [ [PubMed](https://pubmed.ncbi.nlm.nih.gov/33822494)] [ [CrossRef](//doi.org/10.1056%2FNEJMc2102017)] [PMC free article](/pmc/articles/PMC7944950/)] [ [PubMed](https://pubmed.ncbi.nlm.nih.gov/33684280)] [PMC free article](/pmc/articles/PMC8013422/)] [ [PubMed](https://pubmed.ncbi.nlm.nih.gov/33452689)] [ [CrossRef](//doi.org/10.1111%2Fall.14739)] [PubMed](https://pubmed.ncbi.nlm.nih.gov/33277981)] [PMC free article](/pmc/articles/PMC8095372/)] [ [PubMed](https://pubmed.ncbi.nlm.nih.gov/33835769)] [ [CrossRef](//doi.org/10.1056%2FNEJMoa2104840)] [https://www.dgho.de/publikationen/stellungnahmen/gute-aerztliche-praxis/coronavirus/](https://www.dgho.de/publikationen/stellungnahmen/gute-aerztliche-praxis/coronavirus/)astrazeneca-vakzine-gerinnungsstoerungen-20210330.pdf [PMC free article](/pmc/articles/PMC7674972/)] [ [PubMed](https://pubmed.ncbi.nlm.nih.gov/33220855)] [https://www.nytimes.com/2021/04/13/us/politics/johnson-johnson-vaccine-blood-clots-fda-cdc.html](https://www.nytimes.com/2021/04/13/us/politics/johnson-johnson-vaccine-blood-clots-fda-cdc.html), letzter Zugriff 18.4.2021 [PMC free article](/pmc/articles/PMC7723445/)] [ [PubMed](https://pubmed.ncbi.nlm.nih.gov/33306989)] [https://ssrn.com/abstract=3789264](https://ssrn.com/abstract=3789264) [PMC free article](/pmc/articles/PMC8009612/)] [ [PubMed](https://pubmed.ncbi.nlm.nih.gov/33798499)] [ [CrossRef](//doi.org/10.1016%2FS0140-6736(21)00628-0)] [PMC free article](/pmc/articles/PMC7821985/)] [ [PubMed](https://pubmed.ncbi.nlm.nih.gov/33440088)] [ [CrossRef](//doi.org/10.1056%2FNEJMoa2034201)] [PMC free article](/pmc/articles/PMC7953339/)] [ [PubMed](https://pubmed.ncbi.nlm.nih.gov/33704352)] [ [CrossRef](//doi.org/10.1001%2Fjama.2021.3645)] [PMC free article](/pmc/articles/PMC7471804/)] [ [PubMed](https://pubmed.ncbi.nlm.nih.gov/32896291)]", "language": null, "image": "https://www.ncbi.nlm.nih.gov/corehtml/pmc/pmcgifs/pmc-card-share.jpg?_=0", "pagetype": "article", "links": ["#main-content", "https://www.ncbi.nlm.nih.gov/", "https://account.ncbi.nlm.nih.gov", "/myncbi/", "/myncbi/collections/bibliography/", "/account/settings/", "/account/signout/", "https://www.ncbi.nlm.nih.gov/guide/browsers/#ncbi_accesskeys", "https://www.ncbi.nlm.nih.gov", "/myncbi/", "#maincontent", "#", "/pmc/", "https://www.ncbi.nlm.nih.gov/pmc/advanced", "/pmc/about/userguide/", "/pmc/journals/", "/pmc/?term=Springer%20Nature%20PMC%20COVID-19%20Collection[filter]", "/pmc/articles/PMC8204600/?report=reader", "/pmc/articles/PMC8204600/pdf/15033_2021_Article_2716.pdf", "#", "https://twitter.com/intent/tweet?url=https%3A%2F%2Fwww.ncbi.nlm.nih.gov%2Fpmc%2Farticles%2FPMC8204600%2F&text=Impfstoffe%20gegen%20das%20SARS-Coronavirus-2", "https://www.facebook.com/sharer/sharer.php?u=https%3A%2F%2Fwww.ncbi.nlm.nih.gov%2Fpmc%2Farticles%2FPMC8204600%2F", "/pmc/journals/", "/pmc/?term=Springer%20Nature%20PMC%20COVID-19%20Collection[filter]", "/pmc/about/disclaimer/", "/pmc/about/copyright/", "//doi.org/10.1007%2Fs15033-021-2716-x", "https://pubmed.ncbi.nlm.nih.gov/34149947", "https://pubmed.ncbi.nlm.nih.gov/?term=Welte%20T%5BAuthor%5D", "https://pubmed.ncbi.nlm.nih.gov/?term=Welte%20T%5BAuthor%5D", "#", "#", "/pmc/about/disclaimer/", "mailto:dev@null", "/pmc/about/copyright/", "/pmc/articles/PMC8204600/figure/Fig1/", "/core/lw/2.0/html/tileshop_pmc/tileshop_pmc_inline.html?title=Click%20on%20image%20to%20zoom&p=PMC3&id=8204600_15033_2021_2716_Fig1_HTML.jpg", "/pmc/articles/PMC8204600/figure/Fig1/?report=objectonly", "/pmc/articles/PMC8204600/figure/Fig2/", "/pmc/articles/PMC8204600/figure/Fig3/", "#CR1908", "#CR1912", "/pmc/articles/PMC8204600/figure/Fig2/", "/core/lw/2.0/html/tileshop_pmc/tileshop_pmc_inline.html?title=Click%20on%20image%20to%20zoom&p=PMC3&id=8204600_15033_2021_2716_Fig2_HTML.jpg", "/pmc/articles/PMC8204600/figure/Fig2/?report=objectonly", "/pmc/articles/PMC8204600/figure/Fig3/", "/core/lw/2.0/html/tileshop_pmc/tileshop_pmc_inline.html?title=Click%20on%20image%20to%20zoom&p=PMC3&id=8204600_15033_2021_2716_Fig3_HTML.jpg", "/pmc/articles/PMC8204600/figure/Fig3/?report=objectonly", "/pmc/articles/PMC8204600/table/Tab1/", "/pmc/articles/PMC8204600/table/Tab1/?report=objectonly", "/pmc/articles/PMC8204600/figure/Fig4/", "#CR1916", "/pmc/articles/PMC8204600/figure/Fig4/", "/core/lw/2.0/html/tileshop_pmc/tileshop_pmc_inline.html?title=Click%20on%20image%20to%20zoom&p=PMC3&id=8204600_15033_2021_2716_Fig4_HTML.jpg", "/pmc/articles/PMC8204600/figure/Fig4/?report=objectonly", "#CR1920", "#CR1924", "#CR1928", "#CR1932", "#CR1936", "#CR1940", "#CR1944", "#CR1948", "#CR1952", "#CR1956", "#CR1960", "#CR1964", "#CR1924", "#CR1970", "#CR1974", "#CR1978", "#CR1982", "#CR1986", "#CR1944", "#CR1994", "#CR1998", "#CR2002", "#CR2006", "#CR2010", "https://pubmed.ncbi.nlm.nih.gov/32704139", "https://pubmed.ncbi.nlm.nih.gov/33420405", "/pmc/articles/PMC7754704/", "https://pubmed.ncbi.nlm.nih.gov/33353987", "https://pubmed.ncbi.nlm.nih.gov/33782619", "//doi.org/10.1038%2Fs41591-021-01316-7", "/pmc/articles/PMC7553736/", "https://pubmed.ncbi.nlm.nih.gov/33065034", "/pmc/articles/PMC7556339/", "https://pubmed.ncbi.nlm.nih.gov/32991794", "/pmc/articles/PMC7787219/", "https://pubmed.ncbi.nlm.nih.gov/33378609", "/pmc/articles/PMC7583697/", "https://pubmed.ncbi.nlm.nih.gov/33053279", "/pmc/articles/PMC7745181/", "https://pubmed.ncbi.nlm.nih.gov/33301246", "https://www.medrxiv.org/content/10.1101/2021.03.01.21252652v1", "/pmc/articles/PMC7944975/", "https://pubmed.ncbi.nlm.nih.gov/33626250", "//doi.org/10.1056%2FNEJMoa2101765", "/pmc/articles/PMC8524784/", "https://pubmed.ncbi.nlm.nih.gov/33822494", "//doi.org/10.1056%2FNEJMc2102017", "/pmc/articles/PMC7944950/", "https://pubmed.ncbi.nlm.nih.gov/33684280", "/pmc/articles/PMC8013422/", "https://pubmed.ncbi.nlm.nih.gov/33452689", "//doi.org/10.1111%2Fall.14739", "https://pubmed.ncbi.nlm.nih.gov/33277981", "/pmc/articles/PMC8095372/", "https://pubmed.ncbi.nlm.nih.gov/33835769", "//doi.org/10.1056%2FNEJMoa2104840", "https://www.dgho.de/publikationen/stellungnahmen/gute-aerztliche-praxis/coronavirus/", "/pmc/articles/PMC7674972/", "https://pubmed.ncbi.nlm.nih.gov/33220855", "https://www.nytimes.com/2021/04/13/us/politics/johnson-johnson-vaccine-blood-clots-fda-cdc.html", "/pmc/articles/PMC7723445/", "https://pubmed.ncbi.nlm.nih.gov/33306989", "https://ssrn.com/abstract=3789264", "/pmc/articles/PMC8009612/", "https://pubmed.ncbi.nlm.nih.gov/33798499", "//doi.org/10.1016%2FS0140-6736(21)00628-0", "/pmc/articles/PMC7821985/", "https://pubmed.ncbi.nlm.nih.gov/33440088", "//doi.org/10.1056%2FNEJMoa2034201", "/pmc/articles/PMC7953339/", "https://pubmed.ncbi.nlm.nih.gov/33704352", "//doi.org/10.1001%2Fjama.2021.3645", "/pmc/articles/PMC7471804/", "https://pubmed.ncbi.nlm.nih.gov/32896291", "/pmc/articles/PMC8204600/?report=reader", "/pmc/articles/PMC8204600/pdf/15033_2021_Article_2716.pdf", "#", "https://twitter.com/intent/tweet?url=https%3A%2F%2Fwww.ncbi.nlm.nih.gov%2Fpmc%2Farticles%2FPMC8204600%2F&text=Impfstoffe%20gegen%20das%20SARS-Coronavirus-2", "https://www.facebook.com/sharer/sharer.php?u=https%3A%2F%2Fwww.ncbi.nlm.nih.gov%2Fpmc%2Farticles%2FPMC8204600%2F", "#", "https://twitter.com/ncbi", "https://www.facebook.com/ncbi.nlm", "https://www.linkedin.com/company/ncbinlm", "https://github.com/ncbi", "https://ncbiinsights.ncbi.nlm.nih.gov/", "https://www.nlm.nih.gov/socialmedia/index.html", "https://twitter.com/NLM_NIH", "https://www.facebook.com/nationallibraryofmedicine", "https://www.youtube.com/user/NLMNIH", "https://www.google.com/maps/place/8600+Rockville+Pike,+Bethesda,+MD+20894/@38.9959508,-77.101021,17z/data=!3m1!4b1!4m5!3m4!1s0x89b7c95e25765ddb:0x19156f88b27635b8!8m2!3d38.9959508!4d-77.0988323", "https://www.nlm.nih.gov/web_policies.html", "https://www.nih.gov/institutes-nih/nih-office-director/office-communications-public-liaison/freedom-information-act-office", "https://www.hhs.gov/vulnerability-disclosure-policy/index.html", "https://support.nlm.nih.gov/", "https://www.nlm.nih.gov/accessibility.html", "https://www.nlm.nih.gov/careers/careers.html", "//www.nlm.nih.gov/", "https://www.nih.gov/", "https://www.hhs.gov/", "https://www.usa.gov/"]}