{"title": "Auf die Pl\u00e4tze, fertig, piks?", "author": "Britta Verlinden", "url": "https://blog.amboss.com/de/kinderimpfung", "hostname": "amboss.com", "description": "Neues Jahr, neue Erkenntnisse: Warum die COVID-Impfung von Kindern nicht nur sicher und sinnvoll, sondern wom\u00f6glich auch dringend geboten ist.", "sitename": "blog.amboss.com", "date": "2022-01-14", "id": null, "license": null, "body": null, "comments": "", "commentsbody": null, "raw_text": null, "text": "Auf die Pl\u00e4tze, fertig, piks?\n[Britta Verlinden](https://blog.amboss.com/de/author/britta-verlinden)- Freitag, 14.1.2022\nNeues Jahr, neue Erkenntnisse: Warum die COVID-Impfung von Kindern nicht nur sicher und sinnvoll, sondern wom\u00f6glich auch dringend geboten ist.\nAm 9. Dezember war es endlich so weit: Die STIKO\n[ver\u00f6ffentlichte ihre Stellungnahme](https://www.rki.de/DE/Content/Kommissionen/STIKO/Empfehlungen/PM_2021-12-09.html) zur COVID-Impfung von Kindern im Alter von f\u00fcnf bis elf Jahren. Darin empfiehlt sie ausdr\u00fccklich die Immunisierung von Kindern mit Vorerkrankungen wie Adipositas, Diabetes oder Krebs. Auch f\u00fcr Kinder im Umfeld besonders gef\u00e4hrdeter, etwa hochbetagter oder immunsupprimierter Personen wird die Impfung empfohlen. Allerdings k\u00f6nnen \u201ebei individuellem Wunsch\u201c auch alle anderen F\u00fcnf- bis Elfj\u00e4hrigen geimpft werden \u2013 Voraussetzung: eine ausf\u00fchrliche \u00e4rztliche Aufkl\u00e4rung. Welche Informationen sind jetzt f\u00fcr die Impfberatung entscheidend?\nPrimum non nocere: Der Impfstoff ist sicher\nWie bereits in der\n[Zulassungsstudie](https://www.nejm.org/doi/full/10.1056/NEJMoa2116298) hat sich die Impfung auch nach millionenfacher Anwendung in der Praxis als sehr sicher erwiesen. Das zeigt eine [Auswertung von Impfnebenwirkungen durch die US-Gesundheitsbeh\u00f6rde CDC](https://www.cdc.gov/vaccines/acip/meetings/downloads/slides-2022-01-05/02-COVID-Su-508.pdf): Im Untersuchungszeitraum wurden \u00fcber acht Millionen Dosen verimpft. Wo Nebenwirkungen gemeldet wurden, waren sie in 98% der F\u00e4lle leicht. Bei zw\u00f6lf Kindern trat eine Myokarditis auf \u2013 im Vergleich zu Jugendlichen und jungen Erwachsenen ist das Risiko einer Herzmuskelentz\u00fcndung f\u00fcr diese Altersgruppe also deutlich geringer. Das k\u00f6nnte mit der Dosis zusammenh\u00e4ngen: Kinder erhalten zweimal je 10 \u00b5g des BioNTech/Pfizer-Vakzins Comirnaty, also ein Drittel der Menge, die f\u00fcr alle ab zw\u00f6lf Jahren vorgesehen ist.\nKinder erkranken seltener als Erwachsene \u2013 aber sie erkranken\nNun gilt es, die Impfnebenwirkungen gegen die Risiken einer Infektion abzuw\u00e4gen. Hier ist die Lage auch nach zwei Jahren Pandemie nicht eindeutig. Doch bevor es um Komplikationen wie PIMS, Long-COVID und neu aufgetretenen Diabetes geht, zun\u00e4chst ein Blick auf die Zahlen von Infektionen, Krankenhausaufnahmen, Intensivbehandlungen und t\u00f6dlichen Verl\u00e4ufen:\nDem\n[RKI](https://survstat.rki.de/) wurden bislang rund 700.000 positiv getestete Kinder zwischen f\u00fcnf und elf Jahren gemeldet. Etwa 16% aller im [freiwilligen COVID-19-Survey der DGPI](https://dgpi.de/covid-19-survey-update/#alter-in-jahren) erfassten station\u00e4r-p\u00e4diatrischen Behandlungen entfielen auf diese Altersgruppe. Seit Beginn des Jahres liegen [laut Intensivregister](https://www.intensivregister.de/#/aktuelle-lage/zeitreihen) jeden Tag mindestens 27 Minderj\u00e4hrige wegen COVID-19 auf der Intensivstation. Insgesamt sind [laut RKI](https://www.rki.de/DE/Content/InfAZ/N/Neuartiges_Coronavirus/Situationsberichte/Wochenbericht/Wochenberichte_Tab.html) mindestens 41 Kinder und Jugendliche im Zusammenhang mit einer Corona-Infektion gestorben.\nDiese Zahlen stehen nat\u00fcrlich in keinem Verh\u00e4ltnis zu denen der Erwachsenen. Umso relevanter ist es, sie im Kontext der sonst sehr guten Kindergesundheit zu betrachten: So z\u00e4hlt COVID-19 bei F\u00fcnf- bis Elfj\u00e4hrigen in den USA mittlerweile zu den\n[h\u00e4ufigsten Todesursachen](https://www.cdc.gov/vaccines/acip/meetings/downloads/slides-2021-11-2-3/03-COVID-Jefferson-508.pdf). In Europa m\u00fcssen [einer Vorabver\u00f6ffentlichung des European Centre for Disease Prevention and Control zufolge](https://www.medrxiv.org/content/10.1101/2021.11.25.21266875v1) etwa 1,2% der symptomatisch erkrankten Kinder und Jugendlichen ins Krankenhaus; 0,08% werden intensivpflichtig und 0,01% versterben. Wichtig zu wissen: Drei von vier hospitalisierten F\u00fcnf- bis Elfj\u00e4hrigen hatten [dieser Auswertung zufolge](https://www.medrxiv.org/content/10.1101/2021.11.25.21266875v1) keinerlei Vorerkrankungen. [Eine noch nicht begutachtete deutsche Studie](https://www.medrxiv.org/content/10.1101/2021.11.30.21267048v1) kam wiederum zu dem Schluss, dass gesunde F\u00fcnf- bis Elfj\u00e4hrige am wenigsten von schweren COVID-19-Verl\u00e4ufen betroffen sind. Die Mortalit\u00e4t lie\u00df sich nicht berechnen, da im ausgewerteten Zeitraum kein vormals gesundes Kind dieser Altersgruppe verstorben war.\nKinder zwischen f\u00fcnf und elf Jahren haben das h\u00f6chste PIMS-Risiko\nDie gleiche\n[Studie](https://www.medrxiv.org/content/10.1101/2021.11.30.21267048v1) warnt allerdings vor dem p\u00e4diatrischen inflammatorischen Multiorgansyndrom (PIMS). Dabei kommt es wenige Wochen nach einer Ansteckung \u2013 die auch asymptomatisch verlaufen kann \u2013 zu einer hyperinflammatorischen Immunreaktion, die \u00dcberschneidungen mit dem Kawasaki- und dem Toxic-Shock-Syndrom zeigt und meist eine intensivmedizinische Behandlung erfordert. Das Risiko, nach einer SARS-CoV-2-Infektion ein PIMS zu entwickeln, liegt laut den vorl\u00e4ufigen Daten dieser Studie bei 1 zu 4.000; in der Mehrzahl der aufgetretenen F\u00e4lle seien keinerlei Vorerkrankungen bekannt gewesen. In Deutschland hat die DGPI mit ihrem freiwilligen [PIMS-Register](https://dgpi.de/pims-survey-update/#alter-pims) bislang 549 F\u00e4lle erfasst, bei knapp der H\u00e4lfte der Betroffenen (49%) handelte es sich um Kinder zwischen f\u00fcnf und elf Jahren.\nLong-COVID und andere Langzeitfolgen einer Infektion\nZu Long-COVID bei Kindern gibt es gro\u00dfe Wissensl\u00fccken. Verschiedene Forschungsgruppen weisen darauf hin, dass sich Symptome wie Konzentrationsschwierigkeiten nur schwer von pandemiebedingten Problemen abgrenzen lassen, die auch Kinder ohne SARS-CoV-2-Nachweis belasten. Als Long-COVID-Symptome gelten au\u00dferdem M\u00fcdigkeit, St\u00f6rungen von Geruchs- und Geschmackssinn, Schwindel, Muskelschw\u00e4che und Atemprobleme. An diesen Symptomen litten\n[laut einer aktuellen d\u00e4nischen Studie](https://pubmed.ncbi.nlm.nih.gov/35000003/) 0,8% der teilnehmenden SARS-CoV-2-positiven Kinder und Jugendlichen noch mindestens vier Wochen nach der Infektion. [Einer gro\u00dfen britischen Studie zufolge](https://www.researchsquare.com/article/rs-798316/v1) k\u00f6nnten hingegen bis zu 14% aller infizierten Kinder und Jugendlichen an Long-COVID leiden \u2013 und zwar auch noch 15 Wochen nach der Ansteckung. Von Erwachsenen ist bekannt, dass Langzeitsymptome grunds\u00e4tzlich auch bei Infizierten auftreten k\u00f6nnen, die einen initial milden Krankheitsverlauf hatten. [PET-Scan-Aufnahmen](https://link.springer.com/article/10.1007/s00259-021-05528-4) konnten sowohl bei Kindern als auch bei Erwachsenen Ver\u00e4nderungen im Hirnstoffwechsel nachweisen, die mit der Schwere von Long-COVID-Symptomen korrelierten.\nDas\n[RKI ordnet](https://www.rki.de/SharedDocs/FAQ/COVID-Impfen/FAQ_Liste_Impfung_Kinder_Jugendliche.html) sowohl Long-COVID als auch PIMS als Krankheitsbilder ein, \u201ederen Langzeitprognosen noch nicht endg\u00fcltig bekannt\u201c seien. Indes kristallisiert sich eine weitere m\u00f6gliche Komplikation heraus: So scheint eine Corona-Infektion bei Kindern und Jugendlichen \u2013 wie [bei Erwachsenen](/de/covid-diabetes) \u2013 das Diabetesrisiko zu erh\u00f6hen. Minderj\u00e4hrige, die sich mit SARS-CoV-2 infiziert hatten, entwickelten [einer Analyse der CDC zufolge](https://www.cdc.gov/mmwr/volumes/71/wr/mm7102e2.htm?s_cid=mm7102e2_w) 2,5-mal h\u00e4ufiger einen Diabetes mellitus Typ 1 als gesunde Gleichaltrige.\nWie gut sch\u00fctzt die Impfung vor diesen Komplikationen?\nOb die Impfung F\u00fcnf- bis Elfj\u00e4hrige vor diesen Komplikationen sch\u00fctzt, l\u00e4sst sich bislang nicht feststellen. Erkenntnisse aus anderen Altersgruppen sprechen aber daf\u00fcr. So hat eine\n[franz\u00f6sische Studie ](https://jamanetwork.com/journals/jama/fullarticle/2787495)den Impfstatus von Jugendlichen untersucht, die zwischen September und Oktober 2021 mit PIMS ins Krankenhaus bzw. auf die Intensivstation kamen: Niemand der 33 Betroffenen war zweifach geimpft. Eine [Auswertung der CDC](https://www.cdc.gov/mmwr/volumes/71/wr/mm7102e1.htm?s_cid=mm7102e1_w) hat ergeben, dass die doppelte Impfung von Zw\u00f6lf- bis 17-J\u00e4hrigen ihr PIMS-Risiko um 91% reduziert.\nKann das PIMS auch nach der Impfung auftreten? Hier hat die US-Gesundheitsbeh\u00f6rde ebenfalls\n[neue Erkenntnisse](https://www.medrxiv.org/content/10.1101/2022.01.03.22268681v1) geliefert: Unter rund 21 Millionen Geimpften identifizierten die Forschenden 21 Jugendliche mit PIMS. Zwei Drittel von ihnen hatten sich jedoch zuvor mit dem Virus infiziert. Ohne serologisch nachweisbare vorherige Infektion lag die PIMS-Inzidenz geimpfter Jugendlicher bei 0,3 F\u00e4llen je einer Million geimpfter Personen, also einer extrem niedrigen Rate im Vergleich zur H\u00e4ufigkeit des PIMS nach Infektion.\nAuch auf Long-COVID scheint sich die Impfung positiv auszuwirken. So hat\n[eine als Preprint vorab ver\u00f6ffentlichte israelische Studie](https://www.medrxiv.org/content/10.1101/2022.01.05.22268800v1) 951 Personen beobachtet, die sich infiziert hatten und von denen zwei Drittel anschlie\u00dfend den Impfstoff erhielten. Binnen vier Monaten besserten sich die meisten der Long-COVID-Symptome \u2013 um etwa 60% im Vergleich zu den Symptomen jener Teilnehmenden, die nicht geimpft wurden.\nAber wenn Omikron doch nun f\u00fcr mildere Krankheitsverl\u00e4ufe sorgt?\nZum einen bedeutet \u201emilder\u201c nicht \u201emild\u201c. Zum anderen: Selbst wenn Omikron-Erkrankungen komplikations\u00e4rmer verlaufen, kann es durch die gro\u00dfe Zahl Infizierter dennoch zu Versorgungsengp\u00e4ssen kommen. Davor warnt etwa der Expertenrat der Bundesregierung\n[in seiner j\u00fcngsten Stellungnahme](https://www.bundesregierung.de/resource/blob/997532/1995094/0e24018c4ce234c5b9e40a83ce1b3892/2022-01-06-zweite-stellungnahme-expertenrat-data.pdf?download=1) \u2013 und zwar \u201egerade im Bereich der Kinderkliniken\u201c.\nTats\u00e4chlich gab es zun\u00e4chst aus\n[S\u00fcdafrika](https://www.medrxiv.org/content/10.1101/2021.12.21.21268108v1), dann aus [Gro\u00dfbritannien](https://inews.co.uk/news/covid-hospital-admissions-rise-children-under-five-numbers-older-groups-1389365) und aktuell auch aus den [USA](https://www.aap.org/en/pages/2019-novel-coronavirus-covid-19-infections/children-and-covid-19-state-level-data-report/) Berichte \u00fcber steil ansteigende Hospitalisierungsraten erkrankter Kinder. Und w\u00e4hrend die Omikron-Welle im sommerlichen S\u00fcdafrika bereits wieder abklingt, geht sie hierzulande parallel zum Schulstart nach den Ferien gerade erst los. Weil die Impfung auch bei Omikron zuverl\u00e4ssig vor schweren Verl\u00e4ufen sch\u00fctzt, empfiehlt der Expertenrat, die Impfkampagne zu intensivieren \u2013 und zwar ausdr\u00fccklich \u201ein allen Altersgruppen\u201c.\nDie European Pediatric Association betonte k\u00fcrzlich\n[in einem Kommentar](https://www.jpeds.com/article/S0022-3476(21)01273-7/fulltext): \u201eDie Impfung von Kindern und Jugendlichen sch\u00fctzt vor den Risiken einer SARS-CoV-2-Infektion und ihren kurz- und langfristigen Komplikationen.\u201c Auch die deutschen kinder\u00e4rztlichen Fachgesellschaften und Verb\u00e4nde [DGKJ, DGPI und BVKJ](https://dgpi.de/kinder-omikron-variante/) pochen neben der Einhaltung der [S3-Leitlinie f\u00fcr sichere Schulen](https://www.awmf.org/leitlinien/detail/ll/027-076.html) auf \u201edie m\u00f6glichst komplette Durchimpfung\u201c aller, f\u00fcr die ein Impfangebot besteht.\nBislang sind dem\n[Impfquoten-Monitoring des RKI](https://www.rki.de/DE/Content/InfAZ/N/Neuartiges_Coronavirus/Daten/Impfquotenmonitoring.html) zufolge eine halbe Million p\u00e4diatrische Dosen verabreicht worden. F\u00fcr die zweite Januarwoche hatten [laut kassen\u00e4rztlicher Bundesvereinigung](https://www.kbv.de/html/1150_56316.php) allerdings mehr als 10.000 \u00c4rztinnen und \u00c4rzte Kinderimpfstoff bestellt; insgesamt sollten 600.000 Dosen an die Praxen und weitere 400.000 an Impfzentren geliefert werden. Es ist also zu hoffen, dass der Anteil geimpfter Kinder zwischen f\u00fcnf und elf Jahren hierzulande in naher Zukunft deutlich steigen wird.\nErfahrungen andernorts zeigen, wie sinnvoll diese Vorbereitungen sind: Laut der\n[New Yorker Gesundheitsbeh\u00f6rde](https://www.health.ny.gov/press/releases/2022/2022-01-07_pediatric_hospitalizations.htm) stiegen vor Weihnachten die Krankenhauseinweisungen von Kindern im Vergleich zu den Vorwochen um das Vierfache \u2013 91% der Kinder zwischen f\u00fcnf und elf Jahren, die mit COVID-19 ins Krankenhaus kamen, waren nicht geimpft. \u00dcber die H\u00e4lfte der eingelieferten Kinder waren allerdings j\u00fcnger als f\u00fcnf.\n|\n|\nImpfungen gegen SARS-CoV-2 sind die wichtigste Ma\u00dfnahme zur Eind\u00e4mmung und Kontrolle der weltweiten COVID-19-Pandemie. Eine ausf\u00fchrliche \u00dcbersicht \u00fcber alle verf\u00fcgbaren Vakzine, ihre Wirkung und Anwendung findet sich im AMBOSS-Kapitel COVID-19-Impfstoffe.\nUnd was ist mit den ganz Kleinen?\nF\u00fcr Kinder unter f\u00fcnf Jahren gibt es aktuell keinen zugelassenen Impfstoff \u2013 entsprechende Studien laufen noch. Sicherheitsbedenken sind bislang keine bekannt. Gepr\u00fcft wird ein Zehntel der Erwachsenendosis, also 3 \u03bcg.\n[Wie BioNTech und Pfizer im Dezember mitteilten](https://investors.biontech.de/de/news-releases/news-release-details/pfizer-und-biontech-geben-update-zu-laufenden-covid-19-impfstoff), scheint diese Dosis f\u00fcr Kinder im Alter von sechs Monaten bis zwei Jahren erfolgversprechend zu sein. Bei Kindern zwischen zwei und f\u00fcnf Jahren rief sie hingegen keine ausreichend hohe Immunantwort hervor. Die Hersteller haben das untersuchte Impfschema deshalb um eine dritte Dosis erweitert und k\u00fcndigten an, in der ersten Jahresh\u00e4lfte eine entsprechende Zulassung zu beantragen.\nOb gesund oder vorerkrankt: Derzeit kann eine COVID-Impfung von Kindern unter f\u00fcnf Jahren also nur als Off-Label-Use erfolgen. Die Nachfrage scheint sehr gro\u00df zu sein: Ein\n[ehrenamtliches Projekt](http://u12schutz.de/), das interessierte Eltern an Off-Label-Impfpraxen vermittelt, hat nach eigenen Angaben \u00fcber 50.000 Anfragen erhalten. Eine breite Impfung der F\u00fcnf- bis Elfj\u00e4hrigen kann diesen Familien helfen. So konstatiert das RKI in seinem [Faktenblatt zur Kinder- und Jugendimpfung](https://www.rki.de/DE/Content/Infekt/Impfen/Materialien/Faktenblaetter/COVID-19-Kinder-Jugendliche.pdf): \u201eDie Impfung aller Familienmitglieder reduziert die Verbreitung des Coronavirus und sch\u00fctzt damit Risikogruppen und Kinder unter f\u00fcnf Jahren.\u201c\nWeitere Informationen\nWer sich \u00e4rztlicherseits an U5-Impfungen beteiligen m\u00f6chte, wie sie sich zehntausende Eltern w\u00fcnschen, findet\n[hier](https://u12schutz.de/) weitere Informationen.\nWie SARS-CoV-2 die \u03b2-Zellen des Pankreas infiziert und dadurch Diabetes ausl\u00f6sen k\u00f6nnte, beschreibt dieser\n[AMBOSS-Artikel](/de/covid-diabetes).\nUm Long- und Post-COVID auch bei Kindern besser zu erfassen, hat die DGPI auch f\u00fcr dieses Krankheitsbild\n[ein Register](https://dgpi.de/einheitliche-basisversorgung-von-kindern-und-jugendlichen-mit-long-covid/) eingerichtet.\nQuellen\n- St\u00e4ndige Impfkommission: Beschluss der STIKO zur 16. Aktualisierung der COVID-19-Impfempfehlung Epid Bull 2022;2:3 -15 | DOI 10.25646/9460\n- Walter EB, Talaat KR, Sabharwal C, et al. Evaluation of the BNT162b2 Covid-19 vaccine in children 5 to 11 years of age. N Engl J Med. 2022;386(1):35-46. doi:10.1056/NEJMoa2116298\n- Bundle N, Dave N, Pharris A, et al. COVID-19 trends and severity among symptomatic children aged 0-17 years in ten EU countries, 3 August 2020 \u2013 3 October 2021. bioRxiv. Published online 2021. doi:10.1101/2021.11.25.21266875\n- Sorg AL, Hufnagel M, Doenhardt M, et al. Risk of Hospitalization, severe disease, and mortality due to COVID-19 and PIMS-TS in children with SARS-CoV-2 infection in Germany. bioRxiv. Published online 2021:2021.11.30.21267048. doi:10.1101/2021.11.30.21267048\n- Borch L, Holm M, Knudsen M, Ellermann-Eriksen S, Hagstroem S. Long COVID symptoms and duration in SARS-CoV-2 positive children - a nationwide cohort study. Eur J Pediatr. Published online 2022. doi:10.1007/s00431-021-04345-z\n- Wise J. Long covid: One in seven children may still have symptoms 15 weeks after infection, data show. BMJ. 2021;374:n2157. doi:10.1136/bmj.n2157\n- Stephenson T, Stephenson T, Pereira SP, et al. Long COVID - the physical and mental health of children and non-hospitalised young people 3 months after SARS-CoV-2 infection; a national matched cohort study (The CLoCk) Study. Research Square. Published online 2021. doi:10.21203/rs.3.rs-798316/v1\n- Morand A, Campion JY, Lepine A, et al. Similar patterns of [18F]-FDG brain PET hypometabolism in paediatric and adult patients with long COVID: a paediatric case series. Eur J Nucl Med Mol Imaging. Published online 2021. doi:10.1007/s00259-021-05528-4\n- Barrett CE, Koyama AK, Alvarez P, et al. Risk for newly diagnosed diabetes >30 days after SARS-CoV-2 infection among persons aged <18 years \u2014 United States, march 1, 2020\u2013June 28, 2021. MMWR Morb Mortal Wkly Rep. 2022;71(2). doi:10.15585/mmwr.mm7102e2\n- Levy M, Recher M, Hubert H, et al. Multisystem inflammatory syndrome in children by COVID-19 vaccination status of adolescents in France. JAMA. Published online 2021. doi:10.1001/jama.2021.23262\n- Zambrano LD, Newhams MM, Olson SM, et al. Effectiveness of BNT162b2 (Pfizer-BioNTech) mRNA vaccination against multisystem inflammatory syndrome in children among persons aged 12\u201318 years \u2014 United States, July\u2013December 2021. MMWR Morb Mortal Wkly Rep. 2022;71(2). doi:10.15585/mmwr.mm7102e1\n- Yousaf AR, Cortese MM, Taylor AW, et al. Reported cases of multisystem inflammatory syndrome in children (MIS-C) aged 12\u201320 years in the United States who received COVID-19 vaccine, December 2020 through August 2021. bioRxiv. Published online 2022. doi:10.1101/2022.01.03.22268681\n- Kuodi P, Gorelik Y, Zayyad H, et al. Association between vaccination status and reported incidence of post-acute COVID-19 symptoms in Israel: a cross-sectional study of patients infected between March 2020 and November 2021. bioRxiv. Published online 2022. doi:10.1101/2022.01.05.22268800", "language": null, "image": "https://blog.amboss.com/hubfs/AMBOSS_Kinderimpfung.png#keepProtocol", "pagetype": "article", "links": ["https://www.amboss.com/de", "https://www.amboss.com/de/account/register", "https://www.amboss.com/de/account/login", "https://blog.amboss.com/de", "https://blog.amboss.com/de/tag/artikel", "https://blog.amboss.com/de/tag/artikel", "https://blog.amboss.com/de/tag/ratgeber", "https://blog.amboss.com/de/tag/podcast", "https://blog.amboss.com/de/tag/essay", "https://blog.amboss.com/de/author/britta-verlinden", "https://www.facebook.com/sharer/sharer.php?u=https%3A//blog.amboss.com/de/kinderimpfung", "https://twitter.com/home?status=https%3A//blog.amboss.com/de/kinderimpfung", "https://www.linkedin.com/shareArticle?mini=true&url=https%3A//blog.amboss.com/de/kinderimpfung&title=Auf%20die%20Pl\u00e4tze,%20fertig,%20piks?&summary=Neues%20Jahr,%20neue%20Erkenntnisse:%20Warum%20die%20COVID-Impfung%20von%20Kindern%20nicht%20nur%20sicher%20und%20sinnvoll,%20sondern%20wom\u00f6glich%20...&source=", "https://www.rki.de/DE/Content/Kommissionen/STIKO/Empfehlungen/PM_2021-12-09.html", "https://www.nejm.org/doi/full/10.1056/NEJMoa2116298", "https://www.cdc.gov/vaccines/acip/meetings/downloads/slides-2022-01-05/02-COVID-Su-508.pdf", "https://survstat.rki.de/", "https://dgpi.de/covid-19-survey-update/#alter-in-jahren", "https://www.intensivregister.de/#/aktuelle-lage/zeitreihen", "https://www.rki.de/DE/Content/InfAZ/N/Neuartiges_Coronavirus/Situationsberichte/Wochenbericht/Wochenberichte_Tab.html", "https://www.cdc.gov/vaccines/acip/meetings/downloads/slides-2021-11-2-3/03-COVID-Jefferson-508.pdf", "https://www.medrxiv.org/content/10.1101/2021.11.25.21266875v1", "https://www.medrxiv.org/content/10.1101/2021.11.25.21266875v1", "https://www.medrxiv.org/content/10.1101/2021.11.30.21267048v1", "https://www.medrxiv.org/content/10.1101/2021.11.30.21267048v1", "https://dgpi.de/pims-survey-update/#alter-pims", "https://pubmed.ncbi.nlm.nih.gov/35000003/", "https://www.researchsquare.com/article/rs-798316/v1", "https://link.springer.com/article/10.1007/s00259-021-05528-4", "https://www.rki.de/SharedDocs/FAQ/COVID-Impfen/FAQ_Liste_Impfung_Kinder_Jugendliche.html", "/de/covid-diabetes", "https://www.cdc.gov/mmwr/volumes/71/wr/mm7102e2.htm?s_cid=mm7102e2_w", "https://jamanetwork.com/journals/jama/fullarticle/2787495", "https://www.cdc.gov/mmwr/volumes/71/wr/mm7102e1.htm?s_cid=mm7102e1_w", "https://www.medrxiv.org/content/10.1101/2022.01.03.22268681v1", "https://www.medrxiv.org/content/10.1101/2022.01.05.22268800v1", "https://www.bundesregierung.de/resource/blob/997532/1995094/0e24018c4ce234c5b9e40a83ce1b3892/2022-01-06-zweite-stellungnahme-expertenrat-data.pdf?download=1", "https://www.medrxiv.org/content/10.1101/2021.12.21.21268108v1", "https://inews.co.uk/news/covid-hospital-admissions-rise-children-under-five-numbers-older-groups-1389365", "https://www.aap.org/en/pages/2019-novel-coronavirus-covid-19-infections/children-and-covid-19-state-level-data-report/", "https://www.jpeds.com/article/S0022-3476(21)01273-7/fulltext", "https://dgpi.de/kinder-omikron-variante/", "https://www.awmf.org/leitlinien/detail/ll/027-076.html", "https://www.rki.de/DE/Content/InfAZ/N/Neuartiges_Coronavirus/Daten/Impfquotenmonitoring.html", "https://www.kbv.de/html/1150_56316.php", "https://www.health.ny.gov/press/releases/2022/2022-01-07_pediatric_hospitalizations.htm", "https://cta-redirect.hubspot.com/cta/redirect/4491426/0b4fafb3-df40-4292-9ecc-5ec307676106", "https://investors.biontech.de/de/news-releases/news-release-details/pfizer-und-biontech-geben-update-zu-laufenden-covid-19-impfstoff", "http://u12schutz.de/", "https://www.rki.de/DE/Content/Infekt/Impfen/Materialien/Faktenblaetter/COVID-19-Kinder-Jugendliche.pdf", "https://u12schutz.de/", "/de/covid-diabetes", "https://dgpi.de/einheitliche-basisversorgung-von-kindern-und-jugendlichen-mit-long-covid/", "https://dgpi.de/post-covid-19-survey/", "https://blog.amboss.com/de/antibiotikaresistenzen-neue-antibiotika", "https://blog.amboss.com/de/tag/artikel", "https://blog.amboss.com/de/antibiotikaresistenzen-neue-antibiotika", "https://blog.amboss.com/de/psilocybin-bei-depressionen", "https://blog.amboss.com/de/tag/artikel", "https://blog.amboss.com/de/psilocybin-bei-depressionen", "https://blog.amboss.com/de/blog-amd", "https://blog.amboss.com/de/tag/artikel", "https://blog.amboss.com/de/blog-amd", "https://www.amboss.com/de/account/register", "https://www.amboss.com/de/account/oauth/begin/facebook", "https://www.amboss.com", "https://www.amboss.com/de/wissen/index", "https://www.amboss.com/de/other/agb", "https://www.amboss.com/de/other/disclaimer", "https://www.amboss.com/de/other/datenschutz", "#", "https://www.amboss.com/de/impressum", "https://support.amboss.com/hc/de"]}